start_s,end_s,text
2261,2263,なんかその後、ディスコードで、
2263,2265,本当に見たりしないから安心してって言ったら、
2265,2267,本当に頼むね、みたいな。
2267,2268,ハハハ。
2268,2270,なんかそういう返信、返ってきたんですけど、
2270,2272,なんかその日のツイッター見たら、
2272,2275,なんか、あのー、そのうち誰かに、
2275,2280,その抜き打ちで検索履歴をチェックするっていう企画をやりたいから、
2280,2282,とりあえず自分で最初にやりましたって言ってて、
2282,2285,あれ、なんかあれ?自分はやるんだなぁ。
2285,2287,しみじみね、思いましたけど。
2287,2288,うん。
2288,2290,ね、ということで、
2290,2292,まあ、もしかしたら、
2292,2293,スカイダイビング、
2293,2295,まあ、あれですよね、
2295,2298,水曜どうでしょうの大泉陽さんみたいな感じで、
2298,2301,私でも何も知らないポナー宮企画がね、
2301,2303,いつかできたらいいなぁと思いますね。
2303,2304,うん。
2304,2308,ということで、素敵なアイデアありがとうございました。
2308,2309,では次。
2309,2311,えー、とりあえず枝豆さん。
2311,2313,あ、とりあえずって、
2313,2314,とりあえずか。
2314,2316,あの漢字でね、送っていただいてたんですけど、
2316,2320,とりあえず枝豆さんの抜きたい度肝。
2322,2323,えー、初投稿です。
2323,2324,ありがとうございます。
2324,2327,サプライズを先にネタバレするというのはどうでしょう?
2327,2328,ネタバレしちゃうんだ。
2328,2330,えー、カリフォルニア大学の研究で、
2330,2333,あらかじめ作品の結末を知らされたグループと、
2333,2335,知らされてないグループに分け、
2335,2339,それぞれのグループで作品に対する反応がどう変わるかを調査しました。
2339,2343,その結果、意外にも作品の結末を知らされたグループの方が、
2343,2345,より面白かったと答えたのだそうです。
2345,2346,え、すごい。
2347,2351,人間の脳は自分が処理しやすいものをより好むことが明らかになっており、
2351,2353,あらかじめ結末を知っておくことで、
2353,2356,ルカコさんの思いをより深く理解してくれることでしょう。
2356,2358,えー、ここでネタバレなのですが、
2358,2361,私も9月26日が誕生日ですということでね、
2361,2364,ちょっと過ぎ去ってしまって本当に申し訳ないですが、
2364,2366,おめでとうございました。
2368,2373,これあれですね、2週目の方がゲーム面白いんだな。
2374,2376,ドキドキしたくないっていう層が結構いる。
2376,2378,あ、そうなんだ。
2378,2380,どうだろうな、なんか、
2380,2383,サプライズを最初にネタバレ。
2383,2386,私は今からこういうことをします、
2386,2391,みたいなことを言ってしまってもいいタイプの
2391,2394,ジャンルとダメなジャンルが個人的にはありますね。
2395,2397,この作品ジョジュストリックあるよ。
2397,2399,これだけは本当に許せないね。
2399,2402,ジョジュストリックあるよは本当に許せない。
2402,2407,楽しみを完全に丸ごと根こそぎ奪われてしまう。
2408,2410,結末を知っていると伏線を楽しめたりするかも。
2410,2412,まあそうですけど、
2412,2414,なんだろうな、その
2414,2419,最後の驚きを知ってからもう一回読み返すことで伏線を楽しみたい
2419,2423,っていうよりも、一回で終わらせたいという欲の方が強いのかな。
2423,2429,これだけエンターテイメントフワグラ時代ですからね、今。
2431,2433,ちょっとお水を見ます。
2435,2437,うーん。
2438,2442,これツイッターで見たシーンだってテンション上がることがある。
2442,2444,いわゆるそのパロディ的な?
2446,2452,なんか、あ、これこういう流れの、こういう文脈の笑いかみたいなことを知ってから
2452,2456,繰り返し見て面白いみたいなことは確かにわかるけど。
2458,2461,そうですね、ケースバイケースなのかもしれない。
2461,2468,私あの、先週やった誕生日記念配信、内容を何にも言わずに始めたんですけど
2468,2475,あれも最初から謎解きやります!みたいな感じで出した方が面白かったのかな。
2476,2479,これはちょっとでも興味深いですね。
2481,2486,例えばその、もう言っちゃうと、どういう配信だったかっていうと
2486,2498,いわゆる自分のチャンネルでPCを2台使って記念配信をパブリックで公開して
2498,2505,配信中に同時に限定公開で配信してて、別のPCで。
2506,2510,なんかね、一応その同じチャンネルで同時に別の端末でやれば
2510,2516,いくつも多分配信ができるんですよね。YouTubeの機能って。
2516,2520,一応ね、あの、わかってたら環境を整えてみてって言ってくださる方いるんですけど
2520,2523,一応PC推奨とは言ってたんですよ。
2523,2534,で、あの、なんか、それで、その本配信で一応その限定配信、限定公開配信のURLを導き出して
2534,2539,限定公開配信に行ってもらってそこで謎が出るみたいな仕組みだったんですね。
2539,2544,それは最初からある程度言っといた方が良かったのかもしれないな。
2544,2545,うん。
2547,2551,ということでね、非常に学び終えたので、次謎解き配信みたいなのするときは
2551,2554,謎解き配信って言っとこうと思います。
2555,2562,なんかでも、どのどの作る側からすると、やっぱり、あの、徐々にこう
2562,2568,まあ、私126回分くらい自分のチャンネルで配信してたらしいんですけど
2568,2574,なんかそのタイトルを一応全部一文字に変更するっていうフェーズが挟まってたんですね。
2574,2580,で、その当日の午後3時くらいから変えたんですけど
2580,2585,そういうなんか徐々に変わってって、なんか匂わせ的な感じの
2585,2589,あの、風にしようかなと思ってたんですけど
2589,2594,結構何かガチでね、チャンネルが乗っ取られてますよって心配してくださった方がいたんで
2594,2598,それはあんま良くなかったかもなってちょっと反省しました。
2599,2602,ガチで心配させてしまってたわと思って。
2602,2606,一応、野菜子さんにはね、あの、事前に言ってたんですけど
2606,2608,リスナーさんにはお伝えしてなかったんで
2608,2613,そりゃ確かにいきなりなんか普段見てるチャンネルの動画のタイトルが
2613,2618,英数字一文字になってたらそりゃ乗っ取られたと思うかもなと思ってね。
2618,2620,その辺配慮足りなかったですね。
2620,2622,YouTubeのバグかと思った。
2622,2625,確かに普段謎解きよく解いてらっしゃる方とかは
2625,2628,謎解きだって思ってくださったかもしれないんですけどね。
2628,2632,まぁちょっとその辺、今回ご指摘いただいた感じでね
2632,2635,謎解きだっていうことはとりあえず言おうかな、次からは。
2635,2638,学び終えました。ありがとうございます。
2639,2640,では次。
2642,2646,飛ばない方の鳥さんからお便りありがとうございます。
2647,2648,るかこさんこんばんは。
2648,2649,こんばんは。
2649,2652,例文にあった、これあれですね。
2652,2658,フォームの中にあった、多分私のテキストがそうやって書いてあったと思うんですけど
2658,2661,例文にあったプロポーズで度肝を抜くということで
2661,2666,私が憧れているのは男女カップルの女性側からプロポーズすることです。
2666,2669,指輪の箱をカパッて開けるあれを人生一度はやってみたいです。
2669,2672,レストランとかを予約するってなると勘付かれそうだから
2672,2677,バレンタインの食家と思ったら指輪でしたーっていうのが一番バレないかなと思っています。
2677,2679,これ見逃しにカッパカッパしたい。
2679,2685,予約就職が決まって来年から働けるので頑張ってお金貯めて指輪をカパッとしたいです。
2685,2687,素敵なお便りきました。
2689,2692,配信に吹く一陣の清涼な風がね。
2695,2700,いいです。今までの乳首ミルワームハムスター長狂が一気に
2701,2702,一気になかった。
2702,2705,なかったことはならないですよ。素敵なお便りだったんですけど。
2705,2708,一気に爽やかな雰囲気になってきました。
2710,2711,これいいなー。
2713,2716,確かに海外の動画だったかなと思うんですけど
2717,2722,女性同士のカップルの方が付き合ってらっしゃって
2722,2724,何年間の記念日の日に
2725,2731,お互いサプライズで指輪をプレゼントしようと思って
2731,2736,お一人が指輪をカパッと見せた時に
2737,2740,お相手の方も指輪を用意していて
2741,2745,一緒にえぇーみたいな。周りもめちゃくちゃ拍手で
2746,2748,非常にハードフルな動画を見たことがあります。
2749,2753,世界。こういう世界もあるんだ。実際にね。
2754,2757,嘘じゃないんだ。世界なーって思いましたね。
2757,2760,皆さんもどうなんだろうなー。
2761,2763,これはね、フラッシュモブじゃないですよ。全然。
2764,2766,周りの方はたまたま言い合わせてそれを見てて
2767,2769,拍手してみたいな感じだったはず。
2770,2774,その動画、確かYouTubeかなんか見た気がするんでね。
2775,2778,行きあったら皆さんがたまたまYouTubeサーフィンしてて
2779,2782,目に入ることをね、願っています。
2782,2786,非常に素敵な動画だったんで。タイトル何にも覚えてません。
2787,2792,ではね、飛ばないほうの鳥さんがいつかカパカパできるように
2793,2796,私もね、かげながら応援しております。
2797,2799,お互いフラッシュモブ用意してて
2800,2801,フラッシュモブ対決になったパターン。
2802,2804,それむちゃくちゃ熱いっすね。
2805,2807,私はね、フラッシュモブはね、どうだろうな。
2807,2811,されたらマジで虚無の顔しちゃうと思うんですけど
2812,2814,それ自体はね、非常に素敵だなと思いますので
2815,2817,そこでバトルが始まってほしいですね。
2818,2821,なんかエキストラの方がね、お互いにこう、なんだろう。
2822,2825,つばぜり合いというか、こっちのフラッシュモブこそ正義みたいな感じで
2826,2827,戦ってほしいですね。
2828,2830,赤髪原フラッシュモブ。
2830,2836,というわけで、次のお手入れ読ませていただきたいと思います。
2837,2838,よいしょ。
2839,2842,下たるクラゲさんからの抜き態度疑問。
2843,2844,るかこさんこんばんは。
2845,2847,いつも楽しく配聴させていただいております。
2848,2849,ありがとうございます。
2850,2852,私が一度やってみたいサプライズ法をご紹介させてください。
2853,2856,それは細菌を使ってサプライズメッセージを伝えるというものです。
2857,2858,生物科学などの分野では、
2858,2863,研究材料として大腸菌やカビを寒天培地の上で培養することが一般的です。
2864,2866,この時、文字や記号の形に菌を巻くと、
2867,2869,翌日にはその通りの形でコロニーが形成されるのです。
2870,2872,ある朝、研究室の培養器の中を覗いたら、
2873,2875,細菌で書かれたハッピーバースデーの文字、
2876,2877,なんかほっこりしそうじゃありませんか?
2878,2879,るかこさんもぜひご検討ください。
2880,2881,いいですね。
2882,2886,私はいつか年金をね、年金をね、
2886,2888,年金を見たいんですよね。
2889,2891,年金が迷路を解くのね。
2893,2896,確かこれ、年金が迷路が解けるっていうのを知ったのは、
2897,2900,たぶんアルジャーノンに花束をだった気がするんですけど、
2901,2904,あのー、年金っていう生き物を、
2905,2908,あのー、最短で迷路を解くことができるらしいんですよね。
2909,2910,これはめちゃくちゃすごいですよ。
2911,2913,私より賢いかもしれない迷路に関しては。
2913,2915,最近も非常にいいですよね。
2917,2920,この、え、なんか匂いがする?
2921,2924,どうなんだろう?大丈夫かな?匂うのか?
2925,2927,大腸菌ってどんな匂いなんだろう?
2928,2930,大腸菌、匂い。
2931,2932,ちょっとくださいね。
2933,2934,私の検索履歴とんでもないことになりそうだな。
2935,2937,大腸菌、匂い。
2939,2941,あ、大腸菌って、
2941,2943,賢く匂いを嗅ぐんだな。
2946,2948,え、面白い。
2949,2952,大腸菌の匂い探知システムが物理的情報理論的に最適。
2953,2956,え、そうなんだ。これめちゃくちゃ面白いですね。
2957,2959,あ、イグノーベル賞受賞してる?
2960,2962,え、そうなんだ。いいですね。
2963,2965,なんか、あのイグノーベル賞っていう、
2966,2968,いわゆるその、まあ、ノーベル賞的な意味で、
2968,2972,非常にね、イグノーベル賞的に非常に優秀な研究に賞を贈るっていうのが、
2973,2975,あれ年に一回やってるんですかね?
2976,2977,ちょっとわかんないんですけど、
2978,2980,日本人の方すごい受賞されてるんですよね。
2981,2983,例えばね、イグノーベル賞の例だと、
2984,2986,えーと、なんだっけな、
2987,2989,確かタマゴッチとか受賞してたんじゃなかったかな。
2990,2993,あとなんか、犬の言葉がわかる、バウリンガルだったかな。
2993,2997,みたいな、なんかそういうね、あの、ちょっと面白い。
2998,3003,面白くて、こう、どうなんだろう、最先端科学はノーベル賞で、
3004,3008,めっちゃ面白い研究とか、こう特殊な研究とかにね、
3009,3012,あの、なんかそういうものが受賞する賞なんですね。
3014,3018,え、牛の糞からバニラの匂い成分が取れてる?
3018,3022,すごいんだけど、そうなんだ。なんで?
3023,3029,なんか、牛って胃が4つあって、めちゃくちゃ腸内細菌層が発達してるんですよね。
3030,3036,だからその、草っていう、すごいあんまカロリー、栄養素なさそうなものから、
3037,3040,あれだけのその、巨体をね、維持できる分の栄養を、
3041,3045,あの、その、牛の糞に、取れるっていうのが、
3045,3049,巨体をね、維持できる分の栄養を、吸い取れるみたいな。
3050,3053,あれの残りがあってバニラなんだ。
3054,3056,すごいな。面白。
3058,3061,バニラってあの、バニラビーンズから取りますよね。
3062,3065,バニラビーンズって私あの、結構見た目が、
3066,3068,あ、なんの話だっけ?
3068,3075,なんかあの、バニラビーンズってなんか、細長く切った昆布みたいなやつを割くと、
3076,3081,中になんか粒みたいなのが入ってて、なんかそれがどうも、バニラの匂いがするらしいんですよね。
3082,3085,そう。だからそれ面白いなーって思って見てました。
3086,3090,なんか、なんの話だったっけ?忘れちゃった。
3093,3096,戻りますか、そろそろね。戻ろ。
3096,3097,戻ろ。
3098,3102,はい、ということで、あ、あ、イグノーベル賞、猫が液体説もそうでしたっけ?
3103,3105,猫が液体説でいうと、
3106,3113,あの最近ね、読んだ漫画がすごい、猫好きの方にめちゃくちゃおすすめしたい漫画があって、
3114,3122,えーっとね、タイトルが、えーっと、夜、夜は猫と一緒かな。
3122,3126,夜は猫と一緒っていう漫画なんですけど、これ単行本で出てて、
3127,3131,作者の方がTwitterでもともと確か連載されていたのかな、
3132,3135,投稿されていた作品なのでTwitterでも読むことできると思うんですけど、
3136,3144,このね、あの、夜は猫と一緒のね、あのキュルガちゃんっていう猫の日常を描いてらっしゃるんですけど、
3145,3150,これがね、マジですごい液体、
3150,3155,キュルガちゃんね、あの、なんか私猫実家で前一緒に暮らしてたんですけど、
3156,3164,本当に猫ってこういう動きするんだよなっていうのが、こんなになんかそのまんま絵でこんな可愛い絵で描けるもんなんだっていうね、
3165,3167,えーすごいびっくりしました、うん。
3168,3170,よかったら読んでみてください、夜は猫と一緒。
3171,3173,キュルガちゃんで検索したら出てくるかも、うん。
3174,3175,マジで液体。
3175,3179,えーということでね、ラジオに戻ってきたいと思います。
3180,3181,では次。
3183,3187,えー、マグカルコさんの抜きたい度肝。
3188,3190,自分で自分の度肝を抜いた話です。
3191,3197,小学生の頃の僕は、太陽の熱で水がどれくらい暖かくなるのだろう、暖かくなるのだろうと気になって、
3198,3202,理科室の試験管に水をいっぱい貯めて1日置いてみることを考えたんです。
3202,3205,理科室の試験管に水をいっぱい貯めて1日置いてみることにしました。
3206,3210,次の日水を確認してみると、残念なことに掃除係の人に捨てられてしまっていました。
3211,3217,えー今度は捨てられてなるものかと思った僕は、水を入れた試験管を理科室のカーテンの裏に隠しました。
3218,3225,その日、夏休みが終わり、えー夏休みじゃない昼休みが終わり、5時間目が始まって20分ほどしたあたりで、
3226,3228,ジリリリリリリと非常ベルが鳴りました。
3228,3234,もうお分かりかと思いますが、試験管に入れた水のレンズ効果によりカーテンが発火。
3235,3236,理科室は火事になっていたのです。
3237,3239,えー、てんまずに気づいてしまった時のやっちまった感と、
3240,3246,なるほど、暖かくなる前に燃えるのか、という妙に納得を含んだ驚きの感情は今でも覚えています。
3247,3249,以上、自分でやっといて自分でとても驚いてしまったお話でした。
3250,3251,ってことだね、うん。
3252,3253,これマジでビビるでしょうね。
3253,3258,あー、どうなんだろうこれ、言ったのかな、僕のせいですって。
3259,3260,私言えないかもしれない。
3261,3262,小学生だったら。
3266,3269,ジョージ・ワシントンじゃないと言えなくない?これ。
3270,3272,ね、ということでね、ふーんやるじゃん。
3273,3274,火事ワンペア、あ、確かにね。
3276,3278,いやもう心配になるワンペアですけどね。
3278,3283,まあでも火災放置機になってね、怪我人とかがいなかったなら何よりですけど。
3284,3285,うん。
3286,3289,これあれですね、なんかミステリーのトリックみたい。
3290,3293,確かに名探偵コナンって1回くらい会ったんじゃないかな。
3294,3297,うん、ということで、えー、こちらね、マグガルゴさん。
3298,3304,まあでも当時無事で何よりだし、それをあのラジオで書いてくださるのがね。
3304,3309,いや、そういうエピソード、あの非常に興味深いエピソード、ありがとうございました。
3310,3317,私もあの、部屋にね花とか飾ってるんで、あの花瓶をね、このように置かないように気をつけたいと思います。
3318,3319,学び終えました。うん。
3320,3322,えー、ではね、えー次。
3323,3325,ワシントンでも口継ぐムレベル、確かにね。
3327,3330,いや、むちゃくちゃ怒られるよこれ。
3330,3337,なかなか許してくれるかな。探求、いや悪気はなかったんです。探求士からこうなってしまったんですって言って。
3338,3340,許してもらえるかな。どうだろうね。
3341,3348,ということで、えー世の中が世の小学生に寛容であることを願いつつね、えー次のコーナーに行きたいと思います。
3349,3351,はい、えー、チームは国家なり。
3352,3357,えーと来週のゲストさんが来る関係でチームは国家なりはね、最後になります。はい。
3357,3360,ちょっと汚さんくさいミュージック流していきますね。
3363,3372,チームは国家なりは、自分がそのー、まあいわゆる法律もなんでも自由な、あのー、一国の王になったら、
3373,3379,まあ、どうしますかっていう、どんな法律作りますかっていうね、えーコーナーになっております。
3379,3383,はーい、では早速1通目読んでいきますね。
3385,3387,えーガスマッチョさんのチームは国家なり。
3388,3393,些細なことかもしれませんが、通勤時間に賃金が発生する法律を定めます。
3394,3399,仕事のために連、え、めちゃくちゃ噛んだのでお茶飲みます。はい。
3402,3403,うん。
3403,3408,うまい。
3409,3414,仕事のために通勤しているわけですが、その時間は働いていないというにはあまりにも自由がありません。
3415,3421,人によっては1時間以上満員電車に揺られる方もいる、いるわけで、もはや通勤は労働といっても過言ではありません。
3422,3428,この法律によって、朝礼があるから始業5分前には席についててね、みたいな場合にも必ず給料が発生するようになります。
3428,3432,ということでね。うん。
3433,3439,これはどうですか?あのー、雇用されている側にとってみれば、最高ですよね。
3440,3446,ただね、これなかなか難しいなって思うのが、雇用する側になってみるとどうですか?
3447,3452,例えばなんか会社作るってなって、社長になるじゃないですか。で、
3452,3461,まあ、役員でもいいですけど、になった時に、これむちゃくちゃ家遠い人出てきますよ。
3462,3468,最初なんか30分で、あのー、おまわり30分のところに住みますってなって、
3469,3473,で、あ、じゃあどうぞ採用しますねーってなって、で、その人がじゃあ、
3473,3482,あのー、その通勤時間もお家お給料出るんでってなったら、私だったら片道3、4時間のところに引っ越すけどね。
3483,3489,はぁ。引っ越す。絶対引っ越す。だってその、だって通勤してる間、ネットフリックスとか見放題なわけでしょ。
3490,3496,その時間もお給料出るってなったら、普通に5時間。いや、5時間はきついか。朝、
3496,3503,例えば朝9時に行くってなったら結構しんどいな。うん。まあそれでもね、なんか最近見込み残業とかありますから、
3504,3512,うーん、まあそれはあり、ありありって感じなんですけど、まあでもね、雇用される側にしてみたら、その方がいいな。
3513,3524,ただ、これによって例えばその会社の経営が破綻して、なんか、それで働き口がなくなるという懸念はしないかなって思います。
3524,3530,働き口がなくなるという懸念もあるし、なあ、っていうところがね、非常に難しい。うん。
3531,3536,テレポーテーション装置の研究が急がれる?うん、だったらもう全部家がいいですね。
3537,3542,家で働き、まあでも家で働く、どうですか?皆さんリモートワーク多いですかね?
3543,3550,リモートワーク飽きたっていう声も割と聞いたりはするんですけど、私あの一生リモートワークなんで今。うん。
3550,3558,いから通勤時間の?まあ確かにね、見込み通勤代?うん。
3558,3579,なんか、まあそれで言うとね、リモートワーク大変なのかな?集中力が持たないとかね、実際自分は通勤した方がいいですみたいなね、方もいるんだったらもうどっちも選択性にしてくれないですかね?この世、永久に。
3579,3587,まあその働き方、ね、もっといろんな多岐にわたる働き方が認められる世の中になるといいですね。
3588,3595,大企業に限らず、どんなサイズ感の会社でも。なんか真面目な話しちゃった。
