start_s,end_s,text
0,8,まずは
8,18,MIDIの関節オーバーメイドで
18,8,今回はこう一番時には
20,21,修正がね
21,23,おっ
23,25,ん
25,27,ん
27,29,ん
29,31,ん
31,33,ん
33,35,ん
35,37,ん
37,39,ん
39,41,ん
41,43,ん
43,45,ん
45,47,ん
47,49,ん
49,57,しうん
57,59,ん
59,63,bj ん
63,68,vi
68,75,今日、1万円のチョコ食べました。
75,98,それでは、今夜も始めて参りたいと思います。
98,111,1万円のチョコに動揺しすぎてめちゃくちゃ噛んじゃったけど。
111,114,いや、なんで食べたかっていうと、
114,116,ジングルありがとうございます。
116,118,何かあったら教えてください。
118,123,あのですね、うちの母からね、
123,125,この間私誕生日ありまして、
125,128,社員マスカット届いたんですけど、
128,130,それと一緒にね、
130,134,高級チョコレートが入ってまして、
134,136,誰もが知ってる、
136,139,すごい有名ブランドのチョコらしいんですけど、
139,143,ちょっとね、ブランド名を言うと、
143,145,今、もしかしたら販売してないかも。
145,147,特別チョコらしくて、
147,150,うちの母の会社が割れるかもしれないんで、
150,152,ちょっと名言できないんですけど。
152,156,のぎも抜かれた?よかったよかった。
156,160,20粒くらい入って1万円ですね。
160,163,今日食べました。
163,168,なんか、これが1万円のチョコかと思って開けて、
168,170,で、食べて、
170,176,これが1万円のチョコかっていう。
176,179,なんかね、あれなんですよね、
179,181,それを例えば、
181,185,この味で1万円の価値があるなっていうよりは、
185,189,1万円を払うためのチョコみたいな。
189,190,美味しいんですよ、もちろんね。
190,192,めちゃくちゃ美味しいんですけど、
192,194,なんだろうな、
194,198,贈呈品前提みたいな。
198,200,だから、1粒500円なんですけどね。
200,203,そうだから、私としてはですよ、
203,205,牛丼の方が美味いですよね。
205,209,500円で食べられるもので比べるとね。
209,214,そうだから、自分で買って自分で食べるっていうものではないなーって
214,215,しみじみ思いましたね。
215,220,なんか、千引き屋のむちゃくちゃ高いフルーツがあるじゃないですか。
220,225,とかね、なんだっけ、パーラーがある。
225,230,えっと、たか、たかのか、たかのとかの。
230,232,1000円、2粒ありがとうございます。
232,236,このチョコ2粒でね、私今日6粒食べてるんでとんでもないですよ。
236,240,今胃の中の価値が。
240,244,そう、でね、あのー、なんかね、
244,248,食レポ向かないですか?向かないかもしんないですね。
248,250,なんかもう本当信じらんないぐらい、
250,253,社員マスカットもそうですけど、
253,256,ああいうフルーツってすごい高いんですよね。
256,260,やっぱりね、ああいうキリの箱とかに入ってる
260,264,なんか、そういうフルーツ、果物って
264,266,なんかもらうものだよな。
266,268,あげるものだしもらうものだよな、みたいな。
268,271,自分で買って食べないよな、みたいなね。
271,277,そう、だから、あ、あの方すごいこんな高級なチョコレート私にくださったんだ、みたいな。
277,285,そう、あ、すごい千引き屋のフルーツの詰め合わせくださったんだ、みたいなことのために存在する1枚のチョコみたいな。
285,287,そういう感想いただきました。
287,289,うん。ね。
289,292,はい、ということでね、まあすごい美味しかったです。
292,295,あの、コーヒーも、今日なんかどうやらコーヒーの日だったらしくて、
295,299,ファンアート書いてくださったそのイラストで気づいたんですけど、
299,301,そう、メガネの日だということは知ってたんですね。
301,303,そう、メガネの日ということは知ってたけど、
303,306,今日、合わせてコーヒーの日ということでね、
306,308,ま、くしくも、あの、私も、
308,311,えーと、ブラジルサントスナンバー2っていうチョコ、
311,314,チョコじゃないや、コーヒー入れてチョコ食べました。
314,316,うん、美味しかったです。
316,318,ふふふ。
318,320,複雑な味わいですね。
320,322,ま、どうだろうな。
322,325,ちょっとこんなこと、こんなこと言っちゃうとあれですけど、
325,327,私はダースの方が好きですね。
327,329,はははは。
329,331,はははは。
331,333,ごめん、母よ。
333,338,母はでも人生経験として食べてみたらということで送ってくれたんだと思うのでね。
338,341,うん。人生経験になりました。
341,343,はい。ね、そう、ダース美味しいよね。
343,345,うん。やっぱね、こうなんだろうな、
345,348,もうチョコならチョコがいいんだよな。
348,350,なんか、こう複雑なさ、そういうなんか、
350,353,なんか、ベリーのフレーバーでみたいなのいらないんだよな。
353,357,あとなんか、高級のチョ、高級のチョコでよくある、
357,360,中にあの、ジャムみたいなジュリみたいなの入ってるやつちょっと苦手だし。
360,362,うん。
362,364,ピエロマルコリーニが美味い。
364,366,あれなんだよな、なんか、あのー、
366,368,毎年ね、1月ぐらいかな、に、
368,371,あの、チョコレートの祭典があって、
371,374,これ確か東京でやってると思うんですけど、
374,376,あの、サロン・デュ・ショコラ。
376,378,サロン・デュ・ショコラだった?
378,380,メゾン・デュ・ショコラだったっけ?
380,382,まあ、みたいなそういうイベントがあって、
382,385,そこではね、ほんと、あのー、
385,387,ほんと一粒500円レベルの、
387,389,あの、高級チョコレートがね、
389,391,あの、とんでもなく、こう、
391,393,やり取りされているという、
393,395,チョコレートファンタジーがね、
395,397,みんな集って買い込むらしいですね。
397,399,うん。
399,403,なんかね、そう、ジャンポール・エヴァンとかが出る。
403,406,マルコリーニもそうだし、サダハル・アオキとかね。
406,409,みたいなそう、スーパー高級チョコレートたちが、
409,411,一堂に会せるんですよ。
411,413,ふふふふ。
413,416,ね。だからまあ、私はね、やっぱあの、
416,418,高級チョコレートの味を、
418,420,が理解できないということが、
420,422,まあ、今回の件でよくわかったんで、
422,423,そう。
423,425,あ、推しパティシエがいるんだ。
425,427,おしゃれだな。
427,429,いやでもね、なんかそういうその、
429,431,オタクたちが集うイベント、
431,433,ちょっとそうじて好きなんでね。
433,434,うん。
434,436,まあ私は、ちょっとあの、
436,438,サロン・デュ・ショコラにうががうことはね、
438,440,まあ、ないかもしれないんですけど、
440,442,そういうその好きな方の話を聞くのは、
442,444,めちゃくちゃ好きなんで。
444,446,ね、おしゃれ。
446,447,ロイズ?
447,449,ロイズって確かあの、
449,452,ポテトチップスにチョコレートかけたやつ出してましたっけ?
452,453,あれ食べたことある。
453,454,おいしい。
454,457,北海道の食べ物って何であんなおいしいんですかね。
457,459,私あれ好きですよ。
459,461,あのー、ルタオの。
461,462,ルタオの、
462,464,ドゥーブル・フロマージュ。
464,465,うん。
465,467,ドゥーブル・フロマージュ、
467,468,マジでね、
468,471,あの、ほんと一人ワンホール余裕ですからね。
471,472,そう。
472,474,サロン・デュ・牛丼があればいいのに。
474,476,サロン・デュ・牛丼あればいいのにね。
476,477,ないのかな。
477,478,まあでも、
478,481,私たまに家で一人サロン・デュ・牛丼みたいにしますよ。
481,483,あの、松屋とスキ屋と、
483,486,あの、吉野家の牛丼買ってきて食べ比べるみたいな。
486,487,うん。
487,489,あの、サロン・デュ・ハンバーガーもたまにやる。
489,491,あの、モスバーガーと、
491,495,マクドナルドとバーキンのハンバーガー買ってきて戦わせるみたいな。
495,496,うん。
496,498,それ、楽しんでね、
498,499,ぜひやってください。
499,500,サロン・デュ・牛丼。
500,501,ふふふ。
503,504,あれ私、
504,506,ジングル鳴らしましたよね、確か。
506,508,ははははは。
508,510,あの、実はですね、
510,511,明日、
511,512,明日っていうか、
512,513,今日、
513,514,今日なんですけど、
514,515,あのー、
515,517,TIFFっていうイベントがあって、
517,519,東京アイドルフェスティバル。
519,521,で、あの、
521,522,これがね、
522,523,本番なんですよ。
523,525,もう日付があって今日なんですけど、
525,526,だから、
526,529,今日あの、1時間で終わろうっていう、
529,531,そういう手筈です。
531,533,はい、よろしくお願いします。
534,535,ということでね、
535,536,ま、早速、
536,537,もうちょっと10分以内にね、
537,539,えー、お便りに入っていきたいと思います。
541,542,いや、そう、本番前日にね、
542,543,ま、や、
543,545,やろうかやる前かすごい悩んだんですけど、
545,546,ははは。
546,547,いけるかなと思って。
547,549,はははは。
551,553,モスのコーヒーシェイクにはまってしまった。
553,554,で、
554,555,あの、私この間、
555,556,あの、
556,558,えがしら2時50分さんの、
558,561,YouTubeのチャンネル初めて見たの。
562,563,で、
563,565,なんか何を初めて見たかっていうと、
565,566,あの、モスバーガーのね、
566,567,あの、モスバーガー、
567,568,初めての、
568,571,えがちゃん初めてのモスバーガーっていう、
571,572,あのー、
572,573,そういう配信、
573,574,配信じゃないか、
574,575,動画が上がってて、
575,576,それを見たらね、
576,577,あの、
577,578,えがしらさん、
578,579,すごい、
579,582,あの、素直で素敵な方だなと思って、
582,583,で、
583,584,あのー、
584,585,その時に、
585,586,あの、モスのね、
586,588,コーヒーシェイクがむちゃくちゃ美味しかったっていう。
588,590,で、しかもそのモスの、
590,593,ね、お客様担当の方からね、
593,595,あの、折り返しがあって、
595,597,モスのコーヒーシェイクの、
597,599,なんかチケットがもらえたみたいな、
599,601,動画も上げてらっしゃったから、
601,603,あ、私モスのことすごい好きだけど、
603,605,シェイク飲んだことないと思って、
605,606,うん。
607,608,買っちゃったこの間、
608,609,モスで、
609,610,コーヒーシェイク。
610,611,ふふふふ。
612,614,むっちゃ美味かった。
614,616,正直めちゃくちゃ美味かった。
616,619,でも本当頼んでみて良かったですね、
619,620,うん。
620,621,でね、
621,622,あの、えがしらさんのね、
622,625,マクドナルド食べる動画も面白かったですね。
625,628,あのー、なんかレタスに関してすごい、
628,629,あの、なんだっけな、
629,630,ダブチか。
630,632,ダブチをね、もうほんと、
632,635,あの、親の敵のごとくディスっててね、
635,637,そう、清々しかったですね。
637,638,うん。
638,639,ふふふふ。
639,640,面白かった。
640,641,うん。
642,643,でも私モス、
643,645,モスはね、ほんとモスチーズバーガー、
645,646,ソイパティ派なんで、
646,647,うん。
648,651,え、エビカツも美味しいよなー。
651,652,なんかねー、
652,656,私ずっとモスチーズバーガー一強タイプだったんですけど、
656,659,なんかリプライでね、エビカツが美味しいって言われて、
659,662,エビカツ頼んだらめちゃくちゃ美味くて、
662,664,で、なんかねー、
664,665,あの、ホワワットさんに、
666,667,VR版のね、
667,668,ホワワットさんに、あのー、
668,670,ロースカツも美味い、
670,673,聞いて、ロースカツ食べたらめちゃくちゃ美味くて、
673,675,すごい困ってる。
675,676,全部食べたくて。
676,677,うん。
677,678,で、あの動画、
678,680,えがしら250分さんの動画では、
680,682,あのー、モスライスバーガーは、
682,685,いまいちみたいな感じで言われてたんですけど、
685,687,私はね、モスライスバーガーは焼肉じゃなくて、
687,689,海鮮かき揚げの方が美味いと思うので、
689,691,もしね、また機会があったら、
691,694,モスライスバーガー、海鮮かき揚げを食べてほしいと思います。
694,695,ということで、
695,697,えー、ふつおたに入っていきましょう。
699,701,えー、冷凍バナナさんの、
701,702,えー、ふつおた、
702,704,普通のお便りですね。
705,706,えー、
706,707,風呂上がりに、
707,710,マッパでハムスターを体に乗せて散歩させていたら、
710,712,腹の段々を上ってきて、
712,715,乳首を噛まれました。痛かったです。
715,716,えー、今度は舐めるように、
716,717,ゲーを仕込みたいですが、
717,720,あの脳の容量で覚えてくれるでしょうか?
720,721,というお便りですね。
721,722,はい。
722,725,風呂上がりでマッパでハムスターに体を乗せて散歩させていたら、
725,726,腹の段々を上ってきて、
726,728,乳首を噛まれた。
728,729,で、舐めるように、
729,730,えー、
730,731,したいということで、
731,734,お悩みいただいたんですけれども、
735,736,これはですね、
736,737,あのー、
737,740,乳首にラクレットチーズをかけたらいいんじゃないですかね。
740,742,やっぱハムスターも、
742,744,ネズミの一種なので、
744,748,なんかおいしいチーズみたいなものがかかってたら、
748,750,食べに来るんじゃないかなって、
750,751,思いました。
751,752,うん。
752,753,どうなんだろう、
753,755,ハムスターってチーズ食べんのか。
755,757,ハムスターのエサで、
757,759,ちょっと検索してみましょう。
759,761,ハムスター、
761,762,エサ。
762,763,ハムスター、
763,764,エサ。
765,768,あ、なんかでもちょっと固いかもしれないですね。
768,770,あ、なんかでもちょっと固いかもなー。
770,771,なんかドライフードですね。
771,774,ペレットを中心に野菜や果物、
774,776,干し草や穀物、
776,779,えー、ミルワーム、コオロギ、稲穂、トンボ。
779,780,あ、
780,783,いいんじゃないですか、ミルワームとかね。
784,785,なんかミルワーム、
785,786,つけといたら、
786,787,いいかもしんないですね。
787,789,やっぱりね、あのー、
789,792,こう、虫ってタンパク質をすごい取りやすいんで、
792,794,取りやすいって聞いたことあるんで、
794,795,なんかその、
795,797,ずーっとペレット食べさせてるよりも、
797,798,果物とか、
798,800,なんかおやつ感覚でね、ミルワーム、
800,803,あの、食べさせた方がいいみたいな、
803,805,ハリネズミの飼育方法かなんかね、見たんでね。
805,806,うん。
807,808,えー、
808,809,よかったらね、
809,812,今後はちょっとチクビにミルワームをくっつけて、
812,813,えー、
813,815,登らせてみてはいかがでしょうか。
815,816,えー、素敵なお便り、
816,817,冷凍バナナさん、
817,819,ありがとうございます。
819,821,えー、では次。
821,823,ミルワームおいしいのだ。へけ。
823,824,ね。
824,825,いいですよね。
825,829,何、何匹飼ってらっしゃるんですかね。
829,831,2匹いたらね、いいですけどね。
831,833,両チクビにミルワーム、
833,834,ふくりつけとけばね。
834,835,うん。
835,837,んー、では次。
837,840,ちょっとあの、最初からちょっと刺激的なやつ読んでしまったので、
840,842,爽やかなお便りをね、読みたいと思います。
842,843,えー、
843,845,さちこさん、お便りありがとうございます。
845,846,りょがこさん、こんばんは。
846,848,こんばんは、初投稿です。
848,851,えー、いつも楽しい配信をありがとうございます。
851,852,いや、こちらこそありがとうございます。
852,853,朝が早いので、
853,857,アーカイブを在宅勤務中に聞かせていただいております。
857,858,これを、
858,860,昼に聞いていただいてるんですね。
860,861,すみません、なんか。
861,864,えー、近況報告と相談をさせてください。
864,867,先日友人にこれまで全く縁のなかったTRPGに誘っていただき、
867,870,人生初のキャラクター作りに挑戦しております。
870,873,ダブルクロスというタイトルのバトルモノです。
873,874,ダブルクロス。
874,877,えー、学生時代から異能力系の少年漫画を大量に読み、
877,881,ランキングサイトで二次創作を寝るまもおしんであさり尽くし、
881,885,オリジナルのザンパクトや連携術やイノセンスを大量に抱えていた私にとって、
885,889,当時のワクワクを再体験できる非常に有意義な時間になる
889,890,はずだったのですが、
890,892,ロムセンだった私にとっては、
892,895,キャラシートを使いながら設定を練るのがとてつもなく難しいんです。
895,898,というか、正直めちゃくちゃ恥ずかしいです。
898,900,友人たちの目の前で脳みそをまる裸にして、
900,903,己の壁という壁をすべてさらけ出さなければいけない。
903,905,上に、え、演じるだって?
905,907,エルカゴさん、リスナーの皆さん、
907,911,超超初心者が恥を捨てて全力で楽しめる方法を教えてください。
911,912,うん。
912,913,ということでね、
913,915,こちらはですね、
915,918,配信するか、もしくは、
918,923,リプレイ動画を上げるという前提でやったらいいと思います。
923,928,友人同士でやるっていうところが恥ずかしいポイントだと思うんですよね。
928,932,全然知らない人とプレイするって言うんだったら、
932,935,まだ自分をさらけ出しやすいというか、
935,940,今後のね、今までの自分のキャラクター性というか、
940,944,自分自身がやっぱり捨てきれないところがあると思うんですよね。
944,948,ただ、やっぱり友人とやると楽しいっていうのもすごいあると思うので、
948,950,これはね、見られる前提。
950,952,私たちがエンターテイメントを作る、
952,957,見ても面白いコンテンツを作るという共通の目的を持って、
957,963,それを演じるということに対するハードルを低くするっていうのがおすすめです。
963,964,うん。
964,965,ね。
965,971,私もね、やっぱり配信するっていう前提でね、
971,976,普段キャラクターとかも考えたりすることによって、
976,982,フラットな自分だったら絶対こういうキャラクターにしなかっただろうなというね。
982,987,いやでも、言ったら私キャラクターちゃんと作ったの2回だからな。
987,992,2回しかないのにこんななんかすごい力説してますけど、
992,994,2回しかないんで、
994,999,というかそもそも私配信外でTRPGやったことないので、
999,1000,うん。
1000,1001,わからないんですけど、
1001,1003,私は配信でやることによってすごいね、
1003,1006,助けられてる部分が多いので、
1006,1007,うん。
1007,1011,こちらね、よかったらご検討いただけたらと思います。
1011,1013,でね、私も、
1013,1017,来週、片城っていうそのリズムさんがね、
1017,1021,前もラジオに遊びに来てくださった、
1021,1025,リズムさんが制作されている片城を、
1025,1029,これもまたラジオに遊びに来てくださったマダラウシさんがね、
1029,1033,キーパーで来週遊ばせていただくことになって、
1033,1037,キャラクターをこの間作ったんですけど、
1037,1038,まだ、
1038,1043,うん。
1043,1047,結構心配っていうかなんか、
1047,1051,大丈夫かなみたいな、
1051,1054,主張に耐えうるのかなっていう、
1054,1055,すごいね、
1055,1057,非常に心配ではありますが、
1057,1059,キーパーがね、
1059,1061,ナリス・マダラウシさんですし、
1061,1063,そのマダラウシさんがもうそんなに、
1063,1068,心配がないぐらい素晴らしいシナリオなので、
1068,1070,安心してくださいって言ってくださってるんで、
1070,1071,大船に乗ったね、
1071,1073,気持ちで臨みたいと思ってます。
1073,1075,はい、ということで、
1075,1078,ぜひともリプレイ動画にするか、
1078,1079,配信しちゃうか、
1079,1081,よかったら検討してください。
1081,1083,なんかまともな、
1083,1086,まともなアドバイスできなくてすみません。
1086,1089,では次、
1089,1093,鳥胸肉の塩田つたあげさんのふつおた、
1093,1094,こんばんは。
1094,1095,こんばんは。
1095,1098,長持ちはしているけど安物だから、
1098,1100,挙動が鈍いマウスを日夜使用しています。
1100,1102,ロジックルさんいつもありがとうございます。
1102,1103,ところで、
1103,1105,物持ち燃費が悪そうなる過去ですが、
1105,1106,これだけは手放したくない、
1106,1108,手放せない事情があるというものはありますか?
1108,1111,呪いの人形とか所持していたら素敵だなぁと思って、
1111,1113,質問を送らせてもらいました。
1113,1114,ということでね、
1114,1116,いや変なこと言ってないですけどね、
1116,1119,質問を送らせてもらいました。
1119,1121,いや偏見がすごいですね。
1121,1124,呪いの人形を持てたら素敵だなってどういう感想ですか?
1124,1127,持ってませんよ。
1127,1128,なんかね、
1128,1131,昨日、
1131,1132,メアリさんの、
1132,1133,ハニーストラップのね、
1133,1135,さよんじメアリさんのチャンネルで、
1135,1136,漫画の、
1136,1140,漫画を厚く語るみたいなコラボに参加させてもらったんですけど、
1140,1143,配信すごい楽しくてね、
1143,1145,いろんな漫画を知ることができたんですけど、
1145,1147,その後に、
1147,1150,終わった後ちょっとお話しさせてもらってて、
1150,1152,メアリさんと、
1152,1154,コラボは今まで何回かあったんですけど、
1154,1155,しっかりこう、
1155,1157,メアリさんのチャンネルで、
1157,1159,なんかじっくりお話しするみたいなの、
1159,1161,あんまなかったんですよね。
1161,1165,で、なんか今回まともに話せて、
1165,1166,なんかすごい楽しかった。
1166,1167,でもなんか、
1167,1169,あの、得体が知れないねみたいな。
1169,1173,感情とかあるの?みたいな感じの質問をしていただいて、
1173,1175,ヒチカさんにも言われたことあるな、
1175,1177,感情あるのかなって。
1177,1179,でなんか、
1179,1182,コンクリート打ちっぱなしの何にもない部屋に住んでそう。
1182,1184,ね、言われて。
1184,1186,いや普通に白い壁!と思って。
1186,1188,うん。
1188,1190,普通の白い壁。
1190,1192,うん、です。
1192,1193,はい。
1193,1196,なんか普通にその、なんだろうな。
1196,1198,ぬいぐるみとかあるしね。
1198,1200,ベイマックスとか。
1200,1204,私が最近一押しなのは、サンレモンさんっていうところの、
1204,1206,あの、ヒザシャークっていう、今ね、
1206,1208,膝に乗せてるんですけど、
1208,1210,これがね、非常に重さもちょうどよく、
1210,1213,触り心地もすごい素敵なので、
1213,1216,もしね、そろそろ家にサメが欲しいっていう方がいたら、
1216,1220,サンレモンさんのヒザシャーク、ぜひ検索してみてください。
1220,1221,うん。
1221,1224,人形はないです。ぬいぐるみはいっぱいあるけどね。
1224,1226,はい、ということで、
1226,1228,えー、そんな感じで、
1228,1232,すいません、なんか期待に、期待に添えなくてね。
1232,1234,ははは。
1234,1236,えー、では次のお便り。
