start_s,end_s,text
1665,1673,なんちゃってまだミスってマジでなんちゃってまだミスこそ階段はく物語よりも gm の苦労が絶えないですよね
1673,1679,あっはぁ なんちゃってまだミスは私あのリズムさんのチャンネルでやらせていただいたんですけど
1679,1687,いわゆるそのまだミスって最初に配られたそのロール役割で 例えばあなたは犯人ですとかあなたはあの
1687,1693,犯人ではないけどこういうミッションがありますみたいな感じで最初に配られるんです けど
1693,1696,なんちゃってまだミスの場合は
1696,1706,何もない無の状態から順番にその自分のターンが回ってきたら自分以外のプレイヤーに設定をなすりつけられるみたいな
1706,1712,勝手にね そのプレイヤーが言ったことは絶対みたいな感じになって
1712,1721,例えば林さんがマミーポコパンツ履いてるの見ましたみたいなこと言ったら本当にマミーポコパンツを履いてるということになってしまうという世界で
1721,1728,あのプレイするっていうまだミス最終的に犯人を決めるっていう ゲームなんですけど
1729,1733,あれはマジで本当に gm が
1733,1740,gm の力量によりけりーっていう 冴えたる感じがするなぁ
1740,1744,んじゃってもいいさとてもできる気がしない
1744,1755,で a 次の普通た大羽見たけさん不走とありがとうございます ルカ子さんこんばんは突然思い出したのですが年賀状の私の住所
1755,1766,太陽系第三惑星地球日本国丸々県のところから帰ってきたにもかかわらず 肝心のしより下のところを書き間違えてしまい届かなかったという友人がいました
1766,1778,彼少し離れて住んでいたので3月くらいに会った時に気恥ずかしそうに一度返却された 歯垣を手渡しでくれました住所が20戦で訂正されたのたれされていたのがとっても印象的
1778,1784,な小学4年生の春でした ということでねすごい可愛いらしい
1784,1790,すごい可愛いエピソードうん なんか小学校4年生の時に
1790,1801,太陽系第三惑星から帰ってくれたのにしからした間違えて帰ってきちゃってそれを手渡し で渡してきてくれる友達めちゃくちゃ可愛いなぁと思ってね
1801,1804,読ませていただきました
1805,1810,絶対優しい可愛い 確かに宇宙日本世田谷
1810,1815,アニマルはね 太陽系第三惑星地球
1815,1822,の後なんだ地球日本国 東京都北区赤羽ねかなうん
1822,1828,ですので 皆さんもねお便りを送るときはぜひ太陽系第三惑星からね
1828,1835,あの書いてください今募集してないけど多分 なんか1回募集した時期あったけどな
1835,1840,私は多分私が入る前だと思いますけど
1840,1847,はいえーではおー31分
1847,1852,31分ですね 今日は一応ウララジオオールナイト20.5
1852,1856,ということであのコンパクト版 となっています
1856,1863,一応ねはいでは次の普通を読みます 焦げたくさんの普通をたおていでございます
1863,1872,6後3視聴者の皆様こんばんはちょっと疑問に思ったので質問させてください v チューバー の方は健康指南や人間ドックに定期的に行ったりしているのでしょうか
1872,1882,私は会社員かつ24時間のシフト勤務者のため半年に1回健康診断を受けており 反うち1回が生活習慣病予防健康診断
1882,1890,人間どこの一歩手前となっておりますバリウム飲む検査マジ辛い 以前何かのネットラジオだったと思うのですがテレビやラジオに出てる人はあまり
1890,1896,いかないみたいなことを聞いて不安じゃないのかねと思いつつも実費だと高いことも 知っていたのでそういうものかと思いました
1896,1903,健康診断の結果がちょうど来ていたので話のネタになればと思い送らせていただきました そういった話があればお伺いたいです
1903,1912,皆さんも健康には十分お気をつけくださいザルダは失礼いたしましたということでうん 私はね毎年受けてますね
1912,1920,バリウムは飲んだことないけどバリウムまだいらないって言われているので 飲んだことないんですけど
1920,1928,まあ健康ですねなんか なんだろうなその担当の健康診断の担当の
1928,1937,お医者さん保健師さんわかんないけどになんか面談みたいな時間があるんですけど マジで何にも言うことないですね
1937,1946,あまりにも健康すぎてオーラさんちょっとあのないです 終わりでみたいな感じですね毎年
1946,1953,ガンマ gtp の値でバトルしましょうかね アニマルで
1953,1959,絶対勝てるは自信あるがマジ tp
1959,1967,ブーブーすげーそうですよビスコ食べてるからね美味しくて強くなってるから めちゃくちゃ健康なんですよ
1967,1972,ねえ ああなんだろうなぁあとなんか戦える数値あるかなぁ
1972,1976,そうお酒飲まないから
1976,1984,アニマル健康診断対決結構ね他の皆さんもね 健康診断で戦おうみたいな話してるんですよね
1984,1988,1回なんかあの なんだっけなぁ
1988,1996,アニマーレのね 3周年の記念のイベントが最初は多分寝るちゃんとかも言ってたと思うんですけど
1996,2003,24時間で最初企画 しようみたいなうっすらそういう話があって
2003,2007,ねー あのなんかその
2007,2015,中で いわゆるその健康診断に334人ぐらいで言ってその結果で戦おうみたいな企画が確か
2015,2021,あったんですよね 私はなんか内視鏡のなんか映像とかを撮ってきてみんなでなんか配信でみよう
2021,2026,みたいなオーラル過去の内視鏡検査をみんなでみようみたいなことを言ってたんです けどね
2026,2033,ちょっとまあちょっと情勢の関係でね そちらはちょっとできなかったんですけど
2034,2040,ねそうそうそう確かねるちゃんが配信で言ってたと思うんでうん ねえ
2040,2047,7し ok 出るんですかその時はなんか普通に書いてありましたよ 内視鏡って書いてあったかなうん
2050,2059,そうだからなんかみんな私以外どのメンバーだったか忘れちゃいましたけど私はその 内視鏡担当で確か名前入ってた気がするな
2059,2068,すごい健康になんかミーティング中にあの子健康にめっちゃ自信ありますって言ったらなんか なってましたその担当に
2068,2073,はいということで
2073,2082,健康じゃなく企画が中心なる確かにねこれでとんでもない数値とか叩き出しちゃったら 笑い事じゃないからみんなすごい心配になっちゃって
2082,2094,3周年お祝いどころじゃなくなっちゃうから そう確かにねあのなんか事前告知しただけどいざ始まったらなくなってたらそういうことですからね
2094,2104,やめといなくなって逆に良かったかもしれない 面白そうな企画ですけどねみんなが健康だったらね
2104,2107,いいんだけど 健康
2107,2121,あれなんかあれなんかこの子この企画に健康診断バトルに出るって言ってたけど当日いないぞみたいになったらあまりにもね心配すぎるんで見てる側が
2121,2125,あれれってなっちゃうから これちょっとあんま
2125,2129,良くないかもしれないですねうん
2129,2135,はいということで 次の普通歌いきますね
2135,2143,見習いさんの普通歌ありがとうございます ルカゴさんこんばんはこんばんは突然ですが私が好きな生き物の話をさせてください
2143,2154,ルカゴさんはカメレオンが色を変えて擬態することができないという話はご存知でしょうか 実際にはカメレオンはストレスや熱で色彩変化はするものの自分の意思や周囲の色で
2154,2161,自身の体色を変えることはできないんだそうです カメレオンが生き物として優れているのは目です
2161,2173,カメレオンの目は左右独立して動かすことができそれぞれ別のものを注視することができるそうです 視力も他の爬虫類に比べてとても良く長い舌を伸ばして遠くの虫を的確に捉えることができる
2173,2179,のもこの目のおかげです しかしその分目が見えづらくなるだけで餌が食べられなくなり死んでしまうことに大切な
2179,2182,部位でもあります
2182,2194,それを考えると様々な役をこなせる意味のカメレオン俳優という言葉も本来のカメレオンの 生態を考えれば目がとてもいい俳優くらいの意味になってしまうのでしょうか
2194,2205,他にも舌が止まった状態から0.01秒で90kmの速度で 時速かな?0.01秒で90kmの速度で伸ばすことができたり
2205,2215,動くものしかうまく認識できないため止まっている水が飲めなかったりとても面白い特徴を多く持った生き物なのでまた気になったら調べてみてください
2215,2219,もうカメレオンのこと信じられない
2219,2224,これねそうそう天地創造デザイン部でありましたっけ
2224,2232,天地創造デザイン部ってねこれもあの最近私がnetflixかなんかで見たアニメなんですけど
2232,2238,なんかラジオでも1回お話ししたことあるんでご存知の方多いかもしれないけど
2238,2245,神様からの受注…神様からの依頼があって
2245,2252,天地創造デザイン部の人たちが動物をデザインしましたっていう世界観の物語で
2252,2262,例えばそのコアラが可愛いけど可愛くないみたいな生き物作ってっていう神様からの雑な発注を受けてコアラができましたみたいなね
2262,2270,そうそういうなんかあの動物たちの面白生態が学べるすごく素敵なアニメなんですね
2270,2273,そうデザイン部大好き私も大好き
2273,2280,でね、それで言うと私は元々裸デバネズミが結構好きで
2280,2285,結構その哺乳類の中では珍しく非常に社会的な生き物なんですけど
2285,2290,これがね天地創造デザイン部でもね
2290,2298,なんと登場しておりましてそちらの回必見なのでよかったらぜひチェックしてみてください
2298,2300,裸デバネズミ好き
2300,2306,なんか面白いああいうなんか怒り言動みたいな生き物ね
2306,2314,アリットジョーと似てるんですよね結構その巣全体その群れ全体のために生きるみたいな
2314,2316,そう
2317,2322,パンダの発注も気になるパンダいたかなぁ
2322,2328,ね、パンダって非常に不思議な生き物ですよねなんでササしか食べないんだろう
2328,2334,なんかすごいエネルギー効率が悪そうですよねパンダって
2334,2339,あの筐体を刺さだけでなんか維持するのすごい大変そう
2339,2342,胃袋4つぐらいあるのかな
2342,2346,なんか牛って胃袋4つあるじゃないですか
2346,2353,でなんかそのパンダ…あ、じゃないパンダ…パンダって雑食なんだ何でも食べるんだ
2353,2365,なんかあの 牛の胃が4つあるのはそのあの巨体を維持するためにあの草をいっぱい食べるんじゃないですか
2365,2374,で草から余すことなく栄養素を絞り取るために胃袋が4つあるみたいな話聞いたことありますね
2375,2379,ササはビタミンcが豊富
2379,2386,一生ササ食べることないだろうけどすごい勉強になりますね
2386,2390,ビタミンcが豊富だそうですササはね
2390,2393,皆さんもササ食べるときはビタミンcがレモン
2393,2396,レモン20個分のビタミンcとかなのかな
2396,2402,なんかあれって結局キャベツ何個分の食物繊維とかレモン何個分のビタミンcって言われるけど
2402,2408,東京ドーム何個分みたいな感じでなんか東京ドーム自体そんな別に大きくないんだよねみたいな
2408,2411,そういうことじゃないですかキャベツとかレモンとかってね
2411,2422,そんなそんなに実はビタミンcの含有量って多くないんじゃないレモンってみたいな感じでいつもレモン何個分のコピー見ちゃう
2423,2425,ねっ
2425,2431,レモン1個分に含まれるビタミンcの量はレモン4個分?矛盾
2431,2436,はいそうですねということで
2436,2441,皆さん素敵な不走ってありがとうございましたミッドサマーのね
2441,2446,そうミッドサマーのおすすめもいくつか来てましたありがとうございます
2446,2453,はーいでは次のコーナーこちら
2453,2455,えぇ
2455,2458,虚無質問への模範回答ですね
2458,2464,今日は爽やかな感じにしようかな
2464,2467,なんか爽やかな感じの曲にしました
2467,2472,虚無質問への模範回答というコーナーなんですけれども
2472,2481,こちらね便宜上虚無質問とさせていただいてますが決してねこれからあのご紹介する質問が悪いわけではないのでね
2481,2483,うん
2483,2489,そうあのこれをしたらいけないのかって話では全くないので
2489,2494,私が配信上あのなんか
2494,2498,まあね普通に例えば知人と話してる時だったら何でもいいんですけどね
2498,2501,配信で聞かれた時にすごい困るから
2501,2507,あのこういう質問に対する模範回答を教えてくださいというコーナーです
2507,2512,はいなのでどんどん皆さん無人島に一つ持っていくんだったら何って質問をね
2512,2517,周囲の人間にどんどんしたらしてもいいと思います
2517,2522,はいではそんな感じで1つ目から
2522,2524,何の予防線
2524,2527,あらゆる予防線を張っていかないとね
2527,2529,でも本当にそう思ってますよ
2529,2532,1回ねなんかなんだっけな
2532,2537,あのミルチーズランチミーティングっていう配信を火曜日の12時からやってるんですけど
2537,2544,そこにあの無人島に持っていくとしたら何ですかっていう質問を送ってくださった方がいて
2544,2549,それでねじゃあもう無人島に持っていくんだったら
2549,2552,ダニエルラドクリフしかねえっていう話になって
2552,2556,それはあの私の中で結構解決したんですよその時ね
2556,2559,無人島に何持ってくって聞かれたら
2559,2563,あのダニエルラドクリフかなーって答えるって決めてるんで
2563,2566,それも非常に助かってますありがとうございます
2566,2568,では
2568,2571,なんでダニエルラドクリフなのっていうのはですね
2571,2576,スイスアーミーマンっていう映画を見ていただければわかるかなと思います
2576,2579,ダニエルラドクリフがなんと死体役でね
2579,2583,ほぼほぼ裸で登場しているというね
2583,2586,ものすごいあの体を張った映画がありまして
2586,2591,すごく面白いのでよかったらぜひぜひ見てください
2591,2597,であの回の後スイスアーミーマン見直した
2597,2600,ありがとうございますありがとうございます
2600,2603,私がありがとうございますもおこがましいか
2603,2605,はいということで
2605,2610,5つ目から読ませてちょっと水飲みます
2614,2616,江戸の方が良くない?
2616,2619,江戸の方がいいわ
2619,2622,江戸にします
2622,2625,資産応用で成功しよう
2625,2627,ラドクリフの資産で
2627,2630,いやあのねいやちょっと待ってね
2630,2634,模範回答を一回皆さんのご紹介した後に
2634,2637,もう一度ちょっと模範回答をまとめましょう
2637,2639,では1つ目
2639,2647,CDモグモグクラブさんのありがちQ&Aの模範回答
2647,2649,趣味は何ですか
2649,2652,こんな当たり障りのない質問でも
2652,2655,オタクである我々にとってはかなりの難問です
2655,2657,ましてや質問の相手がオタクではない
2657,2659,抜刀な人間だった場合
2659,2661,どう答えるのか正解かわからず
2661,2664,あのyoutubeでVtuberってのよく見てて
2664,2665,Vtuberってのはバーチャルyoutuberの略で
2665,2667,アニメみたいな二次元のキャラクターのyoutubeなんですけど
2667,2669,みたいな受け答えをして
2669,2673,結果的に場を微妙な空気にしてしまうことが多々あるでしょう
2673,2674,ありますよね
2674,2677,そこで私は考えましたオタクの皆さん
2677,2680,料理と答えましょう
2680,2683,もちろんこれは無難で陳腐な回答であるため
2683,2685,個性豊かなオタクの皆さんは
2685,2687,少し言うのをためらうかもしれません
2687,2690,しかしそれでも私が料理と答えることを
2690,2692,お勧めする理由はたくさんあります
2692,2695,まず料理は人類誰もが一度やったことがある行為であり
2695,2697,必ずお題を共有することができます
2697,2700,でも普段料理しないしという方
2700,2701,非常にもったいないです
2701,2704,なぜならこの世界にはインターネットや本などに
2704,2706,多種多様なレシピが掲載されているため
2706,2708,就寝者にも優しく
2708,2711,さらに調理器具と材料さえ揃えばできるため
2711,2714,比較的安価にそして一人でも気軽に始めることができる
2714,2718,というように始める際のハードルがとても低いからです
2720,2722,そして多くのオタク趣味と違い
2722,2724,上手ければ上手いほどかっこいいです
2726,2728,これが最大の魅力かもしれません
2728,2731,このように料理は当たり障りのない回答ではありますが
2731,2734,誰とでも話を広げられてかつ簡単で
2734,2737,ありながらも奥深いという
2737,2739,欠点のない完璧な趣味だと思います
2739,2741,深子さんのように普段料理をされず
2741,2743,ふりかけを時間のみされている方も
2743,2745,この機会に始めてみるのはいかがでしょうか
2745,2746,うん
2746,2748,という
2748,2750,お便りいただきました
2750,2751,はいね
2751,2753,私は料理あまりしませんが
2754,2757,まあね料理を
2757,2759,料理できると
2759,2760,まあでも
2760,2761,オタク
2761,2763,多くのオタク趣味と違い
2763,2765,上手ければ上手いほどかっこいいです
2765,2768,とね書いてありますのでね
2768,2769,皆さんも
2769,2772,やってみてはいかがでしょうか
2772,2774,料理の話一個も
2774,2775,ちょっと待ってくださいね
2775,2776,まず
2776,2778,CDモグモグクラブさん
2778,2780,私がちょっと
2780,2783,何にもないです料理に関して
2783,2785,何にもないです配信者なのにね
2785,2787,一個もないエピソード
2787,2788,うん
2788,2791,全く膨らませられない料理に関して
2791,2793,ねということで
2793,2794,皆さん
2794,2796,料理やってみてください
2796,2797,ね
2797,2799,私はしませんけども
2799,2801,ふふふ
2801,2803,しませんけどもね
2803,2805,んーどう
2805,2807,なんかもう他に何にもやることない
2807,2809,ってなったらやろうかな
2809,2811,ちょっと分かんないですけどね
2811,2812,うん
2812,2813,なんか自分で
2813,2816,じゃあなんか自分でそのやる
2816,2817,料理
2817,2819,外に買いに行った方が
2819,2821,安価で美味しいものが食べられるのに
2821,2824,わざわざその自分で作る
2824,2826,メリットがない
2826,2827,うん
2827,2828,ないです
2828,2829,はい
2829,2831,個人的にはね
2831,2832,はい
2832,2834,でもまあまあまあ
2834,2835,今後ねもしかしたらその
2835,2840,無人島に行った時に料理ができないと困るかもしれないしなーという気がするので
2840,2841,おいおいね
2841,2842,おいおい
2842,2844,うんやっていこうかな
2844,2845,うん
2845,2847,外に出るのがだらすぎる
2847,2849,あーそれは分かる
2849,2851,そりゃ分かるんだよなー
2851,2853,夏とかね雨の日とか
2853,2856,本当にめんどくさいですからね
2856,2860,そういう日はもう一回は食べなくてみたいな気持ちになりますからね
2860,2861,うん
2861,2863,ということで
2863,2866,えーま料理が上手な人っていうのは非常に魅力的ですよね
2866,2868,なんかあのみやち
2868,2870,私と同時デビューのコナンみやが最近あの
2870,2873,あの料理できるアピールをツイッターで始めまして
2873,2875,前からたまにやってたんですけど
2875,2877,あのーなんか
2877,2879,いいなーって思いますもんね
2879,2882,もうなんかあみやちって結構
2882,2885,料理とかするんだみたいな感じになるから
2885,2888,www
2888,2890,そういや私結構刺さってる
2890,2893,あのーコナンみやの料理アピ
2893,2895,いやめっちゃ刺さってるわ
2895,2896,はい
2896,2897,ということでね
2897,2899,えーみな刺さったみなさん
2899,2902,ぜひ今日もねコナンみやがASMR配信したので
2902,2903,歯医者
2903,2905,歯医者ASMR
2905,2907,歯医者七宝ASMRやってましたので
2907,2909,えーぜひぜひ聞いてみてくださいね
2909,2911,うん
2911,2913,なんでしょって歯医者と思ったけど
2913,2915,はいえー次
2915,2918,えーちくわやさんの模範回答
2918,2922,無人島に一つだけ持っていけるなら?
2922,2924,回答
2924,2926,原子力空母
2927,2928,はい
2928,2930,みなさんこれどうですか?
2930,2933,無人島に一つ持っていくならどうする?って聞かれて
2933,2937,あー原子力空母かなーって言われたら
2937,2939,話広がります?
2939,2941,どうかな?
2941,2943,原子力空母
2943,2945,帰る気満々で草
2945,2947,過剰戦力
2948,2950,自分で動かせない
2950,2952,あー確かにな
2952,2955,私の原子力空母の動かし方わからないな
2955,2956,でもなんか
2956,2961,でかい乗り物ってそれだけであると安心するっちゃするかもしんない
2963,2965,えー一人で運用するの?
2965,2969,辛くない?とかで広げる
2969,2971,そのギャル好き
2974,2976,え、あのさーなんか
2976,2979,もし無人島に一つだけ持っていくならさ
2979,2981,何持ってく?
2981,2984,あー原子力空母かな
2984,2987,え?原子力空母?
2987,2990,一人で運用するのだるくない?
2990,2992,って返してくれるギャルいいな
2992,2995,じゃあイオンモール
2996,2999,じゃあイオンモールはいいな
2999,3001,じゃあ原子力空母がいいんだったら
3001,3004,じゃあ私もイオンモール持ってくけど?みたいな感じになりますね
3004,3005,確かに
3005,3008,これはどうなんだろう?もしかしたら
3008,3009,パンチはあるけど
3009,3012,相手が広げてくれるかどうか
3012,3014,一か八か感はちょっとあるかも
3014,3017,で、えー
3017,3022,次にね他にも実はね無人島シリーズ送ってくれた方いました
3022,3023,えー
3023,3026,千代千賀朝奥でいつもやってる筋肉ルーレットが恋しくなってきたら
3026,3027,あれね
3027,3031,フォーチュンルーレットじゃなかったですか?筋肉ルーレットって名前でしたっけ?
3031,3032,はい
3032,3035,えー3の模範回答
3035,3038,無人島に一つだけ持っていけるなら
3038,3040,回答
3040,3043,ごめんな寂しい思いさせて
3043,3047,過去イケボ 過去静かに抱き寄せる
3050,3052,いやこれ間違ってるじゃん
3052,3054,間違ってるじゃん
3054,3056,質問の方を間違えてるじゃん
3056,3058,これいきなりだってさ無人島を
3058,3061,無人島に一つだけ持っていけるんだって聞いて
3061,3065,全然初対面とかの人に
3065,3068,抱き寄せられたら怖いじゃん
3068,3072,いやーこれ面白かったですね
3072,3077,とりあえずごめんな寂しい思いさせてって言っときゃいいと思ってる
3077,3079,確かにでもそうかもね
3079,3082,結局なんか
3082,3084,最終的に
3084,3086,イケボで解決できるのかも
3086,3088,ボイスがイケメンの人たちは
3088,3092,今度ね気が向いたら是非やってみてください
3092,3094,で本当はじゃあ
3094,3100,ごめんな寂しい思いさせてはどんな時に言うかっていうのが次の質問なんですけど
3102,3105,翔平さんの模範回答
3105,3110,仕事と自分どっちが大切なのかという無茶振りな二択を迫られた時
3110,3114,迫られた方多かれ少なかれいらっしゃるかと思います
