start_s,end_s,text
0,2,ん
17,19,ん
19,21,ん
21,23,ん
23,25,ん
25,27,ん
27,29,ん
29,31,ん
31,33,ん
33,35,ん
35,37,ん
37,39,ん
39,41,ん
41,43,ん
48,54,いやついに youtube 君のアルゴリズムと
54,59,膝つき合わせて話さないといけない時が きたなと思っています
59,62,ご縁よろしくお願いします
76,78,こんばんは
78,86,今日はジングルちゃんと流れてましたかね あのージングルがこっちに聞こえる時と聞こえない時が
86,89,ジングル流れない
90,97,ジングルがね流れてるが流れてないかわからない時があるんですけど今日は流れてない 日でした
97,101,まあそういう日もあるか 今日はねちょっと
101,106,youtube 君に言いたいことがあってきました
106,112,なんでかっていうと まあね私あの普段から
112,118,asmr を聞いてるんですけど youtube でパトラさんがね
118,123,なんか パトラさんのasmr を聞いているために
123,131,あの基本的に youtube のオススメ欄が全部ピンクのasmr なんですね それは自明のりなんですよ
131,137,で それもいいんですよまあそれはそうだろうなって感じなんですけど 最近ねー
137,144,youtube 君がオススメでねなんか 生こう
144,155,生こうが寄生虫に感染しててなんかそれを一緒に見てみようみたいなね やつとかあとなんか鎌切りを水につけてみると
155,159,どうなるのかな みたいなやつとか
159,167,あとなんかテラフォーマーズの地球版のやつがいっぱいいるよーみたいなね 動画を突然私にあの
167,171,おすすめしてきてね あれな
171,178,そんな動画見たことない見たことないんですよ本当に youtube でね
178,182,食事中なんですが山は一時だから
182,191,なまこも食べ物だしねなまこも食べる人いますし なんですけど
191,200,な何なんですかね私はそんな動画を一度も見た一度たりとも見た覚えがないんです けどこのアカウントでこのアカウントではね
200,209,なぜか youtube 君が私がなんか好きでしょってなこういうの好きなんだよね知ってるよ みたいな感じでめちゃくちゃオススメしてくるんですよね
209,215,これ一体何なのかなぁと思って皆さんはちゃんと自分の好きな動画でますか
216,227,好きな動画っていうか今多分見てるジャンルに関係あるんだろうなっていうやつ ちゃんと出てきます
227,232,でも実際好きなんですよね いやどうかなぁ
232,241,なんかのなんだろうな私をご飯食べる時に オモコロチャンネルとか見るんですよ
241,251,ねえ youtube なあがそうと思ってご飯用意されている状態で あの寄生虫の動画とかちょっとやめてほしい
251,259,youtube 君私のことなんか目黒寄生虫博物館の年パス持ってる奴みたいな感じで最近扱って くるから
259,265,なぜかずみちゃんの初配信が度々出てくる
266,280,あそれで言うとね私あのコナンミヤのあのなんだっけ切り抜き リスナーさんが切り抜いてくれているやつであのなんだっけな
280,288,お父さんなんか パンツの中に手を入れておくと安心するみたいなそういう癖があって
288,295,でなんか 布団の中でその癖を発揮してたらなんかお父さんに起きろって言われて布団を剥がさ
295,304,れて誤解されたっていうあの切り抜きの動画をめちゃめちゃお勧めされますね
306,317,あれちょっとなんかめちゃくちゃ不名誉なサムネ見るだけでいいのかなぁって思いながら またお勧めされとるわと思ってる
317,327,自分も同じ出てくるみんな出てくるじゃん私たち 私たち同じ世界見てるね
329,340,ということでねあれ結構出るということでみんな同じ世界に生きてて同じものを見て 生きてるんだなぁっていうのが分かってすごい安心しました
340,354,ねそのうち多分ねあのみんな皆さんのあのおすすめ欄にもあの生この寄生地の動画が 出てくると思いますので出てきたらこれこれ知ってるって思ってみてください
355,364,いやワンチャンあるとしたらディスカバリーチャンネルかな ディスカバリーチャンネルで結構ねいろんなものを食べてたりとかするから
364,372,それかもなこの間の亀 亀を食べちゃうぞとかなんか楽だわすごいまずかったみたいなね
372,376,ディスカバリーチャンネルの動画を見たので それ
376,380,それかもしれない そんな真剣ゼミややだ
380,385,これ真剣ゼミでやった生この寄生地の動画だって
385,393,であのテラフォーマーズの地球版のやつはゴミ屋敷の動画が原因かもしれない
393,397,なんか私のせいかもしれない
398,408,なんか youtube のアルゴリズムがどうとか youtube が私のことをなんか誤解してるって散々今まで7分間喋ってきましたけど私のせいかもしれません普通に
408,418,はいということで解決しました 解決ですということでね音量バランス何かありましたら教えてください
418,424,この配信見てると寄生地の動画がお勧めされるようになるってことそうです
425,431,そうですはい youtube 非常にいかん申し訳ない youtube 君にねすぐ冤罪をかけてしまって申し訳ないです
431,435,自分のせいでした音量刑ありがとうございます あっ
435,442,でも公園にジングルが流れないということは普通歌のやつも流れない可能性ありますね
442,449,今日流れてないっぽいな さっきね始まる直前にね
449,454,なんか音量テストしたら 全然声がこういうの
454,457,流れた? えっ
457,460,どういうこと?
460,465,えーわからんちょっともう一回ジングル流してみていいですか
465,469,これ流れてるのかな 流れた
469,473,流れた 流れないはいジングルは流れません
473,482,はいということでね早速 普通歌に入ってまいりましょうか
482,489,ジングルどうしちゃったんだろうね なんかしばらく会わないうちになんかすれちゃったかな
489,496,では1通目 pc 叩いてみる? いや案外それで治るんですよね実際
496,505,なんか電子機器ってね意外となんかいやそんなの治るわけないでしょみたいな そういう素人なんだっけななんか usb
505,512,メモリ? usb メモリっていうのがあったじゃないですか
512,521,ねなんかそれってなんか初心者の人はあの刺した刺してから抜くときになんかもう
521,532,何にもせずにねもうそのままバッて抜いちゃうけどあの実はなんかその pc 側であの抜きますって処理をしてから抜かないといけないらしくて
532,538,で pc 中級者はなんか ちゃんとそのスイッチを抜いてるんですよ
538,547,中級者はなんか ちゃんとその処理をしてから抜くけどなんか上級者になるともうそんなのマジでどうでもいいって言って
547,556,なんかそのまま抜くっていう 要はその初心者と上級者が同じ行動してるっていうのがあるって聞いたことある
556,562,twitter で あれやる意味ないやる意味ないですはい
562,570,はいということでね案外なんか pc もたたえたら治るか治るのかもしれないですね
570,572,では
573,580,早速1通目の不増とから読ませていただきたいと思います
580,586,ガスマッチョさんの不増対応ていれありがとうございます 過去さんリスナーの皆さんこんばんはこんばんは
586,593,来月の話になりますが9月23日から amazon プライムに amazon プライムにてミッドサマーが配信されますね
593,603,私は普段ホラー映画をあまり見ませんしかしネットで見かけた山田と上田のいない トリックという感想が気になりすぎるのでぜひ見たいと思っているんですが
603,608,雰囲気を味わうために一人で見るかはたまた友達や誰かの同時視聴と一緒に見るか悩んで います
608,616,るか子さんはホラー映画を見るなら一人で楽しみたい派ですかそれとも何人から楽しみたい派 ですか
616,623,こちらねあの他にもあのミッドサマーもうすぐきますよ雨プラにっていうお便り いただいてました
623,626,ありがとうございます これ
626,636,なんかみんなで見たいなっていう気はするんですけど 山田と上田がいなくてやべだけトリックやばい
637,643,迷宮に確定したな 山田さんと上田さんがいないトリック
643,649,これねあのミッドサマーって私まだ見たことないんですけど あの
649,658,r 18 r 15じゃなかったかな確かグロ方面じゃなくてエロ方面だった気がするんですけど
658,663,ちょっと待ってくださいねと様 r 18
663,668,なんかそうなると あの
668,679,すごいあの例えばね夜例えば11時ぐらいのドラマを家族で見ててなんかちょっと あのエッチなシーンになっちゃった時の親と一緒に見てるドラマでエッチなシーンが
679,687,挿入された時のあの気まずさみたいなことになるんじゃないかなって思うんですけど 大丈夫ですか
687,689,あっはぁ
689,698,ヒロインの笑顔で終わるいい映画センシティブグロ方面 ちょいグロマーエロって感じ
698,704,なるほどね いやそうそうお茶の間凍りつくんじゃないかなと思って結構不安
704,714,ですねでもなったしかねミッドサマー あれししおくりさんシュガーリリックのしそうししおくりさんが確か同時秀してなかったかね
714,719,ということで もしかしたら
719,727,クリスさん私がもし一人で見るってなったらクリスさんの配信 流しながらやるかも
727,732,あれミッドサマーだっけ来るだったっけな応援上映してた
734,742,なんだっけあの知人がねあの石平さんの少年っていう映画が
742,747,あるらしくていわゆるその 少婦少婦の少女に
747,757,あの年で少年だったと思うんですけど 松坂通りさんが主演だったかなちょっとその辺定かでないんですけど
757,762,そのねー あの結構まあその何
762,772,その名前にねあの負けず結構そのアダルトなシーンが多々あるんですけどこれの 応援上映をしたって言ってて
772,782,ちょっとねあの深夜にふさわしい話題なんですけど初手からね あのこれの応援上映っていうのがまあいわゆるその成功医のシーンがあるんですけど
782,791,それをあのみんなでがんばれいいぞ いい腰使いみたいな感じで応援するっていう応援上映があったらしいです
791,794,はいということで まあ世の中にはいろんな
794,798,あの応援の形が
798,803,いやどういう空気だったんだろうなぁ マジで面白すぎる
803,812,あそうそうがんばれがんばれですね本当あのライフ先生の世界を集団で体験できるというね非常になんか
812,817,あの新感覚のね斬新な応援上映でした うん
817,821,みんな疲れてんだなライト振るんだろうか ライト振ってたはず
821,828,なんかサイリウムみたいな振ってた 内輪とか持ってったみたいなこと言ってたかな
828,835,なかなかディープなイベントが世の中にありますね はいということでミッド様個人あの一人で見るとしたら
835,842,フリスさんと一緒に見たいかな フリスさんの配信とねということでお勧めありがとうございました
842,845,では次のふつおた
846,850,何色のサイリウム振ればいい?それピンクでしょ
850,853,では次
856,862,ちょぼさんお便りありがとうございます ルカゴさんこんばんはこんばんは私は最近何事にもやる気が起きませんしなければ
862,871,いけないことはあるのですがぼーっとしてしまって全くはかどりません ルカゴさんはこれをしたらやる気スイッチが入るみたいなことってありますか
871,874,これはねー 難しい
874,885,難しいですねなんか6月5月6月とかって結構皆さん なんか5月病みたいな話してて確かやる気を出すためにはどうすればいいんだみたいな
885,890,配信したかもしれないんですけど 個人的にはですね
890,893,k-pop
893,900,のあの ブラックピンクとかママムとかなんかそのガールクラッシュ系のね
900,909,あの強い女系アイドルの曲をめちゃくちゃ大炎でかけながら歌うっていう風呂で
911,916,それがおすすめですね あのこれどなんだろうちょぼさんどうなんだろうな
916,925,まあでも女性でも男性でもねすごい楽しいと思うんで これぜひ一度やってみてくださいめちゃくちゃかっこいいんでね
925,934,私あの基本的に風呂でしか歌ったりモノマネしたりしないんで 他の人は普通の部屋でもやるのかもしれないけど
934,936,ん
936,943,ね強い女吉田さん吉田沙織さん強いですね なんかスポーツ観戦とかもいいんじゃないかな
943,947,あとあれですかね
947,955,なんかモチベーションが上がるアニメとか映画とか見るみたいな 私この間あれを見終わったんですよ
955,960,映像研には手を出すなをね見て 映像研に
960,964,映像研には
965,971,手を出すなか これめちゃくちゃいいアニメでした映像研には手を出すな
971,979,高校生が アニメを作るっていう基本的にはその3人がその主人公というか
979,988,で メインで3人出てきてその3人で映像研という部活を作ってアニメを制作するんですけど
988,992,うん これはねあの
992,1000,やっぱすごいのが監督監督 ポジションのことあとアニメーターポジションのこと
1000,1005,あとプロデューサー プロジェクトマネージャーのポジションの子がいるんですけど
1005,1015,まあそのプロデューサーのねあの子がめちゃくちゃ有能でね 金森氏だったかな金森氏
1015,1017,で
1017,1024,この子がいてくれたらほんと世の中で
1024,1032,あの進捗どうですかって聞くだけがあのプロジェクトマネージャーの仕事だと思っている
1032,1040,人間がね山ほどいると思うんですけれども みんな見た方がいいですね私もそう思ってたし
1041,1048,本当いろいろ勉強になりましたね SNSは遊びじゃねーんだ
1048,1058,進捗どうですかって一番聞きたくないですよねやる気がない時にね ということででもねあの金森氏は本当あのびっくりするほど進捗どうですかってめちゃくちゃ
1058,1062,あのアニメの中で聞いてますけどね
1063,1069,あそうクリスさんが今がれき?がれき?がれきってなんだ ガレージキットとかの略ですか
1069,1073,をね今作ってる奴が映像研には手を出すのです
1073,1081,さっきのコメントでもあったんですけどあのやる気を出すためにはもうとりあえず手をつけてみることがいいらしいですね
1081,1088,とりあえず始めてみる やめて現実を知らしめないで
1088,1093,エンジンさんこんばんは あれお疲れ様ですあのマイクラの
1093,1098,ちょっとね私は参加できないんですけど明日かな 今日か日付の上では今日
1098,1105,あのエンドラ 7cインクのねあのマインクラフトのサーバーがあるんですけど
1105,1111,7cインクのマインクラフトのサーバーであのエンドラエンドラなるものをね あの
1111,1120,倒して見んとてするなりっていうイベントがあるのでそちらもぜひぜひチェックしてくださいね
1120,1125,ということで こちらとりあえず始めてみることがいいそうです
1125,1132,あと映像研には手を出すなとか白箱とか見るのがいいかもしれません はいでは
1132,1135,次のお便り
1137,1143,あレトスさん誕生日 今日誕生日明日誕生日かなおめでとうございまーす
1143,1148,ね いやめでたいな私も今日ねなんと晩御飯ね肉食べちゃいました
1148,1157,はぁなんの私全然誕生日じゃないのに 肉を食べてしまいました皆さん何食べましたか
1158,1162,誕生日でもない奴がに行こう食べてしまいましたね 吉野家の
1162,1165,美味しかった
1165,1171,それで言ったら結構私誕生日でもなんのね寿司を食べたり 吉野家食べたり
1171,1179,めでたいカレーでしたあえっカレーの人いっぱいいるキーマカレー
1179,1182,誕生日じゃなくても食べる
1183,1188,いやいやいやいや肉ってやっぱテンション上がるじゃないですか うん
1188,1197,しかも私牛丼じゃないですから吉野家で食べてもダブル ダブル定食ダブル弁当ってなんかあの肉と肉のマリアージュみたいな肉と肉と
1197,1203,米みたいな やべー弁当をいつも食べてるんで
1203,1205,ん
1205,1218,ふりかけ以外の良いものを食べてほしいいやふりかけはたまたまあの日なんか この間ねあの泉さんのあの七深空と昼ご飯シリーズがねこの8月中に
1218,1226,あの12時から平日昼12時から配信されてるんですけど明日が最終日だったっけ
1226,1234,明日は小森メトさんだったかなだったと思うんですけどねあの私もゲストで呼んで いただいてで
1234,1244,なんかその時に10 12時からの配信なんですけどその前にあのお昼ご飯をね配信に載せるお昼ご飯の写真を送って
1244,1252,くださいねっていう風に言われてて で当日の朝セブンイレブンでなんか買ってこようと思ってたんですけど
1252,1261,寝坊してでその日の夜の枠も立てないといけなかったんで なが家にあるもの写真撮らなきゃと思ってなんか撮らなきゃと思って
1261,1266,であの振りかけ以外にもあるんですよ それはね
1266,1270,ビスコとか あと
1270,1278,戦う間ぬかハニーとか そうで戦う間ぬかハニーとビスこと振りかけ並べて
1278,1283,振りかけかなぁと思って振りかけにしました
1285,1291,なんかあのビスコとかでなんかアフダイレクトフレークめちゃ面白かったりがとう ございます
1291,1302,なんかねビスコで話はずまん弾むのかビスコでみたいなただ私がなんかビスコは なんか美味しくて元気になるよみたいな話で終わっちゃうから
1302,1304,そう
1304,1311,ビスコの方がまだまし いやいやその後ねその後ですよやっぱ
1311,1319,ビスコで例えばなんか私が突然やビスコは美味しくて強くなるんで うんみたいなこと言ってもなんか
1319,1327,泉さんの配信見てる方なんかみたいな変な動きちゃったなって感じになりません だったらまあ大人の振りかけの方がなんか
1327,1335,大人の振りかけの方がダメか なんか大人の振りかけの方がダメだったかもしれない今気づきました
1335,1342,やっぱ配信してて気づきっていますね100点ありがとうございます そう
1342,1348,ねあの配信 をしている時に皆さんとこう会話することで
1348,1358,youtube のアルゴリズムも自分のせいだし ビスコと振りかけだったらまあビスコの方がいいそういうことに一つずつ気づいていけるんだな
1358,1361,日々学びを得ています皆さんから
1361,1365,また成長しちまった
1365,1369,やばい 著しく成長してるの最近
1369,1375,では次のお便りを読みたいと思います
1375,1382,ゆっきーさん普通とありがとうございます ルカコさんこんばんはこんばんはいつも楽しい配信をありがとうございます
1382,1392,ありがとうございます先日ルカコさんが参加してた狂気山脈の trpg 配信を見て tlbg に興味が出てきてそのことを友人たちに話したら面白そうだからやろうという話になり
1392,1400,私が gm やることになったので今はルールを覚えながらシナリオの読み込みや常備な 準備などをしているところですうん
1400,1410,実際にプレイするのはもう少し先になりそうですが今からは空がワクワクが止まりません 今回 tlpg に興味を持つきっかけをくれたるかこさんに感謝した感謝しかありません本当にありがとうございました
1410,1415,というね嬉しいお手入れをいただきましたこちらこそ ありがとうございます
1415,1418,あの 先週の
1418,1426,8日曜日にねこれはまた泉さんのチャンネルであの tlpg 階段箱物語というね
1426,1442,ものに参加させていただいて次の日にこのまだら牛さんのチャンネルで 木更津駅 m クロア tlpg の新薬木更津駅に参加させていただいたんですけど
1442,1450,いや私はねあの実はその まあ階段箱物語を入れていいんだとしたら tlpg
1450,1461,は4回やったことあるんですねそうでなんか めちゃくちゃ tlpg やってるみたいな感じであの
1461,1468,なんか結構 言われることがあるんですけどいやすごいやってるよねみたいな tlpg 好きだよねって言われるんですけど
1468,1474,実際まだ4回しかやってないですよねうん ということでね早さは立派に戦った
1474,1482,泉さんのチャンネルの階段箱物語よねマインクラフトの動画を上げてらっしゃる 林さんが
1482,1492,gm をつかむ務めていただいたんですけどあの階段箱物語ってすごいシステムで gm がね話す階段に
1492,1500,プレイヤーたちがこちゃちゃを入れて怖くなくするっていう ねそのざっくり言うとそんな感じなんですけど
1500,1507,なんか ただただ gm がかわいそうなシステムというかねボコボコにただ殴られているっていう
1507,1516,ねそれをこうでも林さんがねー すごい綺麗な物語にまとめててそう
1516,1521,なんかねすごい 趣味猛量がバッコしてたんですけど
1521,1526,私の左右で プレイヤー陣がねあの
1526,1535,ほぼワイダーになりかけてたいやもうほぼワイダンてかも全編ワイダンうん 全員色書きみたいな感じだった気がしますけどね
1535,1542,いやそれは失礼かそれは失礼でした ねあのアイドルの方もいたんでちょっとそれは必然でしたね
1542,1548,でも本当あの まあまあまあまあ趣味猛量が長寮バッコして
1548,1554,シャレスたにはそっと gm 量を支払いしておきました
1554,1563,ブーブー言っなんか一応早いさんもね一応なんかあの口頭では楽しかったって言っ てたんでうん楽しかった
1563,1570,まあまあもしかしたら結構あの 系とかが抜けちゃうぐらいのストレスを受けたかもしれないんですけど
1570,1580,詳しくは配信見ていただけたらと思います 次の日のねプレイした新薬木更木もずっと気になってたエモクロっていうシステムで
1580,1589,エモクロは自体はねあのウェブ上にすべてルールとかがサンプルのシナリオも確か上がっ てたはず
1589,1601,であのすごいキャラクター作成とかもね ui がめちゃくちゃしっかりしてて とても素敵な trpg なのでこちらもぜひぜひチェックしてみていただけたらと思います
1601,1608,楽しかった ねということで gm とっても大変そうですがぜひぜひ楽しんで続報もお待ちしておりますお手
1608,1614,ありありがとうございました では次
1615,1621,さあの木更木 アジーム調整してみませんかジョジー m 確かに
1621,1624,やってみたいですねなんか マドロイスさんに聞いたら
1624,1633,gm やるんだとしたら t rpg よりまだミスの方が楽かもみたいな 基本的にはそのシステム通りに
1633,1643,進行していけばいいのでね t rpg みたいにそのなんての gm のそのなんだろうなここじゃあ何で判定させるかとか
1643,1650,ここじゃあなんかどういう例えば なんだっけなファンブルーとかクリティカルが出たけどじゃあどういう負荷
1650,1659,価値をつけるかみたいなところ後の判断がまた難しいんでね またミスの方がいいかもみたいなお話聞いたことあるんで
1659,1665,いやーやってみたいですね面白そう なんちゃってまだミス
