start_h,start_m,start_s,start_ms,end_h,end_m,end_s,end_ms,text
0,1,0,0,0,1,5,0,わぁ今日9時からずっと配信してるなぁと思ったけど
0,1,6,0,0,1,11,0,よく考えたら前24時間配信してたから全然大したことなかったです
0,1,11,0,0,1,13,0,今夜もよろしくお願いします
0,1,13,0,0,1,15,0,うらラジオールナイト
0,1,15,0,0,1,17,0,うらラジオールナイト
0,1,28,0,0,1,30,0,はい、ということで
0,1,30,0,0,1,34,0,今日はジングルが流れたのか流れてないのか
0,1,34,0,0,1,36,0,ナイスジングル!流れてたっぽいですね
0,1,36,0,0,1,40,0,相変わらずね流れてるかどうかわからなくて困ってます
0,1,40,0,0,1,46,0,音量何かありましたら是非是非ご指摘お願いします
0,1,46,0,0,1,50,0,今日ね、さっきまでリズムさんのチャンネルにお邪魔して
0,1,50,0,0,1,55,0,ともしかさんとリズムさんとソンゴブホラーっていうホラーゲームを遊ばせていただいたんですけど
0,1,55,0,0,1,58,0,急遽ねめちゃくちゃ面白かったですね
0,2,2,0,0,2,6,0,なんかあのクトゥルフ神話…あ、音ちょうどいいありがとうございます
0,2,6,0,0,2,9,0,クトゥルフ神話をモチーフにしたホラーゲームらしいんですけど
0,2,9,0,0,2,13,0,あまりにも途中から参加すぎて全然わからなくて
0,2,13,0,0,2,18,0,配信途中にね、ゲームの攻略チャートを見始めるっていう
0,2,18,0,0,2,22,0,すごい大変な失礼なことをしてしまったんですけど
0,2,22,0,0,2,23,0,めちゃくちゃ楽しかった
0,2,23,0,0,2,25,0,ともしかさんありがとうございます
0,2,25,0,0,2,28,0,配信終わったばっかりなのにお疲れ様です
0,2,28,0,0,2,34,0,前ね、ともしかさんのチャンネルで24時間雑談配信したことあったんで
0,2,34,0,0,2,39,0,なんか結構ね、スケジュールとか立て込んでも
0,2,39,0,0,2,42,0,いや24時間配信できたしなっていう
0,2,42,0,0,2,45,0,あれが一つの指標になっててね、すごい助かってます
0,2,47,0,0,2,48,0,よく途中から入ったね
0,2,48,0,0,2,49,0,うん、そう
0,2,50,0,0,2,51,0,そう
0,2,53,0,0,2,54,0,もうシンプルにそう
0,2,54,0,0,3,4,0,いつもね、はやしさんとディズニーマンさんとともしかさんの3人で宇宙ヤバい組でやってらっしゃる実況だったんで
0,3,4,0,0,3,7,0,お邪魔するのも部粋かなぁとは思いつつね
0,3,7,0,0,3,9,0,入ってしまいました
0,3,9,0,0,3,10,0,楽しかったです
0,3,12,0,0,3,14,0,なんか、あのー
0,3,14,0,0,3,18,0,今日はね、9時から天川はのさんのチャンネルにお邪魔して
0,3,18,0,0,3,25,0,皆さんからいただいたマシュマロにね、ついて話して
0,3,25,0,0,3,32,0,その後、まあホラーゲームでこの後ラジオっていう感じの3回行動だったんですけど
0,3,32,0,0,3,35,0,結構ね、あのーなんだろう
0,3,35,0,0,3,38,0,今、いつもよりテンションが高い
0,3,38,0,0,3,39,0,高いです
0,3,42,0,0,3,46,0,いつもなんかもっと眠そうな感じで始めてた気がするんですけど
0,3,46,0,0,3,50,0,配信中だとなんかアドレナリンが出るのかな
0,3,50,0,0,3,53,0,今日はちょっと元気に配信できそうな気がしますね
0,3,54,0,0,3,56,0,いつも吐きないから
0,3,56,0,0,4,1,0,でね、今日はちょっと一個目標があって
0,4,1,0,0,4,4,0,最近ちょっと反省したことが一つあるんですよ
0,4,5,0,0,4,7,0,配信が長い
0,4,8,0,0,4,10,0,これちょっと気にしてて
0,4,10,0,0,4,16,0,なんか、いや、使者誤入したら1時間だからみたいな意味わかんないこと言ってるじゃないですか
0,4,16,0,0,4,21,0,使者誤入って何?と思って、こないだ
0,4,21,0,0,4,26,0,自分の配信で読めなかったコメントとかを見返すために
0,4,26,0,0,4,29,0,動画見たりするんですけど、自分のアーカイブ
0,4,29,0,0,4,36,0,なんか2時間、一番最初の数字が2にならなければギリセーフみたいなこと言ってて
0,4,36,0,0,4,38,0,はぁ?と思っちゃって、素直にね
0,4,38,0,0,4,42,0,なんで今日はなんとかね、1時間
0,4,42,0,0,4,45,0,1時間を目標に
0,4,45,0,0,4,51,0,まあ言っても1時間から1時間半の間だったらほぼ1時間みたいな感じで
0,4,51,0,0,4,54,0,ちょっと身を引き締めてやっていきたいと思います
0,4,55,0,0,4,57,0,ということで早速ね
0,4,57,0,0,5,0,0,普通のお便りを読んでいきたいと思います
0,5,0,0,0,5,2,0,ラジオ配信なので
0,5,2,0,0,5,4,0,今日のコーナーは
0,5,4,0,0,5,10,0,普通お便りとナナシインクから出る新ユニットの予言の書
0,5,10,0,0,5,14,0,そして結婚相手に求めるあれこれ
0,5,14,0,0,5,18,0,ということで皆さんからお便り募集いたしました
0,5,18,0,0,5,19,0,ね
0,5,21,0,0,5,23,0,はい、ということで
0,5,24,0,0,5,26,0,1通目からね
0,5,26,0,0,5,27,0,読んでいこう
0,5,27,0,0,5,30,0,ジングルとか鳴らしちゃったりして
0,5,30,0,0,5,32,0,はい
0,5,32,0,0,5,39,0,今日はね、なんで結婚についての話になったかっていうと
0,5,39,0,0,5,44,0,来週、10月の末なんですけど
0,5,44,0,0,5,48,0,コナンミヤのね、私と同時デビューのコナンミヤの
0,5,48,0,0,5,53,0,ガチ婚活配信をしようっていう話をコナンミヤとしてて
0,5,55,0,0,5,58,0,でもなんか今まで結婚についてまともに考えてないんですけど
0,5,58,0,0,6,2,0,でもなんか今まで結婚についてまともに考えたことなさすぎて
0,6,2,0,0,6,6,0,どういう配信にしたらコナンミヤにぴったりのね
0,6,6,0,0,6,10,0,伴侶を見つけることができるのかっていうのがすごい悩んで
0,6,10,0,0,6,13,0,ちょっと皆さんに今回ご意見をね
0,6,13,0,0,6,15,0,いただきたいなと思って
0,6,15,0,0,6,17,0,ラジオのコーナーにさせてもらいました
0,6,17,0,0,6,18,0,うん
0,6,19,0,0,6,23,0,ね、これ前からやろうやろうって言ってて実現できてなかったので
0,6,23,0,0,6,25,0,ちょっと今月末にね
0,6,25,0,0,6,29,0,今月末が結婚記念日になるように頑張りたいと思いますので
0,6,29,0,0,6,31,0,ご協力よろしくお願いしますということで
0,6,31,0,0,6,34,0,早速1通目のふつおた
0,6,35,0,0,6,39,0,ねのなし シューさんお便りありがとうございます
0,6,39,0,0,6,41,0,りょかこさんこんばんは
0,6,41,0,0,6,42,0,こんばんは
0,6,42,0,0,6,44,0,以前のラジオや配信で話されていた
0,6,44,0,0,6,47,0,TikTokを筆頭とした短い動画について
0,6,47,0,0,6,50,0,そういえばと思うものがありましたので投稿します
0,6,50,0,0,6,53,0,それは地上波ラジオの公式切り抜き動画
0,6,53,0,0,6,55,0,アーカイブ配信は前からありましたが
0,6,55,0,0,6,57,0,今年に入ってから
0,6,57,0,0,7,0,0,番組公式でYouTubeチャンネルを開設し
0,7,0,0,0,7,4,0,ダイジェストなどを数分の動画にまとめて投稿しているのを見るようになりました
0,7,4,0,0,7,5,0,うん
0,7,5,0,0,7,8,0,星野源さんのオールナイトニッポンなど
0,7,8,0,0,7,11,0,こういうところがラジオは柔軟で好きだなと思うと
0,7,11,0,0,7,16,0,"同時に1,2時間の番組は当時で聞く人も少なくなっているのかなと思ってしまいます"
0,7,16,0,0,7,19,0,りょかこさんもよくラジオの話をされていますが
0,7,19,0,0,7,22,0,お聞きのラジオでこのような動画を見られたことはありますでしょうか
0,7,22,0,0,7,25,0,というお便りをいただいていました
0,7,27,0,0,7,30,0,これ私も初めて知ったんですけど
0,7,30,0,0,7,33,0,ラジオがそういうショート動画みたいな
0,7,33,0,0,7,41,0,切り抜き文化がラジオの世界まで進出したのかって書いていただいているんですけど
0,7,41,0,0,7,46,0,なんかすごい時代だなと思いますよね
0,7,46,0,0,7,51,0,やっぱり今のコンテンツのあふれかえり具合だと
0,7,51,0,0,7,56,0,長らみできるものかすごく短く要素がまとまっているものかの
0,7,56,0,0,8,1,0,どっちかしか消費されにくいんだなってね
0,8,1,0,0,8,3,0,ちょっとお水飲みます
0,8,7,0,0,8,10,0,切り抜き自体はね多分昔からあると思うんですけど
0,8,10,0,0,8,13,0,公式でもやっぱり出すんだなと思って
0,8,15,0,0,8,18,0,なんかもうテキストでよくない?
0,8,18,0,0,8,23,0,私はねラジオは基本的に作業中に聞く
0,8,23,0,0,8,25,0,本当はよくないらしいんですけどね
0,8,25,0,0,8,27,0,作業中って無音が一番いいらしいんですけど
0,8,27,0,0,8,31,0,寂しいのでねラジオとか音楽とか聞くんですけど
0,8,31,0,0,8,37,0,なんかラジオはやっぱりなんか長ければ長いほど嬉しいんですよね
0,8,37,0,0,8,41,0,さっきの冒頭の発言とちょっと矛盾するような気もするんですけど
0,8,41,0,0,8,46,0,まあ聞いてる側からするとなんか1時間で
0,8,46,0,0,8,48,0,私ハライチのターン好きなんですけど
0,8,48,0,0,8,51,0,ハライチのターンって確か1時間ぐらいで終わるんですよね
0,8,51,0,0,8,56,0,で、あとあれですね
0,8,56,0,0,8,58,0,クリーピーナッツだ
0,8,58,0,0,9,4,0,今もうすごいヒプノシスマイクとクリープハイプが出てきちゃって
0,9,4,0,0,9,7,0,全然たどり着けなかったクリーピーナッツに
0,9,7,0,0,9,10,0,似てないですか?
0,9,10,0,0,9,15,0,クリーピーナッツのオールナイトニッポンも1時間半ぐらいだったはずなんですよね
0,9,15,0,0,9,19,0,だからね、2時間たっぷり聞けるって本当にありがたいですけど
0,9,19,0,0,9,26,0,2時間ないとリアルタイムのお便りってなかなかさばききれないと思うし
0,9,26,0,0,9,29,0,なんか長ければ長いほどね嬉しいです
0,9,29,0,0,9,33,0,作業をしてる間に聞けるのが
0,9,33,0,0,9,37,0,なので個人的にはラジオの切り抜きっていうのがね
0,9,37,0,0,9,42,0,あんまり、どうだろう、能動的に見たいとはあんまり思わないんですけど
0,9,42,0,0,9,45,0,それだったら本編見たいのでね
0,9,45,0,0,9,47,0,好きなラジオ長ければ長いほどいい
0,9,47,0,0,9,49,0,そうなんですよね
0,9,49,0,0,9,52,0,どうですか皆さん
0,9,52,0,0,9,58,0,スペシャルウィークとかでゲスト回あるじゃないですか
0,9,58,0,0,10,1,0,私ゲスト回ね、実はあんまり
0,10,1,0,0,10,7,0,積極的に聞こうって実はあんま思わないタイプなんですよね
0,10,7,0,0,10,10,0,こう、なんだろうな
0,10,10,0,0,10,16,0,普段聞いてるラジオで新しい要素が入るとそっちに耳を取られちゃうんで
0,10,16,0,0,10,19,0,作業中に聞かないかな
0,10,19,0,0,10,23,0,ご飯食べてる時にゲスト回とか聞くタイプなんですよ
0,10,23,0,0,10,28,0,だからこう、多少この辺り聞いてなくても
0,10,28,0,0,10,30,0,別の作業に集中してても
0,10,30,0,0,10,35,0,耳慣れてるからだいたい脳内で保管できるみたいな
0,10,35,0,0,10,41,0,そう、だからね、ゲスト回もゲスト回で好きなんですけど
0,10,41,0,0,10,43,0,そっちは結構集中して聞くので
0,10,43,0,0,10,48,0,作業中はね、普段のね、いつも通りのラジオが好きですね
0,10,48,0,0,10,54,0,ゲストだけの話、来てくれてるゲストにちなんだ話になるから
0,10,54,0,0,10,57,0,割とクリビナッツさんとかだと結構
0,10,57,0,0,11,3,0,ヒップホップの方がゲストに来ると結構コアな話になりがちなんで
0,11,3,0,0,11,8,0,割と調べながら、曲聴いたりとかしながら見たい、聞きたいじゃないですか
0,11,8,0,0,11,10,0,そう、っていうのがあるんでね
0,11,10,0,0,11,14,0,私は割と普段のラジオも好きです
0,11,14,0,0,11,16,0,ゲスト回も好きだけど
0,11,16,0,0,11,20,0,うん、なんでやっぱり長ければ長いほど嬉しいんで
0,11,20,0,0,11,22,0,うん、あんま切り抜き見ないけど
0,11,22,0,0,11,25,0,でもあれだな、あのー
0,11,25,0,0,11,28,0,好きなラジオのこれ神回だったな
0,11,28,0,0,11,31,0,このシーン好きだったなーってやつは見たい
0,11,31,0,0,11,33,0,っていう気持ちもわかる
0,11,33,0,0,11,35,0,この間TikTok見てたら
0,11,35,0,0,11,39,0,あのー、星野源さんのオールナイトニッポンに
0,11,39,0,0,11,42,0,若林さん、オードリーの若林さんが来たときの
0,11,42,0,0,11,45,0,ついこの間かな、結構最近だと思うんですけど
0,11,45,0,0,11,47,0,あのー、この回のね
0,11,47,0,0,11,51,0,あのその、多分若林さんがラップしたところが
0,11,51,0,0,11,54,0,あのー、切り抜かれてて上がってて
0,11,54,0,0,11,56,0,これ何回も見たくなる
0,11,56,0,0,11,57,0,うん
0,11,57,0,0,12,0,0,何の曲歌ってたか忘れたんですけど
0,12,0,0,0,12,2,0,若林さんって本当に
0,12,2,0,0,12,5,0,あの、ラップ上手ですよね、めちゃくちゃ
0,12,5,0,0,12,7,0,そう、すごいかっこよかったんでね
0,12,7,0,0,12,10,0,もしまだ聞いてないっていう方いらっしゃいましたら
0,12,10,0,0,12,15,0,星野源さんの若林さんゲスト回、神回だったので
0,12,15,0,0,12,17,0,よかったら聞いてみてください
0,12,17,0,0,12,20,0,ということで、ねのなししゅーさんお便りありがとうございました
0,12,20,0,0,12,21,0,うん
0,12,23,0,0,12,26,0,では次、匿名の方からの普通歌
0,12,27,0,0,12,29,0,こんばんは、こんばんは
0,12,29,0,0,12,33,0,私はVTuberは好きですが、現実のアイドルには興味がありませんでした
0,12,33,0,0,12,37,0,しかし最近になって、オーラさんのように強く推せるアイドルができました
0,12,37,0,0,12,40,0,アイドルかどうかはまあ去っておきね
0,12,40,0,0,12,44,0,それは新しい学校のリーダーズです
0,12,44,0,0,12,47,0,セーラー服を着て全力で踊る姿はぶっ飛んでいて最高でした
0,12,47,0,0,12,49,0,特にメンバーの鈴香さんが
0,12,49,0,0,12,52,0,メガネで高身長でキレッキレな感じがルカ子さんを放出させました
0,12,52,0,0,12,53,0,恐縮ですね
0,12,53,0,0,12,55,0,まだまだアイドルの世界は知らないので
0,12,55,0,0,12,58,0,ルカ子さんの最近の印象に残ったアイドルについて話していただけると
0,12,58,0,0,13,0,0,嬉しいです
0,13,0,0,0,13,2,0,ということでお便りいただいてました
0,13,4,0,0,13,7,0,TikTokでよく見るって書いてくれてる方いるんですけど
0,13,7,0,0,13,9,0,私もね
0,13,9,0,0,13,12,0,こちらの新しい学校のリーダーズさん
0,13,12,0,0,13,14,0,TikTokでめっちゃ見たことあったので
0,13,14,0,0,13,19,0,普通にそのTikTokに上げてる普通の女子高生だと思ってたんですよ
0,13,19,0,0,13,21,0,めちゃくちゃダンスの上手い
0,13,21,0,0,13,23,0,そしたらアイドルでした
0,13,23,0,0,13,26,0,今日これでね、なんか繋がりましたね
0,13,26,0,0,13,28,0,アイドルだったんだ
0,13,28,0,0,13,30,0,新しい学校のリーダーズさんって思って
0,13,30,0,0,13,33,0,お便りいただかなかったらずっと気づかなかったかも
0,13,35,0,0,13,39,0,でね、最近気になってるアイドルで言うと
0,13,40,0,0,13,44,0,AKB48さんが
0,13,44,0,0,13,47,0,8月ぐらいに出してたね
0,13,47,0,0,13,50,0,デモハムルーマーって曲があるんですよ
0,13,50,0,0,13,54,0,で、これ前もツイートしたことあるかもしれないんですけど
0,13,54,0,0,13,58,0,AKBさん、いい意味でぽくないというか
0,13,58,0,0,14,1,0,ダンスがめちゃくちゃ激しくて
0,14,2,0,0,14,5,0,私が知ったきっかけも
0,14,5,0,0,14,9,0,前TIFF東京アイドルフェスティバルっていうイベントに出させてもらったときに
0,14,9,0,0,14,12,0,オドっていう曲を歌って踊ったんですけど
0,14,12,0,0,14,15,0,それの振り付けをもとにさせてもらった
0,14,15,0,0,14,17,0,CHEGOさんっていうチャンネルがあって
0,14,17,0,0,14,19,0,ダンスがバケバケに上手い
0,14,19,0,0,14,22,0,3人の方のチャンネルなんですけど
0,14,22,0,0,14,26,0,その方たちがね、デモハムルーマー踊ってて
0,14,26,0,0,14,28,0,すげー激しいな
0,14,28,0,0,14,32,0,これ誰の曲カバーしたんだろうと思ってみたらAKBさんだったんですよね
0,14,32,0,0,14,38,0,で、AKB48のダンスって最近こんなに激しいんだ
0,14,38,0,0,14,41,0,かっこいいなと思って見て
0,14,41,0,0,14,46,0,めちゃくちゃね、日々の生きる糧をいただいてますね
0,14,46,0,0,14,48,0,アイドルには
0,14,48,0,0,14,50,0,見たことあった?
0,14,50,0,0,14,52,0,そう、YouTubeにね
0,14,52,0,0,14,54,0,結構いろんなダンスのパターンが上がってるので
0,14,54,0,0,14,56,0,よかったら見てみてください
0,14,56,0,0,15,3,0,なんかほんとにアイドルを見ないとダメな日っていうのが
0,15,3,0,0,15,5,0,まぁあるじゃないですか
0,15,5,0,0,15,7,0,わかんないけど
0,15,7,0,0,15,10,0,他の人にもあるのかどうかわからないけど
0,15,10,0,0,15,15,0,今日はもうダメだわみたいな日があるときは
0,15,15,0,0,15,17,0,それとあと
0,15,17,0,0,15,21,0,あとはね、桃黒とか
0,15,21,0,0,15,25,0,なんだっけ、モテキっていう映画があるんですよ
0,15,25,0,0,15,29,0,森山ミライさんが主演してたと思うんですけど
0,15,29,0,0,15,32,0,モテキっていう映画の中で
0,15,32,0,0,15,36,0,桃黒さんの走れっていう曲が使われてるんですけど
0,15,36,0,0,15,39,0,笑顔が止まらない
0,15,39,0,0,15,42,0,ふんふんふんふん止まらない
0,15,42,0,0,15,45,0,ふんふんふんふんふんふんふんふんふん
0,15,45,0,0,15,49,0,走れ走れ走れっていう曲でめっちゃいい曲なんだけど
0,15,49,0,0,15,52,0,なんかそこでね
0,15,52,0,0,15,57,0,アイドルの曲に元気づけられて後押しされるようなことはしない方がいいみたいな
0,15,57,0,0,16,1,0,そういう資源が確かあったような気がするんだよな
0,16,1,0,0,16,4,0,あれ結構胸にきましたね
0,16,4,0,0,16,8,0,走れはね、すごいいい曲なんですよ
0,16,8,0,0,16,10,0,ただやっぱりね、それでなんか
0,16,10,0,0,16,13,0,うわぁ今やんなきゃダメだって言って焦ると
0,16,13,0,0,16,17,0,いいことないなみたいな感じの映画だった気がする
0,16,19,0,0,16,21,0,そうそうそうそう
0,16,21,0,0,16,24,0,モテキね、すごい面白かった
0,16,25,0,0,16,28,0,この間シュガーリリックさんのライブがあったじゃないですか
0,16,28,0,0,16,30,0,あのー
0,16,30,0,0,16,32,0,セカンドライブが
0,16,32,0,0,16,35,0,シュガーリリックさんのセカンドライブで
0,16,35,0,0,16,36,0,なんだっけあれ
0,16,36,0,0,16,39,0,今夜はブギーバックをね歌われてたんですけど
0,16,39,0,0,16,47,0,モテキの中で今夜はブギーバックが挿入歌として出てくるんですよね
0,16,47,0,0,16,51,0,それもねめちゃくちゃかっこよかった
0,16,52,0,0,16,54,0,サブカル好きには小ネタ豊富で楽しい
0,16,54,0,0,16,55,0,そうなんですよね
0,16,55,0,0,17,0,0,結構ね、いわゆる音楽好きな方とか
0,17,0,0,0,17,3,0,そういうサブカルっぽい趣味がね
0,17,3,0,0,17,7,0,元々お好きな方にはさせる部分が多いんじゃないかなと思いますね
0,17,7,0,0,17,9,0,そう漫画原作のね
0,17,9,0,0,17,11,0,あれ原作誰だっけ
0,17,11,0,0,17,13,0,漫画
0,17,13,0,0,17,14,0,あれ
0,17,14,0,0,17,16,0,久保美音部だ
0,17,16,0,0,17,19,0,久保美音部のどなたかだった気がするな
0,17,19,0,0,17,21,0,久保光郎さんだったっけ
0,17,21,0,0,17,22,0,うん
0,17,23,0,0,17,25,0,ちょっと間違ってたら申し訳ないんですけど
0,17,25,0,0,17,27,0,めちゃくちゃいい映画だった覚えが
0,17,27,0,0,17,29,0,あっ久保光郎さんだったでそう
0,17,29,0,0,17,31,0,めちゃくちゃ面白かったんで
0,17,31,0,0,17,33,0,よかったら見てください
0,17,33,0,0,17,34,0,ということで
0,17,34,0,0,17,38,0,新しい学校のリーダーズさん探したらYouTubeのチャンネルもあったのでね
0,17,38,0,0,17,40,0,ダンスすごいかっこよかったので
0,17,40,0,0,17,43,0,私もちょっと、もうちょっと見てみたいと思います
0,17,43,0,0,17,44,0,うん
0,17,45,0,0,17,46,0,では
0,17,46,0,0,17,48,0,えー
0,17,48,0,0,17,50,0,こちら最後のね
0,17,50,0,0,17,51,0,普通歌
0,17,51,0,0,17,52,0,あー
0,17,52,0,0,17,53,0,悪くないペース
0,17,53,0,0,17,54,0,はい
0,17,54,0,0,17,56,0,ルカコさんこんばんは
0,17,56,0,0,17,57,0,こんばんは
0,17,57,0,0,17,58,0,近況報告です
0,18,0,0,0,18,2,0,塩昆布さんからのお便りです
0,18,2,0,0,18,4,0,ありがとうございます塩昆布さん
0,18,4,0,0,18,5,0,うん
0,18,5,0,0,18,6,0,えー
0,18,6,0,0,18,9,0,お付き合いしている最近サメ気味の彼氏に
0,18,9,0,0,18,11,0,1週間ぶりくらいに電話したのですが
0,18,11,0,0,18,13,0,ほどほどに会話した後
0,18,13,0,0,18,14,0,彼の
0,18,14,0,0,18,16,0,俺って仕事できるから
0,18,16,0,0,18,18,0,アピールを何度もされて
0,18,18,0,0,18,20,0,はいはいみたいな感じで
0,18,20,0,0,18,22,0,接してしまったんですよ
0,18,22,0,0,18,24,0,正直だいぶうんざりしています
0,18,24,0,0,18,26,0,そしたら急に声が小さくなって
0,18,26,0,0,18,28,0,話もしなくなって
0,18,28,0,0,18,30,0,そろそろ切るってなった時に
0,18,30,0,0,18,31,0,ねえ
0,18,31,0,0,18,34,0,人間が一番楽に死ねる死に方って知ってる?
0,18,34,0,0,18,35,0,って聞かれて
0,18,35,0,0,18,37,0,急に悩ねんと思ったので
0,18,37,0,0,18,39,0,知らんわって言ったら
0,18,39,0,0,18,41,0,酒に溺れることらしいで
0,18,41,0,0,18,43,0,って言われたんですよ
0,18,43,0,0,18,46,0,へえそうなんやって普通に思ってたんですけど
0,18,46,0,0,18,49,0,電話切る前に言われるの怖くないですか?
0,18,49,0,0,18,50,0,うん
0,18,50,0,0,18,52,0,めっちゃ怖いね
0,18,52,0,0,18,54,0,その後妹でその話をしたら
0,18,54,0,0,18,56,0,そりゃちゃうわ
0,18,56,0,0,18,58,0,ゲロのどに詰めて死ぬからしんどいで
0,18,58,0,0,18,59,0,と言われて
0,18,59,0,0,19,0,0,なるほどなってなりました
0,19,0,0,0,19,2,0,特にうちはないですってね
0,19,2,0,0,19,4,0,お便りをいただきました
0,19,4,0,0,19,5,0,うん
0,19,5,0,0,19,8,0,多分なんか寂しかったんだろうね
0,19,8,0,0,19,11,0,なんかあれなんか心配
0,19,11,0,0,19,13,0,もっと心配してほしいのに
0,19,13,0,0,19,16,0,っていう気持ちがそうさせてしまったのかもしれない
0,19,16,0,0,19,19,0,あとね妹さんがすごいいい
0,19,19,0,0,19,21,0,そりゃちゃうわ
0,19,21,0,0,19,23,0,ゲロのどに詰めて死ぬからしんどいで
0,19,23,0,0,19,24,0,ねえ
0,19,24,0,0,19,26,0,言ってくれてる妹さんがすごい面白いですね
0,19,26,0,0,19,27,0,うん
0,19,27,0,0,19,32,0,人間が一番楽に死ねる死に方って何なんですかね
0,19,32,0,0,19,34,0,なんか
0,19,34,0,0,19,36,0,スイスかどこかに
0,19,36,0,0,19,38,0,どこだ
0,19,38,0,0,19,40,0,その辺のヨーロッパのどこかの国で
0,19,40,0,0,19,42,0,安楽死が
0,19,42,0,0,19,43,0,一応その
0,19,43,0,0,19,46,0,医師に許可もらえたらOKみたいなね
0,19,46,0,0,19,48,0,国が確かあったと思うんですけど
0,19,48,0,0,19,50,0,浪水か
0,19,50,0,0,19,51,0,うん
0,19,51,0,0,19,53,0,なんかねそれで
0,19,53,0,0,19,56,0,もし将来的に安楽死を望もうという方は
0,19,56,0,0,19,58,0,英語を勉強してた方がいいみたいな記事を
0,19,58,0,0,20,0,0,読んだことあるんですよね
0,20,0,0,0,20,1,0,なんか
0,20,1,0,0,20,4,0,その国でその医師との面談があって
0,20,4,0,0,20,6,0,その医師が
0,20,6,0,0,20,9,0,まじゃあ安楽死の許可を出しますと出してもらえたら
0,20,9,0,0,20,11,0,その処置を受けられるんですけど
0,20,11,0,0,20,13,0,そのやりとりが全部英語なんで
0,20,13,0,0,20,15,0,でその医師に対して
0,20,15,0,0,20,18,0,私はこういう理由で安楽死を望んでいます
0,20,18,0,0,20,21,0,っていうのをちゃんと説明できるだけの英語力がないと
0,20,21,0,0,20,25,0,許可してもらえないからまず英語を勉強しようっていう
0,20,25,0,0,20,27,0,ただなんか将来的に
0,20,27,0,0,20,29,0,まあ将来的にというか今すぐ
0,20,29,0,0,20,32,0,その処置をしてほしいと思っている方が
0,20,32,0,0,20,34,0,じゃあ英語を勉強しようっていう
0,20,34,0,0,20,39,0,そんなやる気がある方ばかりではないのではないかなっていうね
0,20,39,0,0,20,40,0,うん
0,20,40,0,0,20,43,0,そうそう英語を勉強するくらいならって
