start_s,end_s,text
1547,1549,3時間ぐらい教えてもらって
1549,1554,オープニング作った覚えがありますこれね
1554,1556,あれなんなんでしょうね
1556,1558,なんであんなにわかりにくいんだろう
1558,1563,たぶんあのおそらくその初心者が一生使わないだろう
1563,1567,あらゆる多機能が詰まりに詰まった結果
1567,1573,ああいうその複雑なUIになってるんだろうなと思うんですけど
1573,1578,だからねまあこれやっぱあれもしたいこれもしたいみたいなのが
1578,1581,そういう需要に応えてくれる仕様なんだろうなと思いつつ
1581,1583,初心者には優しくないですよね
1583,1588,いやそう初めて作ったやつですね
1588,1590,本当素材サイト様々なんでね
1590,1593,あと七石さん様々でしたありがとうございました
1593,1596,ミレニアム検証問題いいですね
1596,1601,私あの小っちゃい頃の夢がね暗号解読者だったんですけど
1601,1603,暗号解読者になるためにはね
1603,1607,数学科を出てないといけないっていうのを何かで読んで諦めたんですよね
1607,1613,だからこれからねなんかそういういろんな検証問題とか
1613,1617,これはもう解き明かすのが不可能だったって思われてた
1617,1621,そういうね数学の問題が解かれていくっていうのは
1621,1623,すごいロマン溢れてるなと思いました
1623,1627,お便りありがとうございます
1627,1631,チューリング暗号といえばサマーウォーズ
1631,1635,確かにサマーウォーズもねあれ暑いですもんね
1635,1639,数学オリンピック出てるって説でしたっけ主人公が
1639,1644,では次のお便り
1644,1647,でもお再びさんお便りありがとうございます
1647,1651,千恵里ちゃんとのコラボでハロプロというワードを聞いてから
1651,1654,ももちとボーノが時折僕の脳裏に現れます
1654,1658,出会ってからライブに行く間もなく引退したあの二つ結びが
1658,1660,ラストライブのステージに消えていくのを
1660,1663,テレビ越しに見送った数年前を思い出します
1663,1666,その時の僕は他のアーティストのオタクをやっていたのもあって
1666,1669,ももちにドハマりしたというわけではありません
1669,1673,でも間違いなく僕の中で過去現在そして未来の中で
1673,1677,一番のアイドルだったであるであり続けるだろうという
1677,1681,確信めいた気持ちを何の根拠もないのに持っていたのを覚えています
1681,1686,懐かしさと懐かしさ半分悲しさ半分どこからか
1686,1689,湧き上がるこの感覚こそが何よりの証明なのでしょう
1689,1694,やつ当たり半分患者半分のかき散らしでしたごめんというね
1694,1698,お便りをいただいてました
1699,1704,先日ねあのアニマルの私の先輩である橋場なぞみさんの
1704,1708,卒業がね発表されまして
1708,1715,私はあの私は皆さんより少し早く知っていたんですけど
1715,1723,あのお知らせをね見た瞬間に今までのあらゆるあの推しの
1723,1728,あの大切なお知らせがフラッシュバックして
1728,1733,これは本当なぞみさんのお知らせどうこうではなく
1733,1739,もう完全にそのトラウマが蘇ってむちゃくちゃ吐きそうでした
1739,1743,本当にねあのもちろんね
1743,1747,もちろんその今までの私の
1747,1751,私が応援してたアイドルも
1751,1757,もちろんなぞみさんも本人がね悩んで悩んで出した結論だと思いますし
1757,1762,もう応援している側でもうそれをその
1762,1767,なんだろう気持ちよく卒業できるように
1767,1773,見送ることしかできないっていうのはもう分かりきってるんですけど
1773,1779,それとは全く別の感覚期間でもうダメなんですよね
1779,1785,そういや本当にねあの
1785,1791,いやしんしんどいですよねあの大切なお知らせは
1791,1799,私一度あのツイッターでねあの通知入れてくれてる方が
1799,1805,あのポップアップなのかなその少しそのツイート
1805,1809,通知入れてるツイートがされましたみたいな感じで
1809,1813,ポップアップでツイートの中身が出るっていうのを知らなくて
1813,1815,大切なお知らせです
1815,1821,あのすしろうの大トロ祭りが8月1日までですみたいなツイートをした時に
1821,1824,その大切なお知らせの部分しかそのポップアップされなくて
1824,1827,肝が冷えましたってリプライをもらった時に
1827,1832,本当にとんでもないことをしてしまったなっていう後悔があるんですけど
1832,1837,それ知らなくてそうねあのツイート
1837,1841,ツイートが全部表示されると思ってたんですけども
1841,1845,その一部だけ切り取ってお知らせがいくと思ってなくて本当にね
1845,1848,大変なことをしちゃった時があったんですけど
1848,1851,ギルティーですよね本当すいませんあの気をつけます今後ね
1851,1857,あのちょっとみんな大トロを食べてほしくて
1857,1859,トロだよっていうお知らせをしたくてね
1859,1863,そんなフォーマント使ってしまったんですけど
1863,1865,でね
1865,1866,あのー
1866,1873,もちろんその14日にね橋場夏実大好きVTuberの企画もあって
1873,1878,いろんなその今のねあの思いとかはそこで
1878,1881,たくさんお話しさせてもらおうと思っているので
1881,1888,これはあの私の今までのそのお知らせが卒業した時の
1888,1890,あの精神
1890,1892,精神状態
1892,1897,いや私ね正直そんなにあのめちゃくちゃ一人にのめり込むっていうか
1897,1902,もうあのそのグループで箱押しみたいな部分が大きいので
1902,1909,まだねそんなにそのとんでもないもうどこへ学校にも行けないみたいな
1909,1912,スマートフォンも開けないみたいなことは
1912,1919,まあそれほどないんですけどやっぱり周りにはそういう方もね多かったので
1919,1921,これからねあの
1921,1924,またなんだろうな
1924,1930,ふとねふとした時にやっぱり例えば次のシングル出た時に
1930,1935,あそうだもうあの子いないんだとかなんか
1935,1939,新しいね曲聴いてて
1939,1942,あそうだ歌割りないんだなぁみたいな
1942,1948,そういうねそういうのがこれからあるんだなぁ
1948,1950,って思うと本当に
1950,1956,あのまた吐きそうになってきたんで
1956,1959,そうあの皆さんもちょっと
1959,1962,吐かないように
1962,1966,精神の安定をともに
1966,1968,測っていきましょう
1968,1970,はいということで
1970,1973,ちょっとね頭がガンガンしてきたんで
1973,1977,次のねコーナーに行きたいと思います
1977,1981,はい
1981,1985,次はですねアニマーレメンバーへのラブレターということで
1985,1989,はい
1989,1992,ジングルとかを流したいと思います
1992,1994,はい
1994,2000,今週のメールテーマ
2000,2002,今週のメールテーマを
2002,2006,はいアニマーレメンバーへのラブレター
2006,2009,大音読フェスティバル第2回ということでね
2009,2012,前回も本当に名作が目白押しだったので
2012,2015,今回もとても楽しみにしていたんですが
2015,2017,あのびっくりするほどね
2017,2019,あのエモーなやつと
2019,2021,ツイートもしたんですけど
2021,2023,エモーなやつとエッチのきいたやつのね
2023,2029,楽さがまあすごかったです
2029,2035,早速ね1通目から読ませていただきたいと思いますね
2035,2038,津田さんで大丈夫かな
2038,2044,津田さんのアニマーレメンバーへのラブレター
2044,2046,セシマへ
2046,2052,あなたの笑顔と企画やゲームなどの配信活動を楽しんでいる姿が可愛く
2052,2055,日々大変癒されております
2055,2057,そして皆さんも見られたと思われますが
2057,2060,歌謡祭の映像や過去の歌見た動画などの
2060,2063,すべての作品に対するこだわり
2063,2068,例えば作詞家さんの歌詞の意味も考えて歌い方を変えたりなど
2068,2071,あげたらキリがないほどすごくこだわって
2071,2074,見た人が感動する作品を作ってくれており
2074,2077,いつも冗談で壁とか言っていますけど
2077,2082,本当に器用で多才なあなたのことを本当に尊敬しています
2082,2087,これからもVTuber兼Vシンガー兼Vクリエイターとして
2087,2089,さらなる発展を応援しておりますので
2089,2092,これからも頑張ってください
2092,2094,本当に大好きです
2095,2097,ということでね
2097,2099,いやー今回もね
2099,2102,セシマさんは人気です
2102,2103,本当にね
2103,2108,なんかルイさんってやっぱりこういうのは直接ね
2108,2115,自分に対して言われるのがもしかしたらちょっとあんまり苦手だったりするところも
2115,2118,あるのかなと思うんですけど
2118,2120,その反動なのかね
2120,2125,これはこういうラブレター募集のフォームにね
2125,2128,ルイさん宛てのお便り多いんですよね
2131,2132,そう
2132,2135,求められてるのはお得に優しいギャルなんだな
2136,2138,でもいちかさんも言ってたけど
2138,2140,ルイさんってさーって
2140,2142,タメ口聞いちゃった
2142,2144,ルイさんはなんかギャル
2144,2147,ギャルなのかな
2147,2150,なんかギャル味ももちろんあるんですけど
2150,2152,あのーなんだろうな
2152,2156,普通にそのクラスのすごい明るい女の子みたいな
2156,2159,ほんと性ヒロインって感じでね
2159,2161,人気なんですよ
2161,2163,Googleフォームにも
2165,2166,はいということでね
2166,2169,ルイさん宛てのお便りは他にもたくさん
2169,2174,かなりね真摯なルイさん宛てのお便りをたくさんいただいてましたね
2174,2177,エモの方が多かった気がする
2177,2178,はい
2178,2180,えーということで
2180,2183,次のラブレターをね
2183,2185,読んでいきたいと思います
2186,2192,いやー結構ね長文のお便りもいただいてるんですよね
2192,2195,そう時間がね許せば読みたいです
2197,2199,あははこれ
2199,2202,えー
2202,2230,ガスマッチョさんのアニメの例のラブレター
2232,2235,お姉ちゃんの方を見てても心配しちゃうな
2235,2238,お兄ちゃん少しでもルカ子の力になれればと思って
2238,2240,会社のメールで社員全員に
2240,2243,大浦ルカ子の宣伝をしておいたぞ
2244,2249,そういえばルカ子は角のことお酒のこと特に仲がいいみたいだね
2249,2252,友達をちゃんと作れててお兄ちゃん嬉しいよ
2252,2257,ところで白宮ミミちゃんとはまたコラボしないのか
2257,2260,ゲームでの他人数コラボはよくしてるけど
2260,2263,お菓子みたいなトーク企画がまた見てみたいな
2263,2265,決して下心はないけど
2265,2268,ミミちゃんの好みの男性のタイプとか聞いてほしいし
2268,2271,あわよくば連絡先も聞き出してほしいな
2271,2275,あ勘違いするようなこと言っちゃってごめんね
2275,2278,お兄ちゃんは純粋にルカ子の配信が好きなだけだよ
2278,2281,そうだ今度スチローに連れてってあげる
2281,2284,ルカ子はスチローが大好きだったもんな
2284,2286,あ友達連れてきてもいいぞ
2286,2288,ただもしミミちゃんが来るなら
2288,2292,高級フレンチに連れてってやるからな
2292,2294,長くなってごめん
2294,2296,体壊さないように気をつけるんだぞ
2296,2298,これからも応援してるよ
2298,2300,お兄ちゃんより
2300,2302,おつみみ
2302,2305,お便りをいただきます
2305,2307,ちょっとお水飲みますね
2307,2310,あはははは
2312,2315,いやめちゃくちゃミミさん推しですね
2315,2317,うちのお兄ちゃん
2317,2320,びっくりしちゃったルカ子
2320,2323,お兄ちゃんがミミさん推しで
2323,2327,なんかミミさん推しっていうのがちょっとリアルでやだわ
2327,2329,お兄ちゃん
2329,2332,あはははは
2332,2335,なんか本当はこういう妹が良かったなって
2335,2337,思ってるんでしょお兄ちゃんも
2337,2338,ねえ
2338,2341,こうなんか
2341,2344,こういうなんかテンションが上下せず
2344,2346,なんかランサーにドッキリにかけられても
2346,2349,なんか逆にこういうなんか
2349,2352,企画で片っ端からアニマル呼んで
2352,2355,ビビらせる動画撮ったらいいんじゃないですかみたいな感じで
2355,2357,あの本当何にも面白くない
2357,2360,ドッキリにかけて一番つまんない反応する妹よりも
2360,2362,ちゃんとなんかホラーだってなったら
2362,2365,絶叫してくれる妹が良かったんでしょお兄ちゃんもね
2365,2366,うん
2366,2368,やだやだ
2368,2371,ねえあの私ランサーにドッキリかけてもらったんですけど
2371,2372,この間
2372,2374,そうで
2374,2377,動画あのランサーのチャンネルで上がってるんでね
2377,2379,もし良かったら見てほしいんですけど
2379,2382,あの途中であのドッキリだなっていうのが
2382,2385,あの分かったのにも関わらず
2385,2388,あんまりねなんかそこからこうブレーキを
2388,2391,ブレーキかアクセルかけられなくて
2391,2394,あはははは
2394,2397,なんか本当ね
2397,2399,あの良くなかったな
2399,2402,ドッキリかけられ甲斐のない人間だなと思ってね
2402,2405,反省しましたうん
2405,2407,その点やっぱねミミさんはちげーよな
2407,2411,ほんとミミさんめちゃくちゃ気持ちいい絶叫してましたからね
2411,2414,なんか悲鳴のSEに対して悲鳴で返してたんでね
2414,2417,あはははは
2417,2418,ね
2418,2420,そうあれねあのドッキリ
2420,2424,まあ見てくれた方は分かるかもしれないんですけど
2424,2425,あのね
2425,2427,私あの
2427,2431,イズミさんにドッキリかけるとき
2431,2434,あのドッキリそのいわば仕掛け人がね
2434,2438,ランさんとイチカさんで私が呼ばれて行って
2438,2440,でまあその一悶着あった後に
2440,2442,じゃあ次イズミさんにかけようってなったんですよ
2442,2445,でなぜか知らないけどなんか
2445,2447,私も行ってそこに
2447,2450,でイズミさんのドッキリかけ終わった後に
2450,2452,なんか
2452,2454,イズミさんまたその次に残らされそうになってて
2454,2459,あこれ取れ高がなかったら残されるっていうシステムなのかなーって
2459,2461,思いました本当にね
2461,2462,あれ本当
2462,2465,反省が残るドッキリでした
2465,2467,ということで
2467,2470,次のねラブレター読みたいと思います
2470,2473,あはははは
2473,2476,はい
2476,2482,次CDモグモグクラブさんのアニマルメンバーへのラブレター
2482,2484,ミヤへ
2484,2486,でね
2486,2488,この前一面でランはいったときさ
2488,2490,ミヤに3000円貸したやん
2490,2492,あれそろそろ返してや
2492,2493,わら
2493,2495,いや別に今日じゃなくていいけど
2495,2496,わら
2496,2497,あそうそう
2497,2499,来週の月曜空いてる?
2499,2501,よかったら飯行かね
2501,2502,わら
2502,2503,え
2503,2504,ダメか
2504,2506,じゃあまた今度行こう
2506,2508,とりあえず近いうち3000円返してな
2508,2509,わら
2509,2511,リョータより
2511,2513,え
2513,2517,いやリアリティあるな
2517,2519,実際そういうライン来てそう
2519,2521,うん
2521,2523,田舎のヤンキーカップルかな
2523,2526,あはははは
2526,2528,いやリョータくんさ
2528,2529,あのリョータくんがね
2529,2532,すごいいい味出してるなと思うんすよ
2532,2534,絶対あのミヤ
2534,2536,ミヤのこと好きじゃん
2536,2537,そうで
2537,2539,ミヤのこと好きで
2539,2543,高校生ぐらいかな中学か高校生ぐらいで
2543,2545,多分なんかねグループ仲いいんですよ
2545,2547,ダンジョンね混合グループで
2547,2549,ででもなんかそのまだ
2549,2552,そんな付き合うとかの距離感じゃないっていうか
2552,2554,まだみんなで遊んでる方が楽しいぐらいの
2554,2557,あの温度感なんだけど
2557,2559,なんかそろそろね
2559,2560,夏だし
2560,2564,なんか今度2人で遊びに行きたいなみたいな
2564,2566,口実をさ
2566,2568,探ってるよねリョータくんね
2568,2569,うん
2569,2571,リョータこれは理測な500円
2571,2573,あはははは
2573,2575,リョータ理測もらったよ
2575,2577,そういうね
2577,2579,ものすごいねリアリティのあるね
2579,2582,しみじみといいラブレターをいただきました
2582,2585,3000貸したのもリョータなりの計算だったんだろうな
2585,2588,うわーいいなリョータ
2588,2590,リョータ頑張ってね
2590,2593,なんかミヤチの趣味はあんまりよくわかんないけど
2593,2595,うまくいくことをね
2595,2597,個人的にも祈ってます
2597,2599,うん
2599,2601,ミヤチはね
2601,2604,実は自分のことに関してはあんまり気づかなそうだけど
2604,2606,どうなんですかね
2606,2608,あはははは
2608,2610,3000円返してやもさなんか口実じゃなくて
2610,2613,普通にうわーこいつなんか3000円で何回も行ってきて
2613,2616,なんかセコいタイプなのかなーとか
2616,2618,思いそうで心配だけどねリョータ
2618,2621,うん頑張ってね
2621,2623,ということで
2623,2625,素敵なラブレターなのか
2625,2626,ラブレターか
2626,2628,まある種ありがとうございました
2628,2631,いいね解像度高まりましたリョータの
2634,2639,クセの強いアイコンさんのアニマルメンバーへのラブレター
2639,2641,チロル先生
2641,2644,3年間どうもお世話になりました
2644,2647,このトワイライトスクールに通えてよかったです
2647,2651,黒板の上の方に手が届かなくて台を使っている先生も
2651,2655,廊下にプリントぶちまけてみんなに拾ってもらってる先生も
2655,2657,定期テストの監督なのに寝てた先生も
2657,2661,教室のドアを正面だと角が引っかかって通れないからって
2661,2665,いつも横になって通ってる先生も
2665,2668,たまにそれを忘れたドアに角を引っかけている先生も
2668,2671,学園祭で飾り付けられていたのを忘れたまま
2671,2674,閉会式の壇上に上がって爆笑された先生も
2674,2678,音楽祭で誰よりも気合入って準備や練習指導頑張っていた先生も
2678,2682,体育祭で応援に力を入れすぎて角が取れた先生も
2682,2685,卒業式で誰よりも号泣していた先生も
2685,2688,全部全部愛おしかったです
2688,2693,今はまだ無理だけど海外で手術できたら迎えに行きます
2693,2695,その時まで待っていてください
2695,2697,大好きな千春先生へ
2697,2702,というね素敵なラブレターですね
2702,2708,海外でのね手術まで視野に入れているというね
2708,2711,あのトワイライトスクールの生徒さん
2711,2717,真面目なねいい生徒さんもお持ちですね千春先生もね
2717,2721,エピソードの濃度よ
2721,2725,いやこれ本当にね全てのエピソードがね
2725,2731,この角がね引っかかるからいつも蟹歩きで教室に入ってきた先生
2731,2736,そしてたまにそれを忘れてドアに引っかかる先生
2736,2738,生徒に飾り付けられる先生
2738,2740,卒業式で号泣する先生
2740,2744,もう全てがもういやそれあったわ
2744,2747,確かにあったそんなことあったなっていうね
2747,2753,まざまざと脳裏に浮かぶような素敵なエピソードでしたね
2753,2755,マジそうディティールがありそう
2755,2756,そうそうあったな
2756,2761,いや本当にあった千尋先生っていつもそんな感じだったけどさ
2761,2766,なんだかんだみんな千尋先生のこと大好きだったよね
2766,2771,うわまた泣いてるわ千尋先生が
2771,2773,なんで俺らより先に泣くの千尋先生
2773,2777,いけんだけど卒業するのはこっちなんだけどね
2777,2784,ということでね千尋先生への素敵なラブレターありがとうございました
2784,2790,お辞儀して相手に角くらわすこともあったねありそう
2790,2798,月ノ木先生って呼びなさいありそうっていうかあった
2798,2801,あったわあったわあったわ
2801,2805,おはよう千尋先生今日も角尖ってんね
2805,2809,月ノ木先生って呼びなさいっていつも言ってるでしょ
2809,2815,あったわありました
2815,2817,あったねほんとね
2817,2822,次のお便り読みたいと思います
2822,2826,みやちキャットさんお便りありがとうございます
2826,2831,コナンみやさんへ普段ひどいこと言ってごめんね
2831,2835,照れ隠しでいじめたくなっちゃう子供っぽい俺を許してくれるかな
2835,2839,でも君の反応が可愛いのが悪いんだぞ
2839,2844,いつも楽しそうに配信してるけど悩んだこともあるって言った時ちょっと泣いてたね
2844,2849,大丈夫だよどんな時もずっと俺は応援するから笑っていてほしい
2849,2854,自信を持って頑張って今まで言葉にして伝えたことはなかったけど
2854,2859,本当に愛してるよ千尋
2859,2862,そうよねお便りでした
2862,2867,あのねなんかコナンみや宛てのねお便りなんですけど
2867,2872,全部なんか落ち着いてるんだよな全部本当に
2872,2880,1から10までちゃんとしたガチのエモレタはいつもなかった
2880,2884,コナンみや宛てはね
2884,2886,失礼しました
2886,2891,そうコナンみや宛ては真面目なやつはいつもなかったです
2891,2897,なんかねルインさんの逆にネタのやつはほぼなかったかな
2897,2905,だいたい全部その真面目な真摯なお便りが多かったけどコナンみや宛てはいつも真面目なやつはなかったです多分
2905,2913,もしねすごい真面目なラブレターだって思って出してくれてるのに私が勝手になんか面白枠で撮っちゃってたら本当すみません
2913,2919,これもしかしたらあの書き間違いかもしれないしねそう最後本当に愛してるよ千尋だったけど
2919,2925,もしかしたら本当にみやちを愛してくれてるのかもしれないしね
2925,2932,まあ何ですよねあのみやち宛てのねラブレター多かったんで愛されていることは間違いないと思います多分
2932,2936,多分だけどね
2936,2948,はいということでねあのびっくりするほど49分なんであの次でねアニマーレのラブレター最後の1通にさせてもらいたいと思います
2948,2955,ちょっとお水飲みます
2955,2959,前回が前回だった
2959,2961,うん
2961,2962,えー
2962,2968,もふもふの木さんからのアニマーレメンバーへのラブレター
2968,2985,はしばへ約1年前その頃はVTuberのことをほとんど知りませんでした初めてはしばのサムネイルを見たとき前髪パッツンのおんまろ眉に犬耳までついてて属性もりもりで尖ってるなーという印象でした
2985,2994,それで気になって配信を見てみたのですが独特なセンスやゲームでシュガリリや白宮をボコボコにする無敵感に一瞬で惹かれました
2994,3003,ふとした時に見せる可愛さ感情のこもった歌実はとても人間臭いところあなたの好きなところをあげるとキリがありません
3003,3011,あなたが褒められていると自分が褒められている時の数倍嬉しいしあなたが傷ついているときはとても辛い気持ちになります
3011,3015,おそらく人生で初めて恋をしました
3015,3021,いつまでもあなたは私の中で一番です愛してます
3021,3025,というお便りをいただきました
3025,3031,でもラジオネームがもふもふの木
3031,3038,もふもふの木さんね素敵なお便りをありがとうございます
3038,3048,やっぱりねこういう風に私のラジオフォームにお便りをいただけるのも本当に嬉しいです
3048,3054,私もやっぱりアニマーレのことが大好きでアニマーレに入ったので
3054,3061,皆さんと比べたらやっぱりアニマーレを知ってからとかアニマーレを知っている期間みたいなものはね
