start_h,start_m,start_s,start_ms,end_h,end_m,end_s,end_ms,text
1,3,38,0,1,3,42,0,去年くらいからたまにお見かけしますけれども
1,3,42,0,1,3,46,0,そのたびに大変だろうなと思って
1,3,46,0,1,3,51,0,めちゃめちゃ大変だろうなぁ
1,3,51,0,1,3,55,0,これ担当の人なぁと思いながらニュース見てますね
1,3,55,0,1,4,4,0,なんかあのーやっぱ私がどんな仕事をしようかなって考えた時に
1,4,4,0,1,4,11,0,マジで人の命とか人の生活最低限
1,4,11,0,1,4,18,0,最低限文化的な生活に全く関係ない仕事がしたいなって
1,4,18,0,1,4,20,0,ずっと思ってたんですよね
1,4,20,0,1,4,26,0,やっぱねこうなんていうんだろう
1,4,26,0,1,4,29,0,責任が伴うじゃないですか
1,4,29,0,1,4,35,0,もちろんねいろんな仕事に平等に責任というものは
1,4,35,0,1,4,39,0,お金とか時間をいただいている以上発生するんですけど
1,4,39,0,1,4,44,0,やっぱお金とかね命とかね
1,4,44,0,1,4,50,0,ちょっともう無理だ
1,4,50,0,1,4,53,0,無理だそうインフラ業は重いよ
1,4,53,0,1,4,59,0,だからね本当に職業に携わってくれてる皆さんに
1,4,59,0,1,5,1,0,日々感謝しながらね
1,5,1,0,1,5,3,0,当たり前のように水が出て
1,5,3,0,1,5,5,0,当たり前のように電気が使えて
1,5,5,0,1,5,7,0,当たり前のようにATMからお金を引き出せる
1,5,7,0,1,5,11,0,っていう日々にね本当に感謝しないといけないなって
1,5,11,0,1,5,15,0,このお便りいただいて改めて思いましたね
1,5,15,0,1,5,17,0,みんなありがとう
1,5,17,0,1,5,22,0,本当にいつもありがとう
1,5,22,0,1,5,28,0,では次のお便り
1,5,28,0,1,5,31,0,イカのすみからさんからの勝手にメールテーマ
1,5,31,0,1,5,33,0,お便りありがとうございます
1,5,33,0,1,5,35,0,りかかさんこんばんは
1,5,35,0,1,5,37,0,今回のメールテーマはこれってうちだけ?
1,5,37,0,1,5,39,0,我が家の謎ルールでしたね
1,5,39,0,1,5,42,0,これは私が子供の頃の話ですが
1,5,42,0,1,5,46,0,我が家にはPS2は3件分立すべしというルールがありました
1,5,46,0,1,5,48,0,これは当時PS2が発売されたことで
1,5,48,0,1,5,51,0,我々3人兄弟にもゲームブームが訪れ
1,5,51,0,1,5,57,0,連日連夜血で血を洗う争いが繰り広げられていたことから
1,5,57,0,1,5,59,0,母が提唱したものです
1,5,59,0,1,6,2,0,ん?PS23件分立
1,6,2,0,1,6,5,0,兄がゲーム機本体、私がゲームソフト
1,6,5,0,1,6,8,0,弟がメモリーカードをそれぞれ所有することで
1,6,8,0,1,6,11,0,互いに牽制し合い争いを避けるという妙案だったのですが
1,6,11,0,1,6,12,0,これが裏目に出ました
1,6,12,0,1,6,15,0,いろいろができた当初こそうまく機能していましたが
1,6,15,0,1,6,18,0,そのうち兄弟間の争いは表面的なものではなく
1,6,18,0,1,6,20,0,潔拓して一人に圧力をかけたり
1,6,20,0,1,6,22,0,かと思えば裏切り騙し影で暗躍し合いを
1,6,22,0,1,6,25,0,三国志さながらの因子なものに変わっていったのです
1,6,25,0,1,6,27,0,それは最終的に母の
1,6,27,0,1,6,30,0,喧嘩したらゲーム禁止で!という強権の行使により
1,6,30,0,1,6,33,0,我々の成長とともに徐々に陳静化していきましたが
1,6,33,0,1,6,37,0,今でもふとした時兄弟のことを疑ってしまう自分がいます
1,6,39,0,1,6,42,0,メモリーカードって絶対大事なんですか?
1,6,42,0,1,6,44,0,これがないとダメ?なのかな?
1,6,47,0,1,6,50,0,三国志になっているのがめちゃめちゃ面白いですよね
1,6,52,0,1,6,56,0,やっぱこのPS2、ゲームハードがね
1,6,56,0,1,6,58,0,私やっぱこう一人っ子なんで
1,6,58,0,1,7,1,0,あ、データがセーブできない
1,7,1,0,1,7,3,0,なるほどね、それ大事だね
1,7,4,0,1,7,9,0,あ、だからもうメモリーカードを持ってる担当の人が
1,7,9,0,1,7,12,0,お前らが朝ないよ今日はって言ったら
1,7,12,0,1,7,15,0,え、ここまで進めたのにセーブできないんだけど
1,7,15,0,1,7,17,0,みたいなそういうことになるってことか
1,7,19,0,1,7,21,0,クリア耐久ならいらないね、確かにね
1,7,21,0,1,7,23,0,クリア耐久ならいらないわ
1,7,25,0,1,7,27,0,でもメモリーカードを持ってるってことは
1,7,27,0,1,7,35,0,今まで他の兄弟が積み重ねてきた歴史を握ってると言っても過言ではないもんね
1,7,36,0,1,7,37,0,そうだよね
1,7,38,0,1,7,39,0,ロードもできないのか
1,7,40,0,1,7,42,0,あ、ロードもできないのか
1,7,42,0,1,7,44,0,じゃあもう素晴らしい三権分立じゃないですか
1,7,48,0,1,7,52,0,これね、それぞれ面白い謎ルールっていうことなんですけど
1,7,52,0,1,7,58,0,私はね、うちの特にこれやんないとダメみたいなのは
1,7,58,0,1,8,0,0,さほどなかったんですけど
1,8,1,0,1,8,6,0,うちの母さんの、うちの母のね、くしぐせが
1,8,6,0,1,8,10,0,結構あの、なんか画期的なアイデアない?だったんですよね
1,8,12,0,1,8,14,0,なんか画期的なアイデアない?と
1,8,14,0,1,8,19,0,人間は官協の動物っていうのを小さい頃からずっと言われて育つとこうなりますね
1,8,19,0,1,8,20,0,多分
1,8,20,0,1,8,21,0,多分
1,8,22,0,1,8,24,0,あの、こういう感じになります
1,8,27,0,1,8,31,0,だからね、あの、まあまあその別にあれですよ
1,8,31,0,1,8,37,0,あの、なんか特許を取りたいとか新しく発明しようっていうわけじゃなくて
1,8,37,0,1,8,40,0,例えばじゃあ、あの、今週末どっか行きたいねみたいな
1,8,40,0,1,8,43,0,今週末どっか遊びに行く?なんか画期的なアイデアない?とか
1,8,43,0,1,8,50,0,今日の晩御飯何する?なんか画期的なアイデアない?って言われてたんですよね、ずっと
1,8,52,0,1,8,53,0,そう、で
1,8,55,0,1,9,1,0,だから、なんか常に何か、常に新しい、なんか昨日とまた違う何かを
1,9,1,0,1,9,7,0,なんかひねり出したいなって思ってたような気がする、常にね
1,9,7,0,1,9,11,0,そう、面白いよね。うち、あの、本当に家族割と仲いいんですけど
1,9,11,0,1,9,14,0,それにしてもやっぱ母は面白いなって常々思いますね
1,9,14,0,1,9,17,0,私よりね、全然オタクだし、アニメよくいっぱい見てるし
1,9,18,0,1,9,23,0,うん、まあ別に実際それがすごい斬新なアイデアじゃなくてもいいんだけど
1,9,23,0,1,9,31,0,何かそう、自分なりに何かしらその、あの、能動的にこの案件に
1,9,31,0,1,9,38,0,あの、携わっていますとか、うん、今日の晩御飯に対して非常に前向きですっていう姿勢を
1,9,38,0,1,9,42,0,あの、見せるのが大事だったのかもしれない、今思えば
1,9,45,0,1,9,48,0,ね、そう、っていうのがね、ありましたね
1,9,48,0,1,9,52,0,うーん、これはなんか、面白かったな、うん
1,9,52,0,1,9,55,0,あとはやっぱ学校行かなくてもあんまり面白くないなって思う
1,9,55,0,1,10,1,0,そういう感じですね、うん、まあ、まあ、ありがたかったけど
1,10,1,0,1,10,4,0,ありがたかったけど、大丈夫だったのかな
1,10,4,0,1,10,8,0,大丈夫じゃないかもな、ははははは
1,10,8,0,1,10,11,0,大丈夫だったのかな、大丈夫じゃなかったのかもな
1,10,11,0,1,10,14,0,と思いながら日々生きてますね、うん
1,10,15,0,1,10,18,0,いやいいね、夕飯なんでもいいっていうと夕飯だけだったし
1,10,18,0,1,10,20,0,まあ私、お母さんが家に帰ってきてから
1,10,20,0,1,10,22,0,お母さんが家に帰ってきてから
1,10,22,0,1,10,25,0,いやいいね、夕飯なんでもいいっていうと夕飯だけだった
1,10,25,0,1,10,27,0,あははははは
1,10,28,0,1,10,31,0,ファニーなご家庭ですね、面白い面白い
1,10,31,0,1,10,34,0,いやなんかね、そういうね、あの皆さんの家にもあったでしょうか
1,10,34,0,1,10,38,0,そういう素敵な、ね、家族のルールみたいな
1,10,38,0,1,10,41,0,なんかならでは感があって非常に素敵だなって思いました
1,10,41,0,1,10,46,0,素敵な、ね、あの、心温まるエピソード、ありがとうございます
1,10,46,0,1,10,52,0,では、次のコーナー行きましょう
1,10,52,0,1,10,57,0,なんだかんだでさ、2時11分だね
1,10,57,0,1,11,0,0,今日なんか、今日なんかすごい普通のサクサクでござる
1,11,0,0,1,11,2,0,って思ってたんだけど
1,11,2,0,1,11,5,0,私の中のキモオタがさ
1,11,5,0,1,11,9,0,りゅふ、今日はサクサクでござるな、るかこし
1,11,9,0,1,11,12,0,うん、キモオタ人格が言ってたんですけど
1,11,12,0,1,11,16,0,別にそういうわけでもないですね、いつも通りです
1,11,16,0,1,11,19,0,えーでは、えー今回ですね
1,11,19,0,1,11,22,0,打ち抜けウィンターブルーということで
1,11,22,0,1,11,25,0,まあちょっとやっぱ冬季?
1,11,25,0,1,11,30,0,冬季うつという風に検索すると出てくるかなと思うんですけども
1,11,30,0,1,11,34,0,あのやっぱね、寒いと人はこううつうつとしがち
1,11,34,0,1,11,36,0,気分が落ちがちということで
1,11,36,0,1,11,38,0,それを打破する何かがね
1,11,38,0,1,11,42,0,ははははは
1,11,42,0,1,11,46,0,ちくしょうこのキモオタかわいいじゃねえかよ公文は非常に困りますね
1,11,46,0,1,11,47,0,恥ずかしいので
1,11,47,0,1,11,50,0,巻き込まないでほしい、ちくしょう公文
1,11,50,0,1,11,53,0,なんかその、月ノ美一郎と小波矢と
1,11,53,0,1,11,56,0,3人でやった黒歴史デュエルで
1,11,56,0,1,12,0,0,爆誕したんですけど、ちくしょう公文が
1,12,0,0,1,12,2,0,これはね、もともとはね
1,12,2,0,1,12,6,0,月ノ美一郎が新章配信の企画でね
1,12,6,0,1,12,9,0,考えていた企画書の中の一文を
1,12,9,0,1,12,12,0,私が抜粋させていただいて音読したんですけれども
1,12,12,0,1,12,16,0,それがね、はははは
1,12,16,0,1,12,18,0,オリジナルは月ノ美なんだけど
1,12,18,0,1,12,20,0,すごい汎用性が高いということにね
1,12,20,0,1,12,23,0,配信中に気づいてしまった、その黒歴史デュエルの
1,12,23,0,1,12,26,0,これは汎用性高いぞって
1,12,26,0,1,12,28,0,巻き込まれたくない、もう嫌だ絶対
1,12,28,0,1,12,31,0,はははは
1,12,31,0,1,12,32,0,はい、ということで
1,12,32,0,1,12,36,0,5つ目お便りありがとうございます
1,12,36,0,1,12,38,0,クローズさんからのうちぬけ指インターブル
1,12,38,0,1,12,40,0,りょかこさん、リスナーの皆さんこんばんは
1,12,40,0,1,12,44,0,僕は最近転職をして収入を減りましたが
1,12,44,0,1,12,46,0,CGをやむなんてことはほとんどなくなりました
1,12,46,0,1,12,48,0,幸せってなんでしょうね
1,12,48,0,1,12,50,0,なんでしょうね
1,12,50,0,1,12,51,0,なんでしょうね
1,12,51,0,1,12,54,0,ここチェーン繋がってますね
1,12,54,0,1,12,56,0,幸せってなんでしょう
1,12,56,0,1,12,58,0,チェーンがね、繋がりました
1,12,58,0,1,13,1,0,魔法カードで
1,13,1,0,1,13,2,0,こちらですね
1,13,2,0,1,13,3,0,さて
1,13,3,0,1,13,5,0,そんな僕はウィンターブルーという言葉を
1,13,5,0,1,13,6,0,初めて見にしたので
1,13,6,0,1,13,8,0,みんな大好きGoogle先生に聞いてみました
1,13,8,0,1,13,10,0,要は日照時間が減り
1,13,10,0,1,13,12,0,天気がどんよりし始める10月から3月の間
1,13,12,0,1,13,14,0,めっちゃ病むということらしいですね
1,13,14,0,1,13,16,0,わかる、寒い朝
1,13,16,0,1,13,18,0,布団から出るときが一番つらいですよね
1,13,18,0,1,13,20,0,うん
1,13,20,0,1,13,21,0,そこで神が考え
1,13,21,0,1,13,22,0,神じゃないや
1,13,22,0,1,13,26,0,はははは
1,13,26,0,1,13,28,0,そこで僕が考えた
1,13,28,0,1,13,30,0,ウィンターブルーをぶっ飛ばす方法
1,13,30,0,1,13,31,0,それは
1,13,31,0,1,13,34,0,真夜中または起きる1時間くらい前から
1,13,34,0,1,13,36,0,エアコンかヒーターを入れて
1,13,36,0,1,13,37,0,部屋を温めることです
1,13,37,0,1,13,39,0,喉とか乾燥しちゃうって人は
1,13,39,0,1,13,40,0,かしつきをつけるか
1,13,40,0,1,13,42,0,濡れたタオルを枕元にほすだけでも全然違います
1,13,42,0,1,13,44,0,僕はそうしてますと
1,13,44,0,1,13,46,0,この方法を始めてから朝から
1,13,46,0,1,13,47,0,スムーズに起きられていますし
1,13,47,0,1,13,50,0,精神的な苦痛も軽減できていると感じます
1,13,50,0,1,13,53,0,皆さんのウィンターがホントホットになりますように
1,13,53,0,1,13,54,0,うん
1,13,54,0,1,13,55,0,ということでね
1,13,55,0,1,13,57,0,神の神託でした
1,13,57,0,1,13,59,0,はははは
1,13,59,0,1,14,1,0,神の神託でした
1,14,1,0,1,14,2,0,うん
1,14,2,0,1,14,3,0,あれ洗濯だっけ
1,14,3,0,1,14,5,0,神の神託どっちだっけ
1,14,5,0,1,14,6,0,うんでした
1,14,6,0,1,14,7,0,これですやっぱり
1,14,7,0,1,14,8,0,もうシンプルそう
1,14,8,0,1,14,9,0,うん
1,14,9,0,1,14,12,0,ポカポカなのがええんやな
1,14,12,0,1,14,14,0,私でもね
1,14,14,0,1,14,15,0,あの
1,14,15,0,1,14,17,0,暖房がすごい嫌いなんですよ
1,14,17,0,1,14,18,0,とにかく
1,14,18,0,1,14,20,0,暖房がね
1,14,20,0,1,14,22,0,あるとやっぱ人はね
1,14,22,0,1,14,23,0,愚かになる
1,14,23,0,1,14,24,0,と思う
1,14,24,0,1,14,26,0,少なくとも私は愚かになる
1,14,26,0,1,14,28,0,暖房の効いた部屋にいる
1,14,28,0,1,14,30,0,オーラル加工は
1,14,30,0,1,14,32,0,当社費やっぱ
1,14,32,0,1,14,34,0,65%ぐらい愚か
1,14,34,0,1,14,35,0,うん
1,14,35,0,1,14,39,0,当社費65%愚かってどういうこと
1,14,39,0,1,14,41,0,はははははは
1,14,43,0,1,14,45,0,マジで愚かなんですよね
1,14,45,0,1,14,46,0,なんかこの間
1,14,48,0,1,14,50,0,あの
1,14,50,0,1,14,53,0,2月じゃないですか今
1,14,53,0,1,14,54,0,で
1,14,54,0,1,14,55,0,あの街中をね
1,14,55,0,1,14,57,0,お仕事終わりに歩いてて
1,14,57,0,1,14,59,0,あの
1,14,59,0,1,15,2,0,みんな大好きスターバックスコーヒーがね
1,15,2,0,1,15,3,0,あったんですよ
1,15,3,0,1,15,5,0,スターバックスコーヒーあると思って
1,15,5,0,1,15,6,0,で
1,15,6,0,1,15,8,0,なんかそうやっぱ寒いし
1,15,8,0,1,15,10,0,これからその街テイクアウトでね
1,15,10,0,1,15,12,0,あの歩きながら飲むから
1,15,12,0,1,15,15,0,温かいものにしようやっぱりと思って
1,15,15,0,1,15,16,0,うん
1,15,16,0,1,15,18,0,エキストラミルクチャイティーラテにすっか
1,15,18,0,1,15,20,0,そいで!と思ったんだけど
1,15,20,0,1,15,22,0,こう並んでるうちに
1,15,22,0,1,15,25,0,なんか店内がすっげえ温かくて
1,15,25,0,1,15,28,0,あれ?なんかもしかしてあったけーんとちゃうか?
1,15,28,0,1,15,29,0,と思って
1,15,29,0,1,15,30,0,よ
1,15,30,0,1,15,31,0,よがね
1,15,31,0,1,15,34,0,世の中ってあったかいんじゃないかって勘違いしちゃって
1,15,34,0,1,15,37,0,あのグランデのフラペチーノ頼んじゃったの
1,15,38,0,1,15,39,0,ですよ
1,15,40,0,1,15,41,0,で
1,15,41,0,1,15,44,0,できて一口目すごいおいしくて
1,15,44,0,1,15,46,0,おいしいなーと思って
1,15,46,0,1,15,47,0,で出たら
1,15,47,0,1,15,49,0,信じらんないくらい寒い
1,15,49,0,1,15,50,0,やっぱね
1,15,50,0,1,15,52,0,暖房は人を愚かにするし
1,15,52,0,1,15,54,0,私も愚か
1,15,54,0,1,15,56,0,なんで?
1,15,56,0,1,15,58,0,てかお腹も痛くなっちゃうしさ
1,15,58,0,1,15,59,0,うん
1,15,59,0,1,16,1,0,なんでしかもフラペチーノなん?
1,16,1,0,1,16,4,0,普段そんなフラペチーノなんて飲まないのにさ
1,16,4,0,1,16,6,0,今日はなんかフラペチーノにしちゃお
1,16,6,0,1,16,7,0,冬だしと思って
1,16,7,0,1,16,9,0,夏に飲みな!
1,16,9,0,1,16,12,0,と私は思いました自分自身に対して
1,16,12,0,1,16,15,0,だからねやっぱ暖房は人を愚かにするんで
1,16,15,0,1,16,17,0,まあこれはちょっと一長一短ですね
1,16,17,0,1,16,19,0,あの自分のその
1,16,19,0,1,16,20,0,思考のABC
1,16,20,0,1,16,22,0,え?なんかなんだろうな
1,16,22,0,1,16,24,0,あの鋭利な
1,16,24,0,1,16,27,0,鋭利な思考回路を維持するか
1,16,27,0,1,16,29,0,ウィンターブルーを這いすか
1,16,29,0,1,16,30,0,どちらかですね
1,16,30,0,1,16,31,0,選ぶしかない
1,16,31,0,1,16,33,0,うん
1,16,33,0,1,16,34,0,皆さんもね
1,16,34,0,1,16,35,0,どちらを捨て
1,16,35,0,1,16,37,0,どちらを残すのか
1,16,37,0,1,16,38,0,ね
1,16,38,0,1,16,40,0,ふふふ
1,16,40,0,1,16,43,0,こんなの私だけなんじゃないか実は
1,16,43,0,1,16,45,0,うん暖房をつけるとバカになっちゃうんですよね
1,16,45,0,1,16,47,0,バカみたいなこと言ってんのは
1,16,47,0,1,16,49,0,私だけなんじゃないかと思い始めたので
1,16,49,0,1,16,51,0,今のは丸言葉忘れてください
1,16,51,0,1,16,52,0,では次
1,16,56,0,1,16,58,0,えー
1,16,58,0,1,16,59,0,TVさん
1,16,59,0,1,17,0,0,TVさんからの
1,17,0,0,1,17,3,0,うちぬけウィンターブルーお便りありがとうございます
1,17,3,0,1,17,4,0,ルカゴさんこんにちは
1,17,4,0,1,17,5,0,こんにちは
1,17,5,0,1,17,7,0,もう10年以上冬場のメンタル不調と
1,17,7,0,1,17,8,0,お付き合いを続けています
1,17,8,0,1,17,9,0,大変ですね
1,17,9,0,1,17,11,0,やり過ごすために続けているのが
1,17,11,0,1,17,12,0,深夜散歩です
1,17,12,0,1,17,14,0,物の本によると
1,17,14,0,1,17,16,0,散歩を朝にするのがいいそうですが
1,17,16,0,1,17,18,0,不調が一番きつかった学生時代は
1,17,18,0,1,17,20,0,夕焼けを見るのが嫌で嫌でたまらず
1,17,20,0,1,17,22,0,日没後にしか起きられなくなったため
1,17,22,0,1,17,24,0,夜に徘徊するのが癖になりました
1,17,24,0,1,17,25,0,ちょっと読みます
1,17,30,0,1,17,31,0,うん
1,17,34,0,1,17,35,0,えー
1,17,35,0,1,17,37,0,寒くなってきて気持ちが傾き始めたら
1,17,37,0,1,17,39,0,夜中にフラッと部屋を抜け出します
1,17,39,0,1,17,41,0,どうせ誰にも見られないので
1,17,41,0,1,17,43,0,髪も顔も服も適当です
1,17,43,0,1,17,46,0,音楽やラジオを聴くかどうかはその日の気分
1,17,46,0,1,17,49,0,この道をまっすぐ進もうと決めてひたすら歩きます
1,17,49,0,1,17,52,0,日中は通らない脇道や生活道路に入ると
1,17,52,0,1,17,55,0,こんなところに喫茶店があったんだといった発見があったり
1,17,55,0,1,17,59,0,次は空いている時間に来ようと思いますが
1,17,59,0,1,18,1,0,まず実現しません
1,18,3,0,1,18,4,0,小一時間も歩けば疲れたし
1,18,4,0,1,18,7,0,そろそろ帰ろうかなという気分になります
1,18,7,0,1,18,9,0,私はまさにこの瞬間に得られる
1,18,9,0,1,18,11,0,ちっぽけな達成感が好きです
1,18,11,0,1,18,14,0,ただ家の周りをうろついただけといえばその通りですが
1,18,14,0,1,18,15,0,メンタルが下り坂の時は
1,18,15,0,1,18,18,0,うじうじ悩み以外のことをしようとしてもなかなかできず
1,18,18,0,1,18,21,0,この達成感でも貫路なのです
1,18,22,0,1,18,24,0,貫路寺光の貫路です
1,18,24,0,1,18,26,0,長文を読んでいただいてありがとうございました
1,18,26,0,1,18,27,0,こちらこそ素敵なお便りをね
1,18,27,0,1,18,28,0,ありがとうございました
1,18,28,0,1,18,32,0,寒い時期はどうぞご自愛くださいとのことで
1,18,32,0,1,18,34,0,いいですね夜の散歩
1,18,36,0,1,18,41,0,私は昔散歩というものの存在意義が全く分からなかったんですけど
1,18,41,0,1,18,47,0,目的もなく歩くということが
1,18,47,0,1,18,50,0,いかようなメリットをもたらすのか
1,18,50,0,1,18,53,0,実体験として知らなかったんですけど
1,18,53,0,1,18,57,0,散歩をするようになって
1,18,57,0,1,19,0,0,実家を出てから
1,19,0,0,1,19,2,0,でね、いいなと思いました
1,19,2,0,1,19,5,0,やっぱ中学校の時の私とかは
1,19,5,0,1,19,10,0,思考が狭かったなって日々思いますね
1,19,10,0,1,19,12,0,日々思う
1,19,12,0,1,19,14,0,あのー
1,19,14,0,1,19,18,0,やっぱ私小学校とか中学生の時って
1,19,18,0,1,19,21,0,結構シャニー構えガールだったんで
1,19,21,0,1,19,24,0,洋楽とか聴きたいとかね
1,19,24,0,1,19,26,0,うん、とかなんか
1,19,26,0,1,19,30,0,普通にそのいわゆる恋愛系のドラマじゃなくて
1,19,30,0,1,19,33,0,海外のねミステリードラマとか
1,19,33,0,1,19,36,0,サスペンス系の映画とか見てたんですけど
1,19,36,0,1,19,38,0,結局ねやっぱね
1,19,38,0,1,19,40,0,あのー
1,19,40,0,1,19,43,0,アイドルに
1,19,43,0,1,19,46,0,生活を救われてるから今
1,19,46,0,1,19,48,0,かつて私が
1,19,48,0,1,19,53,0,軽薄な音楽は聴いてられたもんじゃないと思ってた
1,19,53,0,1,19,56,0,アイドルにお前の命を今救われているぞとね
1,19,56,0,1,19,58,0,私は過去の自分に言いたいんで
1,19,58,0,1,19,59,0,うん
1,19,59,0,1,20,1,0,なんでやっぱこう
1,20,1,0,1,20,4,0,初手でね、なんか私には合わないなとか
1,20,4,0,1,20,7,0,なんか違うな、ジャンル違うなとか思っても
1,20,7,0,1,20,9,0,あのー
1,20,9,0,1,20,11,0,いやでも、もしかしたら
1,20,11,0,1,20,13,0,自分にね、いつか
1,20,13,0,1,20,15,0,あのー
1,20,15,0,1,20,17,0,いい影響をもたらしてくれるかもとか
1,20,17,0,1,20,18,0,うん
1,20,18,0,1,20,21,0,もしかしたらすごい自分にぴったり
1,20,21,0,1,20,24,0,しっくりハマる日が来るかもと思いながらね
1,20,24,0,1,20,26,0,あのー
1,20,26,0,1,20,28,0,コンテンツをね
1,20,28,0,1,20,30,0,なんか飲み込んでいきたいですよね
1,20,30,0,1,20,31,0,これからも
1,20,31,0,1,20,35,0,このエンターテイメントフォアグラ時代
1,20,35,0,1,20,37,0,フフフフフフ
1,20,37,0,1,20,41,0,エンターテイメントフォアグラ時代ね
1,20,41,0,1,20,42,0,うん
1,20,42,0,1,20,45,0,そう、だからねやっぱ
1,20,45,0,1,20,46,0,あの、あいにね
1,20,46,0,1,20,47,0,こう、なんだろ
1,20,47,0,1,20,49,0,これはちょっと私に合わ
1,20,49,0,1,20,50,0,なんだろ
1,20,50,0,1,20,52,0,あの、これはちょっと
1,20,52,0,1,20,53,0,あのー
1,20,53,0,1,20,55,0,私に合わないっていうのはまああり
1,20,55,0,1,20,57,0,not for meの考え方はすごい大事だけど
1,20,57,0,1,20,59,0,なんか下に見たりバカにしたりみたいなのは
1,20,59,0,1,21,2,0,本当に良くないなーって
1,21,2,0,1,21,4,0,最近も思いますね
1,21,4,0,1,21,5,0,日々思う
1,21,5,0,1,21,8,0,なんか中学生の時とかの自分を
1,21,8,0,1,21,10,0,適宜思い出していかないと
1,21,10,0,1,21,12,0,またそこにね
1,21,12,0,1,21,16,0,どんどん視野が狭くなって戻っていくのが怖いんで
1,21,16,0,1,21,19,0,そういう発言しそうなーと思ったらね
1,21,19,0,1,21,21,0,教えてください
1,21,21,0,1,21,22,0,Googleフォームで
1,21,22,0,1,21,23,0,うん
1,21,23,0,1,21,26,0,今日もGoogleフォームにずっと
1,21,26,0,1,21,29,0,ハッシュタグのつづりが間違ってましたよって来てて
1,21,29,0,1,21,31,0,すげー助かっちゃった
1,21,31,0,1,21,32,0,多分あのー
1,21,32,0,1,21,35,0,多分ミルチーズのランチミーティングだと思うんだけど
1,21,35,0,1,21,38,0,ハッシュタグのつづり間違ってた
1,21,38,0,1,21,39,0,ははは
1,21,39,0,1,21,40,0,多分なんか
1,21,40,0,1,21,42,0,30回以上やってるんですけど
1,21,42,0,1,21,44,0,あの配信
1,21,44,0,1,21,46,0,そう、Googleフォームでお知らせしてもらって
1,21,46,0,1,21,48,0,初めて気づきました
1,21,48,0,1,21,50,0,だからねやっぱありがたいですね
1,21,50,0,1,21,53,0,こうやってこう皆さんの前でお話しして
1,21,53,0,1,21,55,0,なんか多分いろんなね
1,21,55,0,1,21,57,0,こう間違ったこととか
1,21,57,0,1,21,59,0,こうなんて言うんだろうな
1,21,59,0,1,22,2,0,あんまりなんだろうにつかわしくないっていうか
1,22,2,0,1,22,4,0,状況ににつかわしくなかった不相応しくなかった
1,22,4,0,1,22,7,0,発言とか行動とかもね多々あると思うんですけど
1,22,7,0,1,22,10,0,それをね非常に皆さん丁寧に教えてくれるんで
1,22,10,0,1,22,11,0,うん
1,22,12,0,1,22,13,0,あの
1,22,13,0,1,22,15,0,フォントの
1,22,15,0,1,22,17,0,フォントのあのデザインの問題だとしたら
1,22,17,0,1,22,19,0,本当に大変恐縮なんですけれども
1,22,19,0,1,22,21,0,ハッシュタグは
1,22,21,0,1,22,22,0,あのつづりが
1,22,22,0,1,22,25,0,Hの次はUではなくAではないでしょうかみたいな
1,22,25,0,1,22,27,0,すごい丁寧なね
1,22,27,0,1,22,28,0,お便りが来てました
1,22,28,0,1,22,29,0,ありがとうございます
1,22,29,0,1,22,31,0,誰も気づいてなかったよね
