start_h,start_m,start_s,start_ms,end_h,end_m,end_s,end_ms,text
1,4,0,0,1,4,3,0,サイゼのプリンを食べたことがないなんて人生は10割損してる
1,4,3,0,1,4,7,0,君が食べたことがないならまだ君は生まれてないということだ
1,4,7,0,1,4,10,0,そこまで言うならと追加注文して食べてみると
1,4,10,0,1,4,12,0,まあ美味しい生まれましたわ
1,4,12,0,1,4,14,0,250円とは思えないクオリティ
1,4,14,0,1,4,17,0,1000円と言われても納得してしまうほどの美味しさ
1,4,17,0,1,4,20,0,私は食レポが下手なので具体的な味を説明できませんが
1,4,20,0,1,4,23,0,250円で確実に幸せになるのでご賞味遊ばせ
1,4,23,0,1,4,27,0,ところで私の大学の寄宿舎は建物の4分の3が廃墟ですわ
1,4,27,0,1,4,29,0,機会があって中に入ってみましたが
1,4,29,0,1,4,32,0,ホラーゲンの舞台のようでなかなか重きがありましたわね
1,4,32,0,1,4,34,0,それでは皆様ごきげんよう
1,4,36,0,1,4,37,0,というねお嬢様
1,4,37,0,1,4,39,0,1通目のお嬢様からのお便りです
1,4,42,0,1,4,46,0,次のお嬢様のお便りです
1,4,47,0,1,4,50,0,アイドル養成学校の寮で同室のお嬢様
1,4,50,0,1,4,51,0,ありがとうございます
1,4,53,0,1,4,55,0,私の人に優しくしたエピソード?
1,4,55,0,1,4,58,0,いいわよ星の数ほどあるうちの1つを教えてあげるわ
1,4,58,0,1,5,2,0,私街を出歩いていてマルチの会員はされたことがありませんが
1,5,2,0,1,5,6,0,異国からお越しになられた観光客の方に道をよく惹かれますの
1,5,6,0,1,5,10,0,この人なら助けてくれそうという機品あるオーラが出ているのかしら
1,5,10,0,1,5,14,0,困っている人を助けるのは貴族の務めノブレス・オブリージュですわ
1,5,14,0,1,5,18,0,行き先をスマホで調べて優しく教えてあげていますの
1,5,18,0,1,5,19,0,まではいいんですの
1,5,19,0,1,5,23,0,このことで最近少し困ってたことがありましたの
1,5,23,0,1,5,27,0,私ってよほどスターに相応しい親しみやすそうなオーラなのかしら
1,5,27,0,1,5,30,0,その時もお出かけした先でおばあさんに聞かれたわ
1,5,30,0,1,5,34,0,あの有名なあの場所ってどう言ったらいいかわかりますか?と
1,5,34,0,1,5,37,0,でも私は答えられなかったわなぜだかわかるかしら
1,5,37,0,1,5,40,0,そこは私も初めて来た観光地だったのよ
1,5,40,0,1,5,43,0,他の観光客の方々が歩いている方を指して
1,5,43,0,1,5,48,0,私もわかりませんが多分他の観光客の方々は向かっているあちらじゃないかしらと
1,5,48,0,1,5,50,0,お答えをさせていただいたものの
1,5,50,0,1,5,53,0,あの出来事はいからパーフェクトで機品ある私といえど
1,5,53,0,1,5,54,0,さすがに動揺したわね
1,5,54,0,1,5,57,0,これでミスオーラの逸話少しは和らげたかしら
1,5,59,0,1,6,2,0,いいのよこんなお話よろしければいくらでも話して差し上げますわ
1,6,2,0,1,6,4,0,お体の方をご自愛なさってくださいまし
1,6,4,0,1,6,5,0,っていうね
1,6,5,0,1,6,7,0,えーお嬢様から来ました
1,6,8,0,1,6,10,0,いや非常にノーブレスなね
1,6,10,0,1,6,11,0,ノーブレスオブリージュな
1,6,12,0,1,6,13,0,ノーブルなお便りが
1,6,13,0,1,6,16,0,あの本当にこれ2通連続で来てました
1,6,16,0,1,6,19,0,だから同一人物お嬢様かなと思ったんだけど
1,6,19,0,1,6,22,0,なんかやっぱ一人称とかも違うし
1,6,22,0,1,6,24,0,うん
1,6,24,0,1,6,28,0,そうあのインターナットお嬢様は一人称がひらがなわたくしで
1,6,28,0,1,6,30,0,アイドル養成学校の寮で同室のお嬢様は
1,6,30,0,1,6,33,0,あの一人称がカタカナわたくしだから
1,6,33,0,1,6,34,0,まあ違う方なのかな
1,6,34,0,1,6,37,0,違うお嬢様から連続でお便りが来ているんだわ
1,6,37,0,1,6,39,0,と思って感動しましたね
1,6,42,0,1,6,44,0,お嬢様ワンペアですわ
1,6,44,0,1,6,47,0,ノーブレスオブリージュっていうとあれ思い出すな
1,6,47,0,1,6,49,0,あの東のエデン
1,6,49,0,1,6,51,0,エデンの東
1,6,51,0,1,6,53,0,エデンの東か東のエデンか
1,6,53,0,1,6,56,0,どっちだ?どっちが映画でどっちがアニメだ?
1,6,56,0,1,6,59,0,東のエデンだろうな
1,7,0,0,1,7,2,0,東のエデンでした
1,7,2,0,1,7,4,0,東のエデンね
1,7,4,0,1,7,7,0,なんかネットフリックスかなんかに確かあったはず
1,7,7,0,1,7,9,0,面白かったですよめちゃめちゃ
1,7,11,0,1,7,14,0,なんかそのすごい度級の金持ちが
1,7,14,0,1,7,16,0,なんか10人ぐらいの人間にね
1,7,16,0,1,7,20,0,あの選ばれた人間に10億ぐらい渡すんですけど
1,7,20,0,1,7,22,0,何億だったっけ?
1,7,22,0,1,7,24,0,それを使ってなんか良き行いをしてくれよな
1,7,24,0,1,7,26,0,みたいな感じだった気がする
1,7,26,0,1,7,28,0,であの
1,7,28,0,1,7,30,0,ジュイスっていう
1,7,30,0,1,7,33,0,AIみたいななんかその
1,7,33,0,1,7,36,0,選ばれた人が携帯端末みたいなので
1,7,36,0,1,7,40,0,お金を使ってこれをやってくれみたいな指示を飛ばすんだけど
1,7,40,0,1,7,43,0,それのAIがジュイスって言って
1,7,43,0,1,7,46,0,めちゃめちゃ可愛かった記憶だけがただある
1,7,46,0,1,7,48,0,うん
1,7,48,0,1,7,50,0,そうだからあの
1,7,50,0,1,7,53,0,ジュイスが実装されてほしい
1,7,53,0,1,7,55,0,私のiPhoneにも
1,7,58,0,1,8,0,0,オープニングもエンディングもね
1,8,0,0,1,8,3,0,すごいあのめちゃめちゃかっこよかった気がする
1,8,3,0,1,8,6,0,オープニングってなんかあれOASISじゃなかった?
1,8,6,0,1,8,8,0,なんかあの
1,8,8,0,1,8,12,0,なんだろそれタイアップの新曲とかではなくて
1,8,12,0,1,8,16,0,既存のOASISの曲使ってたんじゃなかったっけな
1,8,16,0,1,8,19,0,みたいな感じでした
1,8,19,0,1,8,20,0,はい
1,8,20,0,1,8,22,0,えOASISじゃないの?OASISなの?
1,8,22,0,1,8,24,0,あそうなの?
1,8,27,0,1,8,29,0,あOASISで合ってるんだ
1,8,31,0,1,8,33,0,ということでね
1,8,33,0,1,8,36,0,これ是非ともねまだ見てないって方がいたら
1,8,36,0,1,8,40,0,是非ともチェックしてみてほしいなと思います
1,8,40,0,1,8,43,0,サイゼのプリン食べたことないんで今度食べてみますね
1,8,43,0,1,8,45,0,お嬢様
1,8,45,0,1,8,50,0,でねこれサイゼのおすすめもう一人してきてくれた方がいて
1,8,50,0,1,8,52,0,その方はね
1,8,52,0,1,8,56,0,バッファローモッツァレラのピザがむちゃくちゃうまかったっていう
1,8,56,0,1,8,59,0,バッファローモッツァレラ?モッツァレラバッファロー?
1,8,59,0,1,9,1,0,東のエデン?エデンの東?
1,9,1,0,1,9,4,0,バッファローモッツァレラと思うんだけど
1,9,4,0,1,9,7,0,それがすごい美味しかったので是非食べてくださいっておすすめ来てて
1,9,7,0,1,9,10,0,サイゼでワンピアできてると思ったんだけど
1,9,10,0,1,9,12,0,このねバッファローモッツァレラのチーズ
1,9,12,0,1,9,16,0,私この間ししおくりすさんと二人でサイゼ行った時に
1,9,16,0,1,9,19,0,くりすさんがピザ食べたいって言うから頼んだんですよ
1,9,19,0,1,9,22,0,このピザがいいって言うから
1,9,22,0,1,9,26,0,で来たんだけど確かにめっちゃ美味しかったんだけど
1,9,26,0,1,9,30,0,くりすさんなんか自分で食べたいって言ったのに一切れしか食べれなくて
1,9,30,0,1,9,34,0,美味しい美味しいって言って食べたのに一切れ食べ終わったら
1,9,34,0,1,9,39,0,なんか私もチーズいいわみたいな
1,9,39,0,1,9,43,0,あたちも重いの食べられないって言って
1,9,43,0,1,9,47,0,残り全部私が食べたけどバッファローモッツァレラのチーズは美味かった
1,9,47,0,1,9,50,0,うーんおすすめ
1,9,50,0,1,9,56,0,是非ともね直近でサイゼに行く予定がある皆様
1,9,56,0,1,9,59,0,バッファローモッツァレラのチーズ
1,9,59,0,1,10,3,0,チーズのピザとお嬢様おすすめのプリン
1,10,3,0,1,10,6,0,是非ともご賞味あれ
1,10,6,0,1,10,9,0,では次
1,10,12,0,1,10,14,0,こちらですね
1,10,14,0,1,10,19,0,瀬戸内さんの耳から言う薬お便りありがとうございます
1,10,19,0,1,10,21,0,ロカコさんこんばんは
1,10,21,0,1,10,23,0,もうずいぶん昔の話ではありますが
1,10,23,0,1,10,27,0,仕事の忙しさとつらさが天元突破していた時期がありました
1,10,27,0,1,10,30,0,天元突破といえば某ガイナックスのドリルアニメが連想されますが
1,10,30,0,1,10,34,0,実はもともとイゴの用語らしいですよすごいですね知らなかった
1,10,34,0,1,10,37,0,さて話を戻してやはり人間そういった環境にいると
1,10,37,0,1,10,41,0,どこがおかしくなってしまうらしく徐々に行動に現れ始めました
1,10,41,0,1,10,45,0,カフェでコーヒーを買った際そなつけのシロップを開けてそのままゴミ箱に捨て
1,10,45,0,1,10,48,0,またシロップを開けてまたゴミ箱に捨てるという行動を
1,10,48,0,1,10,51,0,定員に指摘されるまで無意識に繰り返したりやばいね
1,10,51,0,1,10,55,0,シロップ開けてそのまま捨ててシロップ開けてそのまま捨ててやばいね
1,10,55,0,1,10,58,0,火災を捨てることに爽快感を感じるようになり
1,10,58,0,1,11,2,0,毎日身についたものを片っ端から捨て始めたりしていました
1,11,4,0,1,11,6,0,ちょっと心当たりがあるな
1,11,6,0,1,11,9,0,そんな折幼なじめの友人二人が何かを察したようで
1,11,9,0,1,11,13,0,三人で遊びに行こうと誘ってくれました
1,11,13,0,1,11,16,0,自分でも少し不安を抱き始めていた頃でしたので
1,11,16,0,1,11,19,0,やはり付き合いの長い人間には分かるものなのだなと考え深く
1,11,19,0,1,11,23,0,またそれとなく誘ってくれた友人の思いやりをとても嬉しく感じ
1,11,23,0,1,11,25,0,約束の日を楽しみにしておりました
1,11,25,0,1,11,28,0,そして約束の当日朝から三人でスロットを打ち
1,11,28,0,1,11,33,0,7時の時点で19時の時点で合計23万円負けました
1,11,33,0,1,11,37,0,友人二人が9万円私は5万円の記録的大敗北でした
1,11,37,0,1,11,40,0,その後のディナーは大変オシャレなお店を予約しておりましたが
1,11,40,0,1,11,42,0,どうやら味付けをミスったのでしょう
1,11,42,0,1,11,45,0,完全な無意無臭でした
1,11,45,0,1,11,48,0,この出来事も当時はずいぶん精神的ダメージを受けたものですが
1,11,48,0,1,11,52,0,不思議なことにしばらく経つと思い出すと笑いがこみ上げてくるようになりました
1,11,52,0,1,11,56,0,この出来事がなければあの時期はきっと単に仕事が辛かった
1,11,56,0,1,11,59,0,というネガティブな印象だけが残っていたのだろうと思うと
1,11,59,0,1,12,1,0,友人たちには感謝してもしきれません
1,12,1,0,1,12,6,0,そして実はあの日途中から勝ち目がないと察した私が
1,12,6,0,1,12,8,0,こっそりローレスクな台に移動してお茶を濁していたことは
1,12,8,0,1,12,10,0,墓まで持っていくつもりです
1,12,10,0,1,12,11,0,というね
1,12,11,0,1,12,14,0,お便り瀬戸志さんありがとうございました
1,12,14,0,1,12,19,0,なんかめちゃめちゃいいですね
1,12,19,0,1,12,24,0,そういう日があってもいいんだよな
1,12,24,0,1,12,30,0,もちろん合計23万負けたのは本当に大変だったと思うんですけど
1,12,30,0,1,12,36,0,なんか本当にあれやばかったなみたいな日って
1,12,36,0,1,12,43,0,一瞬終わって笑いになっていくものだといいな
1,12,43,0,1,12,53,0,今あのね今すごい画面今ちょっと obs の配信画面見たら
1,12,53,0,1,12,56,0,アニマーレ4周年の告知が目に入ったんでね
1,12,56,0,1,13,1,0,いいなこの状況がいつかね
1,13,1,0,1,13,5,0,いやもうさあの時本当に4周年の直前本当に大変だったよね
1,13,5,0,1,13,10,0,っていう話になるといいなと思いますね
1,13,10,0,1,13,16,0,今ですね
1,13,16,0,1,13,23,0,なんかいやムミムシはうつ病の可能性がある
1,13,23,0,1,13,25,0,味がわかんなくなってる可能性
1,13,25,0,1,13,29,0,それも確かに3人が3人ともムミムシなのかね
1,13,29,0,1,13,31,0,それもあれですけど
1,13,31,0,1,13,40,0,いやまあでもねこの間そのなんて言うんだろう
1,13,40,0,1,13,46,0,まあいわゆるねどう考えてもやばいみたいな
1,13,46,0,1,13,49,0,釣りじゃないマジでやばいみたいな配信が
1,13,49,0,1,13,53,0,いなばはねるさんのチャンネルであったんですけども
1,13,53,0,1,14,1,0,あのその時に現時点でねアニマーレの4周年のチケットは
1,14,1,0,1,14,7,0,243枚だったかな243枚しか売れてないみたいな形でね
1,14,7,0,1,14,13,0,話が始まって今後私たちがどうしたらいいのかなみたいな相談を
1,14,13,0,1,14,16,0,配信上でしたんですけど
1,14,16,0,1,14,25,0,それを見てねかなりそのたくさん応援してくださっている方とか
1,14,25,0,1,14,28,0,それを見て買ったよって言ってくれてる方とか
1,14,28,0,1,14,32,0,あとやっぱりそのイラストとかで動画とかファンアートとか
1,14,32,0,1,14,36,0,ファンアートとイラストは全く一緒ですけども
1,14,36,0,1,14,40,0,告知画像作ってくれたり拡散してくれたり
1,14,40,0,1,14,44,0,なんかそういうすごい応援してくれてる方が
1,14,44,0,1,14,47,0,めちゃめちゃいらっしゃって
1,14,47,0,1,14,54,0,でなんか何かできることありませんかみたいに聞いてくださった方もいるし
1,14,54,0,1,14,57,0,アルマ先生もねなんかできることありませんかって連絡くれて
1,14,57,0,1,15,2,0,めちゃめちゃ励みになったんですけど
1,15,2,0,1,15,6,0,クリスさんもねイラスト描いてくれたしね私が版欄のね
1,15,6,0,1,15,9,0,だからすごいありがたいし
1,15,9,0,1,15,12,0,なんかそういうふうにそのみんなでね
1,15,12,0,1,15,15,0,計らずも学園祭っぽくなってきたねって
1,15,15,0,1,15,19,0,こういうこうなんか好意的に受け取ってくれてる方も多くて
1,15,19,0,1,15,24,0,私はやっぱりそのアニマーレのNGなしのアニマーレ
1,15,24,0,1,15,28,0,初期メンバー5人のNGなしのアニマーレがいいなと思って
1,15,28,0,1,15,33,0,アニマーレを受けてるんでオーディションの時に
1,15,33,0,1,15,40,0,うんまあそれでねここから全部皆さんにさらけ出しながらね
1,15,40,0,1,15,44,0,頑張っていきたいなと思うんですけど当日まで
1,15,44,0,1,15,50,0,うーんだよなーって思って今後もね
1,15,50,0,1,15,54,0,例えばサイン書く配信とか
1,15,54,0,1,15,58,0,事前にお届けするグッズと
1,15,58,0,1,16,3,0,もう既に販売中の配信チケットに700枚ね
1,16,3,0,1,16,6,0,合計700枚今ちょっと出てますけど合計700枚
1,16,6,0,1,16,11,0,あの直筆のサインが全員分入ることになったので
1,16,11,0,1,16,16,0,それをみんなでこう書きに行く配信とかも予定してるので
1,16,16,0,1,16,20,0,そのあたりもね期待いただけたらなと個人的に思ってるんですけど
1,16,20,0,1,16,28,0,700枚ってさ例えば30秒で1枚書いたとするじゃないですかサイン
1,16,28,0,1,16,32,0,そしたら700枚でしょ
1,16,32,0,1,16,37,0,であの30枚30秒かける700枚が
1,16,37,0,1,16,45,0,だいたいあれ6時間ぐらいになるなんないそんなかかんない
1,16,45,0,1,16,54,0,ちょっと今計算できないのでちょっと私割り算で結構積んでるタイプなんでちょっと分かんないんだけど
1,16,54,0,1,16,58,0,なるわなるんですよね
1,16,58,0,1,17,3,0,そうなんでね検証にならない
1,17,3,0,1,17,8,0,5時間50分か検証にならない感じでね
1,17,8,0,1,17,14,0,あの頑張っていきたいなって思うんですけどスーパーチャットもありがとうございます
1,17,14,0,1,17,21,0,というのもねあるしまあ告知とかもね頑張っていこうって感じなんですけど
1,17,21,0,1,17,27,0,いやこれはさあどうなんだろうなんか
1,17,27,0,1,17,31,0,すごいぶっちゃけた話をしてしまうと
1,17,31,0,1,17,38,0,すごいぶっちゃけた話をしてしまってもいいですか私は後でもうなくなっていることは多分ないと思うんだけど
1,17,38,0,1,17,49,0,私はね最初243枚売れてるって言われた時にあ243人も買ってくれたんだって私は思ったんですよね
1,17,49,0,1,17,56,0,なんかなんだろうな多分あの私はもともとアニマーレってそのそれぞれやっぱりその
1,17,56,0,1,18,4,0,がが強いからメンバーがアニマールのこの子を見てるとかこの子を特に応援してるっていう人が
1,18,4,0,1,18,9,0,見てくれているそうに多くてコラボとかを見に行くけど基本的にはこの子しか見てない
1,18,9,0,1,18,15,0,ソロ配信だったらこの子しか見てないっていうような方が多い印象だったんですよねだから
1,18,15,0,1,18,22,0,おそらくそのソロイベントとかだともっと多分そのなんだろうな
1,18,22,0,1,18,33,0,枚数の間隔ってどんどん違っていくと思うんだけどなんかなんだろうやっぱりそのメンバーも去年と比べて
1,18,33,0,1,18,44,0,抜けてるしうん引退とか卒業で抜けてるし救出のメンバーもいるしであの我々もねあの
1,18,44,0,1,18,55,0,まあ告知のタイミングもぬるりとしていたしぶっちゃけゴールデンウィークのその中に告知したから
1,18,55,0,1,19,3,0,他の大きなイベントもあったし重大告知みたいな配信も取らなかったんでね取らなかったっていうか
1,19,3,0,1,19,9,0,まあそういうふうにそのこの日にもう告知しちゃうのでみたいな形で告知したんで
1,19,9,0,1,19,21,0,で私それであれだけあんまり告知してない状態であの243人買ってくれたんだと思ったの
1,19,21,0,1,19,29,0,私なんてゴールデン神の方が告知してた申し訳ない
1,19,29,0,1,19,33,0,そうスタンプもねそうでしたねうん
1,19,33,0,1,19,45,0,だからあのなんかそういうのもねあってあの逆に私はものすごいイベントに対して
1,19,45,0,1,19,55,0,こんなになんか素の状態でアニマーレが出るからって言って内容もほとんどわからない状態で買ってくれる人が243人もいるんだと思って
1,19,55,0,1,20,3,0,実際直前になったら買おうっていうタイプの人ももちろんいると思うし
1,20,3,0,1,20,9,0,例えば推しがね推しのために買ったとしても推しがずっと出るわけじゃないじゃないですか
1,20,9,0,1,20,15,0,例えばこの子が好きだけどこの子がずっとその4時間5時間イベントに出るってわけじゃない
1,20,15,0,1,20,19,0,7000円のチケットを買ってくれる人がそんなに買う
1,20,19,0,1,20,25,0,何千円とかTシャツついてたら1万円なんだけどいるんだと思って
1,20,25,0,1,20,35,0,いや私はそれですごい気が引き締まったなって思います
1,20,35,0,1,20,43,0,もうなんだろうなもうあそこまで何でもかんでも言ってるからあれなんですけど
1,20,43,0,1,20,51,0,やっぱり最初どういうイベントにするかみたいなのってめちゃめちゃ自分の誕生日グッズしかりこういうイベントにしかり
1,20,51,0,1,20,59,0,7000円ってすごい意見を聞いてくれるんですよねメンバーの
1,20,59,0,1,21,14,0,であのその時にやっぱり個人的にはそのイベントグッズにあたってどういうターゲットでどういうコンセプトでやるかっていうのすごい大事だと思ってるんですよ
1,21,14,0,1,21,25,0,誰に対してどういうアプローチをしていってどう印象を付けるためのどういう体験をしてもらうための
1,21,25,0,1,21,33,0,そしてその体験からどんな感情を我々に抱いてもらうためのイベントなのかってすごい大事だと思って最初に組むのが
1,21,33,0,1,21,45,0,個人的な話で言うとやっぱりこういうふうにそのメンバーが抜けている状態で
1,21,45,0,1,21,55,0,初期メンバーのね、そうやいちかさんも直前に卒業してるっていう状態でアニマーレが結構すごい変わったなと思うんですよ
1,21,55,0,1,22,5,0,やっぱり空気感とかそれぞれのアニマーレに対する思いとかリスナーさんから見えるアニマーレの姿とかが変わったと思うから
1,22,5,0,1,22,14,0,個人的な思考で言うと無料でいいんじゃないかと思ったんですよね
1,22,14,0,1,22,20,0,無料で面白い企画やれるんだったらそれがいいと思ったの無料イベントで
1,22,20,0,1,22,26,0,そういう話ももちろん運営さんにもしたし
1,22,26,0,1,22,31,0,ターゲットは誰でコンセプトは誰なんですかみたいな話も聞いたは聞いたんだけど
1,22,31,0,1,22,44,0,あんまりなんかそのはっきり回答が得られないままというか我々もはっきりしないまましちゃった感じがやっぱりしてて
1,22,44,0,1,22,50,0,やっぱりそのいろんなイベントとかゴールデンウィークのいろいろなものとかね
1,22,50,0,1,23,0,0,っていうのが立て込んでしまっている中できちんとその辺が整理できなかったのはすごい私個人としても不正事だったなと思うし
1,23,0,0,1,23,14,0,やっぱりすごい強い思いとして自分がリスナーさんに対してこれを買ってくださいってお願いするのって
1,23,14,0,1,23,27,0,信用と私の信用を差し出しているというか感が伝わるかな
1,23,27,0,1,23,37,0,私が本当に納得してもしこれが気にならなかったら私の全部責任だって思ってるものじゃないと買ってくださいって言いたくないんですよ絶対に
1,23,37,0,1,23,46,0,だからなんかもちろん仕事ではあるからやれって言われたらもちろんやるんだけど
1,23,46,0,1,23,53,0,でもそれって仕事だからやれって言われたってやっちゃいけないんじゃないと思う気もしてて
1,23,53,0,1,24,0,0,だからそれが私にとってみればめちゃめちゃ難しかったんですよね今回
1,24,0,0,1,24,6,0,私はやっぱりリスナーさんにお金とか時間をかけてもらうんだったら自分が納得するものを出したいし
1,24,6,0,1,24,14,0,それで自分が納得できてない状態で出すっていうのは私の信頼の霧売りに他ならないんで
1,24,14,0,1,24,21,0,っていうのがすごい難しいなって思ってきちんと整理しないままできちゃったな
1,24,21,0,1,24,26,0,これまでっていうのが本当に後悔してるポイントなんですけど
1,24,26,0,1,24,37,0,でもやっぱりそれでああいうふうにしっかりした数字今何枚売れてるって話を聞いたりとかその後リスナーさんの意見とか
1,24,37,0,1,24,41,0,応援してるよっていう厳しいご意見もたくさんありましたね本当に
1,24,41,0,1,24,49,0,でも私はもっと今回のGoogleフォームに関してはマジでもっとお叱りくるかなと思ってたんだけど
1,24,49,0,1,24,53,0,めちゃめちゃ少なかったですね思ったよりわざわざGoogleフォームから送ってこないのかな
1,24,53,0,1,24,56,0,まあそれはいいんですけど
1,24,56,0,1,25,9,0,なんでやっぱり誰にどんなものを今回で言ったらやっぱりこういうふうにアニマーレメンバーを応援してくれてる人が
1,25,9,0,1,25,18,0,今までこの子しか見てなかったけどアニマーレの中にいるこの子も好きだなって思ってもらえるようなイベントにしたいし
1,25,18,0,1,25,28,0,その先にアニマーレっていいグループだなって思ってもらえるような空気とイベントの内容を
1,25,28,0,1,25,33,0,やっぱりメンバーがすごい能動的に作っていかないといけないと思うし
1,25,33,0,1,25,39,0,それがやっぱりああいう配信をした責任だなって思いますね
1,25,39,0,1,25,42,0,今回はヘイトが漢字に七死に言ってる?
1,25,42,0,1,25,50,0,だからあれなんかあの配信が終わった後にもしね見た方はちょっとわかるかなと思うんですけど
1,25,50,0,1,25,53,0,あの配信終わった後七死さんと喋る機会があって
1,25,53,0,1,25,59,0,いやヘイト管理ミスりましたって言ったらめっちゃ笑ってた
1,25,59,0,1,26,2,0,ヘイト管理ミスりましたね
1,26,2,0,1,26,4,0,いやそうですねそうですね
1,26,4,0,1,26,10,0,いやでもルカコさんも損してますよって
