start_s,end_s,text
1667,1670,人の同人誌の趣味も笑っちゃダメなんですよ
1670,1671,そう
1671,1672,だから、なんか
1672,1673,なんか
1673,1674,なんか
1674,1675,なんか
1675,1678,人の同人誌の趣味も笑っちゃダメなんですよ
1678,1679,だから
1679,1681,面白いなって言っちゃダメなんだけど
1681,1683,それほんとに聞いたとき爆笑したから
1683,1685,ちょっと来週のね
1685,1689,ランチミーティングで話したいと思います
1690,1692,コナン姉妹面白いよね
1692,1694,マジでやばいと思う
1694,1696,ということで私は別にですね
1696,1698,あのー
1698,1699,なんかなんでも
1699,1702,特に二成以外のおじゃらいがないので
1702,1704,個人的にはなんでも読むし
1704,1707,二次創作でどうなってても別に
1707,1710,個人的にはなんか
1710,1713,どうぞお好きにしてくださいという感じです
1713,1714,でなんか
1714,1716,嬉しいなと思うのは
1716,1718,同人誌も嬉しいけど
1718,1721,グッズとか作ってもらってるの見ると嬉しいですね
1721,1723,今回も多分コミケで
1723,1724,えーと
1724,1725,ピンズとかね
1725,1727,あのマグカップとか
1727,1730,作ってくれてた方いたかな
1730,1731,すごい可愛いなと思って
1731,1733,個人的にも欲しかったんですけど
1733,1735,うん
1735,1736,と思いました
1736,1737,嬉しいですね
1737,1739,そういう風に作っていただけるのが
1739,1741,うん
1741,1743,えーということで
1743,1745,めずきさんこれで回答なってたらいいんですけど
1745,1747,お便りありがとうございました
1749,1751,では次
1753,1754,えー
1754,1757,思春期の手さばきさんからの付属歌
1757,1758,お便りありがとうございます
1758,1759,六子さんこんばんは
1759,1760,こんばんは
1760,1764,今年の4月英国のサブカル研究所の界隈では
1764,1766,ちょっとした事件がありました
1766,1769,マンチェスタ大学で資格人類学を勉強している
1769,1771,カール・アンダーソンさんは
1771,1773,私は一人じゃない
1773,1775,我らみんなは一人だ
1775,1779,G行為を利用した諸多文化の民族史研究
1779,1780,を発表しました
1780,1782,これ論文のタイトルですね
1782,1784,それはカールさん自ら3ヶ月間
1784,1786,諸多ものだけでオナニーした
1786,1788,これ不正義にしてくれてるんですけど
1788,1789,読んじゃった まあいいか
1789,1791,体験と結果をまとめた論文でした
1791,1794,論文が正式にジャーナルに選択され
1794,1796,大衆に公開された後から
1796,1797,道徳的にありえない
1797,1799,オナって博士号が取れるのか
1799,1800,オナニー研究と言えるのか
1800,1803,等々の批判がありましたが
1803,1804,カールさんを指導した
1804,1806,マンチェスタ大学のシャロン・キンセラ教授
1806,1809,過去 彼女はロリコン文化の専門家です
1809,1810,過去都市は
1810,1813,いつも自分の研究が導く方向に進むよう
1813,1815,応援していたと
1815,1819,彼の研究結果に感謝するとインタビューしました
1820,1822,インタビューに答えましたかな
1822,1824,カールさんは研究の途中で
1824,1826,スランプに陥っていたと告白し
1826,1827,その打開策として
1827,1829,自分の研究を手伝ってくれた参加者たちと
1829,1832,同じ経験をしてみる方法を思い出したとのことです
1832,1835,そしてちょうどその時期に長く付き合っていた恋人と別れ
1835,1837,一人暮らしになったことも
1837,1839,研究への意思を強くしてくれた要素で
1839,1841,研究の正当性のため
1841,1843,諸多もの以外に性的な刺激になれるものは
1843,1846,生活から徹底的に排除していたとも発言しました
1846,1849,僕もサブカルを愛しサブカルで生きる一人として
1849,1852,これからも彼のような熱意を持った研究者が
1852,1854,増えるように心から願っています
1856,1857,ということでね
1858,1859,いやすごいね
1860,1862,これねやっぱり本当実在してるのか
1862,1863,私も一応調べました
1863,1865,多分実在してると思うんだけど
1866,1868,すごいしっかりした偽のサイトか
1868,1869,偽の論文か
1869,1871,本当に実在してるか
1871,1873,多分8割9割が実在してると思う
1873,1875,フェイクニュースじゃないですよ多分
1880,1881,すごいよね
1881,1883,そうだから欧米って
1883,1885,文化的にさ
1886,1889,少人性愛者に対して
1890,1893,結構厳しいというか
1894,1895,なんかチップ
1895,1898,善家がある人に対してチップ埋め込んだりとか
1898,1902,その周辺の子供を
1902,1904,子供のいる家庭が
1904,1905,その善家
1905,1906,性犯罪の
1906,1909,少人性愛の善家がある人の場所が
1909,1911,分かるようになったりとかするって話を
1911,1914,聞いたことがあるから
1914,1918,かなり厳しいと思うんですよね
1918,1920,これはもう本当かどうか分かんないけど
1922,1925,普通にその子供とかに対して
1925,1930,危害を加えた犯人が
1930,1932,収監されると
1932,1935,一番ひどくボコされるらしい
1935,1937,監獄の中で
1939,1941,という話を聞いたことがある
1942,1945,一番ボコボコにされるっていう
1947,1949,アメリカの監獄って
1949,1951,ドラマのイメージしかないけど
1951,1953,本当にあんなにとんでもない
1953,1956,世界が広がっているのかな
1956,1958,何かで聞いたよな
1959,1962,クレイジージャーニーとかだったかな
1962,1965,ちょっと覚えてないんですけど
1967,1969,だからね
1970,1972,それがちょっと定かではないんで
1972,1974,話半分に聞いてほしいんですけど
1974,1977,そういう中できちんと学問としてね
1978,1982,研究してる方がいるっていうのと
1982,1984,こういうふうにきちんとね
1984,1989,自分の体を使って研究して
1989,1992,その成果をきちんと論文にまとめているっていうのが
1992,1996,本当に素晴らしいなと思いました
1996,2008,はい
2016,2022,やっぱりアメリカの監獄って
2022,2028,やっぱり日本のイメージとは全然違うというか
2028,2030,私も正直日本の監獄のイメージって
2030,2033,完全にゴールデンカムイしかないから
2033,2037,ゴールデンカムイに準ずることになるんだけど
2037,2041,それも多分現状との乖離はなはだしいと思うんで
2041,2045,まあ多分全然違うのかなって思いますよね
2045,2050,結構監獄を舞台にしたドラマって
2050,2055,結構海外ドラマだと割と多いイメージがあって
2055,2059,あとオレンジーズニューブラックとかあったかな
2059,2063,あの女性のね
2063,2069,習慣されている女性たちが主人公の
2069,2074,オレンジーズニューブラック
2074,2075,うんあるよな
2075,2080,あと個人的にはシカゴも好きですかね
2080,2082,シカゴのね
2082,2085,確かミュージカルの映画になってて
2085,2089,キャサリン・セタジョンズとかレネ・セルビガーとか出てるんだけど
2089,2091,なんかそれがね
2091,2098,もともと出てくるいい女が片っ端からの前科者っていう
2098,2103,そういう感じで途中で監獄でめちゃめちゃ歌って踊るんだけど
2103,2108,そのシーンがすごい好きですね
2108,2112,プリズンブレイクってなんか聞いたことあるな
2112,2116,プリズンブレイク聞いたことある
2116,2119,あ、ジョジョ
2119,2122,ジョジョもた…あ、グリーンマイル
2122,2127,グリーンマイルも確か見たことある気がするな
2127,2133,見たことある気がするし知るほどない気はする
2133,2136,シカゴはミュージカルですね
2136,2142,はい、ということでもしよかったらぜひとも見てみてください
2142,2143,シカゴ
2143,2146,オレンジヌーブラック私は見てないんですけど
2146,2153,知人からねお勧めされたんで面白いと思います
2153,2158,では次ですねお便りを読ませていただきたいと思います
2158,2162,匿名の方からのお便りでした
2162,2163,六甲子さんこんばんは
2163,2166,最近の若い子は苦痛点を使わないという話を聞きました
2166,2169,どこか冷たい印象を受けるそうです
2169,2171,重大向けの相談機関のマニュアルには
2171,2175,親近感を出すために苦痛点を使わないという指示もあるのだとか
2175,2178,とはいえ苦痛点をつけないのは今に始まったことではなく
2178,2180,5チャンネルが2チャンネルだった頃
2180,2184,苦痛点をつけるとゴミつきと煽られる文化がありました
2184,2185,へーそんなのあるんだ
2185,2190,そこで七紫インクの各メンバーの苦痛点の使用状況を確認してみました
2190,2193,対象はツイッターの最新投稿50件ほど
2193,2195,youtubeのコミュニティを10件ほど
2195,2197,配信の概要欄を10件ほどです
2197,2199,最初はツイッターだけにしようと思っていたのですが
2199,2203,媒体によって大きく異なる人が数人いたのでyoutubeも確認しました
2203,2205,とはいえ厳密に数えたわけではなく
2205,2210,ざっと眺めた印象のためあくまでも参考程度に
2210,2212,全員を紹介すると長すぎるため
2212,2215,全体的な傾向と特徴的な人を紹介します
2215,2218,まず全体としては苦痛点を対応する人は少数派です
2218,2222,また短い文章やカジュアルな柔らかい文章では苦痛点の使用率が低くなり
2222,2227,長い文章やお知らせなどの固い文章では使用率が低くなる傾向が見られます
2227,2229,ツイッターでの苦痛点の使用率は低めです
2229,2232,特に苦点はあまり使用されません
2232,2235,文末は絵文字やエクスクロメーションマークが対応されます
2235,2239,文末に何もないブランクな文章を書くのは数人だけです
2241,2245,youtubeのコミュニティはツイッターより苦痛点の使用率が高くなります
2245,2250,とはいえほとんど使用しない方が多数派です
2250,2253,配信の概要欄は配信ごとのコメントを必ず付ける人と
2253,2255,テンプレート分だけの人がおり
2255,2257,そもそもの文集量に差があります
2257,2260,配信ごとのコメントは短文のためか苦痛点はほぼ使われません
2260,2265,テンプレートの中で苦痛点を使っている人は比較的多めです
2267,2269,次に個々人の内容を紹介します
2269,2273,苦毒になるため継承を省略しておりますがご容赦ください
2273,2275,苦痛点を対応するのは
2275,2280,稲葉はねる、風見九九、月の岸よる、西雄寿明有、安土ゆげ、鈴見禰毛です
2280,2282,禰毛多が意外でした
2282,2291,苦痛点を対応するが苦点をほぼ使用しないのは 宇野原泉、奏で観音、首相クリス、赤根観音、紫水奇儀です
2291,2296,このうちクリスと奇儀ちゃんだけは文末がブランクの文章を対応していました
2296,2301,関白無古、美子は苦痛点をほぼ使用せず苦点を対応する文章を書きます
2301,2304,このような書き方をするのは美子ちゃんだけです
2306,2311,また一般的な傾向として一文が長くなると苦痛点の使用率は上がりますが
2311,2315,石崎安孝は文が長めな傾向があるわりに苦点を使いません
2315,2317,苦点もほぼ使用しません
2317,2320,またメディアによって大きく異なる人もいます
2320,2323,大浦る加古、湖南美愛は媒体によって異なります
2323,2328,ツイッターでは苦痛点をほぼ使用しませんが コミュニティや概要欄では苦痛点を対応する傾向があります
2328,2331,F1とコモニュメントでも媒体で異なります
2331,2336,全体的に苦痛点を使用しない傾向が見られるのですが ツイッターに限り苦痛点を対応します
2336,2341,その他の人はサワールド苦痛点の使用率は低めです
2341,2346,こうして眺めてみると苦痛点一つとっても 各人の個性がありほっこりしました
2346,2349,個人的には意外だったのはるか子さんです
2349,2351,苦痛点を対応するイメージだったのが
2351,2354,ツイッターでは苦痛点をほぼ使用していないのが意外でした
2354,2356,意識して変えられているのでしょうか
2356,2358,ということで
2358,2362,すごいねしっかり調べていただいて面白いですね
2362,2366,なんかあの結構ね
2366,2369,あの個人的には
2369,2371,あのー
2371,2373,痛点というか
2373,2377,エクスクラメーションマークの使い方に
2377,2379,あの癖がある人と
2379,2381,あと
2381,2383,三点リーダー
2383,2385,あの点点点ですね
2385,2386,うん
2386,2387,あれの使い方に
2387,2389,あの癖のある人が
2389,2393,結構わかりやすいなと思ってて
2393,2395,あのー
2395,2398,多分月ノ木チロルと
2398,2403,あとひよくのクロスピースの小白百合さんは
2403,2404,あのー
2404,2407,エクスクラメーションマークが反覚なんだよね
2407,2408,そう
2408,2410,だからそれがすごい
2410,2412,あ、二人
2412,2413,多分二人だけだと思う
2413,2415,7thincの中だと
2415,2418,私7thincに所属してるんですけど事務所が
2418,2421,反覚のエクスクラメーション使ってるのは
2421,2422,二人だけだと思う
2422,2424,で
2424,2426,結構特徴的なのは
2426,2430,あの湯野原泉の点の使い方で
2430,2433,湯野原泉は確か三点リーダーじゃなくて
2433,2434,普通に
2434,2436,あのー
2436,2438,普通のね
2438,2440,なんていうんだっけ
2440,2442,中点みたいな
2442,2446,なんかあの点ってやつを二つしか使わないんだよね
2446,2448,確か
2448,2450,中黒
2450,2452,を
2452,2456,多分ね二つしか使わない文章が多い気がする
2456,2457,そう
2457,2458,なんで
2458,2460,なんかそれがねすごい特徴的でね
2460,2462,結構覚えてる
2462,2463,うん
2463,2466,だからあのー
2466,2470,結構ね人の文章の癖を
2470,2473,見るの好きなんだけど
2473,2475,うん
2475,2476,私結構あの
2476,2478,そうそう文体だけは誰が勝てる
2478,2480,かえたか当てる企画できそうだと思う
2480,2481,割とできるね
2481,2483,あとね
2483,2485,あのクギタスは本当に分かりやすい
2485,2487,クギタスは絶対なんかあのシュシュシュシュシュって
2487,2490,なんか誰かを殴ってる
2490,2491,あのー
2491,2493,なんだっけ絵文字?あれ?
2493,2495,なんて言うんだっけあれ
2495,2497,あのシュシュシュってやつと
2497,2499,あとなんか寝っ転がってるやつがついてると
2499,2501,あクギタスだなと思う
2501,2504,はははははは
2504,2505,顔文字
2505,2507,そう
2507,2508,なんすよね
2508,2511,めちゃめちゃ分かりやすい
2511,2512,うん
2512,2514,あとなんかあの語尾がちょっと
2514,2515,あのーえ?
2515,2516,なんだこの語尾って言うときは
2516,2518,だいたい草屋一華ね
2518,2520,うん
2520,2523,おはゆとかがあの結構ありますね
2523,2525,どういうおはようをどうやって活用したら
2525,2527,おはゆなんだという
2527,2528,そう
2528,2532,がそれが結構草屋一華感ある
2532,2536,この間なんか始まる始まるわよえーって言ってたよね
2536,2539,はははははは
2539,2542,はははは
2542,2546,始まるわよえーって言ってた
2546,2547,ひらひかり?
2547,2549,ひらひかりはもう発狂してたらひらひかりです
2549,2551,分かりやすいよね
2551,2552,うん
2552,2555,あの1文目と2文目の
2555,2558,あのー意味的なつながりがなかったら
2558,2561,それがひらひかりだと思ってる私は
2561,2565,クレイジーがいい意味でクレイジーツイッター
2565,2568,ツイッターガールだからひらひかりは
2568,2570,分かりやすいですねうん
2570,2573,っていう感じで結構ね人によって
2573,2576,あの癖が出るなーって思ってたんで
2576,2579,面白いなーって思いました
2579,2583,最近なんか一番最近ツイート誰がしてるのかな
2583,2585,なーシンク見てみよう
2585,2587,あらー
2587,2591,あーでもなんか点の使い方面白いな確かに
2591,2594,あと絵文字もやっぱ癖出るよね
2594,2596,うん
2596,2600,絵文字も癖出るなーと思うし
2600,2604,私基本的にあの絵文字使うのめっちゃ苦手だから
2604,2607,はははははは
2607,2610,絵文字使うのがめっちゃ苦手
2610,2615,なので全部秘奏感なっちゃうから
2615,2619,全部秘奏感なっちゃうから苦手なんだけど
2619,2621,割となんかあのー
2621,2624,あこの絵文字使ってるってことはこの人かな
2624,2627,みたいなのはなんとなくありますね
2627,2629,うん
2629,2632,最近動物動物使ってるのはあのー
2632,2636,動物の絵文字の絵文字の絵文字の絵文字の絵文字
2636,2640,最近動物動物使ってるのはあのー
2640,2643,いちかさんに動物使ったらって言われたから
2643,2645,絵文字動物使ったら
2645,2647,なんか全然その子供
2647,2650,なんか動物とか好きなんですけど結構
2650,2654,あんま動物好きに見えないっていう話をしたら
2654,2657,なんか絵文字絵文字使えば動物の絵文字使えば
2657,2659,適当なアドバイスもらったんで
2659,2662,売ってますはい
2662,2665,っていう感じですね
2665,2667,今後もねあのー
2667,2670,七死インクメンバーのね
2670,2672,その文章の癖など
2672,2675,あと品質ごくとかね
2675,2679,ありましたら研究結果ぜひお待ちしております
2679,2681,よろしくお願いします
2681,2684,あそうそう柔らかくなるからいいんだよ
2684,2686,この間そのアークっていうゲーム
2686,2689,あのゆげさんがねサーバー立ててくれて
2689,2692,七死インクのサーバー立ててくれたんで
2692,2695,みやちと二人でこの間入ったんですけど初めて
2695,2700,その時に本当に何にも知らない状態で始めたんですけど
2700,2703,なんかねリスナーさんがいろいろね
2703,2706,何から何まで教えてくださってて
2706,2709,でそのいろいろ教えてくれるアドバイスのコメントに
2709,2712,全部ハートつけてくれてたのだから
2714,2716,すごい柔らかいし
2716,2718,すごい面白かった
2718,2721,途中でなんかお母さんみたいになってきて
2721,2724,最初ひそかだったんだけどだんだんだんだんなんか
2724,2726,ちょっとねなんだろうな
2726,2732,隣に住んでるすごい世話焼きのおばさんみたいな感じになってきて
2732,2735,とても親近感がわきました助かりました
2737,2740,そうまあ指示込めというかアドバイスね
2740,2744,アドバイスなんとかしろっていう人はね本当に一人もいなかったし
2744,2747,こうした方がいいんじゃないとかこれでできるよみたいな感じのことを
2747,2749,つけてくれてよりね
2749,2753,柔らかく伝えてくれてる人がいて大変助かりました
2753,2755,ありがとうございます
2757,2759,隣に住んでる世話焼きの人かね
2762,2765,ということででは次のお便り読ませていただきたいと思います
2765,2767,47分だやっべ47分だやっべ
2767,2770,ネオ県六園さんからのお知らせですねお便りありがとうございます
2770,2773,ルカコさんリスナーの皆さんこんばんはこんばんは
2773,2779,皆さんはファントムバイブレーションシンドローム日本語で幻想振動症候群と呼ばれるものをご存知でしょうか
2779,2782,やたら中に見えたかっこいいネーミングに反して実態は
2782,2786,え今スマホ震えた?気のせいだったわってなるアレです
2786,2791,自分がスマホ依存症気味なこともあったか結構な頻度でこれになるのですが
2791,2793,仕事中だと少し事情が変わります
2793,2799,私は普段仕事中はすぐに取り出せるようにスーツや作業着の内ポケットにスマホを入れているのですが
2799,2802,最近ついにファントムが現れたのです
2802,2808,しかし内ポケットにファントムが現れるということは必然的に振動を感じるところも変わってきます
2808,2810,そう、乳首です
2810,2814,かすかに感じる乳首へのファントムにスマホを取り出すもそれは幻想
2814,2818,仕事という常在線上において戦場ですね
2818,2822,乳首へのファントムは集中力に大きな影響を与えます
2822,2825,このままではファントムに乳首を開発されてしまいます
2825,2828,ファントム乳首ディベロップメントです
2828,2832,よかこさん、リスナーの皆さん、私はファントムに抗うべきでしょうか?
2832,2837,それともファントムに身を委ね、新たな扉を開くべきでしょうか?
2837,2840,というね、お悩み来てます
2840,2842,あ、ちょっとひそかが興奮しちゃってますね
2842,2845,興奮しちゃうじゃないかって言ってるな
2845,2848,これはね、あのー
2848,2851,1点気をつけないといけないと思うんですけど
2851,2856,これさ、あのー多分スマートフォンが1台しかなくて
2856,2859,普通その、多分シャツとかの
2859,2862,スーツのシャツのポケットって片方しかないよね
2862,2866,ってことはさ、しかもなんかほぼ左じゃない?
2866,2868,ほぼ左についてる?あ、ちょっと右についてる?
2868,2871,ちょっと分かりかねるんですけど
2871,2875,ということはさ、片方の乳首だけ開発されるってことじゃん
2875,2877,だからなんか両方
2877,2880,両方一緒に開発した方がいいんじゃない?
2880,2882,ほぼ左?
2882,2883,そう
2883,2886,だってそしたらだからアンバランスじゃないですか?
2886,2888,いざ、だから
2888,2891,まあそのー
2891,2894,いざ、参る!みたいな感じになった時に
2896,2898,なんかそのー
2898,2902,片方だけ異常に左化してたりしたら
2902,2906,それはそれでちょっと面白おかしいのでは?
2906,2908,まあ、もちろんね、片方
2908,2911,まあサイズっていうのはね、人間の顔もね
2911,2916,左右対称であることはマレーという話も聞いたことがあるんですけども
2916,2919,まあだからそのー
2919,2922,まあ、そういうこともあるか
2926,2927,そういうこともあるか
2927,2930,まあアンバランスな方がいいか
2931,2937,なんかコメントで見たらなんかアンバランスな方がエッチだよっていうコメントがあったんで
2937,2941,なんか私の考え方がちょっとあれだったのかもしれないですね
2941,2946,固定観念に囚われたつまらない思考をしていたのかも
2948,2950,アンバランスな乳首開発
2952,2955,えっ、ちょっと天才のコメント見つけた
2955,2958,右は君のために取っておいたよって言える
2958,2960,えっ、天才じゃん
2960,2962,左は開発しちゃったけど
2962,2965,右はちゃんと用意しといたよって
2965,2967,開発地域だよって
2967,2968,いいね
2968,2972,えっ、それぜひ使ってくださいね皆さん
2973,2976,ここが君のフロンティアだよって
2978,2979,なんだこのラジオ
2979,2981,じゃあ次行きます
2985,2987,ちょっとね新コーナーなんですけど
2987,2995,あばばばばばばば
2996,3001,BGM大きかったりとかしたらご指摘お願いします
3004,3005,ということでね
3005,3009,こちらはリスナーの皆さんに
3009,3013,中継でね今の状態をですね
3013,3016,教えていただくっていうコーナーになっておりますので
3016,3019,ちょっとマンネリ化を防ぐために
3019,3022,皆さんご協力のほどよろしくお願いします
3022,3024,ボリショイさん
3024,3027,中継のボリショイさん
3027,3030,はい、こちら中継のボリショイです
3030,3032,私は現在社内にいます
3032,3037,先ほど会社の従約が全社員に向けたメールで
3037,3039,一心情の都合で退職します
3039,3042,今までお世話になりました
3042,3044,という短文メールが届いて
3044,3046,社内が騒然としています
3046,3047,何があったのでしょうか
3047,3050,我々の明日はどうなるのでしょうか
3050,3052,現場からは以上です
3052,3054,転職サイトを開く
3054,3055,かご閉じ
3055,3056,というね
3056,3058,ちょっと中継がきました
3058,3060,とんでもないことになってますね
