start_h,start_m,start_s,start_ms,end_h,end_m,end_s,end_ms,text
0,41,7,0,0,41,9,0,私はそれが一番なので
0,41,9,0,0,41,10,0,これからもね
0,41,10,0,0,41,11,0,はははは
0,41,11,0,0,41,13,0,何を言ってんだほんと
0,41,13,0,0,41,15,0,はははは
0,41,17,0,0,41,19,0,今なんかすごい力説してて
0,41,19,0,0,41,21,0,何言ってんだこいつって思っちゃったな
0,41,21,0,0,41,23,0,はははははは
0,41,25,0,0,41,27,0,何言ってんだろう私
0,41,27,0,0,41,29,0,何言ってんだろうね
0,41,29,0,0,41,30,0,はい
0,41,30,0,0,41,33,0,みんなもカジュアルに病院に行こうという結論でした
0,41,33,0,0,41,43,0,では次のコーナーに行きたいと思います
0,41,43,0,0,41,47,0,次のコーナーはこちら勝手にメールテーマということで
0,41,47,0,0,41,52,0,こちらねいきなり我に帰るな
0,41,52,0,0,41,57,0,そうだよね人生って我に帰ったらおしまいだもんね
0,41,57,0,0,41,59,0,勢いでなんとかやっていかなきゃね
0,41,59,0,0,42,1,0,元気が出ました今
0,42,1,0,0,42,4,0,こちらの勝手にメールテーマというコーナーなんですけど
0,42,4,0,0,42,7,0,本当はねリアルタイムでメールテーマを出したいんですけど
0,42,7,0,0,42,10,0,それがちょっとワンオペのためかなわないので
0,42,10,0,0,42,14,0,皆さんから私がどんな感じで脱線しているのかというのをですね
0,42,14,0,0,42,19,0,予想して送ってもらおうというコーナーとなっております
0,42,19,0,0,42,20,0,では1つ目
0,42,20,0,0,42,27,0,アメ中継さんからの勝手にメールテーマ
0,42,27,0,0,42,31,0,私は甲子園に出ている高校球児たちが昔はお兄さんだったけど
0,42,31,0,0,42,35,0,もう自分が彼らより年上であることに気づいたときと
0,42,35,0,0,42,42,0,新ビオフェルミンS状の醸剤が2状から3状になったときの日経ですかね
0,42,42,0,0,42,44,0,さて今週のメールテーマは
0,42,44,0,0,42,48,0,俺って大人になったんだなぁと感じる瞬間でしたね
0,42,48,0,0,42,52,0,特にビオフェルミンに関しては15歳になると2状から3状になるのですが
0,42,52,0,0,42,54,0,長い間ずっと2状飲んできたのに
0,42,54,0,0,42,59,0,俺もう3状なのかとなる瞬間は感慨深いものがありました
0,42,59,0,0,43,5,0,ぜひロカコさんそして皆さんの大人になったんだなぁと感じた経験を教えてください
0,43,5,0,0,43,9,0,ということです
0,43,9,0,0,43,13,0,今さぁなんか今なんだろう切り替えてね
0,43,13,0,0,43,15,0,今我に帰って切り替えて
0,43,15,0,0,43,18,0,あの大人になった瞬間かみたいな
0,43,18,0,0,43,20,0,真面目な話しようと思ったんだけど
0,43,20,0,0,43,27,0,コメントにさ二股の人は5人集まったら星が作れるねっていうコメントが流れていったんで
0,43,27,0,0,43,31,0,ちょっと一気にさ情景が浮かんでしまってさ
0,43,31,0,0,43,38,0,要はおしっこが二股に分かれる人が5人で真ん中に中央に向かって放尿したら
0,43,38,0,0,43,40,0,星になるってことを言いたいんですよね
0,43,40,0,0,43,45,0,よくなんかあのリアルが充実している画像素材として出てくる
0,43,45,0,0,43,51,0,指で星マーク作るやつみたいなことでしょ
0,43,51,0,0,43,55,0,それはなんかどういう思考回路でそれが発生する
0,43,55,0,0,43,57,0,一体発生するんですかね
0,43,57,0,0,44,3,0,あでもなんか二股の人が5人揃ったら星になるんだ
0,44,3,0,0,44,5,0,ってならないよね人はね
0,44,5,0,0,44,10,0,どういうシナプスの繋がり方をしたらそうなるんだろうね
0,44,10,0,0,44,14,0,面白いね
0,44,14,0,0,44,21,0,はいということでね皆さんが大人になったなと思う瞬間はどこですか
0,44,21,0,0,44,27,0,私はねやっぱりなんか買ったゲームを積んだ時ですね何回か話したかもしれないけど
0,44,27,0,0,44,39,0,なんかやっぱり小学生の頃ってゲーム手に入れたらもうそれをもうずっとやってたじゃないですか
0,44,39,0,0,44,45,0,そもそもやっぱゲームのそのなんだろうソフトを買ってもらえるということ自体が
0,44,45,0,0,44,50,0,1年にそうバコスカあるわけでもないんで
0,44,50,0,0,45,1,0,だから買ってもらった瞬間にうわーって帰ってすぐハードに刺して始めますよね
0,45,1,0,0,45,6,0,最近はでもやっぱスイッチのソフト買っても
0,45,6,0,0,45,11,0,あれそういえばこれなんか開封もしてないなみたいな
0,45,11,0,0,45,16,0,開封もしてないなみたいなやつ結構あるんだよね
0,45,16,0,0,45,19,0,なんかスチームとかもなんかセールで買うけど
0,45,19,0,0,45,24,0,は?これ全然やってないなみたいなのも本当に多いです
0,45,24,0,0,45,30,0,ずっと説明書読んでたカレーの中で説明書読んだそうだよね
0,45,30,0,0,45,35,0,そんな可愛らしい頃があったんですねいや可愛い頃ありましたよ
0,45,35,0,0,45,39,0,ずっとねなんかクリアできるまでとか
0,45,39,0,0,45,45,0,なんかトロフィーコンプするまでゲームやり込んでいた時代が私にもありました
0,45,45,0,0,45,50,0,なんか今はやっぱりこんなにゲームを積んでしまって
0,45,50,0,0,45,53,0,なんか大人になったなーって思う
0,45,53,0,0,45,58,0,買った本とか買った漫画とかも読んでないやつ結構あるし
0,45,58,0,0,46,5,0,なんかそれってすごい子供の頃の自分から考えたらもう信じられないことですよね
0,46,5,0,0,46,9,0,私だって近所の本屋で漫画買ったら
0,46,9,0,0,46,12,0,あのシュリンクっていうその
0,46,12,0,0,46,17,0,あるじゃないですかビニールまとわりついてるでしょ買ったコミックスに
0,46,17,0,0,46,24,0,それを見せてた瞬間に破いて家帰りながら読んでたもんね
0,46,24,0,0,46,29,0,家帰りながら読んでたもんそういう情熱がもうない
0,46,29,0,0,46,33,0,ないんだ寂しいよ
0,46,35,0,0,46,41,0,ということでねなんか何かしらに熱中したりとか
0,46,41,0,0,46,49,0,なんかすごいこれが本当に心から絶対にこれが欲しいとか
0,46,49,0,0,46,55,0,そういうのがもうなくなっちゃったんだな
0,46,56,0,0,46,59,0,寂しいよ
0,46,59,0,0,47,3,0,なんかもうこれあるといいなもちろんありますよ
0,47,3,0,0,47,6,0,これあれがあったら便利だなと思うけど
0,47,6,0,0,47,9,0,本当にこれがもう何をかなぐり捨てたって欲しい
0,47,9,0,0,47,14,0,クリスマスに絶対絶対絶対買ってほしいってのがもうない
0,47,14,0,0,47,18,0,なんか寂しいから寂しいから次のお便り読もうと思います
0,47,18,0,0,47,23,0,話題変えない話題変えよう
0,47,23,0,0,47,27,0,ちょっとつらいからさ
0,47,27,0,0,47,31,0,次のお便りこの曲用意しとこうかな
0,47,31,0,0,47,33,0,ちょっと待ってくださいね
0,47,33,0,0,47,36,0,どこに行っちゃったかな
0,47,36,0,0,47,41,0,ぜひね皆さんが大人になったなっていう瞬間もあったら
0,47,41,0,0,47,46,0,タグ等でねお知らせいただけたらと思います
0,47,46,0,0,47,54,0,なんかこんな大人になりたかったんだっけ
0,47,54,0,0,47,57,0,どんな大人になりたかったんだっけ
0,47,57,0,0,48,1,0,涙出てきちゃう
0,48,1,0,0,48,8,0,よし次のお便り読むぞ
0,48,8,0,0,48,16,0,では次アーモンドヒマワリさんからの勝手にメールテーマ
0,48,16,0,0,48,19,0,エルカコさんリスナーの皆さんこんばんは
0,48,19,0,0,48,22,0,寒暖差の激しい今日この頃皆様いかがお過ごしでしょうか
0,48,22,0,0,48,24,0,さて今週のメールテーマはと
0,48,24,0,0,48,26,0,ここでちょうどお時間のようですね
0,48,26,0,0,48,29,0,アーモンドヒマワリさんお便りありがとうございました
0,48,29,0,0,48,40,0,一旦ここで c ゲームです
0,48,40,0,0,48,45,0,君絵描くの得意じゃんポスター手伝ってよ
0,48,45,0,0,48,50,0,いつもクラスの中心にいる君が突然クラスの日陰ものが僕を捕まえた
0,48,50,0,0,48,55,0,いつもの音に書いてるの知ってるようまいよね
0,48,55,0,0,48,59,0,会話なんてしたことない君のそのくったくのない笑顔が眩しくて
0,48,59,0,0,49,3,0,その瞬間君のために書きたいと思えたんだ
0,49,3,0,0,49,10,0,そんな青春を過ごした君もそうでないあなたも一緒に青春取り戻そう
0,49,10,0,0,49,23,0,アニマーレ4周年イベントアニマーレ学園祭6月18日6時開幕チケット発売中
0,49,23,0,0,49,29,0,ということで今週のメールテーマはアニマーレ学園祭キュンとする妄想ラジオCMより
0,49,29,0,0,49,32,0,漫画化志望とポスター編でした
0,49,32,0,0,49,36,0,みんなキュンとするドラマ自体のCM好きだよな
0,49,36,0,0,49,41,0,なおシリーズものであと数編用意しましたのでご覧ください
0,49,41,0,0,49,45,0,めちゃめちゃいっぱい作ってくれてる
0,49,45,0,0,49,58,0,これもやっとくか
0,49,58,0,0,50,4,0,野球少年と体育館裏編
0,50,4,0,0,50,8,0,文化祭の体育館裏なんてなんかドラマみたいだね
0,50,8,0,0,50,13,0,祭りの熱気であからむ君に見とれた僕は言葉を忘れる
0,50,13,0,0,50,17,0,ドラマみたいな一言お願いね
0,50,17,0,0,50,21,0,わざと冗談めかした笑顔で君を優しく促してくれる
0,50,21,0,0,50,26,0,伝えよう気遣い上手な君にまっすぐ直球勝負で
0,50,26,0,0,50,30,0,そんな青春を過ごした君もそうでないあなたも
0,50,30,0,0,50,32,0,青春はもうすぐそこに
0,50,32,0,0,50,40,0,アニマーレ4周年イベントアニマーレ学園祭6月18日6時開幕チケット発売中
0,50,40,0,0,50,48,0,よくできてるな
0,50,48,0,0,50,53,0,では次
0,50,53,0,0,50,59,0,文学部員と演劇編
0,50,59,0,0,51,5,0,どうしてもこの愛を叫ぶシーンのセリフしっくりこないんだよな
0,51,5,0,0,51,15,0,アンパン食べつつ1時間いまだ台本は進んでいないそうだ試しに私に告白してみてよ
0,51,15,0,0,51,23,0,眉一つ動かさずつぶやくあなたその表情を崩したくて今とっておきの言葉を告げる
0,51,23,0,0,51,29,0,そんな青春を過ごした君もそうでないあなたも青春はいつも今しかない
0,51,29,0,0,51,44,0,アニマーレ4周年イベントアニマーレ学園祭6月18日6時開幕チケット発売中
0,51,44,0,0,51,47,0,間違えた
0,51,47,0,0,51,50,0,こっちだった
0,51,50,0,0,51,55,0,他にも出展班と唐揚げ編巡回係とおもちゃ編と妄想は膨らみますね
0,51,55,0,0,51,59,0,アニマーレ学園祭にもこんな勤が詰まっているかどうかはわかりませんが
0,51,59,0,0,52,2,0,一緒に青春過ごせるこの機会逃すわけにはいかないですね
0,52,2,0,0,52,4,0,ということで
0,52,4,0,0,52,7,0,えっなんかやってる
0,52,7,0,0,52,10,0,ポカリンとかの担当者の人
0,52,10,0,0,52,13,0,なんかシーブリーズとポカリンの担当者の方
0,52,13,0,0,52,17,0,アーモンドひまわりさんは
0,52,17,0,0,52,20,0,めちゃめちゃいいじゃないですか
0,52,20,0,0,52,24,0,私の文学部員と演劇編好きだな
0,52,24,0,0,52,28,0,どうしてもこの愛を叫ぶシーンのセリフしっくりこないんだよな
0,52,28,0,0,52,32,0,っていう人に対してそうだ試しに私に告白してみてよ
0,52,32,0,0,52,35,0,眉一つ動かさずつぶやかなた
0,52,35,0,0,52,38,0,その表情を崩したくて今とっておきの言葉を告げる
0,52,38,0,0,52,40,0,ポカリンちゃん
0,52,40,0,0,52,44,0,シシーレモンかもしれない
0,52,44,0,0,52,46,0,すごかった
0,52,46,0,0,52,48,0,すごい爽やかだった
0,52,48,0,0,52,53,0,こんなイベントになるのかな
0,52,53,0,0,52,56,0,こんなイベントになるのかどうかはわからないけど
0,52,56,0,0,53,3,0,CMはねイメージを皆さんにお伝えするっていうのが目的だから
0,53,3,0,0,53,6,0,実際に蓋を開けたらどうかわからないけど
0,53,6,0,0,53,10,0,目指す先はここにあるのかな
0,53,10,0,0,53,14,0,って感じですね
0,53,14,0,0,53,18,0,その表情を崩したくてめちゃめちゃいいよね
0,53,18,0,0,53,21,0,真顔で言ってるんだもんね相手が
0,53,21,0,0,53,25,0,文学部員が台本書いてて
0,53,25,0,0,53,27,0,うわっいいわ
0,53,27,0,0,53,30,0,情景が浮かんでくるわ
0,53,30,0,0,53,32,0,みんなシーブリーズの匂いしてきたね
0,53,32,0,0,53,35,0,私はシーブリーズ派じゃなかったけど
0,53,35,0,0,53,37,0,クラスの可愛い子がシーブリーズ使ってて
0,53,37,0,0,53,40,0,それを貸してもらった覚えだけはある
0,53,40,0,0,53,44,0,っていう話を前回もしましたね
0,53,44,0,0,53,47,0,下の方に小さくCMはイメージですってありそう
0,53,47,0,0,53,50,0,あれねサプリメントみたいな感じで
0,53,50,0,0,53,55,0,安いらサプリとか個人の感想ですみたいなこと書いてるけど
0,53,55,0,0,54,0,0,一応面積しとかないと
0,54,0,0,0,54,1,0,しとかないとね
0,54,1,0,0,54,4,0,私はAG派だったんで
0,54,4,0,0,54,10,0,AGって銀色のパッケージのやつだったんですよね
0,54,10,0,0,54,12,0,ということで本当にね
0,54,12,0,0,54,14,0,すごい素敵なお便りありがとうございました
0,54,14,0,0,54,18,0,では次
0,54,18,0,0,54,19,0,これどうなんだろう
0,54,19,0,0,54,24,0,一応匿名希望さんなので匿名希望さんで読ませていただきますね
0,54,24,0,0,54,27,0,の勝手にメールテーマ
0,54,27,0,0,54,29,0,ロカゴさんこんばんは
0,54,29,0,0,54,35,0,さて今週のテーマは日本語なのに関係者以外には全く通じない業界用語でしたね
0,54,35,0,0,54,37,0,私はプロの鷹状をしています
0,54,37,0,0,54,40,0,鷹状であってる?鷹の匠と書いて
0,54,40,0,0,54,43,0,動物の鷹の匠と書いて鷹状かな
0,54,43,0,0,54,46,0,鷹状が使う包容術
0,54,46,0,0,54,50,0,放つ鷹の術は数百年の歴史があり
0,54,50,0,0,54,54,0,流派にもよりますが非常に専門用語が多いです
0,54,54,0,0,54,57,0,何だったら会話のほとんどが専門用語だったりします
0,54,57,0,0,55,2,0,飼育所のスタッフにちょっとした指示をするとこんな感じです
0,55,2,0,0,55,4,0,一羽の鷹を指さして
0,55,4,0,0,55,10,0,そこの鷹を据えて獅子を見て低かったらちょっと指して頬についどいて
0,55,10,0,0,55,11,0,となります
0,55,11,0,0,55,13,0,もう一回読みますね
0,55,13,0,0,55,17,0,そこの鷹を据えて獅子を見て低かったらちょっと指して頬についどいて
0,55,17,0,0,55,18,0,となります
0,55,18,0,0,55,19,0,訳しますと
0,55,19,0,0,55,23,0,そこの鷹を手に乗せて体重を測って指定体重より少なかったら
0,55,23,0,0,55,26,0,餌を与えて専用の泊り木に泊まらせておいて
0,55,26,0,0,55,28,0,という意味です
0,55,28,0,0,55,30,0,肉の色と書いて獅子と読み
0,55,30,0,0,55,35,0,実際には体重計には載せず鷹の胸肉を触って体重を測ります
0,55,35,0,0,55,39,0,完全に習得するには10年以上かかります
0,55,39,0,0,55,43,0,日常飼育訓練狩り本番とすべてにおいて専門用語ばかりです
0,55,43,0,0,55,46,0,VTuberの世界にも専門用語が多いですね
0,55,46,0,0,55,47,0,今後ともご活躍を期待しています
0,55,47,0,0,55,49,0,頑張ってください
0,55,51,0,0,55,53,0,というお便りをいただきました
0,55,53,0,0,55,58,0,なんかめちゃめちゃ面白いですね
0,55,58,0,0,56,6,0,身の回りに鷹嬢の方ってもちろん存在はテレビとかで拝見して存知上げてますけど
0,56,6,0,0,56,8,0,どうやってなるんだろう
0,56,8,0,0,56,10,0,お家が代々とかなのかな
0,56,10,0,0,56,15,0,それともやっぱり鷹が好きで弟子入りしてみたいな感じなのかな
0,56,15,0,0,56,17,0,どうやってなるんだろう
0,56,19,0,0,56,21,0,ちょっとお水飲みます
0,56,27,0,0,56,34,0,え、オフチョベットしたテフをマブガットしてリットを作る的なものを感じたって何
0,56,34,0,0,56,36,0,これ読んでいい?
0,56,36,0,0,56,40,0,オフチョベットしたテフをマブガットしてリットを作るって何
0,56,40,0,0,56,42,0,面白い
0,56,42,0,0,56,46,0,意味わかんないことも載られつっていいですよね
0,56,50,0,0,56,52,0,愛石食堂ネタ?
0,56,56,0,0,56,58,0,愛石食堂ネタがよかった
0,56,58,0,0,57,1,0,何の回?愛石食堂の
0,57,1,0,0,57,3,0,私一部の回は見てるんですよね
0,57,3,0,0,57,7,0,愛石食堂って言ったら千鳥のお二人がやってて
0,57,7,0,0,57,11,0,あのーロケにねゲストの方が行って
0,57,11,0,0,57,13,0,そのロケの映像を見ながら
0,57,13,0,0,57,17,0,あのー千鳥のお二人がこう突っ込みたいときにね
0,57,17,0,0,57,20,0,ちょっと止めたいときにちょっと待てーっていうボタンを押して
0,57,20,0,0,57,23,0,色々喋るっていうやつ
0,57,25,0,0,57,27,0,あれめちゃめちゃ面白いですよね
0,57,29,0,0,57,31,0,あのちょっと待てー方式めちゃめちゃ好き
0,57,31,0,0,57,33,0,私もなんか配信で
0,57,33,0,0,57,36,0,あのーちょっと待てー方式をね
0,57,36,0,0,57,38,0,あのー採用して
0,57,38,0,0,57,41,0,あのメンバーのねアニマルメンバーの
0,57,41,0,0,57,43,0,あのコナン宮のね
0,57,43,0,0,57,46,0,あの歌ってみた動画一緒に見ました
0,57,46,0,0,57,48,0,めちゃめちゃ止めどころ多かったからね
0,57,49,0,0,57,53,0,千鳥が海外ロケの説明聞くけど専門用語多すぎるかい
0,57,53,0,0,57,55,0,うわめちゃめちゃ面白そうだな
0,57,58,0,0,58,0,0,はい久しぶりに見たいですね
0,58,0,0,0,58,4,0,私はね朝ヶ谷姉妹の朝ヶ谷姉妹さんが好きなんで
0,58,4,0,0,58,6,0,朝ヶ谷姉妹さんの回が好きでした
0,58,6,0,0,58,9,0,うーんいいよね朝ヶ谷姉妹さん
0,58,9,0,0,58,11,0,朝ヶ谷姉妹さんこの間なんか
0,58,11,0,0,58,15,0,著書がドラマ化なんかしてた?
0,58,15,0,0,58,17,0,気のせいか?
0,58,17,0,0,58,19,0,ちょっと待ってね
0,58,20,0,0,58,23,0,朝ヶ谷姉妹ドラマ
0,58,25,0,0,58,27,0,ああドラマ化してる
0,58,27,0,0,58,30,0,朝ヶ谷姉妹のノグホン二人暮らしNHK
0,58,31,0,0,58,34,0,これは朝ヶ谷姉妹さんが二人でやってるの?
0,58,34,0,0,58,36,0,あれ朝ヶ谷姉妹さんじゃないな
0,58,38,0,0,58,39,0,違う
0,58,40,0,0,58,42,0,えっ木村太衣さんか
0,58,46,0,0,58,48,0,ああそうなんいやいいですね
0,58,48,0,0,58,50,0,癒されそう
0,58,51,0,0,58,54,0,朝ヶ谷姉妹のノグホン二人暮らしNHK
0,58,54,0,0,58,57,0,朝ヶ谷姉妹のノグホン二人暮らし
0,58,57,0,0,58,59,0,めちゃめちゃいい本だった覚えがあります
0,58,59,0,0,59,1,0,ちょっと内容しっかり覚えてないけど
0,59,1,0,0,59,3,0,読んでてすごい良かった
0,59,3,0,0,59,7,0,この後ね今週のメールテーマは耳から胃薬で
0,59,7,0,0,59,9,0,最近やっぱりね
0,59,9,0,0,59,12,0,5月6月は胃がきしむというですね
0,59,12,0,0,59,14,0,お便りも今回いただいてましたけど
0,59,14,0,0,59,18,0,そういった胃に優しいエピソードをね
0,59,18,0,0,59,20,0,送っていただいてるんで
0,59,20,0,0,59,22,0,朝ヶ谷姉妹のノグホン二人暮らしも
0,59,22,0,0,59,25,0,なかなかにして胃に効くんじゃないかな
0,59,25,0,0,59,27,0,って思います
0,59,30,0,0,59,34,0,ということで勝手にメールテーマのコーナーでした
0,59,34,0,0,59,36,0,すごいねいろんな職業の方が
0,59,36,0,0,59,39,0,見てくださってるんだなと思って感動しました
0,59,39,0,0,59,41,0,ありがとうございます
0,59,42,0,0,59,45,0,ということで次のコーナーですね
0,59,45,0,0,59,49,0,週代わりのメールテーマは耳から胃薬ということで
0,59,49,0,0,59,51,0,最近やっぱ胃が痛くて
0,59,51,0,0,59,54,0,胃が痛いっていうか胃が痛くて
0,59,54,0,0,59,57,0,病院は行ってるんでね全然大丈夫なんですけど
0,59,57,0,1,0,0,0,みんなもやっぱ胃が痛いっていうお便り結構来てたんで
1,0,0,0,1,0,2,0,そういう季節なんだなっていう
1,0,2,0,1,0,5,0,あとやっぱ他のね
1,0,5,0,1,0,7,0,7thincメンバーも結構言ってますけど
1,0,7,0,1,0,12,0,やっぱ変頭痛が結構きついですよねこの時期
1,0,12,0,1,0,14,0,夏にかけて
1,0,14,0,1,0,16,0,やっぱ低気圧のせいなのか
1,0,16,0,1,0,18,0,なんなのか分かんないけど
1,0,18,0,1,0,22,0,クローズアップ現代でなんか記事が出てたな
1,0,24,0,1,0,27,0,気圧のせい天気
1,0,27,0,1,0,29,0,天気の病気
1,0,29,0,1,0,34,0,その体調不良天気のせいかもみたいな記事出てたような気がする
1,0,34,0,1,0,37,0,体の不調天気のせいかも
1,0,37,0,1,0,39,0,っていうのね
1,0,39,0,1,0,41,0,4月5日
1,0,41,0,1,0,44,0,放送されてたのかこれ
1,0,44,0,1,0,48,0,っていうのをね今日なんかtwitterで見ました
1,0,48,0,1,0,52,0,でもなんか天気のせいだってなったとしても
1,0,52,0,1,0,55,0,もうどうしようもないしな
1,0,55,0,1,1,0,0,天気のせいにしても天気変えられないし
1,1,0,0,1,1,4,0,新海監督でもない限りはね
1,1,4,0,1,1,6,0,変えられないからね
1,1,6,0,1,1,9,0,ただただ受け流すだけなんだよな
1,1,9,0,1,1,13,0,なんかあの新海監督の新作
1,1,13,0,1,1,18,0,あのそろそろ公開でしたっけ確か
1,1,18,0,1,1,20,0,スズメの
1,1,20,0,1,1,23,0,スズメのとみたいな
1,1,23,0,1,1,25,0,とじまり
1,1,25,0,1,1,28,0,スズメのとじまり
1,1,28,0,1,1,30,0,11月11日全国ロードショー
1,1,30,0,1,1,33,0,あー今年の11月か楽しみですね
1,1,33,0,1,1,36,0,どんな感じなんだろう
1,1,36,0,1,1,40,0,いやー映画見たいもんいっぱいあるな
1,1,40,0,1,1,43,0,なんかあのビジュアルがやっぱりね毎回すごい綺麗なんでね
1,1,43,0,1,1,45,0,楽しみは楽しみだけど
1,1,45,0,1,1,48,0,結構なんかあの登場人物とあんまり
1,1,48,0,1,1,54,0,作品を楽しむ上で共感って必ずしも必要なものだとは思ってないんですけど
1,1,54,0,1,1,57,0,まあそれは合わないなっていうね
1,1,57,0,1,1,59,0,登場人物が多いんでね
1,1,59,0,1,2,4,0,なかなかやっぱ気が合わないのかな
1,2,4,0,1,2,7,0,うんただもう本当作品としては好きなんでね
1,2,7,0,1,2,11,0,まあ見に行くと思いますけど
1,2,11,0,1,2,19,0,えーではね耳から胃薬のお便りを読ませていただきたいと思います
1,2,19,0,1,2,23,0,野次くらげさんからの耳から胃薬お便りありがとうございます
1,2,23,0,1,2,26,0,ルカコさんリスナーの皆さんこんばんは先日ジャンタマをしていて
1,2,26,0,1,2,29,0,トイトイ飲むの安手かなと思ったらしもちゃが監視してくれたおかげで
1,2,29,0,1,2,32,0,ドラガミ募って漫画になりました
1,2,32,0,1,2,35,0,すいません最近人に優しくされたエピソードはこれしかなかったので
1,2,35,0,1,2,38,0,私も今回皆様のエピソードを楽しく配置させていただきます失礼いたしました
1,2,38,0,1,2,41,0,というね答えをいただきました
1,2,41,0,1,2,46,0,これすごいいいなと思ったのが
1,2,46,0,1,2,49,0,しもちゃの勘でドラガミ募ったっていうのが
1,2,49,0,1,2,52,0,優しくしてもらったっていうか
1,2,52,0,1,2,57,0,確かにプレイヤーの野次くらげさんは得してるけど
1,2,57,0,1,3,2,0,それ別に優しさではない
1,3,2,0,1,3,4,0,優しさではないんだよね
1,3,4,0,1,3,7,0,実際誰かから出上がってるか積も上がってるかな
1,3,7,0,1,3,12,0,他の人にとってみればマイナスなことなんだけど
1,3,12,0,1,3,15,0,最近の優しさエピソードはそれということでね
1,3,15,0,1,3,20,0,今回胃に効くような優しいエピソードを
1,3,20,0,1,3,24,0,寄宿舎のエコールの少女たちのように
1,3,24,0,1,3,29,0,一緒にお茶でもアフタヌーンティーでもしゃれ込みながら
1,3,29,0,1,3,31,0,話し合いましょうって言ったせいなのか
1,3,31,0,1,3,34,0,この後2件お嬢様からお便りが来てました
1,3,34,0,1,3,37,0,ありがとうございます
1,3,37,0,1,3,41,0,まずインターネットお嬢様からの耳から胃薬
1,3,41,0,1,3,44,0,お便りありがとうございます
1,3,44,0,1,3,48,0,ルカクお嬢様?リスナーのお嬢様方ごきげんよう
1,3,48,0,1,3,52,0,私の最近よくあったエピソードはズバリサイゼリアのプリンですわね
1,3,52,0,1,3,54,0,先輩のお嬢様とサイゼリアに赴いて
1,3,54,0,1,3,57,0,いつもの大盛りペペロンチーノをご馳走になった後
1,3,57,0,1,4,0,0,突然先輩お嬢様がこうおっしゃったのですわ
