start_s,end_s,text
1662,1664,うん
1664,1666,えーでは次ですね
1666,1673,えーものづくりする猫枝豆さんからの勝手にメールテーマですお便りありがとうございます
1673,1679,さて次に来る漫画大賞の投票期間が終わりあとは8月31日の結果発表を待つだけとなりましたね
1679,1683,ところで前々回スーパーの裏でやにすう二人を紹介したときに
1683,1691,えー佐々木さんやパトレイバーの後藤隊長恋は雨上がれのようにの店長など普段は頼りなさそうなおじさんが私は好みかもしれない
1691,1694,と言っていましたがえーもう私が言ってたんですねこれね
1694,1701,えーその現象FFC過去ファントムファザーコンプレックス過去都市かもしれません
1701,1706,FFCとはドラマや漫画アニメなどの年上の男性を理想の父親に見立てて好意を持つもので
1706,1712,離婚後の親権をほぼ母方が持つ傾向にある日本で多く見られる現象と考えています
1712,1716,えーまたパパ活動する子たちには金銭的な目的だけではなく
1716,1722,このFFCにより優しく話を聞いてくれる男性に対して発言しているのではないかという懸念をしています
1722,1729,今は全く報道されていませんがもしかすると今後大きな社会問題に発展するかもしれないFFCについて
1729,1734,詳しく知りたい方は厚生労働省のホームページを検索しても何にも出てきません
1734,1740,なぜならこれは私が先々週思いついた架空の言葉でFFCなどという現象は存在しません
1740,1745,ということで今週のテーマ次に来るイマジナリー社会現象対象2002Xでした
1745,1752,それではまた来週
1752,1759,これなんか絶妙だよねあのファントムをさFにしてるのがいいですよね
1759,1765,そうそうそうそうそうそう
1765,1770,厚生労働省のサイトをホームページを検索しても何にも出てこないということでね
1770,1775,私も最初読んで確かにうちもめちゃめちゃ女系だわって思ったんだよね
1775,1782,途中までそういうのあるんだなるほどねと思っちゃった
1782,1787,嘘つき嫌いコメント来て
1787,1790,可愛い女児
1790,1797,嘘つき嫌いねやっぱこれはなんか私もさ割となんかもっともらしい言葉で書いてあると
1797,1802,信じてしまうことが多々あるので
1802,1807,このインターネットを本当はやめた方がいいけど
1807,1812,やめられない人々に捧ぐラジオなんでこちらはね
1812,1817,そういうコンセプトでやっぱ52回迎えてるんで
1817,1822,インターネットをやめられない大人たちに捧ぐフェイクニュースの見分け方講座
1822,1830,っていうのが出発点っていうところを考えるとこういうふうにフェイクニュースに踊らされないよう
1830,1837,警鐘を鳴らすお便りっていうのは本当にありがたいことですね
1837,1841,女児も楽しんでくれてて本当にね
1841,1849,女児のみんな人間っていうのは本当に簡単に大人は本当に簡単に嘘をつくのでね
1849,1854,嘘を嘘だと思ってついてる人と
1854,1859,自分に都合をよく歪める人っていうのが世の中にはいて
1859,1865,前者だったらまだいいんだけど後者の場合は本当につける薬がないので
1865,1870,それが本当のことだと思ってるから本人は
1870,1879,過去自分が今言ってる意見と全く違うことを言ってたっていうことを
1879,1887,人間生きてていろんな日々インプットとアウトプットを繰り返して成長していく生き物だから
1887,1890,過去言ってたことと今言ってたことが違うってのは当たり前なんだけど
1890,1894,過去言ってたことを否定する人間っていうのも世にはいるのでね
1894,1897,女児のみんなは
1897,1904,女子はちょっとやべえなと思ったら発言を録音しておくのがいいかもしれませんね
1904,1910,そういう場合に録音してなかったっていう場合でも
1910,1918,メモを取っておくこととかっていうのもちゃんと小骨してきちんと使える場合があるので
1918,1923,本当にこの女子マジでモラハラがやべえみたいな
1923,1930,女子とか身近な人がとんでもない場合は日記とかつけとくのがいいかもしれません
1930,1932,しんどいかもしれないけど
1937,1945,ということでインターネットをやめられない私と皆さんがね
1945,1950,これからも健やかに暮らしていけるように
1950,1954,53回以降も頑張っていきたいですね
1957,1961,女児には上司とかいません!いやあるよ!女児にもいるのよ
1963,1967,私は女児だった頃
1967,1971,保育園に通っていた女児だったんですけれども
1971,1977,やっぱりね保育園という非常にね
1977,1982,原始的なコミュニケーションの中でも
1982,1988,やっぱこの人間ホモサピエンスという生き物が狩猟最終民族であり
1988,1996,やっぱその群れを形成して一つの獲物を飼っているという
1996,2001,そういう遺伝子に深く刻み込まれているんだなということがね
2001,2005,やっぱその小さい頃から如実に感じますもんね
2005,2008,うん女児にもあるのよ
2008,2014,あっ待ってそれで言うとなんかすごい
2014,2018,なんか思い出した
2018,2022,今日はね珍しくシナプスがつながったんですけど
2022,2025,この間そのyoutubeの動画見てたら
2025,2032,人間のハンドサインっていうものが遺伝子に共通に刷り込まれているみたいな
2032,2036,そう
2036,2040,うんうなれニューロンはじけろシナプスね
2040,2042,はじけました
2042,2049,なんかその生まれつき目の見えないお子さんとかでも
2049,2052,同様のハンドサインをするっていうのが
2052,2057,実際にその実験でね検証として結果が出てるらしくて
2057,2065,なんでその身振り手振りとかボディーランゲージで位置相通を測っていたっていうのは
2065,2071,もう本当遺伝子レベルできちんとねあの刷り込まれているものなんだっていう
2071,2077,そういう実験結果があるみたいですすごいよね
2077,2083,なんかその結構その国によって割と例えばこううなずく仕草が
2083,2088,あの否定になったりとかする国ももちろんあるし
2088,2096,いわゆるその今ねコメントしてくださってるそのハンドサインとかがすごい失礼な意味になっちゃったりとかするっていう国もあるから
2096,2102,それぞれのねあの文化っていうのをきちんと組まないといけないはいけないんだけど
2102,2109,やっぱそのボディーランゲージでこう遠くの人とかにもね情報を伝えてたっていうのは
2109,2118,本当になんだろうホモサピとしての基本性能なんだなっていうのがすごい勉強になりましたね
2118,2121,Synapse結合ボーナスありがとうございます
2121,2124,お!なかなかいいペースだ
2130,2134,はいということでですね本日の集合割メールテーマ
2134,2144,リスナーさんにねこれは手比義務とか個人情報保護の観点から問題ない範囲で
2144,2152,皆さんのされているお仕事について教えていただいたりとかなんか面白いねお客さんとかがいたらそのエピソードを送ってください
2152,2158,っていう風に募集させてもらったお便りをご紹介したいと思います
2158,2161,手比義務言えてた?
2161,2164,手比義務って言えてるこれ?
2166,2170,手比義務のさやっぱ日かな?
2170,2176,H?ハヒフフホってめちゃめちゃ発音しにくくないですか?
2176,2182,私あの作業と麻業と歯業がちょっとあんま好きじゃないわ
2182,2185,うん手比義務
2185,2190,なんかあのH発音しない言語とかあるじゃないですか
2190,2194,あれどこだっけ?ちょっと待ってよ
2195,2201,H発音しない言語
2203,2207,フランス語イタリア語スペイン語
2207,2213,古代ローマ帝国で使用されていたラテン語を共通の祖先とした同系統の言語
2213,2217,ねそう無音のアッシュ
2217,2224,だからなんか最近そのあれなんですよね
2224,2231,私フランス語選択だったんですけど
2231,2238,あの英語の他にもう一つ大学で勉強するんですけど
2238,2241,フランス語だったんですよで
2241,2246,ちゃんと収めたんだよねフランス語の単位も
2246,2250,びっくりするほど覚えてないの
2250,2255,これはどうしたことなんですかね
2255,2259,どうしたことだと思いますか
2259,2267,あの皆さんもね多分なんかいろんなその言語を今まで学んだなっていうのがあると思うんですけど
2267,2272,私は本当に何にも一切すっかり忘れてるんですよ
2272,2276,そんなもんかドイツ語1ミリも覚えてない
2276,2282,なんかねあの割と
2282,2288,知人に人気あったのは中国語ですね
2288,2292,一番人気なかったのがフランス語
2292,2298,単位すごい取りにくくてフラ語の
2298,2305,中なんかやっぱそのなんだろうね文法とかが
2305,2317,英語に近いみたいなでなおかつその漢字だからある程度その知ってる感じだったらそこから意味が汲み取りやすいみたいなところからね
2317,2325,中国語人気だったみたいなんですけど私のその同学年の知人には
2325,2333,だからねフランス語楽しかった覚えはあるんだけど発音がめちゃめちゃ難しかったっていうのを覚えてる
2333,2339,なんかあの初めてこれあのフランス語をディスってるわけじゃ全くなくて
2339,2344,私がそのフランス語の発音を練習するにおいて感じたことなんだけど
2344,2351,なんかすごい喉の奥であのケトル沸かしてるのかなみたいな時ない
2351,2364,ネイティブの方とか先生の発音を聞くとすごい素敵だなと思うんだけどやっぱ愛を語る言語だなと思うんだけど私がやってるとなんか
2364,2369,喉でケトル沸かしとんのかいみたいな感じになっちゃう
2369,2379,だよねそうなんだっけありますよねフランス語は愛を語る言語ドイツ語はなんだっけ
2379,2387,もうちょっと何も覚えてないんですけどフランス語愛を語る
2389,2393,英語は商売をする言葉
2396,2406,フランス語は愛を語るのに適しドイツ語は学問をするのに適しイタリア語は歌う歌のに適しロシア語はそのすべてに適している
2406,2410,という説もありますね
2413,2421,なんかさあのこれ今話そうと思った話題を一瞬で忘れたんだけどなんだと思いますか皆さん
2421,2435,私が今多分言語に関する話で今のエピソードから私がその脱線しそうな脱線しそうな話題ってなんだと思います
2435,2444,思い出したあのフランス語ってすごい数字をすごい数えにくい言語なんですよ
2444,2450,私もなんか一生覚えられなかったんだけどフランスがやってる時に
2450,2458,多言語を履修者にねまともに数も数えられない言語のくせに言ってディスられてたの覚えてる
2458,2462,その印象がすごい強い
2462,2471,私最終的に本なんか多分まともに一度も数えられずに終わった
2471,2476,なんか区切りがよくわかんないんだよね
2476,2481,最終的にその数をあの重ねていくと
2481,2488,数の数え方がねフランス語数数え方
2488,2494,が100まで数えるのがめんどくさいんだっけな
2494,2500,そういう感じでね15だったか40だったかまでしか数えられない
2500,2502,デンマーク語もやばい
2502,2506,ちなみにあのなんかこの世で最も
2506,2512,あの習得が難しい言語みたいなランキングを見たことがあるんだけど
2512,2515,10位くらいに日本語入ってて
2515,2518,あとハンガリー語も難しかったかな
2518,2523,あと一番難しいのはあのクリック音が入る
2523,2526,クリック音だっけな
2526,2531,アフリカの方の部族が使ってる
2531,2533,ちょっと待って
2533,2537,クリック言語
2537,2542,えークリック言語ってのがあるな
2542,2545,あコサ語そう
2545,2549,あのコサ語が難しいらしい
2549,2553,これがそのなんかあのいわゆる舌を打つ感じの
2553,2555,たぶん舌で口内を打ってるんだけど
2555,2557,なんかその音をこう喋りながら
2557,2561,そう複雑にあの混ぜて
2561,2565,そうなんかあの喋る言語らしくて
2565,2568,これがやっぱ習得がすごい難しいし
2568,2574,確かね口語というかその句伝というかその口で伝えられている言語だから
2574,2580,あのめちゃめちゃねあの覚えるのも大変みたいな話を聞きましたね
2580,2584,吸着音っていうのかな
2584,2589,小井さん初号のクリックシーンらしいです
2589,2592,気になる方はなんか確か私youtubeでね
2592,2595,実際に話してる音声も聞いたんで
2595,2599,チェコ語も難しいって聞いたことあるね
2599,2603,うん確かにフィンランド語もなんか
2603,2607,なんかあの北欧の言語ね結構難しいですよね
2607,2611,っていう印象がうっすらある
2611,2614,やっぱでも言語って面白いなと思いますね
2614,2618,うん何の話
2618,2623,えっ私って今なんか職業体験のお便り読んだ
2623,2626,えっ読んでないよな
2626,2629,いつも読んでないもしかして
2629,2633,ちょっとね読んでいきたいと思います
2633,2637,あはははは
2637,2641,ちょっとお水飲もう
2646,2651,もうなんで言語の話始めたのか全く覚えてないや
2651,2658,そういえば今回もねすごいお便りたくさんいただいてたんですけど
2658,2665,昨日かなVアパの奏で花音さんとコラボさせてもらった時に
2665,2669,あのたまにその花音さんがラジオ聞いてくれてるみたいな
2669,2673,配信終わった後にあの言ってくださってて
2673,2677,でマジで嬉しくてでもすごい同時にね
2677,2682,あのちょっとあまりにも脱線に脱線が過ぎるし
2682,2687,あとなんか自分が何を話そうとしてたのかも一瞬で忘れるし
2687,2691,あのお恥ずかしい限りですっていうね
2691,2694,あの話をしてたんだけど
2694,2697,なんかその時に花音さんから
2697,2701,結構なんかあの定期的に近況を報告してくれる方とか
2701,2703,いらっしゃるじゃないですかみたいな
2703,2707,あのお便り普通のお便りとかでみたいな話をね
2707,2709,花音さんの方からしてくださって
2709,2714,あれもしかしてのおしっこが二股に分かれてる方の話ですかって言ったら
2714,2716,あそれって言ってて
2716,2719,おしっこが二股に分かれてしまった方っていうのが
2719,2723,まあたまにねあのお便りくださってて
2723,2728,でその方がちょっとまああの最初
2728,2731,ちょっとあの下の話になるんですけど
2731,2736,最初おしっこが二股に分かれちゃうんだけどどうしたらいいですかってお便りもらって
2736,2739,いやちょっと病院行った方がいいと思いますよってお返事して
2739,2744,その病院行ったら性病が見つかってみたいなねお話のその
2744,2747,まあいわゆるその連載
2747,2749,うん
2751,2754,あの二股おしっこの不定期連載を持ってくださってるんですよ
2754,2756,ラジオ内でね
2756,2759,でなんかあのそれに関してね
2759,2762,あのカノンさんが言及してくださってて
2762,2765,でまあその後ねあのほんと何回か
2765,2768,あのお便りいただいてたんですけどちょっとあの時間の都合だったりとかで
2768,2770,ご紹介できてなかったんですけど
2770,2772,その後もねお便りいただいてました
2772,2777,この場を借りて本当にありがとうございます
2779,2781,ということで
2781,2783,ちょっとね
2783,2787,私はまだいつもて呼んでないのかな
2789,2792,あれさっきお便りを読もうという
2792,2795,お便りを読もうという姿勢に一度なったはずのに
2795,2799,なぜこうなってしまったんだろうちょっとお水飲みたいと思います
2807,2811,なんかそれもうほんとなんかこれで最後にするんだけど
2811,2815,前その今日昼間コラボさせてもらった湯野原泉さんのチャンネルで
2815,2820,風俗喫茶アワマーレの体験レポート架空の体験レポートを
2821,2823,あの泉さんがね募集した時も
2823,2829,オーラル学校の体験レポート日本語めっちゃ読みやすかったってお褒めをいただいてね
2829,2835,それが本当に自分の配信を褒められるののやっぱ50倍ぐらい嬉しいです
2835,2839,ということで早速ねお便り読んでいきたいと思います
2839,2844,国家のワンちゃんさんからのリスナー職業体験ですねありがとうございます
2845,2847,オーラさんこんばんはこんばんは
2847,2856,地方から某大規模都市で治安維持に携わって早十数年心がすり減っていく毎日です
2856,2862,皆さんが万が一にも問い調べを受けた場合に頼みたいものそうだよね活動んだよね
2862,2864,でもごめんね頼めないんだよね
2864,2870,仮に逮捕されて問い調べ受けているなら飲料なしで一食400円ぐらいの予算なんだよね
2870,2872,だって税金なんだもん
2872,2876,ちなみに飲み物は紙コップに水が出てくるよ味気ないね
2876,2880,だいたいおにぎり2つになるんだけど好きな具は聞いてます
2880,2884,リスナーのみんな今後万が一逮捕されたらまずすることは
2884,2888,そうだね好きなおにぎりの具2つ考えておいてね
2890,2893,ちなみに私は流水のおにぎりを食べてるんですけど
2893,2897,ちなみに私は流水所の寒便よりも寒しいお昼を毎日食べています
2897,2899,夏の体調にお気を付けください
2899,2901,というお便りでした
2901,2903,流水所の寒便ってなんだ
2905,2907,ということでね
2907,2913,あの国家のワンちゃんさんからの非常に勉強になるお便りをいただきました
2913,2915,好きや頼める
2916,2921,飲料なしで一食400円ぐらいの予算
2921,2923,なるほどね
2923,2927,あそうそうそう寒便はね
2927,2930,これ何なんだ
2930,2933,あ刑務所での食事
2933,2936,あコーヒーなのでなるほどね
2936,2938,ちょっと待って
2938,2944,スキヤでいくらまでだったら問い調べ中に食べれるか今調べておきますね私が
2944,2948,今後何が起こるかわかりませんからね生きてる間
2948,2951,スキヤはですね
2951,2953,ニンニクの目牛丼おいしそう
2953,2957,ダブルニンニク牛丼トリプルニンニク牛丼やばそう
2957,2959,腸内細菌層が全滅しちゃう
2959,2962,えすご
2962,2966,一週間誰にも会わねーみたいな日の一番最初に食べたいね
2968,2974,だめだみんなトリプルニンニク牛丼はミニでも580円するからちょっと予算オーバー
2974,2976,えーちょっと待って
2976,2985,牛丼あ皆さんスキヤの牛丼は並盛り400円なのでちょうどスキヤの牛丼ぴったりです
2985,2989,はいなので皆さんもしねあのー
2989,2995,流知状とかにお邪魔する機会があって取り調べを受ける場合はですね
2995,2999,何食べたいって言われたらスキヤだったら牛丼並食べられます
2999,3002,ちなみに松屋だと
3002,3006,松屋
3008,3013,あうな丼880円もするんだすげー高級だな
3013,3016,えー牛飯が
3017,3021,なんか謎の生き物のオリジナルグッズがついてるなんだ
3022,3027,えー牛飯380円並ですね
3027,3031,20円安いスキヤよりこれ食べられますうん
3031,3036,えーちなみに吉野家だといくらかっていうと
3036,3040,あスタバ見てみるか
3040,3047,みんなもしあのーうわー取り調べ中にスターバックスが飲みてーとなった場合何なら頼めるかと言いますと
3047,3053,スキヤだと牛丼並ま茶だと牛丼並スターバックスだと
3053,3056,えー
3056,3059,季節ドリンクメニュー
3059,3062,商品一覧
3062,3065,えーコーヒーが
3065,3067,ははは
3067,3071,お?コーヒーが400円って書いてあるぞマジか
3071,3076,えーコールドブリューコーヒーがショート400円なのでショートのアイスコーヒーが飲めます
3076,3082,はいえーということでね皆さんぜひとも選択肢の中に
3082,3085,スターバックスだったらコールドブリューのショート
3085,3095,スキヤだったら牛丼並松屋だったら牛丼牛飯並をご検討いただけたらなと思います
3095,3097,ね
3097,3101,次のお便り読ませていただきたいと思います
3101,3108,ちょっとねそんな未来は誰にも訪れてほしくはないですけどこういうのはやっぱ知識があればあるほどいいですからね
3108,3113,えーらかし屋さんからのあちょっと待て
3113,3119,今日慣れないことをしたせいかちょっと喉のなんか疲労が早い
3119,3122,まだだって1時間経っていないのにも関わらず
3122,3124,ははははははははは
3124,3128,まきで喋りすぎたのか慣れないことするからちょっとお水飲みます
3128,3137,うん
3137,3142,らかし屋さんのリスナー職業体験お便りありがとうございます
3142,3148,私は書店員です書店にとっての6月から7月は結構な巻きをでございまして
3148,3156,ドラマアニメの改編機に合わせた商品の入れ替え文庫やコミックの夏セットの展開これらに加えて夏休みに合わせた学算や
3156,3161,課題と書を出したり各種イベントに向けた売り場作りで天夜ワイヤーになっておりました
3161,3170,皆様におかれましても夏ドリルをどこにねじ込もうか売り場で呆然と考えているスタッフを邪見に思わず生温く身を守っていただけると幸いに存じます
3170,3180,それとはあんまり関係ないもっかの悩みとして泥ヘドロを全巻置いておくと書店としての信頼値が上がるようなとは思って置いてはいるもののぶっちゃけでかくて邪魔なのでどうしようかなと迷っています
3180,3186,予告されとって棚にあるとをこの本ややるなと思う本って何かありますか
3186,3194,ということでね皆さんこの本ややりおるなと思う書籍ありますか私はねー
3194,3204,まあ書籍っていうか私の学生の頃マジでお金がなくてだいたい常々3つぐらいバイトを掛け持ちしてたんですけど
3204,3215,あの少しの間ね本屋さんでバイトした時期もあってでその時に感じたのはあの結構ポップに力を入れている書店いいなと思います
3215,3228,"私もねあの私は文庫の棚の担当だったんですけどその時に結構なんだろうゴリゴリねなんか5,6時間残業してポップ作ってたんで"
3228,3243,そういうところで本当にプッシュしたい本とか書店員さんがこれ好きなんだなーみたいなのが伝わってくるポップがあるといいわねと思います個人的にね
3243,3249,なおしか全巻
3249,3253,ハンターハンター全巻ある書店がどこにもない
3253,3262,そうなの本当になんかあのやっぱ好きな漫画何言って聞いた時になんかレベルいいって言われるとあ
3262,3268,みたいな感じになるならないオタクあるあるかなと思ってるんですけど
3271,3280,レベルいいかなみたいななんかそういうなんかちょっと車に構えオタクの気持ち私もちょっと分かる
3280,3285,あきら全巻あきらわかるあきらはそうですね
3286,3291,私もねあきら置いといたらねなんかおしゃれな感じがする
3291,3295,日の鳥文庫版ねわかる
3295,3304,なんかあるとこですかね漫画はやっぱそのあたりかな愛憎版とか置いてあるとなんか愛だなぁって思うけど
3304,3310,はいはいはいはいレベルいいはそんなにみたいに逆逆張り語り出しちゃう
3314,3319,なんかでも個人的にはそのあれですね
3319,3327,まあ大学の時は結構新書系とかで
3327,3336,授業とかで紹介された本があるとなんか信頼度高い感じがした
3336,3341,うんまあの学校で買えよって感じなんだけど
3341,3351,なんかの私あのよくわかんないけど同じ新書3冊とか持ってる時があって
