start_s,end_s,text
60,67,今日の金曜ロードショー トトロだったみたいですね
67,70,トトロ見た人いますか?
70,73,私もねやっぱり
73,77,ジブリは配信で見られないんで
77,80,やっぱり見たことがないんですけど
80,93,自由に乗るためにテレビ買わないな
110,125,皆さんこんばんは 今夜も遊びに来てくださってありがとうございます
125,128,U-KISSアニマルのオーラル加古です
128,132,今日はちゃんとジングル流れたんでしょうか
132,134,定期的にやっぱりね
134,142,配信のソフトの方が設定を変えてくるんで
142,145,まあTVerで相変わらずボラギノールをお勧めされるか
145,147,ジングル流れたらよかったです
147,155,TVerっていう世のねテレビ番組を公式にオフィシャルでね
155,157,アプリで見られるっていう
157,158,買わないテレビ代
158,162,じゃあそれ何になるんだろう
162,164,ありがとうございます 待機でね
164,169,ご衆議いただいてた方もいらっしゃって本当にありがとうございます
169,175,私は結婚したわけではないんですけれども
175,178,とても助かります ありがとうございます
178,182,そうだねどうせPCモニターになる
182,184,賞金100万円明日もらえる予定なんで
184,190,私の右左側に向かって左に出てますけれども
190,193,この金色で100万円って書いてあるとなんか
193,197,すごい一気にねなんかあれですよね
197,203,金の猛者感が出るよね
203,205,100万円もらったらね
205,208,そうですねモニター1枚買おうかな
208,211,モニター1枚買って
211,213,あとどうしようかな
213,216,なんかあれですよせっかく100万円もらったんで
216,220,グループに還元したいなって思いますね
220,226,なんかやっぱり私がダッツで当ててもらった100万円ではあるんですけれども
226,231,こういうふうにゆうかキーさんアニマールっていうグループに所属していなかったら
231,236,こうして皆さんに応援していただけてなかったら
236,239,もらえなかった100万円なんで
239,244,皆さんみんなそのグループのみんなで旅行に行ったりとか
244,248,その旅行のねレポートの様子なんかを皆さんに対して
248,254,お伝えできたらなーって思っている
254,257,思っている
257,259,もうもらった気でいる
259,261,そうもうもらった気でいます
261,264,そうだねなんかあの湾曲してるやつね
264,268,ちょっとなんか高いモニターをまず自分で買って
268,272,あと残りを全部グループで使いたいなって思います
272,278,におたに行こうにおたに行きましょうね
278,281,ちがいます私はたぬきのフレンズではないのでね
281,285,フクロウのフレンズなんでこれはもう未来予知なんでね
285,287,やっぱりフクロウっていうのは
287,291,古来よりあの知恵のね
291,296,あの女神の肩の上に乗ったり乗らなかったりしていたはずなんで
296,300,これはちょっと未来予知です
300,302,はいえーということで
302,305,暮らしのマーケット
305,310,暮らしのマーケットっていうのがその私が一回ね
310,312,ラジオの配信の一番最初に
312,318,うっかり自分で開いてる自分の配信の広告を入れちゃったことがあるんですけど
318,323,すごいねあの蝶々とリスナーさんが育ててくれて
323,328,この間ね晴れて泉さんの配信でご紹介
328,332,切り抜きをご紹介いただくまでに成長しました
332,334,ありがとうございます
334,338,なんかあの最近めっきりあの服がダサいっていうのも
338,342,いじられなくなってきてね久しいんですけども
342,346,やっぱこう一抹の不満というか不安がねありますよね
346,348,いじれる部分が少ない
348,354,人より少ないっていうかまあちょっと動機より少ないんでね
354,358,そういうのをねやっぱあの適宜こうね
358,364,いい肥沃な大地に植えてこう育てていかないといけないなって思うんですけど
364,372,どうけが多すぎるんだよね分かるどうけが多すぎるんだよそのせいなんだよね
372,377,そもそもこの間その泉さんの24時間の企画に出させてもらった時に
377,382,愛の審判部屋っていうあの企画でね
382,387,私と小波彩と獅子王クリスがゲストで
387,393,これはちょっとどうなんだろうっていうのをリスナーさんから募集させてもらって
393,405,その配信のねどうなんだろうポイントをみんなで有罪かギルティーか無罪かを議論するっていう
405,408,企画だったんですけど
408,417,それがさなんかなんでその間に私が入ってるんだろうって最初
417,425,最初泉さんからなんか招待も私基本誘われたら絶対に断らないんだけど
425,431,なんかスケジュールがかぶってるとか以外だったら絶対断らないんだけどなんでその
431,442,獅子王クリスと小波彩に挟まれて私がそのなんだろうな面白おかしいさ
442,451,面白おかしい失態などその2人の前ではもう風前の灯火風の前の塵に同じじゃん
451,456,ねって思ったのでねやっぱりそういうのも
456,463,やっぱり果たない外に出てしんでやりたいって言うの ですね
463,467,あのなんかなんて言うんやって本当に
467,471,果たないよって言ったから2するにもかなり
471,474,凝 physically
474,477,どっか行けないと思ういう経験があって
477,481,しっかり
482,484,井戸を
484,491,今アーカイブがないんで あれ見てないなっていう方はもう良かったなって思います
494,496,良かったなって思います
499,503,そうですね アーカイブ非公開じゃなくて削除になってた 削除したんだ
503,517,なるほどね あ見てしまった あー見てしまったか それともある種なんか呪いみたいなものですからね
517,522,見てしまった人間はもう見なかった自分には二度と戻れませんから
522,534,皆さんもぜひね 婚約者候補にね コナミアのメンバーシップに入っていただいて これからも末永くね
534,542,ある種責任を取っていただかないといけませんよ 配信見てたら 私はリアタイ見てないんですけど
544,550,見てましたか? じゃあ責任取ってくださいね メンバーシップ婚約者候補入ってくださいお願いします
550,560,ということで本日はですね 普通のお便り 地域圏のまるまるさん推しと結婚したらの3本でお送りしたいと思います
560,564,地域圏のまるまるさんはですね 今週から
564,568,今週からというか もう今週だけになるかもしれないんですけど
568,574,まぁちょっと情景がね 変わり映えしないことに一抹の不安を覚えたので
574,585,せっかくリスナーさんが見てくださっているので 現地の情報を教えていただく場面を変えて
585,596,新鮮な一陣の風を吹き込んでいただく この水中の薄暗い部屋にというコーナーを入れてみました
596,599,うん
601,606,見てなかったのか みんなルカ子は見てる男子室なのにどうして
609,612,見てなかったです
612,618,で最後推しと結婚したらですね これ結構タイムウェアリーな話題で
618,624,今週の初めぐらいかな ちょうど私がそのラジオのコーナーを考えている時に
624,631,Twitterのトレンドに推しと結婚というワードが入ってたので そのまま持ってきましたが
631,638,あのやっぱりその有名なユーチューバーさんが 高校1年生ぐらいから推してたアイドルの
638,646,持ったアイドルの方と結婚したっていう すごいね多好感あふれるニュースで
646,650,そんなこともあるんだなぁと思いましたけど
650,657,なんかあのついこの間ね ゆりのレッテっていう 瀬島ルイさんのチャンネルで
657,664,実されたコラボに呼んでいただいたんですけど そこで獅子王クリス社長取り合ったんですけどね
664,671,いろんなメンバーで それがその元々バチェロレッテっていう
671,677,番組がモチーフになって それのゆり版みたいな感じなんですけど
677,681,なんかそこでやっぱ獅子王クリスもねこじらせオタクだから
681,686,なんか推しと結ばれることのなんか苦難みたいなものを解いてて
686,695,ああなんかそういうオタクって生きづらって思いました
695,698,オタクって生きづらと思いましたね
698,701,そう私はなんかあんまりそのなんだろう
701,709,みんなのこと好きですけど 特にこの人を崇拝してるみたいな
709,714,もちろんねアイドル好きだったりとかはするんですけど
714,720,まあその近しい人間でね ナナシンクメンバーはみんな好きなんですけど
720,725,特に誰か一人を崇拝してるみたいなのはあまりないので
725,730,なんかそれもそれでなんか大変なんだなと思って
730,735,結ばれたらそれでハッピーじゃないんだなという気もしました
735,743,オタクが生きやすかった時なんてなかった
743,747,そっかオタクが生きやすかった時なんてなかったんだ
747,750,というかなんかあれかな
750,757,まあなんか生きやすいなーと思って生きてる人っているのかな
757,761,生きにくい性格だからオタクやってるみたいなところある
761,764,それってあれかななんかその趣味先行じゃなくて
764,767,自分の生きやすいコミュニティを探したら
767,772,オタクというフィールドにたどり着いたみたいな
772,775,住みやすいその場所を探して
775,780,あの流浪の民をしていたらそこのなんか集落が
780,784,存外空気が美味しかったみたいなそういうことですかね
784,787,鶏が先が卵が先が
787,790,なるほどね
790,795,なんかまあそれはねなんかオタクっていうものも確かに
795,800,結構その存在としてね
800,808,世に受け入れられ方とかも多分変わってきているのかなと思いますし
808,810,正直私はそのオタクっていうか
810,815,まあ例えばアニメとか漫画が好きだったりとかっていうことを隠す
815,820,隠す文化圏にいなかったんで
820,825,だから私基本的にオタクに優しいギャルいない論者なんですけど
825,833,普通にそのクラスのめちゃめちゃかわいい子とかと漫画貸し借り
833,838,貸したり借りたりとかしてましたし
838,841,なんかそういうことを踏まえると
841,843,なんか割と環境としてはね
843,847,恵まれてたのかなって思いますね
847,850,いる?優しいギャルはいるよ
850,853,オタクにだけ優しいんじゃなくてみんなに優しいギャルだよね
853,855,ハハハハハ
855,857,そうオタクに優しいギャルは誰にでも優しい
857,859,オタクにだけ優しいわけじゃないんだよ
859,860,そう
860,861,そうです
861,864,みんなに優しい人間がたまたまこっちに笑いかけてくれたのを
864,870,自分にだけなんか自分に対して好意を持ってるって勘違いするところから
870,874,悲劇っていうのが始まるってシェイクスピアも言ってた
874,876,ということでね
876,880,普通のお便りを読んでいきたいと思います
880,883,マミムメミャコさんからの普通話ですね
883,885,お便りありがとうございます
885,886,ルカコさんこんばんは
886,887,こんばんは
887,895,最近数少ないママとモノの間で早期性教育についての話題がよく出ます
895,897,早期性教育ね
897,900,性犯罪の加害者被害者にならないためには
900,905,幼少期からプライベートゾーンについて正しく教えておくことが大切なんだとか
905,912,3歳の息子に性教育を私がどうやって伝えればいいのと考えていた矢先のことでした
912,916,ねえママのこれって何?
916,920,お風呂の中で私の体を指差しながら息子が聞いてきたのです
920,923,来たかこの瞬間が
923,925,精査への疑問
925,928,どうしてママにはおちんちんがないの?ってやつ
928,934,脳内で最適解を導き出しながら息子の指先へ目を落とすとそこには腹部
934,939,ん?ここはママのお腹だよ
939,941,じゃあこれは何?
941,944,人差し指をゆっくり下にずらし止まったのは私の下腹部
944,946,そこもお腹
946,950,そう答えると息子は目を丸くして言ったのです
950,954,え?なんでママにはお腹が2つもあるの?
954,962,息子には世の中にはお腹が2段になっている人もいるんだよという答えさについて推し
962,967,推しって文章が途切れてました
967,970,文章はそこで途切れていた
970,974,ここまででねもしかしたら何かしら事件が起こったのか
974,976,生きていたのかね分かりませんけれども
976,983,夢美子さんに温かい日常の一コマを送っていただきありがとうございました
983,987,なんかあの子供の無邪気さというのはね
987,989,何でしょうね
989,991,時に残酷
991,995,時に残酷よな
995,998,時にってかいつも残酷だよな
998,1002,純粋であるっていうことは
1002,1005,むき出しだからね何もかもが
1005,1011,オブラートというものに包まれていないのがそれが子供なのかもしれない
1014,1017,私もあの
1017,1022,あの普通にその小学校低学年ぐらいの時に
1022,1024,あの
1024,1028,先生にね男性の先生が担任だったんですけど
1028,1032,普通にそのちょっと頭部がね
1032,1036,薄くというかちょっと局地的に
1036,1038,なんていうんだろうな
1038,1040,局地的な
1040,1042,間伐なのか
1042,1045,ミステリーサークルみたいな感じで
1045,1049,ちょっとUFOがそこに一部分だけこう
1049,1052,降臨していた先生だったんですけども
1052,1055,あのそれをね指摘してもう
1055,1061,たぶんね生きてて一番あれがたぶんガチで怒られたな
1063,1065,ガチで怒られた
1067,1068,ガチで
1068,1071,ケトルミューティレーション
1073,1076,ケトルミューティレーションはなんかえ?
1076,1078,どうした?
1078,1082,もしかしてなんか私がこの話をするって分かっていたのか
1082,1084,準備されていたコメントなのか
1084,1086,びっくりしたケトルミューティレーション
1086,1089,なんかケトルミューティレーションって
1089,1093,なんかあの牛単体だけなのかな
1094,1099,牛単体だけのことをケトルミューティレーションと呼ぶみたいな
1099,1102,なんかその人間が持っていかれる場合は
1102,1107,なんか違う表現をするみたいな話をね
1107,1109,とかありますね
1109,1111,あそうそう家畜に対してのやつが
1111,1113,あそうアブダクション
1113,1119,だから人間のその頭部だけが吸い取られる場合は
1119,1121,ケトられてるわけじゃなくて
1121,1124,アブダクションの方なのかな
1125,1128,持っていかれたといえばなんか最近ハガレンの
1128,1131,あのすごい話題飛んだけど
1131,1134,ハガレンのあれ出ました?
1134,1137,あのソーシャルゲーム
1138,1141,なんか一回ね私その本編
1141,1144,本編とかそのゲーム自体はやってないんですけど
1144,1146,もうリリースされているのかな
1146,1154,なんかあの列車をこう降りてくる感じの
1154,1157,そのガチャの演出がすごい良かったみたいな
1157,1160,なんかそういうそのトレンドだけちょっと見ましたね
1160,1163,うんだからすごい
1163,1166,まあ持っていかれたでね繋がりましたね
1169,1171,持っていかれたって言ったらもうさ
1171,1173,ハガレンしか出てこないからね
1175,1176,最近だからなんか
1176,1181,うわ持っていかれたなみたいな感想を抱くことって
1183,1185,何かをこう人に持っていかれることって
1185,1188,あんまりなくないですか大人になるとね
1188,1193,だからもう何かしら持っていかれるってなったら
1193,1195,もうハガレンしか出てこない
1196,1199,なんかそれで言うとなんか
1199,1202,結構その英語の
1202,1206,あのなんか持っていく的表現って
1206,1208,なんかtake
1209,1211,takeよく使うと思うんですけど
1212,1215,あ税金ねもうやめよう
1215,1216,税金の話はちょっとミュートワードにする
1216,1218,税金のことは
1223,1227,なんか結構その英語ってある程度その日常会話ぐらいだったら
1227,1231,動詞がなんか5、6個覚えてればできるみたいな話を聞いたことがあって
1231,1235,なんかhaveとtakeとかである程度なんか
1235,1238,あの全部言えるよみたいな
1240,1243,なんかdoとtakeとhaveさえなんか
1243,1248,使えば意思疎通が取れると思うみたいなことで
1248,1252,あの帰国支助の人に言われたことあるんだけど本当なのかな
1253,1257,こればっかりはやっぱりなんかあんまりねその英会話
1258,1261,まあねあったけどな授業で
1261,1266,英会話の授業あったけど何に何も覚えてないな
1266,1271,何も覚えてないですね
1271,1275,あそうgetねそうgetもそう
1276,1279,ていうのでなんかだいたいできるって言いますね
1280,1284,なんか情勢が許せばあれに行きたかったんですけど
1284,1288,あのE3っていうアメリカでね開催されてる
1289,1292,ゲームの大きい祭典があるんですけど
1292,1296,世界3大ゲームショーっていうのが
1296,1299,ドイツとアメリカと日本であって
1299,1302,アメリカのやつがE3なんですけど
1302,1306,それに行きたいなと思ってたやさぎにねこの情勢になっちゃったんで行けなかったんですけど
1306,1309,今年は東京ゲームショーやるって言ってたかな
1309,1312,9月にね毎年やってたかなと思うんですけど
1313,1316,ちょっと遅いかもしれないから一応ここにしとこう
1317,1320,9月15日から
1320,1323,15日からいいですね
1323,1326,えでも3日しかビジネスデーはないのかな
1326,1329,151617184日か
1330,1332,アチケット取れました
1332,1336,なんか久しぶりの開催かな
1336,1338,ねなんで
1339,1344,まあすごい楽しみにしてらっしゃる方もいるかなと思うんですけど
1344,1347,なんかこの間もなんかインディーズゲームのね
1347,1350,イベントがあったりとかして
1350,1353,そういうのがね普通に気軽なくね
1353,1356,いけるように早くなるといいなと思いつつ
1356,1360,ちょっとね流行りやまっちゃうと
1360,1363,周りに迷惑もかけちゃうのでその辺もちょっとね
1363,1366,控えつつで皆さんも
1366,1370,なんか今回のお便りでコロナかかってしまいました
1370,1371,マジでつらいですっていう
1371,1374,なんか結構毎週ねお一人かお二人ぐらいは
1374,1377,コロナかかりましたっていうお便りがあって
1377,1380,皆さん本当にご自愛ください
1383,1386,ということで次の
1386,1391,お便りですね読ませていただきたいと思います
1391,1396,水木さんからのおふそでですねお便りありがとうございます
1396,1397,ルカコさんこんばんは
1397,1398,こんばんは
1398,1402,先週の土日にコミケがあり自分は日曜日に一般参加してきました
1402,1406,大本命のサークルさんの販布物は入手することができなかったのですが
1406,1408,いくつかの目当てのサークルさんの販布物は
1408,1411,友人の協力のもと入手することがかない
1411,1415,久しぶりのコミケ現地の空気感を楽しむことができました
1415,1417,自分自身も拙いながら創作をたしなみ
1417,1420,以前はサークル活動をしていたこともあるので
1420,1423,コミケなどの同人創作イベントに参加すると
1423,1426,自分も創作活動をまたやりたいとパワーをもらえ
1426,1429,それだけでも参加した甲斐があったなと思っております
1429,1432,ただ大本命のサークルさんに3時間ほど円天下のもとを
1432,1435,大気列に並んだ際にできたリストバンド型参加賞の
1435,1439,日焼け跡を見るとほんの少しだけ切なくなりますが
1439,1440,そこでふと気になったのですが
1440,1442,るこ子さんはイベント会場で自分自身が
1442,1446,題材となった二次創作物を見かけたら手に取りたくなる派ですか?
1446,1450,とある漫画家さんが自身の作品の二次創作を
1450,1452,イベント会場で入手していたり
1452,1454,自分が題材となった二次創作を見るのが
1454,1456,お好きというのを見かけたことがあり
1456,1459,るこ子さんはどうなんだろうと思った次第です
1461,1463,こんな二次創作なら気になるかも
1463,1465,こういう二次創作はちょっとなどあれば考えたいです
1465,1467,センシティブな部分かと思いますし
1467,1469,ごたずらかったら申し訳ありません
1469,1470,ということでね
1470,1473,ご大変なお便りありがとうございました
1473,1475,私はね別に
1478,1479,大丈夫です
1480,1485,私個人としてはどう扱っていただいてもいいです
1485,1487,二次創作なのでね
1487,1491,七進区の二次創作ガイドラインみたいなのが出てると思うんですけど
1491,1494,え、出てるの?出てるよねさすがに
1494,1497,と思うんですけどそれに則っていれば
1497,1499,私個人としては別に大丈夫です
1499,1504,私はほぼ唯一の地雷と言ってもいいんですけど
1504,1506,二成りがちょっと地雷なんですけど
1506,1509,別に二次創作の中で二成りになってても
1509,1512,特になんかやめてくださいみたいなことは思わないですね
1512,1513,それはね
1513,1515,あ、出てるよかったよかった
1515,1516,なんで
1517,1519,それはそれで
1519,1522,私という
1523,1526,コンテンツを楽しんでもらう一環としてね
1526,1529,個人の自由なんで
1529,1531,それは大丈夫です
1531,1532,それをだから
1532,1535,二成りを読むかって言われたら読まないんだけど
1537,1538,その
1538,1541,二成りを描きたいなっていう人が
1541,1545,書くのはもう私に何かしら言う権限はないのでね
1547,1548,そうなんだよね
1548,1550,両性グユーは全然大丈夫なんだけど
1550,1554,二成りがダメっていうのが自分でもあまりよくわからない
1554,1557,それだけは地雷かな
1557,1558,あとはなんか概ね
1558,1561,好んで読まないなーっていうジャンルはあるけど
1561,1563,特に地雷はないですね
1563,1564,うん
1564,1567,来た瞬間二成りの話してた
1567,1568,ゆりに出てくる男?
1568,1571,別になんか出てくる文には変わらない
1571,1574,間に入ってくるのも
1574,1577,そういうジャンルもあるかなと思う
1577,1580,積極的には読まない
1581,1586,最終的に間に入ってきて当て馬になってるのは全然好きで読む
1586,1588,っていう感じですね
1590,1591,っていう感じです
1591,1594,この間なんかコナンミヤと
1594,1598,サムギョプサル食べに行ったんですよ
1598,1602,そしたらなんか同人誌の話になって
1603,1604,妹さんとね
1604,1607,コナンミヤって妹さんがいるんだけど
1607,1608,なんか
1608,1610,いや、ルカ子はさ
1610,1612,多分BLとかはさ
1612,1615,フム系の本は読まないんじゃないかなって
1615,1617,妹と話してたって言ってて
1617,1619,妹と何話してんの?と思った
1619,1621,なんか真剣に会議してたんだよ
1621,1624,ルカ子はBL読まないと思うんだけどどう?って言われて
1624,1628,いや、別にどっちでもいいかなって
1630,1632,あんまこだわりないかな
1632,1634,BLを特に好んで読むわけでも
1634,1636,別に嫌いなわけでもないから
1636,1638,作品で好きだったりとかなんか
1638,1642,作者さんが好きだったら全然読むかな
1645,1646,って感じでした
1646,1648,面白いよね
1648,1651,なんかさ、いやこれさ
1651,1653,これコナンミヤが話してから話す
1653,1656,マジでさ、その妹さんがね
1656,1658,コナンミヤの妹さんの茶子ちゃんがさ
1658,1660,めちゃめちゃ面白い
1660,1661,あのー
1661,1663,面白い思考で
1663,1664,面白いって
1664,1667,もうほんと人のセックスを笑っちゃダメなんだけどさ
