start_s,end_s,text
1658,1669,実際に黒猫7thさんにお会いして、アニマーリに潜入って感じです。
1669,1671,どんなこと喋るの?
1671,1681,そうですね、私はまず一番最初に動画送って、その後その動画の内容、
1681,1688,企画案とかを50個くらい出したんだけど、配信の。企画案どういう風に考えたの?とか、
1688,1697,どういうことをやりたくてVTuberという形式を選ぶの?みたいな感じでお話しして、
1697,1704,1回スパイとして潜入したい、なるほどね、みたいな感じになって、
1704,1714,でその後また、次こういうこと聞きたいんでこういうの考えておいてくださいって言われて、
1714,1721,でそれをまた考えて資料を作って、パワポでね、作って、
1721,1727,でもこうこうこういう理由でちょっとアニマーリに潜入したいんですけどって思い浮かぶって、
1727,1729,という感じでした。
1729,1736,うん、そうですね、えらいエラネコ七紫とも喋れました。
1736,1745,なんで、あのー、そういう感じなんですけど、結構他のメンバー聞いてると、
1745,1750,なんかミヤ、コナンミヤとかは、これ配信でも喋ってたんですけど、
1750,1756,最終的に七紫さんとなんか、あ、ちょっともう酒入れていいすか?
1756,1767,ってお酒飲みながら喋ってたみたいな話聞いたから、なんか私とはまだ全然違いますね。
1767,1771,うーん、スパイね、よし通れ。
1771,1780,3時間かける3回通話して、で資料も3回出して、で実際会ってみたいな感じ。
1780,1786,だからね、やっぱ結構そのー、なんだろうな、こうしたら受かるみたいなのないんじゃないですかね。
1786,1791,うーん、もうわからんわ。なんで受かったのかもわかんないし私が。
1791,1796,もうわからん、もうわからん。
1796,1805,はい、えー、ということでね、ちょっと何にも、あのー、なんだろう、参考になることは言えなかったんですけど。
1805,1812,でもスパイって言っても通るってことです。
1812,1816,うん、なんでも通るってこと。ガバガバってこと、七紫さんは。
1816,1830,なんで、あのー、やりたいことがあるとかね、あのアニマーレとか、まさ七紫インクの事務所に所属してこういうことがしたい、こういう読みがあるみたいな方はよかったら応募していただけたらと思います。
1830,1832,そして私と一緒にサーモンランをやりましょう。
1832,1837,はい、えー、では次。
1837,1843,えー、あ、主婦でもいけるかな。え、よくないですか。
1843,1845,めっちゃいいと思う。
1845,1847,うん。
1847,1859,え、だって、なんか、やっぱりね、今どうしてもその全体的な、その業界の男女比的なものって、もう概ねやっぱ男性の方が比率的には高いんですけど。
1859,1873,今後そのVTuberっていうか、アバターとかなんかそういうVRチャットとかで、なんかカジュアルにね、遊ぶみたいな、3Dの体とか、まあ2Dの体とかでもいいんですけど。
1873,1882,遊ぶってなった時に、やっぱその、なんだろう、その層もね、うん。
1882,1887,もしかしたら引っ張ってこれるかもしれないし。
1887,1893,え、ひとずま、ひとずまグループいいね。
1893,1898,ひとずまグループいいね。なんかよくない?
1898,1903,ちょっと、いやでもよくないね。うん、よくない。ひとずまだから。
1903,1909,そういう、なんかそういう、なんか、やめよ?なんか横島な気持ちでひとずまのこと見るの。
1909,1922,なんか、なんでだろうね、普通の言葉のはずなのに、なんかあの、言語のさ、本来の意味を離れたらなんかその意味合い、意味性の汚染みたいなのがありますよね。
1922,1927,いや、ほんとそういう意味じゃないからみたいな言葉ね。うん。
1927,1931,なんで、あの、まあそう、ほんとそういうお店じゃないんで。
1931,1935,ひとずまに対して別に性的な目とか別に持ってないんで。
1935,1939,エロワードではないので、やめてください。
1939,1944,やめてくださいっていうか別に、私が一番言ってたけど。はい。
1944,1947,次のお便り読ませていただきます。
1947,1949,あ、いそうじね。
1949,1958,もうほんとに、これほんとにすごい、ためになるお便りをいただいたことがあって、また脱線するんですけどこれだけ話させてほしくて。
1958,1963,あの、なんかみそうじとかよそうじとかあるじゃないですか。
1963,1975,で、その中で、なぜか、あの、五重の道と書いていそうじだけ、やたらその画像、検索で出てくる画像が全部エッチっていう。
1975,1979,なんかそういう、なんだろうな。
1979,1982,ほんとに素晴らしいお便りが来た。
1982,1987,ほんとに素晴らしいお便りが来た。うん。
1987,1991,そういうことを知りたい。無限に。うん。
1991,1996,で、なんかほんとにいそうじ検索したらマジでそうで。
1996,2001,あ、皆さん検索したことない方はね、今、あの、いそうじで検索してみてほしい。
2001,2004,もう私もちょっとしば、久しぶりに見てみるか。
2004,2008,ちょっと、私はインターネットのリテラシーが高いのでね。
2008,2010,シークレットモードで見ます。
2010,2021,えー、いそうじ。
2021,2028,なんかいそうじ検索したらだってセーフサーチが、セーフサーチオフになってるけど本当にいいですかって聞かれてるもんね、Googleに。
2028,2032,マジでなんでいそうじだけこうなんだろう。
2032,2035,本当に不思議なんだよね。
2035,2040,皆さんも検索する際本当にお気を付けくださいね。
2040,2046,えー、ということで、本当に次こそ次のお便り読みますね。
2046,2049,ふーちゃんさんからの不通貨お便りありがとうございます。
2049,2052,るかごさんこんばんは大好きです。ありがとうございます。
2052,2061,突然ですが私はスーパーなどでたまに見かける、本来そこにあるべきではない商品が誰かの手によって適当な場所に戻されている状態がものすごく好きです。
2061,2069,お店に迷惑をかける行為であるというのは理解しているのですが、見かけるたびにどうしてもときめいてしまいます。
2069,2072,例えばパンのコーナーに一つお菓子があるとします。
2072,2076,するとどこかの可愛い幼女が明日の朝のパンを選んでいる母親に、
2076,2081,ダメ!と言われてしょんぼりしている姿が浮かんで微笑ましい気持ちになります。
2081,2090,調味料コーナーにある缶詰、カップ麺が並ぶ棚にあるドレッシングなどなど、一体ここでどんな葛藤が生まれたんだろうと想像すると楽しくなりませんか?
2090,2096,実際にはストーリーを繋げるのが難しいケースも多いですが、推理力に自信のある方にはおすすめの暇つぶしです。
2096,2100,エルカコさんはこれを見ると妄想が剥がどってしまうというものはありますか?
2100,2105,普段人に発表することのないような、たわいもない妄想をぜひ聞いてみたいです。
2108,2110,あ、ドラマを感じる?わかる。
2110,2120,なんかねー、あのー、私は、これ、なんかどっか、いつか話したことあるんですけど、
2120,2131,あの、街を歩いてる時に、街中歩いてる時に、その、スタバのね、あの、カップを持ってる人見かけた時に、
2131,2140,あの、どこに、そのなんかその、ドリンクの種類とか、あのその、減り具合とか、で、
2140,2150,あのー、ここからどの方向の何メートル先にスタバがあるかっていうのを想像するのが好きですね。
2150,2154,うん。スタバ探偵。
2154,2161,うん。なんで、あのー、それは結構やりますね。
2161,2170,あとなんかカップル、4人、夜のさ、街行くカップルを見て、あのー、あ、付き合ってどれぐらいなのか、みたいな、
2170,2177,なんかそういうのを、まあ、友人とかといたら、何ヶ月かな、みたいな。
2177,2180,まあ答えはないんですけど、本人に聞かないし。
2180,2186,うん。1年は経ってるかな、みたいな。
2186,2188,そういう話をします。
2188,2195,なんかその、距離感とか、会話の頻度とか、あとはまあなんか、例えばそのどれぐらい、
2195,2201,あのー、なんだろうな、なんか持ち物、持ち物というか、
2201,2211,例えばなんかその、同じ種類の靴履くの、2、3年かな、結構前かな、に流行ってたりとかしてたんで、
2211,2217,なんかそういうのに見ると、うーん、まだあんまり日が立ってなさそうだよね、みたいな話をしてました。
2217,2222,うん。こっとけよって感じたんですけどね。
2222,2226,しかも、答え合わせができないし。
2226,2230,なんで、うーん、まあそういうのは結構ありますね。
2230,2236,ディズニーランド、ディズニーランドはね、あのー、本当に趣味が悪いですけれども、
2236,2248,あのー、ん?これ、高校生かな、という人をですね、見抜く方法みたいな、
2248,2250,あまりにも暇なんですよ。
2250,2258,ディズニー、ディズニーリゾートに行って、だいたい3時間か4時間ぐらいショーをね、ベスポジで待つんですよね。
2258,2264,で、そこから動けないんですよ、場所取りしてるから、ショーを見るために。
2264,2270,暇なんですよね。で、まあもちろんそのー、暇つぶしみたいな、本持ってったりとかするんですけど、
2270,2280,結構その、道行くそのお客様をね、見て、ん?おかしくないか、あれ、みたいな。
2280,2292,なんかその、例えばその、集団でこういる時に、どうもそのスカートの柄が、そのグルーブで全然マチマチだし、
2292,2296,なんか生地がペライぞ、みたいな。
2296,2304,生地がペライぞ。これは普通の学校であんなに生地がペライことあるか、みたいな。
2304,2307,なんかそういうのをね、考えてます。
2307,2314,うん、でもね、そう、高校生でもいいし、高校生じゃなくてもいいんです。
2314,2321,だって、なんかあの大学生とかがさ、制服着てるのもいいじゃん。
2321,2323,可愛くて。
2323,2330,なんならもうなんか、いやもう正直さ、もう制服とかギリギリだよね。
2330,2335,みたいな感じで着てるのが一番、そういう風な目で見るのやめてもらえませんか?
2335,2337,本当に。
2337,2338,ね。
2338,2341,そういう風な目で見るのやめてください。
2341,2348,これは想像の中なんで、頭の中で考えてるだけなんで、実際にその道行く人を性的に消費してるわけではないです。
2348,2350,はい。
2350,2351,もちろんね。
2351,2355,それはもう最低限の、人間としてのマナーなんで。
2355,2358,はい、えー、じゃあ次ですね。
2358,2360,お便りを読ませていただきます。
2360,2366,わたちずるさんからのお便りですね。
2366,2394,ありがとうございます。
2394,2396,とのお言葉を頂戴しました。
2396,2405,農林に宇宙猫、お前は何を言っているんだ。DV彼氏、などの単語が浮かびましたが、その場ではグッとこらえて、少し考えさせてください。
2405,2407,とだけ返事をする形になりました。
2407,2411,六五三は社会の荒波の中で、持ち上げられたと思ったら落とされた。
2411,2415,甘やかされていたと思ったら殴られていた、という経験はありますか?
2415,2429,ちなみにその個人弁当の後の昼休みに、4万20円過去税込みのクレジットカード計算通知と、七夕フェス2022ジャンプの抽選の当選通知が来ていたので、転職も実さない覚悟で次回公表に臨んでいく所存です。
2429,2438,何があっても12月に六五三や七夕フェスにお会いしてできることを心のよりどころにして頑張ります。
2438,2447,心のよりどころにしていただくには、本当に気まずい感じの噛み方をしてしまったんですけども、
2447,2452,これはちょっととんでもないことを言われてますね。
2452,2456,本当に素晴らしい人を雇ったと思う。
2456,2463,そこで給与20%カットするか、正規雇用契約を終了したい。
2463,2469,ルカ子足が、シャンクス腕がのノリじゃんね。
2469,2477,なんかね、ちょっとまぁ、昨今やっぱその周りでワンピースを利収してる人が非常に多いし、
2477,2482,シャルさんとか、ハニーストラップの島村シャルトさんとか、
2482,2488,あと日笠の虫子さんとかに、結構ワンピースを付与していただいてたんで、
2488,2498,今ジャンププラスで14か15まで、アラバスタ編まで、最初からアラバスタ編を無料で読めるんで、
2498,2500,それを読んでたんですよ。
2500,2507,で、あの、まぁね、一回は読んでるはずなんだよね、アラバスタまでは。
2507,2510,少なくともアラバスタまでは絶対に見ているはずで。
2510,2520,で、知ってる、キャラクターも知ってるし、うっそらとした加入の経緯みたいなものも覚えてたんですけど、
2520,2524,本当に面白いぞ。
2524,2526,本当に面白いんだ。
2526,2529,ワンピースって。
2529,2531,すげぇよな。
2531,2533,ワンピース。
2533,2536,マジでおもろいし。
2536,2538,キャラクターがみんな好きだ。
2538,2541,うん。
2541,2543,みんな好きだ。
2543,2549,なんで、えー、ちょっとね、次、本当に早く次読みたいんですよ。
2549,2551,次そらじま編だっけ?
2551,2557,そう。なんでね、本当待ちきれないんですけど、せっかくジャンププラスがね、
2557,2565,あの、事前事業団体ジャンププラスっていう、なぜかよくわかんないけど無料で漫画を読ませてくれるっていうね、
2565,2569,もちろん私は読んだ後いいじゃんしてますけど、
2569,2577,素晴らしいサービスがあって、皆さんもぜひともダウンロードしていただきたいと思います、ジャンププラスのこと。
2577,2581,フィルムレッドから女性ファンがすごい勢いで増えてる。
2581,2585,え、フィルムレッドってあれよね、
2585,2590,うたさんの回だよね、最近やってたやつ。まだやってるのかな。
2590,2595,なんか、そこからなんですね。それはアドさんきっかけなのかな。
2595,2596,うん。
2596,2600,あ、でね、別のお便りでいただいてたんですけど、
2600,2606,リヴァイアさんっていうのが、これまたジャンププラスでなぜか無料で読めるバグがあって、
2606,2611,これもね、めちゃめちゃ面白いんで、前ラジオでもご紹介したかな?
2611,2614,ぜひともご覧ください。はい。
2614,2621,えー、ということで、渡智鶴さん、あのですね、本当にあのー、
2621,2627,ナッシーフェスジャンプのね、ナッシーフェスジャンプのさ、
2627,2630,いやこれ私が言っちゃダメなんだけどさ、
2630,2636,ナッシーフェスジャンプのチケットの価格やばくない?
2636,2639,いや、売っちゃいけないのかもしれない。もちろんその価格にね、
2639,2644,十分その、それに合ったそのコンテンツを提供したいという気持ちは、
2644,2650,もう、5000%あるんですよ。そう、全力を出し切る諸葛なんだけど、
2650,2658,マジで、え?もしかしてなんか、ここはドバイ?
2658,2662,ドバイみたいなとこ?みたいな感じでね、
2662,2668,あー、本当にびっくりしました。はい、マジでびっくりした。
2668,2671,ということで、えー、その皆さんがね、
2671,2677,もう本当に、あのー、様々なね、こういう骨子ごもある中、
2677,2681,チケットを買い求めていただいているというですね、真実をね、
2681,2687,毎朝目覚めるたびにちょっと、刻みつけながらね、
2687,2695,生きていきたいと思います。魂に。うん。魂にね。はい。
2695,2699,ありがとうございます。本当に。
2699,2705,生活費削って買った。ありがとう。
2705,2714,いや、ありがとう。ありがとう。いや、ありがとう。ありがとう。うん。
2714,2720,松島。じゃあ次のお便りですね。
2720,2725,えー、ドグーさんからの普通お便りありがとうございます。
2725,2727,ルカカさん、リスナーの皆さんこんばんは。
2727,2731,こんばんは。先日のアニマルでのクイズ大会、とっても楽しく拝見しました。
2731,2735,その中で出題されたカニ味噌や無脊髄動物についてお話しできればと思います。
2735,2738,普通ではないお便りであることをご容赦ください。
2738,2742,そもそもカニ味噌って名前が色々と混乱させるような気がしています。
2742,2746,私自身、かつてはカニ味噌イコール脳味噌だと思っていました。
2746,2748,なんて言ったって味噌が入っているわけですから。
2748,2754,さて、カニ味噌は肝水蔵もしくは中腸腺という劣化した臓器です。
2754,2763,肝水蔵は名の通り、障害器の合成などを行う肝臓と障害器を分泌する水蔵の両方が合体している臓器です。
2763,2766,もちろん人では肝臓と水蔵と明確に分かれていますが、
2766,2772,カニなどが属する節足動物やカエルが属する軟体動物には肝水蔵がよく見られます。
2772,2777,ちなみに、サザエの網焼きなどでサザエの身をカラカラ取り出したことが終わりでしょうか?
2777,2779,うん。
2779,2783,サザエの身にある緑色の部分、それがサザエの肝水蔵です。
2783,2788,カニ味噌は味噌というよりもキモヤ、レバーの方が近いようなものであるということですね。
2788,2792,そう考えると、お寿司屋さんで見られる生クリームを絞るようなビニールの中に入っているカニ味噌は?
2792,2797,あ、そうなんだ。お寿司屋さんって生クリームみたいなのでカニ味噌絞ってんの?
2797,2802,多くのカニから取られた水蔵と肝臓のペーストってことですよね。
2802,2804,考えなければよかった。すごいね。
2804,2814,死して、カラカラたちと肝臓と水蔵をミックスさせられるっていう。
2814,2837,【コメント】我々哺乳類、過去6個その長類の臓器というのはそれぞれきっちりと明確にここからここまでがこの臓器と分かれています。一方、節足動物や軟体動物をはじめとした無脊椎動物、過去背骨がない動物群は哺乳類と違って臓器同士の境界がはっきりしていなかったり、そもそも人には存在する臓器がなかったりということはよくある話です。
2837,2848,【コメント】クラゲの生姜系には胃しかなく、口から食べて胃でしょうか?吸収の後に口から排泄するなど、こういうもの作りが存在しない動物群も多く見られます。
2848,2851,【コメント】また有名な話ではありますが、イカには心臓が3つあります。
2851,2857,普通の心臓1つとエラ心臓と呼ばれるエラに血液を送るためだけの心臓が2つです。
2857,2868,これだけ聞くと命が複数あるチートキャラみたいなイメージを受けるかもしれませんが、イカの心臓は我々の持っている心臓よりもおそらく血液を送り出す力が弱いのでしょう。
2868,2875,うまく血液を回しきれないのでサポートのためにもう2つの心臓を持っているんだと思います。どれか潰れたら終わりってことです。
2875,2893,【コメント】食料問題などが叫ばれる昨今、ひょっとしたら我々を作ってくれるのは彼らのような無脊椎動物なのかもしれません。なんていったって世界中に生息する生物の96%が無脊椎動物と言われるぐらいですので、無脊椎動物に関してはある程度の知識を入れておいた方がいいのかなと思います。
2893,2901,はい。あと一つ、科学はそれだけではなく実際に食べてみながら勉強するのが最前提だと個人的には思いますので何かのきっかけになれば幸いです。
2901,2909,【コメント】追伸!スピノサウルスの話も出ていましたが、恐竜について潮流学者が語っている書籍があります。
2909,2922,川上…あれ、和人だっけ?和人…そうですね。潮流学者、無謀にも恐竜を語る。サイエンティフィックなテーマでありながら、読みやすく面白かったのでおすすめの書籍の紹介でした。
2922,2947,ということでね、最後にご紹介いただいていた川上先生は、潮流学者だからって鳥が好きだと思うなよみたいなタイトルの本も書いていらっしゃって、マジで面白いので、シンプルに文章が到着すぐ前です。
2947,2963,私もこの潮流学者、無謀にも恐竜を語る読んだんですけど、本当に面白かったので、いろんなところに調査に行かれているんですよ。
2963,2984,例えば小笠原諸島とか、目的の潮流がそこにしか生息していなかったのかで、実際に1ヶ月か2ヶ月くらいそこに滞在して、サバイバル、本当にガチの無人島のジャングルみたいなところで生活しているみたいな、そういうエピソードがすごい新鮮で面白かったです。
2984,2993,NHKの子供科学電話相談でも大人気です。
2993,3012,我々もちょうどARKをやっているところなので、さっきも下村シャルトさんにARKでプテラノドンの捕まえ方を教えてもらっていて、結局私は捕まえられなかったので、またARKの世界に行かないといけないんですけど。
3012,3024,ゲームとか身近なものから疑問を持って学びを得るところってすごくいいですよね。
3024,3033,ARKって本当にジュラシックパークだよね。本当に面白いゲームだし、本当によく知る。
3033,3057,なので、こちらもぜひともご覧ください。 カニ味噌に関しては、この間、ひのくまランさんのチャンネルであったアニマーレのクイズ大会が、アニモネアだったと思うんですけど、そこでカニの問題が出たんだけど、全然わからなくて。
3057,3063,肝臓と膵臓らしいです。カニ味噌っていうのは。めちゃめちゃ勉強になりました。
3063,3072,あのクイズ配信がすごく面白かったから、あの後あれをダウンロードしたんですよね。
3072,3085,みはや。みはやっていうのはクイズゲームアプリなんだけど、みんなの早押しクイズみたいな名前だったかな。
3085,3107,で、私が知ってるみはやって、なんかすっごいシンプルな画面で、ただただクイズが好きなやつが集まって早押ししたがるみたいな、そういう非常にね、プリミティブなアプリケーションだったんですけど。
3107,3116,なんか、なに?あの、そしゃげになってた。いや、もともとそしゃげなんだけど。そしゃげになってたの。
3116,3126,そう。で、まあでもクイズ面白かったんで、結構ぶっ続けてやってしまいましたね。
3126,3140,なんか、あの、結構その、クイズの界隈の人がよく言ってる、なんだっけな、問題全部調べる、問題回収みたいな。
3140,3146,いや、どう考えてもそこで答えらんないでしょみたいな人がね、結構いたりとかして。
3146,3156,あとなんかその、なんだっけな、C対B対Eみたいな感じでその、ランクみたいなのがあるんですよ、スパラトゥーみたいな感じで。
3156,3167,でね、Aはまだいいんだけど、S?Sはね、もう一問もわからない。問題が難しすぎて。
3167,3179,うん。なんで、ちょっと無理ですね。あれはやっぱちょっとSの問題まじで一問もわからない。Aは一番最後まで読んだらわかる問題もあるかなって感じ。
