start_s,end_s,text
3060,3063,従約ってそんなさらっとやめられるもんなの?
3065,3068,なんかやめる時って
3068,3070,なんかもう
3070,3073,結構1ヶ月前に言いなさいとか
3073,3075,アルバイトとかでもね
3075,3077,1ヶ月前に言いなさいとか
3077,3079,言うのはあるけど
3079,3081,その厳密に言うと
3081,3084,2週間とかでよかった気がするんだけど
3084,3085,違ったっけ?
3085,3088,2週間くらいでいいんじゃなかったっけ
3088,3091,労働基準法に書いてないのかな
3091,3092,なんかそんななんか
3092,3093,1ヶ月も2ヶ月も前から
3093,3095,言わなくてよかったはずなんだよね
3095,3097,そう、2週間前ですよね
3099,3100,なんでね
3100,3103,一心情の都合で退職します
3103,3104,今までお世話になりました
3104,3108,絶対お世話になったと思ってないほどの短さだな
3110,3111,だから
3112,3114,まあ、従約もなんか
3115,3117,これ、それこないだ
3117,3118,思ったんですよ
3118,3120,結構その
3120,3122,大企業とかで
3122,3124,新しくそのCEOになりました
3124,3126,みたいな感じで
3126,3129,あの、お知らせが出たりするじゃないですか
3129,3134,で、全職がその全然違う会社でまたCEOをしてて
3134,3137,で、この業界で
3137,3140,もう頑張ります!みたいな感じのことをね
3140,3142,あのー
3142,3143,言ってる
3143,3145,もうちょっとこんな小学生みたいなコメントじゃないんだけど
3145,3147,もっとなんか偉いこと言ってるんですけど
3147,3150,で、その社長さんとかもいる中で
3150,3153,結局のところなんかそのCEOって
3153,3156,CEO自体はあんまやること変わんないのかな
3156,3157,と思って
3157,3160,もちろんその業界とか
3160,3162,その職種とかによって
3162,3164,あのー
3164,3165,実際に
3165,3166,まあその
3166,3167,なんだろうな
3167,3171,手を動かしてる人の作業とかは全然違うと思うんですけど
3171,3174,なんかCEOがこう新しく呼ばれて
3174,3175,職に就いて
3175,3177,で、なんかじゃあ
3177,3180,まあこの会社立て直していきましょう!みたいなこと
3180,3181,の話になった時って
3181,3184,結局やること大体一緒なのかな
3184,3186,だからなんか全然違う業種から
3186,3189,あのCEO呼んできたりすんのかな
3189,3190,って
3190,3192,思いました
3192,3193,ね
3194,3195,変わらないんじゃないかな
3195,3198,CEOもCCOもやったことないからわからんけど
3198,3201,私もCEOはやったことないからさっぱりわからん
3201,3203,はははははは
3204,3206,だから結局そのなんか
3206,3208,もうなんかいらないところを全部なんか
3208,3209,産みを出して
3209,3211,うん、なんか
3211,3214,あの無駄なところをカットして!みたいなところは
3214,3216,もしかしたら一緒になるかもね
3216,3217,うん
3218,3221,という風に思いましたし
3221,3222,なんかそれで言うとね
3222,3225,やっぱその現場叩き上げで
3225,3226,社長になりました
3226,3229,みたいな方って最近どうなんだろうな
3229,3230,なんか
3230,3233,いわゆるその
3233,3234,接種生というか
3234,3236,家族経営の会社みたいなのは
3236,3238,かなり少なくなったっていう
3238,3240,体感なんですけどね
3240,3242,どうなるんですかね
3242,3244,はははははは
3244,3246,ナナシに聞いてみる?
3246,3247,この間でもなんか
3247,3249,イズミさんが24時間の企画で
3249,3250,ナナシさんにね
3250,3252,インタビューしてたので
3252,3254,そのあたりでなんか
3254,3256,いや、でもなんか
3256,3258,え?でもなんか無難なことしか
3258,3260,言ってなかったような気がするな
3260,3261,なんか
3261,3262,あの
3262,3265,見たんですけど結構眠かったんで
3265,3266,あんまり
3266,3268,なんかきっちり覚えてないけど
3268,3271,なんか無難なコメントだなって思った覚えだけがある
3271,3272,うん
3272,3274,はい、という感じです
3274,3276,いきなりステーキは息子に社長を譲ってた
3276,3278,はぁー、なるほどね
3278,3280,はははははは
3280,3283,まあでも正直あの企画で
3283,3285,ナナシさんが全然
3285,3286,当たったり触ったりされちゃったら
3286,3288,それはそれで困るからね
3288,3290,はははははは
3290,3292,めちゃめちゃなんか
3292,3294,特定のメンバーのさ
3294,3296,なんか愚痴とか言い始めちゃったら
3296,3297,マジで困るから
3297,3299,はははははは
3299,3301,無難なことしか
3301,3304,言えないよ決まってるよね
3304,3305,ナナシさんも大変だな
3305,3306,はい
3306,3308,では次ですね
3308,3311,えー次のお便り読ませていただきます
3311,3314,えー中継のうなぎのぼりぼりさん
3314,3316,はい、現場から中継です
3316,3318,ただいま私の職場で
3318,3320,その使い方をどこで習った?
3320,3323,に対し人生で一度も言ってみたいセリフ
3323,3325,説明書読んだのよ
3325,3328,をドヤ顔で言うことに成功した模様です
3328,3331,現在職場ではお盆休みを取得する社員が多く
3331,3333,なおかつ流行り病とその対応で
3333,3335,突発的な人手不足が発生しており
3335,3338,入社2年目の私が使ったことのない器具で
3338,3340,ぶっつけ本番で業務に当たっていたところ
3340,3343,お盆休みを満喫してきた先輩からの問いに
3343,3346,アドレナリンバキバキの私が答えたとのことです
3346,3348,またそれに対し一番偉い人は
3348,3350,事故がなくてよかったねー
3350,3352,とコメントしており
3352,3354,私が以前から所謀していた
3354,3356,休憩室に畳を設置する件について
3356,3357,前向きに考えてくれるとのことです
3357,3359,現場からは以上です
3359,3361,ね、よかったねー
3361,3363,ふふふふ
3363,3365,よかったねー
3365,3367,そうこれ何だろうなと思ったら
3367,3369,コマンドなんですね
3369,3371,なんでさインターネットの人って
3371,3373,みんなコマンドがそんなに大好きなの?
3373,3375,私コマンドまだ見てないんですよ
3375,3377,でも前からその映画の
3377,3380,同時視聴やろうかなーって話したら
3380,3382,コマンドはどうですか?
3382,3385,っていうね、あのーお便りとかをね
3385,3387,食い気味にもらうんですよね
3387,3390,なんでそんなにコマンドがみんな大好きなんだろうって
3390,3392,思う
3392,3394,必修科目だから?
3394,3396,はぁー
3396,3398,元ネタが、そう元ネタがあるんですよ
3398,3401,これはコマンドっていう映画のセリフらしいです
3401,3403,その使い方をどこで習った?に対し
3403,3405,説明書を読んだのよ
3405,3407,ドヤ顔で言う
3407,3409,あ、ランボーもね
3409,3411,みんなランボーも好きだよね
3411,3414,そう、なんかランボーとコマンドはね
3414,3417,あのー皆さんによくお勧めされるし
3417,3419,あと実質なんかその
3419,3422,同時視聴とかしてる方もね
3422,3424,多い気がします
3424,3427,アーノルドシュワルツネッカーが出る
3427,3429,あ、なるほどね
3429,3432,ロードショアの定番?へぇー
3432,3434,ネットmemeを知った後でコマンドを見ると
3434,3436,ずっとmemeしかない
3436,3438,ははははは
3438,3440,え、それ私のジョジョと一緒だわ
3440,3442,私もあのジョジョ見始めて
3442,3444,このセリフも知ってるこのセリフも知ってる
3444,3446,この人知ってるみたいな感じになりました
3446,3449,うん、完全にジョジョと一緒
3450,3452,えーということで
3452,3454,えー、まぁちょっとね私もね
3454,3456,あの人生で
3456,3459,え、なんだろ、人生で一度は言ってみたいセリフ
3459,3461,なんかあるかな
3461,3463,なんかめちゃめちゃかっこいいやつ
3465,3467,あ、あれだわ
3467,3469,あのーなんか
3469,3471,あれ言いたいなと思って
3471,3473,一生覚えられないやつがあるんですけど
3473,3475,あのー
3475,3477,攻殻機動隊のね
3477,3480,あのーなんか目と耳を塞いどいたら
3480,3482,まぁ、えんちゃうかなみたいな
3482,3484,そういうのがね
3484,3486,なんかあんま今のが
3486,3488,なんか気に食わんのやったら
3488,3490,なんか目と耳塞いどいたらえんちゃうみたいな
3490,3492,そういうのがねかっこ、うわかっこいい
3492,3494,かっこよすぎるんだがと思ってね
3494,3496,それをいつか言いたいなと思うんだけど
3496,3498,ちょっと長すぎて覚えられない
3498,3501,ちょっとなんだっけ
3501,3503,それはなんか
3503,3506,えっと、キャッチャーインズライのなんか
3506,3508,引用がそれなんだっけ
3508,3510,ちょっと忘れましたけど
3510,3513,目と耳を塞いで
3513,3516,空き地に潜んで暮らしていくしかないじゃない
3516,3518,みたいな、なんかそういうことですよね
3518,3520,そういうことだったっけ
3524,3527,なんか目、うん、え、なんかあんまなんか
3527,3529,キャッチャーの感じが気に入らないんだったら
3529,3532,目と耳を塞いで空き地でひっそり暮らすしかないじゃない
3532,3535,みたいなことだったと思います、確か
3535,3537,だからね、なんか
3537,3539,現状になんか満足しているのに
3539,3541,自分を変えようという気がない人に対しては
3541,3544,そういうふうに今後言っていきたいと思います
3544,3546,はい
3548,3550,では次ですね
3550,3553,タオエリミノ、あ、キタイニョさんからの
3553,3555,え、ちょっと普通に名前読んじゃった
3555,3557,次のお便り読ませていただきます
3557,3561,中継のタオエリミノッタ、あ、キタイニョさん
3561,3564,はい、本日クランクインされた
3564,3567,劇場版勇敢キスアニマールの撮影現場からの
3567,3569,最新の情報をお届けします
3569,3572,制作発表時に稲葉羽根役をシルベスター・スタロン
3572,3575,大浦留加子役をジェイソン・ステイサム
3575,3578,コナン・ミア役をドルフ・ラングレンが
3578,3580,演じることは既にお伝えしておりましたが
3580,3584,新たに黒猫七子役にアノン・アーノルド・シュワルツネッカーが
3584,3586,キャスティングされたと発表がありました
3586,3589,また友情出演としてアニマールを卒業した
3589,3592,あの宗谷一華がなんと本人役で出演決定
3592,3595,撮影初日は宗谷一華が赤羽根駅前のデニーズで
3595,3597,ミニチョコサンデーを3つ食べながら
3597,3603,ひたすら社敬するシーンが撮影されたようです
3603,3607,社敬か、社敬するシーンを中心に撮影されたようです
3607,3611,劇場公開は2032年12月、今からとっても楽しみですね
3611,3615,現場からは以上です。スタジオにお返しします
3615,3617,エクスペンダブルズじゃん
3623,3625,エクスペンダブルズじゃん
3627,3628,でした
3628,3631,なんか、あのー
3633,3638,正直ね、オーラルカオ役がジェイソン・ステイさんだって聞いて
3638,3640,あのすごい嬉しいなって
3640,3644,なんかやっぱり最初劇場版になるっていうので
3644,3649,オタクって少しやっぱその内部になっちゃうっていうか
3649,3655,ちゃんとその自分のね、思った、好きな作品の世界観が
3655,3660,きちんと現実になるのかなっていう
3660,3664,具現化される時に歪んでしまうんじゃないかなっていう懸念が
3664,3667,やっぱりどうしてもあるんですけど
3667,3670,ちょっと、まあね、あのー
3670,3674,本当に恐れ多いんですけども、私の役をね
3674,3675,あのジェイソン・ステイさんが
3675,3680,そして、ねるちゃんの役はシルベスター・スタロンね
3680,3682,話はハーノルド・シュワラティネッカーで
3682,3684,本来はミヤがドルフ・ラングレンね
3684,3687,演じてくれるということで
3687,3689,ベネリクト・カンバーバッチじゃなくていいですか?
3689,3691,いや、ちょっと待ってその
3691,3693,今もうすでにエクスペンダブルズなのに
3693,3697,そこにベネリクト・カンバーバッチは入って平気ですか?
3697,3698,どうですか?
3698,3699,あ、でもどうだろう
3699,3701,ドクター・ストレンジの時結構ムキムキしてるような気もするから
3701,3702,大丈夫なのかな?
3702,3703,うん
3705,3706,えー、ということでね
3706,3710,えー、とっても、まあその公開が2032年ということで
3710,3712,少し先になってしまうんですけど
3712,3714,えー、とっても楽しみにしています
3714,3718,皆さんもね、ぜひ劇場に足を運んでみてください
3718,3719,はい
3719,3723,www
3723,3724,はい、えー
3724,3726,ということで、えー次ですね
3726,3728,えー、最後の
3728,3730,えー、中継の
3730,3733,えー、中継がつながっておりますので
3733,3736,お便り読ませていただきたいと思います
3736,3738,えー、中継のアバランシア幸福さん
3738,3741,はい、ルカゴさん、リスナーの皆さんこんばんは
3741,3744,私は今千葉の幕張メッセに来ております
3744,3745,夏といえばロックフェス
3745,3747,サマーソニックが本日より開催されます
3747,3751,そして前夜祭のソニックマニアが裏ラジの裏でまさに開催中
3751,3752,今やってるんだ
3752,3756,3時15分からはクリーピーナッツがマウンテンステージに出演予定となっております
3756,3761,ちなみにワウワウオンデマンドにてサマーソニックソニックマニアの両方がライブ配信されています
3761,3765,無料キャンペーン中なので今月中に開発すれば実装で視聴可能
3765,3767,裏ラジ後に見てみてはいかがでしょうか
3767,3771,以上このコーナーはワウワウとクリエイティブマンの提供でお送りいたしました
3772,3773,というお便りいただきました
3773,3778,今やってるあと1時間15分後にクリーピーナッツが出るということでね
3778,3782,なんとワウワウオンデマンドが今無料キャンペーン中ということで
3782,3784,皆さん気になる
3784,3790,サマーソニックって誰が出るんだろう
3792,3798,この間もなんか今ちょうど何かの再放送がやってますって教えてくれた方いたな
3798,3800,ちょっと待ってこれ音出ないよなまさか
3800,3802,やめてくれよな
3802,3804,出ないよかった怖
3806,3809,キングヌーもマキシマムザホルモンも出る
3810,3811,じゃん
3814,3816,マキシマムザホルモンも出るじゃん
3818,3822,なんで行きたかった行けねーわ全然行けないわ
3826,3829,全然行けないわ明日七石パークだし
3829,3833,明後日は火曜祭があるから全然行けねー
3834,3837,全然行けねーかったですしょうがないね
3837,3840,それこそだから今ねオンラインで見れるんで
3841,3845,女王鉢も出る大阪でめちゃめちゃいいですね
3846,3848,なんてこったちゃんみなも出る
3850,3853,皆さんこれは是非ねワウワウに入るしかあるまいて
3853,3857,すごいね有益な情報ありがとうございました
3858,3861,なんかね今回有益お便りがすごく多くてね
3864,3867,東橋よしひろ店の
3869,3871,先行抽選販売が
3872,3876,8月21日までですっていうお知らせも来てましたリマインドがね
3877,3881,これ皆さん先行抽選行きたいよって盛り上がってくれたら
3881,3885,先行抽選行きたいよって森アーツセンターギャラリーで開催されるそうなんで
3885,3887,絶対行きたいよっていう方は
3888,3892,是非ね8月21日23時55分までに
3893,3896,申し込んでみてはいかがでしょうか
3901,3903,はいということでね
3903,3907,本当にねこの中継つないでくれる方が
3907,3911,もうマジで本当に今の現状を送ってくださる方もいるし
3911,3914,有益情報を送ってくださる方もいたし
3914,3918,あとなんかさっきゾンビに噛まれて
3918,3921,今人間をバーベキューしてるところですみたいなね
3921,3923,面白いお便りもいただいてたんで
3923,3925,たくさん皆さんね
3926,3931,なんだろう全然想像もしていなかった方向からのね
3931,3935,中継が来ていたんでめちゃめちゃ面白かったですありがとうございます
3935,3937,本当かもしれないよ確かに本当かも
3937,3942,今ゾンビに噛まれてなんか人間って意外と牛肉みたいな味がするんですね
3942,3944,みたいなねリポートしてくれた方がいたんで
3948,3951,本当かもしれないもんねそうだよな確かに
3951,3954,嘘って決めつけたのよくない視野が狭かったわ
3956,3959,ということで次のコーナーに行きたいと思います
3959,3967,推しと結婚したらのねシューガールのメールテーマコーナーに行きたいと思います
3974,3976,うわカーソルが痛い
3977,3980,ではこちら推しと結婚したら1通目
3980,3985,ウィンガーディアムエビせんべいさんからのお便りですありがとうございます
3985,3990,推しと結婚したらということでしたが私が好きなアイドルマスターの推しキャラの
3990,3995,父親になりたい願望が強いので推しの父親になったらとして答えさせてください
3995,3998,ということで父親もねあれですね
3998,4003,まあ大きい枠で言ったら家族になるってことなんでね
4008,4012,娘がアイドルということを知人に伝えた際によく言われることは
4012,4016,よくアイドルになるのを許したねということです
4016,4021,それアイドルになりたいって言われた時は驚きましたし家族で話し合いを重ねましたよ
4021,4027,でも最後は絶対やるんだもんという娘の意思に負けちゃいました笑い
4027,4033,娘はそれはうちうち可愛いですからアイドルになっても活躍できるだろうってことは分かってました
4033,4040,あとは彼女の強い意思が伝わったので私たちは精一杯応援してやろうって決めたんです
4040,4044,月並みな答えですかね笑い
4044,4046,娘へメッセージですか
4046,4050,この16年間真面目に伝えたことはなかったですが
4050,4056,そうですね父さんはどんな時でも味方だぞってことを伝えたいですね
4056,4059,事務所の事務員さんと話した時に
4059,4063,あかねちゃんはいつも明るい子ですよって言ってくれたんですけど
4063,4067,いろんなことを気にしちゃいがちな娘のことだから周りを気遣って無理してから
4067,4070,元気を出すこともあるんじゃないかって心配になるんです
4070,4073,だからちょっとでも辛くなったら何でも話してほしいですね
4073,4076,年が離れてて相談しづらいんだったら
4076,4081,アイドルのお友達の中に何でも相談できる子を見つけ出してほしいです
4081,4085,あとは以前体のラインがかなり出た衣装を見せてくれたんですが
4085,4089,やっぱり父親的にはあれは心配になっちゃいましたね
4089,4092,ピチッとした服じゃなくても十分可愛いんだから
4092,4096,もっとふわもこで可愛い服を着ているんじゃダメなのかって伝えたんですけど
4096,4100,お父さんはこの服の良さがわからないんだからって一括されちゃって
4100,4105,何でも言い返すようになっちゃって嬉しいような悲しいようなって気持ちですね
4105,4109,いろいろ言ってきましたけど楽しくアイドルができていれば十分です
4109,4112,もちろん活躍してほしいって気持ちはありますけど
4112,4118,周りのみんなと仲良く楽しく活動ができていたらそれだけで父親としては嬉しいですよ
4119,4122,というお便りでした
4122,4125,ねえ本当にパパなのか
4125,4128,日野朱音ピー
4132,4135,いいお父さんですね
4135,4137,ちょっとタイムリーだよね
4137,4140,少々のタイムリーさをはらんでいるよね
4140,4146,でも大丈夫だって日野朱音ちゃんは実在するんだけれども
4146,4154,でも日野朱音ちゃんのお父さんになる権利っていうのは
4154,4157,誰しもが持っているものだから
4160,4163,プロデューサーのピーじゃなくてパパのピーだからね
4164,4168,あ、アイマスに朱音ちゃん二人いるの?え、大丈夫なの?
4168,4170,野村原の方?
4172,4178,なんでアイマスという世界の中に二人も同じ名前の子がいていいのか
4178,4184,まあでも実際のアイドルもそういうことあるもんな
4187,4193,まあね、今週結構ね色々ありましたけど
4196,4202,まあ結局のところやめてくださいって言ってることに対して
4203,4207,深追いしないっていうのが大事なんだなって思いました
4207,4214,でもね、あのーちょっと最近このネタが好きすぎていじりすぎたなーっていうのがね
4214,4216,いくつか心当たりがあったので
4216,4219,やめてって言われたらやらないことにしようと思って
4224,4227,やめてって、やめてって、まあでも何なんだろうね
4227,4229,なんかやめ、ん?
4230,4233,やめてって言うそういうふりなのか
4233,4237,でも本当にやめてほしいのかっていうのをやっぱり判断するには
4237,4240,なんか共感力が必要だし
4240,4247,人間ってその共感力を生まれながらにして持っているタイプと持っていないタイプがいると思うんでね
4247,4253,それはだからその空気を読む力みたいなものなんですかね
4254,4260,まあやらないって言われたらやらないっていうのが一番ね、安定だと思うんですけど
4260,4261,うん
4262,4264,ホットホットなお風呂はこすりたい
4264,4266,ホットホットなお風呂久しぶりに聞いたな
4266,4270,なんかあの半年に一回見ると面白いタイプだからなホットホットなお風呂は
4270,4276,ホットホットなお風呂気になる方はホットホットなお風呂で検索したら動画が出てくるんじゃないかな
4276,4279,出てくんのかな?本当に温かいお風呂が出てきちゃうのかな
4279,4281,ちょっと待ってね
4282,4285,ホットホットなお風呂
4285,4289,あったかいお風呂出てきちゃった出てこないわ無理かそりゃ
4289,4294,だって流石にホットホットなお風呂じゃ出てこないか
4294,4296,難しいな
4296,4301,またねあの私はホットホットなお風呂が大好きなんで
4301,4307,コナミアがね生み出した名曲歌ってみたんですけど
4307,4312,また定期的に半年に一回ぐらいね
4312,4321,記念碑的な私たちの活動の軌跡として表舞台に上げていきたいと思うので
4321,4325,そちらはちょっとご安心いただけたらと思います
4325,4330,2ヶ月に1回でも面白い正直私は毎日見ても相当面白いです
4330,4338,コナミアの絶叫しながらVRカラージュをプレイしてるのも毎日見ても面白いです
4338,4343,毎日見ても面白いからどれくらいプッシュしていいのか悩むんだよね
4343,4346,本当に毎日面白いんだけどな
4346,4350,ここやっぱひげ割れが肝心ですね
4350,4357,はいということで素敵なお父さんからのお便りありがとうございました
4360,4365,次のじくらげさんからの推しと結婚したら
4365,4367,お便りありがとうございます
4367,4369,ルカコさん皆さんこんばんは
4369,4374,そしてうらラジリスナーに多くいるであろうミヤミーゴの皆様ご結婚おめでとうございます
4374,4377,よくぞよくぞご結婚なされました
4377,4383,ミヤミーゴってのはコナンミヤのね今ちょうど話題に出たコナンミヤのファンネームです
4383,4389,私が褒めているのはミヤチさんとの結婚生活が大変だということではありません
4389,4396,今妄想でミヤチとの結婚生活を想像されている皆さんに対して私が尊敬の念を抱いているのは
4396,4403,完全にしてその前段階としてミヤチとの結婚式を乗り越えているという事実に対してなのです
4403,4407,皆さんヒロエンを想像してみてください
