start_s,end_s,text
0,2,おしまいです。ご視聴ありがとうございました。
30,32,おしまいです。ご視聴ありがとうございました。
60,74,来週のゲストですけれども、DIZMさんが来てくれます。やったね。よろしくお願いします。
90,98,はい、皆さんこんばんは。パトカーも鳴り響いております。SRAMからお送りしております。
98,106,夕書320の大原るか子で、本日も夜も遅くに来てくださってありがとうございます。
106,118,ということで、先ほどね、申し上げました通り、来週16日の夜は、Dismさんが来てくれます。
118,135,前回、来ていただくのが2回目なんですけど、前回ね、配信で見たいこんなTRPGみたいな感じで、いろいろお話を伺ったので、
135,153,来週もね、来週何のお話聞かせてもらおうかなと思ったんですけど、舞台とか演劇関係のお話をね、させてもらえたらなと思ってて、それにまつわるテーマを設けようかなと思ってます。
153,159,何も聞いてないのに音量確認していただき本当にありがとうございます。助かります。
159,170,今度ね、DismさんがまたそのTRPGのセッションの配信とかもよくされてるんですけど、
170,180,冒涜都市っていう舞台をね、ちょっと待ってね、ちゃんと告知されてるよね。すっげー今怖くなっちゃった。待って。
180,185,あれ?大丈夫だよね。全然見たもんね。Twitterで見たもんね。
185,190,え?見たよね?されてるよね。よかった。
190,197,ひー怖っ。マジで怖い。舞台とかもされるんで。
197,204,それにまつわったりまつわらなかったりしたいと思います。
204,218,本当に告知関連もマジで怖くてね、特にやっぱ12月に7thincとしてもイベントを控えていますけれども、
218,228,あれ?これ告知されてんだっけ?なんか言っちゃダメって言われてたことあったけどマジでなんだっけ?ってね、日々困惑しながら配信をしていますけど、告知するときもね。
228,243,なんか、あのー、この中でリトルトゥースの皆さんもたくさんいると思うんですけど、リトルトゥースっていうのは、あのーあれですね、あれなんだっけ?
243,261,オールナイトニッポンか。踊りは。踊りさんのオールナイトニッポンで、あのよくそのー、若林さんが、若林さんがよくね、フライングで告知をしているっていう。
261,275,でなんか、なおかつまたそのね、あのー、これもオールナイトニッポンですけど、クリピナッツの松永さんもよくフライングでね、ネタバラシをしちゃってるっていうのがあって、
275,285,結構やっぱ、その深夜っていうこともあるし、生配信としてね、言っちゃいけないこと言っちゃった後の対応っていうのがやっぱ一番大事ですから。
285,295,言っちゃダメなら知らせないでほしいよね。マジで本当にそれ。マジで本当にそれなのよ。
295,311,なんか、なに?リスナーさんと同じタイミングで全てを聞きたい。うん。で、なんか正直その12月のイベントに関しても、やっぱその皆さんより先んじて知ってるわけですよ。
311,323,で、いつのコラボだったか忘れちゃったんだけど、アニマーレでコラボ、私は勇敢キスアニマーレっていうグループに所属してるんですけど、
323,339,そのね、勇敢キスアニマーレを要する7thincのイベントがまだ告知される前に、アニマーレでゲームコラボかなんかしてた時に、なんかね、ランちゃんが口を滑らしそうになった回があったんだよね。
339,350,で、なんか、ランちゃんがね、それなんかどっかのアーカイブにあると思う。
350,355,あのー、いや、ちょっと待って今危なかったね。今危なかったわーってランちゃんが自分で言ってました。
355,362,これね、後から聞くとより面白いんでね。
362,370,その時は全然、お首にも出さないというか、全然、ミリも出してなかったんで。
370,384,政府も政府なんですけど、そういうね、もし告知の前にバラしちゃってたらどうしようっていう恐怖と戦いながら生配信をしてますね。
384,392,あとなんか言っちゃいけない、言っちゃいけないこと言わないようにするっていう。
392,403,やっぱね、そういう恐怖とね、隣り合わせになりながら、あの、会いだり会えがなかったりしてるんですよ。配信で。
403,407,いやちょっと待てよ。さすがに会いだら怒られるかな。
407,419,でもなんか、他みんな会いでるし、どうだろうなみたいな感じでね、この間のエロスワード選手権とかを戦ってるわけですよね。
419,428,どのラインかなっていう。怒られたくないんでやっぱり。日々怒られたくないなっていうモチベーションで生きてるところもあるんでね。
428,435,いや、ちょっと待って、運営の七瀬さんに怒られたくないけど、どこがラインなんだろう。
435,439,思いながら配信してます。
439,444,最近コナン宮が飛ばしてる。
444,457,あの、今日ね、同期のコナン宮の切り抜きをたまたまタイムラインに表示されたんで、見たんですけど、あれいつのやつなんだろう。
457,478,なんかね、あのトイレ、コンビニのトイレに寄ったら、男性の極部を見てしまいましたっていう話をしてる回なんだけど、本当に面白いから見てほしい。
478,488,最近コナン宮がやばい奴に思えてきた。いやいやいや、え、待って、嘘でしょ。一番最初からめちゃくちゃやばかったじゃん。
488,492,なんでね、ちょっと待ってね。どれだっけな、今リツイートしよ。
492,495,えーと、確か。
495,502,今リツイートするんで待っててくださいね。めちゃめちゃ笑ったから。
502,506,やばくない時期なんてなかったもんね。だって。
506,520,コナン宮なんかずーっと一生面白いんでね、皆さん是非とも配信ご覧、元の配信もご覧いただきたいんですけど、切り抜きも非常に端的に面白く作っていただいてたんで。
520,522,これかな。
522,526,あ、これだ。
526,536,チンを見た話していいって、なんか3、4回言ってるんだよね、冒頭で。めちゃめちゃ笑った。あとご飯食べながら言ってる。
536,539,今リツイートしました。
539,553,なんか、そう、ご飯食べながらその話するのもね、すごいなと思うんだけど、私でもあんまりね、もともとはご飯中でどうのこうのみたいなのあんま気にしないタイプで。
553,571,過去の、結構昔のアーカイブでは話してるんですけど、ハンニバルっていう、人をね、美しく調理してマッツミケルセンさんが食べるっていう、そういうドラマがあるんだけど、それを見ながらソーセージとか全然食べられるのね。
571,582,だから基本的にあんまり食事中に、そういうドラマとか、そういう話題とか、全然平気なんですよ。
582,598,ただね、やっぱ昼の配信とかで、結構そういう発言が割と多いので、苦手な方はね、お気をつけいただきたいなと思います。
598,606,最初からチンの話をしたがってて何かとハミチンしていた?何のリーク?本当に。
606,618,何のリーク?いや別に、ソーとかハンニバルとか見ながら別にご飯食べられるんだけど、別に積極的に食べたいっていうか、別に食べられるぐらい。
618,625,ご飯食べながらなんかドラマ見る時に、ジャンルは問わないっていうぐらいですかね。
625,632,ですかね?ですかね?うん。ですかね?
632,641,今日、最近の配信いつも眠い眠い言ってて、お前ほんと舐めてんのかって感じかと思うんですけど、
641,649,実は明日の昼から24時間配信をする予定があって、日笠智史さんと。
649,661,前半私のチャンネル、後半智史さんのチャンネルって感じで、YouTubeのアーカイブが12時間を超えるともしかしたら残んないことがあるらしいので、
661,668,11時間半ずつで分けて配信する予定なんですけど、
668,678,さすがにやっぱちょっと昼寝というか、最近寝る時間を取るのが割とランダムなんだけど、
678,686,日中寝たらやばいなと思って、寝てなくて、
686,691,そしたら始まる1時間くらい前から急に眠くて、
691,701,え?こんなことあるのか。これからいっぱい、今日ね、本当に今日いっぱいめっちゃお便り読みたいのあるんでもう読みます。
701,708,こんなのでお便り読めんのかよ。大丈夫かよと思うんだけどね。コーヒーガム飲みしてきたんで多分大丈夫だと思うんですけど、
708,716,今日本当にすごいたくさん読みたいお便りあるんでもう読みますね。
716,723,早速なんですけど、美覚スパーキングさんからのふつおたです。
723,735,今回のラジオふつおた、普通のお便りと中継のお便りと最高の旅行というしおがるのメールテーマに沿ってお便りをいただいております。いつもありがとうございます。
735,739,美覚スパーキングさんからのふつうのお便りありがとうございます。
739,742,ルカコさん、庁員の皆さんこんばんは。
742,752,本日はライフハックの願蓄豊かなルカコさんと皆様にドクターペッパー昔に比べて飲みやすくなってる説の立証ができないか協力をしてほしいです。
752,760,ことの発端は先日、アメリカのソウルドリンクにして国内では飲むサロンパスと表されるルートビアを数年ぶりに久々に飲んで、
760,770,うーん、これこれ、この味だよと懐かしんでいた時です。あれ?ドクターペッパーってここまでじゃないけど、結構このくらいパンチあったよね。
770,780,私は15年ほどドクペを冷蔵庫にストックして愛院しているから逆に気づかなかったのかもしれませんが、徐々にあの湿布感が弱くなって万人向けの味になってきた気がします。
780,787,体感では10年くらい前から少しずつ変わってきたと覚えていますが、ここまで変わったのかと驚愕しました。
787,793,主観になりますが、現在のドクペの薬品を1シップ、1シップっていう単位ですね。
793,798,とするとルートビアは2.5シップあります。ルートビアは間違いなく昔からそのままです。
798,802,しかし昔のドクペは1.5シップはあったはずです。
802,808,会社でルートビアを今のドクペを用意して昔の味を知っている先輩6人に飲んでもらったところ、
808,814,個人差はあると全員、昔のドクペの方が湿布感強かったと答えていました。
814,819,何がきっかけかわかりませんが、10年くらい前から万人向けになってきた可能性があります。
819,825,ですがGoogleでも同じ感想は数が少なくエビデンスが足りません。どうか皆様のお力をお貸しください。
825,829,追伸、もしご存知でない方は是非ともドクペとルートビアをご賞味ください。
829,833,ドクペはスーパーでも売っていますが、ルートビアをビレッジバンガードのドリンクコーナーでたまに売っています。
833,839,もしくは沖縄の那覇空港にあるハンバーガー屋さん、A&Wではルートビア飲み放題のサーバーがあります。
839,842,お立ち寄りの際は是非とも。
842,844,ということでね。
844,850,皆さん、ドクターペッパーとルートビア飲んだことありますか?
850,855,なんかドクペはあれですよね。あれが飲んでなかった?
855,863,あのー、えーっとー、下着のさ、
863,869,平等院報道みたいな。平等院報道が飲んでたよね。
869,875,その記憶がありますね。私でも下着、下着どこまで見たかな?
875,883,なんかね、シリーズは、ワンクールは見てるはずなんですけど、うん。
883,887,なんで、あの、あ、そう、オカリン、オカリン、オカリンね。
887,895,あの、あれ、失敗した失敗した失敗した失敗したまでは確実に見てるんだけど、それ以降の記憶がちょっと曖昧なので。
895,901,その印象がすごい強くて、なんかあの、めちゃくちゃ面白かったんですけど、
901,905,なんか話の添加がこれは重くなるぞっていう。
905,914,そう、なんかその、一時期、その下着おすすめされて見始めたんだけど、
914,922,なんかこう、なんだろうな、高校、高校卒業してしばらくぐらい、
922,929,あの、なんだっけな、いわゆるその、キララ的な、
929,937,ちょっとキララ的なって言って差し支えないのか、ちょっとキララのクロートたちに失礼かもしれないんですけど、
937,949,全く起伏のない、ただ、しかも女の子しかほぼ出てこなくて、物語上のその起伏とか、なんか一大事件みたいなのが起こらず、
949,958,ただただこう、あの、1話見ても5話見ても12話見ても全部同じトーンみたいなアニメしか見られなかった時期があって、
958,965,で、そういう時におすすめされた下着を見たので、ちょっと重かったんだよね。
965,969,だから、まあいつか見たいなと思ってるんですけど、
969,974,まあちょっと結構体力がいるかな、下着。
974,980,キララファに喧嘩を売ってる?いや好きなの!好きなんです。
980,983,そういうのが好きだからちょっと許してほしい。
983,987,キララの世界で男は溶けて消える?わかる。
987,992,別になんか普通にその、お父さんとかが出てくるのは構わないんだけど、
992,997,なんか物語のその、なんだろう、主軸には関わってきてほしくないのよね。
997,1004,うん。あ、で、なんか私あれ、あの、初めて飲んだウイスキーがラフロイグだったんですけど、
1004,1008,ラフロイグは何シップですか?個人的にはラフロイグ、
1008,1013,3.5シップぐらいはある気がするんだけど。
1013,1017,3.5シップか4シップぐらいある気がしてて。
1017,1020,ちょっとドクターペッパーもルートビアンも飲んでないから、
1020,1025,飲んでないからちょっと、私の感覚が合ってるのかわかんないんですけど、
1025,1030,なんか全部飲んだことがある人がいらっしゃったよね。教えてほしい。
1032,1034,あ、シップじゃないのかな?
1034,1039,セイロガン系?なんか飲んだ時にすごい、うわ、なんだろう、
1039,1042,薬箱だって感じがした。うん。
1044,1047,すごい、え、ラフロイグは2セイロガンか。
1048,1053,なんかその、すごい薬箱感がめちゃめちゃ強くて。
1053,1058,で、うわ、ウイスキーってこんなんなんだって思った記憶がある。
1058,1062,でもウイスキー、別に全部が全部そういう感じじゃなかったですね。
1063,1066,うん。なんだかんだですごい思い出深いので、
1067,1071,なんかまた飲みたいなぁと思うんですけど、
1071,1078,意外とね、見当たらない。ラフロイグ。どこにも。うん。
1078,1083,なんでたまたま一番最初に飲んだのがラフロイグだったのかさえ。
1084,1087,多分なんか見た目か名前が好きだったのかな。
1087,1090,それかその場でオススメされたのか。
1091,1096,そもそもそれを飲んだ瞬間にすでに酔っ払ってたからあんまり覚えてないんですよね。
1096,1109,うん。ただすごい目が覚めるぐらい、なんかほろ酔い気分だったのがすごい一気に現実に引き戻されるぐらいインパクトのある飲み物でした。楽しかった。
1110,1113,今度ちょっとじゃあルートビア飲んでみたいと思います。
1113,1118,なんかドクペとかは獅子おくりさんとか飲んでそうだよね。似合うもんね、ドクペ。
1118,1133,うん。体に悪そうな感じの食べ物が似合う。やっぱ普段の食生活がさ、もうあれじゃん。なんか終末的じゃん。アポカリプスじゃん。獅子おくりさんって。
1134,1137,うん。ちょっと聞いてみようかなと思います。
1138,1142,ということで美覚スパーキングさんありがとうございました。
1142,1153,ルートビアも好きなんだ。え、なんかクリスさんって結構なんかオタクの夢詰め込んだみたいなとこあるよね。
1156,1159,あ、ドムドムバーガー好きだしね、そういえば。
1159,1161,次のお便り。
1163,1167,アンノーンさんからのお便りありがとうございます。
1167,1174,ルカコさんへ。このお便りを読んでいるということは、きっと私はもうウルララジオをリアタイしていないでしょう。
1174,1180,とても名残惜しいですが、これは必然であり、私にはどうしても避けることができなかったことをご承知ください。
1181,1184,私が最初にお便りを送ったのは何回前だったでしょうか。
1184,1190,普段文章を書かない私が何度も遂行して送信ボタンを押したのを昨日のように覚えています。
1190,1195,書事上で何回かは送れなかったこともありますが、ほぼ毎回読まれるからドキドキして聞いていました。
1195,1201,聞き終えるたびに一人反省会をし、これがダメだったんじゃないか、ああすればよかったなんてことをしていたり、
1201,1207,時間をかけて書いた渾身のお便りが読まれなかったこともありますが、それも今となってはいい思い出です。
1207,1211,最後になりますが、体調を崩しやすい時期が近づいてまいりました。
1211,1217,VTuber活動は大変だと思いますがご自愛ください。またルカコさんの姿を見られる日を待っています。
1217,1221,PS、バンカラシティのお土産は何がいいですか。
1221,1225,ご自身の宣言と見せかけてスプラトゥーンでした。
1225,1229,スプラトゥーンでしたね。
1229,1237,本当にいつもありがたくて、時間にも限りがあって、私がもう少し脱線しなければいいんですけど、
1237,1245,全てのお便りを読めるわけではないので、皆さんには本当に反省会や、
1245,1251,ちょっと申し訳ない気持ちでいっぱいなんですけど、一応全部私は読んでますので、
1251,1257,それで何か慰められるものがあればいいんですけど、
1257,1261,本当に申し訳ないです。全部読めなくてありがとうございます。
1261,1267,皆さんもスプラトゥーン買ったのかな?私は買いました。
1267,1276,家にコントローラーが、もともとスイッチのデフォルトのやつを合わせると3つあるんだけど、
1276,1284,3つともグリグリが全部壊れてて、グリグリが一斉に壊れたの。
1284,1286,なんでなんだろう。
1286,1298,分かってるんだよね。私、七瀬さんに返してない連絡があって、8日の深夜。
1298,1304,で、うわぁ返さなきゃな。これちゃんと自分で結論出して、
1304,1308,自分のお便りを読むのかどうか、
1308,1316,スプラトゥーンをダウンロードしたりしてたんだけど、そしたら全滅してた。
1316,1321,コントローラーのグリグリが。しかもプロコンが今、死なうすらしい。
1321,1328,だからやっぱりそういうことなんだなって。
1328,1331,罰なんだなって。
1331,1340,思いました。だからしょうがないんですよ。私がスプラトゥーンを思いっきりできないように。
1340,1345,七瀬がね、やれプロコン。はいっつって。そうなんですよね。
1345,1350,あとは単純に私のね、悪力、悪力?悪力はないんですけどね。
1350,1356,多分なんか力が入りすぎてるところがね、いけないんじゃないかな心配してるんですけどね。
1356,1361,なんかスイッチのコントローラーってすごい壊れやすいみたいなんで。
1361,1367,ねえなんかもともとやっぱスティックの耐久度がちょっとあれだったのかなっていうのはあるんですけど。
1367,1379,スプラトゥーンね。なんか、なんだっけな漫画家の先生で、確かスプラトゥーンが出るので、救済しますとかね。
1379,1391,あとなんか、誰だったっけな。ついさっきツイッターで見たのはなんか家族にスプラトゥーンのソフトとかコントローラーとか隠されてるみたいな。
1391,1398,でもなんか締め切りを守るために編集者とかに追い詰められたら、やしろ先生だ。そう。
1398,1401,なんで、とかね、あるんで。
1401,1418,いや確かにそう、ちょぼらう先生、スプラトゥーンのランクがね、S以下だと、どんなに面白い漫画を描いたとしても、どんなにその連載をしっかりしていたとしても、
1418,1434,漫画家としては失格だということは皆さんご存知だと思いますがっていうね、前置きをしてお休みになっているんですね、ちょぼらう先生が。
1434,1438,潔くていいなと思いました。
1438,1441,いやいい救済だな。
1441,1452,作品を楽しみにしている場合はちょっとそういう方にとってみればね、うわ続き気になるっていうところもあると思うんですけど、私はすごい潔くていい理由だなと思いましたね。
1452,1460,はい、ということで皆さんもスプラトゥーン、ヴァンカラシティ楽しんでいただけたらな。
1460,1464,いや、なんなのお前はスプラトゥーンの。
1464,1472,お前は任天堂のなんだ。楽しんでいただけたらなではない。一緒に楽しみましょうですね。間違えちゃった。
1472,1478,最近なんかお前は本当にスプラトゥーンの何みたいなことよくあるわ。自分で配信してて。
1478,1483,この間もなんか朝枠かなんかで言ってたな。お前はなんの何みたいな。
1483,1495,同じようなことをずっと繰り返し続けて1年半経ちましたね。びっくりするわ。痛い。頭ぶつけた。
1495,1503,ということでアンノンさん楽しんできてください。スプラトゥーン、私も楽しみますけれども。
1503,1512,なんか皆さんと一緒にサーモンランができたらいいのになと思うんだけど、あれやっぱサーモンランのスプラトゥーンの方がいいなと思うんだけど。
1512,1521,やっぱサーモンランをみんなでやるには皆さんにVTuberになっていただくほかないですか?ないのか。
1521,1531,なんかフレンド、あれかな?参加型用のアカウントとか作るのか。それしかないのかな。
1531,1536,でもそうするとなんか自分のそのアカウントに還元できないのかな。
1536,1548,プライベートマッチ。プライベートマッチしかないんだ。フレンドになれるならならる。
1548,1562,じゃあやっぱ7thincのオーディションを受けていただくしかないですね。7thincって今オーディションしてるんですか。
1562,1574,7thincオーディション応募方法、先行方法、まとめ。これまとめサイトだ。
1574,1586,お問い合わせ。リクルートがある。マネージャーとアートディレクターしか募集してないな。
1586,1589,所属タレント。
1589,1599,あ、あるある。所属タレントパートナークリエイター募集。募集している。
1599,1611,はい、ということでリンクをコメント欄に送っておきました。
1611,1616,皆さんこちらからね、応募をお待ちしています。よろしくお願いします。
1616,1625,1次審査2次審査を経て7thincに所属という先行の流れらしいですね。
1625,1634,私の場合なんですけれども、まず動画を送ってから、折り返しの連絡、メールが来て、
1634,1639,1回ちょっと通話でお話ししましょうみたいな感じになって、7thさんとね。
1639,1649,3回くらい電話して、通話で面接して、それぞれ2、3時間くらい喋ったかな。
1649,1658,3回かける2、3時間喋って、じゃあもう1回も直接お会いしましょうって感じで、
