start_h,start_m,start_s,start_ms,end_h,end_m,end_s,end_ms,text
0,43,54,0,0,43,56,0,すごいもうはっはっはっはっはっはっはっはっ
0,43,56,0,0,43,57,0,ってなっちゃった
0,43,57,0,0,43,59,0,はははははは
0,43,59,0,0,44,2,0,はっはっはっは怖い怖いよー
0,44,2,0,0,44,4,0,って
0,44,4,0,0,44,6,0,でねあのー実はすごい皆さん
0,44,6,0,0,44,8,0,優しいから私が確定のやつが
0,44,8,0,0,44,10,0,すごい苦手だっていうのをね
0,44,10,0,0,44,12,0,知ってくれてるんで
0,44,12,0,0,44,14,0,あのー
0,44,14,0,0,44,17,0,流行り病のせいで遅れましたっていうと
0,44,17,0,0,44,19,0,4月15日まで
0,44,19,0,0,44,21,0,あの延長できますよっていう
0,44,21,0,0,44,23,0,お便りをいただいてたんですけど
0,44,23,0,0,44,25,0,それはね
0,44,25,0,0,44,26,0,あのー
0,44,26,0,0,44,27,0,それはね
0,44,27,0,0,44,33,0,まじで3月15の朝に知りたかった
0,44,33,0,0,44,36,0,3月15の朝に知りたかったんだ
0,44,36,0,0,44,37,0,うん
0,44,37,0,0,44,40,0,一回私もこの情報忘れるから
0,44,40,0,0,44,43,0,3月15の朝にもう一回教えてくれるか
0,44,43,0,0,44,45,0,多分それまでに全力で
0,44,45,0,0,44,47,0,その進めてると思うんだよね
0,44,47,0,0,44,49,0,そうであーもう無理だよ
0,44,49,0,0,44,50,0,もう終わんないじゃん
0,44,50,0,0,44,52,0,もうできないよってなってる時に
0,44,52,0,0,44,56,0,実は1ヶ月延長できるんですよって
0,44,56,0,0,44,57,0,ね
0,44,57,0,0,44,59,0,まあ間に合うように頑張りますけど
0,44,59,0,0,45,0,0,うん
0,45,1,0,0,45,3,0,間に合うように頑張りますけどね
0,45,3,0,0,45,4,0,とにかく
0,45,4,0,0,45,6,0,努力はやめないけど
0,45,6,0,0,45,7,0,やめないよ
0,45,7,0,0,45,10,0,ということで次のねコーナーに行きたいと思います
0,45,11,0,0,45,13,0,そう延長してもなくなりはしない
0,45,13,0,0,45,14,0,だが
0,45,14,0,0,45,16,0,え?あと1ヶ月余裕ができた
0,45,16,0,0,45,18,0,という時のね
0,45,18,0,0,45,21,0,それこまで全力でやってる分のね
0,45,21,0,0,45,22,0,あのあれはあるし
0,45,22,0,0,45,24,0,最初から4月15日ですって言われると
0,45,24,0,0,45,27,0,4月15日までまじで何もないからね
0,45,27,0,0,45,28,0,うん
0,45,30,0,0,45,32,0,困ったもんですわ
0,45,32,0,0,45,33,0,あ止まっちゃった
0,45,36,0,0,45,37,0,ということでね
0,45,38,0,0,45,39,0,えー次こちらの
0,45,39,0,0,45,41,0,えー勝手にメールテーマの
0,45,42,0,0,45,44,0,コーナーに入りたいと思います
0,45,44,0,0,45,45,0,いや
0,45,45,0,0,45,48,0,私はねやっぱ社会に生きる
0,45,48,0,0,45,49,0,えー
0,45,49,0,0,45,51,0,一匹の国民としてね
0,45,51,0,0,45,53,0,一羽の国民としてね
0,45,53,0,0,45,55,0,やっぱ義務は
0,45,55,0,0,45,58,0,そう義務だからこれ
0,45,59,0,0,46,1,0,ちゃんとやりますよもちろんね
0,46,2,0,0,46,3,0,うん
0,46,3,0,0,46,4,0,ただあのー
0,46,4,0,0,46,6,0,そのやるにあたりちょっと
0,46,6,0,0,46,9,0,他の仕事がまじできるかちょっと分かってきそう
0,46,9,0,0,46,10,0,頑張るからねみんな
0,46,13,0,0,46,15,0,だから私も頑張るからみんなもあのね
0,46,15,0,0,46,18,0,頑張ってください終わってない方は
0,46,18,0,0,46,21,0,えーではねこちら1つ目のお便りなんですけれども
0,46,21,0,0,46,22,0,えー
0,46,22,0,0,46,23,0,リビングでね
0,46,23,0,0,46,26,0,えーリビングで聞いている方は気を付けてください
0,46,26,0,0,46,27,0,はい
0,46,27,0,0,46,28,0,そういうお便りです
0,46,29,0,0,46,31,0,えーうらったらさんからの
0,46,32,0,0,46,35,0,あこれ勝手にメールテーマっていうコーナーなんですけど
0,46,35,0,0,46,36,0,あのー
0,46,36,0,0,46,39,0,私がねリアルタイムでメールテーマが出せないので
0,46,39,0,0,46,41,0,あの今日はこういう話しますっていうのが
0,46,41,0,0,46,43,0,今ほんとね配信始まった直後に
0,46,43,0,0,46,46,0,あの今日はあのチャーリーとチョコレート工場の
0,46,46,0,0,46,49,0,話をメールテーマにしますっていうのができないんで
0,46,49,0,0,46,52,0,あのーこういう話に脱線してるだろうなっていうのを
0,46,52,0,0,46,55,0,想像して送ってもらってるっていう事前に
0,46,55,0,0,46,56,0,そういうコーナーになってます
0,46,56,0,0,46,57,0,よろしくお願いします
0,46,57,0,0,46,58,0,うん
0,47,0,0,0,47,1,0,えー
0,47,1,0,0,47,3,0,でうらったらさんからの勝手にメールテーマ
0,47,3,0,0,47,5,0,お便りありがとうございます
0,47,5,0,0,47,6,0,えーるかこさんこんばんは
0,47,6,0,0,47,9,0,こんばんは初めてメールを送らせていただきます
0,47,9,0,0,47,10,0,ありがとうございます
0,47,10,0,0,47,12,0,えーさて今週のメールテーマ
0,47,12,0,0,47,15,0,検索汚染がひどいワープルのメール
0,47,15,0,0,47,18,0,検索汚染がひどいワード選手権についてですが
0,47,18,0,0,47,21,0,私はぶっちぎりでいそじだと思います
0,47,21,0,0,47,23,0,いそじはたぶんこれ50
0,47,23,0,0,47,26,0,50歳のみちと書いて
0,47,26,0,0,47,27,0,うん
0,47,28,0,0,47,30,0,50歳のみち
0,47,30,0,0,47,32,0,ロゴの石のロと書いて
0,47,32,0,0,47,34,0,えーいそじですね
0,47,34,0,0,47,35,0,うん
0,47,36,0,0,47,37,0,あってる?
0,47,37,0,0,47,38,0,えー
0,47,39,0,0,47,42,0,えー先日何の気なしに
0,47,42,0,0,47,45,0,単語の意味や用法を確認しようと思って
0,47,45,0,0,47,47,0,Googleで検索したのですが
0,47,47,0,0,47,49,0,そこに出てきたのは
0,47,49,0,0,47,52,0,一面の熟女ものアダルトサイトへのページリンク
0,47,52,0,0,47,55,0,どうやらGoogle先生の中では
0,47,55,0,0,47,58,0,いそじは一発でエロにつながるワードのようです
0,47,58,0,0,47,59,0,ふふ
0,47,59,0,0,48,0,0,いそじの
0,48,0,0,0,48,2,0,いそじの辞書ページが表示されたのは
0,48,2,0,0,48,4,0,10件以上後ろでした
0,48,4,0,0,48,5,0,うん
0,48,6,0,0,48,8,0,うっかり画像検索でもしようものなら
0,48,8,0,0,48,10,0,体制のない人にとってかなり大変なことになってしまいます
0,48,10,0,0,48,12,0,よそじやむそじ
0,48,12,0,0,48,13,0,60
0,48,13,0,0,48,15,0,60ってむそじなのかな
0,48,15,0,0,48,18,0,といった他の同芸人のワードを検索した場合は
0,48,18,0,0,48,20,0,基本的に辞書的な意味を教えてくれるようです
0,48,20,0,0,48,21,0,しかし
0,48,21,0,0,48,25,0,いそじだけはなぜか熟女ものアダルトサイトばかりヒットします
0,48,25,0,0,48,27,0,どういうことなのでしょうか
0,48,27,0,0,48,29,0,いそじ界隈による陰謀なのでしょうか
0,48,29,0,0,48,32,0,もうおたえるというよりこれは警告です
0,48,32,0,0,48,33,0,いそじは
0,48,33,0,0,48,35,0,いそじだけは検索しちゃダメだ
0,48,36,0,0,48,37,0,ということでね
0,48,37,0,0,48,40,0,私さっき検索しましたこれ
0,48,40,0,0,48,41,0,ほんとだよ
0,48,42,0,0,48,43,0,ほんとなの
0,48,43,0,0,48,45,0,画像も見てみてください
0,48,45,0,0,48,48,0,後ろに誰もいない人はね
0,48,50,0,0,48,51,0,マジでほんとだった
0,48,54,0,0,48,58,0,私しかもシークレットモードじゃないやつで検索しちゃった
0,48,59,0,0,49,3,0,みんなは少なくともシークレットモードは使ってくるような
0,49,4,0,0,49,5,0,あれだけどね
0,49,5,0,0,49,7,0,どんな効果があるのか分かんないけど
0,49,7,0,0,49,8,0,ダメージくらっちゃった
0,49,9,0,0,49,11,0,やっぱレベル違った画像も
0,49,11,0,0,49,12,0,そうなんだよね
0,49,12,0,0,49,14,0,なんでいそじだけこんなことになってるのか
0,49,14,0,0,49,16,0,ほんとに面白くて
0,49,18,0,0,49,20,0,すごい発見をしたし
0,49,20,0,0,49,22,0,それを教えてくれたね
0,49,22,0,0,49,24,0,うらったらさんほんとにありがとうと思って
0,49,27,0,0,49,29,0,履歴を残してこその男
0,49,29,0,0,49,31,0,そうだね確かに
0,49,32,0,0,49,34,0,これがねやっぱ
0,49,34,0,0,49,36,0,なんでいそじだけって思って
0,49,40,0,0,49,44,0,これなんか理由知ってる人とか思い当たる人がいたらね
0,49,44,0,0,49,46,0,ぜひともハッシュタグで教えてほしい
0,49,48,0,0,49,51,0,アダルト業界でいそじというものが
0,49,52,0,0,49,59,0,塾上コンテンツイコールいそじってことになってるのかな
0,49,59,0,0,50,2,0,ねゴールデンエイジーのやつ
0,50,6,0,0,50,8,0,すげー面白くて
0,50,9,0,0,50,11,0,量が多いんだよね量が多いし
0,50,12,0,0,50,16,0,サジェストがね検索結果でバーって出てくるのが
0,50,16,0,0,50,20,0,マジでほんと1から10まで全部アダルトコンテンツだったの
0,50,21,0,0,50,23,0,非常に検索して面白かったので
0,50,23,0,0,50,26,0,みんなも検索してくれたらいいなと思って
0,50,26,0,0,50,28,0,今お便りご紹介しました
0,50,28,0,0,50,30,0,みんな検索してくれて本当にありがとう
0,50,33,0,0,50,37,0,今一時的にみんないそじを一緒に検索してると思うと
0,50,37,0,0,50,42,0,こうやっぱライブ配信の良さを今ひしひしと感じてますね
0,50,43,0,0,50,45,0,ありがとうございました
0,50,45,0,0,50,47,0,トラップカード発動
0,50,50,0,0,50,52,0,トラップカード発動でしたね伏せといた
0,50,53,0,0,50,54,0,事前にね
0,50,54,0,0,50,57,0,では次
0,50,58,0,0,50,59,0,いやさあ
0,51,0,0,0,51,3,0,次いかないんだけど次って言っといて
0,51,4,0,0,51,8,0,遊戯王のねバトルが明日あるんですよ
0,51,9,0,0,51,11,0,あの泉さんのチャンネルで
0,51,12,0,0,51,14,0,私七石さんと戦うんで
0,51,14,0,0,51,16,0,七石さんがすごい強いんで
0,51,16,0,0,51,19,0,ハミルトンさんっていうプロの方にね
0,51,19,0,0,51,21,0,デッキを監修いただいて
0,51,21,0,0,51,24,0,さっきガチャ配信したんですよね
0,51,24,0,0,51,27,0,でね遊戯王色々勉強して
0,51,28,0,0,51,31,0,ルールブックとかも読んだんだけど
0,51,32,0,0,51,33,0,まあわからない
0,51,33,0,0,51,35,0,なーんもうわからん
0,51,35,0,0,51,37,0,なんでこんな
0,51,37,0,0,51,39,0,私なんかルールブック読んだ後
0,51,39,0,0,51,41,0,私って本当にバカなんだと思った
0,51,41,0,0,51,45,0,日本語で書いてるのに日本語が本当に理解できない
0,51,45,0,0,51,48,0,私はバカだったんだって思いましたね
0,51,48,0,0,51,49,0,そう
0,51,49,0,0,51,53,0,で一応明日あのデュエルなんで
0,51,53,0,0,51,57,0,なんかあまりにも直前すぎてね
0,51,59,0,0,52,1,0,裏でやろうと思ったら
0,52,1,0,0,52,4,0,別に裏で始められたと思うんですけど
0,52,4,0,0,52,7,0,ただそのせっかくなんでね
0,52,7,0,0,52,9,0,配信でやりたいなって
0,52,9,0,0,52,11,0,配信でガチャ引くところから
0,52,11,0,0,52,15,0,やってこうソロとかランクとかやってから
0,52,15,0,0,52,18,0,無しデュエル望みたいなって思ったら
0,52,18,0,0,52,20,0,前日になっちゃった
0,52,20,0,0,52,23,0,前日になっちゃったんだ
0,52,23,0,0,52,26,0,でもなんかエゴサしてたら
0,52,26,0,0,52,27,0,なんかりょがこさんには
0,52,27,0,0,52,30,0,七死にボコボコにされて絶叫してほしいっていう
0,52,30,0,0,52,32,0,エゴサが引っかかってきたから
0,52,32,0,0,52,35,0,そういう需要もあるのですかって
0,52,35,0,0,52,37,0,しみじみと思ってますね
0,52,37,0,0,52,39,0,どっちに転んでもいいよね
0,52,41,0,0,52,42,0,七死さん運営のね
0,52,42,0,0,52,45,0,七死さんに勝っても負けても
0,52,45,0,0,52,48,0,需要があるんじゃないかと思うんで
0,52,51,0,0,52,53,0,どちらにしてもそうだったらよかったな
0,52,53,0,0,52,54,0,思いました
0,52,54,0,0,52,56,0,七死さんをボコボコにしてほしい
0,52,56,0,0,52,57,0,任せてくれ
0,53,2,0,0,53,4,0,私前に
0,53,5,0,0,53,6,0,ポーカーの大会
0,53,6,0,0,53,10,0,七死インクのポーカーの大会に
0,53,10,0,0,53,12,0,出させてもらったことがあって
0,53,12,0,0,53,15,0,アプリゲームと
0,53,15,0,0,53,17,0,ポーカーチーズっていうゲームと
0,53,17,0,0,53,18,0,コラボだったんですけど
0,53,18,0,0,53,20,0,その時に
0,53,22,0,0,53,26,0,事前に結構色々調べたんだけど
0,53,26,0,0,53,28,0,当日ゼロポイントだったんだよね
0,53,28,0,0,53,29,0,取ったポイントが
0,53,34,0,0,53,35,0,それがさ
0,53,37,0,0,53,39,0,これもこの間
0,53,39,0,0,53,43,0,同期のミルチーズっていう
0,53,43,0,0,53,44,0,定期配信してるんですけど
0,53,44,0,0,53,46,0,ミルチーズランチミーティングっていう
0,53,48,0,0,53,50,0,月野義次郎と小波谷と3人で
0,53,50,0,0,53,52,0,お互いの黒歴史で戦うっていう
0,53,52,0,0,53,53,0,デュエルをやったんですけど
0,53,53,0,0,53,54,0,それもまだデュエルなんだけど
0,53,54,0,0,53,56,0,あの時に絶対
0,53,58,0,0,54,0,0,ポーカーチェイスで0点だった時のこと
0,54,0,0,0,54,2,0,出てくるかなって思ってたら
0,54,2,0,0,54,5,0,出てこなかったんだよね
0,54,5,0,0,54,7,0,うん
0,54,7,0,0,54,9,0,え?私がポーカーって言うだけで笑う?
0,54,9,0,0,54,11,0,それはどうなの?
0,54,15,0,0,54,17,0,なんかデータキャラとして
0,54,17,0,0,54,19,0,こんなのデータやりませんって
0,54,19,0,0,54,20,0,メガネパリンって割れてほしいって
0,54,20,0,0,54,22,0,ししおクリスもツイートしてたわそういえば
0,54,22,0,0,54,24,0,思い出したけど
0,54,25,0,0,54,27,0,そうそうそうそう
0,54,28,0,0,54,31,0,司令塔?司令塔っていうかね
0,54,31,0,0,54,33,0,別になんか私作戦立案してたって
0,54,33,0,0,54,35,0,わけじゃなくて
0,54,35,0,0,54,37,0,ポーカーの大会の時はね
0,54,38,0,0,54,40,0,前日に
0,54,40,0,0,54,42,0,同じチーム4人で
0,54,42,0,0,54,43,0,宗谷一華
0,54,43,0,0,54,46,0,平光 コナン 宮 桜 六甲子の4人で
0,54,46,0,0,54,48,0,同じチームだったんですよポーカーのね
0,54,48,0,0,54,50,0,でその前日に
0,54,52,0,0,54,53,0,コナン 宮 チャンネルで
0,54,53,0,0,54,55,0,ポーカーの練習したら
0,54,55,0,0,54,57,0,結構ねコメントだったかな
0,54,59,0,0,55,1,0,エゴサだったらちょっと忘れちゃったんですけど
0,55,1,0,0,55,3,0,コナン 宮マジで何もやってこないなみたいな
0,55,4,0,0,55,6,0,こんなんで明日大丈夫なのかみたいな
0,55,7,0,0,55,8,0,ご意見がね
0,55,8,0,0,55,10,0,チラホラ見えたんで
0,55,12,0,0,55,14,0,うちのコナン 宮はこんなもんじゃないですけど
0,55,14,0,0,55,16,0,と思って
0,55,16,0,0,55,17,0,動画とかね
0,55,17,0,0,55,19,0,なんか自分がこう見た
0,55,19,0,0,55,21,0,資料とかを
0,55,21,0,0,55,23,0,送ってたんですよ
0,55,23,0,0,55,24,0,で
0,55,24,0,0,55,26,0,これすごいわかりやすかったよっていう
0,55,26,0,0,55,27,0,動画を
0,55,27,0,0,55,29,0,5本送って
0,55,29,0,0,55,31,0,1本も見てくれなかったんだよね
0,55,33,0,0,55,35,0,でもすごい活躍してたから
0,55,35,0,0,55,37,0,それならOKです
0,55,40,0,0,55,42,0,いや嫌でしょ私
0,55,42,0,0,55,44,0,コナン 宮がさ
0,55,44,0,0,55,46,0,コナン 宮のことを
0,55,46,0,0,55,48,0,応援してるからさ
0,55,48,0,0,55,50,0,あいついつも何もやってこねーなとかさ
0,55,50,0,0,55,52,0,明日大丈夫なのかよって言われたら
0,55,54,0,0,55,56,0,大丈夫ですけどって
0,55,56,0,0,55,58,0,思っちゃった
0,55,58,0,0,56,0,0,まさか自分が0点だとは思わなかったけどね
0,56,4,0,0,56,6,0,まさか自分が0点とは思わんよ
0,56,6,0,0,56,8,0,面白かったわ
0,56,10,0,0,56,12,0,その後になんで私が
0,56,12,0,0,56,14,0,めちゃめちゃデータで調べてきたのに
0,56,14,0,0,56,16,0,0点だったっていうのがこんなに明るみに
0,56,16,0,0,56,18,0,出たかっていうと
0,56,18,0,0,56,20,0,そうやいちかさんがね
0,56,22,0,0,56,24,0,すごい素敵な
0,56,24,0,0,56,26,0,エフェクトを添えて
0,56,26,0,0,56,28,0,データにね
0,56,28,0,0,56,30,0,お知らせしてくれたんですよ
0,56,30,0,0,56,32,0,オーラルカゴはこんなに頑張ってたのに
0,56,32,0,0,56,34,0,ポーカーで0点だったよっていうのをね
0,56,34,0,0,56,36,0,非常にわかりやすい図解と一緒に
0,56,36,0,0,56,38,0,載せてくれて
0,56,38,0,0,56,40,0,あれはすごい面白かったんで
0,56,44,0,0,56,46,0,なんかね
0,56,46,0,0,56,48,0,もう結構
0,56,48,0,0,56,50,0,経ったからあれなんですけど
0,56,50,0,0,56,52,0,割とあの
0,56,52,0,0,56,54,0,なんだろ
0,56,54,0,0,56,56,0,意地られにくいのかなって
0,56,56,0,0,56,58,0,結構
0,56,58,0,0,57,0,0,懸念した時期が
0,57,0,0,0,57,2,0,あったんで
0,57,2,0,0,57,4,0,あれはね結構嬉しかったんですよね
0,57,6,0,0,57,8,0,そうっていう思い出があります
0,57,8,0,0,57,10,0,ポーカーに関しては
0,57,10,0,0,57,12,0,なので
0,57,12,0,0,57,14,0,常々やっぱ自分がどれくらい
0,57,14,0,0,57,16,0,ジャイアンなのかっていうのが客観視できてない
0,57,16,0,0,57,18,0,ところがあるんで
0,57,18,0,0,57,20,0,でもやっぱあそこまでやってくれるのは
0,57,20,0,0,57,22,0,本当にそうやいちかだけなんでね
0,57,22,0,0,57,24,0,これからもね
0,57,24,0,0,57,26,0,何かあったら警察にやってほしいし
0,57,26,0,0,57,28,0,なんか
0,57,28,0,0,57,30,0,全然確認もなしにツイートしてたから
0,57,30,0,0,57,32,0,確認もせずに
0,57,32,0,0,57,34,0,ツイートしていいって思ってくれたことも
0,57,34,0,0,57,36,0,ちょっと嬉しかったしね
0,57,36,0,0,57,38,0,いい先輩やで
0,57,38,0,0,57,40,0,ということでね
0,57,40,0,0,57,42,0,本当に次のお便りを読みたいと思います
0,57,46,0,0,57,48,0,たわに実ったキタイヌさんからの
0,57,48,0,0,57,52,0,勝手にメールテーマ
0,57,52,0,0,57,54,0,連続ラジオドラマ
0,57,54,0,0,57,56,0,コナン・ミヤその愛
0,57,56,0,0,58,24,0,最終話
0,58,24,0,0,58,38,0,ミヤチ
0,58,38,0,0,58,40,0,ミヤチ
0,58,40,0,0,58,42,0,俺やっぱりミヤチじゃないと
0,58,42,0,0,58,44,0,満足できないんだ
0,58,44,0,0,58,46,0,身体の85%機械化された
0,58,46,0,0,58,48,0,ミヤミイゴくんが叫ぶ
0,58,48,0,0,58,50,0,ミヤチ
0,58,50,0,0,58,52,0,俺と結婚して
0,58,52,0,0,58,54,0,ミヤチの心臓が激しく高鳴る
0,58,54,0,0,58,56,0,ドクドクドクドク
0,58,56,0,0,58,58,0,ドクドクドクドク
0,58,58,0,0,59,0,0,ボタンを押せ
0,59,0,0,0,59,2,0,私も
0,59,2,0,0,59,4,0,大好きだよ
0,59,4,0,0,59,6,0,キュインキュインキュインキュイン
0,59,6,0,0,59,8,0,胸体上部から
0,59,8,0,0,59,10,0,白目く姿のコナン・ミヤが生えてくる
0,59,10,0,0,59,12,0,婚約者モード
0,59,12,0,0,59,14,0,突入
0,59,14,0,0,59,16,0,突入
0,59,16,0,0,59,18,0,突入
0,59,18,0,0,59,20,0,突入
0,59,20,0,0,59,22,0,突入
0,59,22,0,0,59,24,0,以上今週のメールテーマ
0,59,24,0,0,59,26,0,ミルチーズがパチンコになった時に
0,59,26,0,0,59,28,0,ありそうな演出でした
0,59,28,0,0,59,30,0,ちなみにタイトルや小柱のラベルの色が赤かったら
0,59,30,0,0,59,32,0,期待度がアップ
0,59,32,0,0,59,34,0,ミヤミイゴくんが病室で見ていた配信が
0,59,34,0,0,59,36,0,ねるちゃんの推し編
0,59,36,0,0,59,38,0,FO巻配信なら大当たり確定です
0,59,38,0,0,59,40,0,うーん
0,59,40,0,0,59,42,0,ということでね
0,59,42,0,0,59,44,0,ここいいですね
0,59,44,0,0,59,46,0,なんか総武線
0,59,46,0,0,59,48,0,総武線に惹かれた後
0,59,48,0,0,59,50,0,やっぱりミヤじゃないと満足できないんだ
0,59,50,0,0,59,52,0,ね
0,59,52,0,0,59,54,0,その後
0,59,54,0,0,59,56,0,ミヤミイゴくんの告白を聞いた
0,59,56,0,0,59,58,0,ミヤジの心臓が激しく高鳴る
0,59,58,0,1,0,0,0,ドクドク
1,0,0,0,1,0,2,0,ドクドク
1,0,2,0,1,0,4,0,ボタンを押せ
1,0,4,0,1,0,6,0,私も大好きだよ
1,0,6,0,1,0,8,0,キュインキュインキュインキュイン
1,0,8,0,1,0,10,0,はははは
1,0,10,0,1,0,12,0,めちゃめちゃ好きだ
1,0,12,0,1,0,14,0,私ねあんまりいまだにあの
1,0,14,0,1,0,16,0,パチンコとかスロットの楽しみ方が
1,0,16,0,1,0,18,0,わかってなくて
1,0,18,0,1,0,20,0,なんか同じ
1,0,20,0,1,0,22,0,ギャンブルだったら競馬の方が
1,0,22,0,1,0,24,0,好きだなって思うんですけど
1,0,24,0,1,0,26,0,これだったらやりたい
1,0,26,0,1,0,28,0,うん
1,0,28,0,1,0,30,0,これだったらちょっとやりたいですね
1,0,30,0,1,0,32,0,筐体上部からだって
1,0,32,0,1,0,34,0,白向く姿の
1,0,34,0,1,0,36,0,コナミヤが生えてくるんでしょ面白すぎるじゃん
1,0,36,0,1,0,38,0,はははははは
1,0,40,0,1,0,42,0,確かに777読んでリーチ
1,0,42,0,1,0,44,0,確かにな
1,0,44,0,1,0,46,0,7Cインク筐体が出ちゃうね
1,0,46,0,1,0,48,0,ぜひとも
1,0,48,0,1,0,50,0,よろしくお願いします
1,0,50,0,1,0,52,0,ギャンブルやんない方がいい
1,0,52,0,1,0,54,0,大丈夫あの私
1,0,54,0,1,0,56,0,おじがねおじがギャンブラーなんで
1,0,56,0,1,0,58,0,反面教師で本当に1000円ぐらいしか
1,0,58,0,1,1,0,0,あげないから
1,1,0,0,1,1,2,0,とか言って
1,1,2,0,1,1,4,0,さっき遊戯王の
1,1,4,0,1,1,6,0,パック向き配信で
1,1,6,0,1,1,8,0,あんなに取り乱していた人間が言うのも
1,1,8,0,1,1,10,0,どうなのかなって
1,1,10,0,1,1,12,0,今一瞬で思っちゃったんですけど
1,1,12,0,1,1,14,0,それはそれこれはこれでね
1,1,14,0,1,1,16,0,うん
1,1,16,0,1,1,18,0,では次
1,1,18,0,1,1,20,0,えー
1,1,20,0,1,1,22,0,ものづくりする猫江田豆さんからの
1,1,22,0,1,1,24,0,勝手にメールテーマお便りありがとうございます
1,1,24,0,1,1,26,0,今週も始まりました
1,1,26,0,1,1,28,0,インターネット集合地による無駄知識の
1,1,28,0,1,1,30,0,吐き溜め集合地の三角コーナーの
1,1,30,0,1,1,32,0,コーナーです集合地の三角
1,1,32,0,1,1,34,0,コーナーのコーナー今週15日に
1,1,34,0,1,1,36,0,みずほフィナンシャルグラム
1,1,36,0,1,1,38,0,フィナンシャルグループはATMの
1,1,38,0,1,1,40,0,システム障害について金融庁で銀行法に
1,1,40,0,1,1,42,0,基づく報告を命じられていましたね
1,1,42,0,1,1,44,0,ATMでいつでもお金を引き出せる
1,1,44,0,1,1,46,0,現状になれた私たちにとっては困った
1,1,46,0,1,1,48,0,問題ですね
1,1,48,0,1,1,50,0,ちょっとお水飲みますね
1,1,50,0,1,1,52,0,ほとんど発音できてなかったでしょう
1,1,52,0,1,1,54,0,ATMでいつでも金を引き出せる現状になれた
1,1,54,0,1,1,56,0,私たちにとってはとても困った問題
1,1,56,0,1,1,58,0,ですねATMでいつでも
1,1,58,0,1,2,0,0,金を引き出せる現状になれった私たちにとってはとても
1,2,0,0,1,2,2,0,困った問題ですね
1,2,2,0,1,2,4,0,ギリ言えたかなギリ言えた判定
1,2,4,0,1,2,6,0,うん
1,2,6,0,1,2,8,0,ん
1,2,8,0,1,2,10,0,ところで
1,2,10,0,1,2,13,0,ATMの暗証番号が4桁の数列なのはなぜなのかご存知でしょうか?
1,2,13,0,1,2,16,0,これには知られざる愛の物語がありました
1,2,16,0,1,2,18,0,うん
1,2,18,0,1,2,20,0,世界初のATMはイギリスで生まれました
1,2,20,0,1,2,23,0,開発責任者はジョン・シェパード・ダンシャク
1,2,23,0,1,2,27,0,このATMは当初6桁の暗証番号を使用するものとして開発されてきました
1,2,27,0,1,2,31,0,しかしシェパード・ダンシャクの奥さんはどうしても6桁の数列を覚えられなかったのです
1,2,31,0,1,2,36,0,そこで彼は勝手に暗証番号の桁数を4桁に変更してしまい
1,2,36,0,1,2,39,0,それが現在まで脈々と続いているのでした
1,2,39,0,1,2,42,0,おかげで私たちも暗証番号を覚えるのが楽ちんというわけです
1,2,42,0,1,2,44,0,いややはり愛とは偉大ですね
1,2,44,0,1,2,48,0,ちなみにこのATMはお金の受け渡し口のセンサーが未熟で
1,2,48,0,1,2,52,0,お札が残っているかいないかの利託でしか検知できなかったのです
1,2,52,0,1,2,56,0,そのためうっかり、そううっかり1枚お金を取り忘れると取引がキャンセルされて
1,2,56,0,1,3,1,0,保身のために貴重もされず通帳が出てくるうちでの小土地
1,3,1,0,1,3,3,0,マジ?
1,3,5,0,1,3,11,0,金の通りATM界のパンジョナルムというべき英国面満載のものでした
1,3,11,0,1,3,15,0,シェパード・ダンシャクはこのバグを知っていて黙っていたとかデバッグ大事ですね
1,3,15,0,1,3,17,0,ではまた来週
1,3,17,0,1,3,21,0,ということでこれめちゃめちゃすごい裏技なんですよ
1,3,21,0,1,3,27,0,来週ということでこれめちゃめちゃすごい裏技あるじゃんATMの
1,3,27,0,1,3,38,0,なんかね結構ね水子さんのニュースが数年前から
