start_h,start_m,start_s,start_ms,end_h,end_m,end_s,end_ms,text
0,1,0,0,0,1,14,0,【新しいスクーンを揃えたら?】
0,1,14,0,0,1,24,0,【すきなフィルムを奈良に変更】
0,1,24,0,0,1,26,0,これはある種の霊障かもしれないんですけど
0,1,28,0,0,1,31,0,なんかさっきから胃がねじ切れそうに痛いです
0,1,31,0,0,1,51,0,よろしくお願いします
0,1,51,0,0,1,53,0,皆さんこんばんは
0,1,53,0,0,2,1,0,ゆかんけんさんに回るのオラルカコです
0,2,1,0,0,2,3,0,ラジオっていつも自己紹介してたっけ?
0,2,3,0,0,2,5,0,せないような気もしますね
0,2,7,0,0,2,9,0,生の何か食べましたか?
0,2,9,0,0,2,11,0,いや食べてない
0,2,11,0,0,2,13,0,今日はね海苔を食べたんですけど
0,2,13,0,0,2,17,0,海苔は生きてないので
0,2,17,0,0,2,19,0,多分大丈夫だと思いますね
0,2,19,0,0,2,24,0,コーヒー飲みすぎて胃が荒れてる可能性はある
0,2,24,0,0,2,26,0,それが一番可能性あるな
0,2,31,0,0,2,35,0,でもそんなご心配いただくほどのものでもないので
0,2,35,0,0,2,38,0,全然ほっといていただけたらなと思うんですけど
0,2,38,0,0,2,41,0,たまに胃がねじ切れてるなという間がね
0,2,41,0,0,2,43,0,今日存在するかもしれません
0,2,43,0,0,2,45,0,はい
0,2,45,0,0,2,47,0,え?
0,2,47,0,0,2,49,0,海苔は大腸菌の危険性がある?
0,2,49,0,0,2,52,0,海苔を分解する酵素がない?
0,2,52,0,0,2,53,0,え?
0,2,53,0,0,2,55,0,みんな海苔を分解する酵素持ってるの?
0,2,57,0,0,2,59,0,海苔ってどうやって分解されるの?
0,3,1,0,0,3,3,0,なんか人間ってあの
0,3,3,0,0,3,9,0,セルロースをさ分解する酵素が分解できないじゃん
0,3,9,0,0,3,12,0,腸内細菌が分解できるやつが
0,3,12,0,0,3,14,0,いないから
0,3,16,0,0,3,18,0,海苔
0,3,18,0,0,3,20,0,酵素
0,3,21,0,0,3,25,0,え?日本人だけが海苔を消化できるって本当?っていうなんか
0,3,26,0,0,3,31,0,外国の方は海苔とかわかめを食べたら腹壊すらしい
0,3,31,0,0,3,33,0,え?
0,3,33,0,0,3,35,0,そうなの?
0,3,35,0,0,3,37,0,え?
0,3,37,0,0,3,39,0,すごい知らなかった
0,3,39,0,0,3,41,0,面白いね
0,3,41,0,0,3,44,0,海苔の消化酵素を持っているのは日本人だけです
0,3,44,0,0,3,46,0,って書いてある確かに
0,3,46,0,0,3,48,0,へー
0,3,48,0,0,3,50,0,少し難しい話ですが
0,3,50,0,0,3,53,0,ゾベリアガラクタニボランという
0,3,53,0,0,3,56,0,ゾベリアガラクタニボランという陽性バクテリアが
0,3,56,0,0,4,1,0,アモノル族の海藻に含まれる糖類を分解する酵素を持っていることが発見されました
0,4,1,0,0,4,6,0,人の腸内のバクテロイデスプレビウスという微生物が
0,4,6,0,0,4,8,0,同じ酵素を作る遺伝子を持っていて
0,4,8,0,0,4,12,0,このバクテリアはこれまで日本人の排泄物からしか見つかっていないそうです
0,4,12,0,0,4,14,0,へー
0,4,15,0,0,4,17,0,すごくない?
0,4,18,0,0,4,20,0,でもなんかまぁ大体その
0,4,20,0,0,4,23,0,人間って3歳か5歳までに
0,4,23,0,0,4,27,0,腸内細菌層の構成が決まるって言われてるらしくて
0,4,27,0,0,4,30,0,なんかそれまでにこうより良い
0,4,30,0,0,4,35,0,腸内細菌層を育成しておくのが基地みたいな話を聞いたことがあるけど
0,4,35,0,0,4,36,0,本当ですか?
0,4,36,0,0,4,40,0,あ、なんかね、乳頭の不耐性みたいな話聞きますよね
0,4,40,0,0,4,42,0,日本人は
0,4,42,0,0,4,45,0,乳頭の不耐性が何なのかよく分かってないけど
0,4,47,0,0,4,50,0,日本人は8世紀にはすでに海苔を食べていて
0,4,50,0,0,4,52,0,生で昔食べてたので
0,4,52,0,0,4,57,0,海藻に積んでいたバクテリアから分解酵素を作る能力を取り込んで独自の進化をしたようです
0,4,57,0,0,4,58,0,だって
0,4,58,0,0,5,0,0,面白いね
0,5,0,0,0,5,2,0,なんかやっぱりその
0,5,2,0,0,5,4,0,育ってきたさ
0,5,4,0,0,5,6,0,環境とかで
0,5,6,0,0,5,11,0,なんか人間っていくらでもなんか進化できるんだなって思うと
0,5,11,0,0,5,13,0,すごい面白い
0,5,13,0,0,5,16,0,なんか私ももっと5歳までに
0,5,16,0,0,5,19,0,世界の数多の腸内細菌をさ
0,5,19,0,0,5,21,0,ぶち込んでおきたかったな
0,5,21,0,0,5,22,0,と思う
0,5,22,0,0,5,24,0,それが口惜しいですね
0,5,24,0,0,5,25,0,うん
0,5,25,0,0,5,27,0,セロリが好きだったりする?
0,5,27,0,0,5,29,0,セロリ?え、なんでセロリ?
0,5,29,0,0,5,30,0,え、何がセロリ?
0,5,30,0,0,5,32,0,え、セロリもなんか特殊な腸内細菌…
0,5,32,0,0,5,34,0,あ、え?
0,5,34,0,0,5,36,0,あれか
0,5,36,0,0,5,37,0,歌か
0,5,37,0,0,5,39,0,はははははは
0,5,39,0,0,5,41,0,はははははは
0,5,41,0,0,5,45,0,何それ歌詞?歌詞か
0,5,45,0,0,5,46,0,なるほどね
0,5,46,0,0,5,49,0,セロリ、歌詞
0,5,49,0,0,5,53,0,あ、育ってきた環境が違うから好き嫌いは否めない
0,5,53,0,0,5,55,0,完全にセロリでしたね私ね今
0,5,55,0,0,5,57,0,全然気づかなかった
0,5,57,0,0,6,1,0,これもやっぱセロリっていう山月まさよしさんの歌が
0,6,1,0,0,6,3,0,私のその
0,6,3,0,0,6,5,0,真相真理というか
0,6,5,0,0,6,7,0,意識のね無意識
0,6,7,0,0,6,8,0,うん
0,6,8,0,0,6,11,0,長寿我まで深く染み渡っているからこそ
0,6,11,0,0,6,15,0,今ぽろっと出てしまったんじゃないかなと私は思いますね
0,6,15,0,0,6,17,0,うん
0,6,17,0,0,6,18,0,え?
0,6,18,0,0,6,23,0,あ、ガンジス川に生きる方々すごそうだね
0,6,23,0,0,6,25,0,すごそうだね確かに
0,6,25,0,0,6,27,0,なんかさ
0,6,27,0,0,6,31,0,インドとかに行くと大胸のその
0,6,31,0,0,6,36,0,日本人は腹を下すという話を聞いたことがあるんだけど
0,6,36,0,0,6,41,0,やっぱりそのそれも育ってきた環境が違うからってことなんだろうね
0,6,41,0,0,6,46,0,腸内細菌素の違いが否めないって山崎正義さんも歌ってますから
0,6,46,0,0,6,48,0,うん
0,6,48,0,0,6,50,0,え?カバーなの?あ、そうなんだ
0,6,50,0,0,6,56,0,今なんかグーグルでセロリ歌詞で検索したら山崎正義の歌って書いてあったから
0,6,56,0,0,6,58,0,確かに
0,6,58,0,0,7,2,0,なんか山崎正義さんの曲って
0,7,2,0,0,7,4,0,あの
0,7,4,0,0,7,5,0,あれしない?
0,7,5,0,0,7,8,0,なんか長寿我にさ深く
0,7,8,0,0,7,10,0,なんか集合的無意識に
0,7,10,0,0,7,12,0,すでに組み込まれている気がする
0,7,12,0,0,7,15,0,なんか物探している時にさ
0,7,15,0,0,7,18,0,後ろの方から山崎正義さんがさ
0,7,18,0,0,7,22,0,こんなとこにあるはずもないのにみたいなこと言ってこない?
0,7,22,0,0,7,24,0,私よくある
0,7,24,0,0,7,25,0,うん
0,7,25,0,0,7,28,0,なんかそういう時になんか
0,7,28,0,0,7,31,0,あ、真相真理にもう入ってるんだな
0,7,31,0,0,7,33,0,山崎正義がと思うね
0,7,33,0,0,7,36,0,あはははは
0,7,38,0,0,7,40,0,あれさ、なんだっけ
0,7,40,0,0,7,43,0,秒速5セン…え?秒速5センチメートル?
0,7,43,0,0,7,49,0,私が秒速5センチメートルのなんか映像がついてるやつで見たのが本家だったのか
0,7,49,0,0,7,53,0,はたまたなんかそういうあれだったのかちょっと定かではないんだけど
0,7,53,0,0,7,57,0,え?ちょっと待って定かではないから一応調べとこう
0,7,57,0,0,8,1,0,秒速5センチメートル
0,8,3,0,0,8,7,0,えー、山崎正義
0,8,9,0,0,8,11,0,あ、そうだよね
0,8,11,0,0,8,14,0,ワンモアタイムワンモアチャンスだよね
0,8,14,0,0,8,17,0,そうだそうだ、取材会に使われてたよね
0,8,17,0,0,8,22,0,いやー私あの秒速5センチメートルを初めて見た時に
0,8,22,0,0,8,26,0,あの本当になんか多分
0,8,26,0,0,8,31,0,この主人公の男の子と男の子になんか
0,8,31,0,0,8,36,0,共感できることって一生ないんだろうなーって思うな
0,8,36,0,0,8,39,0,あはははは
0,8,39,0,0,8,42,0,一生ないんだろうなーって思った
0,8,42,0,0,8,45,0,これ秒速5センチメートルって新海監督じゃないですか
0,8,45,0,0,8,49,0,なんか新海監督の描くその男性主人公に対してなんか
0,8,49,0,0,8,53,0,共感とか感情移入できたことが一度もないわ
0,8,53,0,0,8,58,0,うん、いやあの物語としてか映画としてはすごい好きなんだけど
0,8,58,0,0,9,3,0,あのなんだろうコトノハノニワとかも映像としてすごい綺麗だし
0,9,3,0,0,9,7,0,あの演出もなんかめちゃくちゃいい映画だなと思って
0,9,7,0,0,9,11,0,雰囲気も素敵だったんだけど
0,9,11,0,0,9,13,0,ないわ、うん
0,9,13,0,0,9,17,0,おそらく相互理解は一生得られないなっていう気がする
0,9,17,0,0,9,20,0,あはははは
0,9,20,0,0,9,26,0,これなんか男とか女とかそういうのも関係なくただただその人間性によるものだと思うんだけど
0,9,26,0,0,9,27,0,うん
0,9,27,0,0,9,29,0,映像日だよね
0,9,29,0,0,9,32,0,なんかあの今度スズメの閉じまり
0,9,32,0,0,9,34,0,11月でしたっけ
0,9,34,0,0,9,37,0,なんか公開されるのも楽しみですね
0,9,37,0,0,9,40,0,多分見に行くと思うけど劇場まで
0,9,40,0,0,9,42,0,楽しみにしてる
0,9,42,0,0,9,46,0,えっ新海監督の映画一回は見たことない
0,9,46,0,0,9,49,0,じゃあ是非ねあの映像綺麗なんで
0,9,49,0,0,9,51,0,是非とも
0,9,51,0,0,9,53,0,見てほしいですね
0,9,53,0,0,9,54,0,うん
0,9,54,0,0,9,57,0,映像綺麗で言うとあれもすごかったな
0,9,57,0,0,9,58,0,あのー
0,9,58,0,0,10,0,0,えっちょっとなんも出てこん
0,10,0,0,0,10,1,0,海の
0,10,1,0,0,10,3,0,あのー
0,10,3,0,0,10,6,0,海のやつで
0,10,6,0,0,10,9,0,あのヨネ、ヨネ沢炎じゃなくて
0,10,9,0,0,10,12,0,あの別のヨネの
0,10,12,0,0,10,15,0,アナザーヨネの方が歌歌ってる
0,10,15,0,0,10,17,0,あの鯨がドーンみたいなやつの
0,10,17,0,0,10,20,0,映画あるじゃないですか
0,10,20,0,0,10,22,0,あの鯨がドーンみたいな
0,10,22,0,0,10,24,0,なんだっけ
0,10,24,0,0,10,26,0,怪獣の子
0,10,26,0,0,10,27,0,そう
0,10,27,0,0,10,28,0,あのヨネ
0,10,28,0,0,10,29,0,あのあれね
0,10,29,0,0,10,31,0,ヨネズギンスさんのね
0,10,31,0,0,10,33,0,そう
0,10,33,0,0,10,34,0,ヨネザー
0,10,34,0,0,10,36,0,ヨネズギンスさんの
0,10,36,0,0,10,37,0,あのー
0,10,37,0,0,10,40,0,海の幽霊が主題歌の
0,10,40,0,0,10,43,0,あのー怪獣の子供ね
0,10,43,0,0,10,45,0,あの化け物の子と混ざった怪獣の子
0,10,45,0,0,10,48,0,がすごいあの映像綺麗でした
0,10,48,0,0,10,51,0,あのーストーリーはほぼよく分からなかったんだけど
0,10,51,0,0,10,54,0,とにかくあの映像がすごかったんで
0,10,54,0,0,10,56,0,うわーすげー映像が見てぇなと思ったらね
0,10,56,0,0,10,57,0,ぜひとも
0,10,57,0,0,10,59,0,えー怪獣の子供見てほしいです
0,10,59,0,0,11,1,0,あれ元々の原作の漫画
0,11,1,0,0,11,3,0,読もうと思って忘れてたの
0,11,3,0,0,11,6,0,思い出した今
0,11,6,0,0,11,10,0,多分ね漫画で元々読んでおけば
0,11,10,0,0,11,12,0,また感じ方違ったかなと思うんですけど
0,11,12,0,0,11,14,0,そう
0,11,14,0,0,11,16,0,ヨネズギンスなんだ
0,11,16,0,0,11,18,0,ギンスだと思ってた今までずっと
0,11,18,0,0,11,20,0,あ、いくすりであなた死にくれ
0,11,20,0,0,11,21,0,ありがとうございますすいません
0,11,21,0,0,11,22,0,あのー全然気にしないでください
0,11,22,0,0,11,25,0,私の胃のことなど
0,11,25,0,0,11,27,0,怪獣の子供を映画館で見た
0,11,27,0,0,11,28,0,いいですよね
0,11,28,0,0,11,30,0,あそうそうそうそうそうそう
0,11,30,0,0,11,31,0,あの井原氏先生
0,11,31,0,0,11,33,0,井原氏大輔先生
0,11,33,0,0,11,35,0,え?
0,11,35,0,0,11,36,0,ていうか
0,11,36,0,0,11,38,0,ヨネズ
0,11,38,0,0,11,44,0,ヨネズ剣士なんだ
0,11,44,0,0,11,46,0,ヨネズ剣士だ
0,11,46,0,0,11,47,0,え?
0,11,47,0,0,11,49,0,私あらゆるところでずっと
0,11,49,0,0,11,51,0,ヨネズ原始と言っていました
0,11,51,0,0,11,52,0,すいません
0,11,52,0,0,11,54,0,へー
0,11,54,0,0,11,55,0,だからなんか
0,11,55,0,0,11,57,0,この間もその新ウルトラマンの
0,11,57,0,0,11,59,0,主題歌歌ってらっしゃいましたよね
0,11,59,0,0,12,1,0,うん
0,12,1,0,0,12,2,0,あのなんだっけ
0,12,2,0,0,12,5,0,M78みたいなやつ
0,12,5,0,0,12,7,0,あれ?M87だっけ
0,12,7,0,0,12,9,0,M88だったっけ
0,12,9,0,0,12,11,0,その三択のうちどれかですね
0,12,11,0,0,12,13,0,うん
0,12,13,0,0,12,15,0,すごいよかったです
0,12,15,0,0,12,17,0,なんかあの
0,12,17,0,0,12,19,0,やっぱりその作品世界みたいなものを
0,12,19,0,0,12,21,0,主題歌としてこう
0,12,21,0,0,12,23,0,歌詞にする
0,12,23,0,0,12,25,0,エンドロールで流れるものに
0,12,25,0,0,12,28,0,消化するのって本当に大変だなと思う
0,12,28,0,0,12,29,0,78か
0,12,29,0,0,12,32,0,M87
0,12,32,0,0,12,36,0,M87は実在の銀河
0,12,36,0,0,12,38,0,え?
0,12,38,0,0,12,40,0,でも声音的にはM78だけど
0,12,40,0,0,12,43,0,楽曲はM87ってこと?
0,12,43,0,0,12,45,0,ダメだ
0,12,45,0,0,12,46,0,もうなんもわからん
0,12,46,0,0,12,48,0,なぜならまだ新ウルトラマンを
0,12,48,0,0,12,50,0,まだ見てないから
0,12,50,0,0,12,52,0,うん
0,12,52,0,0,12,54,0,なんか新ウルトラマンと
0,12,54,0,0,12,56,0,犬王を見ようと思ってたんですけど
0,12,56,0,0,12,58,0,この間犬王を先に見て
0,12,58,0,0,13,0,0,新ウルトラマンはまだ見てないから
0,13,0,0,0,13,2,0,うん
0,13,2,0,0,13,4,0,あ
0,13,4,0,0,13,7,0,新ウルトラマンの出身をM87声優にする予定だったから
0,13,7,0,0,13,9,0,へー
0,13,9,0,0,13,11,0,あそうなんだまだ見てないです
0,13,11,0,0,13,13,0,今度見に行こうと思ってる
0,13,13,0,0,13,15,0,うん
0,13,15,0,0,13,17,0,新ウルトラマン見てないなんて
0,13,17,0,0,13,19,0,人生の99割損してる
0,13,19,0,0,13,21,0,すごいね
0,13,21,0,0,13,24,0,9割超えて99割損してるんだ
0,13,24,0,0,13,26,0,へー
0,13,26,0,0,13,28,0,見ます
0,13,28,0,0,13,30,0,じゃああのそちらをですね
0,13,30,0,0,13,32,0,なんかそれで思い出したんだけど
0,13,32,0,0,13,34,0,あのー
0,13,34,0,0,13,36,0,今日はあの
0,13,36,0,0,13,38,0,作業中に
0,13,38,0,0,13,40,0,あのYouTubeミュージックをね
0,13,40,0,0,13,42,0,かけていたんですよ
0,13,42,0,0,13,44,0,私あのサブアカでYouTubeプレミアムに入ってるから
0,13,44,0,0,13,46,0,YouTubeミュージックを聴けるんだけど
0,13,48,0,0,13,50,0,あのー
0,13,50,0,0,13,52,0,えっと色彩
0,13,52,0,0,13,54,0,坂本真彩さんの色彩っていう曲があるの
0,13,54,0,0,13,57,0,でこれあのFate Grand Orderっていう
0,13,57,0,0,13,59,0,あのー
0,13,59,0,0,14,2,0,ソーシャルゲームの主題歌だったと思うんですけど
0,14,4,0,0,14,6,0,で曲としてもねすごい素敵な
0,14,6,0,0,14,8,0,あの印象的なメロディーの曲なんだけど
0,14,8,0,0,14,10,0,これあのー
0,14,10,0,0,14,12,0,作中のね
0,14,12,0,0,14,14,0,とある登場人物が
0,14,14,0,0,14,16,0,モチーフになっていて
0,14,16,0,0,14,19,0,でなんかそれのさ
0,14,19,0,0,14,21,0,その何歌詞が
0,14,21,0,0,14,23,0,すごい良くて
0,14,23,0,0,14,25,0,なんか
0,14,25,0,0,14,27,0,あのー
0,14,27,0,0,14,29,0,待ってね
0,14,29,0,0,14,31,0,この
0,14,31,0,0,14,33,0,私これ今日聴きながらさ
0,14,33,0,0,14,35,0,あのー流行りだったのに泣いてて
0,14,35,0,0,14,37,0,あ情緒がもういっちゃってるなと思ったんですけども
0,14,37,0,0,14,39,0,なんか初めて聞いたわけじゃなくて
0,14,39,0,0,14,41,0,すごいよく一時期よく聞いてた曲なんだけど
0,14,41,0,0,14,43,0,あのー
0,14,43,0,0,14,45,0,マシュのマシュって言っちゃった
0,14,45,0,0,14,47,0,マシュのことを考え始めたら涙が止まらなくて
0,14,47,0,0,14,49,0,やっぱ俺にはマシュしかいないという
0,14,49,0,0,14,51,0,気持ちになりましたFGO
0,14,51,0,0,14,53,0,なんか1年くらいログインしてないけど
0,14,53,0,0,14,55,0,これがねすごい
0,14,55,0,0,14,57,0,歌詞が良いっていう話をね
0,14,57,0,0,14,59,0,今からちょっと15分くらいしようと思ったけど
0,14,59,0,0,15,1,0,なんか配信始まってもう16分経ってたから
0,15,1,0,0,15,3,0,あのー
0,15,3,0,0,15,5,0,そこそこにしておきます
0,15,5,0,0,15,7,0,是非ともね皆さん
0,15,7,0,0,15,9,0,一度やっぱ色彩
0,15,9,0,0,15,11,0,聴いてください坂本もあやさんの
0,15,13,0,0,15,15,0,やめて先輩のログイン待ってるんだろうなって言わないで
0,15,17,0,0,15,19,0,マシュごめんなんか本当に最近
0,15,19,0,0,15,21,0,私全然なんか
0,15,21,0,0,15,23,0,人理修復
0,15,23,0,0,15,25,0,さしてから全然なんかログインしてなくて
0,15,25,0,0,15,27,0,本当にごめんね
0,15,27,0,0,15,29,0,本当にごめん
0,15,29,0,0,15,31,0,マシュに後ろめたいから
0,15,31,0,0,15,33,0,お便り読むわ
0,15,35,0,0,15,37,0,逆光もいいよね
0,15,37,0,0,15,39,0,えーということで
0,15,39,0,0,15,41,0,お便りをね
0,15,41,0,0,15,43,0,読んでいきたいと思います
0,15,43,0,0,15,45,0,音量何かありましたら教えてください
0,15,45,0,0,15,47,0,はい
0,15,47,0,0,15,49,0,FGOやったことないから正直エッチな方が
0,15,49,0,0,15,51,0,内容でしか知らない
0,15,51,0,0,15,53,0,わかる
0,15,53,0,0,15,55,0,非常によくわかるな
0,15,55,0,0,15,57,0,私もあの基本的に
0,15,57,0,0,15,59,0,あの昨今流行っているゲームなど
0,15,59,0,0,16,1,0,あの原神とかはもう基本的にあのピクシブの
0,16,1,0,0,16,3,0,あのー好きなイラストレーターさんが
0,16,3,0,0,16,5,0,書いてるなんかエッチな同人誌でしか知らない
0,16,7,0,0,16,9,0,昨今ってやっぱ同人誌界隈というか
0,16,9,0,0,16,11,0,あの二次創作では何が流行しているんですか
0,16,13,0,0,16,15,0,ちょっと音でかい
0,16,15,0,0,16,19,0,少し下げる
0,16,21,0,0,16,23,0,なんかこの子やたら催眠かかってるけど
0,16,23,0,0,16,25,0,多分本編では一度も書けられたことないんだろうな
0,16,25,0,0,16,27,0,っていうキャラクターとかさ
0,16,27,0,0,16,29,0,いらっしゃるよね
0,16,33,0,0,16,35,0,ブルーアーカイブが今盛り上がってきたエッチで
0,16,35,0,0,16,37,0,あー
0,16,37,0,0,16,39,0,ブルーアーカイブ確かにね
0,16,39,0,0,16,41,0,あの確かにエッチイラストよく見るわ
0,16,41,0,0,16,45,0,うん
0,16,45,0,0,16,47,0,長い乳の子が
0,16,47,0,0,16,49,0,でもさ長い乳だなと思うじゃん
0,16,49,0,0,16,51,0,でもそれがその長い乳がお好きな方が
0,16,51,0,0,16,53,0,アレンジされて長い乳なのか
0,16,53,0,0,16,55,0,元々長い乳なのか
0,16,55,0,0,16,57,0,分かんないよね
0,16,57,0,0,16,59,0,うん
0,16,59,0,0,17,1,0,てか最近さ
0,17,1,0,0,17,3,0,あの催眠もの多くないですか
0,17,3,0,0,17,5,0,私なんか
0,17,5,0,0,17,7,0,あのそんなにね
0,17,7,0,0,17,9,0,二次創作の変遷を追ってるわけじゃないんだけど
0,17,9,0,0,17,11,0,最近やたらなんかランキングに入ってるやつ
0,17,11,0,0,17,13,0,催眠多くない
0,17,13,0,0,17,15,0,流行ってる?もしかして
0,17,17,0,0,17,19,0,日本人が寝不足だから
0,17,19,0,0,17,21,0,あともしかさ
0,17,21,0,0,17,23,0,なんか本当に最悪な話してる時に
0,17,23,0,0,17,25,0,聞いてくれるじゃん
0,17,25,0,0,17,27,0,いやマジでランキングで多いんですよ
0,17,27,0,0,17,29,0,本当に
0,17,29,0,0,17,31,0,みんなピクシブのランキング見て
0,17,31,0,0,17,33,0,本当に催眠多いから
0,17,33,0,0,17,35,0,うん
0,17,35,0,0,17,37,0,これはでもさなんかさ
0,17,37,0,0,17,39,0,あの一番多かった
0,17,39,0,0,17,41,0,そのエッチなことに至るまでの
0,17,41,0,0,17,43,0,過程を
0,17,43,0,0,17,45,0,やっぱ統計取ってる人が
0,17,45,0,0,17,47,0,おそらくいると思うんだよね
0,17,47,0,0,17,49,0,世の中
0,17,49,0,0,17,51,0,例えばなんかその
0,17,51,0,0,17,53,0,あのいわゆる
0,17,53,0,0,17,55,0,その無理やり感が強かった時期が
0,17,55,0,0,17,57,0,無理やり感が強い
0,17,57,0,0,17,59,0,その導入が多かった時期
0,17,59,0,0,18,1,0,と
0,18,1,0,0,18,3,0,今も催眠もそうなんだけどね
0,18,3,0,0,18,5,0,催眠もそりゃそうなんだけどさ
0,18,5,0,0,18,7,0,そうなんだけどさ
0,18,7,0,0,18,9,0,あとなんか謎のアプリとかもよく見る最近
0,18,9,0,0,18,11,0,催眠から発生して
0,18,11,0,0,18,13,0,なんで
0,18,13,0,0,18,15,0,なんかやっぱ
0,18,15,0,0,18,17,0,そういうのの潮流もあるんだろうな
0,18,17,0,0,18,19,0,と思うしそういうのをなんか分析
0,18,19,0,0,18,21,0,してる
0,18,21,0,0,18,23,0,同人誌とかきっとコミケで売られると思うんでね
0,18,23,0,0,18,25,0,いいな
0,18,25,0,0,18,27,0,と思います私も買いたいわ
0,18,31,0,0,18,33,0,はいということでね
0,18,33,0,0,18,35,0,二つおたを読ませていただきたいと思います
0,18,35,0,0,18,37,0,一つ目
0,18,39,0,0,18,41,0,無駄ページを省ける
0,18,41,0,0,18,43,0,いやでもさ
0,18,43,0,0,18,45,0,導入が大事なんじゃんやっぱり
0,18,45,0,0,18,47,0,なんかそのさ
0,18,47,0,0,18,49,0,なんか
0,18,49,0,0,18,51,0,なんだろう2コマ目からさ始まっちゃうとさ
0,18,51,0,0,18,53,0,なんか何見ても
0,18,53,0,0,18,55,0,同じって感じにならないですか
0,18,55,0,0,18,57,0,確かになんかすごい絵が上手いなとか
0,18,57,0,0,18,59,0,なんか
0,18,59,0,0,19,1,0,このなんか視点エッチだなっていうのはあるんだけど
0,19,1,0,0,19,3,0,なんかそこ
0,19,3,0,0,19,5,0,どういう風にそこまで行き着くかみたいなところがさ
0,19,5,0,0,19,7,0,私は結構見たいタイプなんだよね
0,19,9,0,0,19,11,0,それはさまざまな需要と供給の
0,19,11,0,0,19,13,0,関係があるんだろうけどね
0,19,15,0,0,19,17,0,いやいや
0,19,17,0,0,19,19,0,ネトラルもまだ多い
0,19,19,0,0,19,21,0,導入いいやつだとエロいらない
0,19,21,0,0,19,23,0,わかるな
0,19,23,0,0,19,25,0,だからなんかその
0,19,25,0,0,19,27,0,そこまでの過程が一番
0,19,27,0,0,19,29,0,エロいわけじゃん
0,19,29,0,0,19,31,0,始まっちゃったのも全部一緒じゃん
0,19,31,0,0,19,33,0,そういうこと言うと
0,19,33,0,0,19,35,0,本当に良くないんでこれ以上言わないでおこうと思います
0,19,35,0,0,19,37,0,今日はですね
0,19,37,0,0,19,39,0,最初からなんかどうなんだという話題を
0,19,39,0,0,19,41,0,展開してしまったんですけれども
0,19,41,0,0,19,43,0,テーマがYouTube階段なので
0,19,43,0,0,19,45,0,最後の方結構怖い感じのエピソードが
0,19,45,0,0,19,47,0,あります
0,19,47,0,0,19,49,0,はい
0,19,49,0,0,19,51,0,これが階段だよねもはや
0,19,51,0,0,19,53,0,ラジオの本編に入るまで20分
0,19,53,0,0,19,55,0,喋ってしまっているという
0,19,55,0,0,19,57,0,そういう一つの怖い話なんだけど
0,19,57,0,0,19,59,0,なんですけど
0,19,59,0,0,20,1,0,結構ね
0,20,1,0,0,20,3,0,幽霊系とか日常にね
0,20,3,0,0,20,5,0,忍び寄ってくる系の
0,20,5,0,0,20,7,0,怖いお話もたくさんいただいてますし
0,20,7,0,0,20,9,0,普通だでも一つ読ませていただくので
0,20,9,0,0,20,11,0,苦手だよっていう方は
0,20,11,0,0,20,13,0,お気をつけいただけると
0,20,13,0,0,20,15,0,自衛いただけると
0,20,15,0,0,20,17,0,幸いです
0,20,17,0,0,20,19,0,よろしくお願いします
0,20,19,0,0,20,21,0,ということで
0,20,21,0,0,20,23,0,こちらですね
0,20,23,0,0,20,25,0,一通目読ませていただきたいと思います
0,20,25,0,0,20,27,0,マグさんからの
0,20,27,0,0,20,29,0,ふつおたお便りありがとうございます
0,20,29,0,0,20,31,0,ルカゴさんこんばんは
0,20,31,0,0,20,33,0,エアーカイブにはなりますがいつも楽しく
0,20,33,0,0,20,35,0,配信を見させていただいております
0,20,35,0,0,20,37,0,ありがとうございます
0,20,37,0,0,20,39,0,以前の配信で昼休みまたピンクサロンに
0,20,39,0,0,20,41,0,走り出していたという本のお話を
0,20,41,0,0,20,43,0,していたのを覚えておいてでしょうか
0,20,43,0,0,20,45,0,デリヘル城のお店からの紹介文を
0,20,45,0,0,20,47,0,計量分析することで
0,20,47,0,0,20,49,0,良城っていうの?
0,20,49,0,0,20,51,0,良城とハズレ城を判別してみよう
0,20,51,0,0,20,53,0,というものでそういう店で遊ぶときに
0,20,53,0,0,20,55,0,わりと迷ってしまう私にとって
0,20,55,0,0,20,57,0,すごく興味を引かれる内容でした
0,20,59,0,0,21,1,0,配信が終わるなり僕はすぐさま
0,21,1,0,0,21,3,0,著者の本やホームページを読み漁りました
0,21,3,0,0,21,5,0,本はともかくとしてホームページにある
0,21,5,0,0,21,7,0,お店からの紹介文を
0,21,7,0,0,21,9,0,計量分析してガチで読むは
