start_s,end_s,text
90,94,デザイン屋がトレンド入ってません?
96,98,復活とかかな?
98,100,今日もよろしくお願いします
100,102,お待たせしました
103,105,裏ラジオールナイト
119,121,あ、2日だけの復活なんだ
121,123,新体制で復活?
123,125,めちゃめちゃ楽しみですね
125,127,なんか
128,132,前デザインアテンっていう展示に行ったんですけど
133,135,それめちゃくちゃ面白かったんで
135,137,またやってくれるといいな
139,141,デザイン屋じゃないですね
141,143,それはもうね、七進区に読されてる
145,147,シャルロット島村に読されてますよ
147,149,皆さん
149,152,屋が何かわからない方は敬意をね
152,156,シャルさんが切り抜きをご自分のチャンネルに上げてるんで
156,159,ぜひともそちらご覧いただけたらなと思います
160,162,今日はね
162,165,本当に今回のテーマが
166,169,リスナーさんの職業体験ということでね
169,170,非常に
170,172,いつもは大体全部面白いんですけど
172,174,お便り
175,179,今回特にご紹介したいお便りが多くて
179,182,普段全部下読みした後に
182,185,これご紹介しようかなみたいな感じで
185,187,いくつかピックアップしたりとかして
187,191,さらにこれどう考えたら朝になるんだと思って削るんだけど
191,195,大体普段の数の倍あります
195,197,チェック入ってるお便りが
197,198,なんで
198,200,ちょっとまかないとね
202,205,まかないとマジで朝になってしまうんで
205,209,今日のスケジュールを発表します
209,210,まずね
210,214,普通お便り15分
214,217,勝手にメールテーマ10分
217,219,残り1時間半
219,224,残り時間をリスナーさん職業体験に充てるっていう感じのスケジュールです
225,227,今日はちょっと
227,228,巻き目でね
228,230,私の無駄な話はせず
230,233,たくさんお便りをご紹介する回にしたいなと思います
233,235,ご要望何かあったら教えてください
237,238,今回のお便りでね
238,241,普通お便りで
241,246,この送られてるお便りって全部読んでるんですかってご質問いただいてるんですけど
246,247,全部読んでます
247,248,毎回
251,253,毎回もちろん全部読んでます
253,254,ご安心ください
254,258,全部ちょっとご紹介できなくて心苦しいんですけど
258,263,本当に全部読んだら何時間ぐらいかかるんだろうな
263,264,多分12
264,265,8時間
265,267,6時間
267,269,無駄な話しなかったらもっと短いんだけど
269,271,今無駄な話してますね
271,274,早速今日普通お便り読んでいきたいと思います
278,280,ということで
281,283,ちょっとBGM大きい
283,286,少し下げます
292,294,では一つ目ですね
296,299,エコーさんからの普通お便りありがとうございます
301,302,ルカコさんこんばんは
302,309,先日のシロガコラボで面白そうなイベントや施設があったら教えてほしいとおっしゃっていましたね
309,316,そこで自分がよく行くアニソンクラブの記載ゴールドフィンガー9999
316,318,ちょっと待ってもう一回読む
319,327,そこで自分がよく行くアニソンクラブの記載ゴールドフィンガー9999をご紹介させていただきたいと思います
327,332,ゴールドフィンガー9999はその名の通りGO!ヒロミさんの名曲
332,339,ゴールドフィンガー9999を99回流すイベントになっております
339,343,同じ曲を99回も流して果たして盛り上がるのかと思われるかもしれませんが
343,347,1コーラス目で早々と次のゴールドフィンガー9999に繋いだり
347,350,フルコーラス流したりと歓喜をつけたDJプレイに
350,353,VJのどこから集めてきたんだと言わんばかりのGO!ヒロミ素材
353,358,そしてGO!ヒロミさんになりきって歌って踊るレジデントGO!が
358,362,イベントを盛り上げてくれます
362,365,気分が盛り上がってくれば備え付けのスタンドマイクとジャケットで
365,368,お客さんも自由にGO!ヒロミさんになりきって楽しむことができます
368,371,またイベント途中では余興としてじゃんけん大会が催され
371,375,優勝者にはGO!ヒロミさんのベストアルバムがプレゼントされます
375,381,なおこのベストアルバムにはゴールドフィンガー9999は収録されていません
381,384,酒の力もあるのかもしれませんがイベントが進むにつれ
384,388,ちょっとしたトランス状態になっていき99回終わった頃には
388,392,まるでフルマラソンを完走したかのような謎の達成感に包まれることができ
392,397,サビの振り付けもすっかりマスターすることができるでしょう
397,400,不定期で行われている当イベント先週15回目が行われ
400,405,次回の開催はゴールドフィンガー9999にちなみ9月9日となっております
405,409,クギタスの誕生日だりスプラトゥーンの誕生日だり
409,413,誕生日じゃないや発売日ですね
413,416,興味を持たれた方は福岡県と遠方ではございますが
416,420,ぜひクラブセレクターに足を運んでいただきたいと思います
420,422,もちろんこのような奇抜なイベントだけでなく
422,424,真っ当なアニソンクラブイベントもありますので
424,428,好みのイベントを探してみるのもいいかもしれません
428,433,これいいねめちゃめちゃ面白いイベントですね
433,437,しかも15回もやってるっていうのが驚きだし
437,441,なんかある種のトランス状態になるっていうのはなんとなくわかりますね
441,444,最近そのパリピコーメイとかで
444,450,なんかなじみ深くなっているのかなっていないのかわからないんですけど
450,455,まだ正気でいたい
455,459,でもやっぱそのなんだろう暗い中ですごい
459,462,大音量でね
462,466,なんか明滅する光に当てられてるやっぱ人間っていうのはある程度
466,471,ねちょっとクレイジーな一夜を過ごすっていう
471,476,まあ得難い体験をするねいい機会なのかなとは思いますけど
476,481,私もあの最後に全部嘘って言われるんじゃないかと思った
481,484,確かに一応調べとくか
484,486,私は基本的にあの全部ね
486,489,リスナーさんに教えてもらったことはほとんど全部信じる傾向があるので
489,492,一応調べておきましょうか
492,495,よっ
495,498,やべちょっと待って
498,508,ちょっとあの本物の広見号のゴールドフィンガー99が再生されちゃいそうだから閉じとこう
508,515,一回配信閉じなくなっちゃう閉じないといけなくなっちゃうから
515,523,ということでねあの私配信で何回かお話したことあるかもしれないんですけど
523,531,あのクラブにね人生経験と思って一回行ったら女子トイレで決めてるそのギャルがね
531,534,ギャルがそのなんだろう
534,539,輪になって
539,543,輪になってしゃがんで決めてたっていう経験があって
543,548,これがクラブってやつかという印象があまりにも強くてね
548,554,なんかそれから結構怖いイメージを持ちがちなんですけど
554,559,そうなんでその時はね何を決めたのか定かではないけど
559,564,スタッフさんにね引きずられながらお店の外に出されてましたけど
564,568,どうなったのかなちょっとわかんないですけどその印象が強いですけど
568,573,ゴールドフィンガー99はゴリゴリ合法ですからね
573,579,最終的にそのいる人たちがどういう状態になっているのか非常に興味深いですし
579,586,ここまで合法でトランスできるっていうのもねなかなかレアなんじゃないかなと思う
586,592,ハーブですね多分まあまあまあ合法だったのか
592,597,ノット合法だったのかちょっと分かりかねますけどそういう印象が強いですね
597,600,煙たかったら女子トイレが
600,607,はいということで素敵なねあの面白いイベントをお知らせありがとうございました
607,613,次のお便り読ませていただきたいと思います
613,617,和風さんからの普通お便りありがとうございます
617,624,るかこさんこんばんはこんばんはアーカイブですがいつも通勤のともにラジオ楽しませてもらってます
624,629,ありがとうございます今回るかこさんに聞きたいことがありお便りを送りました
629,633,自分はasmrに興味あるけどいまだに聞いたことがないです
633,639,asmrにはまった人たちは麻薬中毒者のようになっているのをネットで見かけていたので知り込みしてしまっています
639,649,なので決心をつけるためにるかこさんの初めてasmrを聞いたときの感想とおすすめのasmr過去無料でも有料でも教えていただければと思います
649,655,ということでねこれもねそうそう一種のねあのトランスつながり
655,663,今日普通お便りの全部決めるか決めないかねそれが問題だみたいな
663,669,that is problem的なそういう話しかないです今回の普通お便りはね
669,679,でこれに関してはね私は正直あのasmrに関してはもうスウォーとパトラー一本でねここまでやらせていただいてるんで
679,684,やらせていただいてるっていうか聞いてるのはパトラーさんだけなんで
684,688,あのおすすめするってなってもパトラーさんだけなんですけどちょうどね
688,699,あのベストアンサーにね選びたい別の普通歌をいただいてましたのでこちら読ませていただきたいと思います
699,704,asmrマニアさんからの普通歌ですねお便りありがとうございます
704,709,asmrを聞きに聞いて回りました最近は
709,719,このミヤさんのasmrが一番いいんじゃないかって思ってしまっています理由はちょっと色っぽくドキドキして心地がいいasmr
719,723,耳かきが心地いいasmrと
723,730,いろんなねasmrが電脳世界には存在するのですがミヤ様のasmrは違います
730,737,リアルに恥ずかしがりながらセリフを言ってその後笑ってしまうところがとても愛おしくそしてこっちも笑ってしまうのです
737,741,ゲップをしたりお腹の音が聞こえたりそこも面白いしリアルだと思うのです
741,750,他のasmrを夜中に聞くと心地が良くて寝てしまいますしかしミヤ様のasmrはハラハラドキドキで時には大笑いして寝ることはできません
750,756,でもasmr動画を一番楽しく見ることができます最後までどうなるんだろうかと聞いてしまうのです
756,761,これこそasmrの最終形態だと感じました
761,770,おっとミヤ様のasmrの話をしていたら本題から外れてしまいました失敬失敬質問なのですがオウラルカコさんはasmrやられないのでしょうか
770,776,ミヤ様と同期のオウラルカコさんのasmrもすごい楽しみでありますよろしくお願いしますということでね
776,787,私個人としてもやっぱ一応同期のasmrをさすがに本人が恥ずかしいかなと思って聞かないようにしているんで
787,791,ベストアンサーに選ばせていただきました
791,795,たまにねasmrやらないんですかってご質問をいただくんですけれども
795,799,別にあのちょっと
799,800,そうですね
800,805,人様に安眠を届けられるほどの寄与がないものですから
805,810,そういった方向性のasmrはやらないかもしれないですね
810,813,やるとしてもまあどうだろうな
813,822,あの虫とかは食べる予定ないんですけどそれに累することになっちゃうのかなって個人的には思います
822,824,首締めasmr聞いてみたい
824,829,首締めasmrはそのyoutubeくん的にとナナシインク的にokなんですかね
829,837,それだったら別にやってもいいんですけど
837,845,コーヒーミル弾きasmrコーヒーミルはなんか朝枠バイノーラルマイクにするとかかなやるとしたら
845,851,朝枠本当になんか内容がマジでないんだよね
851,854,この間もなんか
854,858,5分前に起きて朝枠始めたんですけど今週の
858,865,水曜日の朝7時からコーヒー入れるだけ朝枠っていうのをやってるんだけど
865,871,5分前に起きちゃって今週でなんか最終的に猛狼として始まってるから
871,877,なんかボボボのアンケート取って終わったことしか覚えてないっていう
877,879,という感じですね
879,884,あれを別にバイノーラルにしてもいいんですけど朝枠だしなっていう
884,893,朝枠ってそんなねデスクに座ってイヤフォンで聞くものでもないかなっていうのもあるんで
893,899,それはそれでなんかスピーカーで聞いてる人がなんか違和感あったりするのかなどうなんだろう
899,904,その辺はちょっとスピーカー勢のご意見も賜りたいところですけどね
904,909,まさかボーボボが勝つとはね
909,912,ボーボボに負けた
912,914,っていうのもあるので
914,924,まあ皆さんねこれ我々のその我々というか配信っていうのは皆さんと一緒に作っていくものですから
924,928,オーラルカッコのチャンネルとしてのそのベストアンサー回答としては
928,940,ASMRは私の同期であるねゆかきさんアニマルのコナンみやのASMRをプッシュしていきたいという
940,944,私はやっぱちょっとみやーちが嫌がるんで聞かないようにしてるんですけど
944,948,チャンネルとしてのオススメはコナンみやのASMRですね
948,954,でまあ私個人としてはそのパトラさんのASMRを聞きながら寝てます
954,960,はいっていう感じです
960,970,リンリュウガサキもねやっぱりんリュウガサキもメンバーというか7thincに聞かれるのが恥ずかしいっていう風にご本人が言ってたので
970,972,私は聞かないようにしてるんですけど
972,976,すごいねあの根強いファンもいらっしゃるので
976,979,ぜひともね聞いてみてはいかがでしょうか
979,983,私はもう基本的にはもう寝るために聞いてます
983,987,なんか面白コンテンツとしてあんまり聞いたことないですね
987,996,ちょっとなんかパトラさんのASMR聞きながら泣いてるっていうと疲れたおじさんかなって言われます
996,1001,あメアリさんのもねいいって聞きますね
1001,1003,今日も動画あげられてたかな
1003,1011,なんかやっぱそのシチュエーションとかロールプレイ的なものを楽しみたいのであれば
1011,1015,メアリさんよりオススメかもしれないですね
1015,1019,ぜひともなんとこれね無料で聞けてしまうんで
1019,1022,youtubeでねぜひともお試しください
1022,1030,で私はパトラさんのその有料のねコンテンツもダウンロードして聞かせてもらってるんですけど
1030,1033,とんでもないボリュームでとんでもない値段でね
1033,1038,めちゃめちゃあのこんな値段で売っていいのかっていうぐらい
1038,1046,すごいあの大量のASMRの音声が手に入るっていうのが有料でも購入できるので
1046,1050,そちらもぜひともご検討いただけたらと思います
1050,1051,はい
1051,1055,ということでですね本日なんと次のコーナーに行きますもう
1055,1061,www
1061,1067,最速かもしれない普通の歌18分で終わってるの
1067,1070,すごいね
1070,1074,www
1074,1080,3分押しまあまあまあまあ誤差の範囲内だわ誤差の範囲内
1080,1084,えーではですねこちらの勝手にメールテーマというコーナーなんですけれども
1084,1087,えーこちらですね私がこう普段
1087,1092,まあ普段の配信ではかなり話がそれ勝ちというか
1092,1096,全然関係ない話を始めちゃったりするんですけれども
1096,1101,えーどんな脱線の仕方をするのかなっていうのを事前に予想していただいて
1101,1108,あのーまあそれを予想した結果のそのメールテーマに沿ったお便りを
1108,1110,事前に送ってもらってるっていうコーナーになります
1110,1112,はい
1112,1114,www
1114,1118,早すぎて私だっていうことが疑われてるねそもそも
1118,1120,www
1120,1124,はいえーではね1つ目
1124,1128,えーしがさんからの勝手にメールテーマお便りありがとうございます
1128,1131,えー身近に横浜出身を名乗る人物がいたら
1131,1137,えー死歌死の歌ですね死歌歌ってと尋ねてみましょう
1137,1140,歌えなければそいつは相模原のスパイです
1140,1145,横浜市のあらゆる私立学校ではなぜか横浜死歌を死ぬほど歌わされます
1145,1149,なんと作詞はあの森陽外浜っ子ならば大体歌えるはずです
1149,1153,しかしよく訓練された相模原のスパイは歌を覚えてくるかもしれません
1153,1157,その時は死歌踊ってと言ってみましょう
1157,1163,えーある程度の年齢以下の横浜市民であれば部分部分の振り付けを覚えているはずです
1163,1164,www
1164,1171,死の小学6年生は年に一度小机小机かなの日産スタジアムに集められて
1171,1176,レッツダンスウィズ横浜という死歌を元にしたよくわからないダンスを踊らされます
1176,1179,皆さんもこうして相模原のスパイを炙り出していきましょう
1179,1184,ということで今週のメールテーマスパイを炙り出す100の方法をお送りしました
1184,1187,ろかかさんは一応スパイなのでそれっぽいテーマですね
1187,1188,それでは
1188,1189,ということでね
1189,1191,え市民だけど踊ったことない
1191,1195,www
1195,1203,えちょっと待ってあの横浜市民でもなんかあれ是非がちょっと分かれているんですけども
1203,1211,うん確かになんか横浜の横浜市民を名乗りたがるみたいな話はよく聞きますね
1211,1215,これ本当フェイクニュース本当か
1215,1217,www
1217,1220,やば早速スパイが炙り出されている
1220,1221,もしかして
1221,1224,そうなった相模原のスパイか
1224,1227,www
1227,1234,えその横浜のその浜っこの中でも過激派と温厚派で分かれているってこと
1234,1240,浜っこの中でもその複数のなんか派閥争いがあるってことなのかな
1240,1245,え横浜市民はみんなレッツダンスウィズ横浜を踊れるはず
1245,1248,えこれが本物の横浜市民か
1248,1252,までもねなんかね浜っこのVTuberがその話よくしてる
1252,1256,あ結構なんか角度が高そうですねこの情報ね
1256,1260,www
1260,1263,昔そんなに横浜って偉いのかって聞いたら怒られた
1263,1266,www
1266,1269,えなんかね
1269,1276,あのうちもなんか出身のところが割とその派閥争いが割と盛んなね
1276,1281,あの土地であの地域によって仲悪かったりするんですよね
1281,1283,まあ匹子も子もあって
1283,1290,でなんか結構そういうのって割と面白がって話題にするんだけど
1290,1293,それがさ逆になんかやっぱ
1293,1296,えなんかその面白がる話題でもないんだけどみたいな
1296,1300,あのガチなんだけどみたいな感じのテンションの方もいるからさ
1300,1304,そうこれ気をつけないといけないなっていうその温度さ
1304,1310,うんなんかその地域性のある話題がね
1310,1313,www
1313,1316,なんかその中学レベルもそうだし
1316,1320,その市とかさ今回の市レベルもそうだし
1320,1323,県レベルもね争い結構あるけど
1323,1328,なんかそういうのでね割となんかバチバチするのも
1328,1331,まあその話のネタとしては面白いんだけど
1331,1333,あの本当にね
1333,1335,あのまあその宗教上の理由により
1335,1340,なんか例えばさ応援しているその球団とかさ
1340,1344,あのそのスポーツのチームとか
1344,1349,なんか諸々の理由で本当は実はすごい仲悪いみたいなのがね
1349,1354,結構やっぱその外の人間からその全然その知らない人間からすると
1354,1357,割とタブーだったりするから
1357,1362,結構なんかあのなんだろう最近本当に聞かないけど
1362,1367,昔はなんか野球の話とかはしない方がいいとか
1367,1371,うんあの聞いたことはね薄々ありますけど
1371,1375,今は普通にみんな知ってるんじゃないかなっていう感じはするんだけど
1375,1377,www
1377,1382,えっ横浜の話題なのに定期的にコメント欄で町田が攻撃食らっててくさ
1382,1385,町田って何?
1385,1387,町田
1387,1393,これは横浜と関係あるの?
1393,1397,町田市
1397,1402,えっこれ町田ってこれ神奈川なの?
1402,1405,あっ町田は東京?
1405,1407,えっ神奈川県?
1407,1409,www
1409,1411,どっち?
1411,1416,えっちょっとフェイクニュースがちょっとはびこってるんだけど
1416,1419,えーっと
1419,1423,いや東京じゃん町田
1423,1428,ちょっと待ってね町田
1428,1430,東京都じゃん
1430,1435,あっこれもしかして限りなくその国境に近いってこと?
1435,1438,限りなく国境に近い東京ってこと?
1438,1442,一歩踏み込んだらそこは神奈川ってことか
1442,1445,地理的には神奈川諸説ある
1445,1448,あっ駅の端っこがすでに神奈川?
1448,1451,www
1451,1454,限りなく神奈川に近い
1454,1457,いやなるほどね
1457,1459,いやでもさ
1459,1464,あれ待ってスヌーピーミュージアムあるじゃん
1464,1468,あっこれ南町田グランベリーパークのところか
1468,1471,スヌーピーミュージアム行きましたよ私
1471,1475,あのーうちの母がスヌーピー好きなんでね
1475,1477,スヌーピーミュージアム行きました
1477,1483,あっこれ私てっきり普通にあのー東京じゃないと思ってたわ
1483,1489,死ぬほど遠かったんだもん都心から
1489,1493,これどんな日だったのか
1493,1496,www
1496,1499,失礼しました
1499,1501,あっそうシャアさんも好きだね
1501,1502,あっバクダ
1502,1507,あの町田にお住まいの皆さん今の発言に関しては
1507,1511,私のね本当に不特のいたすところであり
1511,1513,無知によるね
1513,1520,私の無知による本当に配慮のない発言だったことを
1520,1522,お詫びして訂正いたします
1522,1524,炎上したくないです
1524,1527,www
1527,1531,町田の淀橋付近でナビを使うと県境半復横跳びするから
1531,1534,東京都に入りました神奈川県に入りましたを無限ループする
1534,1536,あっやべ半復横跳び読んじゃった
1536,1538,半復横跳びなんだっけ
1538,1541,これもやっぱ諸説あるからね
1541,1545,半復横跳びなのか半復横跳びなのかっていうのはね
1545,1549,これ本当あの無限に戦いが続くから
1549,1553,これもちょっとアンケートとっとくか
1553,1555,えー
1555,1559,あなたの発音は
1559,1563,えー半復横跳び
1563,1566,半復横跳び派
1566,1572,それとも半復横跳び派
1572,1575,あなたの発音あれどっちがどっちだっけ
1575,1580,半復横跳びそれとも半復横跳び
1580,1583,www
1583,1586,え常識的に考えて半復横跳びでしょわかる
1586,1589,私は半復横跳びかな
1589,1593,半復横跳びこれ本当にどっちが
1593,1600,どっちを笑われてどっちがマジョリティなのか本当にわからないんだよね一生
1600,1605,え待って半復横跳び派少な
1605,1612,ちょっとアンケート終了します
1612,1614,はい
1614,1616,えーアンケートが終了しました
1616,1621,あなたの発音半復横跳び派が85%
1621,1623,半復横跳び
1623,1625,半復横跳び
1625,1627,半復横跳び
1627,1629,半あれ
1629,1634,ということでね半復横跳びがマジョリティということで
1634,1636,あのオーラル確保のチャンネルでは
1636,1638,えースタンダードまあ
1638,1644,北区赤羽根におけるスタンダードは半復横跳びということで決まりました
1644,1651,はいということでね横浜に関してはちょっとまあ横浜出身という方がいらっしゃいましたら
1651,1656,えーこれねぜひとも鹿を踊らせてみてはいかがでしょうか
1656,1662,レッツダンスウィズ横浜というのをねあの振ってみるといいかもしれません
