start_h,start_m,start_s,start_ms,end_h,end_m,end_s,end_ms,text
0,21,50,0,0,21,55,0,あの切ってほしいんですけど配信を
0,21,55,0,0,21,58,0,気にしないでほしいんですけども
0,21,58,0,0,22,1,0,なんかそのめでたいめでたいってのは
0,22,1,0,0,22,4,0,まあその前提として
0,22,4,0,0,22,8,0,あの袖付きなりばあさんのね
0,22,8,0,0,22,13,0,まあその誰かそのお友達が結婚されてるのを見て
0,22,13,0,0,22,16,0,あ幸せそうだなって思って
0,22,16,0,0,22,19,0,その幸せそうだなって思うこと
0,22,19,0,0,22,22,0,幸せそうだなって思った後に
0,22,22,0,0,22,24,0,その幸せそうだなって
0,22,24,0,0,22,28,0,自分が思ったことに対してダメージを受けてるってことですよね
0,22,28,0,0,22,32,0,そうやって結局その誰か知らない外的要因から
0,22,32,0,0,22,33,0,害を受けてるわけじゃなくて
0,22,33,0,0,22,38,0,自分の発想で自分がきつついてません
0,22,38,0,0,22,42,0,なんでなんかそれは幸せ
0,22,42,0,0,22,45,0,本人が相手がその対象が幸せかどうかっていうのは
0,22,45,0,0,22,51,0,全くその自分があの感知できるものではないから
0,22,51,0,0,22,54,0,幸せそうっていうことに対して
0,22,54,0,0,22,55,0,ダメージを受けるのは
0,22,55,0,0,22,58,0,あの全然あのなんだろう
0,22,58,0,0,23,3,0,自分の中で消化できることなんじゃないかなって思うんですよ
0,23,3,0,0,23,4,0,どうですか
0,23,4,0,0,23,7,0,そういう話でもない
0,23,7,0,0,23,11,0,そういう話でもないのかもな
0,23,11,0,0,23,15,0,そもそもやっぱりなんかその幸せで
0,23,15,0,0,23,18,0,誰かが幸せであることは
0,23,18,0,0,23,21,0,まあ嬉しい嬉しいなって言う子も
0,23,21,0,0,23,24,0,幸せなってほしいなって言う子もいるし
0,23,24,0,0,23,27,0,あいつは本当に気が合わないんだろうなっていう子もね
0,23,27,0,0,23,29,0,あのもちろんいると思うんですけど
0,23,29,0,0,23,31,0,暮らしてて
0,23,31,0,0,23,36,0,なんかその幸せ相手が幸せだったら
0,23,36,0,0,23,40,0,私も幸せって思う必要本当にないんでね
0,23,40,0,0,23,44,0,ただその幸せそうかどうかって判断してるのは自分自身だから
0,23,44,0,0,23,47,0,それでダメージを受けるのは
0,23,47,0,0,23,53,0,なんかあのもうちょっとやりようがあるのかなっていう印象を
0,23,53,0,0,23,57,0,受けました自分より幸せそう
0,23,57,0,0,24,2,0,自分自分より幸せそうかなるほどね
0,24,2,0,0,24,7,0,なんかでも幸せかどうかって結局絶対評価じゃないですか
0,24,7,0,0,24,11,0,他の人と比べて何になるんだろうって思っちゃうけどな
0,24,11,0,0,24,15,0,なんか自分がその自分が幸せだって思うことが
0,24,15,0,0,24,19,0,結局最終的に自分のためになるんだろうなと思うから
0,24,19,0,0,24,22,0,私は割といつも自分は幸せだなぁと思いながら
0,24,22,0,0,24,24,0,生きてますね
0,24,24,0,0,24,28,0,そう思った方が結果的に自分今自分にもメリットがあるし
0,24,28,0,0,24,32,0,将来の自分にもメリットありそうだなと思うから
0,24,32,0,0,24,38,0,今じゃあ例えばこういうなんか私が本当に幸せじゃないなぁ
0,24,38,0,0,24,44,0,と思う要素があるんだとしたらそれを配数配せばいいしね
0,24,44,0,0,24,50,0,例えばなんかその仕事がねどうしても合わなくてみたいなことであれば
0,24,50,0,0,24,59,0,もし環境に要するのであれば転職しちゃおうかなって結構環境を変えようかなって思ったり
0,24,59,0,0,25,2,0,すぐするタイプかな
0,25,2,0,0,25,9,0,やっぱり相対的に考えても結局答えがないからね
0,25,9,0,0,25,13,0,幸せとかってでもなんだろう
0,25,13,0,0,25,26,0,やっぱり大学生の時とかに大学生の時とかにやっぱこうなんだろうな
0,25,26,0,0,25,32,0,やらんかさあ私の彼氏がさあどこどこ大学なんだけどみたいな
0,25,32,0,0,25,37,0,なんかあの陰はそこに行こうかなって言ってんだよね
0,25,37,0,0,25,43,0,私の彼氏がさあ医者なんだけどさあ今度なんか車で学校まで迎えに来るって言って
0,25,43,0,0,25,49,0,会社で目立つから本当に嫌だって言ってんだけどみたいなコミュニケーションまじであるからね
0,25,49,0,0,25,52,0,まじであるよまじであるあるあるまじである
0,25,52,0,0,25,59,0,だからそういう最終的には
0,25,59,0,0,26,12,0,自分がね自分が幸せであることを他人に依存し始めたらやっぱダメなんですよ
0,26,12,0,0,26,15,0,他人とか物事とかね
0,26,15,0,0,26,22,0,例えばこの人と付き合ってるから私は幸せとか結婚してるから幸せとか子供がいるから幸せとか
0,26,22,0,0,26,35,0,そういうなんか事物とか物事他人とかに依存したら自分の判断力とか自分の思考が鈍るなってすごい思うんで
0,26,35,0,0,26,44,0,それだけはマジ気をつけた方がいいかなと日々日々ね自分を言いましめながら生きてますね
0,26,44,0,0,26,53,0,マジであるよでも男の人まで男とか女とかで分けるのももう今時ナンセンスだなと思うんでねあれだけど
0,26,53,0,0,26,57,0,まあそのまだん
0,26,57,0,0,27,6,0,男性社会は男性社会でねそれぞれ今まで培ってきたものをおそらくあるだろうから男性社会と言われていた過去の異物の中でね
0,27,6,0,0,27,14,0,そういう中でまあ人間はまあみんなそういう風な社会の仕組みの中でさ
0,27,15,0,0,27,20,0,行為しながら生きてきたし生きていくんだろうね
0,27,21,0,0,27,25,0,生きていくし生きていくんだろうね
0,27,25,0,0,27,32,0,子供が欲しいなら年齢によるタイムリミット考えた方がいい人工支給があります 人工支給があるんで大丈夫ですね
0,27,32,0,0,27,41,0,先週なんとね34件もあの私に教えてくれた人工支給があるんで問題ないと思います ね
0,27,41,0,0,27,52,0,生産用途の件を他人に生き出せるのは本当にそう本当にそうですね っていう感じです私はただまあ正直あんまりあのこういうね
0,27,52,0,0,28,3,0,fm のご相談に関しては あの本当にあんまお役に立てないことが多いので全然意味わかんねーなと思ったら聞き流してください
0,28,3,0,0,28,8,0,本当に比べる必要ないと思いますよはいでは次
0,28,10,0,0,28,18,0,あこれ素敵なすごいお素敵なお便りだなぁと思いました 特命の方からのねお便りですありがとうございます
0,28,18,0,0,28,24,0,ルカ子さんお疲れ様ですお疲れ様です 妹が結婚します
0,28,24,0,0,28,35,0,年は8つ離れていて今でもそれなりに仲良くラインする関係です 妹との思いではたくさんあります小学校1年生の正月に一緒にハリーポッターと賢者の
0,28,35,0,0,28,45,0,石を見に行ってでかい雲が怖くて妹が泣き出してしまったこと 小学校4年生の時に見に行ったハリーポッターとアズカバンの囚人でパンフレットを買おうと目を
0,28,45,0,0,28,50,0,離した一瞬の隙に俺のリュックを盗まれたこと
0,28,50,0,0,28,59,0,中学1年生の時のハリーポッターと不死鳥の騎士団はさすがにお兄ちゃんと映画は卒業 かなぁと思っていたら
0,28,59,0,0,29,9,0,ここまで来たら最後まで一緒に見に行くぞと言ってくれたこと 高校2年生のハリーポッターと死の秘宝パート2を見た夜にくれた
0,29,9,0,0,29,17,0,長い間ありがとうございましたもし続編が来たら彼女と見に行けよというメールは今でも保存 しています
0,29,17,0,0,29,24,0,そんな妹にも今では好きな時に一緒に映画を見てくれる人ができたことをとっても嬉しく 思います
0,29,24,0,0,29,30,0,おめでとう妹幸せになっ あちなみに私はファンタビ
0,29,30,0,0,29,33,0,まだ見れてません
0,29,33,0,0,29,37,0,素敵なお便りいただきました
0,29,37,0,0,29,44,0,ハリーポッターと死の秘宝がパート2が最終ですね ハリーポッターシリーズの映画は
0,29,44,0,0,29,53,0,でファンタビはファンタスティックビーストっていう一応ハリーポッターと世界観を共有した続編の映画
0,29,54,0,0,29,59,0,って感じこのお兄ちゃんグリフィンドール グリフィンドールかなぁ
0,29,59,0,0,30,5,0,いやいやいやいや私あのグリフィンドールの人とはね
0,30,5,0,0,30,14,0,もしかしたら気があんまり合わない傾向に強いかもなって常々思ってるから この方はハッフルパフだといいなと思ってる
0,30,15,0,0,30,25,0,ハッフルパフがいいだったらいいなぁと思うハッフルパフの人とは仲良くできると思う ハッフルパフの人は別に誰とでも仲良くできるんだよね
0,30,25,0,0,30,35,0,私あの友達マジでみんなハッフルパフばっかり 誰とでも対応できる誰とでも仲良い人がすごい長くしてくれ
0,30,35,0,0,30,38,0,ますね 悲しくなってきてる自分で言ってて
0,30,38,0,0,30,43,0,はっはっは 皆さんは困りどうですか
0,30,43,0,0,30,49,0,あのなどこの量が多いですか マジでねー
0,30,49,0,0,30,55,0,ハッフルパフかスリザリンしかおらんな マジでグリフィンドールはいない
0,30,56,0,0,31,0,0,私どうかなスリザリンかスリザリンばっかり
0,31,0,0,0,31,4,0,あースリザリンはね スリザリンはね
0,31,4,0,0,31,8,0,ハッフルパフとレイブンクロウは アズカバン
0,31,8,0,0,31,11,0,アズカバン
0,31,11,0,0,31,15,0,周りがみんなレイブンクロウ 見渡せばスリザリン
0,31,15,0,0,31,22,0,グリフィンドールいないよね 良かったみんなも周りにグリフィンドールいなくて
0,31,22,0,0,31,26,0,何の絆の並み合いなんだって感じだけど
0,31,26,0,0,31,32,0,包まれてるハッフルパフとレイブンクロウが 周りにいる生活は結局いいんだと思うよ
0,31,32,0,0,31,38,0,おそらくね 一番幸せだと思う友人関係として
0,31,40,0,0,31,46,0,グリフィンドールにぶち込まれてみなよ めちゃめちゃしんどいよ だってグリフィンドールの人って
0,31,46,0,0,31,49,0,みんなで仲良く一緒に
0,31,49,0,0,31,56,0,例えばなんか絶対みんなで一緒にやった方が 絶対楽しいじゃんみたいな
0,31,56,0,0,32,1,0,一文に絶対を2回使ってくるタイプだよ グリフィンドールの人はさ
0,32,1,0,0,32,8,0,嫌いじゃないんだけどね 結局やっぱその何事もグリフィンドールの人が主人公になるんだけど
0,32,8,0,0,32,13,0,私はやっぱきつい グリフィンドールの空気は
0,32,13,0,0,32,16,0,あの談話室にいられないよ
0,32,16,0,0,32,21,0,そうだよ 嫌いじゃないんだよね マジでいい人だからさ
0,32,21,0,0,32,27,0,結局グリフィンドールの人って本当に無邪気っていうか
0,32,27,0,0,32,33,0,自分が本当に相手のためを思ってやってますっていうことが
0,32,33,0,0,32,41,0,相手ももちろん嬉しく感じてる 相手もすっごい喜んで自分の考えを受け取ってくれてるって
0,32,41,0,0,32,46,0,思ってんだよね グリフィンドール生って
0,32,46,0,0,32,51,0,そういうとこが合わないのよ グリフィンドールとはね
0,32,51,0,0,32,55,0,まあでもね本当になんかすごい偏見を押し付けちゃったけど
0,32,55,0,0,32,59,0,結局やっぱあの基本的にやっぱ主人公ってグリフィンドールだからね
0,32,59,0,0,33,2,0,悪気がないの いい人なんだよねマジで
0,33,2,0,0,33,8,0,だからなんか結構本当に 自分の考えを受け取ってくれてるって
0,33,8,0,0,33,13,0,だから結構本当にあの
0,33,13,0,0,33,18,0,フォグアーツの寮のなんか組み分けって本当に素晴らしいんだっていつも
0,33,18,0,0,33,22,0,大体の人パッてこう会って話して
0,33,22,0,0,33,27,0,あこの人あの寮だなみたいな分かりません?
0,33,29,0,0,33,34,0,分かんない?そうだよねごめん
0,33,34,0,0,33,39,0,だからねまあでもやっぱアニマーラとか私あの有感キッスアニマーラメンバーなんでね
0,33,39,0,0,33,44,0,アニマーラとか確かなんかハニストのね美子さんが昔
0,33,44,0,0,33,48,0,あの7シンクメンバーを組み分けするみたいな配信してたんでね
0,33,48,0,0,33,51,0,ああいうのって本当無限にできるよね
0,33,51,0,0,33,57,0,めちゃめちゃ楽しいということで本当に素敵なねお便りありがとうございました
0,33,57,0,0,34,1,0,あのファンタビーがね
0,34,1,0,0,34,5,0,見れる日がいつか来るといいなと思いながら
0,34,5,0,0,34,7,0,非常に心温まるお便り
0,34,7,0,0,34,10,0,あと妹さんも本当にご結婚おめでとうございます
0,34,10,0,0,34,13,0,ということでえー
0,34,13,0,0,34,15,0,暑いですね
0,34,17,0,0,34,21,0,えーすだ大福さんからの普通お便りありがとうございます
0,34,21,0,0,34,28,0,えー最近すだまさきさんが演じるミステリというな彼にハマり漫画を買う予定です
0,34,28,0,0,34,36,0,ああいう理論的な暗楽居スタンテが大の好物である私には必要な栄養素がたっぷりと詰まっていました
0,34,36,0,0,34,42,0,人の神経を逆撫でするのに党の本人はあるビレーもせずに淡々と事実を述べる感じが
0,34,42,0,0,34,45,0,腹立たしくてとても好印象ですね
0,34,45,0,0,34,49,0,似たような作品でロバートダウニンジュニアさんが演じられるシャーラックホームズも
0,34,49,0,0,34,54,0,序盤の序盤でワトソンの奥さんの激霖に触れて水をかけられるシーンがあったので近いものを感じました
0,34,54,0,0,34,59,0,なんで私こんなダメな男ばっかり好きになるんだろうかっこ大の字
0,34,59,0,0,35,2,0,また入れていただきました
0,35,2,0,0,35,6,0,ミステリというな彼ドラマ皆さん見てます
0,35,6,0,0,35,14,0,私はね漫画の方を集めて読んでるんでアニメはね見てないんですけれども
0,35,14,0,0,35,19,0,なんかあのミステリというな彼もともと読んでたからなのか分かんないけど
0,35,19,0,0,35,28,0,ニュースのサジェストでねあの月久のミステリというな彼のレビューが出てきて
0,35,28,0,0,35,39,0,なんかあのなんだっけな結構人気のねあのヒールというかちょっとミステリアスな役どころがあるんですけど
0,35,39,0,0,35,44,0,それは絶対なんか白田優だ白田優にやってほしいっていう件があったけど
0,35,44,0,0,35,49,0,実際は違う俳優さんであのみんながしょんぼりしてるみたいなね
0,35,49,0,0,35,54,0,だからみんなやっぱ原作があるコンテンツってそうなっちゃうのかな
0,35,54,0,0,36,0,0,なんかみんななんだろうやっぱこのこれはこのキャラはこの人じゃないけどとかね
0,36,0,0,0,36,9,0,このキャラはこの人じゃないよみたいなのがねどうしても原作ファンの中で生まれいずる悩みなんだよなーって思っちゃうんだよな
0,36,9,0,0,36,12,0,ちょっとお水飲みます
0,36,12,0,0,36,23,0,ドラマの実写化ってだいたいそうちなみになんかこれはマジで全員解釈一致だなっていう漫画とかの実写化ってありますか
0,36,23,0,0,36,31,0,私はね全然何にも思いつかないんだけど
0,36,31,0,0,36,36,0,見てないんだけどあのルローニケンシンとかすごい評判良かったんだけど
0,36,36,0,0,36,44,0,テルマエロマエだ!
0,36,44,0,0,36,47,0,テルマエロマエすごかったよね
0,36,47,0,0,36,54,0,あのあれですねギリシャにタイムスリップした日本人の女の子が
0,36,54,0,0,36,58,0,フロージェネレーションの女の子が
0,36,58,0,0,37,6,0,フローを軸にした物語に巻き込まれていくみたいな漫画だった気がするんですけど
0,37,6,0,0,37,17,0,安倍博史さんがねギリシャ人の役をやっていてマジでその他にもねすごい惚れの深い俳優さんをもう全面にねプッシュした非常に素晴らしい映画だったんで
0,37,17,0,0,37,23,0,もしまだ映画見てないっていう方がねいたら是非とも見てほしい
0,37,23,0,0,37,28,0,孤独のグルベもいい、カイジもいい、デスノートもいい
0,37,28,0,0,37,32,0,デスノートもいいね
0,37,32,0,0,37,36,0,デスノートも良かった
0,37,36,0,0,37,38,0,デスノートってあれですよね
0,37,38,0,0,37,54,0,えーと、不寮原達也さんと松平貞信ですよね
0,37,54,0,0,37,56,0,野田目カンターベルか
0,37,56,0,0,37,59,0,結構ありますね
0,37,59,0,0,38,3,0,銀魂、あ、もやしもんがね
0,38,3,0,0,38,8,0,あのーもやしもんが実写化した時に
0,38,8,0,0,38,14,0,あのー髭で挑発の先輩の役をね笑い飯さんがやってたんですけど
0,38,14,0,0,38,17,0,それがめちゃめちゃ良かったです
0,38,17,0,0,38,19,0,すっごいぴったりだった
0,38,19,0,0,38,20,0,てかまんまだった
0,38,20,0,0,38,22,0,そのまんまだったの
0,38,22,0,0,38,24,0,是非とも見てほしい
0,38,24,0,0,38,27,0,もともとだって絶対さ
0,38,27,0,0,38,30,0,いやこれ絶対もやしもんの
0,38,30,0,0,38,35,0,漫画絶対これ笑い飯ベースで描いてないみたいな感じのキャラデザインだったんだけど
0,38,35,0,0,38,37,0,本当にキャスティングされてて
0,38,37,0,0,38,39,0,大学生なんだけど
0,38,41,0,0,38,44,0,やっぱもともと笑い飯がモデルなんだ
0,38,45,0,0,38,49,0,数年後、制作者が西田さんモデルにしましたって暴露したんだ
0,38,51,0,0,38,52,0,面白すぎる
0,38,52,0,0,38,54,0,大学生の役なのにね
0,38,54,0,0,38,56,0,そういうの自由度が高くていいですね
0,38,56,0,0,39,0,0,っていう話だったんですけど
0,39,0,0,0,39,2,0,ロバートダウニージュニアさんのシャーロックホームズも好きですが
0,39,2,0,0,39,6,0,私はですねBBCのシャーロックがどうしてもやっぱり好きなんで
0,39,6,0,0,39,12,0,BBCのシャーロックが世のドラマの中で一番好き
0,39,12,0,0,39,14,0,一番好きだわ
0,39,14,0,0,39,17,0,もしね私あんまプレゼンがうまくないんで
0,39,17,0,0,39,19,0,とにかく好きだし絶対見てほしいしか
0,39,19,0,0,39,21,0,とにかく好きなんで絶対見てくれます
0,39,21,0,0,39,26,0,とにかく好きなんですよ
0,39,26,0,0,39,29,0,絶対見てほしくて絶対見てくれませんかしか言えないんですけど
0,39,29,0,0,39,31,0,見てほしいです
0,39,35,0,0,39,37,0,なんかね
0,39,37,0,0,39,40,0,主人公がメディリクト・カンバーバッチで
0,39,40,0,0,39,42,0,ワトソン役がですね
0,39,42,0,0,39,45,0,マディ・フリーマンさんがやってるんですけど
0,39,45,0,0,39,48,0,シャーロックホームズの世界観を現代に見せるという
0,39,48,0,0,39,51,0,とにかくワンシーズン3話
0,39,51,0,0,39,53,0,90分×3話でね
0,39,53,0,0,39,55,0,非常にコンパクトで見やすいので
0,39,55,0,0,40,0,0,まだ見てないという方はほとんどいないと思いますけれども
0,40,0,0,0,40,2,0,ぜひご覧ください
0,40,2,0,0,40,4,0,最高
0,40,4,0,0,40,6,0,ネタバレに気をつけてくださいね
0,40,6,0,0,40,9,0,ネタバレ入るで何も言えないオタクだから今
0,40,9,0,0,40,11,0,最高だからとにかく
0,40,11,0,0,40,14,0,なんかね今回のシャーロックホームズの
0,40,14,0,0,40,18,0,メンタリストを見ましたっていうお便りも来てました
0,40,18,0,0,40,20,0,私の前メンタリストはね
0,40,20,0,0,40,24,0,一応最終シーズンの途中まで見てます
0,40,24,0,0,40,27,0,なんかね私の中でメンタリストって
0,40,27,0,0,40,30,0,第3シーズンか第4シーズンくらいがとにかくピークで
0,40,30,0,0,40,33,0,めちゃめちゃ面白いですよ
0,40,33,0,0,40,35,0,犯罪心理学っていうか
0,40,35,0,0,40,37,0,なんだろう
0,40,37,0,0,40,39,0,犯罪心理学なのかな
0,40,39,0,0,40,41,0,犯罪心理学の中で
0,40,41,0,0,40,44,0,なんだろう犯罪心理学なのかな
0,40,44,0,0,40,47,0,いわゆるそのメンタリストが主人公で
0,40,47,0,0,40,49,0,そういうなんか和術とかをね
0,40,49,0,0,40,52,0,駆使して犯人を追い詰めるっていう
0,40,52,0,0,40,55,0,海外のミステリードラマなんですけど
0,40,55,0,0,40,57,0,あのねやっぱ
0,40,57,0,0,41,1,0,第3シーズンか第4シーズンがとにかく面白すぎて
0,41,1,0,0,41,3,0,その後がもうなんか
0,41,3,0,0,41,6,0,あーなんかどうなんだろう引き伸びましたのか
0,41,6,0,0,41,8,0,どうなんだろうなみたいな感じでね
0,41,8,0,0,41,11,0,疑念が巻き起こっちゃってとにかく全編面白いんですけどね
0,41,11,0,0,41,13,0,全編面白い面白いんですけど
0,41,13,0,0,41,16,0,最終シーズンの途中で
0,41,16,0,0,41,18,0,溜まっている状態です
0,41,18,0,0,41,21,0,メンタリストも面白いです
0,41,21,0,0,41,23,0,好きです
0,41,23,0,0,41,25,0,ということで皆さんもね
0,41,25,0,0,41,28,0,おすすめの海外ドラマがあったらぜひとも教えてください
0,41,28,0,0,41,30,0,なんかちょっと沼るとね
0,41,30,0,0,41,33,0,仕事に影響が出そうだし
0,41,33,0,0,41,35,0,私あの来月にね
0,41,35,0,0,41,37,0,確定のやつが控えてるんで
0,41,37,0,0,41,40,0,それがマジで不安なんですけど
0,41,40,0,0,41,43,0,これ今見始めるとマジでやばいと思うんだよね
0,41,43,0,0,41,45,0,確定のやつがあるから
0,41,45,0,0,41,47,0,でなんかね
0,41,47,0,0,41,49,0,なんだかよくわかんないんだけど
0,41,49,0,0,41,51,0,あの確定のやつが
0,41,51,0,0,41,53,0,終わりましたっていう
0,41,53,0,0,41,54,0,お便り来てて
0,41,54,0,0,41,57,0,私基本的にNGないし
0,41,57,0,0,41,59,0,NGないし
0,41,59,0,0,42,1,0,別になんかあのなんだろうな
0,42,1,0,0,42,3,0,いわゆるそのご意見的なものもね
0,42,3,0,0,42,6,0,あのまあそういうご意見もあるかと思って
0,42,6,0,0,42,9,0,あのきちんと読んでるんですけど全部
0,42,9,0,0,42,13,0,マジで確定のやつが終わったっていう連絡だけは
0,42,13,0,0,42,15,0,本当に避けてほしいね
0,42,17,0,0,42,19,0,うんでもお疲れ様でした
0,42,19,0,0,42,21,0,はははははは
0,42,22,0,0,42,24,0,お疲れ様でした
0,42,24,0,0,42,26,0,終わったなら何より本当にうん
0,42,26,0,0,42,28,0,そう
0,42,28,0,0,42,30,0,二成りに続くNGだよ
0,42,30,0,0,42,33,0,二成りは別に二成りが好きな人を
0,42,33,0,0,42,35,0,害しようという気持ちはないし
0,42,35,0,0,42,37,0,あの何なら二成りのいいところとかを
0,42,37,0,0,42,39,0,プレゼンしてほしいなと思ってるけど
0,42,39,0,0,42,42,0,確定のやつだけはマジで確定終わりましたと
0,42,42,0,0,42,44,0,確定のいいところをプレゼンされても
0,42,44,0,0,42,46,0,私の心にはちょっと響かないかもしれません
0,42,46,0,0,42,48,0,ちょっとわかんないけどね
0,42,48,0,0,42,50,0,うん
0,42,50,0,0,42,52,0,いやもうなんかこんな思いをするぐらいなら
0,42,52,0,0,42,54,0,会社員に生まれたかったよ私も
0,42,54,0,0,42,56,0,いや別に生まれられるんだけど
0,42,56,0,0,42,58,0,ふふふふ
0,42,59,0,0,43,1,0,生まれられるんだけど
0,43,1,0,0,43,3,0,うんこんな思いをするぐらいなら
0,43,3,0,0,43,6,0,会社員に生まれたかったなって思うんだったら
0,43,6,0,0,43,8,0,別に会社員としてなんか
0,43,8,0,0,43,10,0,転生できるんだけど
0,43,10,0,0,43,12,0,はははははは
0,43,12,0,0,43,14,0,でもさ去年
0,43,14,0,0,43,16,0,去年生きた私は変えられないからさ
0,43,16,0,0,43,19,0,うん去年1月から会社員としてさ
0,43,19,0,0,43,22,0,生き直すことがもうできないからね
0,43,22,0,0,43,24,0,うん
0,43,24,0,0,43,26,0,ほんとそうなんですよね
0,43,26,0,0,43,28,0,ということでもうこれ以上この話はやめよう
0,43,28,0,0,43,31,0,なんか今さっきライブ配信始めようと思って
0,43,31,0,0,43,33,0,youtube開いたら
0,43,33,0,0,43,34,0,あのー
0,43,34,0,0,43,36,0,湯野原いずみさんが
0,43,36,0,0,43,38,0,生配信をされていて
0,43,38,0,0,43,39,0,ライブ配信がね
0,43,39,0,0,43,41,0,それでなんか名前を言ってはいけない
0,43,41,0,0,43,43,0,あの4時授業が
0,43,43,0,0,43,44,0,うんそう
0,43,44,0,0,43,46,0,3月のウォルデモートが
0,43,46,0,0,43,48,0,すごい大々的にこう
0,43,48,0,0,43,50,0,バンバンバンバンって出てて
0,43,51,0,0,43,53,0,うん確定のやつって出てて
0,43,53,0,0,43,54,0,サムネイルに
