start_s,end_s,text
6299,6301,うんそうかと思うんだけど
6301,6303,なんかWEB2.0でこの
6303,6305,中央集権的だったものをなんか
6305,6307,分散させますそれが
6307,6309,WEB3.0って言われてたけど
6309,6311,ちょっとよくわかんないなまあそのうち
6311,6313,わかってくるか一般化されたら
6313,6315,私も体感できるのかなと思って待ってるんだけど
6315,6317,あれのやっぱの説明
6317,6319,聞いてもまあ多分
6319,6321,そういう風にその
6321,6323,専門的にね研究されてる方とか
6323,6325,実際にその最前線で
6325,6327,携わってる方とかは多分もう肌で
6327,6329,感じてることなのかもしれないけど
6329,6331,一般人はね
6331,6333,やっぱその降りてこないとある程度
6333,6335,一般化されて降りてこないとなかなか体感
6335,6337,できないものではありますよね
6337,6339,うん
6339,6341,昔ながらの古いホームページ減ってて寂しい
6341,6343,えっ待ってちょっとアベヒロシさんの
6343,6345,アベヒロシさんの
6345,6347,アベヒロシ
6347,6349,ホームページ
6351,6353,あっ表示されてる
6353,6355,ははははははは
6355,6357,ははははははは
6357,6359,よかった
6359,6361,表示されました
6361,6363,えーアベヒロシさんのホームページはね
6363,6365,相変わらずしっかりと表示されていました
6365,6367,なんかやっぱ
6367,6369,こう安心するよね
6369,6371,代名詞だよねやっぱり
6371,6373,こうなんか
6373,6375,ホームページとは
6375,6377,核あるべきみたいな
6377,6379,こういう感じがする
6379,6381,いいよね
6381,6383,あのーあれみたいな感じですよね
6383,6385,あのー
6385,6387,クレヨンしんちゃんの
6387,6389,大人帝国みたいな
6389,6391,三丁目の遊匹的な
6391,6393,なんか
6393,6395,多分そのインターネットのこういう時期は
6395,6397,通ってない人でも
6397,6399,アベさんのホームページを見るだけで
6399,6401,なんかすごい
6401,6403,心惹かれるものがあるみたいな
6403,6405,教習ってやつかこれが
6405,6407,みたいな感じがするわ
6407,6409,一生残っててほしい
6411,6413,はいと思います
6413,6415,ということで面白い標準化ね
6415,6417,あっこれは標準化って
6417,6419,言うんだってことを今回初めて知ることができたので
6419,6421,勉強になる
6421,6423,お便りありがとうございました
6423,6425,んーでは次
6425,6433,【コメント】赤いツバメと緑のきらめきさんからのリスナー職業体験お便りありがとうございます
6435,6437,エルカクさんこんばんは
6437,6439,もう数年前の話になりますが
6439,6441,全国に利用者のいる結構な
6441,6443,大規模システムの行使に携わっていた時の
6443,6445,話です
6445,6447,要はまさに大クラウド時代ということで
6447,6449,普段のシステムをこれからはクラウドで動かすぞ
6449,6451,という話になり
6451,6453,私のチームも古いシステムのデータをネット越しに
6453,6455,クラウドへ送信すべく準備を進めていました
6457,6459,システム切り替え日まで残り数ヶ月というある日
6459,6461,上の手違いだかなんだかで
6461,6463,転送速度とデータ容量を計算すると
6463,6465,今からノンストップでデータを転送しても
6465,6467,1日40時間ぐらいないと
6467,6469,切り替えに間に合わないという事実が発覚したのです
6471,6473,急遽対応協議したのですがそれはなんと
6475,6477,数テラあるHDDを旧システムから取り外し
6477,6479,強固なアタッシュケースに入れて
6479,6481,そのまま新幹線に乗り込み
6481,6483,その先のデータセンターに向かって直接接続して
6483,6485,転送するという力技でした
6485,6487,それを数回繰り返してどうにか
6487,6489,データ転送はシステム切り替えに間に合ったのですが
6489,6491,インターネットの転送速度より
6491,6493,新幹線や飛行機の方が早いという
6493,6495,よた話を自分が本当に体験するとは思いもしませんでした
6497,6499,めちゃめちゃ面白いよね
6503,6505,めちゃめちゃ面白い
6507,6509,当時は笑い事じゃ絶対なかったと思うんですけど
6509,6511,数年前のお話ということなんでね
6513,6515,すごいよね
6515,6517,HDDを持って
6517,6519,アタッシュケースに入れて
6519,6521,新幹線に乗って持っていく方が
6521,6523,人力の方が早いっていうのが
6525,6527,風刺が効きすぎてるというか
6527,6529,エピソードが強すぎる本当にそう
6529,6531,めちゃめちゃ面白かったですね
6533,6535,あ、通信業あるあるなんだ
6535,6537,わからない
6537,6539,私もね
6541,6543,PCのデータが
6543,6545,動画のデータとかが多くて
6547,6549,Cドライブがパンクしそうなんで
6551,6553,七石さんに相談したら
6555,6557,外部に一回逃がした方がいいかもしれないですね
6559,6561,でもそれをもし外部がぶっ壊れちゃったら
6561,6563,一生取り戻さないじゃないですか
6563,6565,だからクラウドに保存してるんですけど
6567,6569,このサービスだったら使っていいよっていう
6569,6571,クラウドサービスを確認して
6571,6573,そこにあげてるんだけど
6573,6575,もうなんか
6575,6577,用量が足りなくて一生足りなくなってて
6579,6581,もう一生足りないよ
6581,6583,一生足りないし日に日に
6583,6585,バックアップを定期的に取ってるんですけど
6585,6587,バックアップを上げる時間がとんでもないことになってて
6587,6589,そうだからね
6589,6591,クラウドも今一つなのかもしれないですね
6593,6595,結構あちこちで見られましたHDで持ってくの
6597,6599,何?レイド?ライド?
6599,6601,ナス
6603,6605,ナス
6605,6607,ナス
6607,6609,構築
6611,6613,自宅で簡単構築
6613,6615,簡単構築
6615,6617,自宅で簡単構築
6617,6619,ナスをホームネットワークに接続しよう
6621,6623,これ見ときます
6623,6625,主人者でもできるって書いてあるし
6627,6629,このナスは
6631,6633,ナス自体がぶっ壊れるみたいなことはないって感じですか
6635,6637,ネットワークハードディスク
6637,6639,なんか強そう
6639,6641,いいですね
6641,6645,ネットワークに繋がったHDで
6645,6647,最強じゃん
6647,6649,最強じゃん
6649,6651,それがいいじゃん
6651,6653,そうします
6653,6655,電力がまずい?
6655,6657,なるほどね
6657,6659,電力確かに
6659,6661,不安が残るけど
6663,6665,レイドもある
6665,6669,レイド
6673,6675,データのバック技術レイドを開発します
6677,6679,複数台のHDに分散して記録し
6679,6683,より高速で信頼性の高いディスク装置を実現する技術
6685,6689,今の時代は何でもかんでも分散させたがるからねみんな
6691,6693,やっぱり
6693,6695,最近
6697,6699,広告とか見てると
6699,6701,暗号試算よく見るんですけど
6701,6703,仮想通貨っていうのやめたんだなと思って
6703,6705,仮想通貨っていうのが
6705,6707,すごいうさんくさくなっちゃったから
6707,6709,もともとね
6709,6711,直訳すると多分暗号試算だったはずなんだけど
6713,6715,最近やたら暗号試算だなと思って
6715,6723,うさんくさいイメージを払拭したいんだなっていう気持ちになりました
6723,6725,はいということで
6725,6731,今日ねバックアップに関しても有益な情報コメント欄からも得られたんで非常に助かります
6733,6735,やべちょっと52分になっちゃった30までにはね
6735,6737,ちょっとさすがに
6737,6739,待ってちょっと
6739,6743,朝にはならないことが確定しましたおかげさまでね
6743,6771,では次
6771,6773,次
6801,6813,次
6831,6851,次
6861,6873,次
6873,6875,次
6875,6877,次
6877,6879,次
6879,6881,次
6881,6883,次
6883,6885,次
6885,6887,次
6887,6889,次
6889,6891,次
6891,6893,次
6893,6895,次
6895,6897,次
6897,6899,子
6903,6905,子
6905,6913,くらいの売上げにできるぞと見込み売上価格まで楽しそうに計算していました 自分もそうかすごいな計算あってるぞ
6913,6922,でも実際に売らないけどなと楽しそうに考えていること自体を褒めて 暗算での計算間違いを直したり集計方法の効率化を図ったりするなどのサポートを
6922,6931,してその日あきれまで付き合ってあげていました 数日後神妙な顔した施設長が私を呼び出しました
6931,6940,施設長 天野さん小学校と小学生とカブトムシを売り歩こうとしている話があったの
6940,6943,ですが本当ですか
6944,6954,どうやらカブトムシをいくらで売ったらどれぐらい利益が出るのかの計算をしていた 一連の話がなぜか施設長の耳に職員と小学生がカブトムシ販売で太な利益を
6954,6961,得ようとしていると伝わっていたのです あらゆる誤解を受けてしまい誤解を解くのに時間がかかりましたがきちんと計算練習のために取り組んだことを
6961,6970,実際に販売はしないことを確約してもしもの話として本人があきれまで付き合っただけな ことを根絶丁寧に説明しましたが数ヶ月間は児童と一緒に太な利益を
6970,6981,上げようとしたヤバい職員がいると職場内で噂になったことをここに報告させていただきます 以上私が体験した職業体験でした長文田店でいたしましたということでね
6981,6989,いやーこれめちゃめちゃねあの素敵なエピソードなぁまあ素敵なエピソードではありつつも 災難だったなぁという面もあるんですけど
6989,6992,かぶともし新事件
6993,7001,実際ねやっぱねあのカブトムシってあれですもんね なんか高いって聞きますもんねうん
7001,7009,あれってなんか野生のカブトムシ捕まえてどっかにこう下したりみたいなのって カブトムシって
7009,7019,誰のいやカブトムシはカブトムシのものなんだけど 野生のカブトムシって捕まえた人のものなのそれともその
7019,7025,あのまあ途中を持ってる人のものか
7025,7029,日本人間の法律に当てはめるのであれば
7030,7038,まあそりゃそうかまあカブトムシは誰のものでもないけどね カブトムシ本人のものだけどね
7038,7044,法律に当てはめるとそうか クワガタの方が高いんだ
7045,7051,それこそさっきのねあのキノコみたいな感じの扱いになるんですかね
7053,7057,いやーだからなんか 私もなんか今年の夏休み
7057,7064,夏休みっぽいことしたいなぁと思って カブトムシとかも捕まえたいですよね
7064,7070,なんか クリスさんとかでもちょっと野生のカブトムシ食べさせるのはちょっとあれかな
7070,7080,バイキンとか怖いからねやっぱ 野生のものは食べさせられないんで捕まえてみせるぐらいしかできないですけどね
7080,7088,なんかねカブトムシを捕まえた記憶がないんだよね なんかあのカマキリとかは
7088,7091,よく捕まえてたんだけど
7091,7097,カマキリとバッターとかはよく捕まえてたんですけど
7097,7103,なんかカブトムシとかクワガタはね あーでもなんか戦わせた記憶があるな
7103,7108,でもあれは捕まえたやつを戦わせたのか勝手と戦わせたのかちょっとわからないですけどね
7108,7115,あの戦わせた記憶はあるけどなんか自分でこう捕まえた記憶がないんですよね
7115,7119,ザリガニはね ザリガニめちゃめちゃ捕まえてたかな
7119,7122,でも今ザリガニってあれじゃない?
7122,7127,あの一部のザリガニ 外来種で指定されちゃってて
7127,7133,ザリガニ飼育付加
7134,7138,これも前ねお便りいただいてます
7139,7144,ザリガニは 11月2日から去年のかなこれ
7144,7148,去年か一昨年の11月から
7148,7152,飼育や情報販売のほか野外放つことさらに許なども禁止されます
7152,7160,そのことなのでザリガニの種類によってはね禁止なので皆さん気をつけてください
7160,7163,特定外来生物だから飼育はおろかリリースもNG
7163,7164,そうなんですよ
7164,7168,これもだからあのリスナーさんからねお便りいただいて知りました
7168,7172,皆さんがザリガニ捕まえるときは何卒お気をつけください
7172,7178,じゃあチュース飲みます
7182,7186,カメとかもそうだよね
7187,7192,カメとかも結構その普段みんながその
7192,7200,大自然から捕まえてきて家で育ててたりとかしたカメも結構ねあの外来種で
7200,7206,その日本の固有の生態系とかを崩す存在みたいな感じ
7206,7209,扱いになってた気がするな
7209,7212,っていう感じですね
7212,7215,ということでなんであのザリガニの話になっちゃったのかわかんないですけど
7215,7218,あの素敵なねお便りありがとうございました
7218,7221,いや本当にねやっぱ今回しみじみと思うのは
7221,7225,世の中に本当にたくさんの職業があるんだな
7225,7229,そしてなんかそれぞれこういうふうにその心温まるエピソードとか
7229,7235,なんかえ?HDD新幹線乗って持ってくことなんてあるんだみたいなね
7235,7242,ことを知ることができてなんか締めみたいに言ってますけどまだあと2通ぐらい読みます
7244,7247,あとちょっと待ってくださいね
7247,7253,こちらでね最後のお便りになります
7253,7260,瀬戸内マンダラエフェクトさんからのリスナー職業体験お手入れありがとうございます
7260,7263,エルカコさんリスナーの皆さんこんばんは
7263,7267,私は各省庁と47都道府県をつなぐ組織で仕事をしています
7267,7274,お上が決めたことをお上がいけたことを実現するために手段を考えて開発して導入するみたいな仕事ですが
7274,7281,まあそんなことはいいんですご紹介したいのは私が所属していた部署のリーダーについてです
7281,7283,まずこのリーダーとんでもなく勤務態度が悪いです
7283,7285,遅刻や急な休みはお手のもの
7285,7290,出勤してきたかと思えば手ぶらに漫画雑誌だけ持って現れ
7290,7293,沈迷な姿勢でネットサーフィンのついでに仕事をこなし
7293,7296,それが終わればどれだけ偉い人が残っていても堂々と帰ります
7296,7299,全国のお偉いさんを招いて開催した大規模な会議でも
7299,7303,リーダーは事務局の椅子に踏んぞり帰って座り
7303,7305,ファミリーサイズのお菓子を食べていました
7305,7309,その横にいた私はそりゃもう生きた心地がしませんでした
7309,7311,しかしこのリーダーはとんでもなく仕事ができるのです
7311,7316,あらゆるシステムの設計書と挙動の根拠となる法律が全て頭に入っており
7316,7321,どんなイレギュラーにも迅速かつ的確に対応できる
7321,7325,まさしくリーダーにふさわしい能力を兼ね備えていました
7325,7328,そして何より異常なほど肝が座っているのです
7328,7332,組織の幹部が怒鳴りながら無理難題吹っかけてくるなんてのは日常茶飯事
7332,7335,県知事が直接陳情に来たこともありました
7335,7339,しかし我らがリーダーには相手の肩書や感情なんて全く関係ないのです
7339,7342,筋の通らない要求には一歩も譲らず
7342,7349,リードを整然と跳ねのける頼もしい姿に私は尊敬の念を抱かずにはいられませんでした
7349,7353,特に思い出深いのは官僚との打ち合わせが難航して泥沼にハマった時のことです
7353,7359,関ヶ原の高層ビルから見えるマガマガしい焼き尾バッグに官僚が我々に終電の時間を聞いてきました
7359,7364,要するにお前が首を縦に振らないと今夜は帰れないよと案に告げてきたのです
7364,7368,しかしこの皮肉にもリーダーは眉一つ動かさず
7368,7370,あいにく独り身ですのでお構いなく
7370,7373,しかしこの話はこれ以上進展しないでしょうし
7373,7375,話すことがなくて気まずいですねと
7375,7379,これまた皮肉で返すものですから会議室は耳鳴りがするほどの緊張感に包まれました
7379,7383,これにはさすがな私もこう思いました
7383,7388,ここまで来たらギリギリで終電逃してタクシーチケットもらうのが一番楽やなと
7388,7391,まあともかく数々の修羅場を一緒にくぐり抜けていくにつれて
7391,7396,やがて私は他のどんな役職持ちよりもリーダーに認めてもらいたいと思うようになりました
7396,7398,今にして思えば彼への憧れや
7398,7401,うちのリーダーに恥をかかせるわけにはいかんという教示が
7401,7407,仕事に対する私の意識を変えるきっかけになったような気がします
7407,7411,そんなリーダーとも異動によって今は離れ離れになってしまいました
7411,7414,しかし彼との思い出は今なお色褪せることはありません
7414,7417,ここまで冷たいエピソードばかり紹介してしまいましたが
7417,7421,リーダー本人は極めて温厚でユーモアのある人物です
7421,7423,彼は貯金をしないという強い信念を持っており
7423,7426,食事に行くと必ず全員分支払っていました
7426,7429,それができない場では会計の後いたずらを楽しむように
7429,7434,若手のポケットにこっそり満札を突っ込んでいく姿が印象的でした
7434,7438,またどこから取り寄せたのか想像もつかない怪しげな海外のお菓子やおもちゃ
7438,7443,小さな楽器なんかを頻繁に職場に持ってきてみんなで喧嘩していたのもいい思い出です
7443,7446,私には今の仕事と多少のアルバイト経験くらいしかありませんが
7446,7450,どんな仕事においてもこいつの役に立ちてえと思える上司との出会いは
7450,7454,モチベーションや成長に大きく影響を及ぼすと思います
7454,7458,そして裏を返す場合ずれ自分がそんな存在にならなくてはいけません
7458,7462,そう考えると私はまだリーダーの影すら踏めてないなぁと痛感しつつ
7462,7468,誰が相手でも決して引かない黒いスーツの大きな背中を思い出すのです
7468,7471,というお便りいただきました
7471,7473,ドラマ?
7474,7476,実在?
7476,7481,凄すぎない?いやかっこよすぎるな 何もかもがかっこいい
7481,7485,エピソード何もかもがかっこいいな
7485,7488,ドラマ?映画化決定した?
7488,7492,ゼロがねめちゃめちゃかっこよかったですね
7492,7498,誰がいい? 香川さん 香川照之
7498,7503,あのー全然ちょっと話が変わっちゃうんだけど香川照之さんってめちゃめちゃ虫好きじゃん
7503,7510,であのちょっと前にやってた 科学かどっかでやってたねあの昆虫
7510,7515,博の 待ってね昆虫博ってあるよね
7515,7519,確か のあの
7519,7524,ポスターに 真ん中にドーンっていらっしゃったような気がするんだよね
7524,7527,そう なんかすごいお好きみたい
7527,7532,婚活しようぜって書いてる あの昆虫の子なんだけど
7532,7538,あそうそう東大卒でね 鎌切り好きなんだ
7540,7545,めちゃめちゃいいよねすごいなんかチャーミングで
7546,7553,なんかこれね特別展昆虫私は行けなかったんですけど 2018年結構前だわ
7553,7557,なんか行けなかったんだけどめちゃめちゃ面白そうだなーって覚えがある
7557,7564,なんかまだ距離的にちょっと 遠かったんだけど覚えてないですけど
7564,7574,ねなんかすごいねあの香川さんのこのポスターを見ただけでその香川さんのねあの好感度が異常に爆上がりしました
7576,7583,これなんだっけ確かにね鎌切りのなんかやつ着てるの見たことあるな なんで見たんだっけ鎌切り
7583,7588,鎌切り先生ってのがあるわ
7588,7590,この
7591,7595,この画像だけなんか見たことある確かに
7597,7610,いいですよねなんかこんなにねあの素晴らしい俳優さんでなおかつそのユーモアとか自分のね あの趣味というか好きなものを突き詰めていく姿勢は非常に素敵ですねかっこいいなぁ
7610,7613,なんか あれ
7613,7618,あの 官僚ってさ
7618,7622,額没みたいなやつある なんかあの
7623,7629,官僚になるときってあの国家公務員 3種みたいなやつ取る
7629,7634,ちょっと定かではないんですけど 国家公務員の
7634,7641,3種 官僚
7641,7647,なんかそれであの めちゃめちゃも東大生しかおらんみたいな話を
7647,7661,あの聞いたことがありますねなんかあの学校その出身大学みたいな一覧 みたいな見るとマジでその99.9%東大であの兄弟が一人いるかいないかみたいな
7661,7666,あ一種か一種だけ一種
7667,7675,なんかそのなんか難しいテストをとなんか受かったけど結局どのなんか象徴にもかんなかったなぁ みたいな
7675,7681,あの知人がいたんでなんかうっすらその話だけ覚えてるんだけど
7681,7689,一種か ということでねあの非常になんか1今回本当めちゃめちゃねあの素敵な歌いでたくさんあり
7689,7697,ましたしいろんな世界を見られたなぁと思って 読んでたのも楽しかったし配信中でね皆さんにいろんなコメントでいろいろ教えて
7697,7703,いただくのはめちゃめちゃ楽しかったです ありがとうございましたまたやりたいですねこれ
7707,7711,あ市が一番偉いのか
7713,7718,いやだから本当になんかあの いろんな方がね
7718,7723,配信見てくださっていろんな方がそのラジオにね あの時間割いて
7723,7730,あのテキストを送ってくださってるんだなぁと思うと本当にありがたいですしコメントもね エアータイムで見てくださっている方もアーカイブで見てくださっている方も
7730,7737,いつも本当にありがとうございます まあちょっとのまあに時間を超えたんだけど最初
7737,7743,マジで朝までかなと思ったので それで言うと良かったです
7743,7753,いやーということでね 本当はもっとたくさんねあのいろいろご紹介したいお便りがたくさんあったんですけども
7753,7758,またあの 数ヶ月後にねやりたいと思うので
7758,7766,もし気が向いたらまた送っていただけたら幸いになるかな ゴーヒロミが忘れられない
7766,7770,9999ね
7770,7776,来週何にしようかななんかそろそろなんか夏っぽい
7776,7780,夏っぽい あのー
7780,7786,お題お題というかそのメールテーマをやりたいなと思うんですけど週替わりで
7786,7792,めっちゃ楽しかった歌えるくれたみんなの仕事にビッグ感謝いや本当にビッグ感謝 マジで面白かったです
7792,7797,なんで 夏定期的にその季節
7797,7803,のなんか妄想する 架空の夏の思い出を語るみたいな
7803,7806,去年もやったんですけど
7806,7809,あるし どうしようかな
7809,7814,なんか 配信の終わりで決めればいいのにねって
7814,7818,52回目にして思ったんだよね
7818,7827,階段系いいですね そうしようかな
7827,7831,なんか 何かにまつわる階段
7831,7836,がいいなぁ その辺りちょっと考えておきます
7837,7844,なんであの来週はちょっとねあの怖い感じの配信にしようかなって思います
7844,7852,でもしねあの怪我を受けたら是非あのフォームからお便りいただけると私はとても楽しいです
7852,7859,高評価チャンネル登録ツイッターのフォローよろしくお願いします ありがとうございます助かります完全に忘れてたんで
7859,7867,でえっと明日はね皆さんから こちらもご協力いただいたあの人生における必修ゲーム
7867,7873,の あの話をしたいなと思ってますまあゲームプレイするのではなくて
7873,7881,こういうおすすめをもらってましたよみたいな感じのまとめですね 朝の10時ぐらいからなんかスケジュール入れてたと思います
7881,7889,ねえ来週週明けはですね 月曜日に祝日の日に昼から泉さんのチャンネルで
