start_s,end_s,text
2781,2783,なんかで戦えないかな
2783,2785,なんか罠とかかけたいな
2785,2787,あのー何でしたっけ
2787,2789,ひたすら罠かけ続けるゲーム
2789,2791,あるじゃないですか
2791,2793,あのなんだっけ陰楼か
2793,2795,あのシャドウの影に老爺の楼で
2795,2797,陰楼っていうゲームがあって
2797,2799,それはあのー
2799,2801,どこだったっけ
2801,2803,光栄手雲とか出してるんだったかな
2803,2805,なんかあのすごい
2805,2807,可愛い女の子が
2807,2809,あの城を
2809,2811,攻められてくるんじゃ敵
2811,2813,敵が攻めてくるんじゃ城に
2813,2815,でそこの城の中に
2815,2817,罠をめちゃくちゃ張り巡らして
2817,2819,三角木馬とかに乗せ
2819,2821,たりとかして
2821,2823,追い出すっていう
2823,2825,あれやりたいですね
2825,2827,あれできます魔王城に
2827,2829,めっちゃトラップ仕掛けよう
2829,2831,そう
2831,2833,人が死ぬピタゴラスイッチ
2833,2835,です
2835,2837,近接
2837,2839,近接戦闘ですか
2839,2841,弱そうだなでも
2841,2843,FF14でも銀雄詩人
2843,2845,なんですよね遠くからね
2845,2847,弓でぴょんぴょんぴょんぴょんしてるのが好きなんだよな
2847,2849,うん
2849,2851,ということでトラップが
2851,2853,銀雄詩人がいいかな
2853,2855,近接でもいいけど
2855,2857,負けそうなしな
2857,2859,ということでね
2859,2861,ちょっと魔王
2861,2863,軍の一角として
2863,2865,頑張りたいと思います
2865,2867,では
2867,2869,こちらがね最後の
2869,2871,予言の書
2871,2873,ホーライドールさんからの
2873,2875,支援ユニット予言の書
2875,2877,龍ヶ崎凜
2877,2879,初配信直後に
2879,2881,コネクト4対決を申し込み
2881,2883,無事6連敗
2883,2885,3回勝負に持ち込み
2885,2887,見事18連敗
2887,2889,というね予言が来てました
2889,2891,これは本当にならんですかね
2891,2893,シュガーリリックの龍ヶ崎凜さん
2893,2895,といえばね
2895,2897,コネクト4最弱で有名ですけれども
2897,2899,どうでしょうね
2899,2901,新人さんのコネクト4
2901,2903,パワーがまだ未知数ですからね
2903,2905,なんか
2905,2907,なんだろうな
2907,2909,凜さんがツイッターで
2909,2911,言ってたんですけど赤はバカなんじゃないか
2911,2913,っていうねちょっと暴論
2913,2915,に聞こえてしまうかもしれない
2915,2917,赤い方がいたら本当に申し訳ないんですけど
2917,2919,赤はバカの傾向が
2919,2921,強いというですね
2921,2923,統計も多分ねあるんですよね
2923,2925,フハハハハハハ
2925,2927,赤
2927,2929,バカ勝ちっていうね
2929,2931,なんなんですかね
2931,2933,なんか偏見が
2933,2935,ありますよね果たしてそんなこと
2935,2937,ないと思うんですけれども
2937,2939,そういうそのポジションの問題なのかな
2939,2941,カラーイメージってやっぱ
2941,2943,強いですからねそう
2943,2945,フハハハハハハ
2945,2947,ね
2947,2949,ということでねあの
2949,2951,いやでもね実際そうなの
2951,2953,そうバカじゃない赤が
2953,2955,たくさんいるからね
2955,2957,なんか結構他
2957,2959,でもなんだろう
2959,2961,七深円句なんだから
2961,2963,バカは一人はいるはずっていうね
2963,2965,期待を込めた投稿があるんですけど
2965,2967,やっぱなんだろう皆さん
2967,2969,その学力テスト
2969,2971,みたいな企画ねるちゃんもね
2971,2973,やってますけどやっぱ
2973,2975,お好きなのかなっていうね
2975,2977,フフフフフフ
2977,2979,コナンみやとかもね
2979,2981,学力を試してみたいな
2981,2983,戦いて強いやつとみたいなこと
2983,2985,言ってた時期もね
2985,2987,あったんでそう
2987,2989,パトナーさんはピンク
2989,2991,赤くさんオレンジですからね
2991,2993,って考えるとね
2993,2995,赤は
2995,2997,フフフフ
2997,2999,全員賢ければそれはそれで面白い
2999,3001,ちょっと未知数ですけどね
3001,3003,ただなんか
3003,3005,知識があることと頭がいい
3005,3007,っていうのは別なんでね
3007,3009,やっぱり
3009,3011,頭空っぽの方が夢詰め込めるんで
3011,3013,ちょっとそれとこれとは
3013,3015,また別だなって最近遠見に思いますね
3015,3017,うん
3017,3019,ということで心理と予言の書
3019,3021,こんな感じでした
3021,3023,24日の9時からの初配信
3023,3025,もぜひ楽しみに
3025,3027,一緒に見ましょうということで
3027,3029,こちらちょっと一旦
3029,3031,畳ませていただいて
3031,3033,フフフフフ
3033,3035,ねドラゴンボールね
3035,3037,ドラゴンボール本編は見てないけど
3037,3039,歌だけ知ってるの
3039,3041,次最後の企画ですね
3043,3045,えー
3045,3047,重い重いのにあと8分
3047,3049,しかないけど結婚って
3049,3051,何ってね
3051,3053,テーマで
3053,3055,話していくんですけど今から
3055,3057,あ重っ
3057,3059,なんだ結婚って
3059,3061,うんはいということで
3061,3063,2時前にもう3コーナー目
3063,3065,ですこれが最後のコーナーなのでね
3065,3067,まあ
3067,3069,いいペースなのかな
3069,3071,いいペースっちゃいいペースうん
3073,3075,いやこのね
3075,3077,配信でね
3077,3079,1回の配信で結婚について語り明かすのは
3079,3081,まあ無理だと思うんですけど
3081,3083,とりあえずね来週の
3083,3085,あの
3085,3087,ガチ婚活配信に向けての素地を固めて
3087,3089,おきたいなっていう
3089,3091,そういう意図のコーナーになってます
3091,3093,うん
3093,3095,では早速まず1つ目
3095,3097,の
3097,3099,結婚相手に求めるあれこれ
3099,3101,についてねご紹介
3101,3103,させてくださいお水飲みます
3103,3105,ふふふ
3105,3107,うん
3109,3111,えー
3111,3113,わすおさんの
3113,3115,結婚相手に求める
3115,3117,あれこれ
3117,3119,やばいジジイみたいで自分でも
3119,3121,嫌なんですが箸で
3121,3123,魚をきれいに食べられる人がいいです
3123,3125,あと虫を一人で退治できる
3125,3127,人なんというか総合的な
3127,3129,生活力が気になっているんだ
3129,3131,と思います逆にお2人は
3131,3133,こういうことを女性に求める
3133,3135,男性に対してどう思いますか
3135,3137,という
3137,3139,お便りいただいてました
3139,3141,あの2人っていうのはちょっと怖いですね
3141,3143,もう1人誰か見えてるかもしれないな
3143,3145,ふふふふ
3145,3147,お2人はどう思いますか
3147,3149,ちょっとあの私がね
3149,3151,ややこしい書き方をしてしまったかもしれないですけど
3151,3153,来週のね企画に
3153,3155,コナミアの婚活企画に
3155,3157,使うご意見をいただく
3157,3159,っていうコーナーなので
3159,3161,おそらく大多数の方には
3161,3163,今配信上は1人で
3163,3165,見えているといいなと思います
3165,3167,はいでね
3167,3169,箸で
3169,3171,魚をきれいに食べられる人これ
3171,3173,わかりますうん
3173,3175,やばいジジイ
3175,3177,みたいで自分でも嫌って書かれてるんですけど
3177,3179,それをねやっぱそうじゃなきゃ
3179,3181,ダメとかねあの
3181,3183,逆にできない人に対して
3183,3185,マイナスな感情を抱かなければ全然
3185,3187,いいんじゃないですか私もあの
3187,3189,箸できれいにお魚食べられる
3189,3191,女性好きですよ女性
3191,3193,に限らずねうん
3193,3195,いいですよね
3195,3197,でねこれもう一個ご紹介させてほしいんですけど
3199,3201,マヨコーンが
3201,3203,主子さんの結婚相手に求めるあれこれ
3203,3205,自分自身の字が
3205,3207,丸文字でコンプレックス気味なので
3207,3209,字がきれいな方がいいなと思います
3209,3211,小さい頃自分の名前をとても
3211,3213,きれいな字で母に書いてもらって
3213,3215,すごく嬉しい気持ちになった思い出もあるので
3215,3217,一人の時間を大切にしてくれる
3217,3219,と悩みましたがきれいな文字を
3219,3221,書くことができるを思い出補正の
3221,3223,文上位と
3223,3225,みなし結婚相手に求めるものとさせていただきます
3225,3227,っていうことよりも
3227,3229,いただいてましたうん
3229,3231,字がきれいな子
3231,3233,私も好き
3233,3235,うん
3235,3237,字がきれいで
3237,3239,魚をきれいにお箸で食べられる子
3239,3241,めっちゃ良くない
3241,3243,私もやばい
3243,3245,じじだと思われちゃうのかな
3245,3247,でもそれができない方に対して
3247,3249,なんていうわけじゃなくて
3249,3251,それがなんか
3251,3253,そつの具こなせてる方に対して
3253,3255,すごいもううわー好きってなっちゃう
3255,3257,っていう
3257,3259,ね
3259,3261,そうなんでね
3261,3263,要はねるちゃんかなねるちゃんって字も
3263,3265,うまいし料理もできるし絶対お魚
3265,3267,きれいに食べれそう見たことないけど
3267,3269,うん
3269,3271,私はねあのお魚に関しては
3271,3273,結構骨まで食べる派なんでね
3273,3275,そのまま食べちゃうこと多いんですけど
3275,3277,骨取らずに
3277,3279,最近なんかねあの魚の小骨か
3279,3281,エビフライのエビのしっぽかなんかを
3281,3283,食べて
3283,3285,なんか
3285,3287,期間刑に穴が開いて
3287,3289,病院に運ばれたっていう
3289,3291,ですねニュースを見てから
3291,3293,食べるのやめようと思って
3293,3295,食べるのやめてます
3295,3297,うん皆さんも気をつけてください
3297,3299,私はね骨も食べれば
3299,3301,カルシウムになると思ってね
3301,3303,毒を食らわば皿までの気持ちで
3303,3305,今まで食べてたんですけども普通に
3305,3307,危険らしいですうんやりましょう
3307,3309,はいエビ
3309,3311,のしっぽも食べちゃダメですって
3311,3313,ふふふふ
3313,3315,エビのしっぽと
3315,3317,骨も食べちゃダメです
3317,3319,うん
3319,3321,私ね顎の力にすごい
3321,3323,自信があるんですよ
3323,3325,あの結構ね
3325,3327,その学生
3327,3329,中学生高校生ぐらいの時に
3329,3331,氷を食べる癖があって
3331,3333,標色症っていうらしいんですけど
3333,3335,あのでね
3335,3337,めちゃくちゃ氷食べてたの
3337,3339,貧血だったんですけど
3339,3341,であの氷を
3341,3343,めちゃくちゃ食べてたせいで顎の
3343,3345,力が異常に発達したらしくて
3345,3347,ガラスのポップとかをね
3347,3349,あの
3349,3351,歯で割ったことがある顎の力で
3351,3353,うん
3353,3355,なぜか口の中は
3355,3357,全然大丈夫だったんですけど
3357,3359,無傷だったんだけど
3359,3361,あのガラスのコップで水飲んでる時に
3361,3363,中の氷そのまま食べようとして
3363,3365,そのまま一気にガラスまで噛み砕いたことがあるんですよね
3365,3367,そう
3367,3369,だからねすごい自信がある
3369,3371,顎の力に
3371,3373,ねワニかも
3373,3375,ふふふ
3375,3377,そう
3377,3379,ワニってねもし皆さんワニに襲われた時は
3379,3381,あの
3381,3383,これを思い出してもらえたらと思うんですけど
3383,3385,ワニってこう
3385,3387,何かを噛み砕こうという力は
3387,3389,すごい強いんですけど逆に
3389,3391,あの口を開ける時の力が
3391,3393,30キロぐらいしか確かないんですよね
3393,3395,うん
3395,3397,であのこう
3397,3399,口を閉じる時の力は
3399,3401,強いけど開ける時はすごい弱いから
3401,3403,口を閉じた瞬間に
3403,3405,あの
3405,3407,口の上に乗っちゃえばいいです
3407,3409,ワニの上に
3409,3411,うんなんで
3411,3413,30キロ以上ある方は
3413,3415,ワニの口の上に乗ってくださいね
3415,3417,ということで今日の学びとしては
3417,3419,まず
3419,3421,エビの尻尾を食べてはいけない
3421,3423,魚の骨も食べてはいけない
3423,3425,ワニに襲われたら口の上に乗る
3425,3427,この3点を覚えて帰ってください
3427,3429,うん
3429,3431,えーでは次ですね
3431,3433,ふふふふ
3433,3435,えー特命の方からの
3435,3437,結婚相手に求める
3437,3439,あれこれ
3439,3441,パスタの茹で汁でレトルトのパスタソースを
3441,3443,温める人は嫌です
3443,3445,あとシャンプーのボトルが少なくなってきたら
3445,3447,水足す人も嫌です
3447,3449,ね
3449,3451,いただいてました
3451,3453,どういうことですかこれは
3453,3455,パスタの茹で汁でレトルトのパスタソースを
3455,3457,温めるというのは
3457,3459,どういうことですか
3459,3461,パスタを茹でたことがなくて分かりません
3461,3463,ちょっと教えてください
3463,3465,ふふふふ
3465,3467,パスタを茹で汁で
3467,3469,レトルトで温めるというのは
3469,3471,どういう状態ですか
3471,3473,湯煎というやつですか
3473,3475,うーん
3475,3477,良くない?別に良くない?
3477,3479,麺とソース一緒に茹でてる
3479,3481,麺とソース一緒に茹でてるのは
3481,3483,やばくない?
3483,3485,え?それはやばくないのか
3485,3487,え?溶けないのか
3487,3489,ソースの袋が
3489,3491,パスタ茹でた後に
3491,3493,その
3493,3495,お湯で温めるってこと?
3495,3497,それは別になんか
3497,3499,良くない?え?だめなの?
3499,3501,何がだめなの?バチーノ?
3501,3503,え?分からん
3503,3505,分からんけど
3505,3507,多分パスタを作らないから
3507,3509,多分大丈夫だと思う
3509,3511,ふふふふ
3511,3513,袋ごとだったらいける?
3513,3515,なんかでもパスタのその袋と
3515,3517,麺を一緒に茹でるのは
3517,3519,マジですごいですね
3519,3521,究極の時短って感じ
3521,3523,はぁー
3523,3525,シャンプーのボトル少なくなってきたら
3525,3527,水足す人もいや
3527,3529,これはどういうメカニズムですかね
3529,3531,なんか雑菌的なものが
3531,3533,気になるってことかな
3533,3535,ん?
3535,3537,シャンプーのボトルが
3537,3539,あ、継ぎ足せってこと?
3539,3541,シャンプーをちゃんと詰め替え
3541,3543,をちゃんとしてほしいってこと?
3543,3545,うん
3545,3551,ちょっとお水飲みます
3551,3553,なんか
3553,3555,あのー私
3555,3557,実家で麦茶を
3557,3559,作ってるんですけど
3559,3561,冷蔵庫にあのパックで
3561,3563,お水を入れとくと麦茶になってるっていう
3563,3565,魔法のパックあるじゃないですか
3565,3567,あれ作ってるたんですけど
3567,3569,あのね
3569,3571,ちょっと残して
3571,3573,いっぱい足りないじゃんっていう量で
3573,3575,作るのがね思いやりにかける
3575,3577,行為だっていうのをね
3577,3579,ことごとく学んできたんですよね
3579,3581,幼い頃より
3581,3583,そう
3583,3585,これは絶対人間としてやっちゃいけないこと
3585,3587,なんですよ
3587,3589,次絶対いっぱい分足りないのに
3589,3591,ちょっとだけ残してさ
3591,3593,さも取り替えなくていいと思ってました
3593,3595,みたいなそしらんの顔で
3595,3597,残しておくのは本当重罪
3597,3599,なんでね
3599,3601,これがすごいいけないってことを学んだので
3601,3603,爪替えてほしいって意味だったらすごいわかる
3603,3605,うん
3605,3607,ね
3607,3609,トイレットペーパー10cm残すとかねこれもよくないこと
3609,3611,そうスーパーギルティです
3611,3613,はい
3613,3615,ということでね
3615,3617,こちら爪替えはちゃんとしましょう
3617,3619,ということだと解釈しましたので
3619,3621,全面的に同意です
3621,3623,うん
3623,3625,私もねちょっと前まで
3625,3627,ねるちゃんと同じシャンプーを使ってたんですけど
3627,3629,ねるちゃんがあの
3629,3631,ねるちゃんみたいなシャンプー高いシャンプーになってしまったので
3631,3633,さすがに手が届かない
3633,3635,あの息までいってしまったんで
3635,3637,うん私はね
3637,3639,ヤマトヨリさんと同じシャンプーをこれからも使っていきたいと思います
3639,3641,うん
3641,3643,えーでは次
3643,3645,れにさんの結婚相手に求める
3645,3647,あれこれ
3647,3649,はいえるかこさんこんばんは
3649,3651,こんばんは
3651,3653,僕がもし結婚してもらえるなら結婚するなら
3653,3655,相手に求める条件はただ一つです
3655,3657,一人目の子供の名前を
3657,3659,千早にしてくれる
3659,3661,ということです
3661,3663,アイドルマスターにはまって
3663,3665,千早ピーになってはや15年
3665,3667,もはやあと行き着く先は
3667,3669,ここしかねえと思っていますので
3669,3671,これ以外には思いつきません
3671,3673,ってことですね
3673,3675,うん
3675,3677,千早だったらね男性でもいけますもんね
3677,3679,男の子が生まれても
3679,3681,女の子が生まれても
3681,3683,千早
3683,3685,ふふふふ
3685,3687,なんか
3687,3689,あれじゃないですかでも
3689,3691,あのなんかね
3691,3693,いつだったかな
3693,3695,中小学校か
3695,3697,中学校の時に
3697,3699,あのなんかユリアちゃん
3699,3701,っていう
3701,3703,同級生がいて
3703,3705,ユリアちゃんすごいかわいい名前だね
3705,3707,なんでユリアちゃんなのって聞いたら
3707,3709,あのおじいちゃんが
3709,3711,コクトの剣が好きで
3711,3713,みたいな
3713,3715,でユリアになったの
3715,3717,って言ってた
3717,3719,コクトの剣だよねユリアが出てくるの
3719,3721,そう
3721,3723,ふふふふ
3723,3725,だからもしユリアちゃんが男の子に生まれてたら剣士郎だったかもね
3725,3727,ふふふふ
3727,3729,ふふふふ
3729,3731,そう
3731,3733,ユリアでした
3733,3735,なんかモテそうだよね
3735,3737,ユリアさんってめちゃくちゃモテてませんでしたっけ
3737,3739,コクトの剣の中で
3739,3741,あの私のねうるおぼいコクトの剣
3741,3743,知識だととにかく
3743,3745,コクトの剣に出てくる登場人物の男性は
3745,3747,みんなユリアが好きっていう印象
3747,3749,なんですけど
3749,3751,私はねあの
3751,3753,皆さんに
3753,3755,確かラジオで教えてもらったんですけど
3755,3757,とにかく恋愛関係で困ったらラオーの名言を
3757,3759,言っておけばOK
3759,3761,万事解決っていうね
3761,3763,すごい武器をいただいてるんで
3763,3765,ラオーがいいかもな
3765,3767,うん
3767,3769,ラオー
3769,3771,ラオーか
3771,3773,オウララオー
3773,3775,あそういえば
3775,3777,この間名前でアナグラムしたらね
3777,3779,私あのラオーカオルコっていう
3779,3781,名前ができるんですよ
3781,3783,オウラルがアナグラムすると
3783,3785,良くないですかラオーカオルコ
3785,3787,うん
3787,3789,このラオーの横におればよい
3789,3791,死ぬ時みたいなやつね
3791,3793,ふふふふ
3793,3795,ねということで
3795,3797,ちはや
3797,3799,あのー伴侶の方がね
3799,3801,OKっていうことであればちはやすごい素敵な
3801,3803,名前だしいいんじゃないかなと思いますけど
3803,3805,あの自分の
3805,3807,そのお子さんにね
3807,3809,あのー私の名前の由来って
3809,3811,何?って聞かれた時に
3811,3813,どうかなっていうところ
3813,3815,かなあとは
3815,3817,なんかもっともらしいね
3817,3819,なんかそのー自覚がーとか
3819,3821,こういう由来があって
3821,3823,こんな
3823,3825,ちはやぶるから
3825,3827,ちはやぶる神よも聞かず
3827,3829,立田川から紅に水くくるとは
3829,3831,から取ったんだよっていうね
3831,3833,すごいあの素敵な
3833,3835,由来とかが後からでもつけられるんだったら
3835,3837,いいと思いますけどねうん
3837,3839,ふふふふ
3839,3841,伴侶キサラギだったらどうしようどうする
3841,3843,えてかキサラギさんから探しちゃう?
3843,3845,もう
3845,3847,キサラギさんから探しちゃわない?
3847,3849,ふふふふ
3849,3851,ねということで
3851,3853,えーこちらねあのちはやさん
3853,3855,れにさんのねお子さんが
3855,3857,ちはやさんになったらぜひまたラジオで
3857,3859,教えていただけたらと思います
3859,3861,では次
3861,3863,にゅるりら
3863,3865,仮面さんからの結婚相手に求める
3865,3867,あれこれ
3867,3869,塩が5種類あっても怒らない人
3869,3871,ちなみに砂糖が3袋あった時は
3871,3873,ガチバトルになりました
3873,3875,甘い生活なんてなかった
3875,3877,っていうお便りいただいてますけど
3877,3879,塩が5種類あっても
3879,3881,怒らない?
3881,3883,どういうこと?
3883,3885,え?砂糖が3種類あった時にガチで喧嘩になった?
3885,3887,え?
3887,3889,砂糖が3種類あって怒ることってあります?
3889,3891,大きれば
3891,3893,あ
3893,3895,ミニマリストかな
3895,3897,料理人
3897,3899,えー塩って使い分けるんだ
3899,3901,そうなんですか
3901,3903,えこれマジョリティ?
3903,3905,塩ってみんな使い分けてるんですか
3905,3907,え?なんか
3907,3909,お清め用とか
3909,3911,4隅に
3911,3913,森塩と?
3913,3915,みたいな
3915,3917,あっ抹茶塩と?
3917,3919,みたいな
3919,3921,私あのーテンプラは
3921,3923,抹茶塩が一番好きなんでね
3923,3925,なんかこういうこと言うと
3925,3927,なんかすごいブルジョア人みたいな感じで
3927,3929,受け取られるかもしれないですけどね
3929,3931,あのーなんか
3931,3933,なんだろテンプラのね
3933,3935,なんだろ
3935,3937,衣がね
3937,3939,衣に浸って
3939,3941,ふにゃふにゃになるのがちょっと許せないんですよね
3941,3943,とにかくもうカリッカリの醤だれ食べたい
3943,3945,そうすると
3945,3947,そういいテンプラさんに行くと
3947,3949,いろんな塩を出してくれるんですけど
3949,3951,でね小さい頃にね
3951,3953,抹茶塩が出てくる
3953,3955,お店に連れてってもらって
3955,3957,これもうマジ革命だなと思って
3957,3959,テンプラの革命やと思って
3959,3961,うん
3961,3963,それ以来ほぼ
3963,3965,"その以降に1,2回しか食べたことないですけど"
3965,3967,テンプラなんてね
3967,3969,あれやっぱ思い出発生なのかな
3969,3971,すごい美味しかったな
3971,3973,うん
3973,3975,あ塩分控えめの塩を使ってる
3975,3977,わさび塩美味しい
3977,3979,そう鳥富士を
3979,3981,またオシャレな塩があるわ
3981,3983,あはははは
3985,3987,塩専門店いいな
3987,3989,あでもね私
3989,3991,あのー
3991,3993,紅茶に一時期ハマってた時期があって
3993,3995,紅茶の後にコーヒーに
3995,3997,凝り出したんですけど
3997,3999,その時にね何故か分からないけど
3999,4001,紅茶に使ってた茶器を全部
4001,4003,処分しちゃったんですよね
4003,4005,うん
4005,4007,なんでと思う私もなんでと思う
4007,4009,あのティーコジとか
4009,4011,あとティーポットとか
4011,4013,あのティーカップとか全部揃いで
4013,4015,持ってたんですけど
4015,4017,全部処分してしまって
4017,4019,その時に
4019,4021,お砂糖確かに2種類ぐらい
4021,4023,持ってた気がする
4023,4025,普通の白いやつと茶色いやつ
4025,4027,うん
4027,4029,これ持ってましたね
4029,4031,紅茶に入れるように
4031,4033,なんか1杯目はストレートで飲んで
4033,4035,2杯目砂糖入れて飲んで
4035,4037,3杯目ミルクと
4037,4039,砂糖入れて飲んでみたいな感じでね
4039,4041,楽しんで
4041,4043,いた時期もあったんですけど
4043,4045,今となってはなんで捨ててしまったのかな
4045,4047,なんか
4047,4049,なんでしょうね
4049,4051,そういう謎の潔さ
4051,4053,後ほど後悔するやつ
4053,4055,私はもうコーヒーに生きていくって決めたら
4055,4057,紅茶のセットを全部捨ててしまうっていうね
4057,4059,今すごい反省してますね
4059,4061,ひつまぶしみたいな楽しみ方する?
4061,4063,ひつまぶしね
4063,4065,そう最初は
4065,4067,あのひつまぶしって
4067,4069,最初は普通に
4069,4071,そのまま食べて
4071,4073,次薬味ちょっとかけて食べて
4073,4075,最後の一前をね
4075,4077,お茶漬けみたいな感じで食べるのが
