start_s,end_s,text
1451,1453,作文化やってね
1453,1456,可愛らしいなあと思いました
1456,1458,はいということでね
1458,1463,次は新ユニット予言の章に行きたいと思います
1463,1465,あのー
1465,1467,まあちょっとね
1467,1469,配信を1時間
1469,1471,1時間ちょっとで収めるにあたって
1471,1473,コーナーをね今回3つにしてみました
1473,1475,今までやっぱ4つコーナーがあるから
1475,1478,あの無謀だったんじゃないかってね
1478,1481,はい今回3つにしてみましたので
1481,1484,次のコーナーに行きたいと思います
1487,1490,あ間違えちゃった
1490,1493,えーこれだ
1493,1496,新ユニット予言の章ということでね
1496,1498,えーこちら
1498,1500,あはははは
1500,1502,お気づきになりました
1502,1505,今回で26回目ぐらいなんですけどね
1505,1507,26回目にしようやく気づきました
1507,1509,4コーナーはちょっと多い
1509,1513,最初1コーナーは15分の計算で始まったけど
1513,1515,15分で終わるわけないからな
1515,1517,はいということで
1517,1519,こちら
1519,1522,えーひよこのダブルピースというですね
1522,1524,7thincの新ユニットが
1524,1526,10月24日9時から
1526,1528,配信初配信がね
1528,1532,えー通りセイさんのチャンネルでございますが
1532,1535,こちらの新ユニットについて
1535,1539,えー出る前だったらいくらでも何でも言っていいというですね
1539,1541,えー勝手な解釈のもと
1541,1543,えー皆さんからどんなユニットなのか
1543,1545,どんな子達なのかというのを
1545,1547,えー想像で送ってもらいました
1547,1549,うん
1549,1551,はいということでね
1551,1553,あくまでもダブルピースね
1553,1555,ひよダブですからね
1555,1557,えーではちょっと早速お便り読んでいきましょう
1557,1559,うん
1559,1561,えー
1561,1565,mubeibeibeiさんのひよこのダブルピース
1565,1567,予言の書
1567,1571,獣人族と悪魔族に故郷の村を焼かれた
1571,1573,壮絶な幼少期を送った彼女らは
1573,1577,獣人族と悪魔族に変質的な執着を持つようになり
1577,1579,冒険者となる
1579,1583,獣人族と悪魔族が賑やかに暮らすと消えた彼女らは
1583,1585,超時空魔界都市
1585,1587,赤羽根に降り立つ
1587,1589,うん
1589,1593,これはちょっと波乱の予感ですね
1593,1595,獣人族ね
1595,1597,ちょっともう心当たりがあるんですけど
1597,1599,悪魔もね
1599,1601,いっぱいいますかナナシンクって
1601,1605,ナナシンクって今んとこ人が少ないんですよね
1605,1607,人が
1607,1609,人?
1609,1611,人?人?人?カノンさんか
1611,1613,Vアパの
1613,1615,奏カノンさんは人ですね
1615,1617,あと
1617,1619,人いたっけ
1619,1621,人あんまいない あーアンコさんもそうだ
1621,1623,アンコさんも人ですね
1623,1625,二人くらいしかいないんですよね
1625,1627,フフフフフフ
1627,1631,あとはもう悪魔か獣人かって感じなのでナナシンクは
1631,1633,だから
1633,1635,これはですね
1635,1637,ひよこのダブルピースvs
1637,1641,ナナシンク-カノンさんとアンコさん
1641,1643,カノンさんとアンコさんスイスですね
1643,1645,中立地帯になるんじゃないですか
1645,1651,ここで戦いを始めるということになるんじゃないかなと思います
1653,1655,ワットさんも自称人?
1655,1657,あーじゃあ人なのかな
1657,1659,フフフフフ
1661,1663,じゃあギリ人ってことにするか
1665,1667,はい
1667,1669,次の
1669,1671,予言の書いきましょうか
1671,1673,メジャージョンスミスさんの
1673,1675,日予言の書
1703,1713,バンダイ
1713,1715,バンダイのやつね
1715,1717,フフフフ
1717,1719,だいたいあの日曜日の朝やってる
1719,1721,あのー
1721,1723,男児女人向けのねアニメっていうのは
1723,1725,基本的にそのおもちゃの展開
1725,1727,グッズの展開も
1727,1729,織り込み済みで
1729,1731,放送が始まるんでね
1731,1733,うん
1733,1735,これはいいですよグッズがね
1735,1737,もう目に浮かぶようですもんね
1737,1739,クロスピースの真ん中に
1739,1741,ねなんかいろんな
1741,1743,弾とか入れたりとかしてね
1743,1745,カードとかスラッシュさせたらいいんじゃないですか
1745,1747,なんかでなんか服装変えられるとかね
1747,1749,うん
1749,1751,いいな
1751,1753,いっぱいなんか出そうグッズが
1753,1755,フフフフフ
1755,1757,マネタイズもバッチリ
1757,1759,うん
1759,1761,アニメかけて
1761,1763,最近メディアミックスという言葉も
1763,1765,とんとん聞きませんけれどもね
1765,1767,なんかアプリとかも出しちゃいますか
1767,1769,アニメとアプリと
1769,1771,グッズ展開
1771,1773,うん
1773,1775,いいな
1775,1777,変身とかしちゃおうかみんな
1777,1779,6人でね
1779,1781,合体しちゃおうかなんか
1781,1783,日曜空のクロスピースで
1783,1785,ねトランスフォーマーみたいな感じで
1785,1787,泉さんの財布が軽くなる
1787,1789,泉さんをなんか特別
1789,1791,スペシャルプロデューサーかなんかに
1791,1793,迎えて
1793,1795,ねいいかもしんない
1795,1797,名前がそもそもそしあげっぽい
1797,1799,確かにこれなんてそしあげみたいなこと
1799,1801,誰かツイートしてましたね
1801,1803,うん
1803,1805,ということで
1805,1807,合体していただくということで
1807,1809,次のお便り読んでいきたいと思いますね
1809,1811,CDモグモグクラブさんの
1811,1813,新ユニット予言の章
1813,1815,日曜クロの正体など
1815,1817,ねもちゃんの推しマークと髪色
1817,1819,髪色を見れば一目瞭然です
1819,1821,推しマークは
1821,1823,どこかで見たことがあるような黒い顔面
1823,1825,そして髪色は
1825,1827,青
1827,1829,そうねもちゃんはトーマスが
1829,1831,事故の衝撃で異世界転生した結果
1831,1833,人間の体を受肉した姿です
1833,1835,賢明なリスナーなら
1835,1837,お気づきだと思いますが
1837,1839,他のメンバーもソドー島の人面機関車
1839,1841,たちですその証拠に
1841,1843,イエイリーポポという名前はトーマスたち
1843,1845,機関車が彼らにとっての家である
1845,1847,機関庫に入っている様子から取られたものです
1847,1849,ここまで分かれば警戒することは
1849,1851,ただ一つ
1851,1853,トーマスたちはしばしば暴走し
1853,1855,結果として大事故を引き落とします
1855,1857,彼女たちもそうなる可能性は
1857,1859,ゼロではありません
1859,1861,そうならないために皆さんも心の中の
1861,1863,トップハムハット卿を
1863,1865,呼び起こしてみましょう
1865,1867,ねもちゃん
1867,1869,ねもちゃんっていうのがですね
1869,1871,右からね
1871,1873,画像右から3番目の
1873,1875,青いね
1875,1877,髪の毛の子がねもちゃんなんですけれども
1877,1879,ねもちゃんの
1879,1881,推しマークがね
1881,1883,黒い顔なんですね
1883,1885,こちらはもう確実に
1885,1887,やっぱりトーマスのメタが
1887,1889,つまり
1889,1891,みんな機関車
1891,1893,トーマスの偽人家ということでね
1893,1895,人じゃなかったですね機関車でした
1895,1897,森本レオを呼んでくれた
1897,1899,初配信
1899,1901,初配信ナレーション
1901,1903,森本レオさんかもしれないな
1903,1905,うん
1905,1907,トップハムハット卿ってあれですよね
1907,1909,車掌さんだっけ
1909,1911,なんかあのなんだろう
1911,1913,モーニングみたいなスーツ着てる方か
1913,1915,杖持ってる
1915,1917,ということで
1917,1919,もしかしたら機関車トーマス
1919,1921,始まるかもしれないですね
1921,1923,またなんか別の角度で朝を攻めますね
1923,1925,うん
1925,1927,トーマスって朝だっけ
1927,1929,もしかして
1929,1931,子供向け
1931,1933,子供向け配信
1933,1935,なのか
1935,1937,日朝
1937,1939,新しい
1939,1941,いいですね
1941,1943,VTuber子供向けVTuber
1943,1945,ってなかなか
1945,1947,何チャンネルか見たことあるような
1947,1949,気もしないでもないですけどね
1949,1951,うん
1951,1953,キッズ向けコンテンツ
1953,1955,あのなんか最近やっぱり
1955,1957,小さいお子さんとかって
1957,1959,めちゃくちゃデジタルネイティブで
1959,1961,なんか2歳とか3歳とかから
1961,1963,すごい
1963,1965,タブレットを駆使してね
1965,1967,むちゃくちゃYouTube見るっていう
1967,1969,なんかのニュースを見た
1969,1971,ばっかりなんで
1971,1973,これ穴がちょっと外れてないかもしれないですね
1973,1975,んふふふふ
1975,1977,アニマルとコラボできない?
1977,1979,そうかもしれない
1979,1981,うんそうかも
1981,1983,しばらくちょっと
1983,1985,コラボ禁止かもな
1985,1987,ふふふふ
1987,1989,ハニストさんは大丈夫じゃないですか
1989,1991,ハニストさんはあの
1991,1993,どうだろうな
1993,1995,配信自体はねすごく穏やかで
1995,1997,あの素敵なコラボ配信なども
1997,1999,多い印象なので
1999,2001,うんちょっとあの
2001,2003,谷間さえ隠してもらえたら全然
2003,2005,いけると思いますね
2005,2007,アニマルは多分ダメかな
2007,2009,はい
2009,2011,シュガーリリさんもちょっと
2011,2013,保湿が高すぎるかな
2013,2015,あの肌の部分をなんか
2015,2017,全部黒とかに色塗っちゃえば
2017,2019,多分いけるかもしれないですね
2019,2021,はいということで
2021,2023,まさかのね機関車
2023,2025,トーマスの擬人化ということで
2025,2027,楽しみですね発想が
2029,2031,発車が
2031,2033,あ
2033,2035,発車がね楽しみですね
2035,2037,えーでは次
2037,2039,笹大福さんの
2039,2041,新入りという予言の書
2041,2043,しすいききさんは
2043,2045,合コンや飲み会の席で自己紹介
2045,2047,をすると
2047,2049,えっ魔女タクと同じ名前なんだ
2049,2051,なんかモノマネやってよと
2051,2053,雑な無茶ぶりをされすぎてもはや
2053,2055,魔女タクが地雷なので話題に出さない
2055,2057,方がいい
2057,2059,ねうん
2059,2061,この一番左のね
2061,2063,紫の髪の毛の
2063,2065,ききさんはですね
2065,2067,名前がききでね確か誰かもう
2067,2069,すでに魔女タク
2069,2071,なんか私なんとかのジジイみたいな
2071,2073,リプライ送ってるの見ましたけど
2073,2075,ナシインク内でねうん
2075,2077,私パペットマスターの
2077,2079,ききこっちは黒猫のナシ
2079,2081,ってね黒猫のナシは
2081,2083,アニマルの運営さんなんでちょっと
2083,2085,困りますけれども持っていかれてしまうとね
2085,2087,あーん
2087,2089,困るまあ困りますね
2089,2091,うふふふふ
2091,2093,うんこれでもワンチャンありますね
2093,2095,ずーっとなんかきき
2095,2097,聞きネタでいじられすぎて
2097,2099,もううんざりみたいなことが本人は
2099,2101,あるかもしれませんけどね最初のうちは
2101,2103,まだ大丈夫じゃないですか
2103,2105,どうだろうなデビューしてから
2105,2107,2ヶ月くらいまではいいんじゃないかな
2107,2109,宅急便しても
2109,2111,うん
2111,2113,ニシンのパイ嫌いなのよね
2113,2115,でもニシンのパイの
2115,2117,元ネタになってる
2117,2119,スターゲイジーパイ
2119,2121,ってあるじゃないですかイギリスの京都料理の
2121,2123,あのパイにニシン刺さってるやつ
2123,2125,ニシン
2125,2127,魚がそのまま刺さってるの
2127,2129,どう考えたってこんな見た目
2129,2131,悪ふざけでしょっていう感じの見た目を
2131,2133,している
2133,2135,ニシンのパイね
2135,2137,これはね
2137,2139,嫌いでもいたしかたなし
2139,2141,って思う
2141,2143,魔女の宅急便見てると
2143,2145,見てない方はネタバレになっちゃうんですけど
2145,2147,もはや魔女の宅急便の
2147,2149,ネタバレなんて誰も気にしないと思うんで
2149,2151,言っちゃうんですけど
2151,2153,なんかそのキキ主人公の魔女っ子のキキがね
2153,2155,あのー
2155,2157,知り合ったおばあちゃんの依頼で一緒に
2157,2159,パイ作ってそのおばあちゃんの魔法か
2159,2161,なんかに届けに行くんですけど
2161,2163,その時にねなんかその
2163,2165,女の子がパイを受け取った女の子が
2165,2167,ニシンのパイ
2167,2169,私このパイ嫌いなのよねっていうことに
2169,2171,やっぱすごいね
2171,2173,ショックを受けるわけですよ小っちゃい
2173,2175,時の自分ピュアな
2177,2179,これねなんでそんなこと言うの
2179,2181,おばあちゃんとキキが一生懸命作ったのに
2181,2183,って思うんだけど
2183,2185,スターゲージいっぱい
2185,2187,ゲージいっぱい見たら
2187,2189,そりゃそうってなるんでね
2189,2191,皆さんもしまだ見たことない
2191,2193,いないと思いますけど
2193,2195,みんな飽きるほど見たと思いますけどねあのパイの画像
2195,2197,ね
2197,2199,イギリス料理のまずい原因は下味がないわよ
2199,2201,加熱すぎでパッサパサだから現地ではカレーが人気
2201,2203,あそうなんかこの話もね
2205,2207,前ちょっとしたかもしれないんですけど
2207,2209,イギリスの料理がまずくなっちゃったのって
2209,2211,なんか
2211,2213,はるか昔
2213,2215,イギリスにもその郷土料理みたいなもの
2215,2217,すごいちゃんとあって
2217,2219,すごいおいしい
2219,2221,郷土料理もいっぱいあったんだけど
2221,2223,なんかその
2223,2225,フランスに
2225,2227,戦争で勝ってフランス人の
2227,2229,シェフをめちゃくちゃ国に呼んだ
2229,2231,結果
2231,2233,フランス料理うめーってなってみんな
2233,2235,フランス料理しか食べなくなって
2235,2237,フランスのシェフが一気にいなくなっちゃった
2237,2239,あと誰もなんかあれ
2239,2241,俺たちは今まで何を食ってたんだ
2241,2243,みたいな感じになって一番おいしいのが
2243,2245,マクドナルドになっちゃったっていう
2245,2247,のがなんか
2247,2249,聞いたことありますけどねうん
2249,2251,本当かどうかわからないけど
2251,2253,ふふふふ
2253,2255,産業革命で伝統的な
2255,2257,家庭料理が壊滅した説も
2257,2259,聞いたことあるそう
2259,2261,であの
2261,2263,最近私ねあの
2263,2265,作業してる時に全然作業
2265,2267,に身が入らないんですけど
2267,2269,産業どうでしょうのね
2269,2271,あのヨーロッパ
2271,2273,ヨーロッパ制覇をね
2273,2275,ヨーロッパ21カ国完全
2275,2277,制覇のシリーズが最近ネットフリックス
2277,2279,に来たんですよ
2279,2281,でそれを見てるんですけど
2281,2283,まあおいしくなさそう
2283,2285,ヨーロッパのご飯
2285,2287,だいたい
2287,2289,ふふふふ
2289,2291,だいたいおいしくなさそううん
2291,2293,なんか
2293,2295,なんか麺とかもなんかすごい伸びてる感じが
2295,2297,もうあの画面越しにも伝わってくるし
2297,2299,なんかね
2299,2301,あの
2301,2303,べちゃってしてそう
2303,2305,うん見るからに
2305,2307,であの大泉さんが
2307,2309,うーんこれはまずいですね
2309,2311,って言ってる
2311,2313,ふふふふ
2313,2315,そうそうあとね
2315,2317,スイーツは何でもかんでも砂糖の塊
2317,2319,みたいな感じだねまあ今は多分
2319,2321,もう水曜どうでしょうもかなり
2321,2323,何十年前
2323,2325,ってくらいの
2325,2327,番組なんで今はもうだいぶ様変わりしてる
2327,2329,と思うんですけどうん
2329,2331,んふふふふ
2331,2333,ねあの時あの
2333,2335,時代のやっぱお菓子なり
2335,2337,ご飯なりは本当に
2337,2339,なんか全く魅力を感じない
2339,2341,絵でしたね
2341,2343,今はマシになったそう
2343,2345,って聞けますねさすがに
2345,2347,なんかでも
2347,2349,中華とかね
2349,2351,海外のドラマとか見てると
2351,2353,中華のデリバリーよく出てきますね
2353,2355,なんかパンダ
2355,2357,エクスプレスみたいな名前のうん
2359,2361,北海道と比べて飯がうまい国はない
2361,2363,本当にそう
2363,2365,北海道なんてだって
2365,2367,めちゃくちゃうまいんだから
2367,2369,うわ北海道行きたい
2369,2371,北海道と
2371,2373,福岡に行きたい
2373,2375,飯がとにかくうまいところに行きたい
2375,2377,行きたいなぁ
2377,2379,一回北海道
2379,2381,行った時本当になんか
2381,2383,一日5食くらい食べてたな
2383,2385,うますぎて何もかもが
2385,2387,うん
2387,2389,まずなんかラーメン
2389,2391,美味しいでしょでジンギスカン
2391,2393,美味しいでしょカレー一日
2393,2395,2回食べるでしょとにかく
2395,2397,芋食べるでしょ
2397,2399,とにかくなんでもかんでもうまい
2399,2401,デザートもうまいし
2401,2403,北海道好き
2403,2405,福岡も好き
2405,2407,アイルランドにホームステイした人が
2407,2409,食事全部ジャガイモって言ってた
2409,2411,あーなんか私あのー
2411,2413,知り合いがドイツに
2413,2415,いたんですけども帰ってきちゃったんですけど
2415,2417,ずーっと
2417,2419,芋食ってるって言ってた
2419,2421,本当に芋食ってるって言ってた
2421,2423,ふふふふ
2423,2425,え
2425,2427,なんで他にもっと食べ物あるでしょって
2427,2429,いやもう芋ずーっと芋
2429,2431,うん
2431,2433,いや本当にね
2433,2435,北海道行きたくなってきました
2435,2437,あのー私あれが好きなんですよね
2437,2439,ルタオのチーズケーキが
2439,2441,あのルタオのなんか
2441,2443,チーズケーキマジでワンフォール余裕で
2443,2445,食べられるうん
2445,2447,締めにパフェ食べるのって
2447,2449,北海道だっけそう
2449,2451,夜にパフェ食べるんですけど
2451,2453,北海道の人って
2453,2455,あれほんとに素晴らしい文化
2455,2457,なぜならあのジンギスカン
2457,2459,夜食べるじゃないですかでその後
2459,2461,飲むじゃないですか
2461,2463,ジンギスカン食べながら飲んだ後に
2463,2465,あなんか
2465,2467,ラーメン食べたいなって思って
2467,2469,ラーメン食べに行くじゃないですか
2469,2471,でラーメン食べた後に
2471,2473,あなんか甘いもの食べたいって言ったらまだ
2473,2475,パフェ屋が空いてるんですよね
2475,2477,これマジでミラクル
2477,2479,素晴らしいこのコンボ
2479,2481,死ぬ
2481,2483,ふふふふ
2483,2485,KOルート入ってる
2485,2487,最高ですね
2487,2489,むちゃくちゃ食べる
2489,2491,むちゃくちゃ食べますよ私
2491,2493,北海道行ったら
2493,2495,締めの締めね
2495,2497,デブ製造システム
2497,2499,やっぱそこに命かけてるから
2499,2501,北海道に飯食いに行ってるから
2501,2503,もうその北海道の
2503,2505,1日5食食べるのを
2505,2507,3セット3日いるとしたら
2507,2509,それやるじゃないですか15食
2509,2511,これでその後の1ヶ月
2511,2513,もうその貯蓄で生きる
2513,2515,くらいの気合で行くんで
2515,2517,北海道は
2517,2519,その後はずーっとね
2519,2521,なんか
2521,2523,ビスコとか食べたり食べなかったり
2523,2525,っていうその後1ヶ月くらいね
2525,2527,うん
2527,2529,っていうのでバランスとってますね
2529,2531,食べた目
2531,2533,何の話でしたっけ
2533,2535,はいということで
2535,2537,そんな感じです
2537,2539,ふふふふ
2539,2541,その後ですね
2541,2543,タラマガニは宿借り
2543,2545,さんからの新ユニット予言の書
2545,2547,でこれあのお名前にも
2547,2549,書いてある通りタラマガニはですね
2549,2551,宿借りの仲間らしいですね
2551,2553,美味しいですけどね
2553,2555,ズワイガニはカニでタラマガニは
2555,2557,宿借りって言われてもじゃあ何が違うのって感じ
2557,2559,ですけど
2559,2561,こちらが
2561,2563,6人パーティー
2563,2565,なだけあり近接から中
2565,2567,遠距離バフ回復薬まで揃っており
2567,2569,非常にバランスのいいパーティーだと
2569,2571,感じます懸念材料としては
2571,2573,タンク薬が剣士のみなので
2573,2575,剣士がダウンした時に他でどうカバーできるかが
2575,2577,バトルでの勝敗を握ると思います
2577,2579,パペットマスターがなかなか
2579,2581,癖がありそうで活躍次第では化けそう
2581,2583,面白そうな役職だと
2583,2585,思いましたあと銀油詩人が
2585,2587,ガキで殴り始めるのは斬新だと思ったら
2587,2589,モンハンで既に狩猟笛があるのを思い出し
2589,2591,モンハンすげーと思いました
2591,2593,うん
2593,2595,これねそうあの
2595,2597,異世界から来てるので
2597,2599,異世界からねみんなあの
2599,2601,どういうシステムかわからないんですけど
2601,2603,あのwifi
2603,2605,なのかな異世界にもwifiが
2605,2607,飛んでるのかわからないですけどみんなそこからツイートしてるんですが
2607,2609,それぞれジョブがね
2609,2611,あるんですよね一番
2611,2613,左のキキちゃんがパペット
2613,2615,マスター黄色のポポちゃんが
2615,2617,えー
2617,2619,九術師かな
2619,2621,九術師で赤の
2621,2623,カンナちゃんが剣士で青の
2623,2625,ネモちゃんが召喚士オレンジの
2625,2627,セイちゃんが銀油詩人
2627,2629,えー白のゆりちゃんが
2629,2631,白魔導士というですね
2631,2633,えー
2633,2635,そういうジョブになっていたんじゃないかな
2635,2637,と思います違ってたらマジでごめんなさい
2637,2639,うん
2639,2641,でねこれがね
2641,2643,あのー私は
2643,2645,FF14の
2645,2647,民なんですけれども
2647,2649,イオルゼはですねあのー
2649,2651,FF14ってMMORPGで
2651,2653,それぞれジョブがあるんですけど
2653,2655,あのー九術師
2655,2657,は進化すると銀油詩人
2657,2659,になるんですよそう
2659,2661,でねすごい個人的にはめっちゃ違和感が
2661,2663,あったんですけどどうやらFFの
2663,2665,11FFの11も
2665,2667,オンラインのMMOなんですけど
2667,2669,そこではね弓と
2669,2671,銀油詩人は別らしいんですよね
2671,2673,うん
2673,2675,そうだからどちらかというと
2675,2677,FFの11ベースの
2677,2679,はははわかんないですけど
2679,2681,FFの11ベースの世界観
2681,2683,なんじゃないかというねそう
2683,2685,でまぁそのMMORPG
2685,2687,でタンク役とDPS役と
2687,2689,あとヒーラー
2689,2691,という大体の役割があるんですよね
2691,2693,タンクが敵の
2693,2695,ヘイトを集めて攻撃を受けると
2695,2697,でDPSがダメージ
2697,2699,稼ぎでヒーラーがみんなを回復
2699,2701,するんですけど
2701,2703,このパーティーで見ると
2703,2705,剣士のカンナちゃんがタンク
2705,2707,一人でタンクで
2707,2709,城間同士の
2709,2711,ゆりちゃんが
2711,2713,ヒーラーですよねあとでDPSかな
2713,2715,うんパペットマスターも
2715,2717,ワンチャンタンクできる
2717,2719,って感じかうん
2719,2721,っていう感じなんで
2721,2723,そうまぁバランスがいいっちゃ
2723,2725,いいのかな
2725,2727,ははは
2727,2729,そうまぁいいですよね
2729,2731,妄想が膨らむというか
2731,2733,ついこの間もね
2733,2735,うちのリーダーのアニマリーリーダーの
2735,2737,稲葉羽生さんがね我は
2737,2739,ひよこのダブルピース
2739,2741,の魔王ってツイートされてたんで
2741,2743,うん
2743,2745,これはねあの魔王城
2745,2747,アニマーレ
2747,2749,魔王城アニマーレってことは私
2749,2751,たちも魔王側か
2751,2753,うん魔王ですね
2753,2755,私たちが魔王軍なんで
2755,2757,まぁ
2757,2759,そうでしょうね
2759,2761,私たちこれといった武器
2761,2763,特に与えられてないけど戦えるのかな
2763,2765,はははははは
2765,2767,戦えるのか
2767,2769,うーん
2769,2771,そうですねまぁ戦いたいと思います
2771,2773,頑張って
2773,2775,私どうしようかな
2775,2777,三暴とかでもな
2777,2779,戦略ちょっと苦手なんだよな
2779,2781,うーん
