start_s,end_s,text
1565,1571,そう話したんですよね みたいなことを言っていたのでその理論に一石を投じる体験をお話ししたいと思います
1571,1580,私が大学生の時ある友人が限界まで卵を放置したらどうなるかという今で言えば 真っ先に youtube のネタになるようなことをした奴がいました
1580,1591,そいつはたまたま余った生卵を冷蔵庫に2年間放置し 最終的に開封式といって自分のアパートの前の道路に2年もの卵を叩きつけたそうです
1591,1600,その場に私はいませんでしたので立ち会った友人に話を聞くとパリーンという硬質な音とともに 砕け散るカラカラに乾いた黄身
1600,1609,そしてものすごい一周よく異様の匂いは腐った卵のようだと形容されますが本物はそれ の皮ではないと言っていました
1609,1618,事実そのアパートの周りには数日その一周が取れず割った友人が着てた服は一周の残りがが 取れずその服を捨てる羽目になったそうです
1618,1626,この経験をもとに私の結論を述べると賞味期限切れの卵に当たって死ぬ人は見たことがない が少なくとも2年ものの卵に当たると物理
1626,1634,物理でも当たると死ぬほど臭くなるです参考にしてくださいというね お便りきてました
1634,1641,だーめだよそんないたずらしちゃー なんか私あの賞味期限ってあんまりなんか
1641,1650,うんあの生活に取り入れてなくて 基本なんか火通せば何でもいけるって思って生きてるんですかね
1650,1653,普段 玉子って
1653,1663,ほぼ賞味期限無限なんだよねいやーこと前回話したらあの無限じゃないよっていう ありがたいねご指摘があります
1663,1671,あっはぁ 花子は怖いなぁ私あそうなんだ卵牛乳あたりは
1671,1678,賞味期限1ヶ月切れたら怖いぞ牛乳は特に怖いなぁ 牛乳は確かになんかダメな気もする
1678,1686,にゃダメよねー 牛乳は1週間でも怖いぞ1週間まだいや怖いぞ
1686,1696,卵も怖いね私はそうなんだ いやなんかあのなんだろうアイスクリームって賞味期限ないじゃないですか
1696,1706,あー冷凍庫に入れば無限みたいな感覚はでもちょっとあるね 冷凍庫入れるときは全部無限なんじゃないかって思っちゃってるんだよな
1706,1716,これ卵ちょっと気になったんでもしねこれも賞味期限うっかり切れちゃってたっていうのがもし今後あったら2年間温存してみようかなと思いますね
1716,1722,冷蔵庫に ダメだよどれが本物かわからなくなっちゃう
1722,1734,確かにすごい気になるんだよなぁすごい気になるやってみたい なんか実験で私やったことあるよ卵を腐った卵の匂いとか嗅いだことあるよ
1734,1740,やっぱ臭かったですか 臭いどころじゃないね
1740,1747,例えが全然出てこないけど フランシューですよねだっていわゆるフランシューですもんね
1747,1755,臭かった臭かった ちょっと嗅いでみたい臭いものって嗅ぎたくなっちゃう人間の性ですからね
1755,1762,でも でも酸っぱいこういうのは嫌だなぁ
1762,1766,あれでもなんかあれピータンってあるじゃないですか
1766,1771,うわ出た ピータンってあれ腐ってるのかな
1771,1776,なんかそういう匂いって聞いたことあるね ピータンって臭いんじゃなかったっけ
1776,1784,あれもあれですよね土に埋めて作るんですよねピータンって あそうなんだ腐ってるねってそうなんだ
1784,1793,えー 違うの土に埋まれますそうそう埋もってる状態で
1793,1804,今日なんかよく土に埋める話出るんだ 発酵と腐敗は違うので人間に言うのが発酵人間に何の益もないのが腐敗って習いましたね
1804,1809,えー でもなんか肉とかも熟成言うて
1809,1820,いや多いですね最近エイジングビーフみたいなありますね 熟成肉をすぐねーすごいよくわかってないけど
1820,1827,あれってどうなんですかねなんかあれ香りがなんか違うみたいな話聞きますけどね
1827,1835,ねー全然違うって言うよね 食べたことないなんかやたら高いし古いのに高いってのがちょっと私納得できなくて
1835,1840,食べたことない 高いしなんか
1840,1849,熟成肉のなんとかっていうのは食べたことあるけど正直比べてるわけじゃないからよくわかってないよな
1849,1855,そうなんだ なんか安くてもさ熟成肉みたいなこと言うことない?なんか
1855,1861,なんか食べたことある?私最近 何を熟成して
1861,1868,なんか腐ってるわけじゃないですよねあれもねどうやってその食べられる状態をキープしとくんだろう
1868,1874,熟成肉ってさ多分さ 私勘違いかな
1874,1879,1回多分表面腐らせてるよね多分カビ生えらせてない?多分
1879,1887,で切ってカビのとこだけ切って食べれるとこだけ食べてるみたいなと思ってたんだけど
1887,1893,本当だ書いてある表面は忘れないといけない 持ったな 食べなすぐ
1893,1900,持ったないよ牛がかわいそうじゃん 食べな早く
1900,1906,うまいんだろうね多分ね 早く食べなということで皆さん牛は早く食べましょう
1908,1912,熟成肉ねー ということで
1912,1923,次最後の普通のお便り読ませていただきたいと思います 死んだ目のごくつぶし人間さんからの普通お便りですね
1923,1930,名前が全部独特なんよな ラジオネームがちょっとエグめなんですよね
1930,1937,ルカゴさんメアリさんこんばんはこんばんは 裏ラジももう25回ということで半年以上も続いてるんですね
1937,1946,あとあれですねメアリさんもこの間朝のラジオが100回 すごいですね
1946,1955,ねーなんだかんだ続いてるね でもルカゴちゃんのラジオも100回目指せだよもう4分の1というか
1955,1962,いやーこれ4倍ってことですよね 確かに週1だよねこれ 週1ですね
1962,1968,さっきが長いなぁ
1968,1978,これからも楽しみながらラジオを続けていってくださると嬉しいですってことでね 本日のゲストのメアリさんといえばやはり酔っぱっぱのイメージがあります
1978,1987,そこでルカゴさんの飲んでみたいお酒やメアリさんからルカゴさんに向けておすすめのお酒 飲んでほしいお酒などお酒について話し合ってもらいたいですというね
1987,1996,お便りいただいててでこれ次ねお悩み相談のお便りなんですけど
1996,2002,これね結構お酒に関する話題たくさんもらってて はい
2002,2010,このままちょっとお悩み相談に移行していこうかなお酒の話 いいですねー
2010,2018,やっぱねあの メアリさんといえばお酒みたいな梅酒を好きですもんね
2018,2023,そうもう梅酒だけかななんなら 飲めるって言っても
2023,2030,ビールとかも飲めるけど 梅酒が好きででワインとか日本酒焼酎は
2030,2035,あんまり飲まない飲めない 私あの
2035,2046,同時にデビューしたのコナンミヤっていうミヤキャットがいるんですけど あのほぼね最近もしかしたら飲んでない配信もそこそこあるのかなぁと思うんですけど
2046,2054,マジでデビューしたての頃ほぼ全部アーカイブ飲酒って書いてあったんですよね サムネイルがね
2054,2059,だから私あんまりお酒強くないので
2059,2067,飲酒配信って多分コラボぐらいでしかしたことないんですけど やっぱりなんかのなんだろうな
2067,2072,時制が引かないっていうか制御できなくなる そうなんだ
2072,2077,すぐ寝ちゃうんですよね 寝ちゃうタイプか そうなので
2077,2085,これあれなんですよね なんかなかなかね自分で配信誰かが配信を切れる状態じゃないと
2085,2090,ちょっと怖くてできないなって 七石さんに監視してもらったりとか
2090,2098,コラボ相手のチャンネルをお邪魔してる状態とかじゃなくてじゃないとちょっと怖くて飲めない っていうとこあるんですよね
2098,2108,ミヤリさん配信中にちょっとさっきの黒歴史みたいな話になっちゃいますけど これこの飲酒配信やばかったなっていうのって
2108,2112,結構ある 数あるんですか
2112,2116,いやーどうなんだろう泣いたことはあるけど 泣いてる
2116,2122,でもなんかそんな号泣とかでもなく ふんふんくらいはあるんだけど
2122,2129,なんかテンション上がってウェーって変なこと喋っちゃったとかはあるけども
2129,2138,なんかそれよりも私は今めっちゃ思い浮かべてるのはシャルと同じことだなみたいな ルカコちゃんとシャルちょっと似てるじゃないけど
2138,2144,人のこと話すのあるんですけどシャルとパトラと3人で飲んだ時に
2144,2152,シャルがお酒取り行くって帰ってこなかったことがあって 寝てたんだよね
2152,2156,めっちゃ可愛いですねそのエピソード
2156,2163,それがすごいふと思いついてでシャルも自分の配信ではやらないって言ってお酒配信は飲まないって言ってる
2163,2165,それすごい思い出したんだけど
2165,2171,怖いですもんだって自分が配信持っててお酒取りに行ってくるって途中で寝ちゃって廊下とかで
2171,2173,台所で寝てたんですよ
2173,2178,台所で寝ちゃってたらだってあとの残された人たちどうすればいいんですかだって
2178,2179,止められないし配信
2179,2184,どうだろうねって言いながら
2184,2190,でもその時はチャンネル違ったからまだパトラのチャンネルとかだったから良かったんだけど
2190,2196,あとなんか結構お酒飲むと割と柄が悪くなっちゃうから
2196,2200,あんまりよろしくないんじゃないかっていう説がありますね
2200,2203,はいはいはいどうなるんだろう
2203,2209,なんか一回そのコナンミヤと月ノ木チロロとオフコラボした時に
2209,2214,私ビールちょっとだけ飲んでたんですけど
2214,2218,なんかその時のアーカイブを自分でその霧抜きように聞いてたら
2218,2223,声が2段階ぐらいでかくて
2223,2231,なんかコナンミヤが頼んだビールしか届いてないんですけどみたいなこと言って
2231,2235,コナンミヤが頼んだピザが当日たったなんか届かなくて
2235,2237,そう届かないとか
2237,2242,Uber Eats担当のコナンミヤのピザが届かなくて
2242,2246,ビールだけ届いたことに対して不平を垂れ流してたんですけど
2246,2251,結局声がでかかったっていうのがあったんで
2251,2255,結構ね恐ろしいなと思いつつ
2255,2257,ちょっとお悩み相談のね
2257,2262,一通目お先に関するものを読んでいきたいと思うんですけれども
2262,2267,赤目黒うさぎさんからのミッドナイト大人悩み相談
2267,2271,これミッドナイト大人悩み相談室っていうタイトルです
2271,2274,ミッドナイト大人悩み相談室
2274,2276,ゆるかごさんメアリさんこんばんはこんばんは
2276,2279,突然ですが僕はお酒が弱いです
2279,2283,お酒の席ではカシオレかファジーネーブルかソフトドリンクを頼みます
2283,2286,最近はご時世的にあまりないのですが
2286,2289,後輩たちと飲みに行ってソフトドリンクを頼むと
2289,2291,え?先輩も飲みましょうよ
2291,2294,わらとうざがらみをされますし
2294,2297,飲めるカクテルを頼むと先輩カシオレですか
2297,2299,わらかわいっすね
2299,2302,わらと小バカにしたような態度をとられます
2302,2305,まあ僕も大人ですし全く気にしてませんし
2305,2311,うるさいなと軽く流しているのですが正直尺に触ります
2311,2313,ここで質問です
2313,2316,飲みやすいけどあんまり舐められなそうなお酒はありますか
2316,2320,またうざい後輩の対処法とあれば教えてほしいです
2320,2324,お便りいただいてました
2324,2327,これありますか?舐められないお酒
2327,2335,舐められないお酒ってむずいね
2335,2338,多分なんかなんだろう
2338,2340,黒霧とかなんでしょうね
2340,2342,私もあんまり詳しくないんで
2342,2345,コナンみやが飲んでる目柄なんですけど
2345,2348,黒霧なんでしょうね
2348,2352,テナルトでも強いね
2352,2355,あのあれなんだっけな
2355,2358,今めっちゃ思い出したくて思い出せないんだけど
2358,2359,なんだろう
2359,2362,アンズのお酒があって
2362,2365,新露中?
2365,2368,難しい名前でいけるくない?
2368,2369,新露中ですか
2369,2374,確かになんか新露中って確かに強そう
2374,2377,漢字さえ見なければいけるかも
2377,2380,確かに何飲んでるんですか
2380,2382,オレンジ色で美味しそうですね
2382,2384,新露中です
2384,2387,え?え?え?みたいな
2387,2392,早めに言ったんだよ新露中だよって
2392,2399,何中ですかみたいな感じになるかもしれない
2399,2402,新露中甘くて美味しいし
2402,2405,飲みやすいしね果実酒だから
2405,2407,いいかもしれない
2407,2409,ウーロン配とかもあったけどね
2409,2411,ウーロン配は確かにね
2411,2413,私あれ苦手なんだよな
2413,2416,ウーロン茶が飲みたくなるというか美味しくないんだよな
2416,2418,ウーロン茶の方がうまいなって思ってしまう
2418,2419,ウーロン茶の方が美味しいよね
2419,2422,世のウーロン配好きの方に申し訳ないんだけど
2422,2425,ウーロン茶単体で飲んだ方がうまい
2425,2427,ウーロン茶の方が好きなんだよ私
2427,2428,なんかあれじゃないですか
2428,2431,ピーチウーロンみたいなの
2431,2433,あれはなぁ
2433,2435,あれはピーチジュース飲んでる
2435,2439,別名ある系の
2439,2441,うんうんうんうん
2441,2442,なんだろうな
2442,2444,レゲエパンチみたいなありません
2444,2448,レゲエパンチってピーチウーロンなの
2448,2449,えわからん
2449,2452,そうなの
2452,2453,今レゲエパンチって検索したら
2453,2456,レゲエパンチピーチウーロン味っていうのが出てきて
2456,2459,意味がわからなかった
2459,2462,レゲエパンチって
2462,2464,レゲエパンチいいじゃん
2464,2465,レゲエパンチ強くないですか名前
2465,2469,いじられるくないそうやってさ
2469,2473,先輩っていうようなやつがさ
2473,2475,レゲエパンチだよって言ったら
2475,2478,えウケるみたいな
2478,2483,私が実際そんな後輩にだるがらみされたら
2483,2485,なんていうかな
2485,2488,うわぁまじかよ
2488,2489,これ男の子にいじられてるのか
2489,2491,女の子だよね多分ね
2491,2492,え男じゃないですか
2492,2495,男か
2495,2496,なんかすごいなんだろう
2496,2501,生意気なちょっとギャルっぽい女の子の想像しちゃってさ
2501,2502,それはちょっとご褒美
2502,2504,ご褒美じゃん
2504,2506,ご褒美じゃんと思ってたんだよね
2506,2508,ギャルに言われてたら結構嬉しい
2508,2509,でも
2509,2512,なんかうるさいなあのくだりとかすごい
2512,2515,投稿してくれてる方の感じ方的には
2515,2517,多分男性の後輩っぽいですね
2517,2519,じゃあダメか
2519,2521,なんか普通に
2521,2522,あれかななんか
2522,2525,お酒で圧倒するというよりは
2525,2528,うわぁお前まだその領域みたいな
2528,2530,まだそういういじりしてんの
2530,2534,昭和かよみたいな感じかな
2534,2535,うわぁみたいな
2535,2537,えお前まだそのレベル
2537,2540,心配だよお前が上司になった時さ
2540,2544,後輩に焼酎とか無理やり進めんじゃないかと思って
2544,2546,みたいな感じで返すかな
2546,2547,なるほどね
2547,2552,令和だぞっていう
2552,2553,何も返せないわ
2553,2555,私多分何も言わないわ多分
2555,2557,なんか言われても
2557,2558,いやそうそうそうそう
2558,2559,昭和生まれなので
2559,2560,いや今生きてるのは令和でしょ
2560,2562,ねみたいな感じで言うと思う
2562,2563,なんか何でもかんでも
2563,2568,いや令和ですよって言っちゃうから
2568,2569,強
2569,2570,うんそうですね
2570,2571,なんか令和だよって言うと
2571,2572,なんかあんまり返せないから
2572,2573,だってもう令和だから
2573,2575,確かに
2575,2577,自分が古いのかなって思っちゃう
2577,2578,そうそうそうそう
2578,2579,アップデートできてないですね
2579,2581,感を出すかな
2581,2583,そういう風に言われたらね
2583,2586,言われてないのに言いませんけどもちろん
2586,2589,いい返しだそれ
2589,2593,喧嘩吹っかけられたら買うけどぐらいですね
2593,2594,なんか上司に言われても
2594,2596,ワンチャン返せるワードだね
2596,2598,令和ですよって
2598,2599,そうですね
2599,2602,コンプラとか大丈夫ですかとか
2602,2605,コンプラと令和とタッグで言ってください
2605,2606,もしね喧嘩吹っかけられたら
2606,2608,私が上司だったらしんど
2608,2612,言われた言われそう
2612,2618,全然言いますよ私普通に
2618,2620,しんどい
2620,2622,多分ね私会社にいたら
2622,2624,結構めんどくさいんじゃないかな
2624,2628,皆さんちょっと同僚じゃなくて
2628,2633,よかったかもしれないですね
2633,2635,結構ねコンプラ令和デッキ
2635,2639,よかったらぜひ使ってみてください
2639,2641,赤目黒うさぎさん
2641,2647,令和ですよ
2647,2649,ぜひ使ってください
2649,2655,では次のお悩み相談を読みたいと思います
2655,2657,たくまんじゅうの天ぷらさんからの
2657,2659,ミッドナイト大人悩み相談
2659,2660,るか子さんみやりさん
2660,2661,リスナーの皆さんこんばんは
2661,2664,こんばんは大人ならではの悩みということで
2664,2666,ありがちな質問になってしまいますが
2666,2669,どこからが大人なのかについて
2669,2670,質問させてください
2670,2673,自分は今年二十歳になったばかりなのですが
2673,2675,それ以前と何が変わったかと聞かれると
2675,2677,せいぜい法的にできることが増えたくらいしか
2677,2678,思いつきません
2678,2681,趣味も変わらず好きになる女性のタイプも変わらず
2681,2683,用事も当然変わらず
2683,2685,何が大人なのか分からなくなってきてしまいました
2685,2689,大人なお二人の考えをお聞かせください
2689,2692,とのことでどうですかね
2692,2698,大人大人になったなーって思う時ありますか
2698,2705,どうだろうもう私は大人になりたかったからね
2705,2712,あのもうそうやって大人というかもう
2712,2718,いろいろもう自立してからもう大人だいと思いながら
2718,2723,生活してきたから失敗いっぱいしたけど
2723,2726,私は一人暮らしし始めて
2726,2732,まだその頃は社会的にも大人ってわけではないけども
2732,2735,もうでも自分の中では大人と思ってたよ
2735,2738,一人暮らし結構大きいですよね
2738,2740,親元を離れて
2740,2742,で私すっごい田舎のところから
2742,2745,もうコンビニもないようなところから出てきたから
2745,2749,まず夜中にコンビニに行くっていうこと
2749,2753,まあ私のとって夜中って11時とかなんですけど
2753,2757,10時とかにコンビニに行けるっていうことが
2757,2760,大人じゃーんって思いながら
2760,2761,言ってたよ
2761,2764,めっちゃ可愛いエピソード
2764,2769,確かに夜出かけたりとかって大人感ありますよね
2769,2773,大人感あるよね夜に一人ってやばい
2773,2779,私あの都保県内に映画館があるところに前住んでて
2779,2779,うわ
2779,2783,こういう状況になる前はレイトショーとか行ってたんですよね
2783,2786,うわ大人
2786,2789,いやめっちゃ大人と思いながら行ってました私も
2789,2793,やべー大人だーって思いながらレイトショー
2793,2796,レイトショーは大人はずで
2796,2799,12時とか1時とかに終わる回見てましたね
2799,2803,うわ私まだ体験してないのに
2803,2808,いやこれはねはじめちゃんに大人なんでぜひとも
2808,2812,そうやっちゃうのレイトショー今やってないと思うけど
2812,2816,やってないかなそっかもうそろそろ始まるかっていう
2816,2817,ぜひぜひ
2817,2821,あとはねやっぱ買ったゲームすぐにやんなくなったり
2821,2825,買った漫画すぐに読まなくなった大人ですよね
2825,2828,これは大人なのかな
2828,2832,いやだって小学生とか中学生の時って
2832,2835,漫画買ってきたらもう帰り道で読んでたもん
2835,2836,読んでたね
2836,2838,帰り道で読んだりして
2838,2841,読んでた読んでたもうすぐなんかシュリンク
2841,2844,バーってバリバリって破ってすぐ読み始めて
2844,2847,でも家帰ってもう一回読んでお風呂入ってご飯食べて
2847,2849,寝る前にもう一回読んでたもん
2849,2852,最近もう積みに積んでるんですよね
2852,2855,買った本とか漫画とかゲームとか
2855,2858,大人になっちまったのか
2858,2859,なっちまったそっか
2859,2862,すぐやる予定ないけど一応買っとくかで買い物できる
2862,2863,そうそうそうなんだよね
2863,2866,経済がねお金持っちゃったか
2866,2870,一応買っとくかみたいな感じ
2870,2873,そうだね確かに
2873,2874,そう分かる
2874,2875,大人だわ
2875,2881,でもなんかその500円とかで買った漫画の価値がどんどんなんかやっぱね
2881,2881,確かに
2881,2883,変わってくのかな
2883,2885,変わってるかもね
2885,2887,それ老いだねって言われてる
2887,2889,あちょっと老いらしいです
2889,2891,悲しいです
2891,2895,いやーでも大人っていう証拠だねそれもね
2895,2897,あとやっぱりなんか
2897,2900,はちみつとクローバーだったと思うんですけど
2900,2902,はちみつとクローバーになんか
2902,2906,やっぱ子供ってまだ大人が何でもできると思ってる
2906,2907,みたいなのが書いてあって
2907,2912,大人が何でもできるわけじゃないって知った瞬間から大人だよねみたいなのを
2912,2913,誰でも言ってたんですよね
2913,2914,はちみつとクローバー
2914,2920,名言生産期だからはちみつとクローバーは
2920,2923,エヴァの真珠がかわいそうに見えてきたら大人?
2923,2926,かわいそうに見えてる今大人だわ私
2926,2928,えー
2928,2932,だからなんかやっぱエヴァンゲリオンの碇真珠くんって
2932,2936,多分なんか14歳とかで見たら
2936,2938,すごい不甲斐ない主人公だなみたいな
2938,2941,もっと頑張れよと思うのかもしれないけど
2941,2946,この間やっぱ新劇見てて
2946,2950,いやなんでそんな当たり強い周りみたいな
2950,2951,あーなるほどね
2951,2953,なんでそんな理不尽
2953,2955,14歳だよみたいな
2955,2958,チルドレン像みたいな気持ちで見てますね
2958,2960,なるほど
2960,2966,すごいいいわエヴァンゲリオンいい指標ですね
2966,2969,これエヴァンゲリオンと霊都市をね良かったら
2969,2972,確かに大人だわ
2972,2974,逆にネリフの人たちダメだこいつらって思うよね
2974,2976,そう周りの大人がね
2976,2982,なんで子供に世界の命運かけるみたいな気持ちになってきちゃう
2982,2984,なるほどねそういう考え方ね
2984,2987,やっぱりああいうなんか
2987,2989,やっぱアニメとかって14、15歳
2989,2994,小学生の子とかが活躍するアニメとか漫画とかあるじゃないですか
2994,2999,ああいうので周りの大人何してるんだろうっていう感じになってくるんですね
2999,3001,なるほど
3001,3006,是非エヴァンゲリオンをレイトショーで是非機会があったらね
3006,3010,見てくださいリバイバルとかもしあったら
3010,3014,そうやったら大人ですね
3014,3017,ということで20歳になったばっかりということでね
3017,3021,おめでとうございます大人満喫してください
