start_s,end_s,text
0,28,家に帰る前にお安定食品を triangle マグロと合わせて頂きます
58,84,今日はゲストにハニーストラップから 西音寺みやりさんが来てくださってます
84,91,こちらね 事前にどこまでのLINE大丈夫ですかって聞くの忘れてたの今思い出しました
91,93,今日もよろしくお願いします
93,97,お願いします
97,99,もう喋っていいのかなこれ
99,101,今多分ジングル流れてるぐらいだと思います
101,108,なんか設定がよくわかんなくて ジングルが流れてるか流れてないかわかんなくなっちゃったんですよね
108,121,いつもリスナーさんがジングル鳴ってるよって教えてくれるから ジングル鳴ってるんだなっていうのを感じ取れる
121,126,今日は流れました 流れたり流れなかったりするんですよね
126,130,非表示にしちゃったみたいなやつかな
130,135,かなぁ 前まで流れてたのになぁって
135,143,毎回ガチャなんですよ ということで改めましてみやりさん自己紹介をお願いします
143,152,はいおかえりなさい ハニーストラップから西音寺みやりですよろしくお願いします
152,155,今日はねちょっとあの冒頭でも話したんですけど
155,163,一応ねNGの確認をうっすらしたんですけど なんかLINEの確認をちょっと忘れちゃったなっていうのが
163,168,懸念事項なのでちょっと配信中探り探りいきたいと思いますね
168,171,全然大丈夫です みやりの声がね
171,176,みやりめっちゃでかいって話題なんで
176,180,みやりめっちゃでかいんだよそう
180,185,ごめんなさい失礼しました これぐらいでどうかな
185,189,いつもみんな80くらいまで下げられてる だいたい
189,192,そうなんですか そうそうそうそう
192,196,さっきなんかちょうどあのバーで確認した時ちょうどいいなと思ったんですけど今
196,203,本当?多分ちょっと本番になると声ちょっとでかくなるところあるから
203,205,オーケーオーケーいい感じになった
205,208,あーなるほどねはいはいはいはいオッケーです
208,212,そっちの話かなっていうのがねすでに出てますけど
212,216,あの初めてね見てくださった方もいるかもしれないので改めまして
216,219,勇敢キスアニマルの大浦ルカ子なんですけれども
219,227,こちらの配信ですね事前に皆さんからいろんなねトークテーマに沿った投稿をいただいてまして
227,233,そちらを読みながらゲストの方と一緒にお話ししていく回に今日なるはずです
233,235,はいはいなるはずです
235,237,よろしくお願いします
237,239,お願いします
239,247,なんかさっきもねちょっと話したんですけどみやりさんこの土深夜帯にあんまり配信ってしないですよね
247,254,そうそうそうだからすごい楽しみにしてたんですよ
254,259,もう深夜テンションでもう何喋ってもいいんだろうなーって思いながら
259,267,いやもう何喋っても大丈夫ですはい基本的にはもう無法地帯だと思ってもらえたら
267,270,なんだかんだ初めてだもんね二人で喋るの
270,272,そうですね
272,278,コラボでちょこちょこ会ってたからあんまそんな気がしなかったんだけど
278,284,なんかこの間もねあのみやりさんのチャンネルで漫画のコラボに呼んでいただいたじゃないですか
284,292,あの時とかあとNERUちゃんの配信で筋トレ人狼っていう
292,297,あれみやりさんと初めてコラボしたの筋トレ人狼だったかな
297,299,多分そう飛び込事件の
299,303,そうそう飛び事件のね
303,305,よく切り抜き見た
305,308,私もよく見たすごい進むされてくる
308,312,そうお勧めするなと思いながら
312,314,めっちゃあるやん
314,318,なんかあのNERUちゃんのねあのチャンネルに行くと見られると思うんですけど
318,325,筋トレ人狼って誰が筋トレをしているのか当てるっていうね比較に呼んでもらった時に
325,329,泉さんがお寿司のネタ答える時でしたよね確か
329,330,多分そう
330,338,ココン東西お寿司のネタみたいな感じで答える時に飛びっこって言ったやつに私とかみやりさんも爆笑してたような気がするんですけど
338,340,言い方がね
340,343,そう言い方がちょっとね面白かったっていうかあれだったんで
343,344,あれだったんで
344,347,そこをね結構あの切り抜かれたりとか
347,353,あれ配信終わった後のエゴさ全部飛びっこでしたもん私
353,356,ルカコ爆笑しててクサって書いてあったから
356,360,面白かった
360,369,あれ面白かったですねっていう感じであの本当ね一対一二人でコラボするのは初めてなので今日めっちゃ楽しみにしてきました
369,375,はい早速じゃあもうお便り読んでも大丈夫ですか
375,376,大丈夫です
376,382,なんかいつもこれ最初の話ですごいあの脱線してしまって
382,386,一通目読むのがなんか結構遅くなりがちなんですよね
386,388,今日早い方なんじゃない
388,390,今日早いですだいぶ早いと思う
390,394,音量も確認したし
394,396,そうかなり早い方だと思うんです
396,403,今日はたくさんお便りもねいただいてるんで早速一通目から読んでいきたいと思います
403,407,はいじゃあ普通の歌に変えて
407,411,私いつもハニーストラップの中でも起動修正の女だから
411,412,そうなんですか
412,414,ごめん脱線したけど
414,415,いや全然大丈夫
415,417,脱線の女でもあり
417,418,起動修正の女でもあるから
418,421,すごい自己完結がすごい素晴らしいですね
421,422,そうそう
422,426,この間のTIFF東京アイドルフェスティバルがねあって
426,433,あの私たちゆうかんキスアニマリア2日目ハニーストさんがね3日目にあの登場されてたんですけれども
433,441,そのね皆さんご覧になってくれた方もいると思うんですけどやっぱあのmcすごいグループでこう
441,445,空気感まるで違いますよね
445,447,全然違ったねほんとね
447,452,でもなんかハニーストさんのやっぱり歌もまあもちろんすごい可愛かったんですけど
452,460,mcもねなんかハニーストさんの普段の雰囲気みたいなものがこうそれを凝縮濃縮還元200%みたいな
460,464,すごい癒されるmcだったなと思いました
464,467,アニマリアは本当に台本がなかったの?
467,469,ないですよあれ
469,471,やっぱりどうなんだ
471,478,私たちはねあらかじめねこんなこと喋りたいねっていう箇条書き台本みたいなのはあるんだよ毎回
478,479,なるほどなるほど
479,479,自分たちで
479,480,はいはいはいはい
480,482,流れだけはと思って
482,490,一応なんか最初にねるちゃんからなんかざっくりこういうこと喋ろう喋るかもしれないし喋んないかもしれないみたいな
490,495,なんかそういうのはあったんですけど特になんかあとはもう自由に
495,498,あとは自由演技でみたいな感じだった
498,500,はいはいはい
500,502,芸人だったよね
502,504,いやいやいやありがたいですね
504,506,やべ
506,508,読みたいと思いますね
508,513,早速1つ目読みますからまたなんか人話盛り上がっちゃうんですよねいつも
513,517,はいそれにちょっと関連して
517,522,1つ目メガネスキーさんからの普通話を読ませていただきたいと思います
522,525,ルカコさんメアリーさんこんばんは
525,534,私はナナシンクの皆さんの配信を最近見始めたのですがアニマーレやハニーストラップなど各グループで何か活動方針の違いがあるのでしょうか?
534,539,手法的な質問で申し訳ありませんが教えていただけると幸いですというね
539,544,お便りが来てましたこれ私もちょっと逆に聞きたいんですけど
544,549,アニマーレの活動方針っていうのはどんな感じなんですか?
549,556,でも私のアニマーレのことあんまそこまで知ってるわけじゃないけど
556,563,アニマーレはもう本当に個々が自由にやっているイメージあるけど
563,566,方針的にもそうじゃない多分
566,569,何かこれやっちゃいけないみたいなの
569,577,"最初にいくつかなんか私エピソードでこれはあんま話さない方がいいですねみたいなNGを2,3件くらったぐらいで"
577,583,こういう企画やりたいですみたいなやつは全面的に止められたことないかもしれないですね
583,591,あの人はねそうだなぁなんだろう
591,596,あのー 厳しいというわけじゃないけども
596,603,もう自由にはやっているけどもやっぱりどこかグループ感というか
603,613,なんかね無理やりそうやってしまうあの例えば配信の時間とかも開始時間はかぶらないようにとかも
613,623,なんかねー強制的にやらされているっていうよりはなんかあれだったなどんどんどんどん自分たちがルールができていったっていうか
623,635,あーなるほど言われてみたいな感じよりはもう自分たちでこういう感じにしていこうかみたいな感じで作っていったって感じなんですね
635,641,そうなっていったことが多くてでまぁ そのルールをまぁ
641,652,ルールって言っても配信時間かぶらないようにしようねーとか まあお互いが嫌なことはやりたくないみたいなやらないようにみたいな例えばなんか
652,657,いきなり私が炎上ユーチューバーなるみたいな
657,660,俺はやっぱり嫌じゃん?
660,664,確かに戸惑いがすごいと思いますね見てる方の
664,672,思い合おうねーみたいな結構やっぱなんだろう仲良し感かな いいんだろうね多分ね
672,676,すごい仲の良さはあらゆる配信にひしひし伝わってきますね
676,687,みんながみんななんかねー 仲良いというより気遣う女たちなのかもしれない
687,694,ハニスとみんな真面目でいい子好きってコメントありますけど本当にそうだと思う 本当さっきのテキューの話もそうですけど
694,701,定期的に4人のコラボされてるじゃないですか ああいうところでもなんか
701,706,すごいアットホール感というか 平和だよね
706,713,すごい穏やかな アニマルがコラボするって言うと毎回なんかなんだろうな
713,718,プロレスとか 全然違うよね 戦いとか
718,727,NGなしみたいな感じの冠がつくんで ちょっとそこで空気感の差はすごい感じますよね
727,734,確かにアニマルは元気だね 元気だね
734,740,それがたまに羨ましくも思うよ 本当自由だなぁみたいな
740,747,自由なんですかね 自由だと思いますね 別に不満がないけど私も
747,754,なんか最初やっぱり出た時に自分自身でアニマレとしてはやっぱ地味かなみたいな
754,764,ななしさんからもうちょっとフィジカル強くなれるといいですねみたいな感じ フィジカル? リアルシーンみたいなフィジカルじゃなくて
764,771,パッション的なニュアンスだと思うんですけど いいですねみたいなことを最初は言われてて
771,780,アニマレっぽさみたいなのずっと考えてたんですけど やっぱり未だに掴めないですね
780,785,真面目だねいいね そう真面目なとこつい出ちゃうんですよね
785,791,あのやっぱり結構事前の準備とか配信準備とか企画の準備とかもめちゃくちゃやるタイプだし
791,797,やってるね そうなんでなんかそこのね勢いの良さとかイレギュラーを受け入れるだけの
797,800,弾力みたいなのがちょっとないかも
801,807,っていう感じがちょっとアニマレ難しいなぁと思いますね っていう感じです
807,813,メガレスキーさんどうでしょうなんか わかってもらえたかな
813,820,黒歴史も足りないものを練る過去って いやそう黒歴史がないんだよなぁ
820,826,何にもないんですよねほぼ初発配信でラップしたくらい
826,836,そうそれ一体ですねありますかメガレスキーさん黒歴史 黒歴史はどうなんだろうどれを黒歴史って言おうかなくらいかな
836,846,最初にお酒飲み配信した時はまぁ でも私の中では黒歴史じゃない伝説って呼んでるんだけど
846,857,酔っぱっぱの歌ができた日が多分VTuber自体がお酒の配信を全然してないから
857,862,ある意味黒歴史である意味伝説 いいですね
862,869,黒歴史じゃなくて伝説って言い方 アニマーレもそうだねアニマーレ伝説じゃん黒歴史というより
869,877,伝説ですよね 私もNGなしのアニマーレを見て応募しようと思って応募したんで
877,883,七進くん そういうところが好きなんで
883,891,確かにそういうなんか象徴的な回を見てもらうのが一番いいかもしれないですね
891,901,アニマーレらしさハニストらしさがねすごい滲み出てる回を見て配信を見てもらうのがいいかもしれないなと思いましたということでお便りありがとうございます
901,905,ありがとうございます では次
905,911,セシマのかえりちさんからの質問と めありさんりょうかこさんこんばんは
911,921,下の方に大人の悩み相談これ次のコーナーですね大人の悩み相談がありますが高校生は大人じゃないよなってなったのでこっちで相談というか質問です
921,932,音楽の授業の中で毎回一人好きな曲を紹介する時間があり来週それが回ってきそうです お宅全開だといろいろ言われそうだし普通の jpop は全然わからないし悩んでいます
932,938,めありさんとりかこさんはこういう時どうしますかまたお二人がこの立場ならどの曲を選び ますか
938,947,と言うお便りが高校生から来てしまいましたね やら高校生見てのちなみに中学生からもお便り今回来てて
947,955,私はもうそれをの抜きましたね やべー10代が見てるわと思って
956,966,見てますかね今はねどうしますかめありさんもし高校の授業で一曲紹介してって言われたら どうしよう
966,976,私はさあ割と なんだあんまり歌とかもそんなに大好きなものがあるわけでもなく
976,983,あの 特にこだわりないから多分さ
983,987,今流行ってるの言っちゃいそう 私は
987,997,はいはいはいはいな夜遊びさんとかずっと真夜中でいいのにさみたいなかそういう 感じかなあとボカロとか
997,1008,言っちゃうタイプだなぁ私なんか安牌狙っちゃうタイプなんだよなぁ セオとでもそうでもだからこそ言えるのは本当にやっぱ自分
1008,1014,多分好きな曲あるんだろうねオタク全開になるって言う 同市を唱えてるんで
1014,1020,だからこそ言えるのはあの自分の好きな曲があるっていうのはやっぱ素敵なことという かね
1020,1032,羨ましいことだから私からしたらだからありのままでやっぱ まあその中でも万人受けしそうなものを選んで発表してほしいとは思ってるけどね
1032,1040,いやそれが一番いいですよねただやっぱ私が高校生の時って むちゃくちゃひねくれてたから
1040,1051,だいたい私があれなんですよニルバーナとか昔の洋楽聞いてたんですね高校生 中学校生ってなんかもうJ-POPとかじゃないからみたいな時代だったんですよ
1051,1059,でその時の黒歴史が山ほどあるんでやっぱねあの気を照らわない方がいいです だからジョン・ケージュとかはダメ
1059,1063,そうだからあの 普通に
1063,1071,そこそこあれですよねあのなんだろうな 洋楽でもなく
1071,1081,クラシックとかね4分33秒みたいな感じじゃなく さっきもあったクリーピーナッツさんとかの中学12年生とかがいいかなっていう感じがしますね
1081,1088,なるほどねクリーピーナッツか クリーピーナッツさんの中学12年生はまさにあの
1088,1099,なんかいわゆるその今もう大人じゃないですかクリーピーナッツさんってがあの 中学の時にむちゃくちゃこんな恥ずかしいことをしましたみたいなリリックがあるんですよ
1099,1103,そう確か めっちゃ面白いじゃん
1103,1108,2年生はね 歌詞がむちゃくちゃ良くて
1108,1111,えー それでいいじゃん
1111,1114,そうそうそうそう
1114,1124,これ痛い痛いそれポイム痛い痛いイヤライムっていうなんかあのポイムなのかライムなのか みたいなところとかあとなんか
1124,1127,これ あそうそうそう
1127,1134,カラオケで洋楽入れちゃダメとかなんかそういう歌詞もあったような気がする
1134,1138,これ違う曲だったかな カラオケで洋楽は確かにちょっと低くかもしれない
1138,1148,なんかラップ入れちゃダメみたいな他の曲だったかもしれないクリーピーナッツさんので とにかくめちゃくちゃおすすめだし私が一番好きなあの韻は
1148,1155,ミラノフードリアとミラノユートピアで踏んでるところがあって 高校生ってみんなサイゼリアめっちゃ好きじゃないですか
1155,1163,それはやっぱり今も昔も変わらないんだなっていうことがうかがい知れるんで やっぱちょっと中学12年生めちゃくちゃおすすめです
1163,1166,めっちゃいいじゃん
1166,1172,洋楽歌っちゃダメだったのかいや洋楽は歌っちゃダメですよ一人一人のカラオケだったらいいけど
1172,1180,あのめっちゃうまいならいいけどね めっちゃうまかったのそれはそれでなんか反応困るよね多分
1180,1184,乗り切れないよねなんかね うまいねってなるけど
1184,1188,有名どころならいいけどね まあ確かにな
1188,1193,ベイビーベイビーベイビーおーいえーとか言われたら あーってなるけど
1193,1199,ヨーヤービーワーみたいな感じされたら おーおーおーおーおーおーみたいな
1199,1206,そうですね確かにベイビーベイビーベイビーワーまでかな それくらいまではいいよねそこまでかな
1206,1211,アリアナグランデ逆に歌える? 歌える本当
1211,1218,っていう感じなんでよかったらねおすすめ 取り入れてみてください気が向いたら
1218,1226,いいねそれ いいな高校の授業でもしかしたら紹介されるかもしれないと思うとすごい嬉しいです
1226,1232,めっちゃいいアドバイスだったねそれね 本当ですか
1232,1241,多分私だったらそのまま提出するねクリーピーナッツで 今ちょうど流行ってるじゃんクリーピーナッツさんもね
1241,1250,いやそうですねそうしかもなんかそんなねあのなんかこう チンザドープネスですみたいなぐらいそんなドープじゃないから
1250,1258,ドープてかもっとキャッチーなんでねクリーピーナッツさんだからいいと思いますねおすすめ はいということで
1258,1264,解決できてますように次のお便り読みたいと思います
1264,1271,これすごい可愛いなと思ったよ手入れで トコトコバイクさんからの普通た
1271,1279,ルカゴさんさんのじみありさんこんばんはこんばんは 私はとあるケーキ屋さんで秋限定で販売されるお菓子が大好きです
1279,1289,栗とクリームをパイ生地で包んで焼いたコロンとしたフォルムが可愛いらしいお菓子なの ですが今年もそろそろ販売開始される時期だなぁと思いお店に行ってきました
1289,1300,ショーケースを覗いても見当たらなかったのでお店の人に栗コロリンありますかと尋ねたら ああマロンパイですねありますよと奥から焼き立てのものを出してくださいました
1300,1307,そうなのですどうやら私はこの1年の間にマロンパイを栗コロリンと勝手に解明して しまっていたようなのです
1307,1317,店員さんの察する力の高さに感動しつつ嬉しい恥ずかしで購入した マロンパイ栗コロマロンパイの味は去年と変わらず絶品でした
1317,1324,お二人は自分の思い込みから長年勘違いしていたものなどあるでしょうかもしあれば教えて もらえると嬉しいですということで
1324,1330,お便りいただきました栗コロリン可愛いですよね 栗コロリン可愛いね
1330,1341,自分で名前つけちゃうはねあるあるだね いやそうなんです私もなんか自分でなんかの今配信でかけてる曲とか
1341,1349,ダウンロードした時に全部英語の名前だから わかりやすいように自分で名前変えるんですけど
1349,1361,そうなんだ逆にすごいわかりにくくなっててこれもタイトルが今かけてる曲が 侵害していないっていうタイトルつけてて自分で
1361,1366,なんで全然わかんない 侵害していない?
1366,1374,侵害? いわゆるその何々を侵害する侵害するの侵害で
1374,1383,していないってタイトルついてるんですけど全く理解できなくてどういう意図でつけたんだろうな 自分自身のことが全くわからないんですよね
1383,1391,何なんだろうね 権利かな いやでもなんなら侵害してる曲なんて使ったことないんだけど全部侵害してないんだけど
1391,1401,まずダウンロードしないよね 確かにしないしない 皆さんの著作権量配慮した配信を心がけてますのでご安心ください
1401,1408,雰囲気とかを侵害しないのかもしれない 確かに全然わかんない
1408,1414,なんか穏やかピースフルとか こんなんつけてるの?
1414,1427,うさんくさい曲?うさんくさい曲はまだわかるかな この間なんかじゃあフレッシュな曲ってタイトルあるんでフレッシュな曲かけますって言ったら全然フレッシュじゃなかった時とかありますね
1427,1435,名前つけちゃいけないねそれね そう元々の名前のままにして使えばいいのに
1435,1438,なんかありますか?そういう 何だっけ
1438,1445,長年の勘違い 長年の勘違いか 出そうで出ない絶妙なところよねこれってね
1445,1455,確かにね長年の勘違いってなんかあるかな うちの母がね結構長いことあのピーナッツって気になると思ってたっていう可愛いエピソードあります
1455,1460,わーでもあるねー なるほど
1460,1465,ピーナッツって気になってるんじゃないんだって思ってたらしいですね
1465,1471,ピーナッツってどこになる? あれはなんか土の中じゃないですか
1471,1476,えー嘘やろ えっピーナッツって土の中ですよね
1476,1480,かからずのクリーピーナッツから 土の中なの?
1480,1488,嘘でしょ 土の中なの? 土の上なの?えっ土の中なの? 中だって
1488,1495,あそうっすよね 掘り出すんですよね えっじゃがいもみたいになってるの
1495,1499,えー そうなんだ
1499,1507,知らない知らない あじゃあ今この長年のなんかあれが解けたんじゃないですかピーナッツに関して
1507,1512,うんできちゃった えー嘘
1512,1522,ピーナッツそうだったんだ ということでね我々の長年の勘違いピーナッツということで決まりました
1522,1527,なんならみやりさん今の今まで勘違いしてましたね 今の今までだね
1527,1532,よかった今日はじゃあピーナッツ記念日ですね ピーナッツ記念日
1532,1538,えーでは次の いや他にもあるね多分ね いやいっぱいあると思う世の中に知らないこと山ほどありますからね
1538,1545,いますねー これは私の知らなかったことだ次のふつおた
1545,1551,親戚に養鶏所経営者が2人いるさんからのふつおたさ ふつおたですね
1551,1559,ルカコさんみやりさんこんばんは こんばんは先日ルカコさんが卵ってずっと食べれる基本無限
1559,1565,これあの期限がね期限なんてないでしょ卵にみたいなことを先週から 期限かこれ
