start_s,end_s,text
1348,1350,あなたも鳥では?
1350,1352,鳥ですよ
1352,1354,フクロウですよ
1354,1356,みんな最近忘れてませんか
1356,1358,私がフクロウでやることをね
1358,1360,このうららじのロゴにもね
1360,1362,フクロウがあしらわれておりますので
1362,1364,視聴者さんがね
1364,1366,くださったロゴなんですけど
1366,1368,最近スパイとかね
1368,1370,フクロウとかそういうのが
1370,1372,パッと出た時にね
1372,1374,あ、そうだったそうだったみたいな感じにね
1374,1376,私自身なる時あるんで
1376,1378,気をつけていきましょう
1378,1380,では次
1380,1382,はぐきがじゃくてんさんからの普通お歌ありがとうございます
1382,1384,不老不死について調べてみました
1384,1386,生物学における不老不死とは
1386,1388,通常では時間の経過に伴って
1388,1390,発生する老化が発生せず
1390,1392,もしくは一時的に発生しても
1392,1394,若返ることによって老衰による
1394,1396,死から間抜かれた状態のこと
1396,1398,だそうですね
1398,1401,2021年現在では不老と不死に近い特性を持つ
1401,1403,それぞれの特性
1403,1405,それぞれの特性を持つ生命、細胞は
1405,1407,確認されていますが
1407,1409,不老と不死のどちらの特性を持つ
1409,1412,生物、細胞は確認されていないらしいです
1412,1414,うん
1414,1416,不老不死、それぞれの
1416,1418,該当する動物はいるけど不老不死両方を
1418,1420,持っている動物はいないってことですね
1420,1424,不老に近い特性を持つ生物は
1424,1426,ベニクラゲと裸デバネズミ
1426,1428,うん
1428,1431,ベニクラゲは厳密には不老ではなく
1431,1433,成熟個体から未成熟の状態に戻れるという
1433,1435,若返りが可能で10回ほど若返ったことが
1435,1437,確認されています
1437,1439,裸デバネズミは病気に強く
1439,1441,癌になりにくいことも判明し
1441,1443,2018年の時点では研究所にいる
1443,1446,最も年齢が高いのは35歳
1446,1448,個人ブログでは推定40歳まで生きていると
1448,1450,書かれている方もいました
1450,1454,年齢に関連した疾患は非常に珍しく
1454,1456,えー、まあ、歳を重ねても
1456,1458,大部分ではあまり変化が見られず
1458,1460,病気や怪我を免れた個体は
1460,1462,理論上はずっと生き続けられる
1462,1464,うん
1464,1467,不死に近い特性を持つ生物は
1467,1470,まだはっきりと確認されてないみたいですが
1470,1473,不死に近い特性を持つ細胞があると
1473,1475,これはその細胞は人由来で
1475,1477,株化された
1477,1479,株化ってあれですね
1479,1481,Lガゼイシロタ株の株ですね
1481,1483,えー、ヒーラ細胞
1483,1485,ヒーラ細胞?
1485,1487,ヒカチュウ?
1487,1488,ヒーラ細胞ですね
1488,1490,この細胞はガン細胞である細胞には
1490,1492,テロマエ、え、テロメア
1492,1494,テルマエロマエになりそうちょっと
1494,1495,えー、テロメアですね
1495,1498,テロメアを再構築するテロメラーゼ
1498,1502,テロメアを再構築するテロメラーゼ
1502,1504,www
1504,1507,テロメアを再構築するテロメラーゼ
1507,1509,テロメアを再構築するテロメラーゼ
1509,1511,テロメアを再構築するテロメラーゼ
1511,1512,という構図が含まれており
1512,1514,ガン細胞になったことで
1514,1517,自らのテロメアを無限に再生することができますと
1517,1519,うん
1519,1522,これすごいですね
1522,1525,これね、このニュースを見て思ったのは
1525,1526,このままAIが発達して
1526,1529,ヒーラ細胞や裸でバラズミの遺伝子層の構造などが
1529,1532,解明されて倫理観を取っ払っちゃえば
1532,1535,何十年か後には不老死が可能となるのではないでしょうか
1535,1539,というね、お便りをいただいておりました
1539,1541,そう、大事なことなので3回言いました
1541,1543,www
1543,1545,これね、あの
1545,1547,最近ね、私
1547,1550,天地創造デザイン部ってアニメをね
1550,1551,見ていたんですよ
1551,1554,最近というか、ほぼ1日で見終わっちゃったんですけど
1554,1556,12話、13話?うん
1556,1558,どんなアニメかっていうと
1558,1560,あの、いわゆるその
1560,1564,神様がね、動物を作ったみたいな感じの世界観
1564,1567,一応世界観のベースなんですけど
1567,1570,神様が全部動物作るのちょっとだるいから
1570,1573,あの、害虫、デザイナーさんに害虫したよっていう
1573,1576,動物のデザインをね、話しで
1576,1578,あの、まあその神様からのね
1578,1580,クライアントからのオーダーが
1580,1582,すごいざっくりしてるんですよ
1582,1584,そう、なんかあの
1584,1587,可愛いけど可愛くないやつとか
1587,1588,そうそう
1588,1591,若返るやつ!みたいな感じの
1591,1594,すごいざっくりしたお題に対して
1594,1596,そのデザイナーチームがね
1596,1599,いろんなその特技があるデザイナーさんが
1599,1602,個性の強いデザイナーさんが集まってるんですけど
1602,1604,がそのいろんな動物をね
1604,1606,こんなのどうでしょうクライアントって出して
1606,1608,それが採用して
1608,1611,このオーダーからキリになったんだとか
1611,1614,このオーダーからコーラになったんだっていうのがね
1614,1615,非常に面白く
1615,1618,動物の生態が学べるとってもね
1618,1620,いいアニメだったんですけど
1622,1624,要件定義が甘いオーダーがたくさん来るやつ
1624,1625,そうそうそうそう
1625,1627,でなんかすごいざっくりした
1627,1628,オーダー来たと思ったら
1628,1629,めちゃくちゃなんか
1629,1630,一回出すじゃないですかそれで
1630,1631,じゃあこれで
1631,1634,これで一回確認お願いしますって言ったら
1634,1637,ちょっとこういうのじゃないんですよね
1637,1638,なんかもっとこう
1638,1640,グッとくる感じにできたりします?
1640,1642,みたいな感じのオーダーになって
1642,1644,いやもうそれも意味わかんないし
1644,1646,イメージしてるのがあるんだったら
1646,1648,最初に言語化して伝えてくれます?
1648,1649,みたいな
1649,1650,そういうね
1653,1654,そういうデザイナーさんの苦労もね
1654,1656,垣間見える非常に
1656,1658,オーダー時点で甘いのに
1658,1660,これじゃなくてって言ってくるやつね
1660,1662,あるあるだと思うんですけど世の中にね
1663,1666,っていうそのデザイナーさんの苦しみも分かるアニメで
1666,1668,これね確かね
1668,1670,紅クラゲと裸デーバネズミ
1670,1672,両方出てきたはずなんですよ
1672,1675,そう若返る生き物っていうので紅クラゲ
1675,1678,であと社会性がすごいしっかりしてる生き物っていうので
1678,1683,裸デーバネズミが出てきたと思います確か
1683,1685,でね私あの
1685,1688,裸デーバネズミの
1688,1689,なんて言うんだろうな
1689,1691,すごいねなんか
1693,1696,人類保管計画みたいな生き物だなーって
1696,1698,初めて見た時思ったんですよ
1698,1700,裸デーバネズミを動物園で生で見た時
1700,1703,なんかそのどういう生き物かっていうと
1703,1706,ちょっとモグラみたいな感じで毛がないネズミ
1706,1708,みたいな感じで
1708,1710,実体としては結構アリみたいな
1710,1711,そうアリそう
1711,1714,社会性って聞くとアリとかハチとか連想するって
1714,1716,今コメントいただいてるんですけど
1716,1719,本当にアリにそっくりで
1719,1722,その女王を中心として
1722,1725,女王の周りに繁殖用のいくつか何人かオスがいて
1725,1728,であとは働き
1728,1731,働き裸デーバネズミたちがね
1731,1733,兵隊たちがいるんですよそう
1733,1737,でどんな役割があるかっていうと
1737,1740,いろいろその巣を拡張していく係とか
1740,1743,餌をゲットしてくる係とかいっぱいあるんですけど
1743,1747,赤ちゃんのベッドになる仕事とかね
1747,1752,何匹も何匹も織り重なって赤ちゃんの布団になる
1752,1753,っていうお仕事とか
1753,1757,あと外敵がヘビなんですけど
1757,1761,ヘビが巣に攻めてきたら
1761,1764,率先して自分から食べてもらって
1764,1768,兵隊が自らヘビの口に飛び込んでいって
1768,1772,お腹いっぱいになってもらって帰っていただくっていう
1772,1776,そういう非常にホスピタリティの高い役割の方もね
1776,1778,いたりして
1778,1781,タンク食ね
1781,1786,本当にね巣全体で一つの生き物みたいな
1786,1788,なんかトカゲとかで
1788,1791,しっぽを切ってしっぽを食べさせて
1791,1794,自分本体を逃げるみたいなのはありますけど
1794,1797,裸でバレずみほどねやっぱりその
1797,1799,全体主義的なね
1799,1803,社会性を持った巣はね
1803,1806,本当に興味深いなと思いながら見てました
1806,1808,そうそうそう子より善なんだよな
1808,1809,そうでね
1809,1813,さっき鳥の糞の話したんですけど
1813,1816,鳥がなんであんなに頻繁に糞をするかっていうと
1816,1821,空を飛ぶために体重を軽くしないといけないじゃないですか
1821,1823,であれ
1823,1825,なんか30分になってる
1825,1827,鳥の糞の話しちゃったら
1827,1831,鳥の糞の話しちゃうんですけど
1831,1834,だからその自分のその体を極限まで軽くするために
1834,1840,めちゃくちゃ糞をするっていう仕様になってるらしくて
1840,1844,そうそうだから私がね
1844,1848,東京ディズニーシーでミッキーと会う前に
1848,1851,糞がね落下してきたのも
1851,1855,まあ致し方なしみたいなところもねありますよね
1855,1858,鳥もやっぱその糞したくてしてるわけじゃなくて
1858,1861,体の構造上ね飛ばないといけないんで
1861,1868,やっぱり頻繁に糞しないといけないんだなーっていうことでね
1868,1872,こんなになんか深夜だからって言ってこんなふんふんふんふん言ってていいのかな
1872,1874,まあいっかはいということで
1874,1878,生き物のね話なのであの下品な話じゃないので
1878,1880,生き物の構造上の話なんでね
1880,1882,はいということで
1882,1884,ちょっとね
1884,1888,次もちょっとあのもう一つご紹介してもいいですか
1888,1890,ちょっとねあの
1890,1896,そういえば今回のね投稿フォームで
1896,1901,前回のねその私とオーラ旅行こと月の木チロルとコナンミヤで
1901,1905,火曜日の12時からねランチミーティングっていう配信をしてまして
1905,1908,そこでねちょっと今週のランチミーティングが
1908,1911,タイトルが今ね何になってたかな
1911,1919,包秘ツインターボミヤお前だけでも生きてくれっていうサブタイトルになってたと思うんですけど
1919,1927,あのこちらがね割と包秘の話をしてましてずっと
1927,1931,結構な結構長い尺で包秘の話をしてまして
1931,1937,ちょっとランチ中に包秘の話は厳しいですっていうねお便りいただいてました
1937,1941,でね今からちょっとまた厳しい話をするので
1941,1943,あーちょっとしんどいなーって
1943,1946,ちょっと下品の話はうーんっていう方はね
1946,1951,ブラウザーをね閉じていただく方がいいかもしれません
1951,1958,やっぱね基本的には皆さんに楽しんでもらうためにね配信してるので
1958,1964,ご飯中におならの話は厳しいなーっていう方ももちろんいると思うので
1964,1966,その時はねnot for meだなと思って
1966,1972,ぜひぜひもっと楽しい配信が世の中には楽しいコンテンツにあふれてますのでね
1972,1979,私も本当見るアニメがたまってたまってしょうがないですもん本当に
1979,1982,そう包秘だし出来次第だしね本当にすいませんでした
1982,1986,はいということで皆さんが楽しんでもらえるようにね
1986,1990,ただねちょっと私あのー
1990,1997,カニバリズムのね人体をこう食べる食べてるドラマを見ながらソーセージ食べられるんで
1997,2001,ちょっと人よりもしかしたら大きい範囲がね広い可能性があるんですね
2001,2004,なのでちょっとまあ皆様大変恐縮なんですけど
2004,2007,お気を付けいただければ幸いですね
2007,2010,はいというわけでちょっとあの次からもね
2010,2014,投稿いただいた方にも方からもね若干のしもれた男性にとっては
2014,2019,少し痛い話の可能性がありますというね注釈いただいてますのでご注意ください
2019,2023,包秘大あユング先生ありがとうございます
2023,2028,包秘大ありがとうなんか私が包秘したみたいですけどね
2028,2032,はいということでファデリアさんお便りありがとうございます
2032,2035,りかこさんこんばんは初投稿ですありがとうございます
2035,2039,私は大脳激辛糖で何でも辛くして食べたいと思っていて
2039,2042,宅上にカプサイシンパウダーを常備しているのですが
2042,2046,先日youtubeを見ながらいつものように夕食にカプサイシンパウダーをかけようとしていたところ
2046,2050,誤って自分側に思いっきりひっくり返してしまいました
2050,2052,うん
2052,2056,幸いにも私は裸足ではなかったので直撃を避けることはできたのですが
2056,2060,短パンの裾から一部侵入してしまったようで
2060,2065,服が真っ赤になって絶賛パニック中の私の金曜日にキラキラする部分に
2065,2068,突如灼熱火曜日が襲ってきました
2068,2072,あまりの刺激に悶絶しながらネットで対処法を検索するも
2072,2076,広大なネットの海にも前例がないのかこれといった情報はヒットせず
2076,2080,とりあえずシャワーで冷水を股間に当てるも刺激は悪化
2080,2084,その後刺激が引いていくまで10分ほど灼熱地獄を味わいました
2084,2086,うーん
2086,2090,という経験を私はこれまでに2度繰り返しています
2090,2093,2度あることはなんとやらという言葉もあるので
2093,2096,エルガコさんコメント欄の指揮者の皆さんの中に
2096,2101,股間に刺激物が付着した時の適切な処置を知っている方がいれば
2101,2104,来たる賛同身に備えたいので教えていただけないでしょうか
2104,2106,よろしくお願いします
2106,2108,ということでした
2108,2113,皆さんちょっと私はねこれに対抗する手段が思いつきませんでしたので
2113,2117,インターネット集合地に頼ろうかなと思って
2117,2119,油分だから水じゃ取れない
2119,2121,油には油ぶつける
2121,2126,カプサイシンは使用性なのでオリーブオイルかサラダ油
2126,2130,インターネットってすごいですね
2130,2133,ていうかカプサイシンって使用性なんだ
2133,2138,あれかななんかラー油とかに溶けてるのってカプサイシンなのかな
2138,2140,どうなんだろう
2140,2143,アルガリ性の洗剤で洗うといい
2143,2144,なるほどなるほど
2144,2149,ほかたりやさん皆さんからのアドバイスがありまして
2149,2156,オリーブオイルで股間を洗っていただくか
2156,2161,全身に油を塗ってからカプサイシンを使おうということでね
2161,2165,油には油をぜひぜひ使ってみてください
2165,2170,アルガリ性の洗剤で洗うといいというコメントもありましたので
2170,2174,ぜひぜひ
2174,2177,そうですね
2177,2179,股間にオイルもなかなかの地面っていうね
2179,2182,コメントいただいてちょっと笑ってしまったんですけど
2182,2184,今これを拾ってよかったのかどうかちょっと
2184,2186,分からないことだらけですね
2186,2189,やっぱり活動していく中で
2189,2191,暗中模索というかね
2191,2193,これどうなんだろうなと思いながら
2193,2198,これからも切磋琢磨していきたいと思います
2198,2206,では次のコーナーに行きたいと思います
2206,2209,いやちょっとよかったのか分かんないな
2209,2211,今週のメールテーマ
2211,2214,はいちょっとじゃあ爽やかな曲をね
2214,2217,流したいと思います
2217,2221,これが精一杯の爽やかなんですけど
2221,2224,週帰りのメールテーマ今週はですね
2224,2229,もしプロデュースするならこんなバーチャルアイドルということで
2229,2231,皆さんがもしプロデューサーアイドルのプロデューサーになったら
2231,2234,どんなバーチャルアイドルをデビューさせますかというね
2234,2241,投稿フォームにたくさんのお便りをいただいております
2241,2246,ということで早速1通目読んでいきたいと思います
2246,2250,ちょっとお水見ます
2250,2255,はいでは1通目
2255,2261,赤い青魔導士さんからのもしプロデュースするならこんなバーチャルアイドル
2261,2266,cc 経営のバーチャルアイドルユニット-20
2266,2271,他のアイドルとは何が違うって
2271,2274,100%の私で楽しませるというコンセプトのもと
2274,2278,作詞作曲歌うのはもちろん会場設営や音響の設定も
2278,2280,自分たちでやるという
2280,2282,時代をあ時代って言っちゃった
2282,2286,音は別ベクトルでの時給時速っぷり
2286,2291,その妥協を許さない会場へのこだわりは歌唱と同等以上とも言われ
2291,2294,自分たちで撮影した楽屋裏のメイキング映像では
2294,2296,いい意味で火花が散ります
2296,2301,自分たちのライブに対して文字通り1からいや0からならぬ
2301,2304,無が配布なんですね
2304,2308,から100までこだわり抜く熱意にあらゆる人が度肝を抜かれるでしょう
2308,2311,ということで手作り系アイドルですね
2311,2314,いやめちゃくちゃいいなと思って
2314,2318,せっかくすごい良いご得をいただいたのにびっくりするほど噛んでてね
2318,2320,驚いちゃいました私も
2320,2324,ちょっとお水飲みます
2324,2327,今びっくりするほど噛んでませんでしたが
2327,2329,自分で驚いちゃった
2329,2335,昨日もなんかめちゃくちゃツイッターで配信の告知したわ
2335,2338,したったわみたいな感じのね
2338,2341,椅子にあぐらかいて座ってたんですけど
2341,2344,全然してなくてびっくりしちゃいましたね
2344,2346,なんでだろう
2346,2351,枠を立てたことですごい満足してしまって
2351,2353,忘れちゃうっていうのがね
2353,2356,まあまああるんですよね
2356,2360,それで言うとね私コミュニティの投稿を2週間忘れてるんですよね
2360,2363,これあまり大きい声では言いませんけど
2363,2365,大きい声で言わないといつつね
2365,2368,ワールドワイドに今発信してるんですけど
2368,2372,コミュニティの投稿を2週間忘れています
2372,2374,この2週間何度かね
2374,2375,ふって思い出したんですよ
2375,2378,あコミュニティの投稿忘れてたと思って
2378,2380,今日やろうって思った日は
2380,2384,おそらく4日ぐらいあったんですよね
2384,2386,4回ほど思い出したんですけど
2386,2388,そのね
2388,2390,3歩歩いたらもう忘れててね
2390,2392,というのもまあしょうがないんですよね
2392,2394,私フクロウだから
2394,2396,鳥居頭にできてるんでね
2396,2398,そういう風に生まれてしまったんで
2398,2400,運命なんでね
2400,2401,うん
2401,2402,ということで
2402,2405,これ1から10まで自分でやるアイドル
2405,2407,めちゃくちゃいいなと思いました
2407,2412,なんかVTuberさんって結構自分でいろいろ作れる方多いので
2412,2415,もういるかもしれないなとは思ったんですけど
2415,2417,曲作曲できる方とかね
2417,2419,パトラちゃん様とか
2419,2421,作曲自分でされて
2421,2424,歌も歌って動画も作ってね
2424,2426,いちかさんとかも歌ってみたの
2426,2429,動画自分でイラストも書かれて
2429,2431,動画も作られてね
2431,2435,今度ミックスの勉強もするみたいなことを配信でおっしゃってましたし
2435,2437,うん
2437,2438,でねそうそうそう
2438,2440,何食べればそうなるんだろう
2440,2447,そうだからなんか本当にいろいろできる方がね多いので
2447,2449,これね結構もう
2449,2452,もしかしたらいるかもなとは思いますし
2452,2454,今後もしかしたらね
2454,2457,こういう形でデビューされる方がいたらね
2457,2460,めちゃくちゃ先見の目がありますよね
2460,2463,ということでお便りありがとうございました
2463,2464,では次
2464,2467,えー
2467,2472,戸田さんからのもしプロデュースするならこんなバーチャルアイドル
2472,2476,コンセプトはお酒を意識したアイドルグループ
2476,2478,グループ名はリキュール
2478,2482,メンバー名は名前にリキュールの名前をそのままか一部入れると
2482,2484,カシスちゃんとか
2484,2486,カルーはミルクちゃん
2486,2487,などね
2487,2490,メンバー間でそれぞれのリキュール名を組み合わせたオリジナルカクテル名で
2490,2493,様々な活動を行うと
2493,2495,えーこれあれですかね
2495,2501,例えばそのジンジャーエール担当とビール担当が合体してシャンディーガフンになるみたいな
2501,2503,そういうことですよね多分
2503,2505,20歳以上はお酒の名前
2505,2508,20歳以下の未成年はソフトドリンクの名前などにして
2508,2512,組み合わせに幅を持たせるのもいいかもと
2512,2516,でここまで考えて念のためこのコンセプトのグループが実在しないかと検索したら
2516,2520,カクテル研究所という名前のグループが存在しました
2520,2524,せっかくなのでこのまま投稿させてもらいますということでね
2527,2532,これね私も調べたらカクテル研究所さんありました
2532,2535,そうでね担当のなんか
2535,2538,レッドアイ担当みたいな感じでね
2538,2543,多分その自分のそのいわゆるグリーン担当の〜ですみたいなアイドルの方
2543,2546,多いじゃないですかカラーが決まってる
2546,2550,がお酒になってるっていうねあの方はいました
2550,2558,ただねそれぞれがその例えばリキュール担当みたいな感じになって
2558,2561,コアントロみたいな感じの担当になって
2561,2567,こうコラボする相手によってねカクテルのコラボ名が変わるみたいなの
2567,2570,すごいオシャレだなぁと思ったんで
2570,2573,めちゃくちゃいいなぁと思いました
2573,2577,まぁねあのうちのねU-CAN KISSアニマリにもビール担当すでに
2577,2581,ビール担当と黒霧島担当がねちょっと被っちゃっているんですけど
2581,2586,あのいるのでねそうこれはいいんじゃないですかね
2588,2594,結構ね7CINCお酒たくさん飲まれるイメージの方多いのでね
2594,2598,なんか作ってほしいですよねお酒アイドル
2598,2601,お酒アイドルグループぜひぜひ
2601,2605,ということでとたさん素敵なお便りありがとうございました
2605,2607,では次
2609,2612,CDモフモフクラブさんからのね
2612,2617,もしプロデュースするならこんなバーチャルアイドルということで
2617,2620,CDモフモフクラブさんは前回CDモチモチクラブさんで
2620,2623,前々回までCDモグモグクラブさんだったんですけどね
2623,2628,私がのモの滑舌が悪すぎたので解明してくださいました
2628,2630,ありがとうございますご配慮ね
2630,2632,早速読んでいきましょう
2633,2636,現代社会に生きる若者は時間が足りない
2636,2640,私はそんな忙しい人でも推せる究極のアイドルをプロデュースしました
2640,2643,その名もうまやどこれアルファベットでね
2643,2647,U-M-A-Y-A-R-Dでうまやどです
2647,2650,このグループは10人の発言を同時に聞き分けた逸話を持つ
2650,2653,聖徳太子ことうまやどの巫女にちなみ
