start_s,end_s,text
2796,2798,もしかしたら長いのかな
2800,2802,もしかしたら長いのかな
2802,2804,スイッチとかでね
2804,2806,触されてたりとか
2806,2808,スチームとかも出てると非常にやりやすくて
2808,2810,助かります
2810,2812,狼は外せない
2812,2814,私ね狼多分3回ぐらい
2814,2816,やってんだけど
2816,2818,3回ぐらいやってんだよね
2820,2822,でもなんか忘れるゲームだから人は
2824,2826,いいかもしれません
2826,2828,狼もね絶景版やりましょうか
2828,2830,はい
2830,2832,ということで
2832,2834,13期兵防衛剣もねぜひやりたいと思います
2834,2836,ありがとうございました
2836,2838,では次
2840,2842,ゴーストトリックまだやってないですね
2842,2844,やってない
2844,2846,これになってた
2846,2848,では次
2850,2854,人と会うと挨拶代わりにお腹を強く触られる系おじさん
2856,2858,お便りありがとうございます
2858,2860,強く触られちゃうんだね
2860,2862,よっぽどなんか包容力があるのかな
2862,2864,多分お腹の印象が
2868,2870,おーほらさん
2870,2872,久々のうららじ
2872,2874,お疲れ様ですありがとうございます
2874,2876,いつもおうらさんの朝配信
2876,2878,序盤では電気ケトルくんが大活躍していますが
2878,2882,私の家でも最近新しい電気ケトルくんを購入しました
2882,2884,ただこの電気ケトルくん
2884,2886,0.8リットルサイズでご丁寧に
2886,2888,0.8リットルのメモリの横に
2888,2890,MAXと書かれて
2890,2892,これ以上は入らないぞ
2892,2894,と我々に教えてくれているのですが
2894,2896,私の家族はそれを無視して
2896,2898,電気ケトルくんに入るだけ水をぼち込むのです
2898,2900,なので電気ケトルくんも
2900,2902,毎回ダメ!
2902,2904,溢れちゃう!ってなる
2904,2906,ただ感じでお漏らししてしまい
2906,2908,家族の反感を受かっています
2908,2910,私はそんな電気ケトルくんが不憫になりません
2910,2912,しかし止めようにも
2912,2914,私の家族内の発言力ときたら
2914,2916,女性の買い物に付き合う男性レベル
2916,2918,毎日己の不甲斐なさを
2918,2920,食えるばかりです
2920,2922,そこで質問ですが
2922,2924,エルカコさんの電気ケトルくんはお漏らしはしますか?
2924,2926,無視する場合はやけどの危険もあるので
2926,2930,どうかお気を付けください
2932,2934,っていうお便り来ました
2934,2936,マジでいいお便り
2936,2938,マジでいいお便りだなと思って
2938,2940,読みました
2940,2942,ルカコさんの電気ケトルくんは
2942,2944,お漏らしはしますか?
2944,2946,というご質問をいただいているんですけども
2946,2948,私はですね
2948,2950,メモリをきちんと
2950,2952,メモリのマックス以下で
2952,2954,いつも沸かしておりますので
2954,2956,私のティファールくんは
2956,2958,お漏らししたことは
2958,2960,ありません
2960,2962,こちらがね
2962,2964,人と会うと挨拶代わりに
2964,2966,お腹を強く触られる系
2966,2968,おじさんさんのですね
2968,2970,何かしらプラスになればいいかなと
2970,2972,思うんですけれども
2972,2974,メモリ以上に入れるとやっぱり
2974,2976,溢れますね
2978,2980,でも人間っていうのは
2980,2982,たとえ分かっていても
2982,2984,っていうのは多分にあるんですよね
2984,2986,そう
2986,2988,ああ
2988,2990,これ以上
2990,2992,これ以上を
2992,2994,普通おたを
2994,2996,普通おたの話を
2996,2998,膨らませるとどう考えたって
2998,3000,2時間コースだなって
3000,3002,分かっていても
3002,3004,普通おたを読みたくなってしまう
3004,3006,このお便りだけはどうしても読みたい
3006,3008,なんかそういう時ってあるでしょ
3008,3010,今ちょうど
3010,3012,普通おたが溢れています
3012,3014,人と会うと挨拶代わりに
3014,3016,お腹を強く触られる系
3016,3018,おじさんのこの電気ケトルの
3018,3020,お便りを読みたいなって
3020,3022,思うその気持ちが
3022,3024,私の配信時間を
3024,3026,溢れさせているんですよ
3026,3028,漏らさせているといっても過言ではないな
3028,3030,だから
3030,3032,多分ねご家族もそういう気持ちで
3032,3034,ままならない気持ちを
3034,3036,抱えながら水をたっぷり
3036,3038,入れてるんじゃないかなって
3038,3040,思います
3040,3042,お便り本当にありがとうございました
3044,3046,その後のねケトルくんの様子も
3046,3048,もし気が向いたら
3048,3050,送ってください
3052,3054,ということで次のコーナーいきたいと思います
3056,3058,次のコーナーはですね
3058,3060,勝手にメールテーマ
3060,3062,ということで
3062,3064,どういったコーナーになるかと申しますと
3064,3066,私がですね
3066,3068,かなり配信中
3068,3070,余計な話をね
3070,3072,では次と言いながら
3072,3074,別の話を始めることがたまに
3074,3076,ありまして
3076,3078,脱線してどんな話をするかっていうのはですね
3078,3080,本当はラジオっていうのは
3080,3082,始まってから
3082,3084,オープニングトークをして
3084,3086,そのオープニングトークにひも付いたメールテーマを
3086,3088,募集することができたら一番いいんですけども
3088,3090,残念ながら
3090,3092,一人で全部やってるので
3092,3094,リアルタイムでメールテーマを募集できないから
3094,3096,私はどんなオープニングトークをして
3096,3098,どんなテーマを募集しそうかな
3098,3100,みたいなのを
3100,3102,事前に予想して送ってください
3102,3104,っていうコーナーになります
3106,3108,あはははは
3108,3110,はいということで
3110,3112,いつも読ませていただきたいと思います
3112,3114,叩いてかぶってエビせんべいさんからの勝手に
3114,3116,メールテーマ
3116,3124,ちょっとねトロピカーな100%アップルを飲みたいと思います
3128,3130,ルカコさんこんばんは
3130,3132,こんばんは
3132,3134,今日のメールテーマは
3134,3136,ウララジのアーカイブを朝見返す人のために
3136,3138,午前中のFMラジオごっこをやろう
3138,3140,でしたね
3140,3142,朝枠のむにゃむにゃした雰囲気のルカコさんも素敵ですが
3142,3144,頭がシャッキリしている今だからこそできる
3144,3146,朝ラジオを聞いてみたいです
3146,3148,うん
3148,3150,ということで
3150,3152,あはははは
3152,3154,あなんかFMっぽい曲
3154,3156,FMっぽい曲あるかな
3158,3160,ちょっと探してみましょうか
3162,3164,これFMっぽいかな
3164,3166,ちょっとわかんないけど
3170,3172,おはようございます
3172,3174,午前9時を回りました
3174,3176,通勤中の方も家事をなされている方も
3176,3178,ランニング中だよって方も
3178,3180,皆様いかがお過ごしでしょうか
3180,3182,大浦るカコのウララジ
3182,3184,in the morning
3184,3186,本日も1時間よろしくお願いいたします
3186,3188,関東圏の交通情報は
3188,3190,9時15分から
3190,3192,そして9時40分からは
3192,3194,暮らしのお悩み相談
3194,3196,プレゼントドバイ暮らしのマーケットを
3196,3198,お届けします
3198,3200,それでは早速お便りに参りましょう
3200,3202,東京都三次大女性
3202,3204,ラジオネームまーちゃんさんから
3204,3206,この番組を聞きながら
3206,3208,毎朝車で息子の
3208,3210,送り迎え頑張ってます
3210,3212,とのことです
3212,3214,まーちゃんさんありがとうございます
3214,3216,関東地方は昨晩雨が降って地面が濡れていますから
3216,3218,どうかお気をつけて
3218,3220,行ってらっしゃい
3220,3222,リクエストいただいたのは私も大好きな曲
3222,3224,では
3224,3226,どうぞマルーン5で
3226,3228,シュガー
3228,3230,ブーブー
3230,3232,おおーらるかこの
3232,3234,裏ラジインザモーニング
3234,3236,あ
3236,3238,英語を聞かせればよかった
3240,3242,おおーらるかこの
3242,3244,裏ラジインザモーニング
3244,3246,なんかラジオのさ
3246,3248,ラジオのDJの方ってみんな
3248,3250,死ぬほど発音がいいじゃないですか
3250,3252,私死ぬほど
3252,3254,カタカナ発音だから
3254,3258,やっぱちょいダサいね
3258,3260,やっぱちょいダサい
3260,3262,なんであんなにみんな
3262,3264,発音がうまいんだろう
3268,3270,戻ってきたな
3270,3272,やっぱこの曲じゃないと落ち着かない
3274,3276,えーということでね
3276,3278,マルーン5のシュガーは
3278,3280,権利の関係で流せないんですけど
3280,3284,マルーン5のシュガーってどんな曲だっけ
3284,3286,え
3288,3290,サンデーモーニングは分かるんだけど
3290,3292,あのサンデーモーニング
3292,3294,サンデーモーニング
3294,3296,ってやつでしょ
3296,3298,絶対こんなんじゃないんだけど
3300,3302,うわー
3302,3304,シュガーなんだっけ
3304,3306,歌詞を
3306,3308,てっきりサンデーモーニングの方かと思いきやね
3308,3310,確かに
3310,3312,翌日の朝聞いてくれてる人は
3312,3314,もう日付の
3314,3316,暦の上では土曜日なんで
3318,3320,サンデーモーニングと
3320,3324,なんかトゥルルルルルルルルルルル
3324,3326,みたいなやつは知ってるんだけど
3326,3328,マジで思い出せないシュガーが
3328,3330,え
3330,3332,今聞きたいけど
3332,3334,今聞いたら配信に乗っちゃうよ
3334,3336,配信に乗っちゃうよ
3336,3338,はいということでね
3338,3340,え配信終わったら
3340,3342,存分にシュガーを聞きたいと思います
3342,3344,誰か歌ってくんない
3344,3346,誰か歌ってくんないか
3346,3348,はははははは
3350,3352,そう今聞いたら
3352,3354,暮らしのマーケットしちゃうんだよ
3354,3356,あそう多分ね
3356,3358,あの私が今歌ったのは
3358,3360,ムーブスライクスジャガーらしいです
3360,3362,ね
3362,3364,えーでは
3364,3366,次のね勝手にメール
3366,3368,テーマいきたいと思います
3370,3372,シュガーマジ何
3372,3374,あーもう一回気になり始めたら
3374,3376,もう聞かざるを得ないんだが
3376,3378,え
3378,3380,PVを思い浮かべる
3380,3382,いやシュガーの
3382,3384,ミュージックビデオ見たことない
3384,3386,ははは
3386,3388,シュガーESB
3388,3390,シュガーESB
3390,3392,ESB
3392,3394,ダメだ何にも分かんない
3394,3396,えーでは次のね
3396,3398,ちょっとこういうのって
3398,3400,少し時間を置くと思い出せる
3400,3402,時あるんですよ
3402,3404,だからしばらくしたらもしかしたら
3404,3406,典型のように
3406,3408,シュガーのメロディが
3408,3410,私から生まれいずる
3410,3412,可能性が
3412,3414,あるかもしれません
3414,3416,はい
3416,3418,えーでは次の勝手にメール
3418,3420,出させていただきたいと思います
3420,3422,えーぎっしり
3422,3424,ムリミライナーさんからの
3424,3426,勝手にメールテーマ
3426,3428,ルカコさん
3428,3430,庁員の皆さんこんばんは
3430,3432,えー結局この話題になってしまうのですね
3432,3434,どこから脱線した話題か
3434,3436,えーもはやリスナー含め
3436,3438,誰も覚えていませんが
3438,3440,アニマルメンバーのギャルギャが出たら
3440,3442,各メンバーはどんなキャラになるかという話題で
3442,3444,まさか火が昇ってしまうとは
3444,3446,えー個人的にククタソの
3446,3448,主人公の悪友ポジションかと思いきや
3448,3450,1週目で特定のフラグを立てると
3450,3452,2週目でお前
3452,3454,女だったのかイベントが発生し
3454,3456,3週目で攻略対象として
3456,3458,解放されるキャラというのが解釈一致ですけど
3458,3460,やはりルカコさん本人となると
3460,3462,なかなかイヤンが浮かんでこないものですね
3462,3464,うん
3464,3466,そこで私は攻略対象
3466,3468,ミヤチの友人としてほんの少しだけ
3468,3470,登場した非攻略対象にもかかわらず
3470,3472,一部で熱狂的な人気を博し
3472,3474,SNS等でまるで
3474,3476,公式化のように自滅な設定が勝手に
3476,3478,狙われたファンアートが広まり
3478,3480,初見がそういうキャラだと思って
3480,3482,いざプレイしてみると立ち絵は1枚
3482,3484,ボイスもつかずセリフも3
3484,3486,見事程度
3486,3488,という事実に困惑させたものの
3488,3490,根強い声に応えてリメイク版で
3490,3492,ついに固有ストーリー追加
3492,3494,シリーズ屈指の攻略などへ結ばれたのか
3494,3496,結ばれなかったのか分からない
3496,3498,解釈が分かれるルートエンディングなどが
3498,3500,完全に解釈一致
3500,3502,公式ピクシブ見てた?と
3502,3504,期待になるキャラを押します
3504,3506,ちなみにギャルゲーはエアコンなので異論は認めます
3506,3508,というお便り頂きました
3510,3512,これさ
3512,3514,私結構
3514,3516,デビューしてすぐの時に
3516,3518,アニマーレの美少女ゲームを
3518,3520,作るっていう
3520,3522,配信したんですよ
3522,3524,完結編やってない
3524,3526,ってことをこのお便りで思い出した
3526,3528,やろうかな
3528,3530,なんかあの架空の
3530,3532,ほんと
3532,3534,え?なんか私デビューしてから
3534,3536,ずーっと架空の話してる?もしかして
3536,3538,ずーっと
3538,3540,架空の話してるのか
3540,3542,あの架空の会議を
3542,3544,架空の企画を練る会議をするっていう
3544,3546,配信をしてた時期があって
3546,3548,その一環でね
3548,3550,アニマーレの美少女ゲームを作ってたんだけど
3550,3552,すごいなんか
3552,3554,風呂敷をめちゃめちゃ広げすぎて
3554,3556,閉じるのがすごい大変になっちゃって
3556,3558,2回くらいやって
3558,3560,まだね終わってないんですよね
3560,3562,その時はねクキタソはね
3562,3564,あのーなんかね
3564,3566,過去現在未来編
3566,3568,みたいなんでメンバーが分かれてて
3568,3570,でその過去
3570,3572,現在未来
3572,3574,それぞれにクキタソが偏在してるんだよね
3574,3576,全てにおいて
3576,3578,クキタソがその過去編
3578,3580,現在編未来編の
3580,3582,3タイトルあるんだけど
3582,3584,全てがその裏で繋がっていて
3584,3586,で実は
3588,3590,なんだっけな
3590,3592,でその過去現在未来で
3592,3594,時空がその時間が流れているか
3594,3596,と思いきや
3596,3598,未来編が一番その
3598,3600,時間軸としては昔の話で
3602,3604,で未来
3604,3606,過去現在
3606,3608,みたいな感じで一回その文明が
3608,3610,終わって
3610,3612,で
3612,3614,未来編で文明が一度終わって
3614,3616,からの過去現在
3616,3618,みたいな感じで
3618,3620,あのー
3620,3622,最終的にその未来編で
3622,3624,起こった
3624,3626,今3部作の3タイトル目
3626,3628,未来編で起こった
3628,3630,悪役の死が
3630,3632,ここまでその連綿と
3632,3634,物語の
3634,3636,黒幕を担っていたみたいな感じの
3636,3638,話だった気がする
3638,3640,気がするね
3644,3646,でねあのギャルゲーっていう
3646,3648,コンセプトだったのに
3648,3650,あの全くキャラクター
3650,3652,自体のそのストーリーの深掘りが
3652,3654,できてないんだよね
3654,3656,でクキタソだけが全ての
3656,3658,世界線を行き来しながら
3658,3660,あのー
3660,3662,世界を救おうと頑張ってるっていう
3662,3664,話
3664,3666,だから主人公と
3666,3668,クキタソだけ
3668,3670,あの世界化を行き来してるんだよね
3670,3672,うんだから
3672,3674,それで言ったらなんか
3674,3676,主人公の悪役ポジションといっても過言ではないっすよね
3676,3678,じゃあ繋がるわ
3678,3680,入れられるこれ
3680,3682,うん
3682,3684,でなんかやっぱ私は別になんか
3684,3686,私のことを攻略したいって思わないから
3686,3688,他のアニマルメンバーは攻略したいけど
3688,3690,あんま興味ないから
3690,3692,うんこれでこれぐらいが
3692,3694,ちょうどいいっすね
3694,3696,元々別に
3696,3698,攻略対象じゃなくて
3698,3700,たまにちょっと出てくるモブキャラぐらいが
3700,3702,ちょうどいい
3702,3704,で
3704,3706,感じですね
3708,3710,あそうミルシェスのギャルゲームもね
3710,3712,考えてたんだよね結構ねそれぞれ
3712,3714,そのストーリーとかね最後の
3714,3716,あの告白の
3716,3718,セリフとかも考えたんだけど
3718,3720,あれもなんかまたね
3720,3722,作らず終わってるんで
3722,3724,3人揃ったらね
3724,3726,1回やりたいなと思ってるんですけど
3728,3730,あそう好きでござね
3730,3732,そう私あの告白の最後
3732,3734,あの攻略し終わった後
3734,3736,オーラルカコルート
3736,3738,一番最後私の告白ゼリフ
3738,3740,好きでござ
3740,3742,なんですよ
3742,3744,なんで
3744,3746,って感じでした
3746,3748,ちょっとあれまたやりたいっすね
3748,3750,なんか
3750,3752,美少女ゲームに詳しい
3752,3754,指揮者を招いてね意見をお聞きしたいです
3754,3756,やっぱりなんかあんまり自分で
3756,3758,そのやった
3758,3760,なんだろうな蓄積がないから
3760,3762,これが果たして本当に
3762,3764,あのプレイヤーに
3764,3766,受け入れてもらえるのかってところが一つね
3766,3768,不安なんで
3768,3770,ありがとうございます思い出せてくれて
3772,3774,では次
3776,3778,えーこれなんだっけ
3778,3780,あフグか
3780,3782,川の豚と書いてフグか
3782,3784,フグって川でもなければ豚でもないですよね
3784,3786,そうだね
3786,3788,確かに
3788,3790,あれ
3790,3792,海の豚がいるか
3792,3794,海の豚がいるか
3794,3796,で川の馬がカバー
3796,3798,だっけあれ違ったっけ
3798,3800,ちょっと地面で見ないと分かんないな
3802,3804,なんかあの
3804,3806,まなんだろう
3806,3808,なんで動物を
3808,3810,動物で例えるのって
3810,3812,思いますよね
3814,3816,なぜ動物を動物で
3816,3818,例えるというか
3818,3820,動物で当てはめる感じを
3820,3822,思いますよね
3822,3824,確かにね
3824,3826,フグは確かに川でもなければ
3826,3828,豚でもないよね
3828,3830,その辺は中国由来なんだ
3830,3832,なるほどね
3832,3834,えーということで
3834,3836,川でもなければ豚でもないですよね
3836,3838,さんからの勝手にメールテーマ
3840,3842,本日のメールテーマ
3842,3844,つるしぼち
3844,3846,つるしぼし
3846,3848,つるしぼしって言いにくいよ
3848,3850,つるしぼしに適した
3850,3852,つるしぼしに適した都道府県
3852,3854,について語らせていただきます
3854,3856,試験を申し上げれば
3856,3858,保守安さだけで決めるなら
3858,3860,高知県でしょ
3860,3862,室戸市と
3862,3864,水を洗濯ばさみで固定するだけで
3864,3866,重なりもなく均等に乾きます
3866,3868,しかしこの干し方をすると
3868,3870,水分を吸った中央部のみで
3870,3872,高知県が伸び
3872,3874,四国をオーストラリアで代用できなく
3874,3876,なってしまうためおすすめはできません
3878,3880,また青森も
3880,3882,つるしやすく少し伸びた程度であれば
3884,3886,大間崎
3886,3888,大間崎を函館に寄せれば
3888,3890,津軽海峡が
3890,3892,伸びることもないため
3892,3894,つるしぼしに適しているかと思われがちですが
3894,3896,そうではありません
3896,3898,重みで横浜町から
3898,3900,6か所村
3900,3902,6か所村
3902,3904,にかけて避けてしまうため
3904,3906,つるしぼしには向かないでしょう
3908,3910,それを踏まえ最もつるしぼしに向く
3910,3912,都道府県は新潟県でしょう
3912,3914,横長の地形を3点でハンガーに
3914,3916,洗濯ばさみで固定すれば
3916,3918,重みで伸びるようなこともなく
3918,3920,さらに百均などで販売している
3920,3922,フード付きの衣類を干すための
3922,3924,ハンガーであれば佐渡島も
3924,3926,乾きやすいです私の主張は
3926,3928,一応となりますがごそのご意見があれば
3928,3930,ぜひお聞かせください
3930,3932,ということでした
3932,3934,ちょうど佐渡島はどうするんだろうってコメント来て
3936,3938,皆さん
3938,3940,都道府県つるしぼし検定
3940,3942,一級じゃん
3942,3944,本気で
3944,3946,都道府県のつるしぼしについて考えて
3946,3948,くれてると私すごく素敵だと思う
3950,3952,そう
3952,3954,佐渡島に関しては
3954,3956,フードを干すためのハンガーでやります
3958,3960,青森はカーテンレールで
3960,3962,引っかかりそうでいいよね
3962,3964,確かに確かに
3964,3966,そうですね
3966,3968,島があるとね島があると大変だよね
3968,3970,わかる
3970,3972,島がない都道府県じゃないと干せないですよ
3972,3974,だってその
3974,3976,さあつるしぼしってことはさ
3976,3978,どっかをピンチで止めるわけじゃん
3978,3980,だから
3980,3982,都道府県で
3984,3986,で濡れてる場合は
3986,3988,真ん中が重くなってしまうわけでしょ
3988,3990,集合部の重みで高知県が伸びちゃうから
3992,3994,え
3994,3996,シガーとかは
3998,4000,シガー
4000,4002,シガーがいいんじゃない
4004,4006,シガーってやっぱ真ん中に
4006,4008,デッキへ風穴開いてるからさ
4008,4010,いいんじゃない
4010,4012,乾くんじゃない
4012,4014,早く
4014,4016,え
4016,4018,美箱にフック通せるじゃん
4018,4020,シガー県って一番乾きやすくない
4022,4024,優勝じゃない
4024,4026,個人的にはね
4026,4028,シガーでお願いします
4028,4030,穴伸びちゃう
4030,4032,確かに美箱がもっとでかくなっちゃうか
4034,4036,そっか
4038,4040,確かにな
4040,4042,しかも風穴じゃなくて湖だもんね
4042,4044,溢れ出してるのか水が
4046,4048,確かに
4048,4050,形状保持の観点で難しいか
4050,4052,なるほどね
4052,4054,都道府県つるしぼし連盟かなり面白いですね
4054,4056,多分これがどうやって発展していくかっていう勝手に見えるテーマのコンセプトとしては
4056,4058,この間ねるちゃんのね
4058,4060,昨日かな
4060,4062,ねるちゃんのチャンネルでやってたね
4062,4064,爆穴王
4064,4066,放射付きの爆穴王っていう
4066,4068,七市円区
4068,4070,九市のね
4070,4072,エンターテイナーたちが一同に会して
4072,4074,クイズを解くという問題で
4074,4076,クイズを解くという配信でですね
4076,4078,やっぱね
4078,4080,都道府県の中でも
4080,4082,四国に弱いんですね
4082,4084,七市円区メンバーっていうのは
4084,4086,うーん
4086,4088,らしいんですよどうも
4088,4090,なんで
4090,4092,そのあたりから発展していくのかなって
4092,4094,予想いただいたのかなって思いました
4094,4096,あははははははは
4096,4098,ね
4098,4100,私も一回その日のくまランさんの
4100,4102,保護者枠で出させていただいたことが
4102,4104,ありますけれども
4104,4106,うーん
4106,4108,あれはやっぱちょっとねやっぱりめちゃめちゃ緊張しましたけど
4108,4110,やっぱ
4110,4112,ね保護者として出演するっていうので
4114,4116,緊張しましたけど非常に楽しかったですね
4116,4118,あははははははは
4120,4122,はいということで
4122,4124,えー
4124,4126,皆さんご評価ありがとうございました勝手に
4126,4128,メールテーマでした
4128,4130,ね
4130,4132,つるしぼうしについてぜひとも皆さん考えてみて
4132,4134,はいかがでしょうか
4134,4136,では
4136,4138,こちら最後のコーナーですね
4138,4140,今週のメールテーマにいきたいと思います
4140,4142,えー最強のファーストインプレッション
4142,4144,ということで
4144,4146,私このファーストインプレッションっていう
4146,4148,なんか多分ねプレッションが好きなんだろうね
4148,4150,この弾ける感じ
4150,4152,うーん
4152,4154,よく使うんですよファーストインプレッション
4154,4156,って言葉言いたいだけなんですけど
