start_s,end_s,text
1542,1544,あの個人的に
1544,1546,何も分からんけど
1546,1548,美術展行って面白いなって思うポイントなんですよね
1548,1550,うん
1550,1552,今回チンポムに関してはマジで何も
1552,1554,返ってこなかった
1554,1556,ははははははは
1556,1558,何も返ってこなくて
1558,1560,それはそれで学びになりましたね
1560,1562,うんあとなんかあの
1562,1564,渋谷の
1564,1566,渡りウムだったかな
1566,1568,でやってる展示も行けました現代アートの
1568,1570,えっと
1570,1572,ナム
1572,1574,ちょっと待ってねあれ何ていうタイトルだっけな
1576,1578,渡りウムでやってる
1582,1584,これはね
1586,1588,四角トリップ展
1588,1590,です
1590,1592,名前知ってるのは
1594,1596,あーそうですね
1596,1598,ナムジュンパイクさん
1598,1600,とか名前聞いたことあるけど
1600,1602,あとオラファエリアソンは
1602,1604,オラファエリアソン展っていうのがなんか
1606,1608,オラファエリアソン展もどっかでやってたなっていう
1608,1610,記憶があるぐらいなんですけどこれは結構
1610,1612,面白かったですね
1612,1614,うんなんかあの
1614,1616,いろんな人の
1616,1618,あの展示が
1618,1620,あるのでこれもこれでやっぱり
1620,1622,その一つにまとまらず
1622,1624,これはすげー面白いけど
1624,1626,これはマジでわからんみたいなのが
1626,1628,かなり差別化がはっきりできるんで
1628,1630,うんあの
1630,1632,非常におすすめです渡りウムの方は
1632,1634,っていう感じでしたね
1634,1636,はははははは
1638,1640,でもマジでアートマジでわからんですね
1640,1642,うんマジでわからんですよ
1642,1644,正直なんか
1644,1646,あの西洋絵画とかも
1646,1648,タイミングが合えば
1648,1650,いけるときは言ってるんですけど
1650,1652,ゴッホとか
1652,1654,あのセザンヌとか
1654,1656,見ても
1656,1658,マジでわからん
1658,1660,はははははははは
1660,1662,いやーなんか
1662,1664,すごいんだろうなみたいな
1664,1666,やっぱなんかすごい著名な画家
1666,1668,っていう先入観があるから
1668,1670,これをすごいと思わないといけない
1670,1672,っていう前提条件が自分の中にできて
1672,1674,しまっててあんまりこう素で
1674,1676,こう受け入れることができないんだけど
1676,1678,じゃあこれが例えばその辺に
1678,1680,なんかポイって置かれてたとして
1680,1682,路地裏とかにね
1682,1684,私はこれをすごいと思えるのかな
1684,1686,絶対思わないだろうなって
1686,1688,はははははは
1688,1690,すごい写実的とかだったら
1690,1692,すごい写実的とかだったら
1692,1694,すごさってわかるんだけど
1694,1696,もはやその写真が一般化された時代からって
1696,1698,もはやその写真が一般化された時代からって
1698,1700,もうなんか写実的に描くことを
1700,1702,みんなやめてるじゃん
1702,1704,みんなやめてるじゃん
1704,1706,そういう例えばそのバンクシーとかもそうですけど
1706,1708,バンクシーはでも面白いな
1708,1710,面白いなすげーなーと思うけど
1710,1712,すげーなーと思うけど
1712,1714,バンクシーとかって
1714,1716,バンクシーとかって
1716,1718,いやこの話ちょっと終末します
1718,1720,いやこの話ちょっと終末します
1720,1722,はははははは
1722,1724,これ以上はちょっとなんか
1724,1726,24日のね
1726,1728,今回そのカフカが
1728,1730,課題図書で
1730,1732,課題図書で読書会をね
1732,1734,やらせてもらうんですけど
1734,1736,なんかリプライとかね
1736,1738,この課題図書を読んだ方の
1738,1740,リプライとかいただいてて
1740,1742,マジ何もわからなかったですって
1742,1744,リプライ来ててすげー楽しみなんで
1744,1746,またね
1746,1748,なんかアートの話とか
1748,1750,含めて
1750,1752,何もわからんアートについて
1752,1754,アートとか文学作品についてね
1754,1756,アートとか文学作品についてね
1756,1758,週末日曜日の24時から
1758,1760,くれさんと一緒に話したらなと思うので
1760,1762,これはちょっと週末の楽しみに
1762,1764,とっておきたいと思います
1764,1766,私もこれから読みます
1766,1768,いやー何もわかんなくて
1768,1770,大の字になっちゃう いやー楽しみだなー
1770,1772,はははははは
1772,1774,はははは
1774,1776,えーでは次
1778,1780,えードグーさんからの
1780,1782,普通お便りありがとうございます
1782,1784,えールカコさん
1784,1786,リスナーの皆様こんばんは
1786,1788,そしてルカコさんおかえりなさい
1788,1790,ありがとうございます
1790,1792,今回ルカコさんがお休みの間に
1792,1794,獅子王クリスさんのチャンネルで投稿された
1794,1796,スティルトンチーズに関する普通ではない
1796,1798,お便りをお送りします
1798,1800,私自身興味が出たので少し調べてみました
1800,1802,これねあのー
1802,1804,私がお休みの間に獅子王クリスさんの
1804,1806,シュガーリリックの獅子王クリスさんのチャンネルで
1806,1808,あげてもらった私とクリスさんと
1808,1810,日笠ともしかさんとね
1810,1812,3人で不思議な夢を
1812,1814,見るっていう噂のチーズ
1814,1816,スティルトンチーズを食べて
1816,1818,翌日の朝寝起きでね
1818,1820,どんな夢を見たかっていうのを
1820,1822,クリスさんが動画撮って
1822,1824,まとめてくれたっていうね
1824,1826,ものが上がっております
1826,1828,はい
1830,1832,まずスティルトンチーズが
1832,1834,奇妙な夢を見せると言われる幽縁は
1834,1836,2005年に英国チーズ協会が
1836,1838,発表したスウィートドリームス
1838,1840,アーメイドオブチーズです
1840,1842,この報告では男女100人ずつの
1842,1844,200人を6つのグループに分け
1844,1846,それぞれに1週間
1846,1848,同じチーズを就寝の30分前に
1848,1850,20g食べさせました
1850,1852,これを7日間行い夢を記録したそうです
1854,1856,その結果スティルトンチーズでは
1856,1858,アカムではないものの奇妙な夢を
1858,1860,見た人が多かったようでした
1860,1862,本文では
1862,1864,そのルビットオブクレイジードリームス
1864,1866,鮮明で狂ったような夢
1866,1868,やザモストビザレ
1868,1870,ビザレドリームス
1870,1872,最も突拍子もない夢
1872,1874,というような表現がなされています
1874,1876,実例としてぬいぐるみとの会話
1876,1878,夕食パーティーのゲストが
1878,1880,ラクダと入れ替わっている
1880,1882,兵士が銃の代わりに
1882,1884,子猫を手にして戦っているなどがありました
1884,1886,え?銃より強い子猫
1888,1890,個人的に
1890,1892,面白かったのは
1892,1894,ベジタリアンのワニが子供を
1894,1896,食べられないことを理由にブチ切れです
1896,1898,うはははは
1898,1900,それでいうと
1900,1902,ともしくさんとるかこさんが見た行動向けの夢は
1902,1904,この地図に起因したのかもしれません
1904,1906,このような実験が行われていること
1906,1908,自体驚きだったのですが
1908,1910,ステルトンチーズが奇妙な夢を見せると証明するには
1910,1912,もう少し別の実験も
1912,1914,必要だと考えられます
1916,1918,具体的にはチーズを食べずに寝た時に
1918,1920,見た夢も記録しておく
1920,1922,というものです
1922,1924,そもそも人によっては
1924,1926,夢を見がちということもあるかと思われますので
1926,1928,そういう意味では
1928,1930,お三方がチーズを食べた時とそうでない時の夢を
1930,1932,記録し継げなければ
1932,1934,正確なデータが取れない
1934,1936,ということになります
1936,1938,今後継続的に実験をしてみるのはいかがでしょうか
1938,1940,うはははは
1940,1942,さてこの奇妙な夢を見る原理ですが
1942,1944,もちろん解明されていません
1944,1946,しかし候補物質の一つとして
1946,1948,チラミンというものが
1948,1950,挙げられています
1950,1952,チラミンは
1952,1954,ノルアドレナリンやノルアドレナリンという
1954,1956,候補物質を放出させる物質です
1958,1960,放出されたノルアドレナリンが
1960,1962,睡眠や覚醒のサイクルに関与する脳内の領域に
1962,1964,関与することで
1964,1966,無意識から夢のパターンを変化させるのではと
1966,1968,言われています
1968,1970,ざっと調べてみるとステルトンチーズには
1970,1972,チラミンが他のチーズよりも多めに入っているようです
1972,1974,といっても体に害をなすには
1974,1976,一度に250gから5kg食べる計算になるようで
1976,1978,誤差の範囲なのかもしれません
1978,1980,まあ実験では20gしか食べてない
1980,1982,ということなんでね
1982,1984,チラミンは他の食材にも
1984,1986,含まれる物質ですので
1986,1988,これが本当に効いているかは分かりません
1988,1990,最後に私自身
1990,1992,科学に携わる人間ですので
1992,1994,何でもかんでも科学で
1994,1996,理解したくなるのも分かります
1996,1998,ただこんなに奇妙で
1998,2000,興味深い現象に科学のミスを入れるのは
2000,2002,物推だとも思います
2002,2004,科学で解明できない夢のようで
2004,2006,幻想的なチーズがあってもいいんじゃないかな
2006,2008,なんて思ってしまいます
2008,2010,というお便りをいただきました
2010,2012,いや面白いですね
2012,2014,なんか夢
2014,2016,確かにね
2016,2018,私普段
2018,2020,基本的にあんまり夢を見ないんですね
2022,2024,結構死んだように寝るので
2024,2026,ほんと泥を
2026,2028,かぶったようにぐっすり寝て
2028,2030,一度も起きずに
2030,2032,あの
2032,2034,アラームも完全無視して
2034,2036,日々過ごしておりますので
2036,2038,この間それで
2038,2040,朝枠寝過ごしそうになったんでね
2040,2042,たまたまでその
2042,2044,ステルトンチーズを食べた日は
2044,2046,あの
2046,2048,高級マンションに住んでいる人々が
2050,2052,あの避難する途中
2052,2054,そのマンションのね
2054,2056,エントランスで
2056,2058,頭に穴を開けられて
2058,2060,キーホルダーにされるっていう夢を見たんですけれども
2060,2062,これが7月のライオン事件
2062,2064,っていう事件なんですけど
2064,2066,わからないよ
2066,2068,なんでそんな7月のライオン事件っていうのかわからないけど
2072,2074,松潤が
2074,2076,今から7月のライオン事件の話を
2076,2078,いたしましょうってその話をしてくれて
2078,2080,で
2080,2082,エピソードをね
2082,2084,ステルトンチーズの結果ですっていう形で
2084,2086,お話した動画が
2086,2088,クリスさんがまとめてくれてるんだけど
2088,2090,それで言うと
2090,2092,私クリスさんと
2092,2094,豚味噌を食べた日から
2094,2096,しばらく変な悪夢をね
2096,2098,見続けたんですよ
2098,2100,あれなんか年末だったかな
2100,2102,去年の年末頃に
2102,2104,豚ののを食べてから
2104,2106,本当に連日悪夢だったの
2106,2108,だから夢って
2108,2110,割と食べたものに
2110,2112,影響されうるんじゃないかって
2112,2114,思うんですよね
2114,2116,ふふふふ
2116,2118,そうだからなんか
2118,2120,豚の呪いもあるしチーズの
2120,2122,影響もあるんじゃないかなって個人的には
2122,2124,思ってるんだよな
2124,2126,なんか夢日記をつけるとね
2126,2128,あの名刺勤って言って
2128,2130,自分がその夢の中に
2130,2132,今これは夢
2132,2134,として自分がこれは
2134,2136,見ているんだなってことが分かるようになるっていう
2136,2138,話も聞いたことあって
2138,2140,ただ名刺勤って
2140,2142,あの見たら見たで別になんかいいことない
2142,2144,っていうか
2144,2146,あんまりよくないって
2146,2148,いう話も聞くんで
2148,2150,それはそれで怖いなっていう
2152,2154,思うんですよね
2154,2156,ちょっと面白そうではあるんだよね
2156,2158,ちょっと1ヶ月くらいつけてみようかな
2158,2160,名刺勤
2160,2162,見れるように
2162,2164,ふふふふ
2166,2168,夢に色をつける訓練したことある
2168,2170,へー
2170,2172,たまにあこれ夢やなって思うとき
2172,2174,ありますね
2174,2176,私はねあの
2176,2178,いつあったかな脳みそ食べたときだったか
2178,2180,分かんないですけど
2180,2182,悪夢だから目覚めようって
2182,2184,何回も何回もしてるのに全然目覚められない
2184,2186,っていう
2186,2188,夢を見たことがありますね
2188,2190,あれ本当にきつかったな
2190,2192,悪夢から目覚めようとして
2192,2194,必死に
2194,2196,こう例えばなんか
2196,2198,高いところから落ちるとか
2198,2200,うん
2200,2202,自分の腹をさばくとか
2202,2204,そういうことをするんだけど
2204,2206,一生起きられなくて
2206,2208,何度もそれを繰り返すっていう
2208,2210,無限列車編みたいなこと
2210,2212,しました
2212,2214,怖いよね
2216,2218,えー
2218,2220,ということで
2220,2222,ドグさんいつもね
2222,2224,非常に学術的に面白い
2224,2226,お便りをありがとうございます
2226,2228,では
2228,2230,次
2230,2232,【コメント】特命の方からのお便りですね
2232,2234,ふつおたありがとうございます
2234,2236,ルカクさんとリスナーの皆さんこんばんは
2236,2238,こんばんは
2238,2240,一年とちょっと前から応援しているVTuberの方に
2240,2242,ファンレターを送れるようになったとのことで
2242,2244,文明を考えているのですが
2244,2246,応援の気持ちを伝えたいだけなのに
2246,2248,エロそう
2250,2252,ごめん
2252,2254,あの最悪な読み間違いっていうか
2254,2256,最悪な噛み合い
2256,2258,があったんですよ
2258,2260,読み間違いっていうか
2260,2262,最悪な噛み合い
2262,2264,あのエロそうなではなく
2264,2266,エラそうなです
2266,2268,エラそうな
2270,2272,エラそうな文章になってしまうことに
2272,2274,悩んでいます
2274,2276,例えば頑張ってくださいという言葉
2276,2278,すでに頑張っている人間に対して
2278,2280,頑張ってくださいというのは何か違う気がして
2280,2282,別の言い方にしようと考えていますが
2282,2284,良い言い回しが思いつきません
2284,2286,頑張ってくださいの違う表現方法を
2286,2288,ご教授いただけると幸いですよね
2288,2290,ちょっと一回深呼吸
2290,2292,しましょうか
2298,2300,観音小説を送るなということでね
2300,2302,えー
2302,2304,今度ね七味インク全体で
2304,2306,ファンレターを
2306,2308,受け付けることになったんですけど
2308,2310,私あたりね観音小説を送って
2310,2312,いただいても私は個人的には
2312,2314,一向に構いませんが
2314,2316,七味さんのチェックが事前に
2316,2318,我々に転送される前に
2318,2320,入ってしまうので
2320,2322,私は良くても
2322,2324,七味はどうかなというところはちょっとあります
2324,2326,読みたいですけど私は
2326,2328,オリジナル観音小説
2328,2330,ただまあどうなんだろう
2330,2332,まあほぼ9割
2332,2334,9割5分弾かれてしまうかな
2334,2336,っていう
2336,2338,思いますけどね
2338,2340,ふふふふ
2340,2342,でねこれ
2342,2344,あのー他にもね
2344,2346,せっかくファンレター送れるようになったので
2346,2348,可愛い便箋を選んで
2348,2350,送りますねって言ってくださる方も
2350,2352,いて本当にめちゃめちゃ嬉しいし
2352,2354,個人的にあの
2354,2356,文通とかにね
2356,2358,やっぱ憧れが
2358,2360,あるんで非常に
2360,2362,嬉しいなと思いますし
2362,2364,ね返事がねかけたらいいんですけどね
2364,2366,そういうサービスは
2366,2368,行っていないようで
2368,2370,でねこれやっぱなんか
2370,2372,偉そうに偉そうになっちゃう
2372,2374,ことをやっぱ
2374,2376,懸念してるっていうことを一番最初に
2376,2378,書けばもう無問題
2378,2380,無問題だと思いますね
2380,2382,うん
2382,2384,でやっぱりなんかその
2384,2386,相手に対して
2386,2388,どうこう
2388,2390,っていうことではなく
2390,2392,あなたがこうしてくれたことによって
2392,2394,私はこんなに恩恵を
2394,2396,受けましたみたいな
2396,2398,もうほんと自分語りでいいと思うんですよね
2398,2400,ファンレターだもん
2400,2402,だからあなたが
2402,2404,こういう風に配信してくれることとか
2404,2406,こういう言葉を伝えてくれること
2406,2408,とかこういう配信で
2408,2410,あのこんな風に
2410,2412,私を楽しませてくれて本当に
2412,2414,いつもありがとうございます
2414,2416,みたいなことでいいんじゃないですかね
2416,2418,うん私はあなたがこれからも
2418,2420,この活動を続けて
2420,2422,いってくれたらとても嬉しいです
2422,2424,自分基準で書いたら
2424,2426,いいと思うし
2426,2428,やっぱね私のラジオのフォームもね
2428,2430,本当に
2430,2432,気を使って書いてくださる方
2432,2434,言葉を尽くして書いてくださる方が
2434,2436,非常に多いので
2436,2438,こういうことを書くと
2438,2440,起運民と受け取られてしまうかもしれませんがとか
2440,2442,なんか本当に
2442,2444,あの余計なことだと
2444,2446,わかってはいるんですがみたいな感じで
2446,2448,前置きをつけてね書いてくださるだけで
2448,2450,本当に受け取り方も柔らかく
2450,2452,なるし
2452,2454,ああ配慮してくださってるんだなって
2454,2456,思い出しておりますので
2456,2458,うん
2458,2460,それで十分だと思います
2460,2462,うん
2462,2464,自分がねこういう懸念をしていますとか
2464,2466,こういう風に伝わってほしい
2466,2468,ファンレターですっていうことを書くだけで
2468,2470,十分だと思いますね
2470,2472,うん
2472,2474,そして
2474,2476,ナシチェックは絶対に入りますので
2476,2478,少なくとも
2478,2480,観音小説をね送ってくださると
2480,2482,ナナシは読みます
2482,2484,あなたの観音小説を
2484,2486,ね
2486,2488,それだけは本当に信じてほしい
2488,2490,少なくとも
2490,2492,くるねこななしがあなたの観音小説を
2492,2494,読みます
2494,2496,それが何かしらの救いになればいいですよね
2496,2498,ふふふふ
2498,2500,はははは
2500,2502,はいえーということで
2502,2504,えーそんな形でね
2504,2506,えー何かしらプラスになればいいんですけど
2506,2508,では次
2508,2510,えー
2510,2512,ルーちゃん聞いて聞いてさんからの
2512,2514,ふつわたありがとうございます
2514,2516,えーるかこさんこんばんは
2516,2518,こんばんは
2518,2520,えーつみぼんつみゲーム
2520,2522,つみわんがとうとう退席している中恐縮ですが
2522,2524,るかこさんは先日スイッチ版が
2524,2526,発売された13期兵防衛権を
2526,2528,ご存知でしょうか
2528,2530,このゲームは優秀なSF作品に贈られる
2530,2532,声援運賞の第51回
2532,2534,ノミネー
2534,2536,第51回にノミネーとされ
2536,2538,各ゲームメディアでも大絶賛されていました
2538,2540,うん
2540,2542,ジャンルとしてはアドベンチャープラス戦略シミュレーション
2542,2544,特に評価されている
2544,2546,ストーリーはSFと
2546,2548,みんな大好き自分が得るものが
2548,2550,13人の少年少女たちのそれぞれの
2550,2552,オムニバスな視点から語られていきます
2552,2554,えーこのゲームを
2554,2556,満の言葉を尽くしてあらゆる人に
2556,2558,おすすめしたいんですけど
2558,2560,どうか情報ゼロで楽しんでほしいので
2560,2562,面白いよ
2562,2564,としか言えなくなってしまいつらいです
2564,2566,何にも伝わんねーや
2566,2568,皆さんやリスナーさんもこの気持ち
2568,2570,わかりますよね
2570,2572,わかれ!わかってくれ!
2572,2574,13期兵防衛剣
2574,2576,ゲームでしか体験できないのが爆発しそうなストーリーが待っています
2576,2578,配信は難しいタイトルだと思いますので
2578,2580,どうか裏で体験版だけでも
2580,2582,いや公式ホームページで
2582,2584,キャラクターが動いているのを見ていただくだけでも
2584,2586,幸いです
2586,2588,令和のゲームにブルマの体育会警備少女が見られますよ
2588,2590,という
2590,2592,お便りいただきました
2592,2594,13期兵防衛剣ね
2594,2596,体験版やりましたよ
2598,2600,めちゃくちゃビジュアルがいいですね
2602,2604,すごいビジュアルがいい
2606,2608,動きとか
2608,2610,がね
2610,2612,いわゆるその
2612,2614,なんだろうな
2614,2616,あー難しい
2616,2618,弾丸論破みたいな
2618,2620,弾丸論破みたいな
2620,2622,ビジュアルっていうわけではないんだけど
2622,2624,世界観の構築の仕方が
2626,2628,弾丸論破っぽい
2628,2630,いやーわかんないな
2630,2632,めちゃめちゃ下手なんだけど
2632,2634,例えが
2634,2636,ゲームをゲームで例えるなって感じなんだけど
2638,2640,なんか非常にその
2640,2642,演出としても素晴らしいし
2642,2644,純粋にキャラクターもかわいいし
2646,2648,雰囲気が非常にいい
2648,2650,ゲームでした
2650,2652,タイピックが本当にビレー
2652,2654,バニラっていう会社さんなんですかね
2654,2656,だからねすごいね
2656,2658,あのー
2658,2660,ヌルヌル動くとかじゃないんだよね
2662,2664,世界観と
2664,2666,ゲームの魅力を引き出すのに
2666,2668,最適な演出って感じだった
2668,2670,空気感も非常にいいし
2670,2672,ジュブナイルっぽさも
2672,2674,非常に伝わってきましたよ
2674,2676,なんか
2676,2678,あのー
2678,2680,1分くらい遊べるのかな体験版だけで
2682,2684,それぞれのキャラクター同士が
2684,2686,密接に関わっていくんだろうなって
2686,2688,思うし
2688,2690,キャラクターもかわいくて
2690,2692,デザインもすごい可憐でね
2692,2694,いいですよね
2694,2696,これやりたいなーって思ってるんだけど
2698,2700,遺憾性やっぱね
2700,2702,セキロが終わってない
2702,2704,セキロが終わっていませんので
2704,2706,今度ね
2706,2708,それについてのお便りもいただいてたんですけど
2708,2710,私人生の必修ゲーム
2710,2712,っていうシリーズで
2712,2714,ゲーム実況を
2714,2716,ゲーム配信をしたいなって思っていて
2716,2718,皆さんからね
2718,2720,ご協力いただいて
2720,2722,これは確かに
2722,2724,ハードは古いけど
2724,2726,絶対に人生においてやっておくべき
2726,2728,だっていう
2728,2730,タイトルを皆さんからちょっと
2730,2732,教えていただいて
2732,2734,それを
2734,2736,普段私
2736,2738,こういうことを言うのも
2738,2740,本当に恥ずかしい話なんですけど
2740,2742,極力1時間ぐらいで終わろうっていう
2744,2746,そういう気持ちはあるんですよ
2746,2748,配信をね
2748,2750,そうしてると
2750,2752,ゲームが本当に一向に進まないんですよね
2752,2754,ゲーム配信が
2754,2756,だから
2756,2758,ストーリーの長いゲームは特にね
2758,2760,そういうその縛りを一回外して
2760,2762,長時間
2762,2764,できるようなね
2764,2766,感じで
2766,2768,昼間とかから
2768,2770,割と長尺でやろうかなって思ってるんですけど
2770,2772,それに対してね
2772,2774,色々このゲームがおすすめだよっていう
2774,2776,リプライとか
2776,2778,フォームのね
2778,2780,お便りもいただいてるんで
2780,2782,レウィークあたりから始められたら一番いいなと思うんですけど
2782,2784,ちょっと考えて
2784,2786,おきたいと思います
2786,2788,はい
2788,2790,おきたいと思います
2790,2792,マザーとかね
2792,2794,マザーとかポータルとか
2794,2796,13期兵防衛剣もやりたいんだけど
