start_s,end_s,text
5945,5949,ハッシュタグをつけてるツイートを私に対して発信してくれてるわけだから
5950,5953,ただねやっぱ気をつけないといけないのは
5953,5955,インターネットっていうのは
5955,5958,もうどこに書こうがファブリックってことですね
5958,5960,それはそう
5960,5963,どこに書こうがパブリックスペースだし
5963,5965,あなたのツイッターのインエラーも
5965,5968,世に公開されているカギアーカ以外は
5968,5970,そう気をつけた方がいい
5970,5972,そういうことは本当に気をつけた方がいい
5973,5977,だから推しのエッチなイラストとかを
5977,5979,いいねしていた場合は
5979,5982,それを見られたくなかったらカギアーカにするか
5982,5986,本人をブロックしたファンアカウントにするしかない
5987,5988,そうですね
5988,5990,だからどこに行ったって
5991,5994,どこに行ったってパブリックス
5996,5999,お互いねその覚悟を持ちながら
6000,6003,最近ツイッターくん割とガバだからね
6003,6005,ブックマークもバレるかもしれないし
6005,6007,カギアーカも貫通するから気をつけな
6007,6009,本当にそう
6010,6012,ツイッターはガバい最近は
6012,6014,私はツイッターくんのことすごく好きだし
6014,6016,愛してるけど
6017,6019,とってもガバいです
6021,6024,カギアーカだからって安心しない方がいい
6025,6027,本当に見られて困ることは
6027,6030,お家でメモ帳に書こう
6030,6032,いらない紙に書こうな
6032,6034,インターネットに放出しちゃダメ
6034,6037,とかスマートフォンのメモに書こう
6038,6040,それでいこう
6040,6042,カギアーカ思いっきり貫通して笑った
6042,6044,そうなんだよね
6044,6046,気をつけよう
6046,6048,ワンチャンバレていいんじゃないかな
6048,6050,カギアーカみたいなやつだけだったら
6050,6054,そのラインがいいラインじゃない?
6054,6056,そのライン
6056,6058,そうしましょう
6058,6060,デッキや穴に叫んどこうね
6064,6068,次のお便り読ませていただきたいと思います
6070,6073,これもいくつか同様のお便りいただいてたんですけど
6073,6075,【コメント】布なしシューさんからの人のお仕方を笑うな
6075,6077,お便りありがとうございます
6077,6079,ありがとうございます
6079,6081,【コメント】ルカコさんスーさんこんばんは
6081,6085,趣味の世界では同じことを好いているはずなのに
6085,6087,上を目指したい人と楽しみたい人の熱量の違いで
6087,6090,圧力が生まれることをしばしば見かけます
6090,6094,お仕方によっても同じことかなと思った経験を投稿します
6094,6096,数年前友人の相違で
6096,6099,オタク趣味の人たちの飲み会に参加した時のこと
6099,6101,私の近くの宅にいた人が
6101,6103,VTuberの話をしていました
6103,6106,リアルでVTuber好きを講演している人を初めて見た私は
6106,6109,興味本位でその宅の会話に参加
6109,6111,自分もVTuberを見ているよと伝えると
6111,6113,その人の第一声は
6113,6117,え?じゃあ推しの配信欠かさず全部見てるんだよね
6117,6119,しばらく会話をしていましたが
6119,6121,好きなVTuberの話の合間には
6121,6123,イベントには必ず参加した話
6123,6125,グッズをすべて買った話
6125,6127,当人は上等がつもりでいたのかもしれないですが
6127,6131,この人はストイックに推し活をするガチの人だと悟りました
6133,6136,自分もその人が好きなVTuberさんの配信を見ていたのですが
6136,6138,見てますよという勇気は湧かず
6138,6141,当たり障りのないことを言って別の席に移動しました
6141,6143,見られる範囲で追いかけている自分は
6143,6145,推し活をしていると言えるのか
6145,6147,にわかだと思われたんだろうか
6147,6149,自分がコミュニケーションだけかもしれないけど
6149,6151,熱量が違うと分かり合うのは難しいと
6151,6154,少し余裕の冷めて頭で思案した帰り道でした
6154,6156,お二人は好きなものは一緒だけど
6156,6158,方向性や熱量が違う人と関わるならば
6158,6160,どこまで許容することができますか
6162,6165,別日の回では自分がひけらがすがに回ってしまい
6165,6167,解散後に一人反省会をしたこともありました
6167,6170,結局おいたエトリーと一人反省会に疲れ
6170,6172,この回には行かなくなってしまいました
6172,6174,ツイッターので推し仲間がいる人を羨ましく思いながら
6174,6178,この人たちも似た経験をした末に仲間を見つけたのかなと考えています
6178,6180,あ〜なるほどね
6181,6183,ですね
6183,6185,いや難しいよな
6185,6187,難しいですけどね
6187,6190,全然熱量違くてもいいのになぁと思いますけど
6193,6197,気にしてしまう人はやっぱり気にしちゃうんだろうし
6199,6202,でも確かにそうだ私も結構
6203,6206,ちょっと見たぐらいのコンテンツで
6206,6211,オタクぶるわけじゃないんですけどみたいな言い訳しちゃう話すとき
6215,6220,でも例えば私の配信を
6222,6225,たまにリスナーさんで
6226,6228,リア対できなくてごめんなさいとか
6228,6230,あーはいはいはい
6230,6233,グッズ買えなくてごめんなさいとか
6233,6236,伝えてくださる方がいるんだけど
6236,6238,謝ることなんて何一つない
6238,6241,いや本当にそうそれは本当にそう
6242,6246,1秒でも見てくれたら感謝しかないから
6249,6252,そのあたりは全然気にしないでほしいし
6252,6254,こっちからしたら
6256,6260,グッズ買ってくれないとオタクじゃないみたいなのないからなんも
6260,6261,うんうん
6262,6264,なんもない
6265,6267,本当に本当にそう
6269,6271,あとなんか全てのコンテンツをね
6272,6278,見ようと頑張らなくてもいいんだよって思いながら生きてる
6278,6279,わかる
6281,6283,本当に本当に本当にそう
6286,6289,これもねなんか色々あったんですよね
6291,6296,推しのこの配信だけはちょっとどうしても受け付けないですみたいな
6296,6299,どうしたらいいでしょみたいなお便りも別でもらってたんだけど
6299,6300,はい
6300,6303,なんかそれはやっぱそのみんなそれぞれね
6303,6307,配信者エンターテイメントのカテゴリーで
6307,6310,いつもyoutubeでさカテゴリーを選ぶところがあるんだけど
6310,6313,いつもみんなエンターテイメントにしてると思うの
6313,6316,そうエンターテイメントというカテゴリーで配信してる以上
6316,6323,みんなが楽しく時間を過ごすために活動してると思うんでみんな
6323,6324,うんうん
6324,6327,主語でかいですけど少なくとも私はそうだし
6327,6328,そう
6328,6331,そうなった時になんか見るのが億劫だなとか
6331,6334,しんどいなって思われたらやっぱ悲しいから
6334,6335,うん
6335,6343,楽しいなって思えるコンテンツを見てくれるのが史上の喜びだね
6343,6344,いやそう
6344,6345,そう
6345,6347,そうなんですよ
6347,6348,うん
6348,6349,なんでね
6349,6355,あのーまあ難しいけど
6355,6358,まあこっち側からすると
6358,6362,自分が応援していただく側になった時は
6362,6367,そこのなんかそれぞれをしたいように
6367,6371,それぞれ楽しみたいように楽しんでもらうのが一番嬉しい
6371,6373,うん本当にそう
6373,6375,そうですね
6375,6380,あとはなんか自分がオス側になった時は
6380,6385,確かに上には上がいるなと思いながら喋ることはあるんだけど
6385,6386,うん
6386,6393,別になんかあのこの人なんかこの程度で好きって言ってんだと思ったことは一度もない
6393,6394,ないな
6394,6396,あははは
6396,6402,でもなんか本当に少数派ですけどマウント取りながる人とかもいますからね
6402,6407,そういう人とそういうなんか空気感差しちゃうと疲れるわってなる
6407,6412,あーマウント取られたらどうする
6412,6416,えもうあそうなんですねって言ってしれっとフェードアウトしていく
6416,6417,あー
6417,6419,あははは
6419,6420,そうか
6420,6421,うん
6421,6424,なんかでもどうなんだろうな
6424,6426,例えば飲み会で完全にフラットで
6426,6428,はい
6428,6432,今後例えばその友人の紹介とかでもなく
6432,6433,はいはい
6433,6435,完全に赤の他人で
6435,6436,はい
6436,6440,これ以上関わることもないだろうなっていう人に会話ないで
6440,6444,そこそこ好きだなと思ってるコンテンツでマウント取られるじゃないですか
6444,6445,はいはいはい
6445,6446,したとするじゃない
6446,6447,はい
6447,6449,っていうのを今脳内でシミュレーションしたんだけど
6449,6450,うん
6450,6452,ちょっとマウント取ってみてもらってもいいですか
6452,6456,えへへどうどういうマウント取ったらいいかな
6457,6458,えルカコさんさ
6458,6459,うん
6459,6461,あのー
6461,6464,こないだ始まったアニメ見た?
6464,6469,あーなんか1話だけ見た最新は生だけど全然見てない
6469,6470,あー原作は?
6470,6473,あ原作読んでないんだよねアニメで見ちゃおうと思って
6473,6476,あそうそうなのか
6476,6479,あれさ原作のね
6479,6484,何あのアニメでね表現されてない伏線とかがあるからさ
6485,6490,原作読んだ方がいいと思うんだよな
6490,6495,マウント取るの下手すぎて可愛い
6495,6497,わかんないよ
6501,6505,マウント取るの下手すぎて可愛いぜ
6505,6506,わかんない
6506,6510,ただただただただすずさんが可愛いだけの時間だった
6510,6517,純粋に原作見てほしいなっていうオタクの泣き声が聞こえただけだった
6517,6519,おもろ
6522,6526,例えば私がかつてされたマウントで言うと
6526,6527,はい
6527,6531,例えばそのなんて言うんだろうな
6531,6534,映画結構見ますよって言った時に
6534,6535,はいはい
6535,6538,黒沢明は見てるみたいな
6538,6539,あーはー
6539,6541,あー見てないんだ
6541,6546,まあやっぱ基本的になんか映画を見る上で
6546,6548,それが作品だと思うから
6548,6549,はいはいはいはいはい
6549,6552,やっぱり黒沢作品見てないってなると
6552,6556,映画好きを名乗るのはちょっとまだ早いかな
6556,6559,っていうマウントを取られたことがあるな
6559,6564,あとはやっぱドストエフスキー読んでない奴は何やらしてもダメみたいなことも言われたことある
6564,6566,ハードルが高いよ
6566,6570,少年の男性にマウントを取られてきたから今まで
6570,6573,そうですねあらゆる場面で
6573,6574,わー
6574,6575,と言った時に
6575,6578,それが例えばなんかなんて言うんだろう
6578,6584,仕事関係の人とか知り合いがその媒介にいるから言えなかったけど
6584,6588,そういうのがいなかったら絶対に言ってやりたいなと思うのは
6588,6592,あーこういうファンがコンテンツを殺すんですよね
6593,6596,うわすごくいいサンプルだ
6596,6599,強すぎるってカウンターが
6602,6609,やだなーこういう人間が多くいる界隈って本当に新しい人近づいてこないと思うんですよね
6609,6611,カジュアボーイだって
6618,6620,って言いたいよ
6621,6622,言いたいよな
6622,6624,気持ちいいだろうな言えたら
6624,6625,そう
6625,6628,誰がコンテンツを殺すのかですよ
6630,6631,本当よ
6631,6633,よくないよそういう
6633,6636,そうと思います
6637,6640,なんかねなんだろうね
6640,6642,やっぱりその
6642,6645,これも別のお便りであったんだけど
6646,6648,あのー
6649,6654,私の架空のマスコットキャラがめっちゃ話しかけてくるプリキュアのマスコットキャラみたいな
6654,6657,ルカちゃん大変おじさん息してないよ
6657,6664,今まで一度も見かけたことない私の架空のマスコットキャラがめっちゃ慌てちゃってるわ
6664,6667,いやそうあのねこれ別であったんだけど
6667,6671,腰に伸びてほしくないっていうお便り来てた
6671,6674,あー
6675,6678,腰に伸びてほしくないという
6678,6685,要はあの今ね私のあれだよねマウントに対する話で言うと
6685,6688,そういうその上から来るタイプとか
6688,6690,はいはいはいはい
6690,6700,新規をないがしろにしたりとか下げすんだりする風潮が強いところってやっぱ新しいお客さんが入ってこなくなっちゃうから
6700,6703,それこういうかコンテンツを殺すんだけど
6704,6709,意図してそうしてる可能性があるのかと思って
6709,6713,そうかもいっていますからね
6713,6717,そうそうそうメジャーデビューしたら興味なくすタイプね
6717,6720,友達にいるんだよな
6720,6723,メジャー行ってからおもんなくなったなみたいな
6723,6727,テレビで始めたからなんかあんまり尖ってなくてみたいな
6727,6732,そういうのがね結構ありますよね
6732,6741,ただなんか結局活動者もね生命なので
6741,6743,そうなんですよね
6743,6751,さっきも数字の話したけどやっぱ停滞したりとか逆に下がったりとかすると活動モチベーションは下がるんでね
6751,6759,なんでこれはね結局のところねあの推しの寿命を縮めると思う
6760,6768,だからもしその推しが長く活動してほしいなって思う場合は
6768,6772,結果的に長い目で広い視野を持ってみたら
6772,6775,伸びた方がいい
6775,6778,伸びた方がいいどのコンテンツにおいても
6778,6781,どのコンテンツにおいてもVTuberだけじゃなくて
6781,6786,あらゆるものにおいて結局のところその
6787,6790,なんていうんだろうな
6790,6793,そのプレイヤーのモチベーションが
6793,6797,どこにねそれぞれその全員が全員
6797,6802,数字に対して執着してるわけじゃないと思うんですけどもちろんね
6802,6808,ただ完全に分けても考えられないので
6808,6811,っていう気がするから
6811,6814,どちらにせよね
6814,6820,それがもしその閉じない閉じたことによって
6820,6825,マイナスはあるけど閉じなかったことによるマイナスはやっぱ少ない
6825,6829,どちらかといえばそのメリットの方が大きいんじゃないかなと思うんで
6829,6830,そうですね
6830,6833,ケースバイケースではあるんですけどね
6833,6836,と思います
6836,6840,だから伸びたら離れるのはマジで自由なんだよね
6840,6842,そうそれはそう
6842,6847,ただ伸びてほしくないというムーブをしてしまうのが
6847,6851,推しの寿命縮めるかもって意味
6851,6857,見る見ないっていうのは完全にリスナーさんの自由なんで
6857,6860,伸びたら離れるのも自由
6860,6864,完全に主張選択できる側ですからね視聴者さんは
6864,6868,なおかつなんかそのコンテンツに対して
6868,6874,ある程度の批評的な目線から発言したりとか
6874,6881,クリティシズム的に何かしら意見を言うみたいなものも完全に自由
6881,6888,ただそれは自由だしそのように楽しむっていう方法ももちろんあると思うけど
6888,6892,それがだから排他的になったりとか新しい人
6892,6893,そうね
6893,6896,そうそうそうなんか自分だけのものでいてほしい
6896,6901,末永く活動しほしいと思っているっていう前提のもとで
6901,6904,なんか自分たちだけのものでいてほしい
6904,6916,だから閉じ込んかするっていうのは結果的に将来未来の自分の楽しみを奪う可能性があるなっていうのを念頭に置いた方がいいかなって意味です
6916,6920,なのでね自由です遊び方は
6920,6926,ねそうそうそうそうなんでね
6926,6931,まあエンターテインメントだということをね
6931,6939,みんなが楽しむためのものであるということを毎日ツイートしていかないといけないな
6939,6941,そうね
6941,6948,推しがコリエンション伸びたいと思ってるかわからないパターンもあるわからないんだったらやんなほうがよくねじゃあ
6948,6953,わかんなくね推し何考えてるかわかんないから
6953,6959,わかんないだったらやんなほうがいいよ
6959,6966,推し自身がそのコミュニティを閉じつつあるっていうんだったら別にいいかなと思うけど
6966,6969,みんな閉じていけって言ってるんだったらもちろんそうしたら
6969,6970,そうそうそう
6970,6972,言ってないんだったら別に
6972,6979,今から閉じ込んになるから新規に絶対わかんねえ暗号作ろうぜみたいな感じだったら
6979,6985,そうそうそうでなおかつVTuberって新しい人がどんどん出てくるんで
6985,6989,今のままでいいですっていうのって
6989,6993,停滞ではなく減衰なんですよ
6993,6995,そうそうそう
6996,7004,なんでこの状態を維持していこうと思ったらある程度伸びるような活動していかないと減ります
7004,7006,そうですねそうなんだよな
7006,7010,っていうのはまあみんなわかってると思うんですけどね
7013,7019,だから今すごい活動として数字を持ってる人っていうのはそれ以上にめちゃくちゃ努力をしてる人っていうことですね
7019,7021,本当にすごいよ
7022,7024,本当にすごいよな
7024,7035,やっぱモチベーションの持続っていうのが大変なのにやっぱすげえなと思いながら推しを見ている
7038,7039,モチベーションね
7039,7041,そうモチベーションがすごいな
7042,7052,だからなんか末永く活動してほしいなと思いながら登録チャンネルを眺める日ある
7057,7059,そんな日あるのか
7059,7065,今日も栗山ヤンミーが1日に何度も配信しているみたいな
7065,7067,ヤンミーさんはちょっと恐ろしい
7067,7070,恐ろしいほどに配信しているみたいな
7071,7074,私も頑張らないとなっていう時がある
7074,7078,今日も栗山ヤンミーが3回も配信しているぞ
7078,7080,すごすぎる
7080,7083,やば3時になっちゃうちょっと最後のダイル読む
7083,7084,すごいはい
7084,7087,え嘘さっきまで20分だったからさ
7087,7094,まだまだあるね時間と思ったのに何をしていたのか40分経ってたびっくりした
7094,7096,気が付いたらすごい
7096,7099,気が付いたらね何のために配信顔面に溶け出しているのか
7101,7103,びっくりしちゃうよな
7103,7104,目に入らない時は入らない
7104,7106,入らない時は入らないか
7110,7112,ちょっとあと2通読んでいい?
7112,7113,いいですよ
7113,7115,すいません本当に
7115,7116,全然
7117,7120,魔王霊さんからの人のおしかつを笑うなお手入れありがとうございます
7120,7121,ありがとうございます
7121,7125,るかこさんゲストの香倉すずさんリスナーの皆さんこんばんは
7125,7126,こんばんは
7126,7130,今回のテーマは人のおしかつを笑うなということで
7130,7133,ヤン組がこちらに訴えかけてきそうなタイトルですが
7134,7136,お前ら笑うなあのやつね
7136,7141,今ここにいる全員が沼っているVTuberというコンテンツについては
7141,7144,長くはなりますがお便り投稿させていただきます
7144,7148,バーチャルユーチューバーという世界の沼に自分が足を踏み込んで
7148,7151,早いものでなんだかんだ6年以上が経ちました
7152,7156,一つのコンテンツをこれだけ長く追っていると数えきれないほどの楽しい思いで
7156,7159,悲しい思いで出会いは別れを繰り返して
7159,7162,今も自分はこの世界の虜になっています
7162,7168,もちろんおしたちが今も活動を続けて自分たちに幸せや感動を届けてくれるのが一番なのですが
7168,7172,この沼に使って自分が手に入れたものそれは仲間です
7172,7175,これからワンピースを探しに行くわけではないのですが
7176,7178,仲間がいるようではないのですが
7178,7182,はじめはイベントで会う程度の仲だった彼らとも酒を飲んだり
7182,7186,風呂に行ったりお泊まりしたり深い友人関係を今でも築いています
7186,7190,社会人になってからこんなにも信頼できる仲間がたくさんできたこと
7190,7192,あまりにも恵まれていますよね
7193,7197,自分の人生の初一人旅行もこの界隈で出会った遠方の友人のもとへ
7197,7201,12時間かけて夜行バスと行き2人で2泊3日の旅をしました
7201,7205,一つのコンテンツに困っていただけで自分の人生はこんなにも動かされ
7205,7207,数々の思い出が人生を彩ってくれています
7207,7210,はじめは同じ推しが好きな顔も知らない他人だったのに
7210,7214,今では彼らは自分の中では欠けてはいけない存在です
7214,7218,二方の活動がなければ自分の人生もここまで変わることはなかったでしょう
7218,7220,本当にありがとう推し達
7220,7223,恩返しとしては少し足りないかもしれませんが
7223,7226,これからも変わらず推し達を応援します
7226,7229,ここに集っている全員がこれからもお世話になれますように
7229,7231,それではということで
7231,7233,うわー
7233,7235,素敵
7235,7240,ちょっと温度感が違って盛り上がれなかったよっていうお便りくれた方も
7240,7244,ツイッターランド最近ガバガバツイッターランドで
7244,7250,もしそしたらその温度感とかね馬の合うお友達を見つけることができるかもしれないので
7250,7251,うん
7251,7253,ぜひぜひ
7253,7256,人間なんてたくさんいるんだから
7256,7260,すずさんもあれですもんねよく同時視聴してますもんね
7260,7263,同時視聴してますね
7263,7267,志をと音楽を同じくするオタクたちと
7267,7270,そうね
7272,7275,これがなんかそのあれですよね
7275,7276,こう
7276,7279,同端拒否というジャンルもあるから
7279,7283,いやそうなんですよそれも難しいオタク
7283,7284,そう
7284,7286,だからなんか
7286,7290,決してね推し同士がつながることが
7290,7293,ぜというわけではなく完全なる
7293,7296,だから好みを共有できる
7296,7301,使おうという育ちでつながれるという環境が整っていることが素晴らしいねという
7301,7303,うんうん
7303,7305,思いますね
7306,7308,なんか
7308,7310,同端拒否よくわからん?
7310,7312,同端拒否わかります?
7312,7314,特選よくでしょう
7314,7316,うーん
7317,7320,どうなんたら私もわかんないな
7320,7321,うん
7321,7325,推しが活動していくためには経済が必要で
7325,7328,自分は大富豪ではないので
7328,7330,みんなと支えていくしかないから
7330,7331,うーん
7331,7334,うんオタクはいっぱいいてほしい
7334,7336,同端いっぱいいてほしい
7336,7338,わかるよくあの
7338,7341,推しが褒められてると嬉しいオタクだから
7341,7343,あーわかる
7343,7345,わかるな
7345,7347,いいなってなっちゃう
7347,7349,わかる
7349,7351,めちゃめちゃ嬉しくなる
7351,7353,めちゃくちゃ嬉しい
7353,7355,うーんってなる
7355,7357,わかるわかる
7358,7360,なるよね
7360,7361,なる
7361,7363,いやー積極だったらな
7363,7366,積極だったら同端拒否になってもいい
7366,7368,えーでも
7368,7369,え?
7369,7372,るかぐさん認知足りるかもしれないんですよ
7372,7373,あ、ダメだ
7373,7374,ダメだった
7374,7376,認知されたくない
7376,7380,同端拒否になって周りのオタク排除してったら
7380,7382,自分しか残らなくなっちゃう
7382,7383,あー
7383,7384,よくないね
7384,7386,認知されたくないもん
7386,7389,あとやっぱ普通にあの
7389,7391,ねえあの
7391,7394,インターネットの見知らぬ人たちとさ
7394,7396,推しの話したいもん
7396,7398,うんわかる
7399,7400,したいよね
7400,7402,したい
7402,7404,いやー
7404,7406,それがだから多分
7406,7410,相手をどのように好きかにもよるのかも
