start_s,end_s,text
0,4,この曲は、私が作った曲の中で一番好きな曲です。
4,8,私はこの曲を作るのに時間がかかります。
8,12,私はこの曲を作るのに時間がかかります。
12,16,私はこの曲を作るのに時間がかかります。
16,20,私はこの曲を作るのに時間がかかります。
20,24,私はこの曲を作るのに時間がかかります。
24,28,私はこの曲を作るのに時間がかかります。
28,32,私はこの曲を作るのに時間がかかります。
32,36,私はこの曲を作るのに時間がかかります。
36,40,私はこの曲を作るのに時間がかかります。
40,44,私はこの曲を作るのに時間がかかります。
44,48,私はこの曲を作るのに時間がかかります。
48,52,私はこの曲を作るのに時間がかかります。
52,56,私はこの曲を作るのに時間がかかります。
56,68,ファンのみなさんの意見。
68,70,ん
75,81,配信始まる前に あの歯を磨くっていう
81,87,ルーティンがあるんですけど私がね 今も信じられないぐらいあの
87,97,洗面台のドアが閉まっていることに気づかなくて 普通にあの体のすべてを持ってぶつかってきました
97,100,すごい痛い
101,106,めちゃくちゃ痛いけど よろしくお願いします
106,126,はいということで皆さん 今夜もね夜分遅くに遊びに来てくださってありがとうございます
126,132,なんか 5月27日土曜日の1時あるいは
132,140,5月26日金曜日の25時ですね これから1時間半ないし2時間ぐらい
140,145,あ ジングルいなかった? まあまあまあいない日もあるわ
145,151,びっくりした本当にめちゃくちゃ痛かった めちゃくちゃ痛かったけどね
151,154,はははははは
154,157,ジングルいない日もあるわ
157,164,あそこね 最近あのあまりにも pc の調子が悪くて
164,168,素材のね アリが変わったりしたんで
168,171,それでいなくなったりしたかも
171,175,素材の
175,179,音楽の
179,181,音楽の
182,185,素材の
186,188,音楽の
188,192,ラジオジングル あないわ
193,198,どこにも見当たらないもん まあそういう日もあります
198,206,いや本当に多分ね眠いんだと思う 眠いという感覚をちょっと最近
206,215,あの感じなくなってきたけど多分眠い これ多分私も眠いんだろうなっていう感じはしますね
215,223,確かに9と4分の3番線だと思えば 私がマグルだったっていうことですどうしようもなくね
223,228,悲しいぐらいにマグルだったんだなぁ いやなんか
228,232,それこそ なんだろうな
232,238,ハリーポッターの映画見てて
238,242,なんだろう ハリーポッターの映画見てる時に
242,249,どうしてもその 小さい頃からハリーポッターの世界に憧れ
249,258,てたから どうしてもその選ばれなかった存在としてホグアーツに選ばれなかった存在なわけじゃん
258,263,このホグアーツに ホグアーツに通ってなかった人たちね
263,271,この世界のホグアーツに通ってなかった人たちってみんな選ばれなかったじゃん ボーバートンでもいいよ別にあの魔法どころでもいいですけど
271,278,それがやっぱりね人生において結構大きい 大きいわ
278,286,小さい頃魔法学校に入学を許されなかった者たちよ 私もそうなんですけど
287,293,いやもう招待状めちゃくちゃ待ってましたね 三日寝でお母さんがクリスマスに手書きでね
293,299,めちゃくちゃカリグラフィーして送ってくれたことありますもん クリスマスに英語の
299,306,英語で書いてあるホグアーツ入学許可書をね 優しいよな
306,312,あの今日はですね 普通のお便りとあとラジオ
312,321,なんかラジオの配信をして結構2年以上経つので ラジオっていうテーマでね
321,326,あの募集させていただきましたお便りを 一番最初に
326,330,サイレンも鳴り響いてますけども
330,337,一番最初にあの まずラジオ配信を今回で82回目なんだけど
337,342,あのラジオ配信を始めるにあたって
343,352,皆さんは一体どんなラジオが好きですかとかどういうコーナーがいいと思いますかみたいな 感じでお伺いを立てたのがシャープゼロで
352,362,その間の何.5みたいなのが多分数多あるんだけど 東映ナンバーリングとしては82回ですね
362,366,なんで あのそういった意味で
366,372,言うとまぁ 初心に帰るじゃないですけど
372,374,まあなんかこの
375,383,ラジオの配信がみんなにとってどう どういった位置づけで聞いてくれているのかとか
383,389,まあ個人的にそのラジオっていう 存在に対して
389,397,どういったところに魅力を感じているのかみたいなことがね あの聞けたらいいなぁと思っています
397,401,はい じゃあ早速ですね
401,406,靴音からご紹介していきましょう
407,419,今回もたくさんね 今週めちゃくちゃのあれが多くて募集系の配信が多くて あのおととい昨日かおとといもあの
419,428,あれですねアニメの必修アニメ の募集があったりとかあと土曜日
428,433,なんかあの土曜日もあの
433,436,読書会ですね
438,447,これ私がなんですごいあの話が今日スローかっていうと あの怖いなんかそのジングルのデータをずっと探してんだよね
447,453,マジジングルのデータどこ行ったんだろうと思って ずーっと探しながら今あの
453,456,話のさ あの
456,464,リソースをリソース3割7割データ探索に当ててるんだけど マジどこにもないんだよね
464,469,どこ行っちゃったんだろうジングル まあいっか
469,478,まあジングルも家でする時があります ということでまあ過去の配信開けばいくらでも裏ラジオールナイトオールナイト
478,484,オールナイトオールナイトどぅーんどぅーんどぅーんの日で流れてるんでね まあそれでいいか
484,489,えー 普通と音量大丈夫ですか
490,496,音量大丈夫ですかね 何かあったら教えてください
499,510,えーでは普通とね普通のお便りのコーナー読ませていただきたいと思います 1つ目ですね特命の方からでした
511,513,ルガコさん
514,520,ルガコさん 朝トイレに行ったらお尻に激痛が走り便器が血で真っ赤に
520,529,ガサキです生まれて初めてのキレガサキになってしまいました 貧乳期間を受診し何個もらったのですがお医者様からはキレガサキは大きいのを
529,537,するために傷が開いてしまうことがあるので治りづらいとお考えください 食生活の改善も一緒に行っていきましょうねと言われました
537,545,神様今日から頑張って野菜も食べるのでどうぞ僕のキレガサキリーンを早く直してください ルガコさん POCとサブリだけじゃダメだったよってね
545,555,お便りが だからもうあのうちの七進区の流が咲きリーンをさあの地の大名詞として使うのやめてもらってもいいですか
555,561,あの地のことをキレガサキ キレ地のことキレガサキっていうものやめてもらっていいですか
561,564,あの風評被害なんでね
565,572,でかのリーサーも地治ってるはずだからだいぶ前で育って地の話してたの なんかあの
572,580,あんなに歌がうまくていい女なのにあの尻周りにすごい問題が集中してるっていうショート上がった の結構前でしょ
580,585,だからあの風評被害ですよね今は
586,591,わかんないえっちょっとその あの流が咲き
591,598,れねー流が咲きのあのお尻周りの事情はちょっと詳しくないんですけど
598,603,でなんかねこっ今週のお便り あのケツ周りの話が多すぎた
603,611,ちょっとあの汚い話で恐縮なんですけど あのなんでなんだろうなと思ったんだけどすごい思い当たる節があって
611,625,あのこの間の水曜日の24時からししおくりさんのチャンネルで日笠ともしかさんと3人で あのケツの穴に異物を入れたことある人集合みたいな配信したんですよ
625,630,それでだと思う ケツの話ばっかり来た
632,641,だからみんなバランスとろーとしてくれるのかななんかラジオのさ テーマこの後ご紹介するやつ結構あのいい話多いから
641,647,いい話が多いからそこでバランスとって くれてるのかもしれない
647,657,なんかそれで言ったらさあの あのおととい水曜日の深夜にあのケツに異物を入れたことがあるみんな集合って配信して
657,669,で次の日の23時からあの安藤ゆげさんのチャンネルでコナン宮と3人でコラボしたんだけど なんかちょっとエモい話になった後にあのバランスとるために
669,678,あの お酒コナン宮がお酒を飲むとちょっと緩くなるっていうちょっと緩くなってハッピーデイズになるって
678,688,まあギュってしたらそういう意味なんだけどあのそういう話をしてて あれ私今週毎日同じような話をしているのではっていうことになりました
688,691,3日目です
691,698,3日目3日連続ケツの穴の話をしている
698,702,すごくない明日もしないとね
702,710,明日もケツの穴の話をしないといけまーせん 肛門ウィークです今日は今週はね
711,718,ということでねあの とにかくちょっと風評被害はなはだしいのであの
718,732,が先あのキレ字のことをキレが先臨機をぶのは本当にやめていただきたいですし あの何はともあれあの肛門周りにね特命の方の肛門周りに平穏が訪れますよう一刻も早く
732,738,お祈り申し上げますそれで言ったらねー ちゃんとしたお手入れも来てるんですよ
738,746,あのレネリューが先に関してね なんか部位の宴っていうクラブイベントはこないだあったんだけど
746,753,あのそれにそのレネが出てて そのレネがそのツイートでね
753,764,クラブイベントだからそのお宅怖いかもしれないけどクラブを恐れるなってツイートしてくれてて お便り送ってくれた方一人で行ったらしいんだけど結構なんかその部位の宴っていう
764,771,クラブイベント一人でいらっしゃってる方が多かったみたいで なんかあのすごい馴染めました
771,781,あとやっぱあの凛さんの歌声がすごい良かったです 低音量も来てました今のでプラマイプラだよね
781,788,はっはっは プラマイプラだもんね歌うまいし歌うまいしいい女だから
788,793,それでちょっとバランス調子に合わせておこうと思います
793,798,あっ やめろ知るだけにって言わないで
798,802,知るだけにって言うなよ はい
802,808,じゃあ次ですね クラブイベントと言えばさ
809,814,私何回かクラブっていう存在に行ったことがあるんですけど
815,824,それも別になんか 今日は音に抱かれたい夜みたいなの別に人生の訪れたことなくて
824,832,ただ純粋にそのバイトの先輩に誘われて断らなくて行ったりとか あの友達がその根っからのあの
832,841,なんだろう常にパーティーみたいな毎晩がパーティーみたいな女だったりとかして 何回かその一緒に行ったことがあるんだけど
841,846,あの結構ね 一人で来てらっしゃる方も
846,851,見たことありますスーツ着てて あの
851,857,本当に音楽が好きなんだなぁっていう感じの方
857,862,まあ概ねはね 概ねはあの
862,870,何? えー何聞こえないって感じだよ だからこの後どっか一緒に抜けない?
870,878,えもう全然聞こえない そんな感じだいたいそんな感じなんだけどあの一人で普通にあのお酒飲みながらとか
878,882,あの ゆっくり座りながら
882,890,お酒たしなんだり音に乗ったりしながら楽しんでいる方もいるっていう感じのお店でした
890,895,まあ多分もうあの誰か知らんに誘われない限りはもう行かないと思うんだけど
895,900,でもこういう風にさそのなんか 知らない空間とか
900,906,特にやっぱ深夜のイベントとかでドキドキするしねワクワクするので そういったところにその
906,915,自分が今まで縁がなかったなぁとかこの子のこと好きにならなかったら あのこういうところに行かなかったかもとかこういう
915,918,話もしなかったかもとか
918,922,なんかそういうのがね あの
922,928,たくさんあるのが素晴らしいなと思いますね 押し勝はね
929,931,押し勝はね うん
931,936,って思うけど それこそなんかあの
936,941,私が行った時は特に危険なこともなく うん
941,945,概ね健やかに 過ごせましたけど
945,951,ただまぁの普通にそのオールナイトのイベントとかでさもう2時には眠ったくなっちゃう じゃん
951,956,それがやっぱしんどいよな一番 2時に眠たくなっちまうっていうのが
956,963,家帰りたすぎて 家帰るにはタクシーならないといけないじゃんタクシー私すごい苦手だから
963,969,家帰れないし 眠れない横にも慣れないしとこにも
969,973,でそういったねあの
973,977,弊害はあるにせよ まああの
977,982,それは一旦置いといてオールナイトのイベントとか ではワクワクするもんですよ
982,987,首相クリスのオフライントークイベントしっかりね
990,997,ということであのさっきねさっきから左にちらちら出てるかもしれませんがのレネ龍ヶ崎が6月4日にね
997,1011,有料初めての有料ワンマンがあるんでそちらもチェックしてくださいめちゃくちゃかっこいい 感じのねステージ映像が公開されておりますのでめっちゃ乗れねーって感じなんで
1011,1025,ぜひ今の2つの話題を踏まえてから見てください キレガサキリンとVの宴に戦するどちゃくそ散るくてかっこいい龍ヶ崎リンを脳内で再生した後に映像を見てください
1025,1029,はい 次
1030,1038,エビせんべいさんからのふつわたお手入れありがとうございます 裏ラジのアーカイブをテキスト化したサイトを趣味で作っているものです
1038,1048,ありがとうございます今日概要欄にURL載せておきましたいつもありがとうございます 今日の話ですが会社の社内勉強会として私が作っているサイトの事例を紹介しました
1048,1055,使用したツールの比較やノウハウなど内容は技術的なものでしたが面白がって聞いて くれていて作った甲斐がありました
1055,1065,私の発表の最後余談としてスライドを2枚追加しましたその内容はあなたもサイト作りでお仕事を始めませんか というお誘いと今日の25時から裏ラジやるから聞いてね
1065,1074,という不況ですまさか業務時間にそれも大人数を前にした会議でお仕事の紹介ができると思ってませんでした この会社にて良かったですということでね
1074,1081,みんなエビせんべいさんの会社のみんな見てる 25時からラジを始めました
1081,1085,あの ついこないだ
1085,1089,あの 作業通話
1089,1097,みたいなあのまぁちょっとそれぞれサムネイル作りながらとか 通話してた時に
1097,1102,なんかの ラジオを
1102,1108,まあその聞いてくれてたみたいな お話が出て
1109,1118,その時に まあアルマ先生なんだけどアルマ先生がラジを聞いてくれてたって教えてもらって嬉しいありがとうございます
1118,1126,何の話してたかなぁみたいな であでもなんかこういう話してたかもしれないですえっそれどの回だろう
1126,1135,全く記憶にないっていう時にあのこの裏ラジアーカイブスで単語検索したら回わかった
1137,1141,ありがとう なんかの高
1141,1148,高所の高所の回だった 見つかりました感謝します
1149,1156,ということでねなんかあの そういった意味で本当にあのめちゃくちゃ助かりますし
1156,1160,あのこういうふうにね 会社で紹介していただくのは
1160,1165,まぁちょっと恥ずかしい周知8割ぐらいなんですけど
1166,1169,インターネットすごいですね
1170,1178,いや本当にありがたいなと思いますなんかすべてのね あのすべてのチルドレンにありがとう
1178,1181,水飲みます
1186,1189,あの スキヤのさ
1189,1194,今日スキヤだったの晩御飯が あのスキヤの
1194,1200,牛丼に キングってあるの知ってる
1200,1208,キング あのどういった内容かと申しますと
1208,1215,普通の牛丼ってあるんですよ 牛丼の中にキングが入ってるんですよ
1215,1220,普通の牛丼の えーと米3倍
1220,1227,あの上のその牛6倍だっけ そう1200円ぐらいなんだけど
1227,1235,あの あれさぁ今度食べてみようかなと思って
1235,1241,今度食べてみようなんかいけそうな気がしたんだよね 頼んでる人見かけてさお店で
1241,1250,なんか私もいけそうな気がするあれぐらいの量ならと思って 今度挑戦してみようかなって思います
1250,1254,ドーナツと別に好きやおう そう
1254,1260,ドーナツとは別に好きやおう だってドーナツは晩御飯足りえないから
1260,1266,そう ドーナツはおやつであり晩御飯ではないので
1266,1270,牛丼食べてドーナツ5個食べた
1270,1274,だからねー 正直な話今日
1274,1278,今 だからだだから眠いんだ
1278,1284,そっかだから私さっきドアにめちゃくちゃぶつかったんだ
1285,1292,今あの糖質爆弾が投下されてるからだ 謎が解けました
1293,1296,どうだろうねあの
1297,1304,量を食べるメンバーで言うと 周りで私より食べるなぁみたいなのはでも
1304,1307,いるとは思うけどね
1308,1311,いるとは思うんだけど
1312,1319,もう気絶部だよ までもあの度過食い気絶部さん
1319,1326,のあの 動画とか youtube で見るけど普通にそのただただ量が多いとかじゃなくて
1326,1332,なんかあの大量のご飯にバター丸ごと乗せるみたいな
1333,1339,なんかそういう感じだもんね だからなんかあのよりそのプラスアルファで
1339,1344,それこそカロリー追加しないと
1344,1351,いけないのかもね バターってそんなに体に悪くないって聞いたけど
1351,1357,まあ健康に悪いなんかわかんないものさっきだってあのさ キレイ人になっちゃった方もさ
1357,1362,poc サプリだけじゃダメだったよって書いてあったからとりあえず多分 プロテイン
1362,1365,あのファットカーボが
1365,1372,はきちんと あの調整されててサプリメントも飲んでたけどキレイ人になっちゃうんでしょ
1372,1378,ね だからどうしようもなくやっぱ力は逃れられないのかな
1378,1381,人は
1382,1387,だからなんか 結局のところ
1387,1391,好きなものを食べて 何かその体に
1391,1402,破綻 もういい もういい俺は何もかも金繰り捨てて毎日ジローを食うみたいな人は止められないしね
1402,1407,うん それはもうみんなそれぞれの自由だからね
1407,1412,もし家族がさ そんなこと言ってたら一応ちょっとなんかあのやんわり
1412,1416,いやーでもなんか週1とかにした方がいいんじゃないかなーとかは言うかもしれないけど
1416,1420,はっはっは
1420,1428,何種を稼いでキストリンは血糖値の上昇緩和してくれます何種を稼いでキストリンはあれ 水溶性食物繊維
1428,1435,あの溶けない方 腐葉性 なんかあの水溶性食物繊維だけ取ってても腐葉性食物繊維だけ取ってても
1435,1441,あの腸内細菌層に良くないから両方バランスよく取らないとね
1441,1444,水溶性か だからあの
1444,1451,まず食物繊維もすごい大事なんだけど それこそだから
1451,1454,なんて言うんでしょうね あの
1454,1462,やっぱり私人間はやっぱ腸内細菌層だと思うんだよね 腸だと思う何より大事なのは
1462,1468,だからあの毎日自分の腸内フローラーに話しかけて あの
1468,1473,善玉菌を増やすみたいな 大事に大事に大事にさ
1473,1478,あこれなんか前もなんかすごいさ2年くらい前のラジオでも同じようなこと言ってたような気がする
1478,1486,腸内フローラーを育成するとか育てないといけないみたいなこと言ってたね ずーっと同じこと言ってんだね
1490,1496,大事ですはい ということで個人的にはあれですね
1496,1504,あのiherbで売ってるあのなんかとんでもなく あの善玉菌がぶち込める
1504,1510,あの死ぬほどでかいサプリがあってなんつったっけ名前
1510,1513,腸 iherb 腸
1513,1517,あれをねー カリフォルニア
1517,1522,カリフォルニアゴールドニュートリションの あのラクトビフ
1522,1529,飲んでます これさあのどれぐらいそのプロバイオティクスが入ってるかみたいなのが
1529,1534,まあそのどれぐらい入ってるかによってさ 値段が変わるんだけど
1534,1541,これもどれぐらい以上が無駄なの ちょっとなんもわからないあのなんかちなみに
1541,1548,えっとね50億50億300億 1000億
1549,1557,あっはっはっは みたいなもう意味わかんないことになっちゃっててすごい楽しいんだよね
1557,1564,すごい楽しい なんであの皆さんもこれねあの飲んでみたいかがでしょうか楽しいですよ
1564,1570,あのテンション上がりますサプリメント一粒一粒でかいんで
1570,1574,ドラゴンボールの戦闘力みたい
1574,1582,結局だからなんか腸内細菌層はだいたい5歳までに割合自体は決まっちゃって
1582,1589,あとはもうただその超通り過ぎていくのみみたいな ヨーグルトいくら食べようが
1589,1597,あのこのねプロバイオティクスのカプセル飲もうが基本的に定着はしないみたいなのも
1597,1601,なんかで読んだんだよな なんかのけ
1601,1608,なんかのなんかちょ結構ちゃんとしてそうな pdf で読んだような気もするんだけど あの
1608,1614,っていうのを見たことがあるんで そんな体勢に影響はないみたいな
1614,1622,ただ通り過ぎていくだけでもね一時的にも多分効果はあるだろうからこのあたりはね あの話3割ぐらいで聞いてください
1622,1627,よく知らないんで 一応なんかその
1627,1633,大学で学ぶことって 角度の高いソースに
1633,1638,当たりやすくなる方法だと思っていて
1638,1644,だからそのインターネットで ざっくり検索して
1644,1649,あの変な情報を 避けやすくするみたいな
1649,1657,回避率を上げるみたいなところじゃないかなと思うんだよでもそれって 小学生で教えてほしくない
1658,1662,小学生で教えてほしくない一番最初に
1662,1666,っていう気がする そういうの大事だよな
1666,1674,私もなんかあのインターネットで見るものを話半分で聞く まあ人の話もだけどもちろん
1674,1682,っていう技能をもっと早く身につけておいた方が良かったなぁって思うことすごくある
1682,1686,すごくある私だってもうあの
1686,1694,インターネットとともに大きくなっちゃったから そこでやっぱねあらゆるその感覚が鈍り
1694,1698,あらゆる性癖が歪んだと思う
1699,1701,良くないです
1704,1712,まあでもだからそのフェイクだと思ってそれをなんか フィクションを共有できるところはとても好きだけどね
1712,1722,なんでまあそういった意味でね まずその情報をぶち込まれる前にその情報の扱い方っていうものを教えてくれ
1722,1728,義務教育よろしくお願いします では次
1729,1735,フォンニルさんからのお通知ですね ご提示ありがとうございます ルカコさんリツの皆さんこんばんは
1736,1746,私と妻は平日帰宅してからの数時間夕飯を食べながらその日の出来事を共有したり 価値観をすり合わせたりそういった話が特にない日には一緒に映画やドラマを
