start_s,end_s,text
1746,1753,見るといった時間を可能な限り取るようにしています お互いはオタクのため意識してこういった時間を取らなければそれぞれが好きな
1753,1758,コンテンツにばかり向かってしまい 会話がなくなってしまうのではと危惧して設けたルールです
1758,1766,ただ毎日話題になるようなイベントはそう起きませんし 最近はさすがにネタ切れになりマンネリ化が進行しつつあります
1766,1775,このあたりでてこいであったりパートナーの新たな一面が見つかるような取り組みがあればと思うの ですがルカコさんやリツの皆さんのお知恵を拝借できませんでしょうか
1775,1780,どうかよろしくお願いします ということで
1780,1788,いや一石ですね一緒に 映画見たりドラマ見たりする時間を可能な限り取るようにしているってことなんでもうなんか
1788,1797,それができてたらいいんじゃないと思うんですけど あえて言うのであればあのブループロトコルですかね
1797,1805,ブループロトコルはですねもうすぐ多分 公開されるあれMMOだっけ
1805,1811,あの平光さんがね とっても楽しみにしているでおなじみの
1811,1815,ブループロトコルオンラインアクションゲームか
1816,1824,pcm 系オンラインアクション rpg って書いてある そうこれなんじゃないかな
1824,1830,これがさああの 多分なんだけど
1830,1835,これみんなでプレイできる系 みんなでプレイできる系ですか
1835,1840,私はねあのちゃんとそのブループロトコルを登録 して
1841,1846,あのあわゆくばねヒカちゃんと一緒に遊びたいなって思ってますけどね
1847,1856,MMOだと思ってるそうだ私もそう思ってる でもアクション rpg って書いてあるから違うかもしれない
1858,1860,かなって思って
1860,1867,ランテンの先行プレイで見たけどすごかった あそうなんだやっぱこういうさなんかまあもちろん
1867,1876,なんかの映画とかドラマとかを一緒に見て感想を交わすみたいなのもあの すごいいいなって
1876,1882,思うんだけどやっぱゲームを一緒にやるって なんかなんだろうな
1882,1887,世界がもう一つ増えるみたいな こう
1887,1892,自分がそのゲームの中で あの
1892,1906,まあそのリアルのね知り合いとかパートナーの方と一緒にプレイするって多分その普段 あのテーブルにね2人でついて喋る以上の
1906,1911,あのなんていうんだろうな 一面が見られるんじゃないかな
1911,1915,まあ喧嘩するかもしれないけど
1916,1919,喧嘩するかもしれないけど
1920,1930,もうなんかエオルゼアとかもさ やっぱなんだろうちょっとあのギスギスする時あるらしいもんね
1930,1936,私はそれこそそのあのなんていうんだろうな 難しいコンテンツ
1936,1941,については あの
1941,1945,あんまり挑戦してこなかったから
1945,1953,チャンネル登録好評が通知の追加のフォローできればメンバーシップ登録お願いします っていうのをスーパーチャットで
1953,1963,送ってくれるっていうこともお金をかけて私のチャンネルの宣伝をしてくれるみたいなもんだな すごいありがとうございますでも私メンバーシップやってないんですよね
1963,1969,すいません だからそのエオルゼアとかFF14のエオルゼアで
1969,1974,まああまた あの
1974,1980,遊び方があるんですよ あまた遊び方があるんですけど私は結構その
1980,1986,牧歌的な楽しみ方をしてたんで いわゆるそのエンドコンテンツもうだから
1986,1993,あのこの まあ例えばその8人とかで参加してでこの
1993,2003,絶対にその8人がそれぞれあのマーカーのついた人々がこの輪の中に入ってないと全滅する みたいな
2003,2006,なんかそういうギミックがあったりする
2008,2016,それがやっぱ結構しんどいけどあの 戦わなくても生きていけるから
2016,2023,戦わなくても楽しめる麻雀だけしててもいいし っていうのがあるんで
2023,2027,いろんな遊び方が 用意して
2027,2033,もらえていれば 全然アリなのかなって思います
2034,2042,でも面白そうだねプループロトコル どういうストーリーなんだろうキャラクターも可愛いし
2042,2049,世界観もすごそう かつてこの星は神々の住まう輝かしい楽園だったという
2049,2051,書いてある
2052,2060,惑星レグナス神秘の光エングラムのあふれるこの星であらゆる映画を極めた者たちが いたその名をバファリア神族
2060,2066,カラーの気づいたバファリア文明はレグナス全島を追い時の流れさらもう手の中に収め た
2066,2074,ちょっと知らない単語がどちゃくちゃ出てきてあの 脳が理解を拒み始めた
2074,2080,ちょっとまぁあの一応ね事前登録しとこうかなと思うのでご検討くださいはい
2080,2087,プロプロプロところ楽しみだねなんか今度あの ff もパッチが来たのかこれから来るのか
2087,2090,っていう話をちらっと聞きました
2090,2096,m さんの影響でポケモン号を始めたけど話題増えましたよもちろん喧嘩もね 話題増えましたよ
2097,2106,いいですねでもポケモン号いいね だってあのポケモン号はあの外歩いてなんかジムとか回す感じでしょ
2106,2113,私も一番最初やってたんですよまだあの 多分あれ初期のポケモンかな初期のポケモンだけ出てきてるような時に
2113,2117,あの 出てきてるような時にあの
2117,2124,あの好きなポケモンが あればっかりなんかあの最近のポケモンもすごい可愛いんだけど
2124,2129,結構なんか凝ったキャラで座というかモンスターデザインが多い
2129,2132,あの キャラが多いんですよ
2132,2135,あの キャラが多いんですよ
2135,2138,あの キャラが多いんですよ
2138,2149,なんかあの最近のポケモンもすごい可愛いんだけど結構なんか凝ったキャラで座というかモンスターデザインが多いイメージで
2149,2154,でもなんかあの初期の 一番最初のシリーズのポケモン
2154,2160,がなんかあの 割と線がシンプルメタモンとか
2160,2165,カビゴンとか 線がシンプルで可愛い
2165,2171,個人的に好き あのあたりのポケモンのキャラクターデザイン
2171,2177,ポケモンGOって妻と大きな公園に行ったりそこから一駅二駅ポケモン捕まえながら歩いてた 素敵
2177,2180,いいねー なんか
2180,2186,ブループロトコよりポケモンGOがいいかもしれない ポケゴーで行こう
2186,2188,うん
2188,2191,ポケゴーで行こう 北高速なる?
2191,2196,ポケモンGOって今どれぐらいになってるの?
2197,2204,なんかポケモンGOの後にナイアンティックが
2204,2207,あれだったじゃないですか
2207,2212,なんだっけな ハリーポッターのゲーム出してなかったっけ
2213,2216,ハリーポッターのゲーム出してて
2216,2224,それすっごい楽しみにしてたんだけど なんか始まってみたらなんかあれ表壇と違うってなった
2224,2230,表壇と違ったーってなりました 何が違ったんだろうね
2230,2234,イングレスっていうのもあったらしいですね ポケモンGOの
2234,2239,イングレスにそのポケモンっていうそのIPが絡んだのがポケモンGOだもんね
2239,2243,多分ゲームシステム的に
2243,2246,あれはすごくいい
2246,2251,いいわー なんか今度スリープとかも出るらしいですもんね
2251,2257,あれさポケモンスリープがそれこそだからそのカビゴンが
2257,2263,あのメイン メインポケモン?メインポケモンになってて
2263,2268,すごい可愛かったこの間リリース見たら いいですよねー
2268,2275,ポケモンGO 最新のポケモンGO情報が見たいけど音が出そうで怖い
2275,2279,最近のポケモンGOどうなっとるんや
2279,2283,久しぶりに始めてみようかな また
2283,2287,だっていかんせい外に出なすぎて
2287,2295,いかんせい外に出なすぎて最近どのポケモンが強いのかとかも全然知らないよ
2295,2298,そもそもなんか なんだっけなぁ
2298,2303,ちょっとあんまり覚えてないけど なんかあの
2303,2310,死ぬほど耐久が高いポケモンジムに置かれるとすげー困るみたいな なかった?
2310,2313,私もう定かじゃないんだよな
2314,2316,最新
2316,2320,新デバイスポケモンGOプラスプラス
2320,2325,こういうなんかデバイス無駄に欲しくなっちゃうよな
2329,2335,ハピナスとかカビゴンなんだ えーちょっと水飲みます
2341,2345,なんかこういう風にその カビゴンの音がすると
2345,2350,なんかこういう風にその スマホっていう端末
2350,2355,とかいわゆるその専用デバイスとかで
2355,2359,ARとしてその要は
2359,2365,現実の方にそのデジタルな要素とかが
2365,2369,こう浸食してくるみたいなの すごい
2369,2372,やっぱ子供ながらにワクワクしたもんね
2372,2377,あのー あれ見たことあります?ポケモンGOの
2377,2381,あのー えっとねー
2381,2385,ポケモンGOがリリースされた時に
2385,2387,あのー
2387,2390,なんだろPVみたいなのが
2390,2395,出てそれが本当によかったの あのー
2395,2401,なんかねー ニューヨークかどっかの広場に集まって
2401,2405,みんなでミュウツーゲットしよう みたいな感じだったような気がするんだけど
2405,2407,すごい昔に見たから覚えてないんだけど
2407,2410,あれ本当に1回見てほしい
2410,2413,すごいワクワクしました
2413,2415,ぜひともね
2415,2418,あれは本当告知の時にあんなにワクワクするゲームが
2418,2421,なかなか巡り合えないぐらいね
2421,2426,魅力的なプロモーションビデオだったなーって思います
2426,2429,あるよね なんか
2429,2433,なんだろう あっこれすごく今までにない体験を
2433,2437,もたらしてくれるゲームだって
2437,2439,思う日が
2441,2446,はいえーということでポケモンGOがブループロところ良かったらご検討ください
2446,2448,はい
2449,2454,では次のね コーナーに行きたいと
2454,2458,思います 今日サクサクだから
2459,2461,ん
2463,2468,ラジオのねお便りゆっくり読みたいので
2469,2476,今週はちょっと早めに ラジオのコーナーに行きたいと思います
2476,2479,第1つ目ですね
2479,2485,ハクキガジャクテンさんからのラジオにまつわるお便りありがとうございます
2485,2492,ラジオを聞き始めたのは年の離れた兄弟の影響でサマーズのラジオがきっかけでした
2492,2498,初めて聞いた時衝撃は今でも忘れられません このようにこんなにひんな番組があるとは
2498,2504,そこからは芸人さんのラジオにハマり大人になった今でも通勤時に欠かさずラジオを聞いて おります
2504,2509,ですがほぼ毎日聞いているにも関わらず投稿しようと思ったことはありませんでした そう
2509,2514,裏ラジオを聞くその時までは 初めて裏ラジに投稿した時本当に緊張しました
2514,2520,こんなパロにまみれたネタが読まれるのか ルカコさんに失礼はないのか そもそもネットに書き込みをしたことすらない自分が
2520,2525,送って大丈夫なのか 幸いなことにまさかの初投稿で採用されました
2525,2534,名前をもらった瞬間心拍数が跳ね上がり 眼光…あ、動向がんみ…がんぎまりで呼吸を悪くしながら配信をただただ眺めていました
2534,2540,それからは毎日…毎日…あ、もう1回じゃない 毎回裏ラジに投稿するようになり気づけば2年近く送り続けています
2540,2545,まだ裏ラジに投稿したことのないそのあなた 裏ラジはいいぞ ルカコさんはすべて目を通してくれているし
2545,2549,もし採用されなくても配信で触れてくれることもあるので どしどし送ろうね
2549,2553,これからも裏ラジ配信活を楽しみにしております
2553,2556,お便りいただきました ありがとうございます
2556,2560,なんかあの ラジオ
2560,2568,ラジオって今回ねお便りいただいててあの 配信で一応視覚情報もあるから
2568,2572,これをラジオと呼んでいいんだろうかみたいなのがね そのフォーム
2572,2577,募集させてもらったフォームの一言コメントみたいなのとか 私が書いてたんですけど
2577,2583,なんか まあ広い意味で見ればラジオだよみたいな
2583,2588,あの 優先で今見てる人はラジオじゃないけど
2588,2597,Wi-Fiで見てたらラジオだって だからの優先で見てる人は今のコード抜いてもらったらラジオになります
2599,2604,うん なりますありがとうございます
2604,2609,そうしたらなんか広い意味でラジオになるんだって ということでね
2609,2613,だからWi-Fiで見てくれてる人はラジオです ありがとう
2613,2617,それこそだからその まあ基本的に
2617,2625,まあユーチューバーさんって視聴者さんのことをリスナーさんって呼ぶのは インターネットラジオとかの
2625,2632,文化っていうのが日本にすごい根強くあったからみたいな
2632,2636,お手入れも来てましたね なんか海外ではその
2636,2640,リスナーさんのことをビューワーって言うらしいよ 本当?
2640,2646,見てくれてる人だもんね 聞いてるだけじゃないもんな
2646,2651,ってなったら なんかその元々のその文化というか
2651,2656,インターネット あっそれもあれだななんかその
2656,2660,昔 テキストサイト
2660,2669,テキストサイトをやっていた友達と あの仲間たちでそのネットラジオをやってましたみたいな
2669,2673,お便りも来てて そういうところからなのかな
2673,2678,ネットラジっていうサービスがあったんでしたっけ ネットラジオサイトネットラジ うん
2678,2685,であの仲間たちと一緒にあの12時間ぐらい配信したりとかしたみたいな
2685,2693,テキストサイトはねあの存在は知ってるんですよやっぱりオモコロの あのオモコロってもともとその
2693,2699,インターネットで面白記事を公開している サイトなので
2699,2708,もともとそのテキストサイトっていう ところからそのライター業に移行していった人も多いみたいで
2709,2715,だからあのそれこそそのオモコロの記事ですごい好きな
2715,2723,えっとね魔法少女になるやつ とか男だらけの魔法少女なりきり選手権とかで
2723,2729,テキストサイトを あの書いてらっしゃった方とかが
2729,2735,あの参加されてたりして それでねあの存在を学びましたけど
2735,2739,いいですよねなんか あの
2739,2746,なんか多分これもオモコロだと思うんだけどなんか当時はその 回線
2746,2756,ネットの速度がすごい遅かったからなんかイラストとかは あの表示できなくってみたいな
2756,2763,だからその文字の文化っていうのがすごい発達したみたいなのなんかチラッて 聞けるような気もしないでもないです
2763,2767,今ではこうやってねあの リアルタイムで
2767,2770,配信できるんだから
2771,2783,リアルタイムでコメント写してリアルタイムで泡立ち上らしてさ リアルタイムで広告画像だって買えるんだからありがたいですよね
2784,2791,だから本当にインターネットがないと生きていけない インターネットがないと生きていけないよ
2791,2795,俺たちはインターネットやめられない
2798,2803,インターネットってすごいね ありがたいです
2805,2808,ということで まああの
2808,2813,一応ね毎週あのいただいているお便りは 全部
2813,2816,目を通しているんですけど
2817,2826,あの その中でもねやっぱりその皆さんの生活の推移みたいなものもすごい感じるんですよね
2826,2830,あの 転職しましたとか
2830,2833,あと あの
2833,2837,性病が悪化しましたとか
2838,2846,いやちょっともう他になんかないかなと思ったんだよ あの他になんかもっといい例がいい例がないかなと思ったんだけど
2846,2851,次に出てきたのが性病が悪化しましたしかなかった
2852,2857,とかねあの まああのついこないだ
2857,2861,あの 相談のってもらった件
2861,2868,が解決しましたとか いい感じで着地しましたみたいなお便りをね
2868,2873,あのいただいたりとかするんで そういうふうにその
2873,2880,あの皆さんの あちゃんとお便りを送ってくださっている方もあの一緒に
2880,2884,時を過ごしているんだなっていう
2885,2892,時を過ごしていたんだなこれまでもっていうのをね なんかしみじみ思いますし
2892,2898,あとなんか結構何回かその あれしてる通りその連載をね
2898,2905,あのなんかまあマガジンみたいな感じです ああそうだそれで言ったらの今日ねあの昨日か日付で言ったら昨日
2905,2911,あの またね私のコラムを載せていただいている
2911,2917,あの雑誌が出ておりますので ur 始まって私ツイートしたかな
2917,2923,後ほどまたあのツイッター等で はいあのご紹介したいと思います
2923,2930,ブーバースタイルにコラムを載せてもらっています はいありがとうございますおかげさまで生きています
2931,2940,丁寧じゃない暮らしっていうねあの コーナーで私がすごい生活に困っているっていう
2940,2946,後悔ばかりそうこう生活で後悔ばかりみたいな話
2946,2952,をしておりますので よかったらご覧くださいはい
2954,2961,ということで まあなんかそういった意味では本当に最近ねあの自分が研究されている
2961,2972,まああの生物系の研究されている方がこういうふうな論文ありましたよとかこういう 最近はあのそろそろ女王有が
2972,2981,周りの研究されている方とかがそろそろ女王有の結婚飛行みたいなのが始まる時期で たくさん捕まえましたっていうねお便りとか
2981,2984,あと あの
2984,2990,最近の恋愛事情とかを送ってくださる方がいて 毎週楽しいです
2990,2994,ありがとうございます
2994,2996,では次
2997,3006,特免の方からのラジオにまつわるお便りありがとうございます 学校さんリスナーの皆さんこんばんはこんばんは
3006,3015,一部界隈からラジオの帝王とも呼ばれているタレントの移住員光さん テレビでも人気者の彼は街中で声をかけられることも多いのですがファン
3015,3024,さんによって言葉遣いが異なるそうです 依順3枠あえじゅんえっと声をかける方は大抵テレビの視聴者で
3024,3030,移住員さんと軽症付きで呼ぶ方はラジオリスナーであることがほとんどなのだそう
3030,3038,彼はこの現象についてラジオリスナーの方が人間扱いしてくれると表しています こうした違いはなぜ生まれるのでしょうか
3038,3047,ラジオはテレビと比べて視聴者との距離が近いメディアです テレビ番組ではたとえ mc であっても放送時間中の大半を喋り倒すようなことはありません
3047,3054,一方でラジオ dj はほとんどの時間を自らの語りで費やしています ほざけた話も真面目なトークもします
3054,3062,そして大抵の場合テレビよりも純度の高い本音を語ります その雰囲気はさながら深夜の居酒屋のように作家化することさえあります
3062,3072,居酒屋に何度も一緒に行って何度も本音を聞くそうして 目の内も腹の内もさらけ出した dj に対して私たちは親近感を抱かずにいられないから
3072,3079,移住員さんのいうところの人間扱いにつながるのではないかというのが私の仮説です ラジオって本当に素敵なメディアですね
3079,3085,ブララジもリスナーとの近い距離が近いコンテンツかと思いますが果たしてリスナーは dj を何者扱いしているのか
3085,3090,ルカ子さんの所感をお伺いしたいです ということで
3090,3095,そうですねなんか あのそれで言うと
3095,3103,まあ私結構比較的 故障としてルカ子さんと呼ばれることが多い
3103,3108,かもしれないです特にその なんだろうなぁ
3108,3116,普段その私のコラボとかをよく見てくれている方 なぜはその火曜日の昼とかに
3116,3123,あの同期のコナミアと定期配信定期コラボ してるんですけど
3123,3132,なんかそういうコメントでは呼び捨てが多いかな 逆にでもフォームのお便りとかはルカ子さんリスナーの皆さん
3132,3138,こんばんはが多い っていう感じですねマジョリティはそう
3138,3142,特殊な呼び方してくれる人もいるけど
3142,3148,だからそのコラボをあの 見て
3148,3155,くれている人と 重点的に見てくれている人とソロ配信で見てくれてる人だとやっぱ結構感覚が
3155,3158,違うのかもしれませんね
3159,3164,誰とリスナーかっていうのもありそう
3165,3172,まあでも別にあの特に何て呼ばれたいみたいなのないんでね何でもいいんで
3172,3178,なんだろう一番しっくりくるのが いいかなって
3178,3183,クリスさんが呼び捨てにすんなって怒ってた?自分のことを?
3184,3186,うん
3186,3195,そうだねいやでもさそれこそだからあの まあルカ子さんとか大浦さんとかルカ子でも別にいいんだけど
3195,3203,ある程度その配慮があるなみたいな呼ばれ方をしたらその後の文章って
3203,3207,あのすごいスッと入ってくる
3207,3212,スッと入ってきます だいたいねそれがだから
3212,3220,あの例えばなんだろうなそれこそ おいてめーお前最近調子乗ってんじゃねーのかみたいなから来たらさ
3220,3226,それはさすがにその後に続く文章も半巻を持って読むよね
3226,3233,ってなったらまああの概ねさんづけが安定なんじゃないですか
3233,3240,だからあの私はそのある程度の あの配慮とかを
3240,3246,持って接してくれている人はすごくその友人のように 感じるし
3246,3253,あの今例えばそのラジオ配信してて 普通にその1対1で
3253,3257,それこそ居酒屋とかで喋ってるような気がするけど
3258,3265,てめーお前なんかさお前最近 何してんの?みたいな
3265,3271,なんか面白い話してよ!みたいな風に言われたら誰? 誰ですか?
3271,3277,えっ知り合いだっけ?ってなります そういうことだね
3281,3283,そういうことです うん
3283,3290,まあでもそれは一時が万事そうじゃない?普通になんか友人に話しかける時もそうじゃない?
3291,3298,うん ルカ子さんは新幹線に見かけたらちゃんと握手してください話しかけてください新幹線に見かけたらね
3298,3303,絶対オーレルカ子だなと思ったら話しかけてほしい
3304,3309,だからもう全然だからそれはもうなんだろう
3310,3313,その人の楽しみ方による
3314,3318,しょて殴りてえなっていう人もいるかもしれないし
3319,3325,うん オーラとりあえず表ドロラ俺と殴り合おうぜっていう楽しみ方をしたい人もいるだろうし
3325,3334,普通に私とあの例えばあの松屋とかで一緒に牛丼食べたい人もいるだろうし
3334,3341,リングフィットアドベンチャーしたい人もいるだろうしそれぞれはそれはもうだからあの受け取り手のねみんなの楽しみ方による
3341,3345,オーラルカ子はコンテンツなので
3345,3354,によりますそう なんであの皆さんもねあの好きに楽しんだらいいと思いますよ
3355,3364,はいえーということでこれでもすごい面白いですねうん リアルで一郎見たら一郎だって言っちゃう
3365,3370,あっはっは それはそれで面白いね
