start_s,end_s,text
3152,3154,ミチョお試しいただけたらと思います
3154,3158,では次
3158,3160,七死海はもう全然一人一人
3160,3162,全然違うもの飲んでるよ
3162,3164,いやだって
3164,3168,七死インクのメンバーがとりあえずビールなんてするわけないもんね
3168,3170,とりあえずビール
3170,3172,に
3172,3174,耐えられない人間がやはり
3174,3176,あのVTuber
3176,3178,バーチャル業界にやってくるわけ
3178,3180,あるいは動物あるいは悪魔
3180,3182,うん
3182,3184,やってくるわけですよ
3184,3186,はい
3186,3188,えーでは次
3188,3190,えー
3190,3192,おまけさんからの
3192,3194,酒入門
3194,3196,おすすめありがとうございます
3196,3198,最近ウイスキーの美味しさが分かってきたので
3198,3200,初心者なりのウイスキーの楽しみ方をお送りします
3200,3202,ウイスキーを飲める大人ってかっけーと思い
3202,3204,ウイスキーを飲んでみるもアルコールはきついし味もよく分からないし美味しくない
3204,3206,飲めないそんな経験ある人も少なくないと思います
3206,3208,私もその一人でした
3208,3210,でもバーでウイスキー飲んでドヤ顔して
3210,3212,そう思っていたある日
3212,3214,ウイスキーの味と香りはウイスキーが保管されている
3214,3216,樽のものが長い時間かけてお酒に移ったものである
3216,3218,という話を耳にしました
3218,3220,つまり誤解を恐れずに言うと
3220,3222,ウイスキーとは木の香りと味を楽しむものだったのです
3222,3224,これを知ってからは
3224,3226,あれだけ苦手だったウイスキーの味と香りが
3226,3228,木の味と香りだと脳が理解してくれるようになり
3228,3230,美味しく飲めるようになりました
3230,3232,ウイスキーの味と香りは
3232,3234,どんな樽に何年入れておくのか
3234,3236,樽はどんな加工をするのか
3236,3238,別の樽に移すのか混ぜるのか
3238,3240,ここでは語りきれない数の変数があり
3240,3242,それによって味や香りが全く変わってくる
3242,3244,お酒で非常に奥が深いです
3244,3246,ルカコさんももし
3246,3248,ウイスキー未経験でしたら
3248,3250,木の樽を思い浮かべながら飲んでみてはいかがでしょうか
3250,3252,ちなみに私のおすすめは
3252,3254,グレンモーレンジーというウイスキーです
3254,3256,少し高めですがとてもいい香りがするので
3256,3258,初心者にもおすすめです
3258,3260,ということで
3260,3262,色も樽木の色
3262,3264,天使の分け前って聞いたことあるな
3264,3266,なんかあの
3266,3268,人間が死ぬと
3268,3270,魂の分21g浮くみたいな話があるよね
3270,3272,なんか
3272,3274,ウイスキーにも
3274,3276,えーとですね
3276,3278,今回なんですけど
3278,3280,結構複数の方からおすすめいただいている
3280,3282,お酒の
3282,3284,名前があって
3286,3288,あ、似たような分?
3288,3290,あははははは
3290,3292,あはははは
3292,3294,樽と浄圧する
3294,3296,樽を浄水すると浄圧しちゃう分
3296,3298,死ぬと魂
3298,3300,21g浮く分
3300,3302,そういうことじゃないの?
3302,3304,あ、違うのか
3304,3306,えーということでね
3306,3308,同じ名柄をおすすめいただいている
3308,3310,あの
3310,3312,方が割といて
3314,3316,あのラフロイグがね
3316,3318,結構多かったんだよね
3318,3320,ラフロイグが
3320,3322,だいたいね
3322,3324,"3,4件来てたかな"
3324,3326,あのアイラ
3326,3328,アイラ
3328,3330,アイリッシュウイスキーっていうのかな
3330,3332,あのアイラ島で
3332,3334,できてる、作られてる
3334,3336,癖がどちゃくちゃ強い
3336,3338,で私
3338,3340,あの人生で一番最初に飲んだ
3340,3342,ウイスキー
3342,3344,ラフロイグだったから
3344,3346,あのラフロイグで
3346,3348,あ、もう私ウイスキー向いてないんだ
3348,3350,と思った覚えがある
3350,3352,でもね
3352,3354,私薬の匂いとか
3354,3356,割と嫌いじゃないんで
3356,3358,今飲んだら割と違うかな
3358,3360,うん
3360,3362,もしかしたら他にも
3362,3364,普通のいわゆる
3364,3366,ジャックダニエルとかも
3366,3368,飲んだことあるし
3368,3370,あれを経てのラフロイグだったら
3370,3372,感じ方も違うかもしれないんだけど
3372,3374,うん
3374,3376,あ、そうアートベック
3376,3378,ってやつ
3378,3380,もう二人くらいから来てた
3380,3382,ラフロイグは三、四人
3382,3384,アートベックは二人から来てました
3384,3386,フハハハハハハ
3386,3388,ハハハハハハ
3388,3390,うん
3390,3392,言ってましたよ
3392,3394,あれはあれですよね
3394,3396,ピートみたいな
3396,3398,そういう名前の香りが
3398,3400,すごい強くついてて
3400,3402,めちゃくちゃ癖が
3402,3404,強いんだけど
3404,3406,あの
3406,3408,シーバスリーガルはなかった
3408,3410,うん
3410,3412,だからあの
3412,3414,それで癖が強いんだけど
3414,3416,それが好きになっちゃったら
3416,3418,もうそれ以外飲めないらしい
3418,3420,うん
3420,3422,ボウモアも一人いたかな
3422,3424,フハハハハハハ
3424,3426,うん
3426,3428,っていう感じです
3428,3430,なので割とね
3430,3432,2の方からたくさんおトイレが来てるのかも
3432,3434,また今度ちょっと
3434,3436,ね
3436,3438,という気はしますね
3438,3440,煙飲んでるみたい
3440,3442,確かに
3442,3444,すっごいスモーキー
3444,3446,私洋米酒普段飲んでるから
3446,3448,確かに平気かも
3448,3450,うん
3450,3452,グレーエディックは
3452,3454,個人飲んだことあったような
3454,3456,気もしないでもないな
3456,3458,うん
3458,3460,っていう感じです
3460,3462,ちっちゃい瓶売ってるんだ
3462,3464,えーとね
3464,3466,あとはね複数あったのは
3466,3468,ホットバタードラムカウっていう飲み方
3468,3470,これはね温まるのと
3470,3472,とてもおすすめですって書いてあって
3472,3474,ラムが入ってるんだけど
3474,3476,ホットバタードラムカウには
3476,3478,えーとねおすすめされてたラムがね
3478,3480,カタカナだったんで
3480,3482,忘れちゃったんですけど
3482,3484,なんだっけな
3484,3486,キャプテンモルガンとね
3486,3488,なんだっけな
3488,3490,これもこのラムで飲む
3490,3492,ホットバタードラムカウが
3492,3494,うめえですって書いてあったんだけど
3494,3496,カタカナが難しかった
3496,3498,なんだっけなちょっと言われたら思い出すかも
3498,3500,うん
3500,3502,ハリポッタエリアあ確かに
3502,3504,ははははは
3504,3506,めっちゃハリーポッター
3506,3508,あバカルディだそう
3508,3510,バカルディとかキャプテンモルガンとかで
3510,3512,作るホットバタードラムカウ
3512,3514,のおすすめも2件来てて
3514,3516,あとは
3516,3518,えー
3518,3520,あれだ
3520,3522,アラマサこれ日本酒かな
3522,3524,アラマサはマジでいっぱい来てました
3524,3526,うん新しい
3526,3528,祭りごとと書いて
3530,3532,アラマサかな読み方
3532,3534,書いてくれてた人がいたから
3536,3538,これね本当に
3538,3540,何人かから来てて
3540,3542,あのパッケージもかわいいし
3542,3544,なんか高いやつはすごい高いんだけど
3544,3546,割とバリエーション豊かなので
3546,3548,あの
3548,3550,ぜひ
3550,3552,お試しくださいって
3552,3554,言われたんだけどそんな高いんだ
3554,3556,ちょっと待って検索してみよう
3558,3560,アラマサ
3562,3564,えでもなんか
3564,3566,導入なんかサイトがオシャレ
3566,3568,薄い色してるわ
3568,3570,オシャレだな
3570,3572,あと名前がむずいな
3572,3574,カラーズナンバーシックスプライベートラボ
3574,3576,えーと
3576,3578,まあでもまあまあまあ
3578,3580,私この間
3580,3582,あの100g紅茶100g
3582,3584,買ったら4000円だったから
3584,3586,それに比べたらまあそんなもんかって感じがするけどな
3590,3592,そんなもんかって感じするけどな
3594,3596,マリアージュフレルで紅茶の茶葉が
3596,3598,4000円もして
3598,3600,震えながら買えたんだから私
3600,3602,100gだよ
3602,3604,100gだよ
3604,3606,だって100gだよ
3606,3610,まあ他にも2000円とか3000円で買える茶葉もあるんだけどもちろん
3610,3612,マリアージュフレルにも
3612,3614,私がたまたま値段も聞かずに買ったやつが
3614,3616,それだったっていう
3616,3618,しかもなんかあの
3618,3620,あのスタッフさんの接客がすごい豪車だったから
3620,3622,あまりにもビビリ散らかしちゃって
3624,3626,であの1個目のおすすめ買ったら4000円だったっていうだけなんですけどね
3626,3628,うん
3628,3630,っていう感じです
3630,3632,アナマさんの2代目社長は秋田の中でもマジでやりてぇ
3632,3634,ナンバー6のブランディング手法がマジで豊か
3634,3636,へぇー
3636,3638,いやだってウェブサイトがおしゃれだもん
3638,3640,ナンバー6
3640,3642,6号工房の魅力をダイレクトに表現することを目的に上達されるラインが
3642,3644,ナンバー6ですって書いてある
3646,3648,これデザインがすごくいいね
3648,3650,いやプレゼントとかするってなったらデザインも
3650,3652,割と重視する方いるもんね
3652,3654,自分用に飲むんだったらね
3654,3656,まぁ
3656,3658,なんでもいいかって感じだけど
3658,3660,そう
3660,3662,デザインやっぱデザイン
3662,3664,なんだよね
3664,3666,うん
3666,3668,いやそうなんですよ
3668,3670,はぁー
3670,3672,水飲むか
3674,3676,確かにシャネルのコーステみたいでおしゃれですね
3676,3678,うん
3678,3680,シャネルの5番を決めるの
3680,3682,うん
3682,3684,今日はナンバー6
3684,3686,飲んで寝るの
3686,3688,やっぱデザインとプロモーション
3688,3690,の力とブランディングって
3690,3692,本当に大事だよね
3692,3694,うん
3694,3696,あタンカレーってなんだっけ
3696,3698,タンカレーってジンだっけ
3698,3700,ウォッカだっけ
3700,3702,なんかそういう系のあれだよね
3702,3704,高いやつのね
3704,3706,あのジンか
3706,3708,あの黒の組織のさ
3708,3710,割と初期に出てくるやつだよね
3710,3712,多分飲んだことあると思う
3712,3714,冷やして飲むやつじゃない
3714,3716,ジンだったら
3716,3718,あのジンかウォッカか
3718,3720,ラムか全く分からないんだけど
3720,3722,タンカレーとあとボンベーサファイア
3722,3724,あと
3724,3726,何飲んだことあったっけな
3726,3728,あとビーム出すやつみたいなやつとか
3728,3730,割と複数種類
3730,3732,を飲んだことあるかも
3732,3734,うん
3734,3736,あそう名探偵コナンはね
3736,3738,あビフィーターだなんで分かったの
3738,3740,ビフィーターです
3740,3742,とかは
3742,3744,飲んだことあるけど
3744,3746,味の違いはマジで分かんなかった
3746,3748,なんも分かんなかった
3748,3750,まあうめえけど
3750,3752,と思って飲んでた
3752,3754,はははははは
3754,3756,うん
3756,3758,っていう感じですね
3758,3760,えーということで
3760,3762,えー何の話だっけ
3762,3764,あそうあとねカクテルで言ったら
3764,3766,それこそロングアイランドアイスティー
3766,3768,は割と何人かから
3768,3770,好きなんだけど人に
3770,3772,お勧めしにくいっていうお便りが来てました
3772,3774,はははははは
3774,3776,うん
3776,3778,だからあの
3778,3780,ロングアイランドアイスティーっていうのはアイスティーが
3780,3782,入ってるわけじゃないんだけど
3782,3784,あのすごくアルコール度数が高くて
3784,3786,めっちゃ飲みやすいんだって
3786,3788,そう
3788,3790,レディキラーなんだ
3790,3792,ロングアイランドアイスティーは
3792,3794,紅茶入ってないけど紅茶の味がする
3794,3796,んですが
3796,3798,なんかそれが
3798,3800,なんかその
3800,3802,飲みやすくってすぐ
3802,3804,酔っ払っちゃうから
3804,3806,あのー今日行ったね!みたいな時に
3806,3808,あのー
3808,3810,飲ませたりすることが多くて
3810,3812,純粋にロングアイランドアイスティーが
3812,3814,好きなだけなのに
3814,3816,好きでお勧めしたいだけだけど
3816,3818,誤解されやすくて困ってるって
3818,3820,うん
3820,3822,言われました今度でも飲んでみたい
3822,3824,うん
3824,3826,実際飲んでみたらまあまあコーラ
3826,3828,へー
3828,3830,あスクリュードライバー
3830,3832,スクリュードライバー
3832,3834,スクリュードライバーって
3834,3836,中身なんだっけ
3838,3840,スクリュードライバー
3842,3844,あーこれか
3844,3846,ボッカベース
3846,3848,これ上オレンジジュース
3848,3850,あスライス
3850,3852,スライスオレンジ
3852,3854,なるほどね
3854,3856,てかもうジュースだもう
3856,3858,もうジュースじゃん
3858,3860,へー
3860,3862,ということで皆さんもですね
3862,3864,ロングアイランド
3864,3866,ロングアイランドアイスティー
3866,3868,強いけど美味しいらしいので
3868,3870,ただあのー初手でなんか
3870,3872,勧めてくる場合は
3872,3874,気をつけましょうって感じですね
3876,3878,気をつけましょう
3878,3880,はははは
3880,3882,うんロンググッドバイ
3882,3884,読んでからギムレット飲みたい
3884,3886,あでも小説にちなんだ作品とかって
3886,3888,あ小説にちなんだお酒とかって
3888,3890,飲みたくなるよね
3890,3892,あのー
3892,3894,村上春樹さんがさウイスキーとても好きじゃない
3894,3896,であのウイスキーに関する
3896,3898,書籍とかエッセイかなんか
3898,3900,が出てたはずなんだよねそれをなんか
3900,3902,ちらっと読んだことがあって
3902,3904,なんかそれ読んでウイスキー飲んでみたいなー
3904,3906,っていう気持ちになった気がするな
3906,3908,うん
3908,3910,それ初めて読んだ時確か成人してな
3910,3912,うーん
3912,3914,までも酒飲まない普段飲まないんですけど
3914,3916,うん成人しなかった
3916,3918,なんかでそう
3918,3920,飲んでなかったんだけど
3920,3922,すごいねあとあれ
3922,3924,あのー
3924,3926,短編集で
3926,3928,短編集
3928,3930,ファミリーアフェアかなんか村上春樹さんの
3930,3932,でなんかあのー
3932,3934,IWハーパーが出てきて
3934,3936,IWハーパーにもなんか
3936,3938,謎の憧れを抱いてましたね
3938,3940,小学生の頃
3940,3942,あでも
3942,3944,それで言ったらIWハーパー飲んだことないかも
3944,3946,うん
3946,3948,大喜利も飲んだことない小説読んだのに
3950,3952,いや今度ちょっと
3952,3954,頼んでみようかな
3954,3956,IWハーパー
3956,3958,夜は難しさルーケー乙女読んで電気ブラン探した
3958,3960,ああれ本当に京都で電気ブラン
3960,3962,あるらしいですね
3962,3964,うん
3964,3966,そうバナナ大喜利ね
3966,3968,そうバナナ大喜利と
3968,3970,IWハーパーが確か同じ小説に出てくるんだよな
3972,3974,だからぜひともね
3974,3976,皆さん読んでみてください
3976,3978,ファミリーアフェアだと
3978,3980,思う確か出てきたのが
3980,3982,あとあのなんだっけ
3982,3984,さっきタイトル書いてくださった方いたな
3984,3986,もしも僕らの
3986,3988,言葉がウィスキーであったなららしいです
3988,3990,確かね
3990,3992,あの
3992,3994,ハルキー村上
3994,3996,ウィスキーのエッセイと
3996,3998,ジャズのエッセイ出してて
3998,4000,私は結構それ読んで
4000,4002,うわ聞いてみようと思って聞いてみたりとか
4002,4004,飲んでみようと思って飲んでみたりとか
4004,4006,結構あったような気がする
4006,4008,大喜利よく出てくるよね
4008,4010,わかる
4010,4012,よし
4012,4014,次
4014,4016,次のお便りを読ませていただきたいと思います
4016,4018,ゆゆさんからの
4018,4020,酒入門お便りありがとうございます
4020,4022,ルカコさんこんばんは
4022,4024,コーヒージャンキーでインターネットのレシピが好きそうな
4024,4026,ルカコさんにはコーヒーワッカーの
4026,4028,自作をお勧めします
4028,4030,なぜなら私はコーヒージャンキーでインターネットのレシピが好きな
4030,4032,酒カスだからです
4032,4034,作り方はとっても簡単
4034,4036,適当なワッカーの瓶を買ってきて
4036,4038,1、2割ほど飲みます
4038,4040,この時酔いつぶれないようにしましょう
4040,4042,2、ワッカー瓶の空いたスペースに
4042,4044,ひくまいのコーヒー豆を瓶の付属口の
4044,4046,口の元まで詰め込みます
4046,4048,3、あとは2日ほど放置すれば
4048,4050,沈殿した豆からコーヒーが染み出した
4050,4052,度数の高いリキュールの完成です
4052,4054,とっても簡単ですね
4054,4056,本来は酸化やえぐみが出るのを防ぐために豆を取り除いたり
4056,4058,容器を変えたりするのですが
4058,4060,どうせ自分しか飲まない酒であれば適当に冷凍庫に
4060,4062,入れておけば大丈夫です
4062,4064,私はよく夏場に作って冷凍庫に常駐させています
4066,4068,飲み方はストレート6ミルク割りが
4068,4070,鉄板ですが個人的なおすすめは
4070,4072,砂糖をすくったスプーンにコーヒーワッカーを
4072,4074,垂らしたものを口に突っ込むことです
4074,4076,砂糖をすくったスプーンにコーヒーワッカーを垂らしたもの
4076,4078,えぐいね
4078,4080,カフェインアルコール糖分の酸子の原理が一瞬で吸収され
4080,4082,明らかに体に悪いタイプの元気が出てきます
4082,4084,私は学生時代、面接や発表の前によく決めていました
4084,4086,元気が必要やったんや
4086,4088,最後になりましたがアルコールもカフェインも
4088,4090,健康を損ないない形で楽しむのが私なものが大前提です
4090,4092,よかったら楽しい一杯を
4092,4094,ということで
4094,4096,これえぐいね
4096,4098,これもやっぱり
4098,4100,コーヒーの味がすると
4100,4102,これえぐいね
4102,4104,そうで、骨幹の血とかさ
4104,4106,限界の
4108,4110,もうギリギリの人間が飲むもの
4114,4116,でしたね、楽しそう
4116,4118,なんかね、他にももっとマイルドで
4118,4120,可愛いあの
4120,4122,え、ま違うわ、イギリスじゃない
4122,4124,どっからイギリス、おい、イギリスどっから来た
4124,4126,私は今イチゴって言おうと思ったの
4126,4128,やっぱちょっと
4128,4130,人間6時からずっとペケモンやってたら
4130,4132,こうなっちゃうのかな
4132,4134,最近なんか
4134,4136,すごい一生のどがカスカスのカスでね
4136,4138,お聞き苦しかったらすいません
4138,4140,水飲みます
4144,4146,待ってこういう時に必要なのかもな
4146,4148,これ
4148,4150,私が今一番必要なのって
4150,4152,砂糖をすくったスプーンにコーヒーワッカーを照らしたものなのかも
4152,4154,他にもね
4154,4156,ウイスキーにイチゴをつけておくと
4156,4158,とってもおいしいですよっていう
4158,4160,ちゃんと可愛いお便りも来てましたよ
4160,4162,その方がね
4162,4164,コーヒーワッカーっていうのもあるみたいですけど
4164,4166,なかなか作るのが難しいらしいので
4166,4168,まずはイチゴからどうぞみたいな感じで
4168,4170,おすすめしてくれました
4172,4174,何かつけ込むみたいな
4174,4176,あ、待って
4176,4178,なんかつけるのって別にいいんだっけ
4178,4180,なんか
4180,4182,度数が上がらなければいいんだっけ
4182,4184,確か
4184,4186,自分家で作るのって
4186,4188,うん
4188,4190,つける果物を間違えると不幸に触れる
4190,4192,そうだよね
4192,4194,梅酒はいいんだけど
4194,4196,ぶどうはダメなんだよね
4196,4198,なんかぶどうだけが
4198,4200,ダメって聞いたことある
4200,4202,ぶどうはマジでダメ
4202,4204,みりんで梅酒を作るのはNG
4204,4206,みりんで梅酒作れんだ
4206,4208,え、すご
4208,4210,やばいね
4210,4212,梅酒も量主題
4212,4214,へー、勉強になりました
4216,4218,果実を発酵させると度数が上がっちゃうと良くない
4218,4220,あ、そうなんだ
4220,4222,勉強になるね
4222,4224,みんな
4224,4226,ぶどう、今日の学びね
4226,4228,今日の学び全然更新してなかった
4228,4230,えー
4232,4234,ぶどうは
4234,4236,家で
4236,4238,酒に
4238,4240,OK
4240,4242,これ、今日の学びです
4242,4244,サングリアの作り置きは
4244,4246,違法?え、じゃあその場で?
4246,4248,あ、その場で
4248,4250,あれなの?
4250,4252,え、その場で
4252,4254,飲まないとサングリアってダメなんだ
4254,4256,え
4256,4258,怖
4258,4260,え、ちょっと気を付けよう
4260,4262,これだってさ
4262,4264,もしうっかりさ
4264,4266,家に、あ、超厳密に
4266,4268,言うとダメってこと?
4268,4270,20度未満とかお酒を使うとか
4270,4272,複数種類混和するとNGになる
4272,4274,例がある
4274,4276,なるほどね
4276,4278,その場で混ぜて提供すればOK
4278,4280,発酵すると醸造だからか
4280,4282,へー
4282,4284,おもろ
4284,4286,気を付けまーす
4286,4288,え、なんかあの
4288,4290,CBDのグミってあるじゃないですか
4290,4292,あの、カンナビジオールだっけ
4292,4294,あのー
4294,4296,大丈夫な成分だけ
4296,4298,を、今普通に
4298,4300,あのみんなリラックスするために
4300,4302,あのーグミとか
4302,4304,オイルとかにして摂取することが
4304,4306,ままあるらしいんだけど
4306,4308,ウィスキーにさ、CBDのグミ
4308,4310,付けたらさ、むっちゃよくない?
4310,4312,どう?
4312,4314,すげー、あのー
4314,4316,めちゃくちゃダウナー
4316,4318,www
4318,4320,スーパーダウナー
4320,4322,グミができるんじゃない?
4322,4324,CBDってもうな、あ、CBDの中で
4324,4326,一部ダメになったんだよね
4326,4328,うん
4328,4330,CBDの中でまた再分化して
4330,4332,ダメになったんじゃなかったっけ
4334,4336,え、ダメなんだっけ
4336,4338,ま、ちょっとあの
4338,4340,これはあの、仮想、ダメかどうかっていうのを
4340,4342,今調査してるっていう配信なんで
4342,4344,別にあのーあれですよ
4344,4346,犯罪予告じゃないですからね
4346,4348,うん、合法のこの世の終わり
4348,4350,あーいいですね
4350,4352,ギリギリ法に触れない
4352,4354,この世の終わり
4354,4356,この、この世の終わりの酒
4356,4358,うん
4358,4360,そう、あ、じゃあちょっと今度
4360,4362,あのー
4362,4364,大丈夫そうなギリギリラインはちょっと
4364,4366,七瀬さんに聞いてみようかな
4366,4368,と思います
4368,4370,なんかこれ配信で紹介していいか
4370,4372,よくわかんないんだけど
4372,4374,あのーその辺の草で
4374,4376,あのー決められるかどうか
4376,4378,調べてみたよみたいな本
4378,4380,ってまだ売ってる?
4380,4382,なんか読んでみたいな
4382,4384,と思ってたんだけど
4384,4386,なんかあれ規制かかっちゃったんだっけな
4386,4388,なんかその辺の雑草で
4388,4390,決まっちゃおうみたいな本
4390,4392,すごい興味あって
4392,4394,読んでみたいなと思ってたんですけど
4394,4396,いいよね
4396,4398,なんか知的好奇心がさ
4398,4400,あ、雑草で読むみたいなタイトルだっけ
4400,4402,有害指定されちゃった?
4402,4404,あー
4404,4406,じゃあダメだ、ダメでした
4406,4408,皆さん雑草で決めるのはやめましょう
4412,4414,えーでは次ですね
4414,4416,せつなとさんからの酒入門
4416,4418,お便りありがとうございます
4418,4420,うん
4420,4422,やめましょうね
4422,4424,はい
4424,4426,せつなとさんからの酒入門
4426,4428,こんばんは今週のテーマは酒入門ということで
4428,4430,私のおすすめのお酒を紹介させてもらいたいです
4430,4432,それは
4432,4434,つみ
4434,4436,アイスクリーム用果肉酒です
