start_s,end_s,text
2992,2994,最近7時間とかなので
2994,2995,うん
2995,2996,全然
2996,2999,6時に寝れば5時間半寝れるから
2999,3000,え?
3000,3001,短すぎ
3001,3003,あと6時までやらないから安心してください
3003,3004,あはははは
3004,3006,あはははは
3006,3010,はい特命の方からの質問とですねお便りありがとうございます
3010,3011,ありがとうございます
3011,3015,えーりかこさんかくらすずさんリスナーの皆さんこんばんはこんばんは
3015,3016,こんばんは
3016,3021,えー突然ですが松剣サンバをテーマにしたコラボカフェが今度渋谷に現れるそうです
3021,3022,うーん
3022,3026,えー私はファンでもなんでもなんですが公式サイトをぜひご覧になってほしくてメールしました
3026,3029,一言で言うととっても元気になれます
3029,3030,ぜひ見て
3030,3035,えーガチファンの方がちゃんと来店できそうなコント数具合であれば私も伺いたいなと思っています
3035,3039,ダメそうならグッズをハワーしたい活力あふれるサイトで今から楽しみですということでね
3039,3043,これね皆さん見てくださいマジで元気出た
3043,3044,あとねなんか
3044,3045,サイト見たことない
3045,3050,松剣サンバのコラボカフェでなんかメニューのネーミングがめっちゃよくて
3050,3053,私もこれセンターで見たんですよ
3053,3055,そうめっちゃよくてね
3055,3059,なんかね松剣サンバーガーとかね
3059,3061,そうそうそう全部なんか
3061,3062,そうそうそう
3062,3064,ダジャレですよね
3064,3068,たたけボンゴレビヤンココイヘヨコイセヨアヒージョみたいな
3068,3070,めっちゃいい
3070,3072,むちゃくちゃいいんだよな
3072,3073,そう
3073,3079,でなんか全てにおいてやっぱあのね松平健さんのねきらびやかなお姿が
3079,3083,きらびやかなお姿が知られていて
3083,3086,そう最高なんでね
3086,3089,オリジナルコースターめっちゃ欲しい
3090,3091,オリジナル
3091,3100,なんかさ予約するとランダムでもらえる内輪みたいなやつ全然違いがわからないやつがあるって聞いた
3100,3102,へーそうなんだ
3102,3103,予約特典
3103,3105,表面のやつかな
3105,3108,欲しいわ何もかもグッズがいい
3108,3115,いやなんか松剣サンバコラボカフェのグッズもめちゃくちゃいいんだけど
3115,3116,はいはい
3116,3124,なんか私がいいなと思ったのはテニスの王子様の顔面のみのヘアゴム
3124,3126,あれすぎる
3126,3129,あれちょっと強すぎますよね
3129,3132,テニスの王子様というジャンルが強すぎるって
3132,3138,強すぎる私テニスの王子様のグッズを開封されてる動画あげてらっしゃる
3138,3139,あ
3139,3141,あのyoutubeチャンネル
3141,3144,おしゃ…じゃけっこさんみたいな
3144,3149,そうそうそうお塩じゃけっこさんみたいな方めちゃくちゃ好きで
3149,3150,わかる
3150,3156,よく見てるんだけどやっぱヘアゴムの開封動画最近一番笑った
3156,3158,わかる
3158,3162,めちゃくちゃよかったあれ
3162,3167,テニポリのグッズ開封専門チャンネルの方が
3167,3168,そうそうそう
3168,3170,ガチ面白いから見て
3170,3173,めちゃくちゃ面白いしすごく愛のあるオタクなんですよ
3173,3174,すごく愛がある
3174,3176,見てて気持ちがいい
3176,3180,なんか全てのキャラクターに対してテニスの王子様
3180,3184,全てを包み込む大きな愛
3184,3186,そうもうペラペラ出てくる
3186,3189,マザーテレさあ驚愕まじで
3189,3191,本当にそう
3191,3193,パーフェクトラブ完全ない
3193,3195,まじですごすぎるわ
3195,3197,見習いたいですもん
3197,3200,普通さグッズでさどんなに好きなキャラでもさ
3200,3203,3つ4つ被ったらさしんどくなるじゃん
3203,3208,なんでこんなに固いのに4つも5つもこいつばっか出る
3208,3210,なるじゃんどんなに好きでも
3210,3212,でも彼女は違うからね
3212,3215,違ういればいるだけいいスタンスだね
3215,3218,東西南北におけて風水的にもいいみたいな
3220,3225,強いもう本当に目指すべき全人類が目指すべきオタクの姿
3226,3229,彼女がオタクのゴール
3229,3231,本当にそう
3231,3236,髪のヘアゴムもさ
3236,3242,コンプリートボックス9月に発送されるやつ予約してるのに買ったって言ってましたからね
3242,3243,言ってましたね
3243,3245,上でたぶらせてるからな
3245,3248,たぶらせてキャッキャしてるからな
3248,3250,いくら使ってるんだテニプリに
3250,3255,女性のオタクの際談とか作るじゃないですか
3255,3257,はいはいはい
3257,3261,私そういう方の動画見るのすごい好きなんだけど
3261,3263,はいはいはい
3263,3272,人生のかけ方がちょっとレベル違うっていう人いる
3272,3276,押しの缶バッジ無限回収して
3276,3285,誕生日には押しのケーキを発注してレンタルスペース借りて飾り付けして
3285,3290,押しのカラー一色にしてグッズ全部バーって並べてみたいな
3290,3292,楽しそう
3292,3295,あれすごいですよね愛だね
3295,3297,すごい愛ですね
3297,3303,愛だねなんかエンタメ系の仕事されてる方とかとか
3303,3308,エンタメ系の仕事されてる方とかと打ち合わせすると
3308,3315,もうなんかねこういうことをね今配信で言うのもどうかなと思うんだけど深夜だからいいかな
3315,3319,あのエンタメ系の方と打ち合わせするともう
3319,3331,いやもう今は女性向けの展開しか企業的には進めらんないみたいなとこありますみたいな
3332,3333,そうなんだ
3333,3345,女性の女性ファンが信じらんないぐらいお金を使ってくれるというか商業的に考えた時に
3345,3349,現場に行ってお金を落とす
3349,3356,なおかつそのSNSとかに投稿して広く周知してくれる
3357,3359,SNSか
3360,3369,だから彼女たちはその自分がお金と時間をかけるだけじゃなくてそれを不況する熱意にもあふれてる
3369,3371,なるほど
3371,3377,ので20代から30代の女性
3377,3387,20代30代前半の女性に向けたコンテンツ特に現地ありきのものとかは
3388,3392,絶対女性向けですねみたいな
3392,3394,そうなんだ
3394,3396,感じの話聞きますね
3397,3399,面白い
3399,3401,ごめんね
3401,3403,ごめんね
3404,3408,マジですごい写真あげてる方ほんとにいるもんな
3408,3410,ほんとにそう
3411,3415,机いっぱいに缶バッジとかアクスタとかを並べてさ
3415,3421,可愛い服着たさお顔とかあまり見えないけど可愛いんだろうなみたいなさ
3421,3423,シャンパンとか持ってさ
3423,3425,そうそうそうなんだよね
3428,3430,あれ圧倒されるよな
3430,3433,そうなんだよ謝らんでもって言われて
3433,3436,自分のアナリティクス見てるとやっぱ男性が多いから
3437,3441,男性が多いのでごめんねという気持ちです
3441,3443,ごめんね
3444,3448,ごめんでも経済だからごめん
3450,3452,経済だから
3453,3461,そうだから例えばVTuberやっぱり女性VTuberだったら男性がたくさん見てくれてる方が多いと思うんだけど
3462,3471,リアルイベントとかだとそういう傾向がどうしてもエンタメ業界においてはそういう風になりがちみたいな
3473,3477,例えばここでコラボ展開しましょうかみたいな話になった時に
3477,3483,どのIP持ってくるみたいなどのタイアップするみたいな
3484,3487,どのコンテンツどのIPとタイアップするみたいな話になった時に
3488,3491,いやまあ女性向けの方がみたいな
3492,3494,そうなんだ
3494,3499,そういうのがやっぱりの実にいろんなメディア露出とかにもつながっていくんで
3500,3503,世知辛いとは思いつつそういうとこあるね
3506,3508,経済だからごめん
3509,3511,大人の世界は世知辛い
3511,3514,世知辛いよ世知辛いね
3515,3520,ということでコラボカフェの話にもなったところで
3521,3524,前もコラボカフェの話しませんでしたっけ
3526,3529,そうでしたっけ脳死で喋りすぎて
3530,3532,そうなんですよね
3533,3540,コラボカフェの話をしたような気もしないでもないなと思って今ふと通り過ぎていった脳裏を
3541,3543,脳死すぎて覚えてない
3545,3548,瞬間瞬間を生きてるんでね俺たち
3548,3550,切な的にしか生きていけないから
3550,3552,脅落的だから
3553,3558,長い目で切な的に生きてる人間の方がおもろいからね
3559,3561,カービィカフェがすげえみたいな話した
3561,3563,そうだした
3563,3566,やっぱねカービィカフェは本当に愛が詰まってるんで
3566,3568,あれはかわいい本当に
3568,3572,絶対誰が行っても楽しいですもんねあれ
3572,3575,カービィ知らないみたいな人も絶対楽しい
3575,3577,本当に楽しい本当にかわいい
3577,3579,本当にかわいい
3580,3582,行ったことないの?
3582,3584,行ったことないです
3586,3590,でもすごい行ったことないのにカービィカフェに対する情景が深い
3591,3594,サイトを何回か見たことあるので
3594,3595,マジでかわいいですよ
3595,3598,カービィに対するリスペクトとラブがあふれてる
3598,3605,オタクはやっぱり運営がリスペクトとラブがあふれてることを肌で感じるからね
3605,3607,わかる
3607,3610,なんかちょっと話違うかもしれないんですけど
3610,3614,アンスターかなちょっと私わからないんですけど
3614,3620,アンスターか何かのイベントで出てくるカフェをモチーフにしたカフェが期間限定で
3620,3622,コラボカフェみたいな
3622,3624,今完全にその話しようと思ってた
3624,3626,なんかシトラスみたいな名前の
3627,3629,作中に出てくるカフェみたいな
3629,3630,そうそうそうそう
3630,3633,全然キャラクターグッズとかはないんだけどみたいな
3633,3634,そうそうそうそう作中
3634,3636,なんかその話しなかったっけ
3636,3637,あ、してないのか
3637,3640,私は勝手に脳内の神楽すずさんとした
3641,3643,カフェシナモンだ
3643,3645,シナモンなんだあれ
3647,3649,あれすごすぎる
3649,3651,行ってみたい
3651,3655,普通に何も知らないカップルが入りかけて
3655,3657,その話前回したらしい
3657,3658,嘘
3659,3665,でもねみんなあの時前回やった時1年くらい前だと思うんだけど
3665,3666,え嘘
3666,3668,半年か1年くらい前だと思うんだけど
3668,3669,あの時と
3669,3670,やば
3670,3674,我々はもう細胞が入れ替わって違う存在になっているから
3674,3675,そうです
3675,3679,なんだか半分くらいのAIに浸ってるかもしれない
3680,3682,入れ替えてるかも3の大当たり
3682,3683,わかんないからね
3683,3684,そう
3684,3689,徐々に徐々に入れ替わっていてもう違うものになり果ててる可能性もあるからな
3689,3690,うん
3690,3691,そうテセウスだね
3691,3693,もう記憶なんてすぐなくなるんだから
3693,3695,そうそうそうそうそうそう
3696,3699,じゃあ瞬間イマジネーションしたところで次の
3699,3703,人のお仕方を笑うなのコーナーに行きたいと思います
3703,3704,いえーい
3705,3707,はいえーということで
3707,3708,みんな
3708,3710,お仕方してますか
3713,3714,してますか
3714,3717,最近なんか最近の推しなんですかすずさん
3719,3720,最近の推し
3720,3727,こないだ久しぶりにミュースのMVを見て矢沢にこが可愛すぎて泣きました
3728,3731,でもねアイドルって可愛すぎたら泣くんだよね
3731,3733,可愛すぎて泣いた
3734,3736,そう可愛すぎて泣くことがある
3736,3737,ある
3737,3744,私なんかこの間アニメの作画をいいシーン集めてくれてるやつ見て
3744,3746,作画が良すぎて泣いた
3747,3749,何のアニメでした
3749,3751,えーとねそれなんだっけな
3751,3756,いろんなアニメから抽出したやつをこう曲で繋げてくれてるみたいな
3756,3760,あーおしゃれな感じにまとめられてる
3760,3762,とかあとアニメーターさん
3762,3763,はいはい
3763,3766,だけこのアニメーターさんのシーンだけみたいな
3766,3768,あーはいはいはいはい
3768,3771,どうやって調べてくるんだと思うけど確かにまとめられたら
3771,3776,あ確かになんか共通点あるわみたいな
3776,3777,えーすごー
3777,3780,走り方すごい特徴的だわみたいな
3780,3782,へー
3782,3784,感じで集めてくれてるやつを見ました
3784,3786,見て泣きました
3787,3788,作画が良すぎて
3788,3789,ゆるいせい弱いからオタク
3789,3790,ガバガバだから
3790,3792,すぐ泣いちゃうんだから
3792,3794,声優さんの演技が良すぎて泣いた確かに
3794,3799,あのーこれ本当にあのファンの人には本当に申し訳ないんだけど
3799,3802,あのー目損一刻っていうアニメあるじゃないですか
3802,3805,漫画家元々高橋美香先生の
3805,3810,私目損一刻を1ページも読んだことないんですけど
3810,3818,あのー声優さんの演技がすごいみたいな動画がTikTokでこうシュンって流れてきて
3818,3820,へーはいはいはい
3820,3822,そのワンシーンだけで泣きました
3822,3823,うわー
3823,3825,あまりにも良すぎて
3825,3828,あれ?大谷さんのやつ?大谷さんの大学生?
3828,3831,大谷さんのシーンだとそうそうそう大谷さんだと思う
3831,3833,はー
3833,3834,うん
3834,3841,なんか未亡人の大谷さんと大学生の主人公がうんたらかんたらみたいな話じゃないかな
3841,3842,なんも知らん
3842,3843,うわー
3843,3845,私も全然知らない
3845,3846,うん
3846,3847,へー
3847,3849,なんも知らんけど泣いた
3850,3854,すごいなその一瞬で人間を泣かせられるってすごいよな
3854,3857,すごいすごい多分なんかあれだよな
3857,3860,ナウシカの声の方だと思うんだけど多分
3860,3862,そうなんですかへー
3862,3864,なんかあのナウシカの声した
3864,3866,姫姉さまの声した気がする
3866,3867,うわー
3870,3873,あれ読んで恋愛感学んで人生失敗した
3880,3883,ダメなんだあそこから学んだらいけないんだね
3885,3887,なんかそのいいなそれ
3887,3890,この漫画で学んだなみたいなのあります?
3890,3894,なんかすごい人生観とか生き方に影響を与えたなみたいな漫画
3895,3899,うわーあの進撃の巨人のアルミンが
3900,3905,捨てる覚悟がない奴は選択をできないみたいなことを言ったのを見て
3905,3907,ほわーって思った
3910,3911,進撃の巨人か
3911,3912,はい
3912,3916,なるほど進撃の巨人はあれはすごい漫画ですね
3917,3919,最後までちょっと読んでないんですけど
3919,3921,私捨てられない人間なので
3921,3922,はいはいはいはい
3922,3924,ぐっさーきましたね
3924,3925,なるほどね
3926,3928,それを見て
3928,3934,いやあのうちの母がだいぶ進撃の巨人の
3934,3935,わー
3935,3937,割と強火のオタクなんで
3937,3938,はいはいはい
3938,3941,LINEのアイコンリヴァイアッカーマンだし
3941,3942,わー
3943,3947,そうこの間のユニクロで進撃の巨人コラボがあって
3947,3950,TシャツUTコラボしてたんですよ
3950,3952,えーはいはいはい
3952,3955,でたまたま私ユニクロに寄った時に
3955,3959,あっリヴァイのTシャツあるやんけと思って
3959,3962,で写真撮ってお母さんに送ったんですよね
3962,3967,そしたら買っといて私が行く前に売り切れちゃうかもしれないから
3968,3970,買っといてって帰ってきて
3971,3973,分かった買っとくねって
3974,3977,言って買ってまだ送ってないんだけど
3977,3978,そうそうそう
3978,3980,送ってあげなきゃ
3980,3983,めちゃくちゃ好きじゃんいつ着るのこのTシャツって
3983,3988,寝巻きっていうかベッドを共にするんじゃないですか
3990,3992,確かにもうすぐ母の日だからみんな
3992,3993,5月13日
3993,3994,あそうだわそうだ
3994,3998,みんなもお母さんにリヴァイのTシャツ送ってみたらいかがでしょうか
3999,4001,なんかちょっと前にさ
4001,4006,友達と新劇って始まってからそこそこ長いじゃないですか
4006,4007,アニメシリーズも
4007,4008,そうですね
4008,4010,始まってからだいぶ経つからさ
4010,4017,それなりに私たちも年齢というか生きる時間を重ねてさ
4017,4020,価値観とかもそれなりに変わっていた
4020,4021,逆
4022,4023,当時あんまり
4023,4026,なんでリヴァイこんなに人気なんだって思ってたのが
4026,4029,だんだんわかるようになってきたよねみたいな話をして
4031,4034,リヴァイってかっこよかったんだみたいなね
4036,4039,初読の時のリヴァイってあんまりかっこよくないんですか
4039,4046,いやっていうか当時の私の価値観的にはなんかあんまり刺さらなかったんですよね
4046,4047,へー
4048,4053,けど変わってたんだろうな大人に近づいてたんだろうな
4053,4055,なるほどね
4055,4058,大人に刺さるキャラだと思いましたリヴァイは
4058,4059,そうなんだ
4060,4063,私なんか結構あれかと思ってた
4064,4067,いわゆる術でいう五条
4067,4069,五条させるポジというか
4069,4070,はいはいはい
4070,4073,うちの母めっちゃ趣味わかりやすくて
4073,4076,ナルトだと加快先生が好きで
4076,4079,術解針だと五条悟が好きで
4079,4082,神奇形の巨人だとリヴァイが好きなんですよ
4082,4085,だからそのジャンルのその流れの人だと思ってた
4085,4087,なるほどね
4087,4088,そう
4089,4090,だった
4090,4091,わかりやすいよね
4091,4092,イケメンは
4092,4093,わかりやすい
4095,4098,で広若だと翔人くんが好き
4098,4100,トドロキ翔人くんが好き
4100,4102,あー唯一のマン知ってる
4102,4103,そうそうそうそう
4104,4106,私もなんか
4106,4109,トドロキ君が好きみたいなこと言ってたから
4109,4111,誰だ?わからない
4111,4113,広若読んでない
4117,4118,手に振りだと富士
4118,4120,手に振りだと富士だった気がする
4121,4122,後部だったかな
4122,4124,どっちかわからないちょっと忘れた
4125,4127,なんかでもツートップなイメージある
4128,4131,手に振りちょっと全くわからないんですけど
4132,4134,私も手に振りしたのはね
4134,4139,うちのお母さんが車でキャラソング聞いてたことぐらいしか
4142,4144,後部?後部様でしょ
4144,4146,やばいやばい怒られた
4146,4147,後部様ですすいません
4147,4148,お詫びして訂正します
4148,4149,メス猫
4154,4156,後部様のメス猫ちゃん?
4156,4157,メス猫?
4157,4158,あれ?
4158,4160,メス猫って言われてるらしいですね
4160,4161,そうだよね
4161,4164,ちえりさんのツイッターで知ったもんそれ
4166,4169,ちえりさん後部好きだからな
4169,4170,ねー
4171,4172,そうですよね
4174,4177,後部様ってバレンタインで宇宙行ったの?
4177,4178,なにそれ
4178,4180,意味がわからない何も繋がらない
4180,4183,後部様ってバレンタインで宇宙に行ったの
4183,4184,怖っ
4185,4186,なんだよそれ
4186,4190,意味わからなすぎておもろいこのフレーズ
4191,4194,このまま何も知らずにいたいこの件について
4194,4197,このままなんだったんだろうのままでいたい
4199,4203,確かに後部様だったら宇宙ぐらい行くでしょうの気持ちでいきたい
4205,4206,いきそう
4206,4211,ということで私は人のおしかつを笑うなというお便りテーマをいつでも読んでるんでしょうか?
4211,4213,読んでないですよね
4214,4216,読んでないかも
4217,4222,屈折率1.70さんからの人のおしかつを笑うなお便りありがとうございます
4222,4223,ありがとうございます
4223,4228,私は香倉すずさんを推し申し上げております
4228,4229,ありがとうございます
4229,4235,3月にドットライブのリアルイベントがあってじめじめしたところに生息する和いしょうな虫子と私
4235,4240,住処の石の下から這い出て晴れ晴れ渋谷へ繰り出して参りました
4240,4243,いざ会場の前についてみるとこういうのを初めてで
4243,4246,あんまオタクとしてのアクティビティを経験してなくて
4246,4250,なんかいいのかな俺なんかがという気持ちが襲ってきて
4250,4255,遠く尊い輝ける推しに対してなんだ俺のこの無様な実態は
4255,4260,存在を明らかにすることが推しに対し無礼であろうがという意識が芽生えてきて
4260,4262,2時間くらいうろうろしてしまいました
4262,4265,離島から東京に来ているのに荒れえないですよね
4265,4266,一体何しに
4266,4272,そんなコーナーでツイッターをチェックしていたらすずさん忙しいだろうにいっぱい投稿してくださっていて
4272,4276,私もオタクだからさとか初めてイベント行った時緊張したなとか
4276,4278,とどり着いてえらいとか
4278,4281,なんかそんな輝ける言葉の数々を示してくださっていて
4281,4282,まさか
4282,4283,え?
4283,4284,見てる?
4284,4287,ヘッダのすずさんが僕を見てる
4287,4289,最高のすずさんが僕を見てるぞ
4289,4291,すずさんが僕を見てるぞ
4291,4292,冷静じゃない緑
4292,4294,過去すずさんのサブアカディスタカカと違う
4294,4295,僕を見てる
4295,4298,ツイッターのすずさんが僕に話しかけてるぞ
4298,4301,よかった世の中まだまだ捨てたもんじゃないんだね
4301,4303,やっほーと思って突撃しました
4303,4308,女神に感謝を捧げなければ忠誠を示さなければと思って恥さんじました
4308,4311,優しい人だなーって思いました
4313,4314,よかった
4316,4318,これルイズコピペ
4319,4321,ルイズコピペのフルを
4322,4324,バキバキ童貞さんのチャンネルで聞いて
4324,4326,はいはいはい読んでた
4326,4331,コピペを音読するっていう企画があって
4331,4333,あれ大好き
4334,4336,本当に良くて
4336,4338,なんかなんつーんだろうな
4338,4342,ルイズさんをあまり存じ上げなかったんだけど
4342,4346,そのコピペのなんか揺らぎ
4346,4348,感情の揺らぎみたいなものが
4348,4353,こんなになんかすごくダイレクトに書けるんだみたいな
4353,4354,はいはいはい
4354,4356,感動しちゃったね
4356,4358,いいね
4358,4359,名文ですよね
4359,4360,名文
4360,4364,私は掲示板文化に対して結構強く苦手意識を持ってここまで育ってきて
4364,4367,ほぼ自分で見たことなかったんですけど
4367,4372,なんかコピペバキ童さんのコピペ読む動画めちゃくちゃ好きだから
4372,4377,なんかすごい面白い文化があまたあったんだなーと思って
4378,4380,そうそうそうそう
4380,4382,なんか自分のなんかあれですね
4382,4387,あの先入観というか思い込みを恥じました
4389,4391,そうだね玉石根香だよね
4391,4392,いやそうよ
4392,4398,表層に出てきてるものは良いものだろうなって思ってます私勝手に
4398,4400,それでいうとあれも好きですね
4400,4402,なんだっけ
4402,4407,こんな深夜にすれ見てる中3
4407,4410,あーはは俺だけか
4411,4414,it's true world
4414,4417,狂ってるそれ褒め言葉ね
4417,4419,これめっちゃ好き
4421,4423,わかる
4423,4424,そう初回っ子どもだ
4424,4425,それだ
4425,4428,初回っ子どもめちゃくちゃ好き
4428,4430,本当に最高なんだよな
4430,4431,めっちゃいい
4431,4434,あれ好きだわー名文すぎる
4435,4440,私あの馬起動さんのそのコピペの動画だと
4440,4443,ぽは何だろう
4443,4445,ぽめっちゃ好き
4445,4448,もう今絶対次ぽの話するだろうな
4448,4450,ぽの話するだろうなって思って待ってた
4450,4451,ぽだろうな
4451,4452,ぽだろうな
4452,4454,ぽだってなった
4456,4460,私あの動画で初めて知ったけど爆笑しちゃったなんか
4461,4463,バランスがいいんですよね
4463,4465,ちょっとバカっぽい一人称とさ
