start_s,end_s,text
90,97,なんかこれ私の環境だけかもしれないんですけど
97,104,ここ数日あの youtube のコメントの皆さんのお名前に
104,110,色がついて見えるのね でさっきコナンミヤとコラボしてたんだけど
110,116,コナンミヤにそれ言ったらえっ私見れない 見えないんだよね
116,122,って言ってて なんか色の共感覚みたいなのが
122,129,急に目覚めたのかなって期待したら普通にバグでした よろしくお願いします
133,137,うらラジオールナイト
137,143,はい皆さんこんばんは本日も夜分遅くに遊びに来てくださってありがとうございます
143,150,You can kiss アニマルのうらるかこです ということでね見える人と見えない人がいると思います
150,158,いると思うんですけど私からは確かに色がね あのー別れて見えるんですよねこれがね
158,167,どういう法則なのか全くわかんないな アルファベットだったら君は見える人だ私見える人なんだよね
167,173,アルファベットだったら何色とかなのかなと思いきや全くそうでもない
173,177,みんな何色か知りたい自分が
177,181,初コメの人たちにも見える色があると思うんですけど
181,192,みんな何色か知りたい自分が 初コメの人とか関係ないのなんかそれで例えばメンバーシップに入ってるとか
192,198,全然関係ないんだよねみんなに見えてる人は見えてるし見えてない人は見えてないし
198,205,そんでなんかよくわかんないけどコメ欄がバグって配信画面上に表示できなくなっちゃったんですよ
205,213,だから困ってるんだよねめちゃくちゃどういうことと思って
213,219,なぜかわかんないけど何度読み込んでも表示されなくて今キャッシュあ、消えたかな?
219,223,キャッシュ更新されましたよかった
223,227,これのことじゃないんだよね
227,232,っていうのがありまして あれちょっと待ってまた消えた
232,239,これなんかちょっと待ってレンダーしないとダメなのかな
240,246,一瞬キャッシュを更新して一瞬だけ見えるの見て
246,249,私今日さ
249,256,あの画面をキャッシュ更新し続けないとコメント欄が表示させられないんだよね
256,264,俺にも色見えた? なんだと思うこれ本当にわかんないんだよねチカチカうるさいと思うんだけど
264,267,今日はコメントなしで行くか
268,274,めちゃめちゃバグってる最近なんかツイッターもyoutubeもいろいろあれですね過渡期なんかな
274,281,調子悪かったり凍結祭りだったりして本当にいろいろねありますけど音量大丈夫ですか?
281,288,BGMちょっと小さくしますマイクが小さいかも
288,292,音量もちょっと下げますね これぐらいで
292,303,何かまた気になったら教えてください そうということでねあのちょっと今日コメントが更新しないと表示できなくなっちゃったので
303,305,なんか
305,313,たまにはなんかあれしようかなお便りをさここに表示してみようかな文字小さすぎてわけわかんないと思うけど
313,318,このバグに気づいたのが配信2分前だったからさどうしようもなくて対応できなかったんですけど
318,323,今日ここにお便りのあれ入れてみようかなテキスト
323,326,お便り
326,338,私あの普段ねあのつくしオールドゴシックめちゃめちゃこのバグはスパチャだけ表示されるという噂がある
338,342,マジちょっと見せて 本当だ
349,353,面白い youtubeくん
353,362,これ別にあれですよ別に私が意図してやってるわけじゃないですから皆さん スーパーチョットが欲しくてやってるわけじゃないんでほんと勘違いしないでyoutubeくんが勝手にです
362,370,youtubeくんがあのスパチャーのねあのあれ欲しさに あのロイヤリティ
370,376,マージ欲しさにやってることなんで本当に気にししょうがないにゃー
376,385,ハウスイットゴーイングって言われてるけどまぁこれはやっぱちょっと金の猛者かひどいよ
387,400,youtubeくんこれが youtubeくんが望んだ世界なの これが youtubeくんが望んだ世界なんだお金を投げているしか投げている投げてくれる人しか
400,412,コメントが表示できないなんてスパチャも時々切るらしいそんなことあるでもあのみんなの さスーパーチョット以外の存在は認知してるのにねでも表示しないんだね
413,417,いいんだよ別にあのみんな今
417,432,お前もいいんだよみんなそういうやつじゃないから今日何の祝いでもなんでもない ただの先の話をみんなから聞くだけの話配信だからあの全然そんな気にしないで
432,440,認知して いやほんとスーパーチャットじゃないと認知できなくて本当にコメント許せる大変すいません
440,446,はいこうするメール後ほどねちゃんとお名前確認させていただきますありがとうございます
446,456,これが youtube ブルーですかそうですあの皆さんこれが youtube ブルー課金版の課金版でが youtube ってもともとね
456,464,私のチャンネルは収益化してるんでね 今日これを通し出してるんだまぁでもこれ本当すごいよね
464,471,間にさちゃんと普通のコメントも拾ってる風なのにこの間の 隙間の開け方
471,476,本当に スパチャしか表示してないっていう
476,485,更新したら一瞬出るってことはさ 色の設定とかこっちの設定のミスじゃないわけじゃん完全さ youtube 君が彼の猛者になっちゃった
485,488,っていうだけなんだよね
489,496,そう文字色の問題ではないんだよ更新したら出るからさ っていうことで彼の猛者になってしまいましたけれども
496,502,あの別にあの皆さん本当に気にしないで大丈夫本当にありがとうございます 不具合
502,508,がね発生しているのに無力ですいません 無力でごめん
508,518,ちょっとここにねあの皆さんがスーパーチャットで埋めなきゃ私ね 色付き米で埋めなきゃと思ってしまうかもしれないここでお便り出そうかな今日は
518,528,ファーマーのラジオ配信ということで 基本的に画面水に流し聞けるような形でねまぁちょっと動画でやってんだから動画で見
528,535,やすいようにしろよという声もまあ全然そうだなそれはそう そりゃそうだなぁって感じなんですけど
535,541,一応あの 画面見なくても見やすいようにという意図でね
541,547,決して面倒面倒くさくてやってないわけじゃないんだからね 勘違いしないでよね
547,553,ラジオだから あんまり画面見なくていいようにっていう意味でやってるだけなんだから
553,559,なんですけど今日はちょっと表示できるだけしてみようかな
559,562,美しいオールドミンチョー
562,570,オールドミンチョーじゃないオールドゴシックだ 美しいのゴシックオールドゴシック
570,575,なんかあの 皆さん好きなフォントってあります
575,577,なんかあの
581,589,無料コメント失礼しますって面白かった 無料コメント失礼します面白いんですよ
589,593,皆さん私はいつも思ってるんだけど
594,602,基本的にやっぱそのお金をねこう投げてたことも本当にありがたいお金 お金って言うとあれですけどスーパーチャット投げてたから本当にありがたいんですけど
602,611,アーカイブとかでもね時間をかけて見ていただくって皆さんの時間をかけて見ていただくってのは本当にすごくてなんで
611,617,そうなんです無料ユーザーだっていいんですよ いいっていうかありがたいです本当にね
617,626,マティスといえば新世紀エヴァンゲリオン 明理をわかるパワーポイントとか結局明理をだよな
626,630,フーツラデザイナーだ
630,635,あ、K-Fontって名前聞いたことある 平木野ってあれだよね
635,639,macユーザーにしか許されてない
639,643,macユーザーにしか許されてない
643,645,ここにお便り
646,649,macユーザーにしか許されてないやつね
650,652,で
652,658,えっと、こうして ここにお便り表示させよう
658,664,あ、つくし民調わかる私もつくしシリーズ結構好きですね ヘルベチカわかる
664,669,ヘルベチカ私あのあんまり
669,674,あの英文フォントに明るくなくて 普段その
674,682,英文使うってなったらもうだいたいセンチュリーにしちゃうんだよね センチュリーが好きハラマセニャンコって何?
682,686,え、大丈夫なやつ?
692,698,これ大丈夫なやつ? 怖いんだけど検索しよう
698,705,あーはいはいはいはいなんか見たことあるっちゃあるな
705,711,コーポレートロゴねあの無料のやつ ラノベポップよく見ますねわかる
711,716,あインパクトわかる 私もあれあの
716,724,あの朝枠のフォントむっちゃインパクトでなんか前どっかの配信であの
724,731,なんかデビューしたてってデザインのこと何もわかんなかったから なんか結構癖の強いフォント使っちゃいがちですよね
731,739,っていう話したらなんかいや初心者ってインパクト使いがちだよねって言われてすげー恥ずかしかった インパクト使ってます
739,748,私インパクト使わせていただいておりますみたいな感じになってすごい恥ずかしかったです でも良くないインパクト
748,755,インパクト好きなんだけど
755,762,インパクト好きなんだよなぁなんか なんかわかんないけど
762,768,あーなんか落ち着くわーってなっちゃう 初心者使いがちだよね
768,773,でもやっぱ結局ねあの あれなんすよ
773,782,なんて言うんだろうな まあスタンダードなあんまり癖のないフォントが結局いいんだなっていう素人は
782,790,癖の強いフォントはやっぱデザイナーさんじゃないと 使い慣れないんだな
790,794,そのうちあれやろうかな あのフォント
794,801,フォントってかデザイン 助けてデザイナー回やりたいいつか
801,807,そろそろあとあれですね あのようこそプロデューサー野生のプロデューサー回と
807,815,あとラブレター回ラブレターってその アニマルメンバーと自分の夢小説を送ってもらうっていう回とか
815,821,あと 以前やったのは職業体験リスナーさんの職業体験の回とか
821,827,またねもう1回やりたいなと思う企画 いっぱいありますね
827,834,はいということでラブレター回3回もやってんだ 好きだね私も
834,839,今日はですね酒入門 シューガールメールテーマは酒入門ということで
839,843,普通のお便りとお酒の入門をね皆さんに聞きました
843,849,のでこちらで読んでいきたいと思います ということで
849,859,コメントお便りお便りはここに入れちゃっていいんだっけな このサイズって決められるんだっけ
859,864,ちょっとまぁあのレイアウト私はレイアウト配信中にさ あの
864,873,アーカイブが残る配信で配信中にレイアウトが崩れるのを割と許せないタイプなんだ けどタイプだったんだけど最近もう
873,880,いいかという気持ちになってきましたそれがもう生ってことじゃん 生の良さじゃんって感じになったんだよね
880,886,はっはっは ここにたどり着くまでに2年もかかっちまった
886,892,長かったな そこが許容できるまでに2年もかかった
892,903,生きてるって感じだよねはいじゃあ普通のお便り読んでいきましょう 今週もたくさんのメールありがとうメールメールとかフォームのお便りありがとうございます
903,910,普通のお便りはもうそのまま特に何のジャンルもこだわりも縛りもなく
910,915,読ませていただく感じです うん副業デザイナーと思ってた?
915,922,えっ全くだよ副業デザイナーだったら初期のサムネもうちょっとマシでしょ
924,928,初期のサムネイルダセーダセー 本当にでも
928,934,普通に1週間前作ったサムネイルもダサいからな 耐えられないもうこの生活に
934,938,本当に 辛い生きてて
940,946,一生ダサい初期作ってたサムネイルもダサい 初期作ってた配信画面もダサい
946,953,辛いよ昔の配信見るの はいということで1通目を本当に読みますね
953,960,白向の甘返さんからのお便りです ルカコさんこんばんは私は木曜日に高校受験があります
960,966,これを書いているのは月曜日ということで高校受験もう終わったんですねお疲れ様でした
966,972,人生で初めて受験というものを経験するので緊張しています ルカコさんは何か受験に関するエピソードはありますでしょうか
972,980,お体に気をつけて寒い日々をお過ごしください ということで中学生が見てます
980,988,びっくりしましたこれ本当かどうかわかんないけど中学生が見てました 中学生が見ていい配信なんですかこれは
988,994,あとやっぱり思ったんだけどこのお便りは9スペースに表示できるんだけど普通に あの私
994,1001,の配信を送っていただくことよりむちゃくちゃな家からここに入るわけなかった
1001,1007,ここに入っていくわけなかったから今日の学びを書いていくことにしよう
1007,1010,今日の学び
1010,1017,を以下に書いていくことにします普通にお便り全然入んないや開業のなんかスペース めっちゃ広いし
1017,1024,8ねー 中学生は早く寝た方がいいや対してるかどうかわかんないけど youtube の配信
1024,1027,てアーカイブでも見られるからね なんか
1027,1034,あの中学生に聞かせられるような内容だったことは1回もないと思うんだよね
1034,1043,今日の学びバグにスパチャは youtube は彼の亡者になってしまったのか
1046,1052,youtube は彼の亡者バグ これ1個今日の学びです
1053,1056,そうだからねー
1056,1068,結構さあこういう話するのちょっとあれかもなと思うんだけど7シンク見てる方って 何シンクて私のチャンネル見てくれる方ってアナリティクス見るとだいたいそのボリューム
1068,1075,ゾーンが25歳から34歳 ゾーンなのねこんなこと言っていいのかな
1075,1084,であのもちろんその年齢だけじゃないんだけど一番多いのがその年齢なので あの例えばゲーム配信が多かったりとか fps とかを良くされる方はもうちょっと
1084,1092,多分若そうな若いんだよね だからあの結構その雑談系が多いとか
1092,1101,あの夜遅くに多く配信するとかだと割かしねあのあれなんすよね 年齢層が高くなりがちなんだよね
1101,1104,おっとそれ以上は
1104,1114,そうっていうのがねまぁでもまぁまぁちょっと調べたら出てくることだから別に配信で言っても問題ないかなと思うんだけど
1114,1123,そうそうなんですよだからねあの中学生ってマジでほんとレアなんだと思うだからびっくりした 本当に中学生なのかって疑う
1123,1133,そう疑っちゃうんだよねでも本当の中学生だと思う だから白服の甘えがえるさんに私があの
1133,1139,ちょっともうね高校受験が終わってるっていうことなので特に何の配慮もせずに喋っちゃうん ですけど
1139,1146,あの私 あの高校も大学も第一志望を落ちたんですけど元気に健やかに
1146,1155,生きてるんでこうして楽しくねあの落ちたとしても気にしなくても大丈夫です 人生何とかなります日本だし
1155,1168,韓国とかって結構その人生における受験の比率がむちゃくちゃ高いらしくて あの割とすごいなんかそれ落ちただけで結構その後の人生決まっちゃうみたいなとこあるみたい
1168,1175,なんですけど 私はねあの普通にあの高校も大学もなんなら中学受験もしたけど全部第一志望を
1175,1182,落ちてるけど あの全体体なんとなくうまくきました
1182,1190,だいたいなんとなくうまくやってきたんで受験に落ちたらチキン屋あそうなんだ
1190,1199,そう中韓国は本当に受験が1回しかないんだっけ 確か
1199,1208,であのそれに命をかけるらしいそう あのそう今日の学びにはねあの日本は受験落ちてもなんとかなる
1208,1214,だいたい
1214,1217,これ今日の学びに
1221,1228,ですね もう一発勝負かなんかだった気がするんだよね
1228,1235,ナナシンクも大事だけどナナシンクしか受けてないよ VTuberの事務所さんは
1235,1241,浪人あるんだ受験成功してもチキン屋 えっそうなの まあでもチキン
1241,1245,韓国のチキンマジでうまいもんな なんだっけ
1245,1256,あの韓国のアイドルが好きなんですけど女性アイドルのなんかそのライブインスタライブ みたいなの見てるのなんかインスタライブじゃなくてその専門のなんか
1256,1266,あの配信アプリみたいなのがあってそこで結構 素の姿を見せてくれたりするんだけどあのそこでだいたいチキン食べてる
1266,1275,むちゃうまそうであの韓国のチキン出してくれるお店にも行ったことあるけど本当に うまい
1275,1279,チキンめっちゃ好き
1279,1288,だからチキンチキン屋も本当にありがとうという感じ まあでもあのケンタッキーも好きだけどね
1288,1293,ケンタッキーも好き てかあの肉
1293,1303,この間ケンタッキーがその毎月28日にそのパックがね 鳥の火かなんかで安いって聞いて買いに行ったんだけど
1303,1306,本当にうまい
1306,1309,鳥の火パック2パック食べた
1309,1315,あ確かに世界のヤマチョウもうまいね あの手羽先?手羽先だっけ
1315,1319,かなんかの めっちゃうめえ
1319,1322,チキン最高
1322,1328,いやだからやっぱ チキンはいくら食べても大丈夫っていうね
1328,1335,チキンはいくらでも食べられるっていうのも今日の学びです 鶏肉って安いのにむちゃうまいよな
1335,1338,なんで? おかしくない?
1338,1344,鶏肉ってさ比較的お安いじゃないですか 他の牛とかに比べたら
1344,1351,でもあんなに高タンパクでさ めちゃうまいのバグだよな
1351,1354,鶏のうまさってバグ
1354,1360,鶏のうまさと安さバグ
1360,1363,これ学びです今日の
1363,1366,マジで好き
1366,1370,確かに鶏胸ね
1370,1377,あの胸肉は高タンパクで低脂質だから トレーニングをみんな食べてるよね
1377,1382,あれ何の話だっけ なんでチキンの話だっけ 受験の話だったかな
1382,1388,なんであの全然安心してよかったよかったよ日本で
1388,1392,日本に生まれてよかったなということを感じつつ
1392,1397,受験の結果を待っていただけたらなと思います
1397,1401,あのもしね落ちた時って本当世界の終わりだなと思うんだけど
1401,1406,あの普通に学校入ったら楽しいです
1406,1409,楽しいです
1409,1412,落ちたと決まったもちろん落ちたと決まったわけじゃないですよねもちろんあの
1412,1416,合格されていることをもちろん心から願ってるんですけど
1416,1418,あのー
1418,1420,私はあのー
1420,1424,白向の天帰りさんがね受かってらっしゃるともちろん信じてはいるんですけど
1424,1428,万が一っていう場合がありますから
1428,1430,どんなことでも
1430,1436,あらゆる分野にも万が一まさかの事態というものが存在しますからね
1436,1440,それぐらいの大らかな気持ちでこの
1440,1444,ねあの結果発表までお過ごしいただけたらなと思います
1444,1447,はい
1447,1449,まあ
1449,1454,友人がですね中国に留学してた時期があったんですけど
1454,1456,あの
1456,1460,中国もかなりその受験戦争的なものがすごいって聞くんですけど
1460,1462,えっとどこだったかな
1462,1464,えっと聖火大学
1464,1466,聖火大学でやってるかな結構ねあの
1466,1468,中国の中ではかなり
1468,1471,名門の大学みたいな話を
1471,1473,聞いたんですけどやっぱなんか
1473,1475,そこもなんか
1475,1477,あの学生さんの
1477,1479,なんだろうな
1479,1481,勉強にかける
1481,1483,勉強にかける
1483,1487,なんだろうな勉強にかける
1487,1490,よく聞くそうそうそうそうそう
1490,1493,がなんかその大学
1493,1495,日本の大学と
1495,1497,あの全然違うって言ってましたね
1497,1499,うん
1499,1501,あの
1501,1502,なんかその
1502,1509,勉強しないと死ぬんだこの人たちって
1509,1514,うん私は言ってないですよもちろん私日本出たことないからね
1514,1517,なんであのマジでやっぱ
1517,1520,すごいらしいですよなんかその勉強していい
1520,1522,いい大学に行き
1522,1530,その大学でむちゃくちゃいい成績を収めていい会社に行かないと死ぬぐらいの気持ちでみんなあの机にかじりついてて
1530,1535,あのすごいやっぱ日本とは全然違ったって友人は言ってました
1535,1539,うんまあ1年ぐらい行ってたんですけど
1539,1543,だからなんか本当にすごいびっくりしましたね
1543,1548,私は全然行ってないですよ留学したことない怖いもんね
1548,1550,あと飛行機苦手だし
1550,1556,私1回あの飛行機乗り過ごしてからマジで飛行機トラウマなんだよな
1556,1564,だから本当に怖い絶対に日本から一人で出られない
1564,1567,そりゃトラになるよ
1567,1572,そうよそりゃ我が友かつって
1572,1575,みんなもトラにならないように気をつけないとね
1575,1582,はいということで白木の天蛙さんが浮かっておりますように心からお祈りしております
1582,1584,次のお便り
1584,1588,妖怪キャベツ洗いさんからのお便りですねお便りありがとうございます
1588,1591,今週の週刈りメールテーマ酒入門とのことですが
1591,1597,あいにく私は普段酒を全く飲まないので代わりにコーヒーとタバコの話でもさせていただこうかと思います
1597,1600,ルカコさんは世界で一番タバコに合うコーヒーをご存知でしょうか
1600,1606,はい世界で一番タバコに合うコーヒーで丸ごとで商品名
1606,1609,すごい世界で一番タバコに合うコーヒー
1609,1613,これは新宿のキノコニア書店ビルの1階内のタバコ屋
1613,1615,喫煙具屋アンティークショップ
1615,1618,そういう店なかがやというオリジナルブランド
1618,1621,かがやのオリジナルブランドです
1621,1624,私も最初はいやいや酔いてタバコに合うとか合わないとかそんなないでしょ
1624,1627,などと思いつつ話の種に一度買ってみるとこれがびっくり
1627,1630,本当にタバコによく合うのです
1630,1635,タバコにもコーヒーにもそれぞれいがらっぽい刺激成分があるかと思うのですが
1635,1640,このコーヒーはそのいがらっぽい風味がタバコのそれとぶつかるゾーンをきれいに開けて
1640,1643,あるかのようにスルリと喧嘩せずに調和するのです
1643,1646,どうしてこんなことが可能なのかと不思議に思った私は
1646,1649,これを作っている万千工房について調べてみると
1649,1652,なんと当時住んでいた場所の近所に店を出しているではないかですか
1652,1656,ないですか店を訪れたこのコーヒーについて店主に尋ねてみると
1656,1662,ブレンドだけでなく入り方に味噌があるらしく通常より低温で非常に長時間かけてローストすることで
1662,1665,そのような風味を作り出したとのことでした
1665,1669,専門のコーヒー焙煎家の手にかかるとそのようなマジックが可能なことに
1669,1671,私は非常に驚いたものです
1671,1675,食べ方を合わせてみずともこのコーヒーはなかなか独特な味わいが楽しめますので
