start_s,end_s,text
1675,1680,新宿にお越しの際は本屋の通電にでもかがやに立ち寄ってみられてはいかがでしょうか
1680,1682,ということでね
1682,1685,これ面白そう
1685,1687,えー今度
1687,1690,新宿ねキノコニアっていうでけえ本屋があれですよね
1690,1694,新宿駅から新宿三丁目に行く途中にある気がするんですけど
1694,1698,なんか前にね誰だっけなどの配信だったか忘れたんですけど
1698,1702,あの理想のデートプランみたいなオフコラボかな
1702,1706,オフコラボかなんかで理想のデートプランの話になって
1706,1710,私だったら新宿のキノコニア前で待ち合わせて
1710,1712,で
1712,1715,一緒に本屋入ってお互いに会いそうな
1715,1717,あまず
1717,1720,あの新宿のさ
1720,1723,あのあれなんだっけな
1723,1726,あれ前なんかつたやかな
1726,1729,ちょっと忘れたんですけど
1729,1733,あの高野のフルーツパーラ杉里あたり
1733,1737,ザラのほんと新宿全然行かない方に意味わかんないんだけど
1737,1741,新宿三丁目寄りにスターバックス2階建てかなんか2階にあるスターバックスがあって
1741,1744,そこで集合してちょっと喋って
1744,1747,でキノコニアに移動して
1747,1750,でそのちょっと喋った印象をもとに
1750,1753,お互いにその相手に
1753,1757,読んでみてほしい本を一冊選んで交換して解散するっていう
1757,1760,そう
1760,1763,っていう話をしたことがあって
1763,1766,でなんかあの
1766,1770,その話を受けて実際にキノコニアに行ってみましたっていう
1770,1773,この間ファンレターに書いてくださってた方もいて
1773,1776,裏にヨドバシあるね
1776,1779,うんあんまりさ
1779,1782,ミヤチとやってほしい
1782,1785,ミヤチとやったらさミヤチが私に
1785,1788,どんな本選んでくれるのかすごい楽しみ
1788,1791,うん
1791,1794,ですね
1794,1797,キノコニアの後新宿中村屋
1797,1800,最初やっぱ一番最初から
1800,1803,ご飯食べるのどうですか初対面の人と
1803,1806,これ初対面の人とのデートっていう前提だったんだけど
1806,1809,一番最初から初対面の人と飯
1809,1812,まあ普通に食う食べるかなっていう感じはするけど
1812,1815,解散したいかな
1815,1818,お茶コーヒー飲んで何かしら
1818,1821,一盛り上がりあってすぐに解散したい
1821,1824,うん
1824,1827,っていう気がするミヤチすぐ個室入りたがるからね
1827,1830,うん
1830,1833,あとやっぱフルーツパーラーがあるからさ
1833,1836,高野のフルーツパーラーが
1836,1839,高野の下のビーチに新宿にある高野のビルの
1839,1842,ビーチにパフェ専門店があるんですけど
1842,1845,あそこなんか上のそのフルーツパーラーよりちょっと安いからさ
1845,1848,あと千尾家より高野の方がちょっと安いじゃん
1848,1851,そう
1851,1854,だからやっぱパフェ食べよう
1854,1857,パフェ食べよう
1857,1860,パフェ食べてテンション上げてコーヒー飲んでちょっと喋って
1860,1863,キノコニア行って本選んで
1863,1866,交換して帰る
1866,1869,ということにしよう
1869,1872,ついでに1階の香谷さんで
1872,1875,タバコに合うコーヒーの豆を買おう
1875,1878,うちのお母さんがすごいヘビースモーカーだって話を
1878,1881,何回か今までしてるんですけど
1881,1884,うちのお母さんは絶対に
1884,1887,ミント系のタブレットとか
1887,1890,飴とかを舐めながらタバコ吸いますね
1890,1893,なんかそれメンソールじゃ
1893,1896,ダメなの?みたいな話をしたことあるけどなんか違うらしい
1896,1899,やっぱり
1899,1902,メンソールじゃないんだって
1902,1905,ミントのタブレットを食べながらタバコ吸うのがいいんだって
1905,1908,よくわかんないよね
1908,1911,確かにフレンチローストとか
1911,1914,かなり深いりの
1914,1917,豆とかになると
1917,1920,だいたいチーズとか
1920,1923,タバコとかになってくるみたいなんで
1923,1926,めちゃめちゃオシャレだよね
1926,1929,今度の朝枠で吸ってみようかな
1929,1932,タバコを久しぶりに
1932,1935,いや、どうだろ、数ヶ月
1935,1938,私基本的に喫煙しないんですけど
1938,1941,あのー
1941,1944,ホームシックで
1944,1947,うちのお母さんと同じ銘柄のタバコ吸ってた時期が
1947,1950,ほんの数週間
1950,1953,1ヶ月くらいあるんですけど
1953,1956,あとはお酒と同じくらいですね
1956,1959,お酒と同じくらい
1959,1962,例えば打ち合わせとかに行って
1962,1965,その合間に
1965,1968,吸いますかって言われて
1968,1971,で、なんかなんだろ
1971,1974,もうさ、私はあんまりその文化知らないんだけど
1974,1977,あのー
1977,1980,昔はさ、喫煙所コミュニティみたいなのがあったらしいじゃないですか
1980,1983,要するにタバコ吸う人だけで
1983,1986,喫煙所の中で話が展開するみたいな
1986,1989,そういうのもあったりすんのかなと思って
1989,1992,興味本位でたまに付き合ったりする
1992,1995,っていう感じです
1995,1998,黒猫七瀬さんは吸わないよ
1998,2001,私別の仕事もしてるから、その関係でって感じ
2001,2004,ですね
2004,2007,七瀬さんも吸わないですよ
2007,2010,七瀬さん吸わなそうだもんなー
2010,2013,喫煙所行かないと出巣できないとかあった
2013,2016,そうなんだ
2016,2019,それはさ、でもさ、全然あれだね
2019,2022,今回のお酒の話にも通じるものありますけど
2022,2025,喫煙所と社長と仲良くなった
2025,2028,やっぱそういうのあるんだ
2028,2031,今はそういうのはないですけどね
2031,2034,みたいな話を普通にタバコ吸ってる人からは
2034,2037,聞くけどね、最近はまじで
2037,2040,肩身狭いばっかりですよみたいな
2040,2043,上司もみんなあれになってるし
2043,2046,電子タバコとかになってるから
2046,2049,飲み会行かないとコミュニケーション取れないとか
2049,2052,タバコ吸わないと話に絡めないとかって
2052,2055,今はないと思ってたけど
2055,2058,あるとこにもあるのかな
2058,2061,最近でもうちの母が曰く
2061,2064,めちゃめちゃやっぱ
2064,2067,喫煙所の肩身が
2067,2070,加速度的に狭くなってて
2070,2073,本当にしんどいよみたいなこと言ってましたね
2076,2079,喫煙所とゴルフ場は仕事の話ばっか
2079,2082,確かに
2082,2085,うちの先輩で絶対に社長としか付き合わない
2085,2088,美女がいたんだけど
2088,2091,やっぱゴルフしてたもん
2094,2097,絶対に社長としか付き合わないし
2097,2100,私は絶対に社長の中の一人と結婚する
2100,2103,と言ってて
2103,2106,途中でやっぱゴルフ始めてた
2106,2109,やっぱゴルフしかない
2109,2112,そうプロハンターね
2112,2115,プロハンターがいたんだよって
2115,2118,プロハンターの人とか
2121,2124,プロハンターの女が
2124,2127,私の周りはそこそこいたんだけど
2127,2130,その中でいろいろ聞いたのは
2130,2133,ゴルフ始めた子は
2133,2136,大学生なんだけど
2136,2139,あれだって言ってた
2139,2142,やっぱゴルフ始めたら
2142,2145,5とか10とか上の
2145,2148,成功してる方と
2148,2151,知り合いはするんだけど
2151,2154,結婚してると
2154,2157,だいたい
2157,2160,いい大学出てる方が多い
2160,2163,割合的に
2163,2166,大学内で
2166,2169,完全にガチガチに絡め取られた
2169,2172,当時付き合ってた女性が
2172,2175,絶対手放さないから
2175,2178,そこでガチガチに絡め取られて
2178,2181,結構結婚者率がすごい高い
2181,2184,なんですよね
2184,2187,だから
2187,2190,そのプロハンターが言ってたのは
2190,2193,さっきの受験の話もあるんだけど
2193,2196,将来的に
2196,2199,そういう方を狙うのであれば
2199,2202,別に全然
2202,2205,それどうでもいいという方は
2205,2208,聞き流していただきたいんだけど
2208,2211,将来的に
2211,2214,そういう女性と結婚したい方
2214,2217,肥母志望の方は
2217,2220,いい大学入って
2220,2223,そこでガチガチに
2223,2226,こいつは今
2226,2229,さえない見た目をしてるけど
2229,2232,将来的にそこそこ整えれば
2232,2235,いい感じになる気がする
2235,2238,性格も合う気がするみたいな人を
2238,2241,捕まえておくのが
2241,2247,いいらしいです
2247,2250,ただ
2250,2253,別のプロハンターなんだけど
2253,2256,別のプロハンター曰く
2256,2259,大学時代にあんまりモテなくて
2259,2262,社会に出て成功して
2262,2265,いきなり周りに可愛い女が増え始めると
2265,2268,絶対に浮気をするから
2268,2271,ある程度学生時代に多少遊ばせておいた方が
2271,2274,いいって言ってた
2274,2277,自分の手のひらの上で遊ばせておいて
2277,2281,結婚したら学生時代は楽しくやってたみたいだけど
2281,2286,結婚したらそう話は違うからね
2286,2289,ということを言ってましたプロハンターは
2289,2292,はははははは
2292,2295,やっぱハンター資金くぐり抜けてるやつって
2295,2298,言うことがちげーなって思った
2298,2301,ルカボさんの副業はハンター協会職員なのか
2301,2303,はははは
2303,2306,狙う大学なんだけど
2306,2309,やっぱね
2309,2316,私の高校の時一番仲良かった友達が
2316,2319,兄弟の医学部に行って
2319,2323,本当に医学部の男はやめた方がいいって
2323,2326,言ってたんで
2326,2329,医学部はやめた方がいいらしいです
2329,2332,あとやっぱ医者はやめた方がいいって
2332,2335,このラジオを聞いてくれてるお医者さんが
2335,2337,言ってたんで
2337,2340,頭のいい医学部の男はやめた方がいい
2340,2343,って言ってた
2343,2346,でやめた方がいいらしいです
2346,2349,なんなら看護師さんとかお医者様とか
2349,2352,ラジオでお便りいただいたことあるんですけど
2352,2355,やめた方がいいですって書いてました
2355,2358,はははは
2358,2361,前もその話になったよな
2361,2366,結局だからどこが一番いいのかって話なんだよね
2366,2369,うーん
2369,2376,一番将来的に安定した伴侶を大学で
2376,2379,見つけたい人向きに一番おすすめの
2379,2383,この角度でなかなかおすすめの大学を
2383,2386,ランキング化してるところないと思うから
2386,2391,就職がいいよみたいな話ではよくあるかもしれないけど
2391,2393,うーん
2393,2394,ね
2394,2396,と思うんだよな
2396,2398,うーん
2398,2399,えー
2399,2401,慶應か青山
2401,2404,慶應か青山って絶対ダメじゃないの
2404,2408,遊んどくから大学時代に遊んどくからいいってこと
2408,2412,いやいやいやいやいやいやいや
2412,2415,婚活について
2415,2417,はははは
2417,2419,あ、登校台ね
2419,2421,あ、登校台かも
2421,2422,うーん
2422,2425,上智か登校台にしましょう
2425,2428,えー上智か登校台か
2428,2429,あれは?
2429,2431,あのー
2431,2432,具体名出すのは危ない
2432,2434,まあ大学名だったらいいでしょ
2434,2435,うーん
2435,2439,大学名ぐらいだったら大丈夫大丈夫
2439,2444,大丈夫、大丈夫じゃなかったらアーカイブがなくなってるだけだからみんな察してください
2444,2445,うん
2445,2449,あ、確かに慶應の内部のご出身の方ね
2449,2451,確かに
2451,2453,あのー
2453,2455,なんかインターンの時に
2455,2457,あのー
2457,2460,インターンやった時になんかそのあれなんだよね
2460,2465,取引先のすごい偉い方とお話しさせてもらった時に
2465,2468,なんかその学校の話になって
2468,2472,出身のなんか学校の話になった時に
2472,2474,すごい品のいい方だったんだけど
2474,2476,あの慶應の幼稚者から
2476,2478,ずっとあの
2478,2481,しかも自分で慶應の幼稚者って言わない
2481,2482,言わなくて
2482,2484,で、あ、いや僕はでも
2484,2487,あの本当にずっとエスカレーターで楽してしまったので
2487,2489,あまりそうですね
2489,2493,学校の思い出、勉強の思い出というのは特にないんですけどみたいなこと言って
2493,2495,でなんか部下の人が
2495,2497,そんなですよ、あのー
2497,2500,こちら本当に幼稚者から敬語でみたいな話してて
2500,2502,うわ世界がちげー
2502,2504,と思った
2504,2507,なんかあの人間の階層が違った
2507,2509,自分が本当になんか
2509,2511,あの、歪症だ
2511,2513,私は歪症なゴミです
2513,2515,って合図しそうになっちゃったね
2515,2517,うん
2517,2519,怖いよ
2519,2521,ということでね
2521,2523,えーそのあたりはちょっとやっぱ怖いので
2523,2525,はい
2525,2528,あと幼稚者ってさ幼稚園のことじゃないって知ってた?
2528,2531,俺幼稚園のことだと思っててさ
2531,2533,ふっふっふっふ
2533,2536,だって幼稚者の幼って幼稚園の幼じゃん
2536,2538,え?
2538,2540,幼稚者って
2540,2542,小学校なんだって
2542,2544,あっはっはっはっはっはっは
2544,2546,え、そうだよね
2546,2548,え、幼稚者って思う
2548,2550,幼稚者で幼稚園かと思いきや小学校
2550,2552,なんだよね
2552,2554,違ったっけ?
2554,2556,まあそうだけどそうじゃない
2556,2558,知らなかったんだよ
2558,2560,びっくりしちゃってさ
2560,2562,教一の学び
2562,2564,ふっはっはっはっはっは
2564,2566,えーということで
2566,2568,教一の学びでした
2568,2570,ふっはっはっはっはっは
2570,2572,えー
2572,2574,やっぱレベルが違う人間っていうのは
2574,2576,やっぱりたくさんいるんだね
2576,2578,うん
2578,2580,筑波とか横国とかもいい気がする
2580,2582,うん
2582,2584,やっぱり投稿大にしよう
2584,2586,投稿大ってなんか
2586,2588,なんであんなに知名度がないんだろうね
2588,2590,あんなにいい大学なんだけど
2590,2592,うん
2592,2594,はい、えーということで
2594,2596,投稿大にしたいと思います
2596,2598,ふっふっふっふ
2598,2600,あっはっはっはっはっは
2600,2602,はぁ
2602,2604,じゃあ今日の学び4つ目ね
2606,2608,えー
2608,2610,投稿大は
2610,2612,好感度爆高い
2618,2620,もうすぐ東京科学大学
2620,2622,あ、名前変えるんだっけ
2622,2624,そうだったね、うん
2624,2626,なんでだもともと知名度が低いのにさ
2626,2628,なんでまた
2628,2630,変えちゃうんだろうね
2630,2632,なんでなんだろうな
2632,2634,ふぅー
2634,2636,ね、そもそもだってなんか
2636,2638,あんまりさ
2638,2640,あのーなに、レベルの高さとさ
2640,2642,知名度が噛み合ってないよな投稿大って
2642,2644,ちょっと水飲みます
2652,2654,あ、大岡山大学
2654,2656,大岡山がキャンパスだからか
2656,2658,もうさ、東京大学
2658,2660,東京じゃなかった人なんもわからん話
2660,2662,だからやめるね
2662,2664,東京いかしか大学ってさ、あれにあるやつ
2664,2666,お茶の水にあるやつだっけ
2666,2668,もうこの話やめるね
2670,2672,今日あのーお酒の話
2672,2674,すごいいっぱい話したいから
2674,2676,この辺でやめます
2676,2678,えーということでね
2678,2680,あれ、やべ
2680,2682,ちょっと待ってくださいね
2682,2684,普通おたが2通しか読めてないんですけど
2684,2688,コーナーに行きたいと思います
2692,2694,今回のですね、メインのテーマは
2694,2696,酒!
2696,2698,ニューマンということで
2698,2700,普段ですね、この塩帰りのメールテーマに
2700,2702,流している曲がですね
2702,2704,データが消滅していたので
2704,2706,一旦ちょっと
2706,2708,こちらのうさんくさい曲を流していきたいと思いますね
2710,2712,今日は後半ずっとうさんくさい曲でもいいですか?
2712,2714,途中でちょっと
2714,2716,うさんくさすぎるな
2716,2718,うさんくさ配信だなと思ったら変えます
2722,2724,今日はもうずっと
2724,2726,酒の話をしていくんですけど
2726,2728,なんでお酒の話を募集したかっていうと
2730,2732,こちらですね
2734,2736,私がこないだ
2736,2738,たまたま日本酒を飲ませていただく機会に
2738,2742,恵まれた時に
2742,2744,今までちょっと苦手意識があったんですけど
2744,2746,焼酎とか日本酒に関して
2748,2750,お酒すごい強い
2750,2752,アルコールガンみたいな感じのイメージがあって
2752,2754,あんまり飲んだことなかったんですけど
2756,2758,美味しい日本酒を飲ませてもらったら
2758,2760,めっちゃ美味かったから
2760,2762,え?これはめちゃくちゃ美味い!
2762,2764,と思って皆さんに
2764,2766,おすすめを募集しました
2766,2768,酒の
2768,2770,うん
2770,2772,脱細とか
2772,2774,漢字が難しくて覚えてません
2778,2780,なんかもやしもん読んだ時に
2780,2782,本当に大銀条
2782,2784,むちゃくちゃいい日本酒っていうのは
2784,2786,メロンみたいな匂いがするって書いてあったの
2786,2788,確か
2790,2792,で嗅いでみたら
2792,2794,果実みたいな
2794,2796,果実みたいな匂いがして
2796,2798,すごいさっぱりしてて
2798,2800,でなんかむちゃくちゃ美味かったんだよね
2802,2804,でなんかあの
2804,2806,なんだろうな
2806,2808,大銀条みたいな日本酒フルーティ
2808,2810,常磐の水のことし
2810,2812,別の配信でもおすすめいただいてましたね
2814,2816,そうでなんかね
2816,2818,めちゃめちゃ香りもいいし
2818,2820,ただいわゆるジュースみたいな感じではなくて
2820,2822,なんかその
2822,2824,なんだろうな
2824,2826,品が
2826,2828,フルーティな果実香が
2828,2830,あって
2830,2832,でなんか
2832,2834,喉越しは
2834,2836,水
2836,2838,うまっ
2838,2840,と思ってびっくりしました
2840,2842,なのでちょっとね
2842,2844,日本酒に限らず色んなお酒の
2844,2846,おすすめを教えていただいたので
2846,2848,とかあとお酒にまつわるエピソードを教えていただいたので
2848,2850,ご紹介していきたいと思います
2852,2854,1つ目
2854,2856,金木生さんからの
2856,2858,酒入門お便りありがとうございます
2860,2862,ルカコさんリスナーの皆さんこんばんは
2862,2864,唐突ですが私はビールが大の苦手です
2864,2866,コロナ禍以前の職場の飲み会や
2866,2868,忘年会などのスタートドリンクが
2868,2870,必ずビールなので毎回悶絶していました
2870,2872,リスナー諸誌の中にも
2872,2874,ビールのあの独特な苦味が苦手
2874,2876,という人もいらっしゃるのではないでしょうか
2876,2878,そこで今回は
2878,2880,酒入門がテーマということで
2880,2882,実は意外と苦手な人も多いであろう
2882,2884,ビールを飲みやすくする魔法のアレンジを紹介したいと思います
2884,2886,それはズバリ
2886,2888,CJフーズという会社から
2888,2890,発売されている
2890,2892,ミチョと呼ばれる果実酢と
2892,2894,ビールを1対4の割合で混ぜるだけ
2894,2896,これによりビール全体の味が
2896,2898,果実酢特有の
2898,2900,爽やかな甘酸っぱい風味に書き換えられ
2900,2902,ビール特有の苦味は
2902,2904,ちょっとほろ苦いフレーバー程度にまで軽減され
2904,2906,単純ハイとジュースの中間くらいの
2906,2908,飲みやすさに変身します
2908,2910,CJフーズさんの回し者かと思われるかもしれませんが
2910,2912,本当にマジ飲みやすいです
2912,2914,ちなみに私はコロナ禍に入る前の最後の忘年会の
2914,2916,席にてあらかじめミチョ
2916,2918,美しい酢と書いてあるミチョですね
2918,2920,を小さい容器に入れて持ち込んだのですが
2920,2922,上司や同僚に見つかって
2922,2924,ドン引きされました
2924,2926,俺は一体どうすればいいんだ
2926,2928,ちょうどミチョ飲んでた
2928,2930,美しいミチョパーじゃないよ
2930,2932,あのー
2932,2934,これを入れる
2934,2936,これでね
2936,2938,ミチョ
2940,2942,らしいです
2942,2944,韓国のお酢なんだ
2944,2946,確かにねこの話
2946,2948,見て
2948,2950,あのー
2950,2952,ちょっと持ち込みは引かれるだろうなと思ったんだけど
2952,2954,ごめんなさい金木犀さん
2954,2956,はははははは
2956,2958,ごめんなさい
2958,2960,なんだけど
2960,2962,アレンジとして
2962,2964,すごいいいなっていう
2964,2966,やっぱこういう時って
2966,2968,なんかあの
2968,2970,結構さビール
2970,2972,私は普段そんなことないんですけど
2972,2974,大人数で
2974,2976,お酒飲みに行くことがまるでないから
2976,2978,かもしれないんだけど
2978,2980,話に聞くと
2980,2982,1杯目ビール以外
2982,2984,でも別に
2984,2986,いい人が多そうな感じはするけど
2986,2988,とはいえみたいな
2988,2990,ビールでいい?
2990,2992,違う人なんかあったら教えてみたいなこと言われても
2992,2994,なかなか言いにくいっていう方もいるだろうしね
2994,2996,うん
2996,2998,でねなんか場として
2998,3000,絶対ビールってわけではないけど
3000,3002,そこでなんか
3002,3004,あじゃあちょっとハイボールで
3004,3006,言いにくいみたいなのがもしかしたらあるのかもしれない
3006,3008,うん
3008,3010,それはすごい想像し
3010,3012,想像に固くないんでね
3012,3014,だけどまあ
3014,3016,とはいえやっぱ
3016,3018,持ち込まないと飲めない
3018,3020,持ち込めないと飲めないものを無理やり飲むのも辛いしね
3020,3022,ああ
3022,3024,まあだから
3024,3026,ハイボールが飲めればハイボールでって
3026,3028,言っちゃえばいいのかな
3028,3030,っていう気がするけど
3030,3032,空気山積み飲め酒頼むタイプ
3032,3034,別にいいんじゃないですか
3034,3036,うん
3036,3038,あはははは
3038,3040,あ確かにでもビールってさ
3040,3042,私思うんだよね
3042,3044,あのビールって
3044,3046,めっちゃお腹にたまらない
3046,3048,私食べ放題でビール飲めないんですよね
3050,3052,なんか損した気持ちになる
3052,3054,腹の中で膨れるじゃんビールって
3054,3056,私なんかあの前
3056,3058,あの
3058,3060,なんか
3060,3062,なんつったっけなあれ
3062,3064,あのひよこ豆のペーストにつけて食べる
3064,3066,あのピタパン
3066,3068,ピタパンみたいなやつが
3068,3070,おかわりし放題の店で
3070,3072,で
3072,3074,あのそれをなんか
3074,3076,めちゃくちゃおかわりしたんですよ
3076,3078,すごい美味しくて
3078,3080,うん
3080,3082,フムスにつけて食べたんだけど
3082,3084,それが死ぬほど美味しくて
3084,3086,めちゃくちゃ食べて
3086,3088,で水飲んだらさ
3088,3090,お腹の中でパンがさ
3090,3092,岩のように固くなって
3092,3094,帰り泣きながら電車乗ったんだよね
3094,3096,お腹いっぱいすぎて
3096,3098,あのあれみたいな気持ちだった
3098,3100,腹にさ
3100,3102,閉められた狼みたいな気持ちでさ
3102,3104,泣きながら帰った
3104,3106,お腹が重いよーって
3106,3108,お腹重いよーって
3108,3110,でも私思うんだけど
3110,3112,ショテでビール入れてなかったらもう2個くらい食べれた気がする
3112,3114,うん
3114,3116,もう2個くらい食べれたな
3116,3118,って思う
3118,3120,焼肉とかいっても
3120,3122,焼肉の食べ放題いっても
3122,3124,あとあの七瀬さんが出してくれるタイプの焼肉いっても
3124,3126,あれショテビールじゃなかったら
3126,3128,もう2人前いけたな
3128,3130,みたいなことを帰りに思うんだよね
3130,3132,だから
3132,3134,やっぱビールってやっぱショテはよくない気がする
3134,3136,食べ放題じゃなければ全然いいんだけど
3136,3138,うん
3138,3140,っていう感じがします
3140,3142,えーということで
3142,3144,ビールが苦手でねなかなかショテ
3144,3146,あのー
3146,3148,ちょっとあのハイボールでとか
3148,3150,別のでウーロン茶でとか言えない方は
3150,3152,えーぜひともね
